commit	score	memory_gb	status	problem	description
auto	4.003963114377159	0.0	discard	28_DOMINO_in_8	Parallel run loop
auto	3.820307154948568	0.0	discard	27_DOMINO_in_8	Parallel run loop
auto	7.160232969366078	0.0	discard	16_8_in_DOMINO	Parallel run loop
auto	3.2287940102004677	0.0	discard	19_DOMINO_in_8	Parallel run loop
auto	3.8369336484278946	0.0	discard	13_6_in_CIRCLE	Parallel run loop
auto	3.5764417535910717	0.0	discard	25_DOMINO_in_8	Parallel run loop
auto	5.204380234725994	0.0	discard	28_DOMINO_in_6	Parallel run loop
auto	5.315907449674494	0.0	discard	30_DOMINO_in_6	Parallel run loop
auto	4.085091429602335	0.0	discard	31_DOMINO_in_8	Parallel run loop
auto	3.5703799076483236	0.0	discard	24_DOMINO_in_8	Parallel run loop
auto	3.759141572791398	0.0	discard	17_DOMINO_in_CIRCLE	Parallel run loop
auto	3.7487368429551218	0.0	discard	26_DOMINO_in_8	Parallel run loop
auto	2.4007400073217737	0.0	discard	12_5_in_8	Parallel run loop
auto	8.102774853359481	0.0	discard	20_8_in_DOMINO	Parallel run loop
auto	3.7683056475804717	0.0	discard	17_5_in_6	Parallel run loop
auto	2.803879883664299	0.0	discard	9_DOMINO_in_CIRCLE	Parallel run loop
auto	4.041666263872599	0.0	keep	18_DOMINO_in_6	Parallel run loop
auto	4.715705736132049	0.0	discard	23_DOMINO_in_6	Parallel run loop
auto	4.697834635053744	0.0	discard	19_5_in_DOMINO	Parallel run loop
auto	4.479815897501027	0.0	discard	24_5_in_6	Parallel run loop
auto	2.5794828405467167	0.0	discard	13_DOMINO_in_8	Parallel run loop
auto	6.497991980936347	0.0	discard	11_8_in_5	Parallel run loop
auto	4.475245630635559	0.0	discard	15_6_in_6	Parallel run loop
auto	4.039521851836077	0.0	discard	30_DOMINO_in_8	Parallel run loop
auto	2.9559621946049712	0.0	discard	10_DOMINO_in_CIRCLE	Parallel run loop
auto	3.659026073253804	0.0	discard	16_DOMINO_in_CIRCLE	Parallel run loop
auto	3.589733062051877	0.0	keep	19_6_in_8	Parallel run loop
auto	2.72976517994299	0.0	discard	14_DOMINO_in_8	Parallel run loop
auto	5.790189669490146	0.0	discard	13_8_in_6	Parallel run loop
auto	4.8203042879733635	0.0	discard	20_5_in_DOMINO	Parallel run loop
auto	4.75127218611163	0.0	discard	10_8_in_CIRCLE	Parallel run loop
auto	5.102893955208136	0.0	discard	20_8_in_8	Parallel run loop
auto	5.994170884047151	0.0	discard	9_8_in_5	Parallel run loop
auto	3.833926104130867	0.0	discard	29_DOMINO_in_8	Parallel run loop
auto	3.0351924158142594	0.0	discard	18_DOMINO_in_8	Parallel run loop
auto	3.6521991511468035	0.0	discard	25_DOMINO_in_8	Parallel run loop
auto	5.212714325307466	0.0	discard	28_DOMINO_in_6	Parallel run loop
auto	4.904537362780794	0.0	discard	21_5_in_DOMINO	Parallel run loop
auto	5.394092973202802	0.0	discard	30_DOMINO_in_6	Parallel run loop
auto	5.777467632032182	0.0	discard	26_8_in_8	Parallel run loop
auto	3.440622428928729	0.0	discard	22_DOMINO_in_8	Parallel run loop
auto	2.6915521371235593	0.0	discard	8_DOMINO_in_CIRCLE	Parallel run loop
auto	6.2478639807772485	0.0	discard	16_8_in_6	Parallel run loop
auto	4.2697670885556445	0.0	discard	19_DOMINO_in_6	Parallel run loop
auto	4.7142911658776665	0.0	discard	23_DOMINO_in_6	Parallel run loop
auto	4.113177387199778	0.0	discard	18_DOMINO_in_6	Parallel run loop
auto	5.663881359656193	0.0	discard	25_6_in_6	Parallel run loop
auto	4.882630265799585	0.0	discard	19_DOMINO_in_DOMINO	Parallel run loop
auto	4.558228051991228	0.0	discard	16_6_in_6	Parallel run loop
auto	3.827281560659983	0.0	discard	11_DOMINO_in_DOMINO	Parallel run loop
auto	4.569815862524372	0.0	discard	18_5_in_DOMINO	Parallel run loop
auto	6.3086008314667135	0.0	discard	10_8_in_5	Parallel run loop
auto	4.409839693042728	0.0	discard	17_5_in_DOMINO	Parallel run loop
auto	4.309862100185108	0.0	discard	16_5_in_DOMINO	Parallel run loop
auto	2.6447738834161796	0.0	discard	9_6_in_8	Parallel run loop
auto	3.589732325013667	0.0	keep	19_6_in_8	Parallel run loop
auto	7.812784092602333	0.0	discard	32_6_in_5	Parallel run loop
auto	2.5069731037578142	0.0	discard	13_5_in_8	Parallel run loop
auto	6.700106835949054	0.0	discard	23_6_in_5	Parallel run loop
auto	5.8434126687983206	0.0	discard	20_6_in_DOMINO	Parallel run loop
auto	6.0953254095291225	0.0	discard	19_8_in_CIRCLE	Parallel run loop
auto	3.0294424570362044	0.0	discard	16_DOMINO_in_8	Parallel run loop
auto	5.949837118888085	0.0	discard	28_6_in_6	Parallel run loop
auto	5.6215705425904785	0.0	discard	25_5_in_5	Parallel run loop
auto	5.302443940088193	0.0	discard	22_5_in_5	Parallel run loop
auto	5.693379391606711	0.0	discard	19_6_in_DOMINO	Parallel run loop
auto	4.733780902267363	0.0	discard	27_5_in_6	Parallel run loop
auto	5.199178195837957	0.0	discard	28_DOMINO_in_6	Parallel run loop
auto	5.259853638048061	0.0	keep	30_DOMINO_in_6	Parallel run loop
auto	5.299764827769427	0.0	discard	29_DOMINO_in_6	Parallel run loop
auto	2.8900148954966616	0.0	discard	9_5_in_6	Parallel run loop
auto	4.2920288208596995	0.0	discard	19_DOMINO_in_6	Parallel run loop
auto	3.2342712519580337	0.0	discard	12_DOMINO_in_CIRCLE	Parallel run loop
auto	5.012765064798198	0.0	discard	20_DOMINO_in_DOMINO	Parallel run loop
auto	4.795756538056002	0.0	discard	24_DOMINO_in_6	Parallel run loop
auto	8.382506079934158	0.0	discard	22_8_in_DOMINO	Parallel run loop
auto	6.281350871924349	0.0	discard	20_6_in_5	Parallel run loop
auto	7.676416747555321	0.0	discard	31_6_in_5	Parallel run loop
auto	3.9493073634468594	0.0	discard	11_6_in_6	Parallel run loop
auto	3.1860393694450497	0.0	discard	11_DOMINO_in_CIRCLE	Parallel run loop
auto	3.1206342394830537	0.0	discard	17_DOMINO_in_8	Parallel run loop
auto	4.003963114377159	0.0	discard	28_DOMINO_in_8	Parallel run loop
auto	5.384931350321754	0.0	discard	23_5_in_5	Parallel run loop
auto	5.071232976203554	0.0	discard	27_DOMINO_in_6	Parallel run loop
auto	3.3236392676260467	0.0	discard	20_DOMINO_in_8	Parallel run loop
auto	7.160232969366078	0.0	discard	16_8_in_DOMINO	Parallel run loop
auto	3.820307154948568	0.0	discard	27_DOMINO_in_8	Parallel run loop
auto	3.5897316460464657	0.0	keep	19_6_in_8	Parallel run loop
auto	3.2614080911115835	0.0	discard	19_DOMINO_in_8	Parallel run loop
auto	5.005446132707396	0.0	discard	26_DOMINO_in_6	Parallel run loop
auto	3.431077442578044	0.0	discard	23_DOMINO_in_8	Parallel run loop
auto	3.8369336484278946	0.0	discard	13_6_in_CIRCLE	Parallel run loop
auto	4.085091429602335	0.0	discard	31_DOMINO_in_8	Parallel run loop
auto	3.759141572791398	0.0	discard	17_DOMINO_in_CIRCLE	Parallel run loop
auto	3.7487368429551218	0.0	discard	26_DOMINO_in_8	Parallel run loop
auto	3.5703799076483236	0.0	discard	24_DOMINO_in_8	Parallel run loop
auto	5.208545613115357	0.0	discard	28_DOMINO_in_6	Parallel run loop
auto	2.4007400073217737	0.0	discard	12_5_in_8	Parallel run loop
auto	8.102774853359481	0.0	discard	20_8_in_DOMINO	Parallel run loop
auto	2.803879883664299	0.0	discard	9_DOMINO_in_CIRCLE	Parallel run loop
auto	3.7683056475804717	0.0	discard	17_5_in_6	Parallel run loop
auto	4.267205868682185	0.0	discard	19_DOMINO_in_6	Parallel run loop
auto	5.2975341051319464	0.0	discard	30_DOMINO_in_6	Parallel run loop
auto	4.697834635053744	0.0	discard	19_5_in_DOMINO	Parallel run loop
auto	2.5794828405467167	0.0	discard	13_DOMINO_in_8	Parallel run loop
auto	6.497991980936347	0.0	discard	11_8_in_5	Parallel run loop
auto	2.9559621946049712	0.0	discard	10_DOMINO_in_CIRCLE	Parallel run loop
auto	4.479815897501027	0.0	discard	24_5_in_6	Parallel run loop
auto	4.475245630635559	0.0	discard	15_6_in_6	Parallel run loop
auto	2.72976517994299	0.0	discard	14_DOMINO_in_8	Parallel run loop
auto	4.75127218611163	0.0	discard	10_8_in_CIRCLE	Parallel run loop
auto	5.790189669490146	0.0	discard	13_8_in_6	Parallel run loop
auto	5.102893955208136	0.0	discard	20_8_in_8	Parallel run loop
auto	4.8203042879733635	0.0	discard	20_5_in_DOMINO	Parallel run loop
auto	4.490747745863403	0.0	discard	13_DOMINO_in_5	Parallel run loop
auto	5.994170884047151	0.0	discard	9_8_in_5	Parallel run loop
auto	3.833926104130867	0.0	discard	29_DOMINO_in_8	Parallel run loop
auto	5.117594137722417	0.0	discard	27_DOMINO_in_6	Parallel run loop
auto	3.5897310205750217	0.0	keep	19_6_in_8	Parallel run loop
auto	4.904537362780794	0.0	discard	21_5_in_DOMINO	Parallel run loop
auto	3.0351924158142594	0.0	discard	18_DOMINO_in_8	Parallel run loop
auto	5.777467632032182	0.0	discard	26_8_in_8	Parallel run loop
auto	3.440622428928729	0.0	discard	22_DOMINO_in_8	Parallel run loop
auto	2.6915521371235593	0.0	discard	8_DOMINO_in_CIRCLE	Parallel run loop
auto	6.2478639807772485	0.0	discard	16_8_in_6	Parallel run loop
auto	5.222628393619493	0.0	discard	28_DOMINO_in_6	Parallel run loop
auto	5.663881359656193	0.0	discard	25_6_in_6	Parallel run loop
auto	4.919907061991625	0.0	discard	19_DOMINO_in_DOMINO	Parallel run loop
auto	4.558228051991228	0.0	discard	16_6_in_6	Parallel run loop
auto	4.569815862524372	0.0	discard	18_5_in_DOMINO	Parallel run loop
auto	6.3086008314667135	0.0	discard	10_8_in_5	Parallel run loop
auto	3.827281560659983	0.0	discard	11_DOMINO_in_DOMINO	Parallel run loop
auto	4.26763263194538	0.0	discard	19_DOMINO_in_6	Parallel run loop
auto	2.5794828405467167	0.0	discard	13_DOMINO_in_8	Parallel run loop
auto	5.315045721548798	0.0	discard	30_DOMINO_in_6	Parallel run loop
auto	4.409839693042728	0.0	discard	17_5_in_DOMINO	Parallel run loop
auto	4.309862100185108	0.0	discard	16_5_in_DOMINO	Parallel run loop
auto	7.812784092602333	0.0	discard	32_6_in_5	Parallel run loop
auto	2.6447738834161796	0.0	discard	9_6_in_8	Parallel run loop
auto	6.0953254095291225	0.0	discard	19_8_in_CIRCLE	Parallel run loop
auto	3.0294424570362044	0.0	discard	16_DOMINO_in_8	Parallel run loop
auto	2.5069731037578142	0.0	discard	13_5_in_8	Parallel run loop
auto	5.8434126687983206	0.0	discard	20_6_in_DOMINO	Parallel run loop
auto	6.700106835949054	0.0	discard	23_6_in_5	Parallel run loop
auto	5.949837118888085	0.0	discard	28_6_in_6	Parallel run loop
auto	5.693379391606711	0.0	discard	19_6_in_DOMINO	Parallel run loop
auto	4.733780902267363	0.0	discard	27_5_in_6	Parallel run loop
auto	5.302443940088193	0.0	discard	22_5_in_5	Parallel run loop
auto	5.6215705425904785	0.0	discard	25_5_in_5	Parallel run loop
auto	5.28019095319624	0.0	discard	29_DOMINO_in_6	Parallel run loop
auto	2.8900148954966616	0.0	discard	9_5_in_6	Parallel run loop
auto	3.5897304443845335	0.0	keep	19_6_in_8	Parallel run loop
auto	4.724825964162169	0.0	keep	24_DOMINO_in_6	Parallel run loop
auto	5.012765064798198	0.0	discard	20_DOMINO_in_DOMINO	Parallel run loop
auto	3.2342712519580337	0.0	discard	12_DOMINO_in_CIRCLE	Parallel run loop
auto	8.382506079934158	0.0	discard	22_8_in_DOMINO	Parallel run loop
auto	7.676416747555321	0.0	discard	31_6_in_5	Parallel run loop
auto	3.9493073634468594	0.0	discard	11_6_in_6	Parallel run loop
auto	6.281350871924349	0.0	discard	20_6_in_5	Parallel run loop
auto	3.1860393694450497	0.0	discard	11_DOMINO_in_CIRCLE	Parallel run loop
auto	5.003644241371123	0.0	discard	19_DOMINO_in_DOMINO	Parallel run loop
auto	3.1206342394830537	0.0	discard	17_DOMINO_in_8	Parallel run loop
auto	4.289454247285672	0.0	discard	19_DOMINO_in_6	Parallel run loop
auto	2.7072481179543093	0.0	discard	13_DOMINO_in_8	Parallel run loop
auto	4.003963114377159	0.0	discard	28_DOMINO_in_8	Parallel run loop
auto	5.384931350321754	0.0	discard	23_5_in_5	Parallel run loop
auto	3.3572113814404516	0.0	discard	20_DOMINO_in_8	Parallel run loop
auto	5.2864204012902425	0.0	discard	30_DOMINO_in_6	Parallel run loop
auto	3.820307154948568	0.0	discard	27_DOMINO_in_8	Parallel run loop
auto	3.431077442578044	0.0	discard	23_DOMINO_in_8	Parallel run loop
auto	5.036074206193	0.0	discard	26_DOMINO_in_6	Parallel run loop
auto	7.160232969366078	0.0	discard	16_8_in_DOMINO	Parallel run loop
auto	3.117498006277882	0.0	discard	19_DOMINO_in_8	Parallel run loop
auto	3.8369336484278946	0.0	discard	13_6_in_CIRCLE	Parallel run loop
auto	2.4007400073217737	0.0	discard	12_5_in_8	Parallel run loop
auto	3.7487368429551218	0.0	discard	26_DOMINO_in_8	Parallel run loop
auto	3.5703799076483236	0.0	discard	24_DOMINO_in_8	Parallel run loop
auto	3.759141572791398	0.0	discard	17_DOMINO_in_CIRCLE	Parallel run loop
auto	4.806766889081217	0.0	discard	24_DOMINO_in_6	Parallel run loop
auto	4.124298528996569	0.0	discard	18_DOMINO_in_6	Parallel run loop
auto	4.085091429602335	0.0	discard	31_DOMINO_in_8	Parallel run loop
auto	5.196376014769551	0.0	discard	29_DOMINO_in_6	Parallel run loop
auto	3.7683056475804717	0.0	discard	17_5_in_6	Parallel run loop
auto	8.102774853359481	0.0	discard	20_8_in_DOMINO	Parallel run loop
auto	2.803879883664299	0.0	discard	9_DOMINO_in_CIRCLE	Parallel run loop
auto	4.697834635053744	0.0	discard	19_5_in_DOMINO	Parallel run loop
auto	4.697349384082568	0.0	discard	23_DOMINO_in_6	Parallel run loop
auto	3.589729913592251	0.0	keep	19_6_in_8	Parallel run loop
auto	6.497991980936347	0.0	discard	11_8_in_5	Parallel run loop
auto	2.9559621946049712	0.0	discard	10_DOMINO_in_CIRCLE	Parallel run loop
auto	4.479815897501027	0.0	discard	24_5_in_6	Parallel run loop
auto	4.475245630635559	0.0	discard	15_6_in_6	Parallel run loop
auto	2.72976517994299	0.0	discard	14_DOMINO_in_8	Parallel run loop
auto	4.893742735493969	0.0	discard	25_DOMINO_in_6	Parallel run loop
auto	5.102893955208136	0.0	discard	20_8_in_8	Parallel run loop
auto	4.75127218611163	0.0	discard	10_8_in_CIRCLE	Parallel run loop
auto	4.8203042879733635	0.0	discard	20_5_in_DOMINO	Parallel run loop
auto	3.833926104130867	0.0	discard	29_DOMINO_in_8	Parallel run loop
auto	5.790189669490146	0.0	discard	13_8_in_6	Parallel run loop
auto	5.399154672411788	0.0	discard	30_DOMINO_in_6	Parallel run loop
auto	4.282850583980959	0.0	discard	13_DOMINO_in_5	Parallel run loop
auto	5.994170884047151	0.0	discard	9_8_in_5	Parallel run loop
auto	4.904537362780794	0.0	discard	21_5_in_DOMINO	Parallel run loop
auto	3.0351924158142594	0.0	discard	18_DOMINO_in_8	Parallel run loop
auto	5.777467632032182	0.0	discard	26_8_in_8	Parallel run loop
auto	3.440622428928729	0.0	discard	22_DOMINO_in_8	Parallel run loop
auto	2.6915521371235593	0.0	discard	8_DOMINO_in_CIRCLE	Parallel run loop
auto	6.2478639807772485	0.0	discard	16_8_in_6	Parallel run loop
auto	5.663881359656193	0.0	discard	25_6_in_6	Parallel run loop
auto	4.558228051991228	0.0	discard	16_6_in_6	Parallel run loop
auto	5.232880087295193	0.0	discard	29_DOMINO_in_6	Parallel run loop
auto	6.3086008314667135	0.0	discard	10_8_in_5	Parallel run loop
auto	4.569815862524372	0.0	discard	18_5_in_DOMINO	Parallel run loop
auto	3.827281560659983	0.0	discard	11_DOMINO_in_DOMINO	Parallel run loop
auto	4.409839693042728	0.0	discard	17_5_in_DOMINO	Parallel run loop
auto	4.675322544240417	0.0	discard	23_DOMINO_in_6	Parallel run loop
auto	4.309862100185108	0.0	discard	16_5_in_DOMINO	Parallel run loop
auto	7.812784092602333	0.0	discard	32_6_in_5	Parallel run loop
auto	3.589729424621327	0.0	keep	19_6_in_8	Parallel run loop
auto	2.6447738834161796	0.0	discard	9_6_in_8	Parallel run loop
auto	2.5069731037578142	0.0	discard	13_5_in_8	Parallel run loop
auto	5.8434126687983206	0.0	discard	20_6_in_DOMINO	Parallel run loop
auto	3.0294424570362044	0.0	discard	16_DOMINO_in_8	Parallel run loop
auto	6.0953254095291225	0.0	discard	19_8_in_CIRCLE	Parallel run loop
auto	6.700106835949054	0.0	discard	23_6_in_5	Parallel run loop
auto	5.693379391606711	0.0	discard	19_6_in_DOMINO	Parallel run loop
auto	3.5764417535910717	0.0	discard	25_DOMINO_in_8	Parallel run loop
auto	5.6215705425904785	0.0	discard	25_5_in_5	Parallel run loop
auto	5.949837118888085	0.0	discard	28_6_in_6	Parallel run loop
auto	2.8900148954966616	0.0	discard	9_5_in_6	Parallel run loop
auto	5.302443940088193	0.0	discard	22_5_in_5	Parallel run loop
auto	4.733780902267363	0.0	discard	27_5_in_6	Parallel run loop
auto	3.9493073634468594	0.0	discard	11_6_in_6	Parallel run loop
auto	3.2342712519580337	0.0	discard	12_DOMINO_in_CIRCLE	Parallel run loop
auto	5.012765064798198	0.0	discard	20_DOMINO_in_DOMINO	Parallel run loop
auto	3.1860393694450497	0.0	discard	11_DOMINO_in_CIRCLE	Parallel run loop
auto	8.382506079934158	0.0	discard	22_8_in_DOMINO	Parallel run loop
auto	4.003963114377159	0.0	discard	28_DOMINO_in_8	Parallel run loop
auto	7.676416747555321	0.0	discard	31_6_in_5	Parallel run loop
auto	6.281350871924349	0.0	discard	20_6_in_5	Parallel run loop
auto	5.384931350321754	0.0	discard	23_5_in_5	Parallel run loop
auto	3.1206342394830537	0.0	discard	17_DOMINO_in_8	Parallel run loop
auto	5.31515722358847	0.0	discard	29_DOMINO_in_6	Parallel run loop
auto	3.3572113814404516	0.0	discard	20_DOMINO_in_8	Parallel run loop
auto	5.130917862013317	0.0	discard	27_DOMINO_in_6	Parallel run loop
auto	3.820307154948568	0.0	discard	27_DOMINO_in_8	Parallel run loop
auto	3.431077442578044	0.0	discard	23_DOMINO_in_8	Parallel run loop
auto	4.981974563682261	0.0	discard	26_DOMINO_in_6	Parallel run loop
auto	4.62879999309409	0.0	keep	23_DOMINO_in_6	Parallel run loop
auto	7.160232969366078	0.0	discard	16_8_in_DOMINO	Parallel run loop
auto	3.5897289741767135	0.0	keep	19_6_in_8	Parallel run loop
auto	3.117498006277882	0.0	discard	19_DOMINO_in_8	Parallel run loop
auto	3.8369336484278946	0.0	discard	13_6_in_CIRCLE	Parallel run loop
auto	2.4007400073217737	0.0	discard	12_5_in_8	Parallel run loop
auto	4.085091429602335	0.0	discard	31_DOMINO_in_8	Parallel run loop
auto	3.7487368429551218	0.0	discard	26_DOMINO_in_8	Parallel run loop
auto	3.5703799076483236	0.0	discard	24_DOMINO_in_8	Parallel run loop
auto	3.759141572791398	0.0	discard	17_DOMINO_in_CIRCLE	Parallel run loop
auto	4.135449739954795	0.0	discard	18_DOMINO_in_6	Parallel run loop
auto	2.803879883664299	0.0	discard	9_DOMINO_in_CIRCLE	Parallel run loop
auto	3.7683056475804717	0.0	discard	17_5_in_6	Parallel run loop
auto	4.932066116929039	0.0	keep	29_5_in_6	Parallel run loop
auto	8.102774853359481	0.0	discard	20_8_in_DOMINO	Parallel run loop
auto	4.697834635053744	0.0	discard	19_5_in_DOMINO	Parallel run loop
auto	4.479815897501027	0.0	discard	24_5_in_6	Parallel run loop
auto	2.9559621946049712	0.0	discard	10_DOMINO_in_CIRCLE	Parallel run loop
auto	6.497991980936347	0.0	discard	11_8_in_5	Parallel run loop
auto	2.72976517994299	0.0	discard	14_DOMINO_in_8	Parallel run loop
auto	4.475245630635559	0.0	discard	15_6_in_6	Parallel run loop
auto	4.807881311264913	0.0	keep	25_DOMINO_in_6	Parallel run loop
auto	5.790189669490146	0.0	discard	13_8_in_6	Parallel run loop
auto	4.75127218611163	0.0	discard	10_8_in_CIRCLE	Parallel run loop
auto	5.102893955208136	0.0	discard	20_8_in_8	Parallel run loop
auto	4.8203042879733635	0.0	discard	20_5_in_DOMINO	Parallel run loop
auto	4.282850583980959	0.0	discard	13_DOMINO_in_5	Parallel run loop
auto	3.833926104130867	0.0	discard	29_DOMINO_in_8	Parallel run loop
auto	5.994170884047151	0.0	discard	9_8_in_5	Parallel run loop
auto	4.716996273849544	0.0	discard	23_DOMINO_in_6	Parallel run loop
auto	5.042121425212129	0.0	discard	26_DOMINO_in_6	Parallel run loop
auto	3.1474353937180983	0.0	discard	18_DOMINO_in_8	Parallel run loop
auto	5.777467632032182	0.0	discard	26_8_in_8	Parallel run loop
auto	4.904537362780794	0.0	discard	21_5_in_DOMINO	Parallel run loop
auto	3.589728559222962	0.0	keep	19_6_in_8	Parallel run loop
auto	3.440622428928729	0.0	discard	22_DOMINO_in_8	Parallel run loop
auto	6.2478639807772485	0.0	discard	16_8_in_6	Parallel run loop
auto	2.6915521371235593	0.0	discard	8_DOMINO_in_CIRCLE	Parallel run loop
auto	4.882630265799585	0.0	discard	19_DOMINO_in_DOMINO	Parallel run loop
auto	4.558228051991228	0.0	discard	16_6_in_6	Parallel run loop
auto	5.663881359656193	0.0	discard	25_6_in_6	Parallel run loop
auto	4.569815862524372	0.0	discard	18_5_in_DOMINO	Parallel run loop
auto	3.827281560659983	0.0	discard	11_DOMINO_in_DOMINO	Parallel run loop
auto	6.3086008314667135	0.0	discard	10_8_in_5	Parallel run loop
auto	4.409839693042728	0.0	discard	17_5_in_DOMINO	Parallel run loop
auto	2.6447738834161796	0.0	discard	9_6_in_8	Parallel run loop
auto	7.812784092602333	0.0	discard	32_6_in_5	Parallel run loop
auto	4.309862100185108	0.0	discard	16_5_in_DOMINO	Parallel run loop
auto	6.0953254095291225	0.0	discard	19_8_in_CIRCLE	Parallel run loop
auto	4.93183093266987	0.0	keep	29_5_in_6	Parallel run loop
auto	5.8434126687983206	0.0	discard	20_6_in_DOMINO	Parallel run loop
auto	4.91895222051388	0.0	discard	25_DOMINO_in_6	Parallel run loop
auto	3.5764417535910717	0.0	discard	25_DOMINO_in_8	Parallel run loop
auto	3.0294424570362044	0.0	discard	16_DOMINO_in_8	Parallel run loop
auto	5.949837118888085	0.0	discard	28_6_in_6	Parallel run loop
auto	2.5069731037578142	0.0	discard	13_5_in_8	Parallel run loop
auto	4.282850583980959	0.0	discard	13_DOMINO_in_5	Parallel run loop
auto	6.700106835949054	0.0	discard	23_6_in_5	Parallel run loop
auto	5.693379391606711	0.0	discard	19_6_in_DOMINO	Parallel run loop
auto	5.6215705425904785	0.0	discard	25_5_in_5	Parallel run loop
auto	5.302443940088193	0.0	discard	22_5_in_5	Parallel run loop
auto	2.8900148954966616	0.0	discard	9_5_in_6	Parallel run loop
auto	4.721959225512637	0.0	keep	24_DOMINO_in_6	Parallel run loop
auto	4.733780902267363	0.0	discard	27_5_in_6	Parallel run loop
auto	8.382506079934158	0.0	discard	22_8_in_DOMINO	Parallel run loop
auto	3.2342712519580337	0.0	discard	12_DOMINO_in_CIRCLE	Parallel run loop
auto	5.012765064798198	0.0	discard	20_DOMINO_in_DOMINO	Parallel run loop
auto	3.589728176963775	0.0	keep	19_6_in_8	Parallel run loop
auto	7.676416747555321	0.0	discard	31_6_in_5	Parallel run loop
auto	5.003644241371123	0.0	discard	19_DOMINO_in_DOMINO	Parallel run loop
auto	3.1860393694450497	0.0	discard	11_DOMINO_in_CIRCLE	Parallel run loop
auto	6.281350871924349	0.0	discard	20_6_in_5	Parallel run loop
auto	3.9493073634468594	0.0	discard	11_6_in_6	Parallel run loop
auto	3.1206342394830537	0.0	discard	17_DOMINO_in_8	Parallel run loop
auto	5.384931350321754	0.0	discard	23_5_in_5	Parallel run loop
auto	4.003963114377159	0.0	discard	28_DOMINO_in_8	Parallel run loop
auto	3.3236392676260467	0.0	discard	20_DOMINO_in_8	Parallel run loop
auto	3.820307154948568	0.0	discard	27_DOMINO_in_8	Parallel run loop
auto	5.13759272670469	0.0	discard	27_DOMINO_in_6	Parallel run loop
auto	7.160232969366078	0.0	discard	16_8_in_DOMINO	Parallel run loop
