commit	score	memory_gb	status	problem	description
auto	3.825446483127054	0.0	keep	10_DOMINO_in_5	Parallel run loop
auto	5.421551360138886	0.0	keep	23_8_in_8	Parallel run loop
auto	3.7033679870201235	0.0	keep	30_5_in_8	Parallel run loop
auto	3.5068608405216044	0.0	keep	27_5_in_8	Parallel run loop
auto	6.069596930529948	0.0	keep	22_6_in_DOMINO	Parallel run loop
auto	5.514392354859372	0.0	keep	24_5_in_5	Parallel run loop
auto	3.7683056475804717	0.0	discard	17_5_in_6	Parallel run loop
auto	4.943088540325798	0.0	keep	29_5_in_6	Parallel run loop
auto	7.208876137043892	0.0	discard	27_6_in_5	Parallel run loop
auto	4.479450015973007	0.0	keep	24_5_in_6	Parallel run loop
auto	4.619100571921561	0.0	keep	17_6_in_6	Parallel run loop
auto	4.428235832120012	0.0	keep	23_5_in_6	Parallel run loop
auto	5.735663181552993	0.0	keep	26_6_in_6	Parallel run loop
auto	3.44499647435254	0.0	keep	26_5_in_8	Parallel run loop
auto	5.488740257886188	0.0	discard	23_6_in_6	Parallel run loop
auto	3.667423960054199	0.0	keep	14_DOMINO_in_6	Parallel run loop
auto	3.7608570903135465	0.0	keep	31_5_in_8	Parallel run loop
auto	2.4744975300295144	0.0	discard	11_DOMINO_in_8	Parallel run loop
auto	4.212319033891546	0.0	keep	14_5_in_5	Parallel run loop
auto	5.410034547912116	0.0	keep	18_6_in_DOMINO	Parallel run loop
auto	5.102893955208136	0.0	discard	20_8_in_8	Parallel run loop
auto	3.6266852590778553	0.0	keep	29_5_in_8	Parallel run loop
auto	2.793942216148419	0.0	keep	15_DOMINO_in_8	Parallel run loop
auto	6.2478639807772485	0.0	discard	16_8_in_6	Parallel run loop
auto	3.1917547584457124	0.0	keep	22_5_in_8	Parallel run loop
auto	6.787214634017203	0.0	keep	24_6_in_5	Parallel run loop
auto	4.591371862667766	0.0	keep	25_5_in_6	Parallel run loop
auto	5.777467632032182	0.0	discard	26_8_in_8	Parallel run loop
auto	4.85989954654252	0.0	keep	28_5_in_6	Parallel run loop
auto	4.558228051991228	0.0	discard	16_6_in_6	Parallel run loop
auto	5.663881359656193	0.0	discard	25_6_in_6	Parallel run loop
auto	4.618960888044945	0.0	keep	22_DOMINO_in_6	Parallel run loop
auto	5.289512270969785	0.0	keep	27_6_in_CIRCLE	Parallel run loop
auto	3.472352217598895	0.0	keep	14_5_in_6	Parallel run loop
auto	3.3168170351804376	0.0	keep	21_DOMINO_in_8	Parallel run loop
auto	5.921582803504327	0.0	keep	28_6_in_6	Parallel run loop
auto	6.0953254095291225	0.0	discard	19_8_in_CIRCLE	Parallel run loop
auto	6.073239978866936	0.0	keep	29_8_in_8	Parallel run loop
auto	5.8434126687983206	0.0	discard	20_6_in_DOMINO	Parallel run loop
auto	5.113785337679533	0.0	keep	31_5_in_6	Parallel run loop
auto	7.784901398442698	0.0	keep	32_6_in_5	Parallel run loop
auto	2.9143265579953863	0.0	keep	16_DOMINO_in_8	Parallel run loop
auto	5.566954849811148	0.0	keep	22_DOMINO_in_5	Parallel run loop
auto	6.700106835949054	0.0	discard	23_6_in_5	Parallel run loop
auto	5.693379391606711	0.0	discard	19_6_in_DOMINO	Parallel run loop
auto	5.594858087107836	0.0	keep	25_5_in_5	Parallel run loop
auto	5.302443940088193	0.0	discard	22_5_in_5	Parallel run loop
auto	5.654781273165983	0.0	keep	25_8_in_8	Parallel run loop
auto	4.505460540956388	0.0	keep	14_DOMINO_in_5	Parallel run loop
auto	4.673590214675345	0.0	keep	26_5_in_6	Parallel run loop
auto	2.9407739902523184	0.0	keep	9_DOMINO_in_6	Parallel run loop
auto	4.245837341646496	0.0	keep	21_5_in_6	Parallel run loop
auto	4.733780902267363	0.0	discard	27_5_in_6	Parallel run loop
auto	6.281350871924349	0.0	discard	20_6_in_5	Parallel run loop
auto	3.5270775652050976	0.0	keep	13_DOMINO_in_6	Parallel run loop
auto	3.7072273353537804	0.0	keep	16_5_in_6	Parallel run loop
auto	3.8570536566353777	0.0	keep	27_DOMINO_in_8	Parallel run loop
auto	5.372243768304024	0.0	keep	23_5_in_5	Parallel run loop
auto	6.903950231592421	0.0	keep	25_6_in_5	Parallel run loop
auto	3.504602572869968	0.0	keep	27_5_in_8	Parallel run loop
auto	4.396096171827871	0.0	discard	20_DOMINO_in_6	Parallel run loop
auto	5.4996826062998005	0.0	keep	24_5_in_5	Parallel run loop
auto	3.7683056475804717	0.0	discard	17_5_in_6	Parallel run loop
auto	3.6841480504712787	0.0	keep	30_5_in_8	Parallel run loop
auto	4.942004917784334	0.0	keep	29_5_in_6	Parallel run loop
auto	4.479815897501027	0.0	discard	24_5_in_6	Parallel run loop
auto	3.8943946000641203	0.0	keep	16_DOMINO_in_6	Parallel run loop
auto	2.7156892101454315	0.0	keep	14_DOMINO_in_8	Parallel run loop
auto	7.208876137043892	0.0	discard	27_6_in_5	Parallel run loop
auto	4.398349391386404	0.0	keep	23_5_in_6	Parallel run loop
auto	5.720536937430391	0.0	keep	26_6_in_6	Parallel run loop
auto	3.757828103686657	0.0	keep	31_5_in_8	Parallel run loop
auto	4.16816265915921	0.0	keep	12_DOMINO_in_5	Parallel run loop
auto	5.448268872272794	0.0	keep	23_6_in_6	Parallel run loop
auto	5.102893955208136	0.0	discard	20_8_in_8	Parallel run loop
auto	3.442078602128796	0.0	keep	26_5_in_8	Parallel run loop
auto	5.777467632032182	0.0	discard	26_8_in_8	Parallel run loop
auto	5.663881359656193	0.0	discard	25_6_in_6	Parallel run loop
auto	4.590227398418843	0.0	keep	25_5_in_6	Parallel run loop
auto	4.610989039220096	0.0	keep	22_DOMINO_in_6	Parallel run loop
auto	3.6258601768084384	0.0	keep	29_5_in_8	Parallel run loop
auto	4.558228051991228	0.0	discard	16_6_in_6	Parallel run loop
auto	4.8586244513866825	0.0	keep	28_5_in_6	Parallel run loop
auto	5.8434126687983206	0.0	discard	20_6_in_DOMINO	Parallel run loop
auto	5.112431827805381	0.0	keep	31_5_in_6	Parallel run loop
auto	6.0953254095291225	0.0	discard	19_8_in_CIRCLE	Parallel run loop
auto	7.812784092602333	0.0	discard	32_6_in_5	Parallel run loop
auto	5.949837118888085	0.0	discard	28_6_in_6	Parallel run loop
auto	6.100717150518816	0.0	discard	29_8_in_8	Parallel run loop
auto	3.0294424570362044	0.0	discard	16_DOMINO_in_8	Parallel run loop
auto	6.700106835949054	0.0	discard	23_6_in_5	Parallel run loop
auto	4.041751229264535	0.0	keep	17_DOMINO_in_6	Parallel run loop
auto	5.6215705425904785	0.0	discard	25_5_in_5	Parallel run loop
auto	5.302443940088193	0.0	discard	22_5_in_5	Parallel run loop
auto	4.673088177934919	0.0	keep	26_5_in_6	Parallel run loop
auto	3.7038860893015912	0.0	keep	16_5_in_6	Parallel run loop
auto	3.922392999616021	0.0	discard	27_DOMINO_in_8	Parallel run loop
auto	7.707891527545897	0.0	discard	31_6_in_5	Parallel run loop
auto	5.196541172154802	0.0	keep	28_DOMINO_in_6	Parallel run loop
auto	4.733780902267363	0.0	discard	27_5_in_6	Parallel run loop
auto	4.3510465326757455	0.0	keep	20_DOMINO_in_6	Parallel run loop
auto	5.359098940898318	0.0	keep	23_5_in_5	Parallel run loop
auto	2.578331540908866	0.0	keep	13_DOMINO_in_8	Parallel run loop
auto	3.7683056475804717	0.0	discard	17_5_in_6	Parallel run loop
auto	6.2685296021793295	0.0	keep	32_6_in_6	Parallel run loop
auto	6.366764143026497	0.0	keep	29_DOMINO_in_5	Parallel run loop
auto	3.742031098299584	0.0	discard	30_5_in_8	Parallel run loop
auto	4.941003582336044	0.0	keep	29_5_in_6	Parallel run loop
auto	4.479815897501027	0.0	discard	24_5_in_6	Parallel run loop
auto	2.72976517994299	0.0	discard	14_DOMINO_in_8	Parallel run loop
auto	5.689890204144913	0.0	keep	26_5_in_5	Parallel run loop
auto	3.0481118693074354	0.0	keep	18_DOMINO_in_8	Parallel run loop
auto	4.138864111453027	0.0	keep	12_DOMINO_in_5	Parallel run loop
auto	7.153410212646325	0.0	keep	27_6_in_5	Parallel run loop
auto	3.439714539833198	0.0	keep	26_5_in_8	Parallel run loop
auto	3.7553760908747846	0.0	keep	31_5_in_8	Parallel run loop
auto	3.641820487433201	0.0	discard	29_5_in_8	Parallel run loop
auto	4.622697671048495	0.0	keep	15_DOMINO_in_5	Parallel run loop
auto	5.431613626461278	0.0	keep	23_6_in_6	Parallel run loop
auto	4.4350097507776285	0.0	keep	16_5_in_5	Parallel run loop
auto	4.579812418082424	0.0	keep	22_DOMINO_in_6	Parallel run loop
auto	4.589169398041832	0.0	keep	25_5_in_6	Parallel run loop
auto	5.102893955208136	0.0	discard	20_8_in_8	Parallel run loop
auto	5.663881359656193	0.0	discard	25_6_in_6	Parallel run loop
auto	5.777467632032182	0.0	discard	26_8_in_8	Parallel run loop
auto	4.857445474115241	0.0	keep	28_5_in_6	Parallel run loop
auto	3.0294424570362044	0.0	discard	16_DOMINO_in_8	Parallel run loop
auto	5.7555003158195435	0.0	keep	24_DOMINO_in_5	Parallel run loop
auto	5.111180306608735	0.0	keep	31_5_in_6	Parallel run loop
auto	6.0953254095291225	0.0	discard	19_8_in_CIRCLE	Parallel run loop
auto	4.041478072069874	0.0	keep	17_DOMINO_in_6	Parallel run loop
auto	7.812784092602333	0.0	discard	32_6_in_5	Parallel run loop
auto	5.949837118888085	0.0	discard	28_6_in_6	Parallel run loop
auto	5.6215705425904785	0.0	discard	25_5_in_5	Parallel run loop
auto	3.1206342394830537	0.0	discard	17_DOMINO_in_8	Parallel run loop
auto	5.302443940088193	0.0	discard	22_5_in_5	Parallel run loop
auto	3.7460412903571165	0.0	keep	27_DOMINO_in_8	Parallel run loop
auto	4.672624992289787	0.0	keep	26_5_in_6	Parallel run loop
auto	3.19734417280043	0.0	keep	20_DOMINO_in_8	Parallel run loop
auto	3.1352386814005566	0.0	keep	19_DOMINO_in_8	Parallel run loop
auto	6.100717150518816	0.0	discard	29_8_in_8	Parallel run loop
auto	5.176312627316074	0.0	keep	28_DOMINO_in_6	Parallel run loop
auto	5.837617794331301	0.0	keep	28_8_in_8	Parallel run loop
auto	4.733780902267363	0.0	discard	27_5_in_6	Parallel run loop
auto	5.384931350321754	0.0	discard	23_5_in_5	Parallel run loop
auto	5.165308566590611	0.0	keep	19_DOMINO_in_5	Parallel run loop
auto	7.707891527545897	0.0	discard	31_6_in_5	Parallel run loop
auto	5.3041643290505744	0.0	keep	20_DOMINO_in_5	Parallel run loop
auto	3.7683056475804717	0.0	discard	17_5_in_6	Parallel run loop
auto	4.940078500111987	0.0	keep	29_5_in_6	Parallel run loop
auto	2.5794828405467167	0.0	discard	13_DOMINO_in_8	Parallel run loop
auto	5.734497359224317	0.0	keep	27_6_in_6	Parallel run loop
auto	4.479815897501027	0.0	discard	24_5_in_6	Parallel run loop
auto	3.7200887922679824	0.0	discard	30_5_in_8	Parallel run loop
auto	6.082969702882483	0.0	keep	27_DOMINO_in_5	Parallel run loop
auto	5.717590854823145	0.0	discard	26_5_in_5	Parallel run loop
auto	2.72976517994299	0.0	discard	14_DOMINO_in_8	Parallel run loop
auto	4.737400416977929	0.0	keep	16_DOMINO_in_5	Parallel run loop
auto	4.320067517213193	0.0	keep	13_DOMINO_in_5	Parallel run loop
auto	3.4538562079264596	0.0	discard	26_5_in_8	Parallel run loop
auto	3.3977233190545606	0.0	keep	22_DOMINO_in_8	Parallel run loop
auto	3.753397336164312	0.0	keep	31_5_in_8	Parallel run loop
auto	5.4156888438614805	0.0	keep	23_6_in_6	Parallel run loop
auto	3.1153105438085373	0.0	discard	18_DOMINO_in_8	Parallel run loop
auto	4.426425120704206	0.0	keep	16_5_in_5	Parallel run loop
auto	4.588191585222832	0.0	keep	25_5_in_6	Parallel run loop
auto	3.641820487433201	0.0	discard	29_5_in_8	Parallel run loop
auto	4.237052405484782	0.0	keep	19_DOMINO_in_6	Parallel run loop
auto	4.856355668512603	0.0	keep	28_5_in_6	Parallel run loop
auto	4.606373481567585	0.0	keep	15_DOMINO_in_5	Parallel run loop
auto	5.663881359656193	0.0	discard	25_6_in_6	Parallel run loop
auto	3.0294424570362044	0.0	discard	16_DOMINO_in_8	Parallel run loop
auto	4.041467296638518	0.0	keep	17_DOMINO_in_6	Parallel run loop
auto	3.800119281616542	0.0	keep	15_DOMINO_in_6	Parallel run loop
auto	5.110023409368523	0.0	keep	31_5_in_6	Parallel run loop
auto	5.6215705425904785	0.0	discard	25_5_in_5	Parallel run loop
auto	5.328449659510382	0.0	keep	29_DOMINO_in_6	Parallel run loop
auto	5.949837118888085	0.0	discard	28_6_in_6	Parallel run loop
auto	7.812784092602333	0.0	discard	32_6_in_5	Parallel run loop
auto	3.1206342394830537	0.0	discard	17_DOMINO_in_8	Parallel run loop
auto	5.033279288774603	0.0	keep	27_DOMINO_in_6	Parallel run loop
auto	4.672197701285595	0.0	keep	26_5_in_6	Parallel run loop
auto	3.820307154948568	0.0	discard	27_DOMINO_in_8	Parallel run loop
auto	4.733780902267363	0.0	discard	27_5_in_6	Parallel run loop
auto	3.3236392676260467	0.0	discard	20_DOMINO_in_8	Parallel run loop
auto	5.993021013773624	0.0	keep	26_DOMINO_in_5	Parallel run loop
auto	5.384931350321754	0.0	discard	23_5_in_5	Parallel run loop
auto	3.2024351839685585	0.0	discard	19_DOMINO_in_8	Parallel run loop
auto	6.056529720239095	0.0	keep	29_8_in_8	Parallel run loop
auto	5.154168302609424	0.0	keep	28_DOMINO_in_6	Parallel run loop
auto	4.686004462947639	0.0	keep	23_DOMINO_in_6	Parallel run loop
auto	7.648736354436046	0.0	keep	31_6_in_5	Parallel run loop
auto	4.939224048497261	0.0	keep	29_5_in_6	Parallel run loop
auto	2.5794828405467167	0.0	discard	13_DOMINO_in_8	Parallel run loop
auto	4.280944212017085	0.0	keep	13_DOMINO_in_5	Parallel run loop
auto	2.72976517994299	0.0	discard	14_DOMINO_in_8	Parallel run loop
auto	4.479815897501027	0.0	discard	24_5_in_6	Parallel run loop
auto	5.724849731172783	0.0	keep	27_6_in_6	Parallel run loop
auto	6.222518488602049	0.0	keep	28_DOMINO_in_5	Parallel run loop
auto	3.767229394968456	0.0	discard	30_5_in_8	Parallel run loop
auto	4.8506057039752415	0.0	keep	17_DOMINO_in_5	Parallel run loop
auto	3.635290938824361	0.0	keep	25_DOMINO_in_8	Parallel run loop
auto	5.677020127738932	0.0	keep	26_5_in_5	Parallel run loop
auto	3.440622428928729	0.0	discard	22_DOMINO_in_8	Parallel run loop
auto	3.867108722629126	0.0	keep	28_DOMINO_in_8	Parallel run loop
auto	3.027835876592687	0.0	keep	18_DOMINO_in_8	Parallel run loop
auto	4.418316100768158	0.0	keep	16_5_in_5	Parallel run loop
auto	4.92647085768483	0.0	keep	26_DOMINO_in_6	Parallel run loop
auto	6.293454094105282	0.0	keep	33_6_in_6	Parallel run loop
auto	3.9506038669090153	0.0	keep	29_DOMINO_in_8	Parallel run loop
auto	4.2559486648884635	0.0	discard	19_DOMINO_in_6	Parallel run loop
auto	5.67502752108069	0.0	keep	23_DOMINO_in_5	Parallel run loop
auto	4.08527986486613	0.0	keep	18_DOMINO_in_6	Parallel run loop
auto	4.992745176884099	0.0	keep	18_DOMINO_in_5	Parallel run loop
auto	4.041466874764639	0.0	keep	17_DOMINO_in_6	Parallel run loop
auto	4.859740098724881	0.0	keep	25_DOMINO_in_6	Parallel run loop
auto	3.744429329158158	0.0	keep	15_DOMINO_in_6	Parallel run loop
auto	5.326513451366944	0.0	keep	29_DOMINO_in_6	Parallel run loop
auto	3.1206342394830537	0.0	discard	17_DOMINO_in_8	Parallel run loop
auto	5.6215705425904785	0.0	discard	25_5_in_5	Parallel run loop
auto	5.949837118888085	0.0	discard	28_6_in_6	Parallel run loop
auto	5.033603721994568	0.0	discard	27_DOMINO_in_6	Parallel run loop
auto	5.336136596745584	0.0	keep	30_DOMINO_in_6	Parallel run loop
auto	3.498180921919444	0.0	keep	23_DOMINO_in_8	Parallel run loop
auto	3.820307154948568	0.0	discard	27_DOMINO_in_8	Parallel run loop
auto	7.812784092602333	0.0	discard	32_6_in_5	Parallel run loop
auto	3.3572113814404516	0.0	discard	20_DOMINO_in_8	Parallel run loop
auto	5.167041411140228	0.0	discard	28_DOMINO_in_6	Parallel run loop
auto	3.2024351839685585	0.0	discard	19_DOMINO_in_8	Parallel run loop
auto	3.5564353829351334	0.0	keep	24_DOMINO_in_8	Parallel run loop
auto	4.746483024260806	0.0	keep	24_DOMINO_in_6	Parallel run loop
auto	2.5794828405467167	0.0	discard	13_DOMINO_in_8	Parallel run loop
auto	4.093531798667193	0.0	discard	30_DOMINO_in_8	Parallel run loop
auto	5.384931350321754	0.0	discard	23_5_in_5	Parallel run loop
auto	4.717083370073929	0.0	discard	23_DOMINO_in_6	Parallel run loop
auto	3.8247664824142262	0.0	discard	26_DOMINO_in_8	Parallel run loop
auto	2.72976517994299	0.0	discard	14_DOMINO_in_8	Parallel run loop
auto	4.2769026151080025	0.0	keep	13_DOMINO_in_5	Parallel run loop
auto	4.104737035953608	0.0	keep	31_DOMINO_in_8	Parallel run loop
auto	7.676416747555321	0.0	discard	31_6_in_5	Parallel run loop
auto	4.6421823161217075	0.0	keep	19_6_in_6	Parallel run loop
auto	3.9671434273642867	0.0	discard	28_DOMINO_in_8	Parallel run loop
auto	3.595066752873783	0.0	keep	25_DOMINO_in_8	Parallel run loop
auto	3.440622428928729	0.0	discard	22_DOMINO_in_8	Parallel run loop
auto	5.40048176991982	0.0	keep	23_6_in_6	Parallel run loop
auto	3.0351924158142594	0.0	discard	18_DOMINO_in_8	Parallel run loop
auto	3.751804613875416	0.0	keep	31_5_in_8	Parallel run loop
auto	4.5872881022745196	0.0	keep	25_5_in_6	Parallel run loop
auto	4.855348547252799	0.0	keep	28_5_in_6	Parallel run loop
auto	3.92869008295522	0.0	keep	29_DOMINO_in_8	Parallel run loop
auto	4.919659210711603	0.0	keep	26_DOMINO_in_6	Parallel run loop
auto	4.261059124476035	0.0	discard	19_DOMINO_in_6	Parallel run loop
auto	4.148648307735542	0.0	discard	18_DOMINO_in_6	Parallel run loop
auto	4.024124995381911	0.0	keep	17_DOMINO_in_6	Parallel run loop
auto	5.6519417862819825	0.0	keep	23_DOMINO_in_5	Parallel run loop
auto	5.0691257436898285	0.0	discard	18_DOMINO_in_5	Parallel run loop
auto	3.794088693785276	0.0	discard	15_DOMINO_in_6	Parallel run loop
auto	5.204265770292785	0.0	keep	29_DOMINO_in_6	Parallel run loop
auto	3.1206342394830537	0.0	discard	17_DOMINO_in_8	Parallel run loop
auto	4.8546121698824445	0.0	keep	25_DOMINO_in_6	Parallel run loop
auto	6.285570527282787	0.0	keep	33_6_in_6	Parallel run loop
auto	3.429038804259795	0.0	keep	23_DOMINO_in_8	Parallel run loop
auto	5.108954257076046	0.0	keep	31_5_in_6	Parallel run loop
auto	5.330815611715633	0.0	keep	30_DOMINO_in_6	Parallel run loop
auto	3.3236392676260467	0.0	discard	20_DOMINO_in_8	Parallel run loop
auto	5.113770317494244	0.0	discard	27_DOMINO_in_6	Parallel run loop
auto	5.233607986772508	0.0	discard	28_DOMINO_in_6	Parallel run loop
auto	4.938434992631042	0.0	keep	29_5_in_6	Parallel run loop
auto	4.6718035660101584	0.0	keep	26_5_in_6	Parallel run loop
auto	3.820307154948568	0.0	discard	27_DOMINO_in_8	Parallel run loop
auto	3.1061029439157934	0.0	keep	19_DOMINO_in_8	Parallel run loop
auto	3.5703799076483236	0.0	discard	24_DOMINO_in_8	Parallel run loop
auto	4.017690290180235	0.0	keep	30_DOMINO_in_8	Parallel run loop
auto	2.5794828405467167	0.0	discard	13_DOMINO_in_8	Parallel run loop
auto	4.736763492747254	0.0	keep	24_DOMINO_in_6	Parallel run loop
auto	3.721013360681842	0.0	keep	26_DOMINO_in_8	Parallel run loop
auto	4.014686042046874	0.0	keep	20_DOMINO_in_CIRCLE	Parallel run loop
auto	3.759141572791398	0.0	discard	17_DOMINO_in_CIRCLE	Parallel run loop
auto	4.710483744185148	0.0	discard	23_DOMINO_in_6	Parallel run loop
auto	4.490747745863403	0.0	discard	13_DOMINO_in_5	Parallel run loop
auto	4.211850105668564	0.0	discard	31_DOMINO_in_8	Parallel run loop
auto	3.0351924158142594	0.0	discard	18_DOMINO_in_8	Parallel run loop
auto	4.882630265799585	0.0	discard	19_DOMINO_in_DOMINO	Parallel run loop
auto	4.6201430505186885	0.0	keep	19_6_in_6	Parallel run loop
auto	4.235568044869794	0.0	keep	19_DOMINO_in_6	Parallel run loop
auto	3.5648403286634087	0.0	keep	25_DOMINO_in_8	Parallel run loop
auto	3.440622428928729	0.0	discard	22_DOMINO_in_8	Parallel run loop
auto	3.851816367847195	0.0	keep	28_DOMINO_in_8	Parallel run loop
auto	4.120531797875164	0.0	discard	18_DOMINO_in_6	Parallel run loop
auto	4.996104015840589	0.0	discard	26_DOMINO_in_6	Parallel run loop
auto	7.676416747555321	0.0	discard	31_6_in_5	Parallel run loop
auto	3.933556629036189	0.0	discard	29_DOMINO_in_8	Parallel run loop
auto	3.722677988079332	0.0	keep	15_DOMINO_in_6	Parallel run loop
auto	4.056824903975825	0.0	discard	17_DOMINO_in_6	Parallel run loop
auto	4.854418057791339	0.0	keep	28_5_in_6	Parallel run loop
auto	3.7505253273218626	0.0	keep	31_5_in_8	Parallel run loop
auto	4.817574320672789	0.0	keep	25_DOMINO_in_6	Parallel run loop
auto	4.976114028256912	0.0	keep	18_DOMINO_in_5	Parallel run loop
auto	3.117498006277882	0.0	discard	19_DOMINO_in_8	Parallel run loop
auto	5.196323095708319	0.0	keep	29_DOMINO_in_6	Parallel run loop
auto	6.278185000492673	0.0	keep	33_6_in_6	Parallel run loop
auto	5.033603721994568	0.0	discard	27_DOMINO_in_6	Parallel run loop
auto	5.388954132068166	0.0	discard	30_DOMINO_in_6	Parallel run loop
auto	3.9938064594550418	0.0	keep	30_DOMINO_in_8	Parallel run loop
auto	3.431077442578044	0.0	discard	23_DOMINO_in_8	Parallel run loop
auto	4.8116963312316985	0.0	discard	24_DOMINO_in_6	Parallel run loop
auto	3.5703799076483236	0.0	discard	24_DOMINO_in_8	Parallel run loop
auto	3.7211543644081986	0.0	discard	26_DOMINO_in_8	Parallel run loop
auto	5.107966431039223	0.0	keep	31_5_in_6	Parallel run loop
auto	4.6566207935437705	0.0	keep	23_DOMINO_in_6	Parallel run loop
auto	4.937706462575649	0.0	keep	29_5_in_6	Parallel run loop
auto	3.820307154948568	0.0	discard	27_DOMINO_in_8	Parallel run loop
auto	4.066164801844494	0.0	keep	31_DOMINO_in_8	Parallel run loop
auto	4.671440050189325	0.0	keep	26_5_in_6	Parallel run loop
auto	4.069078977365869	0.0	discard	20_DOMINO_in_CIRCLE	Parallel run loop
auto	3.1792276704223217	0.0	discard	18_DOMINO_in_8	Parallel run loop
auto	4.263522405970115	0.0	discard	19_DOMINO_in_6	Parallel run loop
auto	4.1382891233744825	0.0	discard	18_DOMINO_in_6	Parallel run loop
auto	3.2531176663263763	0.0	discard	5_6_in_DOMINO	Parallel run loop
auto	3.440622428928729	0.0	discard	22_DOMINO_in_8	Parallel run loop
auto	4.293483619432756	0.0	discard	5_8_in_DOMINO	Parallel run loop
auto	3.6521991511468035	0.0	discard	25_DOMINO_in_8	Parallel run loop
auto	5.032207586843795	0.0	discard	26_DOMINO_in_6	Parallel run loop
auto	2.0338761676062855	0.0	discard	5_5_in_CIRCLE	Parallel run loop
auto	4.003963114377159	0.0	discard	28_DOMINO_in_8	Parallel run loop
auto	3.935917589280831	0.0	discard	29_DOMINO_in_8	Parallel run loop
auto	4.853558558601432	0.0	keep	28_5_in_6	Parallel run loop
auto	4.9623878960300685	0.0	keep	18_DOMINO_in_5	Parallel run loop
auto	4.909431868422852	0.0	discard	25_DOMINO_in_6	Parallel run loop
auto	3.117498006277882	0.0	discard	19_DOMINO_in_8	Parallel run loop
auto	3.4175597497180172	0.0	discard	6_6_in_DOMINO	Parallel run loop
auto	5.253854577399189	0.0	discard	29_DOMINO_in_6	Parallel run loop
auto	5.283825397278663	0.0	keep	30_DOMINO_in_6	Parallel run loop
auto	7.676416747555321	0.0	discard	31_6_in_5	Parallel run loop
auto	5.002490374274168	0.0	keep	27_DOMINO_in_6	Parallel run loop
auto	4.807848321172265	0.0	discard	24_DOMINO_in_6	Parallel run loop
auto	3.431077442578044	0.0	discard	23_DOMINO_in_8	Parallel run loop
auto	4.041368043263178	0.0	discard	30_DOMINO_in_8	Parallel run loop
auto	3.705928105350065	0.0	keep	26_DOMINO_in_8	Parallel run loop
auto	3.5703799076483236	0.0	discard	24_DOMINO_in_8	Parallel run loop
auto	4.64960591758442	0.0	keep	23_DOMINO_in_6	Parallel run loop
