commit	score	memory_gb	status	problem	description
auto	3.8369336484278946	0.0	discard	13_6_in_CIRCLE	Parallel run loop
auto	3.431077442578044	0.0	discard	23_DOMINO_in_8	Parallel run loop
auto	3.117498006277882	0.0	discard	19_DOMINO_in_8	Parallel run loop
auto	4.085091429602335	0.0	discard	31_DOMINO_in_8	Parallel run loop
auto	3.7487368429551218	0.0	discard	26_DOMINO_in_8	Parallel run loop
auto	2.4007400073217737	0.0	discard	12_5_in_8	Parallel run loop
auto	3.759141572791398	0.0	discard	17_DOMINO_in_CIRCLE	Parallel run loop
auto	4.963581898875819	0.0	discard	29_5_in_6	Parallel run loop
auto	4.095937409457576	0.0	discard	18_DOMINO_in_6	Parallel run loop
auto	2.803879883664299	0.0	discard	9_DOMINO_in_CIRCLE	Parallel run loop
auto	3.5703799076483236	0.0	discard	24_DOMINO_in_8	Parallel run loop
auto	8.102774853359481	0.0	discard	20_8_in_DOMINO	Parallel run loop
auto	4.792582459768923	0.0	discard	24_DOMINO_in_6	Parallel run loop
auto	4.479815897501027	0.0	discard	24_5_in_6	Parallel run loop
auto	3.7683056475804717	0.0	discard	17_5_in_6	Parallel run loop
auto	2.5794828405467167	0.0	discard	13_DOMINO_in_8	Parallel run loop
auto	4.697834635053744	0.0	discard	19_5_in_DOMINO	Parallel run loop
auto	2.9559621946049712	0.0	discard	10_DOMINO_in_CIRCLE	Parallel run loop
auto	4.475245630635559	0.0	discard	15_6_in_6	Parallel run loop
auto	6.497991980936347	0.0	discard	11_8_in_5	Parallel run loop
auto	3.5897278248231674	0.0	keep	19_6_in_8	Parallel run loop
auto	2.72976517994299	0.0	discard	14_DOMINO_in_8	Parallel run loop
auto	3.885882729879618	0.0	discard	30_DOMINO_in_8	Parallel run loop
auto	5.102893955208136	0.0	discard	20_8_in_8	Parallel run loop
auto	4.75127218611163	0.0	discard	10_8_in_CIRCLE	Parallel run loop
auto	5.790189669490146	0.0	discard	13_8_in_6	Parallel run loop
auto	4.8203042879733635	0.0	discard	20_5_in_DOMINO	Parallel run loop
auto	3.3572113814404516	0.0	discard	20_DOMINO_in_8	Parallel run loop
auto	5.994170884047151	0.0	discard	9_8_in_5	Parallel run loop
auto	3.833926104130867	0.0	discard	29_DOMINO_in_8	Parallel run loop
auto	3.117498006277882	0.0	discard	19_DOMINO_in_8	Parallel run loop
auto	4.904537362780794	0.0	discard	21_5_in_DOMINO	Parallel run loop
auto	3.0351924158142594	0.0	discard	18_DOMINO_in_8	Parallel run loop
auto	6.2478639807772485	0.0	discard	16_8_in_6	Parallel run loop
auto	2.6915521371235593	0.0	discard	8_DOMINO_in_CIRCLE	Parallel run loop
auto	4.558228051991228	0.0	discard	16_6_in_6	Parallel run loop
auto	3.440622428928729	0.0	discard	22_DOMINO_in_8	Parallel run loop
auto	5.777467632032182	0.0	discard	26_8_in_8	Parallel run loop
auto	4.569815862524372	0.0	discard	18_5_in_DOMINO	Parallel run loop
auto	6.3086008314667135	0.0	discard	10_8_in_5	Parallel run loop
auto	3.827281560659983	0.0	discard	11_DOMINO_in_DOMINO	Parallel run loop
auto	5.663881359656193	0.0	discard	25_6_in_6	Parallel run loop
auto	4.409839693042728	0.0	discard	17_5_in_DOMINO	Parallel run loop
auto	7.812784092602333	0.0	discard	32_6_in_5	Parallel run loop
auto	2.6447738834161796	0.0	discard	9_6_in_8	Parallel run loop
auto	4.309862100185108	0.0	discard	16_5_in_DOMINO	Parallel run loop
auto	4.830112656977945	0.0	discard	24_DOMINO_in_6	Parallel run loop
auto	6.0953254095291225	0.0	discard	19_8_in_CIRCLE	Parallel run loop
auto	5.8434126687983206	0.0	discard	20_6_in_DOMINO	Parallel run loop
auto	3.5764417535910717	0.0	discard	25_DOMINO_in_8	Parallel run loop
auto	2.5069731037578142	0.0	discard	13_5_in_8	Parallel run loop
auto	6.700106835949054	0.0	discard	23_6_in_5	Parallel run loop
auto	5.949837118888085	0.0	discard	28_6_in_6	Parallel run loop
auto	3.589727500428103	0.0	keep	19_6_in_8	Parallel run loop
auto	3.0294424570362044	0.0	discard	16_DOMINO_in_8	Parallel run loop
auto	5.693379391606711	0.0	discard	19_6_in_DOMINO	Parallel run loop
auto	5.6215705425904785	0.0	discard	25_5_in_5	Parallel run loop
auto	5.302443940088193	0.0	discard	22_5_in_5	Parallel run loop
auto	2.8900148954966616	0.0	discard	9_5_in_6	Parallel run loop
auto	3.2342712519580337	0.0	discard	12_DOMINO_in_CIRCLE	Parallel run loop
auto	4.733780902267363	0.0	discard	27_5_in_6	Parallel run loop
auto	3.117498006277882	0.0	discard	19_DOMINO_in_8	Parallel run loop
auto	8.382506079934158	0.0	discard	22_8_in_DOMINO	Parallel run loop
auto	7.676416747555321	0.0	discard	31_6_in_5	Parallel run loop
auto	5.012765064798198	0.0	discard	20_DOMINO_in_DOMINO	Parallel run loop
auto	6.281350871924349	0.0	discard	20_6_in_5	Parallel run loop
auto	3.1860393694450497	0.0	discard	11_DOMINO_in_CIRCLE	Parallel run loop
auto	5.384931350321754	0.0	discard	23_5_in_5	Parallel run loop
auto	3.9493073634468594	0.0	discard	11_6_in_6	Parallel run loop
auto	4.003963114377159	0.0	discard	28_DOMINO_in_8	Parallel run loop
auto	3.1206342394830537	0.0	discard	17_DOMINO_in_8	Parallel run loop
auto	3.8369336484278946	0.0	discard	13_6_in_CIRCLE	Parallel run loop
auto	7.160232969366078	0.0	discard	16_8_in_DOMINO	Parallel run loop
auto	5.0590760034048925	0.0	discard	27_DOMINO_in_6	Parallel run loop
auto	3.820307154948568	0.0	discard	27_DOMINO_in_8	Parallel run loop
auto	5.002943910135604	0.0	discard	26_DOMINO_in_6	Parallel run loop
auto	3.431077442578044	0.0	discard	23_DOMINO_in_8	Parallel run loop
auto	4.085091429602335	0.0	discard	31_DOMINO_in_8	Parallel run loop
auto	5.137157822934903	0.0	keep	28_DOMINO_in_6	Parallel run loop
auto	3.7487368429551218	0.0	discard	26_DOMINO_in_8	Parallel run loop
auto	3.759141572791398	0.0	discard	17_DOMINO_in_CIRCLE	Parallel run loop
auto	3.5703799076483236	0.0	discard	24_DOMINO_in_8	Parallel run loop
auto	2.4007400073217737	0.0	discard	12_5_in_8	Parallel run loop
auto	3.589727201592515	0.0	keep	19_6_in_8	Parallel run loop
auto	4.090615884485314	0.0	discard	18_DOMINO_in_6	Parallel run loop
auto	2.803879883664299	0.0	discard	9_DOMINO_in_CIRCLE	Parallel run loop
auto	8.102774853359481	0.0	discard	20_8_in_DOMINO	Parallel run loop
auto	2.5794828405467167	0.0	discard	13_DOMINO_in_8	Parallel run loop
auto	3.7683056475804717	0.0	discard	17_5_in_6	Parallel run loop
auto	4.479815897501027	0.0	discard	24_5_in_6	Parallel run loop
auto	4.697834635053744	0.0	discard	19_5_in_DOMINO	Parallel run loop
auto	4.475245630635559	0.0	discard	15_6_in_6	Parallel run loop
auto	6.497991980936347	0.0	discard	11_8_in_5	Parallel run loop
auto	2.9559621946049712	0.0	discard	10_DOMINO_in_CIRCLE	Parallel run loop
auto	2.72976517994299	0.0	discard	14_DOMINO_in_8	Parallel run loop
auto	4.039521851836077	0.0	discard	30_DOMINO_in_8	Parallel run loop
auto	4.75127218611163	0.0	discard	10_8_in_CIRCLE	Parallel run loop
auto	4.910596688170311	0.0	discard	25_DOMINO_in_6	Parallel run loop
auto	5.102893955208136	0.0	discard	20_8_in_8	Parallel run loop
auto	5.790189669490146	0.0	discard	13_8_in_6	Parallel run loop
auto	4.8203042879733635	0.0	discard	20_5_in_DOMINO	Parallel run loop
auto	5.994170884047151	0.0	discard	9_8_in_5	Parallel run loop
auto	3.833926104130867	0.0	discard	29_DOMINO_in_8	Parallel run loop
auto	5.116570670070814	0.0	discard	27_DOMINO_in_6	Parallel run loop
auto	4.282850583980959	0.0	discard	13_DOMINO_in_5	Parallel run loop
auto	3.0351924158142594	0.0	discard	18_DOMINO_in_8	Parallel run loop
auto	4.904537362780794	0.0	discard	21_5_in_DOMINO	Parallel run loop
auto	5.777467632032182	0.0	discard	26_8_in_8	Parallel run loop
auto	5.018979776155715	0.0	discard	26_DOMINO_in_6	Parallel run loop
auto	3.440622428928729	0.0	discard	22_DOMINO_in_8	Parallel run loop
auto	5.164618675493008	0.0	discard	28_DOMINO_in_6	Parallel run loop
auto	4.262088037057067	0.0	discard	19_DOMINO_in_6	Parallel run loop
auto	2.6915521371235593	0.0	discard	8_DOMINO_in_CIRCLE	Parallel run loop
auto	4.1271866931169825	0.0	discard	18_DOMINO_in_6	Parallel run loop
auto	6.2478639807772485	0.0	discard	16_8_in_6	Parallel run loop
auto	3.589726926302568	0.0	keep	19_6_in_8	Parallel run loop
auto	5.663881359656193	0.0	discard	25_6_in_6	Parallel run loop
auto	4.960148968728546	0.0	discard	19_DOMINO_in_DOMINO	Parallel run loop
auto	4.558228051991228	0.0	discard	16_6_in_6	Parallel run loop
auto	3.827281560659983	0.0	discard	11_DOMINO_in_DOMINO	Parallel run loop
auto	6.3086008314667135	0.0	discard	10_8_in_5	Parallel run loop
auto	4.569815862524372	0.0	discard	18_5_in_DOMINO	Parallel run loop
auto	2.6447738834161796	0.0	discard	9_6_in_8	Parallel run loop
auto	4.409839693042728	0.0	discard	17_5_in_DOMINO	Parallel run loop
auto	4.309862100185108	0.0	discard	16_5_in_DOMINO	Parallel run loop
auto	6.0953254095291225	0.0	discard	19_8_in_CIRCLE	Parallel run loop
auto	7.812784092602333	0.0	discard	32_6_in_5	Parallel run loop
auto	5.949837118888085	0.0	discard	28_6_in_6	Parallel run loop
auto	4.869031440595681	0.0	discard	25_DOMINO_in_6	Parallel run loop
auto	2.5069731037578142	0.0	discard	13_5_in_8	Parallel run loop
auto	5.8434126687983206	0.0	discard	20_6_in_DOMINO	Parallel run loop
auto	5.693379391606711	0.0	discard	19_6_in_DOMINO	Parallel run loop
auto	4.445840268404769	0.0	discard	13_DOMINO_in_5	Parallel run loop
auto	6.700106835949054	0.0	discard	23_6_in_5	Parallel run loop
auto	5.302443940088193	0.0	discard	22_5_in_5	Parallel run loop
auto	5.6215705425904785	0.0	discard	25_5_in_5	Parallel run loop
auto	5.08341916223948	0.0	discard	27_DOMINO_in_6	Parallel run loop
auto	4.253571954093506	0.0	discard	19_DOMINO_in_6	Parallel run loop
auto	4.733780902267363	0.0	discard	27_5_in_6	Parallel run loop
auto	5.283888565760591	0.0	discard	29_DOMINO_in_6	Parallel run loop
auto	4.985463341248307	0.0	discard	26_DOMINO_in_6	Parallel run loop
auto	5.012765064798198	0.0	discard	20_DOMINO_in_DOMINO	Parallel run loop
auto	2.8900148954966616	0.0	discard	9_5_in_6	Parallel run loop
auto	3.2342712519580337	0.0	discard	12_DOMINO_in_CIRCLE	Parallel run loop
auto	5.214440266889157	0.0	discard	28_DOMINO_in_6	Parallel run loop
auto	8.382506079934158	0.0	discard	22_8_in_DOMINO	Parallel run loop
auto	3.9493073634468594	0.0	discard	11_6_in_6	Parallel run loop
auto	3.1860393694450497	0.0	discard	11_DOMINO_in_CIRCLE	Parallel run loop
auto	3.589726672703095	0.0	keep	19_6_in_8	Parallel run loop
auto	7.676416747555321	0.0	discard	31_6_in_5	Parallel run loop
auto	6.281350871924349	0.0	discard	20_6_in_5	Parallel run loop
auto	2.4007400073217737	0.0	discard	12_5_in_8	Parallel run loop
auto	5.384931350321754	0.0	discard	23_5_in_5	Parallel run loop
auto	3.8369336484278946	0.0	discard	13_6_in_CIRCLE	Parallel run loop
auto	7.160232969366078	0.0	discard	16_8_in_DOMINO	Parallel run loop
auto	3.759141572791398	0.0	discard	17_DOMINO_in_CIRCLE	Parallel run loop
auto	3.7683056475804717	0.0	discard	17_5_in_6	Parallel run loop
auto	2.803879883664299	0.0	discard	9_DOMINO_in_CIRCLE	Parallel run loop
auto	4.931614132063029	0.0	keep	29_5_in_6	Parallel run loop
auto	4.696286050621444	0.0	discard	23_DOMINO_in_6	Parallel run loop
auto	4.907651066648707	0.0	discard	25_DOMINO_in_6	Parallel run loop
auto	8.102774853359481	0.0	discard	20_8_in_DOMINO	Parallel run loop
auto	4.479815897501027	0.0	discard	24_5_in_6	Parallel run loop
auto	4.697834635053744	0.0	discard	19_5_in_DOMINO	Parallel run loop
auto	2.9559621946049712	0.0	discard	10_DOMINO_in_CIRCLE	Parallel run loop
auto	6.497991980936347	0.0	discard	11_8_in_5	Parallel run loop
auto	4.475245630635559	0.0	discard	15_6_in_6	Parallel run loop
auto	5.116059013003807	0.0	discard	27_DOMINO_in_6	Parallel run loop
auto	4.278743470169882	0.0	discard	19_DOMINO_in_6	Parallel run loop
auto	4.75127218611163	0.0	discard	10_8_in_CIRCLE	Parallel run loop
auto	5.102893955208136	0.0	discard	20_8_in_8	Parallel run loop
auto	5.790189669490146	0.0	discard	13_8_in_6	Parallel run loop
auto	4.8203042879733635	0.0	discard	20_5_in_DOMINO	Parallel run loop
auto	5.994170884047151	0.0	discard	9_8_in_5	Parallel run loop
auto	2.6915521371235593	0.0	discard	8_DOMINO_in_CIRCLE	Parallel run loop
auto	4.904537362780794	0.0	discard	21_5_in_DOMINO	Parallel run loop
auto	6.2478639807772485	0.0	discard	16_8_in_6	Parallel run loop
auto	4.558228051991228	0.0	discard	16_6_in_6	Parallel run loop
auto	3.5897264390850943	0.0	keep	19_6_in_8	Parallel run loop
auto	5.003644241371123	0.0	discard	19_DOMINO_in_DOMINO	Parallel run loop
auto	4.569815862524372	0.0	discard	18_5_in_DOMINO	Parallel run loop
auto	5.777467632032182	0.0	discard	26_8_in_8	Parallel run loop
auto	6.3086008314667135	0.0	discard	10_8_in_5	Parallel run loop
auto	3.827281560659983	0.0	discard	11_DOMINO_in_DOMINO	Parallel run loop
auto	5.663881359656193	0.0	discard	25_6_in_6	Parallel run loop
auto	4.409839693042728	0.0	discard	17_5_in_DOMINO	Parallel run loop
auto	4.309862100185108	0.0	discard	16_5_in_DOMINO	Parallel run loop
auto	2.6447738834161796	0.0	discard	9_6_in_8	Parallel run loop
auto	4.670059041534408	0.0	discard	23_DOMINO_in_6	Parallel run loop
auto	7.812784092602333	0.0	discard	32_6_in_5	Parallel run loop
auto	6.0953254095291225	0.0	discard	19_8_in_CIRCLE	Parallel run loop
auto	2.5069731037578142	0.0	discard	13_5_in_8	Parallel run loop
auto	6.700106835949054	0.0	discard	23_6_in_5	Parallel run loop
auto	5.8434126687983206	0.0	discard	20_6_in_DOMINO	Parallel run loop
auto	4.931414288686676	0.0	keep	29_5_in_6	Parallel run loop
auto	5.693379391606711	0.0	discard	19_6_in_DOMINO	Parallel run loop
auto	5.949837118888085	0.0	discard	28_6_in_6	Parallel run loop
auto	5.6215705425904785	0.0	discard	25_5_in_5	Parallel run loop
auto	5.302443940088193	0.0	discard	22_5_in_5	Parallel run loop
auto	2.8900148954966616	0.0	discard	9_5_in_6	Parallel run loop
auto	5.078845914597419	0.0	discard	27_DOMINO_in_6	Parallel run loop
auto	5.232880087295193	0.0	discard	29_DOMINO_in_6	Parallel run loop
auto	4.733780902267363	0.0	discard	27_5_in_6	Parallel run loop
auto	5.012765064798198	0.0	discard	20_DOMINO_in_DOMINO	Parallel run loop
auto	3.2342712519580337	0.0	discard	12_DOMINO_in_CIRCLE	Parallel run loop
auto	4.817088292379926	0.0	discard	24_DOMINO_in_6	Parallel run loop
auto	3.9493073634468594	0.0	discard	11_6_in_6	Parallel run loop
auto	6.281350871924349	0.0	discard	20_6_in_5	Parallel run loop
auto	7.676416747555321	0.0	discard	31_6_in_5	Parallel run loop
auto	3.1860393694450497	0.0	discard	11_DOMINO_in_CIRCLE	Parallel run loop
auto	8.382506079934158	0.0	discard	22_8_in_DOMINO	Parallel run loop
auto	3.5897262238742123	0.0	keep	19_6_in_8	Parallel run loop
auto	3.8369336484278946	0.0	discard	13_6_in_CIRCLE	Parallel run loop
auto	2.4007400073217737	0.0	discard	12_5_in_8	Parallel run loop
auto	5.384931350321754	0.0	discard	23_5_in_5	Parallel run loop
auto	7.160232969366078	0.0	discard	16_8_in_DOMINO	Parallel run loop
auto	4.138345713046154	0.0	discard	18_DOMINO_in_6	Parallel run loop
auto	3.759141572791398	0.0	discard	17_DOMINO_in_CIRCLE	Parallel run loop
auto	3.7683056475804717	0.0	discard	17_5_in_6	Parallel run loop
auto	8.102774853359481	0.0	discard	20_8_in_DOMINO	Parallel run loop
auto	2.803879883664299	0.0	discard	9_DOMINO_in_CIRCLE	Parallel run loop
auto	4.687371133225528	0.0	discard	23_DOMINO_in_6	Parallel run loop
auto	4.697834635053744	0.0	discard	19_5_in_DOMINO	Parallel run loop
auto	4.479815897501027	0.0	discard	24_5_in_6	Parallel run loop
auto	6.497991980936347	0.0	discard	11_8_in_5	Parallel run loop
auto	2.9559621946049712	0.0	discard	10_DOMINO_in_CIRCLE	Parallel run loop
auto	4.475245630635559	0.0	discard	15_6_in_6	Parallel run loop
auto	4.93123008521123	0.0	keep	29_5_in_6	Parallel run loop
auto	4.75127218611163	0.0	discard	10_8_in_CIRCLE	Parallel run loop
auto	5.790189669490146	0.0	discard	13_8_in_6	Parallel run loop
auto	4.490747745863403	0.0	discard	13_DOMINO_in_5	Parallel run loop
auto	4.8203042879733635	0.0	discard	20_5_in_DOMINO	Parallel run loop
auto	5.994170884047151	0.0	discard	9_8_in_5	Parallel run loop
auto	5.102893955208136	0.0	discard	20_8_in_8	Parallel run loop
auto	2.6915521371235593	0.0	discard	8_DOMINO_in_CIRCLE	Parallel run loop
auto	4.904537362780794	0.0	discard	21_5_in_DOMINO	Parallel run loop
auto	5.777467632032182	0.0	discard	26_8_in_8	Parallel run loop
auto	4.882630265799585	0.0	discard	19_DOMINO_in_DOMINO	Parallel run loop
auto	3.827281560659983	0.0	discard	11_DOMINO_in_DOMINO	Parallel run loop
auto	6.2478639807772485	0.0	discard	16_8_in_6	Parallel run loop
auto	4.558228051991228	0.0	discard	16_6_in_6	Parallel run loop
auto	5.663881359656193	0.0	discard	25_6_in_6	Parallel run loop
auto	4.569815862524372	0.0	discard	18_5_in_DOMINO	Parallel run loop
auto	6.3086008314667135	0.0	discard	10_8_in_5	Parallel run loop
auto	4.409839693042728	0.0	discard	17_5_in_DOMINO	Parallel run loop
auto	4.309862100185108	0.0	discard	16_5_in_DOMINO	Parallel run loop
auto	2.6447738834161796	0.0	discard	9_6_in_8	Parallel run loop
auto	7.812784092602333	0.0	discard	32_6_in_5	Parallel run loop
auto	6.0953254095291225	0.0	discard	19_8_in_CIRCLE	Parallel run loop
auto	5.8434126687983206	0.0	discard	20_6_in_DOMINO	Parallel run loop
auto	5.289064404639008	0.0	discard	30_DOMINO_in_6	Parallel run loop
auto	2.5069731037578142	0.0	discard	13_5_in_8	Parallel run loop
auto	5.949837118888085	0.0	discard	28_6_in_6	Parallel run loop
auto	6.700106835949054	0.0	discard	23_6_in_5	Parallel run loop
auto	5.693379391606711	0.0	discard	19_6_in_DOMINO	Parallel run loop
auto	5.6215705425904785	0.0	discard	25_5_in_5	Parallel run loop
auto	5.302443940088193	0.0	discard	22_5_in_5	Parallel run loop
auto	5.274913137695462	0.0	discard	29_DOMINO_in_6	Parallel run loop
auto	2.8900148954966616	0.0	discard	9_5_in_6	Parallel run loop
auto	4.733780902267363	0.0	discard	27_5_in_6	Parallel run loop
auto	4.931060305294061	0.0	keep	29_5_in_6	Parallel run loop
auto	4.768678162780872	0.0	discard	24_DOMINO_in_6	Parallel run loop
auto	3.2342712519580337	0.0	discard	12_DOMINO_in_CIRCLE	Parallel run loop
auto	5.012765064798198	0.0	discard	20_DOMINO_in_DOMINO	Parallel run loop
auto	3.9493073634468594	0.0	discard	11_6_in_6	Parallel run loop
auto	8.382506079934158	0.0	discard	22_8_in_DOMINO	Parallel run loop
auto	3.1860393694450497	0.0	discard	11_DOMINO_in_CIRCLE	Parallel run loop
auto	7.676416747555321	0.0	discard	31_6_in_5	Parallel run loop
auto	6.281350871924349	0.0	discard	20_6_in_5	Parallel run loop
auto	2.4007400073217737	0.0	discard	12_5_in_8	Parallel run loop
auto	7.160232969366078	0.0	discard	16_8_in_DOMINO	Parallel run loop
auto	3.8369336484278946	0.0	discard	13_6_in_CIRCLE	Parallel run loop
auto	5.384931350321754	0.0	discard	23_5_in_5	Parallel run loop
auto	2.803879883664299	0.0	discard	9_DOMINO_in_CIRCLE	Parallel run loop
auto	8.102774853359481	0.0	discard	20_8_in_DOMINO	Parallel run loop
auto	4.041819418389567	0.0	discard	18_DOMINO_in_6	Parallel run loop
auto	3.7683056475804717	0.0	discard	17_5_in_6	Parallel run loop
auto	3.759141572791398	0.0	discard	17_DOMINO_in_CIRCLE	Parallel run loop
auto	4.969037608288333	0.0	discard	26_DOMINO_in_6	Parallel run loop
auto	6.497991980936347	0.0	discard	11_8_in_5	Parallel run loop
auto	5.290122376213026	0.0	discard	30_DOMINO_in_6	Parallel run loop
auto	4.479815897501027	0.0	discard	24_5_in_6	Parallel run loop
auto	2.9559621946049712	0.0	discard	10_DOMINO_in_CIRCLE	Parallel run loop
auto	4.697834635053744	0.0	discard	19_5_in_DOMINO	Parallel run loop
auto	4.475245630635559	0.0	discard	15_6_in_6	Parallel run loop
auto	4.949545996694627	0.0	discard	25_DOMINO_in_6	Parallel run loop
auto	4.75127218611163	0.0	discard	10_8_in_CIRCLE	Parallel run loop
auto	5.102893955208136	0.0	discard	20_8_in_8	Parallel run loop
auto	5.790189669490146	0.0	discard	13_8_in_6	Parallel run loop
auto	4.8203042879733635	0.0	discard	20_5_in_DOMINO	Parallel run loop
auto	5.994170884047151	0.0	discard	9_8_in_5	Parallel run loop
auto	4.445840268404769	0.0	discard	13_DOMINO_in_5	Parallel run loop
auto	4.904537362780794	0.0	discard	21_5_in_DOMINO	Parallel run loop
auto	4.930903826040525	0.0	keep	29_5_in_6	Parallel run loop
auto	5.777467632032182	0.0	discard	26_8_in_8	Parallel run loop
auto	4.261661828253361	0.0	discard	19_DOMINO_in_6	Parallel run loop
auto	2.6915521371235593	0.0	discard	8_DOMINO_in_CIRCLE	Parallel run loop
auto	6.2478639807772485	0.0	discard	16_8_in_6	Parallel run loop
auto	4.960148968728546	0.0	discard	19_DOMINO_in_DOMINO	Parallel run loop
auto	4.558228051991228	0.0	discard	16_6_in_6	Parallel run loop
auto	5.663881359656193	0.0	discard	25_6_in_6	Parallel run loop
auto	4.569815862524372	0.0	discard	18_5_in_DOMINO	Parallel run loop
auto	3.827281560659983	0.0	discard	11_DOMINO_in_DOMINO	Parallel run loop
auto	6.3086008314667135	0.0	discard	10_8_in_5	Parallel run loop
auto	4.409839693042728	0.0	discard	17_5_in_DOMINO	Parallel run loop
auto	4.08040160721851	0.0	discard	18_DOMINO_in_6	Parallel run loop
auto	5.0240015174752815	0.0	discard	26_DOMINO_in_6	Parallel run loop
auto	2.6447738834161796	0.0	discard	9_6_in_8	Parallel run loop
auto	4.309862100185108	0.0	discard	16_5_in_DOMINO	Parallel run loop
auto	7.812784092602333	0.0	discard	32_6_in_5	Parallel run loop
auto	6.0953254095291225	0.0	discard	19_8_in_CIRCLE	Parallel run loop
auto	2.5069731037578142	0.0	discard	13_5_in_8	Parallel run loop
auto	6.700106835949054	0.0	discard	23_6_in_5	Parallel run loop
auto	5.8434126687983206	0.0	discard	20_6_in_DOMINO	Parallel run loop
auto	5.29541540932075	0.0	discard	30_DOMINO_in_6	Parallel run loop
auto	5.693379391606711	0.0	discard	19_6_in_DOMINO	Parallel run loop
auto	5.949837118888085	0.0	discard	28_6_in_6	Parallel run loop
auto	5.302443940088193	0.0	discard	22_5_in_5	Parallel run loop
auto	5.6215705425904785	0.0	discard	25_5_in_5	Parallel run loop
auto	2.8900148954966616	0.0	discard	9_5_in_6	Parallel run loop
auto	5.277023630547371	0.0	discard	29_DOMINO_in_6	Parallel run loop
auto	4.733780902267363	0.0	discard	27_5_in_6	Parallel run loop
auto	4.799777087817949	0.0	discard	24_DOMINO_in_6	Parallel run loop
auto	7.676416747555321	0.0	discard	31_6_in_5	Parallel run loop
auto	4.279171387308613	0.0	discard	19_DOMINO_in_6	Parallel run loop
auto	8.382506079934158	0.0	discard	22_8_in_DOMINO	Parallel run loop
auto	5.012765064798198	0.0	discard	20_DOMINO_in_DOMINO	Parallel run loop
auto	3.2342712519580337	0.0	discard	12_DOMINO_in_CIRCLE	Parallel run loop
auto	4.882630265799585	0.0	discard	19_DOMINO_in_DOMINO	Parallel run loop
