commit	score	memory_gb	status	problem	description
auto	2.723541365240401	0.0	discard	17_3_in_5	Parallel run loop
auto	5.882751995651736	0.0	discard	48_3_in_4	Parallel run loop
auto	4.1224090447026	0.0	discard	37_3_in_5	Parallel run loop
auto	3.28214483695474	0.0	discard	24_3_in_5	Parallel run loop
auto	5.42024606848092	0.0	discard	42_3_in_4	Parallel run loop
auto	4.120900618978455	0.0	discard	26_3_in_4	Parallel run loop
auto	5.6558043873455945	0.0	discard	45_3_in_4	Parallel run loop
auto	4.420651458171621	0.0	discard	30_3_in_4	Parallel run loop
auto	2.9679322722808794	0.0	discard	20_3_in_5	Parallel run loop
auto	3.8830095189943075	0.0	discard	33_3_in_5	Parallel run loop
auto	3.6252955178315855	0.0	discard	29_3_in_5	Parallel run loop
auto	4.836741378202467	0.0	discard	35_3_in_4	Parallel run loop
auto	2.281537039064641	0.0	discard	12_3_in_5	Parallel run loop
auto	3.210077067339119	0.0	discard	23_3_in_5	Parallel run loop
auto	2.0822264941748503	0.0	discard	10_3_in_5	Parallel run loop
auto	2.3761589487460775	0.0	discard	13_3_in_5	Parallel run loop
auto	5.137737105885086	0.0	discard	39_3_in_4	Parallel run loop
auto	4.67070588510787	0.0	discard	33_3_in_4	Parallel run loop
auto	1.9752539455750515	0.0	discard	9_3_in_5	Parallel run loop
auto	2.6364757202549027	0.0	keep	16_3_in_5	Parallel run loop
auto	3.8625635625046986	0.0	discard	23_3_in_4	Parallel run loop
auto	3.815872973622432	0.0	discard	32_3_in_5	Parallel run loop
auto	4.718823269093404	0.0	discard	46_3_in_5	Parallel run loop
auto	3.771055580537708	0.0	discard	22_3_in_4	Parallel run loop
auto	4.708662387201879	0.0	discard	45_3_in_5	Parallel run loop
auto	3.4922921078926272	0.0	discard	27_3_in_5	Parallel run loop
auto	3.7498213543586023	0.0	discard	31_3_in_5	Parallel run loop
auto	4.029691347701578	0.0	discard	25_3_in_4	Parallel run loop
auto	4.538863354151099	0.0	discard	43_3_in_5	Parallel run loop
auto	2.7241001914993745	0.0	discard	17_3_in_5	Parallel run loop
auto	4.062319170768994	0.0	discard	36_3_in_5	Parallel run loop
auto	4.353879639558532	0.0	discard	29_3_in_4	Parallel run loop
auto	4.592061881267662	0.0	discard	32_3_in_4	Parallel run loop
auto	4.122036418177843	0.0	discard	37_3_in_5	Parallel run loop
auto	5.831604596521761	0.0	discard	48_3_in_4	Parallel run loop
auto	4.199736722542713	0.0	discard	27_3_in_4	Parallel run loop
auto	3.69246747616373	0.0	discard	30_3_in_5	Parallel run loop
auto	2.55713506443138	0.0	discard	15_3_in_5	Parallel run loop
auto	2.9808685418642793	0.0	discard	20_3_in_5	Parallel run loop
auto	4.43754539360113	0.0	discard	30_3_in_4	Parallel run loop
auto	2.4707017170239247	0.0	discard	14_3_in_5	Parallel run loop
auto	1.6121374931758699	0.0	discard	6_3_in_5	Parallel run loop
auto	5.520706650533487	0.0	discard	45_3_in_4	Parallel run loop
auto	1.4735920530241908	0.0	discard	5_3_in_5	Parallel run loop
auto	4.50257233090988	0.0	discard	31_3_in_4	Parallel run loop
auto	4.66331298363442	0.0	discard	33_3_in_4	Parallel run loop
auto	5.1606309537543655	0.0	discard	39_3_in_4	Parallel run loop
auto	4.988256122491859	0.0	discard	37_3_in_4	Parallel run loop
auto	2.0821935876179465	0.0	discard	10_3_in_5	Parallel run loop
auto	3.6792626882271255	0.0	discard	21_3_in_4	Parallel run loop
auto	3.8198891014775516	0.0	discard	32_3_in_5	Parallel run loop
auto	5.503892009050083	0.0	discard	43_3_in_4	Parallel run loop
auto	2.6401737146431894	0.0	discard	16_3_in_5	Parallel run loop
auto	3.8647772956687594	0.0	discard	23_3_in_4	Parallel run loop
auto	4.754442724554937	0.0	discard	34_3_in_4	Parallel run loop
auto	4.728545349177508	0.0	discard	46_3_in_5	Parallel run loop
auto	3.5623477012030857	0.0	discard	20_3_in_4	Parallel run loop
auto	3.74266359672722	0.0	discard	31_3_in_5	Parallel run loop
auto	4.368092535273514	0.0	discard	41_3_in_5	Parallel run loop
auto	4.345057217919251	0.0	discard	29_3_in_4	Parallel run loop
auto	4.551425509209976	0.0	discard	43_3_in_5	Parallel run loop
auto	2.7222527783707493	0.0	discard	17_3_in_5	Parallel run loop
auto	4.034621471194984	0.0	discard	25_3_in_4	Parallel run loop
auto	3.1264447043189048	0.0	discard	22_3_in_5	Parallel run loop
auto	4.1219662668106265	0.0	discard	37_3_in_5	Parallel run loop
auto	5.775905156041312	0.0	discard	48_3_in_4	Parallel run loop
auto	4.059085827770061	0.0	discard	36_3_in_5	Parallel run loop
auto	4.201396177680254	0.0	discard	27_3_in_4	Parallel run loop
auto	3.0641163714927715	0.0	discard	21_3_in_5	Parallel run loop
auto	5.086680895007307	0.0	discard	50_3_in_5	Parallel run loop
auto	4.437957840433547	0.0	discard	30_3_in_4	Parallel run loop
auto	5.576003679685058	0.0	discard	44_3_in_4	Parallel run loop
auto	1.612334935277943	0.0	discard	6_3_in_5	Parallel run loop
auto	2.897568526878113	0.0	discard	19_3_in_5	Parallel run loop
auto	5.246174446160965	0.0	discard	40_3_in_4	Parallel run loop
auto	1.8622717181603263	0.0	discard	8_3_in_5	Parallel run loop
auto	4.516281827490098	0.0	discard	31_3_in_4	Parallel run loop
auto	5.20082418490838	0.0	keep	41_3_in_4	Parallel run loop
auto	4.998157855515855	0.0	discard	37_3_in_4	Parallel run loop
auto	2.1852989573785377	0.0	discard	11_3_in_5	Parallel run loop
auto	2.805009680466953	0.0	discard	18_3_in_5	Parallel run loop
auto	3.801198972521551	0.0	discard	32_3_in_5	Parallel run loop
auto	5.070846895365432	0.0	discard	38_3_in_4	Parallel run loop
auto	3.356830339806951	0.0	discard	25_3_in_5	Parallel run loop
auto	4.4907270370365415	0.0	discard	42_3_in_5	Parallel run loop
auto	2.6417597450643466	0.0	discard	16_3_in_5	Parallel run loop
auto	4.744853285258161	0.0	discard	46_3_in_5	Parallel run loop
auto	4.6391100925870585	0.0	discard	44_3_in_5	Parallel run loop
auto	3.588499938342344	0.0	discard	20_3_in_4	Parallel run loop
auto	2.7260966692409485	0.0	discard	17_3_in_5	Parallel run loop
auto	4.357276348439011	0.0	discard	41_3_in_5	Parallel run loop
auto	3.874416542794509	0.0	discard	33_3_in_5	Parallel run loop
auto	5.406199430074472	0.0	discard	42_3_in_4	Parallel run loop
auto	4.485809991227528	0.0	discard	43_3_in_5	Parallel run loop
auto	3.7317054446815034	0.0	discard	31_3_in_5	Parallel run loop
auto	3.127000658922162	0.0	discard	22_3_in_5	Parallel run loop
auto	4.097393593487989	0.0	keep	37_3_in_5	Parallel run loop
auto	4.056676055058181	0.0	discard	36_3_in_5	Parallel run loop
auto	3.389679239099029	0.0	discard	26_3_in_5	Parallel run loop
auto	4.825042646460126	0.0	discard	35_3_in_4	Parallel run loop
auto	3.9490592084064158	0.0	discard	24_3_in_4	Parallel run loop
auto	4.904891093643268	0.0	discard	48_3_in_5	Parallel run loop
auto	3.9449955161265993	0.0	discard	34_3_in_5	Parallel run loop
auto	1.9752436107930773	0.0	discard	9_3_in_5	Parallel run loop
auto	1.7415210060194886	0.0	discard	7_3_in_5	Parallel run loop
auto	3.213157356722755	0.0	discard	23_3_in_5	Parallel run loop
auto	1.862999418727561	0.0	discard	8_3_in_5	Parallel run loop
auto	2.1834884587707584	0.0	discard	11_3_in_5	Parallel run loop
auto	2.286362489025547	0.0	discard	12_3_in_5	Parallel run loop
auto	4.258330231192132	0.0	discard	39_3_in_5	Parallel run loop
auto	3.8234923184225993	0.0	discard	32_3_in_5	Parallel run loop
auto	3.770344991031697	0.0	discard	22_3_in_4	Parallel run loop
auto	2.8563788105010217	0.0	discard	13_3_in_4	Parallel run loop
auto	4.191977614348059	0.0	discard	38_3_in_5	Parallel run loop
auto	5.306176326611742	0.0	discard	41_3_in_4	Parallel run loop
auto	3.6851025404496145	0.0	discard	30_3_in_5	Parallel run loop
auto	2.4636051809928583	0.0	discard	14_3_in_5	Parallel run loop
auto	3.4953666351979678	0.0	discard	27_3_in_5	Parallel run loop
auto	2.558587550513895	0.0	discard	15_3_in_5	Parallel run loop
auto	1.4735927818955443	0.0	discard	5_3_in_5	Parallel run loop
auto	2.644831838924555	0.0	discard	16_3_in_5	Parallel run loop
auto	4.760693385365639	0.0	discard	46_3_in_5	Parallel run loop
auto	3.8740485293823657	0.0	discard	33_3_in_5	Parallel run loop
auto	5.429632121705751	0.0	discard	42_3_in_4	Parallel run loop
auto	3.125733510804021	0.0	discard	22_3_in_5	Parallel run loop
auto	4.524999539438165	0.0	discard	43_3_in_5	Parallel run loop
auto	4.407763928005299	0.0	discard	41_3_in_5	Parallel run loop
auto	3.7541734665708306	0.0	discard	31_3_in_5	Parallel run loop
auto	4.103566981965649	0.0	discard	37_3_in_5	Parallel run loop
auto	4.054004284694454	0.0	discard	36_3_in_5	Parallel run loop
auto	3.4116603398794765	0.0	discard	26_3_in_5	Parallel run loop
auto	4.013825462752092	0.0	discard	35_3_in_5	Parallel run loop
auto	4.786408121027798	0.0	keep	35_3_in_4	Parallel run loop
auto	4.2821757788740245	0.0	discard	28_3_in_4	Parallel run loop
auto	3.6771602180933503	0.0	discard	21_3_in_4	Parallel run loop
auto	3.2842524976787737	0.0	discard	24_3_in_5	Parallel run loop
auto	5.436597799609158	0.0	discard	43_3_in_4	Parallel run loop
auto	4.7539430406942875	0.0	discard	34_3_in_4	Parallel run loop
auto	5.854406961913515	0.0	discard	47_3_in_4	Parallel run loop
auto	2.183756331534564	0.0	discard	11_3_in_5	Parallel run loop
auto	3.0635640221410685	0.0	discard	21_3_in_5	Parallel run loop
auto	4.2717020786740525	0.0	discard	39_3_in_5	Parallel run loop
auto	2.8583781655534057	0.0	discard	13_3_in_4	Parallel run loop
auto	4.218383088547821	0.0	discard	38_3_in_5	Parallel run loop
auto	5.109319071919103	0.0	discard	50_3_in_5	Parallel run loop
auto	3.772072647708329	0.0	discard	22_3_in_4	Parallel run loop
auto	3.6892026662159823	0.0	discard	30_3_in_5	Parallel run loop
auto	5.309996556824351	0.0	discard	41_3_in_4	Parallel run loop
auto	4.817098517968115	0.0	discard	46_3_in_5	Parallel run loop
auto	2.6445042982447684	0.0	discard	16_3_in_5	Parallel run loop
auto	2.4661636224391983	0.0	discard	14_3_in_5	Parallel run loop
auto	2.884060979351459	0.0	discard	19_3_in_5	Parallel run loop
auto	5.211483859835936	0.0	discard	40_3_in_4	Parallel run loop
auto	5.581330650453053	0.0	discard	44_3_in_4	Parallel run loop
auto	3.876699085081123	0.0	discard	33_3_in_5	Parallel run loop
auto	3.129591844756036	0.0	discard	22_3_in_5	Parallel run loop
auto	5.753312181573567	0.0	discard	46_3_in_4	Parallel run loop
auto	4.401336787130617	0.0	discard	41_3_in_5	Parallel run loop
auto	4.1367287939507875	0.0	discard	37_3_in_5	Parallel run loop
auto	3.7493311659192665	0.0	discard	31_3_in_5	Parallel run loop
auto	4.460747298526124	0.0	discard	43_3_in_5	Parallel run loop
auto	3.402310687274142	0.0	discard	26_3_in_5	Parallel run loop
auto	4.0632443690574505	0.0	discard	36_3_in_5	Parallel run loop
auto	4.021945284824138	0.0	discard	35_3_in_5	Parallel run loop
auto	2.81376905497559	0.0	discard	18_3_in_5	Parallel run loop
auto	3.6768179979239344	0.0	discard	21_3_in_4	Parallel run loop
auto	5.488133303850226	0.0	discard	43_3_in_4	Parallel run loop
auto	4.812544956143762	0.0	discard	35_3_in_4	Parallel run loop
auto	4.513402744005318	0.0	discard	42_3_in_5	Parallel run loop
auto	3.3523827197842193	0.0	discard	25_3_in_5	Parallel run loop
auto	2.184224723917209	0.0	discard	11_3_in_5	Parallel run loop
auto	5.090203699497642	0.0	discard	38_3_in_4	Parallel run loop
auto	4.629760027579935	0.0	discard	44_3_in_5	Parallel run loop
auto	4.877386760747978	0.0	discard	47_3_in_5	Parallel run loop
auto	2.857727110056084	0.0	discard	13_3_in_4	Parallel run loop
auto	3.9540035571024084	0.0	discard	24_3_in_4	Parallel run loop
auto	5.298440653386618	0.0	discard	41_3_in_4	Parallel run loop
auto	2.468511066805074	0.0	discard	14_3_in_5	Parallel run loop
auto	4.9404894491967974	0.0	discard	48_3_in_5	Parallel run loop
auto	1.9747800153538626	0.0	discard	9_3_in_5	Parallel run loop
auto	2.0824565036273626	0.0	discard	10_3_in_5	Parallel run loop
auto	1.7415209837890295	0.0	discard	7_3_in_5	Parallel run loop
auto	3.9517335767444055	0.0	discard	34_3_in_5	Parallel run loop
auto	2.283166255770938	0.0	discard	12_3_in_5	Parallel run loop
auto	3.4894628791485407	0.0	discard	27_3_in_5	Parallel run loop
auto	4.428207637707449	0.0	discard	41_3_in_5	Parallel run loop
auto	3.8522973638198255	0.0	discard	23_3_in_4	Parallel run loop
auto	3.1989438154116927	0.0	discard	23_3_in_5	Parallel run loop
auto	3.132903751608343	0.0	discard	22_3_in_5	Parallel run loop
auto	5.083545339704124	0.0	discard	39_3_in_4	Parallel run loop
auto	3.609788619078422	0.0	discard	29_3_in_5	Parallel run loop
auto	3.754882873050317	0.0	discard	31_3_in_5	Parallel run loop
auto	4.185211303247267	0.0	discard	27_3_in_4	Parallel run loop
auto	4.4525473200192005	0.0	discard	43_3_in_5	Parallel run loop
auto	3.421452771625277	0.0	discard	26_3_in_5	Parallel run loop
auto	2.7989584550038944	0.0	discard	18_3_in_5	Parallel run loop
auto	3.3916526973204264	0.0	discard	18_3_in_4	Parallel run loop
auto	4.825042646460126	0.0	discard	35_3_in_4	Parallel run loop
auto	5.411424973068337	0.0	discard	43_3_in_4	Parallel run loop
auto	1.6123349291708902	0.0	discard	6_3_in_5	Parallel run loop
auto	3.5618705635938457	0.0	discard	28_3_in_5	Parallel run loop
auto	3.6789251030267742	0.0	discard	21_3_in_4	Parallel run loop
auto	4.5140546394736365	0.0	discard	31_3_in_4	Parallel run loop
auto	5.35898266463525	0.0	discard	41_3_in_4	Parallel run loop
auto	4.734780618249769	0.0	discard	45_3_in_5	Parallel run loop
auto	2.5583652024985226	0.0	discard	15_3_in_5	Parallel run loop
auto	2.184005442365929	0.0	discard	11_3_in_5	Parallel run loop
auto	4.282472286465101	0.0	discard	28_3_in_4	Parallel run loop
auto	1.4723575133800673	0.0	discard	5_3_in_5	Parallel run loop
auto	3.2727291003151207	0.0	discard	24_3_in_5	Parallel run loop
auto	5.014169378273553	0.0	discard	37_3_in_4	Parallel run loop
auto	2.281670347519425	0.0	discard	12_3_in_5	Parallel run loop
auto	5.029698568659449	0.0	discard	49_3_in_5	Parallel run loop
auto	3.5798978313342906	0.0	discard	20_3_in_4	Parallel run loop
auto	4.755613952749212	0.0	discard	34_3_in_4	Parallel run loop
auto	1.9747823360656096	0.0	discard	9_3_in_5	Parallel run loop
auto	2.9747731846989303	0.0	discard	20_3_in_5	Parallel run loop
auto	5.1449547287533015	0.0	discard	39_3_in_4	Parallel run loop
auto	4.346358603081047	0.0	discard	40_3_in_5	Parallel run loop
auto	3.17430864953989	0.0	keep	23_3_in_5	Parallel run loop
auto	3.6063182120772512	0.0	discard	29_3_in_5	Parallel run loop
auto	3.4701653358347895	0.0	discard	19_3_in_4	Parallel run loop
auto	5.613712984120503	0.0	discard	47_3_in_4	Parallel run loop
auto	3.0378737353615266	0.0	keep	21_3_in_5	Parallel run loop
auto	4.18602247756902	0.0	discard	27_3_in_4	Parallel run loop
auto	4.4814326907663125	0.0	discard	43_3_in_5	Parallel run loop
auto	4.827465822132832	0.0	keep	50_3_in_5	Parallel run loop
auto	2.8034430522960196	0.0	discard	18_3_in_5	Parallel run loop
auto	5.580378387007341	0.0	discard	44_3_in_4	Parallel run loop
auto	4.833689083243277	0.0	discard	35_3_in_4	Parallel run loop
auto	5.49389035984852	0.0	discard	43_3_in_4	Parallel run loop
auto	1.612334934560841	0.0	discard	6_3_in_5	Parallel run loop
auto	3.6764433040410878	0.0	discard	21_3_in_4	Parallel run loop
auto	2.1841054036999856	0.0	discard	11_3_in_5	Parallel run loop
auto	4.509897231007021	0.0	discard	31_3_in_4	Parallel run loop
auto	5.239639218819974	0.0	discard	40_3_in_4	Parallel run loop
auto	2.875106171137398	0.0	keep	19_3_in_5	Parallel run loop
auto	5.742503649259582	0.0	discard	46_3_in_4	Parallel run loop
auto	4.906896070612719	0.0	discard	36_3_in_4	Parallel run loop
auto	4.278539795983793	0.0	discard	28_3_in_4	Parallel run loop
auto	1.473317262746351	0.0	discard	5_3_in_5	Parallel run loop
auto	4.1210946601328065	0.0	discard	26_3_in_4	Parallel run loop
auto	3.2878624754015706	0.0	discard	24_3_in_5	Parallel run loop
auto	1.9746332707880587	0.0	discard	9_3_in_5	Parallel run loop
auto	3.5742956682746767	0.0	discard	20_3_in_4	Parallel run loop
auto	2.281826533696073	0.0	discard	12_3_in_5	Parallel run loop
auto	3.345596146790883	0.0	discard	25_3_in_5	Parallel run loop
auto	4.437376086504897	0.0	discard	42_3_in_5	Parallel run loop
auto	2.965994032290814	0.0	discard	20_3_in_5	Parallel run loop
auto	3.043737017819285	0.0	discard	21_3_in_5	Parallel run loop
auto	4.995431706016797	0.0	discard	38_3_in_4	Parallel run loop
auto	5.0643290463908635	0.0	discard	39_3_in_4	Parallel run loop
auto	3.203723821516042	0.0	discard	23_3_in_5	Parallel run loop
auto	1.8622704397523455	0.0	discard	8_3_in_5	Parallel run loop
auto	3.616977196845869	0.0	discard	29_3_in_5	Parallel run loop
auto	5.763590091884262	0.0	discard	47_3_in_4	Parallel run loop
auto	4.1978121397642125	0.0	discard	27_3_in_4	Parallel run loop
auto	4.525283117136912	0.0	discard	43_3_in_5	Parallel run loop
auto	4.831369947193028	0.0	discard	50_3_in_5	Parallel run loop
auto	4.363736517891098	0.0	discard	29_3_in_4	Parallel run loop
auto	2.824418696677031	0.0	discard	18_3_in_5	Parallel run loop
auto	1.6127718377692226	0.0	discard	6_3_in_5	Parallel run loop
auto	4.5214004433256205	0.0	discard	31_3_in_4	Parallel run loop
auto	3.686134887923182	0.0	discard	21_3_in_4	Parallel run loop
auto	5.950556431427995	0.0	discard	48_3_in_4	Parallel run loop
auto	5.475774995696977	0.0	discard	43_3_in_4	Parallel run loop
auto	4.648141742003517	0.0	discard	44_3_in_5	Parallel run loop
auto	5.332129008727798	0.0	discard	42_3_in_4	Parallel run loop
auto	2.9057732274770594	0.0	discard	19_3_in_5	Parallel run loop
auto	1.4723588131741439	0.0	discard	5_3_in_5	Parallel run loop
auto	4.958684430029658	0.0	discard	48_3_in_5	Parallel run loop
auto	4.874620567782788	0.0	discard	47_3_in_5	Parallel run loop
auto	3.936134222342684	0.0	discard	24_3_in_4	Parallel run loop
auto	3.5883725424892767	0.0	discard	20_3_in_4	Parallel run loop
auto	4.508673142459209	0.0	discard	42_3_in_5	Parallel run loop
auto	1.9752427764076739	0.0	discard	9_3_in_5	Parallel run loop
auto	2.3765979384137963	0.0	discard	13_3_in_5	Parallel run loop
auto	3.9204292505234863	0.0	keep	34_3_in_5	Parallel run loop
auto	3.345805389175443	0.0	discard	25_3_in_5	Parallel run loop
auto	2.082216799429422	0.0	discard	10_3_in_5	Parallel run loop
auto	1.7416417628942873	0.0	discard	7_3_in_5	Parallel run loop
auto	3.045446244181504	0.0	discard	21_3_in_5	Parallel run loop
auto	1.8630002233983514	0.0	discard	8_3_in_5	Parallel run loop
auto	3.192640668319722	0.0	discard	23_3_in_5	Parallel run loop
auto	5.089682329317998	0.0	discard	38_3_in_4	Parallel run loop
auto	5.070179943771921	0.0	discard	39_3_in_4	Parallel run loop
auto	3.6184306288974524	0.0	discard	29_3_in_5	Parallel run loop
auto	4.178351413740284	0.0	discard	27_3_in_4	Parallel run loop
auto	4.55679907492865	0.0	keep	32_3_in_4	Parallel run loop
auto	5.744275815506249	0.0	discard	47_3_in_4	Parallel run loop
auto	4.878538891926604	0.0	discard	50_3_in_5	Parallel run loop
auto	4.202771622927029	0.0	discard	38_3_in_5	Parallel run loop
auto	3.4928534191879725	0.0	discard	27_3_in_5	Parallel run loop
auto	3.861418606978172	0.0	discard	23_3_in_4	Parallel run loop
auto	4.275962589457088	0.0	discard	39_3_in_5	Parallel run loop
auto	3.7760625350824433	0.0	discard	22_3_in_4	Parallel run loop
auto	3.3742178977129553	0.0	discard	18_3_in_4	Parallel run loop
auto	5.425819399095981	0.0	discard	42_3_in_4	Parallel run loop
auto	3.6925972599640935	0.0	discard	30_3_in_5	Parallel run loop
auto	3.9513947722725002	0.0	discard	34_3_in_5	Parallel run loop
auto	3.5375540596121873	0.0	keep	28_3_in_5	Parallel run loop
auto	1.4735930649226727	0.0	discard	5_3_in_5	Parallel run loop
auto	3.923183522171839	0.0	keep	24_3_in_4	Parallel run loop
auto	2.558331730909843	0.0	discard	15_3_in_5	Parallel run loop
auto	4.689279261767693	0.0	discard	45_3_in_5	Parallel run loop
auto	4.017482723025274	0.0	discard	35_3_in_5	Parallel run loop
auto	3.3567212706415885	0.0	discard	25_3_in_5	Parallel run loop
auto	4.875032141896831	0.0	discard	49_3_in_5	Parallel run loop
auto	1.9748009314644197	0.0	discard	9_3_in_5	Parallel run loop
auto	4.980129074188304	0.0	discard	37_3_in_4	Parallel run loop
auto	4.427418616623124	0.0	discard	30_3_in_4	Parallel run loop
auto	3.0403579994685326	0.0	discard	21_3_in_5	Parallel run loop
auto	3.6159351113362592	0.0	discard	29_3_in_5	Parallel run loop
auto	4.756474332876029	0.0	discard	34_3_in_4	Parallel run loop
auto	4.337158486578315	0.0	discard	40_3_in_5	Parallel run loop
auto	3.210682018129271	0.0	discard	23_3_in_5	Parallel run loop
auto	5.1314654563451185	0.0	discard	39_3_in_4	Parallel run loop
auto	3.4818029375856137	0.0	discard	19_3_in_4	Parallel run loop
auto	5.537664335364328	0.0	discard	44_3_in_4	Parallel run loop
auto	4.190233316441765	0.0	discard	27_3_in_4	Parallel run loop
auto	4.589448080295156	0.0	discard	32_3_in_4	Parallel run loop
auto	5.733809856613445	0.0	discard	47_3_in_4	Parallel run loop
auto	4.915997764851156	0.0	discard	50_3_in_5	Parallel run loop
auto	5.2195097425837504	0.0	discard	40_3_in_4	Parallel run loop
auto	3.4772605786429898	0.0	keep	27_3_in_5	Parallel run loop
auto	4.914325519018829	0.0	discard	36_3_in_4	Parallel run loop
auto	3.8600711558804344	0.0	discard	23_3_in_4	Parallel run loop
auto	4.20704239517602	0.0	discard	38_3_in_5	Parallel run loop
auto	5.712682894330071	0.0	discard	46_3_in_4	Parallel run loop
auto	4.675524555480416	0.0	discard	33_3_in_4	Parallel run loop
auto	3.3891140389720538	0.0	discard	18_3_in_4	Parallel run loop
auto	3.9513947722725002	0.0	discard	34_3_in_5	Parallel run loop
auto	3.5602715267535716	0.0	discard	28_3_in_5	Parallel run loop
auto	3.953178737838389	0.0	discard	24_3_in_4	Parallel run loop
auto	3.355625795506373	0.0	discard	25_3_in_5	Parallel run loop
auto	5.7015861808794295	0.0	discard	45_3_in_4	Parallel run loop
auto	4.622926771052484	0.0	discard	44_3_in_5	Parallel run loop
auto	4.106269703647864	0.0	discard	26_3_in_4	Parallel run loop
auto	4.441287105031934	0.0	discard	30_3_in_4	Parallel run loop
auto	5.943418243793153	0.0	discard	48_3_in_4	Parallel run loop
auto	4.9451009829062835	0.0	discard	37_3_in_4	Parallel run loop
auto	4.362371508893879	0.0	discard	29_3_in_4	Parallel run loop
auto	5.001316825720253	0.0	discard	49_3_in_5	Parallel run loop
auto	3.871775837265246	0.0	discard	33_3_in_5	Parallel run loop
auto	4.777046714325332	0.0	discard	47_3_in_5	Parallel run loop
auto	2.0827425772235286	0.0	discard	10_3_in_5	Parallel run loop
auto	3.0402879790103485	0.0	discard	21_3_in_5	Parallel run loop
