commit	score	memory_gb	status	problem	description
auto	2.342820092199945	0.0	discard	27_3_in_6	Parallel run loop
auto	4.003926127064279	0.0	discard	23_4_in_5	Parallel run loop
auto	4.2273333554472865	0.0	discard	26_4_in_5	Parallel run loop
auto	9.05095472197593e-15	0.0	discard	1_8_in_3	Parallel run loop
auto	0.9892995737546343	0.0	discard	3_3_in_6	Parallel run loop
auto	3.075302695713595	0.0	discard	38_4_in_8	Parallel run loop
auto	4.5041733168589975	0.0	discard	29_4_in_5	Parallel run loop
auto	9.656856919367272	0.0	keep	16_8_in_4	Parallel run loop
auto	0.7365398902319754	0.0	discard	3_3_in_8	Parallel run loop
auto	3.8504539070806487	0.0	discard	32_4_in_6	Parallel run loop
auto	5.141255845444521	0.0	discard	39_4_in_5	Parallel run loop
auto	4.93336431580044	0.0	keep	36_4_in_5	Parallel run loop
auto	4.624846322901251	0.0	discard	31_4_in_5	Parallel run loop
auto	4.171095203880236	0.0	discard	25_4_in_5	Parallel run loop
auto	1.0560227379123676e-11	0.0	discard	1_8_in_8	Parallel run loop
auto	2.460083736734749	0.0	discard	31_3_in_6	Parallel run loop
auto	2.7920684388920995	0.0	discard	31_4_in_8	Parallel run loop
auto	2.9415702674679713	0.0	discard	36_4_in_8	Parallel run loop
auto	2.645708458553609	0.0	discard	28_4_in_8	Parallel run loop
auto	2.947442396851262	0.0	discard	4_6_in_DOMINO	Parallel run loop
auto	3.9799000189504725	0.0	discard	4_8_in_DOMINO	Parallel run loop
auto	0.7773356176027824	0.0	discard	4_3_in_8	Parallel run loop
auto	1.6112060500153396	0.0	discard	3_6_in_8	Parallel run loop
auto	2.8995093740800026	0.0	keep	34_4_in_8	Parallel run loop
auto	1.0294375004178038	0.0	discard	3_4_in_8	Parallel run loop
auto	3.7920887451353718	0.0	discard	31_4_in_6	Parallel run loop
auto	4.828982827603958	0.0	discard	34_4_in_5	Parallel run loop
auto	2.936661319786652	0.0	keep	19_4_in_6	Parallel run loop
auto	3.749785714080873	0.0	discard	3_8_in_5	Parallel run loop
auto	4.202388486768133	0.0	discard	38_4_in_6	Parallel run loop
auto	2.7477838008179085	0.0	discard	3_6_in_5	Parallel run loop
auto	1.8333584779613132	0.0	discard	17_3_in_6	Parallel run loop
auto	4.438082017691727	0.0	discard	28_4_in_5	Parallel run loop
auto	1.895877731964159	0.0	discard	18_3_in_6	Parallel run loop
auto	9.932984586741902	0.0	discard	18_DOMINO_in_3	Parallel run loop
auto	2.000025568006337	0.0	discard	21_3_in_6	Parallel run loop
auto	10.310305194130006	0.0	discard	19_DOMINO_in_3	Parallel run loop
auto	3.080877833871798	0.0	discard	38_4_in_8	Parallel run loop
auto	0.9892996509203482	0.0	discard	3_3_in_6	Parallel run loop
auto	1.5442374671963693e-15	0.0	discard	1_8_in_3	Parallel run loop
auto	1.3660308937496013	0.0	discard	3_4_in_6	Parallel run loop
auto	4.124432280848681	0.0	discard	24_4_in_5	Parallel run loop
auto	0.7365400143333446	0.0	discard	3_3_in_8	Parallel run loop
auto	2.716111370352478	0.0	discard	3_8_in_CIRCLE	Parallel run loop
auto	2.3323071423345585	0.0	discard	27_3_in_6	Parallel run loop
auto	3.718042938602991	0.0	discard	30_4_in_6	Parallel run loop
auto	4.514335845140007	0.0	discard	29_4_in_5	Parallel run loop
auto	2.1715732346593764	0.0	discard	3_8_in_8	Parallel run loop
auto	1.9885360422333582	0.0	discard	20_3_in_6	Parallel run loop
auto	3.845764502478891	0.0	discard	32_4_in_6	Parallel run loop
auto	4.22696487037854	0.0	discard	26_4_in_5	Parallel run loop
auto	9.656914959980716	0.0	discard	16_8_in_4	Parallel run loop
auto	2.489980238436128	0.0	discard	31_3_in_6	Parallel run loop
auto	2.899647498378216	0.0	discard	34_4_in_8	Parallel run loop
auto	1.847872734926823e-18	0.0	keep	1_8_in_8	Parallel run loop
auto	4.8289001946664785	0.0	discard	34_4_in_5	Parallel run loop
auto	4.167994950797684	0.0	discard	25_4_in_5	Parallel run loop
auto	5.138263199329405	0.0	keep	39_4_in_5	Parallel run loop
auto	1.9766904220053136	0.0	discard	4_5_in_6	Parallel run loop
auto	2.947442396851262	0.0	discard	4_6_in_DOMINO	Parallel run loop
auto	3.9799000189504725	0.0	discard	4_8_in_DOMINO	Parallel run loop
auto	4.624846322901251	0.0	discard	31_4_in_5	Parallel run loop
auto	4.942993068846421	0.0	discard	36_4_in_5	Parallel run loop
auto	2.9415702674679713	0.0	discard	36_4_in_8	Parallel run loop
auto	2.655306733809377	0.0	discard	28_4_in_8	Parallel run loop
auto	1.0294375004178038	0.0	discard	3_4_in_8	Parallel run loop
auto	0.7773356176027824	0.0	discard	4_3_in_8	Parallel run loop
auto	1.5740009890436293	0.0	discard	8_4_in_8	Parallel run loop
auto	7.0356339305232325	0.0	discard	7_8_in_4	Parallel run loop
auto	1.3660308937496013	0.0	discard	3_4_in_6	Parallel run loop
auto	1.9999849727272947	0.0	keep	21_3_in_6	Parallel run loop
auto	2.565465019682941	0.0	discard	8_4_in_5	Parallel run loop
auto	8.242666811584183	0.0	keep	10_8_in_4	Parallel run loop
auto	8.333389649076475	0.0	keep	8_6_in_3	Parallel run loop
auto	0.9892996509203482	0.0	discard	3_3_in_6	Parallel run loop
auto	3.0206074905084366	0.0	discard	38_4_in_8	Parallel run loop
auto	2.936612598038689	0.0	keep	19_4_in_6	Parallel run loop
auto	1.436906765561975	0.0	discard	7_4_in_8	Parallel run loop
auto	1.0699499329298534e-12	0.0	discard	1_8_in_3	Parallel run loop
auto	8.192344762771517	0.0	discard	12_5_in_3	Parallel run loop
auto	0.8036669940717013	0.0	discard	5_3_in_8	Parallel run loop
auto	6.51138217823979	0.0	discard	6_8_in_4	Parallel run loop
auto	3.549056332511809	0.0	discard	5_5_in_4	Parallel run loop
auto	9.932504026696751	0.0	discard	18_DOMINO_in_3	Parallel run loop
auto	8.77683541685548e-09	0.0	discard	1_8_in_8	Parallel run loop
auto	2.6940226533661047	0.0	discard	9_4_in_5	Parallel run loop
auto	1.6817603190706747	0.0	discard	10_4_in_8	Parallel run loop
auto	9.583130624808957	0.0	discard	17_5_in_3	Parallel run loop
auto	0.7365397586108993	0.0	discard	3_3_in_8	Parallel run loop
auto	5.147240124520687	0.0	discard	39_4_in_5	Parallel run loop
auto	1.9766904220053136	0.0	discard	4_5_in_6	Parallel run loop
auto	0.9245400229687899	0.0	discard	7_3_in_8	Parallel run loop
auto	2.716111370352478	0.0	discard	3_8_in_CIRCLE	Parallel run loop
auto	1.9903881974501638	0.0	discard	20_3_in_6	Parallel run loop
auto	2.478255913611304	0.0	discard	31_3_in_6	Parallel run loop
auto	1.4343288179215334	0.0	discard	9_3_in_6	Parallel run loop
auto	2.947442396851262	0.0	discard	4_6_in_DOMINO	Parallel run loop
auto	14.042747240691119	0.0	discard	13_8_in_3	Parallel run loop
auto	8.378156622559946	0.0	keep	13_5_in_3	Parallel run loop
auto	4.906674282171963	0.0	discard	10_5_in_4	Parallel run loop
auto	3.9799000189504725	0.0	discard	4_8_in_DOMINO	Parallel run loop
auto	2.1715732346593764	0.0	discard	3_8_in_8	Parallel run loop
auto	2.3323071423345585	0.0	discard	27_3_in_6	Parallel run loop
auto	1.3660308937496013	0.0	discard	3_4_in_6	Parallel run loop
auto	0.7773356176027824	0.0	discard	4_3_in_8	Parallel run loop
auto	7.035615131303261	0.0	discard	7_8_in_4	Parallel run loop
auto	8.242735002536309	0.0	discard	10_8_in_4	Parallel run loop
auto	2.931925434374192	0.0	discard	36_4_in_8	Parallel run loop
auto	8.333536267671072	0.0	discard	8_6_in_3	Parallel run loop
auto	1.9833282766528608	0.0	discard	14_4_in_8	Parallel run loop
auto	1.0294375004178038	0.0	discard	3_4_in_8	Parallel run loop
auto	10.289748499654928	0.0	discard	13_6_in_3	Parallel run loop
auto	1.9999133994884375	0.0	keep	21_3_in_6	Parallel run loop
auto	4.942795225197669	0.0	discard	36_4_in_5	Parallel run loop
auto	1.5740009890436293	0.0	discard	8_4_in_8	Parallel run loop
auto	5.904858111418961	0.0	discard	15_5_in_4	Parallel run loop
auto	0.9892996887000588	0.0	discard	3_3_in_6	Parallel run loop
auto	3.030176589100015e-11	0.0	discard	1_8_in_8	Parallel run loop
auto	6.511438022198529	0.0	discard	6_8_in_4	Parallel run loop
auto	2.1552824900461513e-11	0.0	discard	1_8_in_3	Parallel run loop
auto	2.716111370352478	0.0	discard	3_8_in_CIRCLE	Parallel run loop
auto	0.7365399711761157	0.0	discard	3_3_in_8	Parallel run loop
auto	9.785646148055216	0.0	discard	18_5_in_3	Parallel run loop
auto	9.581576592877832	0.0	discard	17_5_in_3	Parallel run loop
auto	1.4369086085940732	0.0	discard	7_4_in_8	Parallel run loop
auto	2.947442396851262	0.0	discard	4_6_in_DOMINO	Parallel run loop
auto	2.6941044292034655	0.0	discard	9_4_in_5	Parallel run loop
auto	1.199372614553753	0.0	discard	12_3_in_8	Parallel run loop
auto	2.9368631837060795	0.0	discard	19_4_in_6	Parallel run loop
auto	1.9766904220053136	0.0	discard	4_5_in_6	Parallel run loop
auto	1.3660308937496013	0.0	discard	3_4_in_6	Parallel run loop
auto	1.6817805984017322	0.0	discard	10_4_in_8	Parallel run loop
auto	9.199760189101676	0.0	keep	13_8_in_4	Parallel run loop
auto	0.9245400229687899	0.0	discard	7_3_in_8	Parallel run loop
auto	3.9799000189504725	0.0	discard	4_8_in_DOMINO	Parallel run loop
auto	0.8036669940717013	0.0	discard	5_3_in_8	Parallel run loop
auto	1.8970788835167214	0.0	discard	13_4_in_8	Parallel run loop
auto	8.19227586907001	0.0	discard	12_5_in_3	Parallel run loop
auto	5.2324576989547	0.0	discard	12_5_in_4	Parallel run loop
auto	8.378604027727887	0.0	discard	13_5_in_3	Parallel run loop
auto	14.043435996477715	0.0	discard	13_8_in_3	Parallel run loop
auto	1.0294375004178038	0.0	discard	3_4_in_8	Parallel run loop
auto	8.242726706535532	0.0	discard	10_8_in_4	Parallel run loop
auto	0.7773356176027824	0.0	discard	4_3_in_8	Parallel run loop
auto	1.4343288179215334	0.0	discard	9_3_in_6	Parallel run loop
auto	7.0356339305232325	0.0	discard	7_8_in_4	Parallel run loop
auto	2.5001671866614767	0.0	discard	31_3_in_6	Parallel run loop
auto	2.1715732346593764	0.0	discard	3_8_in_8	Parallel run loop
auto	6.245963927513365	0.0	discard	17_5_in_4	Parallel run loop
auto	4.906096228830717	0.0	keep	10_5_in_4	Parallel run loop
auto	1.9833436764812669	0.0	discard	14_4_in_8	Parallel run loop
auto	10.996625281153994	0.0	discard	23_5_in_3	Parallel run loop
auto	10.288879034621122	0.0	keep	13_6_in_3	Parallel run loop
auto	8.333350814977559	0.0	keep	8_6_in_3	Parallel run loop
auto	0.7365398902319754	0.0	discard	3_3_in_8	Parallel run loop
auto	2.7297217831938273e-08	0.0	discard	1_8_in_3	Parallel run loop
auto	2.6942419520985865	0.0	discard	9_4_in_5	Parallel run loop
auto	3.479411307571736	0.0	discard	16_4_in_5	Parallel run loop
auto	1.5740009890436293	0.0	discard	8_4_in_8	Parallel run loop
auto	7.04952610508139	0.0	discard	22_5_in_4	Parallel run loop
auto	3.1749409878611337	0.0	discard	20_4_in_6	Parallel run loop
auto	9.583477245712984	0.0	discard	17_5_in_3	Parallel run loop
auto	4.914334992375877	0.0	discard	9_DOMINO_in_4	Parallel run loop
auto	9.785646148055216	0.0	discard	18_5_in_3	Parallel run loop
auto	2.7161114801421262	0.0	discard	3_8_in_CIRCLE	Parallel run loop
auto	1.4369065696866217	0.0	discard	7_4_in_8	Parallel run loop
auto	2.947442396851262	0.0	discard	4_6_in_DOMINO	Parallel run loop
auto	1.1994139568171645	0.0	discard	12_3_in_8	Parallel run loop
auto	2.000046990370826	0.0	discard	21_3_in_6	Parallel run loop
auto	0.9245400229687899	0.0	discard	7_3_in_8	Parallel run loop
auto	1.8971544193236975	0.0	discard	13_4_in_8	Parallel run loop
auto	6.341187219681199	0.0	discard	18_5_in_4	Parallel run loop
auto	8.192352910018652	0.0	discard	12_5_in_3	Parallel run loop
auto	5.2324576989547	0.0	discard	12_5_in_4	Parallel run loop
auto	0.8036669940717013	0.0	discard	5_3_in_8	Parallel run loop
auto	1.6817603190706747	0.0	discard	10_4_in_8	Parallel run loop
auto	3.9799000189504725	0.0	discard	4_8_in_DOMINO	Parallel run loop
auto	1.0294375004178038	0.0	discard	3_4_in_8	Parallel run loop
auto	8.378731213157199	0.0	discard	13_5_in_3	Parallel run loop
auto	1.9766904220053136	0.0	discard	4_5_in_6	Parallel run loop
auto	1.3660308937496013	0.0	discard	3_4_in_6	Parallel run loop
auto	9.200010267514541	0.0	discard	13_8_in_4	Parallel run loop
auto	2.47859367656441	0.0	discard	23_4_in_8	Parallel run loop
auto	11.339293437634941	0.0	discard	25_5_in_3	Parallel run loop
auto	2.17157402403434	0.0	discard	3_8_in_8	Parallel run loop
auto	14.042758537775752	0.0	discard	13_8_in_3	Parallel run loop
auto	8.333394745232535	0.0	discard	8_6_in_3	Parallel run loop
auto	3.54177571299376	0.0	discard	17_4_in_5	Parallel run loop
auto	3.479411307571736	0.0	discard	16_4_in_5	Parallel run loop
auto	0.7773356176027824	0.0	discard	4_3_in_8	Parallel run loop
auto	11.110439200692014	0.0	discard	20_8_in_4	Parallel run loop
auto	8.242726706535532	0.0	discard	10_8_in_4	Parallel run loop
auto	7.457099311805799	0.0	discard	25_5_in_4	Parallel run loop
auto	7.0356339305232325	0.0	discard	7_8_in_4	Parallel run loop
auto	4.906995409297185	0.0	discard	10_5_in_4	Parallel run loop
auto	10.288910091074099	0.0	discard	13_6_in_3	Parallel run loop
auto	1.5740009890436293	0.0	discard	8_4_in_8	Parallel run loop
auto	1.4343288179215334	0.0	discard	9_3_in_6	Parallel run loop
auto	0.7365397586108993	0.0	discard	3_3_in_8	Parallel run loop
auto	2.4210248843735687	0.0	discard	22_4_in_8	Parallel run loop
auto	10.995361391061724	0.0	keep	23_5_in_3	Parallel run loop
auto	7.045725797328264	0.0	discard	22_5_in_4	Parallel run loop
auto	1.4369076315702392	0.0	discard	7_4_in_8	Parallel run loop
auto	6.330387427375083	0.0	discard	18_5_in_4	Parallel run loop
auto	3.165543618305243	0.0	discard	20_4_in_6	Parallel run loop
auto	9.789767129433292	0.0	discard	18_5_in_3	Parallel run loop
auto	1.0087152127696104	0.0	discard	9_3_in_8	Parallel run loop
auto	3.626045515105249	0.0	keep	18_4_in_5	Parallel run loop
auto	8.320783436833434	0.0	discard	12_DOMINO_in_3	Parallel run loop
auto	16.74508145517827	0.0	discard	20_8_in_3	Parallel run loop
auto	15.493598578141688	0.0	discard	32_6_in_3	Parallel run loop
auto	0.9245400229687899	0.0	discard	7_3_in_8	Parallel run loop
auto	11.806491899045287	0.0	discard	10_8_in_3	Parallel run loop
auto	8.694994058837256	0.0	discard	15_5_in_3	Parallel run loop
auto	0.8036669940717013	0.0	discard	5_3_in_8	Parallel run loop
auto	1.9766907913676464	0.0	discard	4_5_in_6	Parallel run loop
auto	8.334571071193249	0.0	discard	8_6_in_3	Parallel run loop
auto	0.7773356176027824	0.0	discard	4_3_in_8	Parallel run loop
auto	5.232390394171094	0.0	discard	12_5_in_4	Parallel run loop
auto	1.681830849177438	0.0	discard	10_4_in_8	Parallel run loop
auto	9.656914959980716	0.0	discard	16_8_in_4	Parallel run loop
auto	3.542289322549211	0.0	discard	17_4_in_5	Parallel run loop
auto	11.110439200692014	0.0	discard	20_8_in_4	Parallel run loop
auto	11.34674382256974	0.0	discard	25_5_in_3	Parallel run loop
auto	10.313745474344415	0.0	discard	19_DOMINO_in_3	Parallel run loop
auto	8.191195265606687	0.0	keep	12_5_in_3	Parallel run loop
auto	3.795780038200155	0.0	discard	31_4_in_6	Parallel run loop
auto	9.477589795765269	0.0	discard	16_DOMINO_in_3	Parallel run loop
auto	3.479411307571736	0.0	discard	16_4_in_5	Parallel run loop
auto	10.198092879780287	0.0	discard	21_5_in_3	Parallel run loop
auto	1.3541280884218148	0.0	discard	16_3_in_8	Parallel run loop
auto	14.043894378809615	0.0	discard	13_8_in_3	Parallel run loop
auto	8.37894264557814	0.0	discard	13_5_in_3	Parallel run loop
auto	6.799628397946985	0.0	keep	2_8_in_3	Auto run attempts=5000
auto	3.1195152873008425	0.0	discard	39_4_in_8	Auto run attempts=5000
auto	3.1195152873008425	0.0	discard	39_4_in_8	Auto run attempts=50000
auto	3.1195152873008425	0.0	discard	39_4_in_8	Auto run attempts=500000
auto	0.9680088680085646	0.0	discard	3_3_in_DOMINO	Auto run attempts=50000
auto	1.1204680284017543	0.0	discard	4_3_in_DOMINO	Auto run attempts=50000
auto	1.288470512236011	0.0	keep	3_4_in_circle	Auto run attempts=50000
auto	7.631880325069904	0.0	discard	10_DOMINO_in_3	Auto run attempts=50000
auto	1.5198332005523776	0.0	discard	2_DOMINO_in_6	Parallel run loop
auto	1.4456419010635229	0.0	discard	3_DOMINO_in_8	Parallel run loop
auto	1.8614091643433046	0.0	discard	3_DOMINO_in_6	Parallel run loop
auto	1.5751382207326066	0.0	discard	4_DOMINO_in_8	Parallel run loop
auto	2.1684923287853244	0.0	discard	4_DOMINO_in_6	Parallel run loop
auto	2.0051996327520683	0.0	keep	7_DOMINO_in_8	Parallel run loop
auto	8.323632056892368	0.0	discard	12_DOMINO_in_3	Parallel run loop
auto	8.791744205000827	0.0	discard	14_DOMINO_in_3	Parallel run loop
auto	9.493652924802479	0.0	discard	16_DOMINO_in_3	Parallel run loop
auto	10.324837935751273	0.0	discard	18_DOMINO_in_3	Parallel run loop
auto	12.261313043390997	0.0	discard	27_DOMINO_in_3	Parallel run loop
auto	11.881182844607538	0.0	discard	25_DOMINO_in_3	Parallel run loop
auto	8.651091643465453	0.0	discard	13_DOMINO_in_3	Parallel run loop
auto	11.260853826103226	0.0	discard	23_DOMINO_in_3	Parallel run loop
auto	5.961436090702017	0.0	keep	14_DOMINO_in_4	Parallel run loop
auto	7.03616573595127	0.0	discard	20_DOMINO_in_4	Parallel run loop
auto	11.10639567382138	0.0	discard	22_DOMINO_in_3	Parallel run loop
auto	6.864504648488255	0.0	keep	19_DOMINO_in_4	Parallel run loop
auto	10.32790387116265	0.0	discard	19_DOMINO_in_3	Parallel run loop
auto	10.651500718525643	0.0	discard	20_DOMINO_in_3	Parallel run loop
auto	12.402922356105613	0.0	discard	26_DOMINO_in_3	Parallel run loop
auto	1.5198332005523776	0.0	discard	2_DOMINO_in_6	Parallel run loop
auto	10.95333223592899	0.0	discard	21_DOMINO_in_3	Parallel run loop
auto	3.365213031051526	0.0	discard	21_DOMINO_in_8	Parallel run loop
auto	1.4456419010635229	0.0	discard	3_DOMINO_in_8	Parallel run loop
auto	1.8614091643433046	0.0	discard	3_DOMINO_in_6	Parallel run loop
auto	1.5751382207326066	0.0	discard	4_DOMINO_in_8	Parallel run loop
auto	2.1684923287853244	0.0	discard	4_DOMINO_in_6	Parallel run loop
auto	4.574649422745705	0.0	discard	22_DOMINO_in_6	Parallel run loop
auto	2.0051996327520683	0.0	discard	7_DOMINO_in_8	Parallel run loop
auto	8.323632056892368	0.0	discard	12_DOMINO_in_3	Parallel run loop
auto	8.791744205000827	0.0	discard	14_DOMINO_in_3	Parallel run loop
auto	9.493652924802479	0.0	discard	16_DOMINO_in_3	Parallel run loop
auto	3.8921243667471783	0.0	keep	16_DOMINO_in_6	Parallel run loop
auto	5.961436090702017	0.0	discard	14_DOMINO_in_4	Parallel run loop
auto	6.864504648488255	0.0	discard	19_DOMINO_in_4	Parallel run loop
auto	10.651500718525643	0.0	discard	20_DOMINO_in_3	Parallel run loop
auto	10.32790387116265	0.0	discard	19_DOMINO_in_3	Parallel run loop
auto	1.5198332005523776	0.0	discard	2_DOMINO_in_6	Parallel run loop
auto	12.261313043390997	0.0	discard	27_DOMINO_in_3	Parallel run loop
auto	12.454238019795618	0.0	discard	25_DOMINO_in_3	Parallel run loop
auto	11.260853826103226	0.0	discard	23_DOMINO_in_3	Parallel run loop
auto	8.651091643465453	0.0	discard	13_DOMINO_in_3	Parallel run loop
auto	11.505387066184918	0.0	discard	24_DOMINO_in_3	Parallel run loop
auto	1.4456419010635229	0.0	discard	3_DOMINO_in_8	Parallel run loop
auto	7.03616573595127	0.0	discard	20_DOMINO_in_4	Parallel run loop
auto	11.10639567382138	0.0	discard	22_DOMINO_in_3	Parallel run loop
auto	5.075988007438324	0.0	keep	28_DOMINO_in_6	Parallel run loop
auto	1.8614091643433046	0.0	discard	3_DOMINO_in_6	Parallel run loop
auto	1.5751382207326066	0.0	discard	4_DOMINO_in_8	Parallel run loop
auto	2.1684923287853244	0.0	discard	4_DOMINO_in_6	Parallel run loop
auto	1.5198332005523776	0.0	discard	2_DOMINO_in_6	Parallel run loop
auto	5.012765064798198	0.0	discard	20_DOMINO_in_DOMINO	Parallel run loop
auto	3.2342712519580337	0.0	discard	12_DOMINO_in_CIRCLE	Parallel run loop
auto	2.0051996327520683	0.0	discard	7_DOMINO_in_8	Parallel run loop
auto	1.4456419010635229	0.0	discard	3_DOMINO_in_8	Parallel run loop
auto	8.323632056892368	0.0	discard	12_DOMINO_in_3	Parallel run loop
auto	8.791744205000827	0.0	discard	14_DOMINO_in_3	Parallel run loop
auto	9.493652924802479	0.0	discard	16_DOMINO_in_3	Parallel run loop
auto	5.961436090702017	0.0	discard	14_DOMINO_in_4	Parallel run loop
auto	10.651500718525643	0.0	discard	20_DOMINO_in_3	Parallel run loop
auto	6.864504648488255	0.0	discard	19_DOMINO_in_4	Parallel run loop
auto	10.32790387116265	0.0	discard	19_DOMINO_in_3	Parallel run loop
auto	11.505387066184918	0.0	discard	24_DOMINO_in_3	Parallel run loop
auto	12.650561160806369	0.0	discard	26_DOMINO_in_3	Parallel run loop
auto	10.95333223592899	0.0	discard	21_DOMINO_in_3	Parallel run loop
auto	4.625250894349484	0.0	discard	22_DOMINO_in_6	Parallel run loop
auto	3.8921243667471783	0.0	discard	16_DOMINO_in_6	Parallel run loop
auto	1.8614091643433046	0.0	discard	3_DOMINO_in_6	Parallel run loop
auto	2.1684923287853244	0.0	discard	4_DOMINO_in_6	Parallel run loop
auto	12.261313043390997	0.0	discard	27_DOMINO_in_3	Parallel run loop
auto	11.260853826103226	0.0	discard	23_DOMINO_in_3	Parallel run loop
auto	11.881182844607538	0.0	discard	25_DOMINO_in_3	Parallel run loop
auto	1.5751382207326066	0.0	discard	4_DOMINO_in_8	Parallel run loop
auto	8.651091643465453	0.0	discard	13_DOMINO_in_3	Parallel run loop
auto	3.759141572791398	0.0	discard	17_DOMINO_in_CIRCLE	Parallel run loop
auto	2.0051996327520683	0.0	discard	7_DOMINO_in_8	Parallel run loop
auto	7.03616573595127	0.0	discard	20_DOMINO_in_4	Parallel run loop
auto	8.323632056892368	0.0	discard	12_DOMINO_in_3	Parallel run loop
auto	8.791744205000827	0.0	discard	14_DOMINO_in_3	Parallel run loop
auto	9.493652924802479	0.0	discard	16_DOMINO_in_3	Parallel run loop
auto	5.961436090702017	0.0	discard	14_DOMINO_in_4	Parallel run loop
auto	6.864504648488255	0.0	discard	19_DOMINO_in_4	Parallel run loop
auto	10.651500718525643	0.0	discard	20_DOMINO_in_3	Parallel run loop
auto	10.32790387116265	0.0	discard	19_DOMINO_in_3	Parallel run loop
auto	11.10639567382138	0.0	discard	22_DOMINO_in_3	Parallel run loop
auto	5.205534816582014	0.0	discard	28_DOMINO_in_6	Parallel run loop
auto	2.803879883664299	0.0	discard	9_DOMINO_in_CIRCLE	Parallel run loop
auto	2.9559621946049712	0.0	discard	10_DOMINO_in_CIRCLE	Parallel run loop
auto	2.6915521371235593	0.0	discard	8_DOMINO_in_CIRCLE	Parallel run loop
auto	3.827281560659983	0.0	discard	11_DOMINO_in_DOMINO	Parallel run loop
auto	11.505387066184918	0.0	discard	24_DOMINO_in_3	Parallel run loop
auto	12.650561160806369	0.0	discard	26_DOMINO_in_3	Parallel run loop
auto	10.95333223592899	0.0	discard	21_DOMINO_in_3	Parallel run loop
auto	5.012765064798198	0.0	discard	20_DOMINO_in_DOMINO	Parallel run loop
auto	3.8921243667471783	0.0	discard	16_DOMINO_in_6	Parallel run loop
