commit	score	memory_gb	status	problem	description
auto	4.806066398089316	0.0	discard	35_3_in_4	Parallel run loop
auto	3.9507270502313694	0.0	discard	34_3_in_5	Parallel run loop
auto	4.572984457404915	0.0	discard	32_3_in_4	Parallel run loop
auto	3.2043076928150813	0.0	discard	23_3_in_5	Parallel run loop
auto	4.292645028691155	0.0	discard	39_3_in_5	Parallel run loop
auto	4.346358603081047	0.0	discard	40_3_in_5	Parallel run loop
auto	2.282933757460022	0.0	discard	12_3_in_5	Parallel run loop
auto	3.8063899891996087	0.0	discard	32_3_in_5	Parallel run loop
auto	4.764865590095546	0.0	discard	46_3_in_5	Parallel run loop
auto	3.7591693974584772	0.0	discard	22_3_in_4	Parallel run loop
auto	4.937570516124916	0.0	discard	48_3_in_5	Parallel run loop
auto	3.4879020363545563	0.0	discard	27_3_in_5	Parallel run loop
auto	3.8564818631679314	0.0	discard	23_3_in_4	Parallel run loop
auto	4.144708358448107	0.0	keep	38_3_in_5	Parallel run loop
auto	1.8622700526066214	0.0	discard	8_3_in_5	Parallel run loop
auto	2.722618849229716	0.0	discard	17_3_in_5	Parallel run loop
auto	6.000951478575948	0.0	discard	48_3_in_4	Parallel run loop
auto	5.089682329317998	0.0	discard	38_3_in_4	Parallel run loop
auto	1.976019216688875	0.0	discard	9_3_in_5	Parallel run loop
auto	3.621489234860259	0.0	discard	29_3_in_5	Parallel run loop
auto	5.266077634621132	0.0	discard	40_3_in_4	Parallel run loop
auto	4.971696999360521	0.0	discard	49_3_in_5	Parallel run loop
auto	4.74583714090127	0.0	discard	34_3_in_4	Parallel run loop
auto	3.494190151521076	0.0	discard	19_3_in_4	Parallel run loop
auto	5.854406961913515	0.0	discard	47_3_in_4	Parallel run loop
auto	4.19997162293994	0.0	discard	27_3_in_4	Parallel run loop
auto	3.745343901275139	0.0	discard	31_3_in_5	Parallel run loop
auto	4.257835865563364	0.0	discard	28_3_in_4	Parallel run loop
auto	5.109319071919103	0.0	discard	50_3_in_5	Parallel run loop
auto	3.676162051557759	0.0	discard	30_3_in_5	Parallel run loop
auto	4.84433327929383	0.0	discard	35_3_in_4	Parallel run loop
auto	3.55495448348007	0.0	discard	28_3_in_5	Parallel run loop
auto	3.9282079018406773	0.0	discard	34_3_in_5	Parallel run loop
auto	4.666920080914447	0.0	discard	45_3_in_5	Parallel run loop
auto	4.293614540336591	0.0	discard	39_3_in_5	Parallel run loop
auto	4.442359209667605	0.0	discard	30_3_in_4	Parallel run loop
auto	4.592265473829824	0.0	discard	32_3_in_4	Parallel run loop
auto	3.6677049196362597	0.0	discard	21_3_in_4	Parallel run loop
auto	4.638834437978773	0.0	discard	46_3_in_5	Parallel run loop
auto	3.491981785165422	0.0	discard	27_3_in_5	Parallel run loop
auto	3.8266804024015664	0.0	discard	32_3_in_5	Parallel run loop
auto	4.890060395313869	0.0	discard	48_3_in_5	Parallel run loop
auto	5.495849434355977	0.0	discard	43_3_in_4	Parallel run loop
auto	4.394880487761758	0.0	discard	41_3_in_5	Parallel run loop
auto	2.726393087112816	0.0	discard	17_3_in_5	Parallel run loop
auto	3.8541613598548845	0.0	discard	23_3_in_4	Parallel run loop
auto	1.8622698048894826	0.0	discard	8_3_in_5	Parallel run loop
auto	4.167087064091505	0.0	discard	38_3_in_5	Parallel run loop
auto	3.138544263538286	0.0	discard	22_3_in_5	Parallel run loop
auto	3.061137586496899	0.0	discard	21_3_in_5	Parallel run loop
auto	1.9752446967269284	0.0	discard	9_3_in_5	Parallel run loop
auto	3.6253733587990746	0.0	discard	29_3_in_5	Parallel run loop
auto	4.917801853319325	0.0	discard	36_3_in_4	Parallel run loop
auto	5.043520862041086	0.0	discard	49_3_in_5	Parallel run loop
auto	3.495393297194029	0.0	discard	19_3_in_4	Parallel run loop
auto	4.7439128607154295	0.0	discard	34_3_in_4	Parallel run loop
auto	5.786164248336122	0.0	discard	47_3_in_4	Parallel run loop
auto	3.7477562650991927	0.0	discard	31_3_in_5	Parallel run loop
auto	5.6631636725059185	0.0	discard	46_3_in_4	Parallel run loop
auto	4.264836448522671	0.0	discard	28_3_in_4	Parallel run loop
auto	3.6890095520542383	0.0	discard	30_3_in_5	Parallel run loop
auto	4.669347970902102	0.0	discard	33_3_in_4	Parallel run loop
auto	3.5601469964062336	0.0	discard	28_3_in_5	Parallel run loop
auto	4.723494157403891	0.0	discard	45_3_in_5	Parallel run loop
auto	4.119488800725829	0.0	discard	26_3_in_4	Parallel run loop
auto	3.9520757209567576	0.0	discard	34_3_in_5	Parallel run loop
auto	4.579486159016162	0.0	discard	32_3_in_4	Parallel run loop
auto	4.492576417599728	0.0	discard	42_3_in_5	Parallel run loop
auto	2.8201362255731963	0.0	discard	18_3_in_5	Parallel run loop
auto	4.654041686532284	0.0	discard	44_3_in_5	Parallel run loop
auto	4.743007449017173	0.0	discard	46_3_in_5	Parallel run loop
auto	5.361431482114366	0.0	discard	42_3_in_4	Parallel run loop
auto	4.792352657580139	0.0	discard	47_3_in_5	Parallel run loop
auto	3.4954228611943665	0.0	discard	27_3_in_5	Parallel run loop
auto	4.15017415599429	0.0	discard	37_3_in_5	Parallel run loop
auto	3.8480822444495044	0.0	discard	23_3_in_4	Parallel run loop
auto	1.8618255277750007	0.0	discard	8_3_in_5	Parallel run loop
auto	4.188026224797546	0.0	discard	38_3_in_5	Parallel run loop
auto	2.0816256740538077	0.0	discard	10_3_in_5	Parallel run loop
auto	3.413590100270666	0.0	discard	26_3_in_5	Parallel run loop
auto	3.9492312890443224	0.0	discard	24_3_in_4	Parallel run loop
auto	2.282200974084939	0.0	discard	12_3_in_5	Parallel run loop
auto	3.1421488248231433	0.0	discard	22_3_in_5	Parallel run loop
auto	3.6252671042880467	0.0	discard	29_3_in_5	Parallel run loop
auto	3.210529739235556	0.0	discard	23_3_in_5	Parallel run loop
auto	4.203424186315758	0.0	discard	27_3_in_4	Parallel run loop
auto	2.5550698995253396	0.0	discard	15_3_in_5	Parallel run loop
auto	3.7634416719306074	0.0	discard	22_3_in_4	Parallel run loop
auto	5.804586574055975	0.0	discard	47_3_in_4	Parallel run loop
auto	3.7489316228413285	0.0	discard	31_3_in_5	Parallel run loop
auto	1.4732507719224306	0.0	discard	5_3_in_5	Parallel run loop
auto	4.282361192837453	0.0	discard	28_3_in_4	Parallel run loop
auto	4.0839924009099215	0.0	discard	36_3_in_5	Parallel run loop
auto	4.015817229434117	0.0	discard	35_3_in_5	Parallel run loop
auto	3.5612434550176904	0.0	discard	28_3_in_5	Parallel run loop
auto	3.944521369918782	0.0	discard	34_3_in_5	Parallel run loop
auto	4.725703875295683	0.0	discard	45_3_in_5	Parallel run loop
auto	4.442391770498902	0.0	discard	30_3_in_4	Parallel run loop
auto	4.941054901556117	0.0	discard	37_3_in_4	Parallel run loop
auto	8.43048885754377	0.0	discard	21_6_in_4	Parallel run loop
auto	4.408451499511633	0.0	discard	42_3_in_5	Parallel run loop
auto	6.388553067875531	0.0	discard	13_4_in_3	Parallel run loop
auto	8.356862175146127	0.0	keep	23_4_in_3	Parallel run loop
auto	7.7379955374790645	0.0	discard	18_6_in_4	Parallel run loop
auto	9.149636321582882	0.0	discard	25_6_in_4	Parallel run loop
auto	2.8132409448861893	0.0	discard	18_3_in_5	Parallel run loop
auto	8.522156032410958	0.0	discard	24_4_in_3	Parallel run loop
auto	8.774947412252958	0.0	discard	26_4_in_3	Parallel run loop
auto	8.619398901246518	0.0	discard	25_4_in_3	Parallel run loop
auto	9.255840516534487	0.0	discard	26_6_in_4	Parallel run loop
auto	9.783113701199017	0.0	discard	33_4_in_3	Parallel run loop
auto	8.014201219029097	0.0	discard	20_6_in_4	Parallel run loop
auto	7.387785192386595	0.0	discard	18_4_in_3	Parallel run loop
auto	9.513940573292547	0.0	discard	27_6_in_4	Parallel run loop
auto	9.70420703924515	0.0	discard	32_4_in_3	Parallel run loop
auto	9.469128336582969	0.0	keep	31_4_in_3	Parallel run loop
auto	10.368637368212893	0.0	discard	37_4_in_3	Parallel run loop
auto	8.775406011648657	0.0	keep	27_4_in_3	Parallel run loop
auto	9.906689815939474	0.0	discard	34_4_in_3	Parallel run loop
auto	6.57626910209534	0.0	discard	15_4_in_3	Parallel run loop
auto	11.01851023958955	0.0	discard	43_4_in_3	Parallel run loop
auto	10.776309862715156	0.0	discard	40_4_in_3	Parallel run loop
auto	10.102256807489026	0.0	discard	35_4_in_3	Parallel run loop
auto	10.628463076123532	0.0	discard	39_4_in_3	Parallel run loop
auto	10.963768808251237	0.0	discard	42_4_in_3	Parallel run loop
auto	10.95143988939162	0.0	discard	41_4_in_3	Parallel run loop
auto	10.097240077527125	0.0	discard	36_4_in_3	Parallel run loop
auto	4.154707933020685	0.0	discard	4_4_in_3	Parallel run loop
auto	4.30942692978523	0.0	discard	5_4_in_3	Parallel run loop
auto	5.154784542108047	0.0	discard	7_4_in_3	Parallel run loop
auto	8.419120872869083	0.0	discard	23_4_in_3	Parallel run loop
auto	6.3985247233180775	0.0	discard	13_4_in_3	Parallel run loop
auto	3.491959014509597	0.0	discard	3_6_in_4	Parallel run loop
auto	8.43048885754377	0.0	discard	21_6_in_4	Parallel run loop
auto	4.438079146634743	0.0	keep	5_6_in_4	Parallel run loop
auto	8.591953675831972	0.0	discard	24_4_in_3	Parallel run loop
auto	7.763371982027166	0.0	discard	18_6_in_4	Parallel run loop
auto	5.309456355946519	0.0	discard	8_4_in_3	Parallel run loop
auto	9.149636321582882	0.0	discard	25_6_in_4	Parallel run loop
auto	8.774947412252958	0.0	discard	26_4_in_3	Parallel run loop
auto	9.255840516534487	0.0	discard	26_6_in_4	Parallel run loop
auto	8.563014759510843	0.0	discard	25_4_in_3	Parallel run loop
auto	8.011237531469504	0.0	discard	20_6_in_4	Parallel run loop
auto	9.851848888201381	0.0	discard	33_4_in_3	Parallel run loop
auto	7.387955541169579	0.0	discard	18_4_in_3	Parallel run loop
auto	9.515299990595514	0.0	discard	31_4_in_3	Parallel run loop
auto	10.368637368212893	0.0	discard	37_4_in_3	Parallel run loop
auto	9.513940573292547	0.0	discard	27_6_in_4	Parallel run loop
auto	9.70420703924515	0.0	discard	32_4_in_3	Parallel run loop
auto	8.785229111502591	0.0	discard	27_4_in_3	Parallel run loop
auto	9.931246793297	0.0	discard	34_4_in_3	Parallel run loop
auto	10.102256807489026	0.0	discard	35_4_in_3	Parallel run loop
auto	6.57626910209534	0.0	discard	15_4_in_3	Parallel run loop
auto	11.05680135503868	0.0	discard	43_4_in_3	Parallel run loop
auto	10.599771163337323	0.0	discard	39_4_in_3	Parallel run loop
auto	10.776309862715156	0.0	discard	40_4_in_3	Parallel run loop
auto	11.07710167451943	0.0	discard	42_4_in_3	Parallel run loop
auto	10.885670544889784	0.0	keep	41_4_in_3	Parallel run loop
auto	10.071782844255878	0.0	discard	36_4_in_3	Parallel run loop
auto	3.232052318453766	0.0	discard	3_4_in_3	Parallel run loop
auto	4.815183322352559	0.0	discard	6_6_in_4	Parallel run loop
auto	5.155344374810373	0.0	discard	7_4_in_3	Parallel run loop
auto	8.471010479530038	0.0	discard	23_4_in_3	Parallel run loop
auto	4.438123057858091	0.0	discard	5_6_in_4	Parallel run loop
auto	3.4919620863456333	0.0	discard	3_6_in_4	Parallel run loop
auto	8.696770964307701	0.0	keep	26_4_in_3	Parallel run loop
auto	8.542534000129315	0.0	discard	24_4_in_3	Parallel run loop
auto	8.4493650814135	0.0	discard	21_6_in_4	Parallel run loop
auto	9.11452624148448	0.0	discard	25_6_in_4	Parallel run loop
auto	7.9061745767615585	0.0	discard	18_6_in_4	Parallel run loop
auto	4.154750717508222	0.0	discard	4_4_in_3	Parallel run loop
auto	6.388553067875531	0.0	discard	13_4_in_3	Parallel run loop
auto	9.255840516534487	0.0	discard	26_6_in_4	Parallel run loop
auto	9.784109077071728	0.0	discard	33_4_in_3	Parallel run loop
auto	8.089384994607542	0.0	discard	20_6_in_4	Parallel run loop
auto	8.563014759510843	0.0	discard	25_4_in_3	Parallel run loop
auto	10.260221039654585	0.0	discard	37_4_in_3	Parallel run loop
auto	7.387955541169579	0.0	discard	18_4_in_3	Parallel run loop
auto	9.635390066119172	0.0	discard	31_4_in_3	Parallel run loop
auto	9.513940573292547	0.0	discard	27_6_in_4	Parallel run loop
auto	9.659578206958082	0.0	discard	32_4_in_3	Parallel run loop
auto	9.928503593750683	0.0	discard	34_4_in_3	Parallel run loop
auto	8.787266326248679	0.0	discard	27_4_in_3	Parallel run loop
auto	10.599771163337323	0.0	discard	39_4_in_3	Parallel run loop
auto	6.538606514812582	0.0	discard	15_4_in_3	Parallel run loop
auto	10.014055011131939	0.0	discard	35_4_in_3	Parallel run loop
auto	10.868935062578375	0.0	keep	41_4_in_3	Parallel run loop
auto	10.776309862715156	0.0	discard	40_4_in_3	Parallel run loop
auto	11.00636872113245	0.0	keep	43_4_in_3	Parallel run loop
auto	4.30943258797098	0.0	discard	5_4_in_3	Parallel run loop
auto	10.096814507517992	0.0	discard	36_4_in_3	Parallel run loop
auto	3.2320607503195915	0.0	discard	3_4_in_3	Parallel run loop
auto	11.057079850967028	0.0	discard	42_4_in_3	Parallel run loop
auto	4.438123057858091	0.0	discard	5_6_in_4	Parallel run loop
auto	6.15525932259678	0.0	discard	11_4_in_3	Parallel run loop
auto	8.774947412252958	0.0	discard	26_4_in_3	Parallel run loop
auto	8.472237346101952	0.0	discard	23_4_in_3	Parallel run loop
auto	5.309456355946519	0.0	discard	8_4_in_3	Parallel run loop
auto	8.556724708490135	0.0	discard	24_4_in_3	Parallel run loop
auto	9.864752752260609	0.0	discard	33_4_in_3	Parallel run loop
auto	7.9061745767615585	0.0	discard	18_6_in_4	Parallel run loop
auto	5.154752352831598	0.0	discard	7_4_in_3	Parallel run loop
auto	9.13726962239043	0.0	discard	25_6_in_4	Parallel run loop
auto	8.43048885754377	0.0	discard	21_6_in_4	Parallel run loop
auto	6.3985247233180775	0.0	discard	13_4_in_3	Parallel run loop
auto	9.255840516534487	0.0	discard	26_6_in_4	Parallel run loop
auto	8.563014759510843	0.0	discard	25_4_in_3	Parallel run loop
auto	8.089384994607542	0.0	discard	20_6_in_4	Parallel run loop
auto	9.474361225301514	0.0	discard	27_6_in_4	Parallel run loop
auto	9.630730852154063	0.0	discard	31_4_in_3	Parallel run loop
auto	10.260221039654585	0.0	discard	37_4_in_3	Parallel run loop
auto	7.387955541169579	0.0	discard	18_4_in_3	Parallel run loop
auto	8.851527856275144	0.0	discard	27_4_in_3	Parallel run loop
auto	9.81626260602841	0.0	discard	32_4_in_3	Parallel run loop
auto	6.553883953630861	0.0	discard	15_4_in_3	Parallel run loop
auto	9.942756554192467	0.0	discard	34_4_in_3	Parallel run loop
auto	10.599771163337323	0.0	discard	39_4_in_3	Parallel run loop
auto	9.877528661157257	0.0	keep	35_4_in_3	Parallel run loop
auto	11.005520545002303	0.0	discard	41_4_in_3	Parallel run loop
auto	11.01851023958955	0.0	discard	43_4_in_3	Parallel run loop
auto	4.154750717508222	0.0	discard	4_4_in_3	Parallel run loop
auto	10.085571900891914	0.0	discard	36_4_in_3	Parallel run loop
auto	3.232052318453766	0.0	discard	3_4_in_3	Parallel run loop
auto	6.156893685363397	0.0	discard	11_4_in_3	Parallel run loop
auto	10.790774349591166	0.0	discard	40_4_in_3	Parallel run loop
auto	4.439000354968679	0.0	discard	5_6_in_4	Parallel run loop
auto	10.93955256506185	0.0	keep	42_4_in_3	Parallel run loop
auto	9.783113701199017	0.0	discard	33_4_in_3	Parallel run loop
auto	8.473894756296447	0.0	discard	24_4_in_3	Parallel run loop
auto	8.696770964307701	0.0	discard	26_4_in_3	Parallel run loop
auto	3.491959731325357	0.0	discard	3_6_in_4	Parallel run loop
auto	8.471010479530038	0.0	discard	23_4_in_3	Parallel run loop
auto	7.895648304230482	0.0	discard	18_6_in_4	Parallel run loop
auto	5.155053785931084	0.0	discard	7_4_in_3	Parallel run loop
auto	9.2309605067419	0.0	keep	26_6_in_4	Parallel run loop
auto	9.118021638826727	0.0	discard	25_6_in_4	Parallel run loop
auto	6.465070897142405	0.0	discard	13_4_in_3	Parallel run loop
auto	8.43048885754377	0.0	discard	21_6_in_4	Parallel run loop
auto	8.563014759510843	0.0	discard	25_4_in_3	Parallel run loop
auto	8.089384994607542	0.0	discard	20_6_in_4	Parallel run loop
auto	10.168661960596854	0.0	keep	37_4_in_3	Parallel run loop
auto	7.387785192386595	0.0	discard	18_4_in_3	Parallel run loop
auto	9.526816723345474	0.0	discard	31_4_in_3	Parallel run loop
auto	9.510760983258802	0.0	discard	27_6_in_4	Parallel run loop
auto	8.819050170221848	0.0	discard	27_4_in_3	Parallel run loop
auto	6.584665709583202	0.0	discard	15_4_in_3	Parallel run loop
auto	9.76840525993033	0.0	discard	32_4_in_3	Parallel run loop
auto	9.860409477809945	0.0	discard	34_4_in_3	Parallel run loop
auto	10.044741357915102	0.0	discard	35_4_in_3	Parallel run loop
auto	10.639293259652943	0.0	discard	39_4_in_3	Parallel run loop
auto	11.029791082120102	0.0	discard	41_4_in_3	Parallel run loop
auto	10.143929657656013	0.0	discard	36_4_in_3	Parallel run loop
auto	10.963768808251237	0.0	discard	42_4_in_3	Parallel run loop
auto	4.438123057858091	0.0	discard	5_6_in_4	Parallel run loop
auto	11.01851023958955	0.0	discard	43_4_in_3	Parallel run loop
auto	4.309409782028365	0.0	discard	5_4_in_3	Parallel run loop
auto	10.776309862715156	0.0	discard	40_4_in_3	Parallel run loop
auto	5.155344374810373	0.0	discard	7_4_in_3	Parallel run loop
auto	5.309456355946519	0.0	discard	8_4_in_3	Parallel run loop
auto	9.81478428470782	0.0	discard	33_4_in_3	Parallel run loop
auto	7.730063257741899	0.0	discard	18_6_in_4	Parallel run loop
auto	8.774947412252958	0.0	discard	26_4_in_3	Parallel run loop
auto	8.472237346101952	0.0	discard	23_4_in_3	Parallel run loop
auto	4.815183322352559	0.0	discard	6_6_in_4	Parallel run loop
auto	4.154750717508222	0.0	discard	4_4_in_3	Parallel run loop
auto	8.522156032410958	0.0	discard	24_4_in_3	Parallel run loop
auto	8.549035601204384	0.0	keep	25_4_in_3	Parallel run loop
auto	8.430168530083199	0.0	keep	21_6_in_4	Parallel run loop
auto	9.083749787439356	0.0	discard	25_6_in_4	Parallel run loop
auto	9.255840516534487	0.0	discard	26_6_in_4	Parallel run loop
auto	6.3985247233180775	0.0	discard	13_4_in_3	Parallel run loop
auto	8.022138981393471	0.0	discard	20_6_in_4	Parallel run loop
auto	7.387955541169579	0.0	discard	18_4_in_3	Parallel run loop
auto	9.513940573292547	0.0	discard	27_6_in_4	Parallel run loop
auto	10.260221039654585	0.0	discard	37_4_in_3	Parallel run loop
auto	9.48566769368882	0.0	discard	31_4_in_3	Parallel run loop
auto	6.589001389609748	0.0	discard	15_4_in_3	Parallel run loop
auto	8.793324245426204	0.0	discard	27_4_in_3	Parallel run loop
auto	9.929802353984389	0.0	discard	34_4_in_3	Parallel run loop
auto	10.085995551403762	0.0	discard	35_4_in_3	Parallel run loop
auto	10.599771163337323	0.0	discard	39_4_in_3	Parallel run loop
auto	10.089613446336648	0.0	discard	36_4_in_3	Parallel run loop
auto	9.748219324694178	0.0	discard	32_4_in_3	Parallel run loop
auto	10.857625834240915	0.0	keep	41_4_in_3	Parallel run loop
auto	11.058125893868384	0.0	discard	43_4_in_3	Parallel run loop
auto	3.491959014509597	0.0	discard	3_6_in_4	Parallel run loop
auto	10.97567535740859	0.0	discard	42_4_in_3	Parallel run loop
auto	6.105491953617294	0.0	discard	10_6_in_4	Parallel run loop
auto	10.776309862715156	0.0	discard	40_4_in_3	Parallel run loop
auto	3.2320607503195915	0.0	discard	3_4_in_3	Parallel run loop
auto	7.900888869156121	0.0	discard	18_6_in_4	Parallel run loop
auto	6.309719735191199	0.0	discard	12_4_in_3	Parallel run loop
auto	8.774947412252958	0.0	discard	26_4_in_3	Parallel run loop
auto	4.309418543637569	0.0	discard	5_4_in_3	Parallel run loop
auto	9.701718871914597	0.0	keep	33_4_in_3	Parallel run loop
auto	8.568395832409651	0.0	discard	24_4_in_3	Parallel run loop
auto	4.438123057858091	0.0	discard	5_6_in_4	Parallel run loop
auto	5.155403441090606	0.0	discard	7_4_in_3	Parallel run loop
auto	8.469111224383393	0.0	discard	23_4_in_3	Parallel run loop
auto	8.43048885754377	0.0	discard	21_6_in_4	Parallel run loop
auto	9.118021638826727	0.0	discard	25_6_in_4	Parallel run loop
auto	8.620168250920733	0.0	discard	25_4_in_3	Parallel run loop
auto	6.3886915059595815	0.0	discard	13_4_in_3	Parallel run loop
auto	8.012270166332785	0.0	discard	20_6_in_4	Parallel run loop
auto	7.464231441122713	0.0	discard	18_4_in_3	Parallel run loop
auto	10.368637368212893	0.0	discard	37_4_in_3	Parallel run loop
auto	9.50264716863939	0.0	discard	27_6_in_4	Parallel run loop
auto	8.783812590081387	0.0	discard	27_4_in_3	Parallel run loop
auto	9.551632229631196	0.0	discard	31_4_in_3	Parallel run loop
auto	10.560916324773153	0.0	keep	39_4_in_3	Parallel run loop
auto	6.538606514812582	0.0	discard	15_4_in_3	Parallel run loop
auto	9.807451120192226	0.0	discard	32_4_in_3	Parallel run loop
auto	10.085580259671277	0.0	discard	35_4_in_3	Parallel run loop
auto	10.090481997169428	0.0	discard	36_4_in_3	Parallel run loop
auto	9.859456383527776	0.0	discard	34_4_in_3	Parallel run loop
auto	11.01851023958955	0.0	discard	43_4_in_3	Parallel run loop
auto	3.491959014509597	0.0	discard	3_6_in_4	Parallel run loop
auto	10.940638114596652	0.0	discard	41_4_in_3	Parallel run loop
auto	4.154750717508222	0.0	discard	4_4_in_3	Parallel run loop
auto	11.057079850967028	0.0	discard	42_4_in_3	Parallel run loop
auto	5.309456355946519	0.0	discard	8_4_in_3	Parallel run loop
auto	4.8139467162719285	0.0	discard	6_6_in_4	Parallel run loop
auto	9.784109077071728	0.0	discard	33_4_in_3	Parallel run loop
auto	7.9061745767615585	0.0	discard	18_6_in_4	Parallel run loop
auto	10.791219693178732	0.0	discard	40_4_in_3	Parallel run loop
auto	8.620972216247035	0.0	discard	24_4_in_3	Parallel run loop
auto	4.30942692978523	0.0	discard	5_4_in_3	Parallel run loop
auto	8.774947412252958	0.0	discard	26_4_in_3	Parallel run loop
auto	6.105336428074948	0.0	discard	10_6_in_4	Parallel run loop
auto	8.419120872869083	0.0	discard	23_4_in_3	Parallel run loop
auto	6.154772890366584	0.0	discard	11_4_in_3	Parallel run loop
auto	8.43048885754377	0.0	discard	21_6_in_4	Parallel run loop
auto	8.545164371624018	0.0	keep	25_4_in_3	Parallel run loop
auto	6.390557303285993	0.0	discard	13_4_in_3	Parallel run loop
auto	9.100998092955923	0.0	discard	25_6_in_4	Parallel run loop
auto	8.07747430544803	0.0	discard	20_6_in_4	Parallel run loop
auto	6.339849586688972	0.0	discard	11_6_in_4	Parallel run loop
auto	9.513940573292547	0.0	discard	27_6_in_4	Parallel run loop
auto	7.387955541169579	0.0	discard	18_4_in_3	Parallel run loop
auto	10.599771163337323	0.0	discard	39_4_in_3	Parallel run loop
auto	8.899751248939085	0.0	discard	27_4_in_3	Parallel run loop
auto	9.942756554192467	0.0	discard	34_4_in_3	Parallel run loop
auto	9.807451120192226	0.0	discard	32_4_in_3	Parallel run loop
auto	10.096814507517992	0.0	discard	36_4_in_3	Parallel run loop
auto	9.631514356730015	0.0	discard	31_4_in_3	Parallel run loop
auto	6.547608008069317	0.0	discard	15_4_in_3	Parallel run loop
auto	9.936087376153132	0.0	discard	35_4_in_3	Parallel run loop
auto	11.094522456470944	0.0	discard	43_4_in_3	Parallel run loop
auto	5.155344374810373	0.0	discard	7_4_in_3	Parallel run loop
