commit	score	memory_gb	status	problem	description
auto	3.8989087524875647	0.0	keep	33_4_in_6	Parallel run loop
auto	3.1358544743636227	0.0	discard	39_4_in_8	Parallel run loop
auto	4.8890277009045695	0.0	keep	35_4_in_5	Parallel run loop
auto	6.917185289957142	0.0	discard	19_DOMINO_in_4	Parallel run loop
auto	1.7527800100636761	0.0	discard	28_3_in_8	Parallel run loop
auto	8.928240961476828	0.0	keep	14_DOMINO_in_3	Parallel run loop
auto	2.9130767285708896	0.0	discard	35_4_in_8	Parallel run loop
auto	1.6453700630094263	0.0	discard	24_3_in_8	Parallel run loop
auto	4.725964777179055	0.0	discard	32_4_in_5	Parallel run loop
auto	2.7669992398850973	0.0	discard	30_4_in_8	Parallel run loop
auto	4.016637004422287	0.0	discard	35_4_in_6	Parallel run loop
auto	3.549062023341998	0.0	discard	27_4_in_6	Parallel run loop
auto	11.087420695432247	0.0	discard	22_DOMINO_in_3	Parallel run loop
auto	1.7011095136213437	0.0	discard	26_3_in_8	Parallel run loop
auto	4.785348516437221	0.0	discard	33_4_in_5	Parallel run loop
auto	5.138378143508757	0.0	keep	39_4_in_5	Parallel run loop
auto	4.041486215768469	0.0	keep	36_4_in_6	Parallel run loop
auto	3.171246474017651	0.0	discard	40_4_in_8	Parallel run loop
auto	1.8041201129685212	0.0	keep	30_3_in_8	Parallel run loop
auto	4.2673635294632355	0.0	discard	39_4_in_6	Parallel run loop
auto	2.3334438952775445	0.0	keep	28_3_in_6	Parallel run loop
auto	4.818171246845945	0.0	keep	34_4_in_5	Parallel run loop
auto	4.565337815553901	0.0	discard	30_4_in_5	Parallel run loop
auto	1.7290280509420763	0.0	discard	27_3_in_8	Parallel run loop
auto	2.5279018741612798	0.0	keep	26_4_in_8	Parallel run loop
auto	1.6640081377671292	0.0	discard	25_3_in_8	Parallel run loop
auto	11.240923821174528	0.0	discard	23_DOMINO_in_3	Parallel run loop
auto	3.929149315387576	0.0	keep	34_4_in_6	Parallel run loop
auto	3.6865342797963776	0.0	discard	29_4_in_6	Parallel run loop
auto	10.935408919797645	0.0	discard	21_DOMINO_in_3	Parallel run loop
auto	4.325679257086705	0.0	keep	40_4_in_6	Parallel run loop
auto	12.067067212615234	0.0	discard	26_DOMINO_in_3	Parallel run loop
auto	1.7797403600300725	0.0	discard	29_3_in_8	Parallel run loop
auto	1.9761081264702478	0.0	keep	20_3_in_6	Parallel run loop
auto	1.8358545436592422	0.0	discard	31_3_in_8	Parallel run loop
auto	2.5101781449603537	0.0	discard	25_4_in_8	Parallel run loop
auto	11.940805183094383	0.0	discard	25_DOMINO_in_3	Parallel run loop
auto	2.899502996012949	0.0	keep	33_4_in_8	Parallel run loop
auto	2.0235496509148727	0.0	keep	37_3_in_8	Parallel run loop
auto	5.021084156321819	0.0	keep	37_4_in_5	Parallel run loop
auto	1.8466809380129314	0.0	discard	32_3_in_8	Parallel run loop
auto	2.9130767285708896	0.0	discard	35_4_in_8	Parallel run loop
auto	3.899736977436757	0.0	discard	33_4_in_6	Parallel run loop
auto	3.084679552814788	0.0	keep	39_4_in_8	Parallel run loop
auto	1.900755144532835	0.0	discard	33_3_in_8	Parallel run loop
auto	10.668246111399757	0.0	discard	20_DOMINO_in_3	Parallel run loop
auto	5.07987060034679	0.0	discard	38_4_in_5	Parallel run loop
auto	12.240058936229826	0.0	keep	27_DOMINO_in_3	Parallel run loop
auto	2.9471914444154206	0.0	discard	36_4_in_8	Parallel run loop
auto	11.625502563333496	0.0	keep	24_DOMINO_in_3	Parallel run loop
auto	1.6370396410597632	0.0	discard	24_3_in_8	Parallel run loop
auto	4.016637004422287	0.0	discard	35_4_in_6	Parallel run loop
auto	4.795186589905255	0.0	discard	33_4_in_5	Parallel run loop
auto	11.087420695432247	0.0	discard	22_DOMINO_in_3	Parallel run loop
auto	4.041482035549435	0.0	keep	36_4_in_6	Parallel run loop
auto	4.558920746985814	0.0	keep	30_4_in_5	Parallel run loop
auto	1.7664009913969017	0.0	discard	28_3_in_8	Parallel run loop
auto	4.888808075130369	0.0	keep	35_4_in_5	Parallel run loop
auto	1.9682057201882532	0.0	keep	36_3_in_8	Parallel run loop
auto	4.259462931925501	0.0	keep	39_4_in_6	Parallel run loop
auto	2.769498158309131	0.0	discard	30_4_in_8	Parallel run loop
auto	5.183417856881617	0.0	keep	40_4_in_5	Parallel run loop
auto	3.1601084905307455	0.0	discard	40_4_in_8	Parallel run loop
auto	8.928664320474262	0.0	discard	14_DOMINO_in_3	Parallel run loop
auto	4.723191490629986	0.0	discard	32_4_in_5	Parallel run loop
auto	6.880135199247852	0.0	discard	19_DOMINO_in_4	Parallel run loop
auto	1.8129879939530449	0.0	discard	30_3_in_8	Parallel run loop
auto	3.549062023341998	0.0	discard	27_4_in_6	Parallel run loop
auto	1.7413227759945618	0.0	discard	27_3_in_8	Parallel run loop
auto	1.7827109834718484	0.0	discard	29_3_in_8	Parallel run loop
auto	10.935408919797645	0.0	discard	21_DOMINO_in_3	Parallel run loop
auto	3.92574705945672	0.0	keep	34_4_in_6	Parallel run loop
auto	1.6471525051238232	0.0	keep	25_3_in_8	Parallel run loop
auto	1.8432779928556553	0.0	keep	32_3_in_8	Parallel run loop
auto	2.894675229579231	0.0	keep	33_4_in_8	Parallel run loop
auto	1.8963014232477746	0.0	keep	34_3_in_8	Parallel run loop
auto	12.048153486482255	0.0	discard	26_DOMINO_in_3	Parallel run loop
auto	4.318555196366246	0.0	keep	40_4_in_6	Parallel run loop
auto	3.6869814981866664	0.0	discard	29_4_in_6	Parallel run loop
auto	2.3575744016051847	0.0	discard	28_3_in_6	Parallel run loop
auto	11.877180180210683	0.0	discard	25_DOMINO_in_3	Parallel run loop
auto	1.829331670211211	0.0	discard	31_3_in_8	Parallel run loop
auto	11.2666787649585	0.0	discard	23_DOMINO_in_3	Parallel run loop
auto	1.8822177985964996	0.0	keep	33_3_in_8	Parallel run loop
auto	2.0259148775370135	0.0	discard	37_3_in_8	Parallel run loop
auto	1.9557195600609176	0.0	discard	35_3_in_8	Parallel run loop
auto	4.04154369343722	0.0	discard	36_4_in_6	Parallel run loop
auto	1.6248142417806752	0.0	keep	24_3_in_8	Parallel run loop
auto	12.240058936229826	0.0	discard	27_DOMINO_in_3	Parallel run loop
auto	5.07987060034679	0.0	discard	38_4_in_5	Parallel run loop
auto	2.929350425244329	0.0	discard	35_4_in_8	Parallel run loop
auto	10.668246111399757	0.0	discard	20_DOMINO_in_3	Parallel run loop
auto	11.485041715911644	0.0	keep	24_DOMINO_in_3	Parallel run loop
auto	5.021084156321819	0.0	discard	37_4_in_5	Parallel run loop
auto	4.889250532471852	0.0	discard	35_4_in_5	Parallel run loop
auto	2.931925434374192	0.0	keep	36_4_in_8	Parallel run loop
auto	4.029288535529539	0.0	discard	35_4_in_6	Parallel run loop
auto	3.9018324454743536	0.0	discard	33_4_in_6	Parallel run loop
auto	2.0005705237678875	0.0	discard	36_3_in_8	Parallel run loop
auto	4.796239987809272	0.0	discard	33_4_in_5	Parallel run loop
auto	2.283501390497471	0.0	discard	26_3_in_6	Parallel run loop
auto	4.5590711652018845	0.0	discard	30_4_in_5	Parallel run loop
auto	2.547273740281077	0.0	keep	33_3_in_6	Parallel run loop
auto	1.8544885237546707	0.0	discard	32_3_in_8	Parallel run loop
auto	2.375217578436799	0.0	keep	29_3_in_6	Parallel run loop
auto	2.7289285132259624	0.0	discard	38_3_in_6	Parallel run loop
auto	11.087420695432247	0.0	discard	22_DOMINO_in_3	Parallel run loop
auto	10.935332366508785	0.0	keep	21_DOMINO_in_3	Parallel run loop
auto	2.500002454603796	0.0	discard	32_3_in_6	Parallel run loop
auto	2.6529817611229847	0.0	discard	36_3_in_6	Parallel run loop
auto	5.183417856881617	0.0	discard	40_4_in_5	Parallel run loop
auto	1.8041128849958712	0.0	keep	30_3_in_8	Parallel run loop
auto	8.928664320474262	0.0	discard	14_DOMINO_in_3	Parallel run loop
auto	4.72450278935316	0.0	discard	32_4_in_5	Parallel run loop
auto	2.2194997056232277	0.0	discard	25_3_in_6	Parallel run loop
auto	2.421234182643837	0.0	keep	30_3_in_6	Parallel run loop
auto	1.8303155712184702	0.0	discard	31_3_in_8	Parallel run loop
auto	12.099586915753415	0.0	discard	26_DOMINO_in_3	Parallel run loop
auto	2.6770531762058574	0.0	discard	37_3_in_6	Parallel run loop
auto	11.91583737625627	0.0	discard	25_DOMINO_in_3	Parallel run loop
auto	1.8963014232477746	0.0	discard	34_3_in_8	Parallel run loop
auto	2.360519680019161	0.0	discard	28_3_in_6	Parallel run loop
auto	2.588275614046589	0.0	keep	34_3_in_6	Parallel run loop
auto	11.252888977248585	0.0	discard	23_DOMINO_in_3	Parallel run loop
auto	2.802680150665713	0.0	keep	40_3_in_6	Parallel run loop
auto	1.9247729746177151	0.0	keep	35_3_in_8	Parallel run loop
auto	5.07987060034679	0.0	discard	38_4_in_5	Parallel run loop
auto	2.869404348297652	0.0	keep	41_3_in_6	Parallel run loop
auto	2.9130767285708896	0.0	discard	35_4_in_8	Parallel run loop
auto	4.041468621409939	0.0	keep	36_4_in_6	Parallel run loop
auto	2.0061078510370356	0.0	keep	37_3_in_8	Parallel run loop
auto	12.31555177401542	0.0	discard	27_DOMINO_in_3	Parallel run loop
auto	1.8822177985964996	0.0	discard	33_3_in_8	Parallel run loop
auto	2.840389505101361	0.0	discard	39_3_in_6	Parallel run loop
auto	2.89918110377163	0.0	keep	43_3_in_6	Parallel run loop
auto	5.021084156321819	0.0	discard	37_4_in_5	Parallel run loop
auto	2.996780134943356	0.0	discard	46_3_in_6	Parallel run loop
auto	2.7793385082272537	0.0	discard	38_3_in_6	Parallel run loop
auto	2.279895579309268	0.0	discard	26_3_in_6	Parallel run loop
auto	2.9089455117930454	0.0	keep	44_3_in_6	Parallel run loop
auto	2.39647214767431	0.0	discard	29_3_in_6	Parallel run loop
auto	3.000043618208955	0.0	keep	49_3_in_6	Parallel run loop
auto	1.9989621388410987	0.0	discard	36_3_in_8	Parallel run loop
auto	11.685119347701418	0.0	discard	24_DOMINO_in_3	Parallel run loop
auto	4.900699970992109	0.0	discard	35_4_in_5	Parallel run loop
auto	2.9108999241616034	0.0	discard	42_3_in_6	Parallel run loop
auto	2.566637990121091	0.0	discard	33_3_in_6	Parallel run loop
auto	3.0000106765190924	0.0	keep	47_3_in_6	Parallel run loop
auto	2.250205295500826	0.0	discard	25_3_in_6	Parallel run loop
auto	2.6771117839580554	0.0	discard	36_3_in_6	Parallel run loop
auto	2.599270473845022	0.0	keep	35_3_in_6	Parallel run loop
auto	2.500002454603796	0.0	discard	32_3_in_6	Parallel run loop
auto	2.956283943796274	0.0	keep	45_3_in_6	Parallel run loop
auto	1.8129879939530449	0.0	discard	30_3_in_8	Parallel run loop
auto	1.8811333523724885	0.0	keep	34_3_in_8	Parallel run loop
auto	2.5713783598969453	0.0	keep	34_3_in_6	Parallel run loop
auto	11.949685955614227	0.0	discard	18_6_in_3	Parallel run loop
auto	10.93928481303274	0.0	discard	21_DOMINO_in_3	Parallel run loop
auto	1.8286273613361401	0.0	discard	31_3_in_8	Parallel run loop
auto	2.40005564940699	0.0	keep	30_3_in_6	Parallel run loop
auto	3.0496868431438338	0.0	keep	48_3_in_6	Parallel run loop
auto	2.333382626963888	0.0	keep	28_3_in_6	Parallel run loop
auto	2.6698761675926086	0.0	keep	37_3_in_6	Parallel run loop
auto	5.183417856881617	0.0	discard	40_4_in_5	Parallel run loop
auto	12.067067212615234	0.0	discard	26_DOMINO_in_3	Parallel run loop
auto	5.07987060034679	0.0	discard	38_4_in_5	Parallel run loop
auto	1.8822177985964996	0.0	discard	33_3_in_8	Parallel run loop
auto	2.015873355536443	0.0	discard	37_3_in_8	Parallel run loop
auto	4.041567095300331	0.0	discard	36_4_in_6	Parallel run loop
auto	2.7289285132259624	0.0	discard	38_3_in_6	Parallel run loop
auto	2.8276508824188746	0.0	discard	40_3_in_6	Parallel run loop
auto	2.77142597220387	0.0	discard	30_4_in_8	Parallel run loop
auto	5.024654504399765	0.0	discard	37_4_in_5	Parallel run loop
auto	14.046687753100313	0.0	discard	39_5_in_3	Parallel run loop
auto	2.909235257394456	0.0	discard	43_3_in_6	Parallel run loop
auto	2.9933220832135827	0.0	discard	46_3_in_6	Parallel run loop
auto	2.7882095839352004	0.0	keep	39_3_in_6	Parallel run loop
auto	1.3688025213052981	0.0	discard	16_3_in_8	Parallel run loop
auto	2.8428478000960173	0.0	keep	41_3_in_6	Parallel run loop
auto	1.9247729746177151	0.0	discard	35_3_in_8	Parallel run loop
auto	2.3692654230419032	0.0	keep	29_3_in_6	Parallel run loop
auto	3.00045287910627	0.0	discard	47_3_in_6	Parallel run loop
auto	1.736647610236818	0.0	discard	27_3_in_8	Parallel run loop
auto	2.5443128529779804	0.0	keep	34_3_in_6	Parallel run loop
auto	1.9689116714881405	0.0	discard	36_3_in_8	Parallel run loop
auto	2.2194997056232277	0.0	discard	25_3_in_6	Parallel run loop
auto	11.496960516608057	0.0	discard	24_DOMINO_in_3	Parallel run loop
auto	4.32073601148035	0.0	discard	40_4_in_6	Parallel run loop
auto	2.666721126928283	0.0	discard	36_3_in_6	Parallel run loop
auto	2.55230427254843	0.0	discard	33_3_in_6	Parallel run loop
auto	2.871566558309911	0.0	keep	42_3_in_6	Parallel run loop
auto	2.6100668623146337	0.0	discard	35_3_in_6	Parallel run loop
auto	2.908671200148805	0.0	keep	44_3_in_6	Parallel run loop
auto	2.973322640679562	0.0	discard	45_3_in_6	Parallel run loop
auto	3.1698683792918416	0.0	discard	49_3_in_6	Parallel run loop
auto	1.9218778043146818	0.0	discard	34_3_in_8	Parallel run loop
auto	2.2761102762029797	0.0	discard	26_3_in_6	Parallel run loop
auto	2.500002454603796	0.0	discard	32_3_in_6	Parallel run loop
auto	2.3568426194040795	0.0	discard	28_3_in_6	Parallel run loop
auto	2.7272905870601427	0.0	keep	38_3_in_6	Parallel run loop
auto	11.949685955614227	0.0	discard	18_6_in_3	Parallel run loop
auto	2.9836331985473015	0.0	keep	48_3_in_6	Parallel run loop
auto	2.40005564940699	0.0	discard	30_3_in_6	Parallel run loop
auto	2.0061078510370356	0.0	discard	37_3_in_8	Parallel run loop
auto	2.708049315795751	0.0	discard	37_3_in_6	Parallel run loop
auto	1.8578496931745732	0.0	keep	33_3_in_8	Parallel run loop
auto	1.6640081377671292	0.0	discard	25_3_in_8	Parallel run loop
auto	5.183417856881617	0.0	discard	40_4_in_5	Parallel run loop
auto	4.262700168897848	0.0	discard	39_4_in_6	Parallel run loop
auto	2.894675229579231	0.0	discard	33_4_in_8	Parallel run loop
auto	8.856839379799213	0.0	keep	14_DOMINO_in_3	Parallel run loop
auto	1.6022074202486387	0.0	keep	24_3_in_8	Parallel run loop
auto	2.392239326679588	0.0	discard	29_3_in_6	Parallel run loop
auto	2.005315515059833	0.0	discard	36_3_in_8	Parallel run loop
auto	2.2202445231319086	0.0	discard	25_3_in_6	Parallel run loop
auto	2.826962951879392	0.0	keep	43_3_in_6	Parallel run loop
auto	2.869404348297652	0.0	discard	41_3_in_6	Parallel run loop
auto	11.496960516608057	0.0	discard	24_DOMINO_in_3	Parallel run loop
auto	2.8144757515942	0.0	discard	40_3_in_6	Parallel run loop
auto	3.0808382122870706	0.0	discard	47_3_in_6	Parallel run loop
auto	2.996780134943356	0.0	discard	46_3_in_6	Parallel run loop
auto	1.8389710039393146	0.0	discard	31_3_in_8	Parallel run loop
auto	2.5688970689079538	0.0	discard	34_3_in_6	Parallel run loop
auto	1.9234011199206806	0.0	keep	35_3_in_8	Parallel run loop
auto	4.329755603406173	0.0	discard	40_4_in_6	Parallel run loop
auto	1.375496389972524	0.0	discard	16_3_in_8	Parallel run loop
auto	14.059104074725978	0.0	discard	39_5_in_3	Parallel run loop
auto	1.7413227759945618	0.0	discard	27_3_in_8	Parallel run loop
auto	2.7817401872360397	0.0	keep	39_3_in_6	Parallel run loop
auto	4.596207854901943	0.0	discard	30_4_in_5	Parallel run loop
auto	2.40005564940699	0.0	discard	30_3_in_6	Parallel run loop
auto	2.9011880279892392	0.0	discard	42_3_in_6	Parallel run loop
auto	4.282850583980959	0.0	discard	13_DOMINO_in_5	Parallel run loop
auto	2.29511998306328	0.0	discard	26_3_in_6	Parallel run loop
auto	2.6668869691172086	0.0	discard	36_3_in_6	Parallel run loop
auto	3.113196485960975	0.0	discard	48_3_in_6	Parallel run loop
auto	2.0007365680544758	0.0	keep	37_3_in_8	Parallel run loop
auto	3.093889467843033	0.0	discard	49_3_in_6	Parallel run loop
auto	2.949875478200765	0.0	keep	45_3_in_6	Parallel run loop
auto	2.500002454603796	0.0	discard	32_3_in_6	Parallel run loop
auto	11.949685955614227	0.0	discard	18_6_in_3	Parallel run loop
auto	2.6885926966336195	0.0	discard	37_3_in_6	Parallel run loop
auto	2.55230427254843	0.0	discard	33_3_in_6	Parallel run loop
auto	2.768515134540913	0.0	discard	38_3_in_6	Parallel run loop
auto	2.360519680019161	0.0	discard	28_3_in_6	Parallel run loop
auto	2.649803008948617	0.0	discard	35_3_in_6	Parallel run loop
auto	2.9157054167583722	0.0	discard	44_3_in_6	Parallel run loop
auto	5.183417856881617	0.0	discard	40_4_in_5	Parallel run loop
auto	4.264303207446555	0.0	discard	39_4_in_6	Parallel run loop
auto	1.8795216741215133	0.0	discard	33_3_in_8	Parallel run loop
auto	8.928205000575302	0.0	discard	14_DOMINO_in_3	Parallel run loop
auto	2.8995127851870617	0.0	discard	33_4_in_8	Parallel run loop
auto	1.6640081377671292	0.0	discard	25_3_in_8	Parallel run loop
auto	2.8173532731791733	0.0	discard	40_3_in_6	Parallel run loop
auto	2.5900243148034874	0.0	discard	34_3_in_6	Parallel run loop
auto	2.8902772249653803	0.0	discard	43_3_in_6	Parallel run loop
auto	11.636036322703774	0.0	discard	24_DOMINO_in_3	Parallel run loop
auto	2.835322975277297	0.0	keep	41_3_in_6	Parallel run loop
auto	3.0083699296445445	0.0	discard	47_3_in_6	Parallel run loop
auto	2.985394454882998	0.0	keep	46_3_in_6	Parallel run loop
auto	1.9234011199206806	0.0	discard	35_3_in_8	Parallel run loop
auto	2.723006429727893	0.0	keep	39_3_in_6	Parallel run loop
auto	1.861211564742954	0.0	keep	3_DOMINO_in_6	Parallel run loop
auto	1.4369059842284526	0.0	keep	3_DOMINO_in_8	Parallel run loop
auto	14.060652063035493	0.0	discard	39_5_in_3	Parallel run loop
auto	2.9299782996480777	0.0	discard	42_3_in_6	Parallel run loop
auto	2.6461424293815186	0.0	discard	35_3_in_6	Parallel run loop
auto	1.719321539756422	0.0	discard	27_3_in_8	Parallel run loop
auto	3.1537733938116195	0.0	discard	49_3_in_6	Parallel run loop
auto	1.5196717723426367	0.0	keep	2_DOMINO_in_6	Parallel run loop
auto	2.013506380308664	0.0	discard	37_3_in_8	Parallel run loop
auto	2.938042663164316	0.0	discard	44_3_in_6	Parallel run loop
auto	1.3552982199663324	0.0	discard	16_3_in_8	Parallel run loop
auto	2.154702635076972	0.0	keep	4_DOMINO_in_6	Parallel run loop
auto	2.4515544902881565	0.0	discard	30_3_in_6	Parallel run loop
auto	2.9671633476005312	0.0	discard	45_3_in_6	Parallel run loop
auto	4.282850583980959	0.0	discard	13_DOMINO_in_5	Parallel run loop
auto	3.089119967907845	0.0	discard	48_3_in_6	Parallel run loop
auto	1.5733722032791817	0.0	keep	4_DOMINO_in_8	Parallel run loop
auto	2.8872878708831973	0.0	discard	43_3_in_6	Parallel run loop
auto	2.7911162555526676	0.0	keep	40_3_in_6	Parallel run loop
auto	2.937464396549383	0.0	keep	46_3_in_6	Parallel run loop
auto	2.8995127851870617	0.0	discard	33_4_in_8	Parallel run loop
auto	11.949685955614227	0.0	discard	18_6_in_3	Parallel run loop
auto	2.3575744016051847	0.0	discard	28_3_in_6	Parallel run loop
auto	2.827322344168984	0.0	keep	41_3_in_6	Parallel run loop
auto	2.992784062955144	0.0	keep	47_3_in_6	Parallel run loop
auto	1.6778600942355635	0.0	discard	25_3_in_8	Parallel run loop
auto	4.270745640985923	0.0	discard	39_4_in_6	Parallel run loop
auto	11.492553198092146	0.0	discard	24_DOMINO_in_3	Parallel run loop
auto	5.183417856881617	0.0	discard	40_4_in_5	Parallel run loop
auto	1.8782163812094022	0.0	discard	33_3_in_8	Parallel run loop
auto	2.723006429727893	0.0	discard	39_3_in_6	Parallel run loop
auto	8.928252848913793	0.0	discard	14_DOMINO_in_3	Parallel run loop
auto	2.0000014092791627	0.0	discard	2_8_in_8	Parallel run loop
auto	1.5357469254971334	0.0	discard	2_4_in_5	Parallel run loop
auto	3.359611268263679	0.0	discard	2_8_in_5	Parallel run loop
auto	2.4689455391270005	0.0	discard	2_6_in_5	Parallel run loop
auto	3.0633908590566556	0.0	discard	49_3_in_6	Parallel run loop
auto	2.6399362781126556	0.0	discard	35_3_in_6	Parallel run loop
auto	2.588275614046589	0.0	discard	34_3_in_6	Parallel run loop
auto	2.9250076663639404	0.0	keep	45_3_in_6	Parallel run loop
auto	2.8977835791573496	0.0	keep	44_3_in_6	Parallel run loop
auto	0.736539920691255	0.0	keep	3_3_in_8	Parallel run loop
auto	1.9234011199206806	0.0	discard	35_3_in_8	Parallel run loop
auto	0.9892996509203482	0.0	keep	3_3_in_6	Parallel run loop
auto	1.9727680284776081	0.0	keep	37_3_in_8	Parallel run loop
auto	2.9836331985473015	0.0	discard	48_3_in_6	Parallel run loop
auto	1.3457751041431714	0.0	keep	16_3_in_8	Parallel run loop
auto	1.971205364122458	0.0	discard	2_DOMINO_in_DOMINO	Parallel run loop
auto	1.7333251289521023	0.0	discard	27_3_in_8	Parallel run loop
auto	2.9538865110739874	0.0	discard	46_3_in_6	Parallel run loop
auto	8.776229960288623	0.0	keep	14_DOMINO_in_3	Parallel run loop
auto	0.876699268544093	0.0	discard	2_4_in_8	Parallel run loop
auto	4.282850583980959	0.0	discard	13_DOMINO_in_5	Parallel run loop
auto	11.495892128497758	0.0	discard	24_DOMINO_in_3	Parallel run loop
auto	5.194002084042339	0.0	discard	40_4_in_5	Parallel run loop
auto	2.742215100164393	0.0	discard	39_3_in_6	Parallel run loop
auto	2.827322344168984	0.0	discard	41_3_in_6	Parallel run loop
auto	11.954496342456913	0.0	discard	18_6_in_3	Parallel run loop
auto	2.374524328017774	0.0	discard	28_3_in_6	Parallel run loop
auto	1.8804126470302613	0.0	discard	33_3_in_8	Parallel run loop
auto	4.121327274071906	0.0	discard	2_8_in_4	Parallel run loop
auto	2.816446672910001	0.0	discard	40_3_in_6	Parallel run loop
auto	2.8995779267470345	0.0	discard	33_4_in_8	Parallel run loop
auto	2.1005153696408363	0.0	discard	3_5_in_DOMINO	Parallel run loop
auto	2.9648456099124285	0.0	discard	43_3_in_6	Parallel run loop
auto	5.219936469636757	0.0	discard	4_5_in_3	Parallel run loop
auto	2.9836331985473015	0.0	discard	48_3_in_6	Parallel run loop
auto	3.0002038792065733	0.0	discard	49_3_in_6	Parallel run loop
auto	3.359611268263679	0.0	discard	2_8_in_5	Parallel run loop
auto	1.725010368343479	0.0	discard	27_3_in_8	Parallel run loop
auto	2.588275614046589	0.0	discard	34_3_in_6	Parallel run loop
auto	2.4689455391270005	0.0	discard	2_6_in_5	Parallel run loop
auto	1.9727680284776081	0.0	discard	37_3_in_8	Parallel run loop
auto	2.9960574323666354	0.0	discard	47_3_in_6	Parallel run loop
auto	2.5713030687769125	0.0	keep	35_3_in_6	Parallel run loop
auto	2.0000014092791627	0.0	discard	2_8_in_8	Parallel run loop
auto	1.3490165122029604e-26	0.0	keep	1_8_in_3	Parallel run loop
auto	1.9215863720066504	0.0	keep	35_3_in_8	Parallel run loop
auto	1.5357469254971334	0.0	discard	2_4_in_5	Parallel run loop
auto	2.892789388057696	0.0	keep	44_3_in_6	Parallel run loop
auto	1.971205364122458	0.0	discard	2_DOMINO_in_DOMINO	Parallel run loop
auto	3.5136774054888793	0.0	discard	3_8_in_DOMINO	Parallel run loop
auto	2.236068067823152	0.0	discard	3_5_in_5	Parallel run loop
auto	2.947442396851262	0.0	keep	4_6_in_DOMINO	Parallel run loop
