commit	score	memory_gb	status	problem	description
auto	2.485835231656688	0.0	discard	32_3_in_6	Parallel run loop
auto	4.036965648323428	0.0	discard	35_4_in_6	Parallel run loop
auto	3.657357456511554	0.0	discard	28_4_in_6	Parallel run loop
auto	2.4149547696293094	0.0	discard	30_3_in_6	Parallel run loop
auto	2.8599677294777037	0.0	discard	32_4_in_8	Parallel run loop
auto	1.5708892985329193	0.0	discard	22_3_in_8	Parallel run loop
auto	4.701209644746939	0.0	discard	30_4_in_5	Parallel run loop
auto	2.519017470378839	0.0	discard	25_4_in_8	Parallel run loop
auto	1.7948348845423978	0.0	discard	30_3_in_8	Parallel run loop
auto	13.884493816920813	0.0	discard	38_5_in_3	Parallel run loop
auto	14.077674238257678	0.0	discard	25_6_in_3	Parallel run loop
auto	2.382191620351339	0.0	discard	21_4_in_8	Parallel run loop
auto	4.95906101564547	0.0	discard	32_4_in_5	Parallel run loop
auto	4.041621768437455	0.0	discard	36_4_in_6	Parallel run loop
auto	1.8262321636215084	0.0	discard	31_3_in_8	Parallel run loop
auto	2.3560708845512424	0.0	keep	29_3_in_6	Parallel run loop
auto	5.33386413036413	0.0	discard	38_4_in_5	Parallel run loop
auto	14.05678443804131	0.0	discard	39_5_in_3	Parallel run loop
auto	1.9582229879796893	0.0	discard	36_3_in_8	Parallel run loop
auto	2.7228640292078126	0.0	discard	29_4_in_8	Parallel run loop
auto	3.3833817024149666	0.0	discard	28_4_in_CIRCLE	Parallel run loop
auto	1.6577100735479915	0.0	discard	25_3_in_8	Parallel run loop
auto	2.7702964943057093	0.0	discard	30_4_in_8	Parallel run loop
auto	3.4467857018435315	0.0	discard	24_4_in_6	Parallel run loop
auto	5.0191542333404096	0.0	discard	37_4_in_5	Parallel run loop
auto	1.5400946759899503	0.0	discard	21_3_in_8	Parallel run loop
auto	1.7302612376665731	0.0	discard	27_3_in_8	Parallel run loop
auto	1.4801224664338222	0.0	discard	19_3_in_8	Parallel run loop
auto	11.960108969580684	0.0	discard	18_6_in_3	Parallel run loop
auto	2.5152513691822214	0.0	discard	32_3_in_6	Parallel run loop
auto	12.910495881561323	0.0	discard	33_5_in_3	Parallel run loop
auto	1.5104429077839856	0.0	discard	20_3_in_8	Parallel run loop
auto	2.989736754164845	0.0	discard	32_4_in_8	Parallel run loop
auto	2.4149547696293094	0.0	discard	30_3_in_6	Parallel run loop
auto	3.5804455387083056	0.0	discard	27_4_in_6	Parallel run loop
auto	12.771121686878123	0.0	discard	32_5_in_3	Parallel run loop
auto	1.7948348845423978	0.0	discard	30_3_in_8	Parallel run loop
auto	1.7439957676520519	0.0	discard	12_3_in_DOMINO	Parallel run loop
auto	2.9476053891229426	0.0	discard	35_4_in_8	Parallel run loop
auto	1.5708892985329193	0.0	discard	22_3_in_8	Parallel run loop
auto	13.884493816920813	0.0	discard	38_5_in_3	Parallel run loop
auto	1.4029233710948728	0.0	discard	17_3_in_8	Parallel run loop
auto	3.504561196287405	0.0	discard	26_4_in_6	Parallel run loop
auto	1.8804777931882963	0.0	discard	13_3_in_DOMINO	Parallel run loop
auto	1.5400946759899503	0.0	discard	21_3_in_8	Parallel run loop
auto	2.3838544843563816	0.0	discard	29_3_in_6	Parallel run loop
auto	1.6577100735479915	0.0	discard	25_3_in_8	Parallel run loop
auto	1.7302612376665731	0.0	discard	27_3_in_8	Parallel run loop
auto	2.382191620351339	0.0	discard	21_4_in_8	Parallel run loop
auto	1.8262321636215084	0.0	discard	31_3_in_8	Parallel run loop
auto	1.9582229879796893	0.0	discard	36_3_in_8	Parallel run loop
auto	5.005146389003712	0.0	discard	33_4_in_5	Parallel run loop
auto	3.7196445790114643	0.0	discard	29_4_in_6	Parallel run loop
auto	5.1332484788868875	0.0	discard	35_4_in_5	Parallel run loop
auto	7.03616573595127	0.0	discard	20_DOMINO_in_4	Parallel run loop
auto	13.946930352147506	0.0	discard	25_6_in_3	Parallel run loop
auto	4.038580838360076	0.0	discard	35_4_in_6	Parallel run loop
auto	5.280266465267401	0.0	discard	40_4_in_5	Parallel run loop
auto	5.009626418189186	0.0	keep	37_4_in_5	Parallel run loop
auto	1.7948348845423978	0.0	discard	30_3_in_8	Parallel run loop
auto	4.786866784335104	0.0	discard	30_4_in_5	Parallel run loop
auto	1.5104429077839856	0.0	discard	20_3_in_8	Parallel run loop
auto	3.657357456511554	0.0	discard	28_4_in_6	Parallel run loop
auto	2.918027744296042	0.0	discard	32_4_in_8	Parallel run loop
auto	2.3476825245566384	0.0	discard	28_3_in_6	Parallel run loop
auto	2.6787871087209503	0.0	keep	38_3_in_6	Parallel run loop
auto	12.910495881561323	0.0	discard	33_5_in_3	Parallel run loop
auto	3.445062653636714	0.0	discard	24_4_in_6	Parallel run loop
auto	14.05678443804131	0.0	discard	39_5_in_3	Parallel run loop
auto	12.771121686878123	0.0	discard	32_5_in_3	Parallel run loop
auto	2.7228640292078126	0.0	discard	29_4_in_8	Parallel run loop
auto	4.410638612632372	0.0	discard	40_4_in_6	Parallel run loop
auto	4.95906101564547	0.0	discard	32_4_in_5	Parallel run loop
auto	1.76341890008406	0.0	discard	28_3_in_8	Parallel run loop
auto	2.8993617483110063	0.0	discard	30_4_in_8	Parallel run loop
auto	1.4801224664338222	0.0	discard	19_3_in_8	Parallel run loop
auto	11.960108969580684	0.0	discard	18_6_in_3	Parallel run loop
auto	2.4149547696293094	0.0	discard	30_3_in_6	Parallel run loop
auto	2.9051992788582677	0.0	discard	33_4_in_8	Parallel run loop
auto	2.382191620351339	0.0	discard	21_4_in_8	Parallel run loop
auto	1.7802430144454746	0.0	discard	29_3_in_8	Parallel run loop
auto	1.8262321636215084	0.0	discard	31_3_in_8	Parallel run loop
auto	3.178905265988797	0.0	discard	40_4_in_8	Parallel run loop
auto	1.5400946759899503	0.0	discard	21_3_in_8	Parallel run loop
auto	3.504561196287405	0.0	discard	26_4_in_6	Parallel run loop
auto	5.046837023672625	0.0	discard	37_4_in_5	Parallel run loop
auto	1.4029233710948728	0.0	discard	17_3_in_8	Parallel run loop
auto	13.820493131853882	0.0	discard	25_6_in_3	Parallel run loop
auto	2.519017470378839	0.0	discard	25_4_in_8	Parallel run loop
auto	1.935046816120619	0.0	discard	36_3_in_8	Parallel run loop
auto	13.884493816920813	0.0	discard	38_5_in_3	Parallel run loop
auto	1.7439957676520519	0.0	discard	12_3_in_DOMINO	Parallel run loop
auto	1.4801224664338222	0.0	discard	19_3_in_8	Parallel run loop
auto	3.459563071375535	0.0	discard	24_4_in_6	Parallel run loop
auto	1.8804777931882963	0.0	discard	13_3_in_DOMINO	Parallel run loop
auto	8.651091643465453	0.0	discard	13_DOMINO_in_3	Parallel run loop
auto	2.3476825245566384	0.0	discard	28_3_in_6	Parallel run loop
auto	1.7948348845423978	0.0	discard	30_3_in_8	Parallel run loop
auto	4.115639782283407	0.0	discard	35_4_in_6	Parallel run loop
auto	4.726818672940521	0.0	discard	32_4_in_5	Parallel run loop
auto	12.910495881561323	0.0	discard	33_5_in_3	Parallel run loop
auto	3.504561196287405	0.0	discard	26_4_in_6	Parallel run loop
auto	2.7228640292078126	0.0	discard	29_4_in_8	Parallel run loop
auto	2.382191620351339	0.0	discard	21_4_in_8	Parallel run loop
auto	4.8287150492886575	0.0	discard	33_4_in_5	Parallel run loop
auto	11.960108969580684	0.0	discard	18_6_in_3	Parallel run loop
auto	1.76341890008406	0.0	discard	28_3_in_8	Parallel run loop
auto	3.6186020414508318	0.0	discard	27_4_in_6	Parallel run loop
auto	14.05678443804131	0.0	discard	39_5_in_3	Parallel run loop
auto	12.771121686878123	0.0	discard	32_5_in_3	Parallel run loop
auto	2.7702964943057093	0.0	discard	30_4_in_8	Parallel run loop
auto	5.33386413036413	0.0	discard	38_4_in_5	Parallel run loop
auto	3.7356742913814442	0.0	discard	29_4_in_6	Parallel run loop
auto	13.820493131853882	0.0	discard	25_6_in_3	Parallel run loop
auto	4.041621768437455	0.0	discard	36_4_in_6	Parallel run loop
auto	2.9476053891229426	0.0	discard	35_4_in_8	Parallel run loop
auto	2.4149547696293094	0.0	discard	30_3_in_6	Parallel run loop
auto	1.935046816120619	0.0	discard	36_3_in_8	Parallel run loop
auto	4.973692147620266	0.0	discard	35_4_in_5	Parallel run loop
auto	2.8599677294777037	0.0	discard	32_4_in_8	Parallel run loop
auto	5.442588749725697	0.0	discard	40_4_in_5	Parallel run loop
auto	7.03616573595127	0.0	discard	20_DOMINO_in_4	Parallel run loop
auto	2.743886341550862	0.0	discard	38_3_in_6	Parallel run loop
auto	3.178905265988797	0.0	discard	40_4_in_8	Parallel run loop
auto	3.64494293706607	0.0	discard	28_4_in_6	Parallel run loop
auto	12.261313043390997	0.0	discard	27_DOMINO_in_3	Parallel run loop
auto	1.7948348845423978	0.0	discard	30_3_in_8	Parallel run loop
auto	4.318112688023703	0.0	discard	40_4_in_6	Parallel run loop
auto	4.786866784335104	0.0	discard	30_4_in_5	Parallel run loop
auto	2.6863951488447557	0.0	discard	37_3_in_6	Parallel run loop
auto	1.7439957676520519	0.0	discard	12_3_in_DOMINO	Parallel run loop
auto	8.651091643465453	0.0	discard	13_DOMINO_in_3	Parallel run loop
auto	3.439554685537472	0.0	discard	24_4_in_6	Parallel run loop
auto	11.881182844607538	0.0	discard	25_DOMINO_in_3	Parallel run loop
auto	2.4149547696293094	0.0	discard	30_3_in_6	Parallel run loop
auto	2.519017470378839	0.0	discard	25_4_in_8	Parallel run loop
auto	2.3838544843563816	0.0	discard	29_3_in_6	Parallel run loop
auto	2.7228640292078126	0.0	discard	29_4_in_8	Parallel run loop
auto	11.10639567382138	0.0	discard	22_DOMINO_in_3	Parallel run loop
auto	1.935046816120619	0.0	discard	36_3_in_8	Parallel run loop
auto	2.382191620351339	0.0	discard	21_4_in_8	Parallel run loop
auto	13.820493131853882	0.0	discard	25_6_in_3	Parallel run loop
auto	5.173022929798316	0.0	discard	38_4_in_5	Parallel run loop
auto	13.884493816920813	0.0	discard	38_5_in_3	Parallel run loop
auto	2.7702964943057093	0.0	discard	30_4_in_8	Parallel run loop
auto	2.9051992788582677	0.0	discard	33_4_in_8	Parallel run loop
auto	4.005521716751597	0.0	discard	33_4_in_6	Parallel run loop
auto	4.431861633641944	0.0	discard	40_4_in_6	Parallel run loop
auto	4.900949552394857	0.0	discard	35_4_in_5	Parallel run loop
auto	3.504561196287405	0.0	discard	26_4_in_6	Parallel run loop
auto	4.843428274429765	0.0	discard	33_4_in_5	Parallel run loop
auto	2.9476053891229426	0.0	discard	35_4_in_8	Parallel run loop
auto	4.041621768437455	0.0	discard	36_4_in_6	Parallel run loop
auto	11.960108969580684	0.0	discard	18_6_in_3	Parallel run loop
auto	3.5790135753052335	0.0	discard	27_4_in_6	Parallel run loop
auto	4.0959310646411	0.0	discard	35_4_in_6	Parallel run loop
auto	3.7136976091762173	0.0	discard	29_4_in_6	Parallel run loop
auto	2.5152513691822214	0.0	discard	32_3_in_6	Parallel run loop
auto	12.771121686878123	0.0	discard	32_5_in_3	Parallel run loop
auto	12.910495881561323	0.0	discard	33_5_in_3	Parallel run loop
auto	14.05678443804131	0.0	discard	39_5_in_3	Parallel run loop
auto	3.6639469581861013	0.0	discard	28_4_in_6	Parallel run loop
auto	4.726818672940521	0.0	discard	32_4_in_5	Parallel run loop
auto	5.442588749725697	0.0	discard	40_4_in_5	Parallel run loop
auto	4.786866784335104	0.0	discard	30_4_in_5	Parallel run loop
auto	7.03616573595127	0.0	discard	20_DOMINO_in_4	Parallel run loop
auto	2.4149547696293094	0.0	discard	30_3_in_6	Parallel run loop
auto	2.8599677294777037	0.0	discard	32_4_in_8	Parallel run loop
auto	1.935046816120619	0.0	discard	36_3_in_8	Parallel run loop
auto	3.449889360597646	0.0	discard	24_4_in_6	Parallel run loop
auto	2.6863951488447557	0.0	discard	37_3_in_6	Parallel run loop
auto	3.178905265988797	0.0	discard	40_4_in_8	Parallel run loop
auto	11.78013726824729	0.0	keep	25_DOMINO_in_3	Parallel run loop
auto	1.7439957676520519	0.0	discard	12_3_in_DOMINO	Parallel run loop
auto	8.651091643465453	0.0	discard	13_DOMINO_in_3	Parallel run loop
auto	11.260853826103226	0.0	discard	23_DOMINO_in_3	Parallel run loop
auto	10.95333223592899	0.0	discard	21_DOMINO_in_3	Parallel run loop
auto	12.261313043390997	0.0	discard	27_DOMINO_in_3	Parallel run loop
auto	4.075909095196951	0.0	discard	35_4_in_6	Parallel run loop
auto	13.884493816920813	0.0	discard	38_5_in_3	Parallel run loop
auto	4.862108401795182	0.0	discard	33_4_in_5	Parallel run loop
auto	2.3476825245566384	0.0	discard	28_3_in_6	Parallel run loop
auto	4.041621768437455	0.0	discard	36_4_in_6	Parallel run loop
auto	2.3838544843563816	0.0	discard	29_3_in_6	Parallel run loop
auto	2.7702964943057093	0.0	discard	30_4_in_8	Parallel run loop
auto	3.504561196287405	0.0	discard	26_4_in_6	Parallel run loop
auto	13.820493131853882	0.0	discard	25_6_in_3	Parallel run loop
auto	5.1332484788868875	0.0	discard	35_4_in_5	Parallel run loop
auto	12.910495881561323	0.0	discard	33_5_in_3	Parallel run loop
auto	2.9476053891229426	0.0	discard	35_4_in_8	Parallel run loop
auto	2.485835231656688	0.0	discard	32_3_in_6	Parallel run loop
auto	2.519017470378839	0.0	discard	25_4_in_8	Parallel run loop
auto	11.966322751034012	0.0	keep	26_DOMINO_in_3	Parallel run loop
auto	3.989929826398649	0.0	discard	33_4_in_6	Parallel run loop
auto	2.6787871087209503	0.0	discard	38_3_in_6	Parallel run loop
auto	2.7228640292078126	0.0	discard	29_4_in_8	Parallel run loop
auto	2.9051992788582677	0.0	discard	33_4_in_8	Parallel run loop
auto	12.771121686878123	0.0	discard	32_5_in_3	Parallel run loop
auto	1.935046816120619	0.0	discard	36_3_in_8	Parallel run loop
auto	11.10639567382138	0.0	discard	22_DOMINO_in_3	Parallel run loop
auto	5.33386413036413	0.0	discard	38_4_in_5	Parallel run loop
auto	2.382191620351339	0.0	discard	21_4_in_8	Parallel run loop
auto	3.5285482113357163	0.0	keep	27_4_in_6	Parallel run loop
auto	11.881182844607538	0.0	discard	25_DOMINO_in_3	Parallel run loop
auto	11.960108969580684	0.0	discard	18_6_in_3	Parallel run loop
auto	3.6749058577712312	0.0	keep	29_4_in_6	Parallel run loop
auto	6.987123361662304	0.0	keep	20_DOMINO_in_4	Parallel run loop
auto	5.349950852901027	0.0	discard	40_4_in_5	Parallel run loop
auto	11.260853826103226	0.0	discard	23_DOMINO_in_3	Parallel run loop
auto	2.8599677294777037	0.0	discard	32_4_in_8	Parallel run loop
auto	4.669097318272951	0.0	discard	19_3_in_3	Parallel run loop
auto	11.881182844607538	0.0	discard	25_DOMINO_in_3	Parallel run loop
auto	11.966322751034012	0.0	discard	26_DOMINO_in_3	Parallel run loop
auto	10.95333223592899	0.0	discard	21_DOMINO_in_3	Parallel run loop
auto	3.442651833121761	0.0	discard	24_4_in_6	Parallel run loop
auto	2.3476825245566384	0.0	discard	28_3_in_6	Parallel run loop
auto	3.5815198872324605	0.0	discard	27_4_in_6	Parallel run loop
auto	2.8993617483110063	0.0	discard	30_4_in_8	Parallel run loop
auto	1.7439957676520519	0.0	discard	12_3_in_DOMINO	Parallel run loop
auto	13.946930352147506	0.0	discard	25_6_in_3	Parallel run loop
auto	12.261313043390997	0.0	discard	27_DOMINO_in_3	Parallel run loop
auto	2.485835231656688	0.0	discard	32_3_in_6	Parallel run loop
auto	4.37593011124105	0.0	discard	40_4_in_6	Parallel run loop
auto	2.519017470378839	0.0	discard	25_4_in_8	Parallel run loop
auto	14.05678443804131	0.0	discard	39_5_in_3	Parallel run loop
auto	2.6863951488447557	0.0	discard	37_3_in_6	Parallel run loop
auto	3.65224048293681	0.0	discard	28_4_in_6	Parallel run loop
auto	2.968311099473362	0.0	discard	43_3_in_6	Parallel run loop
auto	2.9051992788582677	0.0	discard	33_4_in_8	Parallel run loop
auto	2.743886341550862	0.0	discard	38_3_in_6	Parallel run loop
auto	2.7228640292078126	0.0	discard	29_4_in_8	Parallel run loop
auto	4.041621768437455	0.0	discard	36_4_in_6	Parallel run loop
auto	13.884493816920813	0.0	discard	38_5_in_3	Parallel run loop
auto	12.910495881561323	0.0	discard	33_5_in_3	Parallel run loop
auto	3.178905265988797	0.0	discard	40_4_in_8	Parallel run loop
auto	7.03616573595127	0.0	discard	20_DOMINO_in_4	Parallel run loop
auto	5.27213836413791	0.0	discard	37_4_in_5	Parallel run loop
auto	2.3838544843563816	0.0	discard	29_3_in_6	Parallel run loop
auto	12.771121686878123	0.0	discard	32_5_in_3	Parallel run loop
auto	4.9094704054890155	0.0	discard	32_4_in_5	Parallel run loop
auto	4.786866784335104	0.0	discard	30_4_in_5	Parallel run loop
auto	3.6774793211540797	0.0	discard	29_4_in_6	Parallel run loop
auto	4.817105164761469	0.0	discard	33_4_in_5	Parallel run loop
auto	11.960108969580684	0.0	discard	18_6_in_3	Parallel run loop
auto	2.3476825245566384	0.0	discard	28_3_in_6	Parallel run loop
auto	12.402922356105613	0.0	discard	26_DOMINO_in_3	Parallel run loop
auto	2.382191620351339	0.0	discard	21_4_in_8	Parallel run loop
auto	2.9476053891229426	0.0	discard	35_4_in_8	Parallel run loop
auto	3.8758779050283025	0.0	keep	33_4_in_6	Parallel run loop
auto	12.261313043390997	0.0	discard	27_DOMINO_in_3	Parallel run loop
auto	4.0636990815789	0.0	discard	35_4_in_6	Parallel run loop
auto	2.485835231656688	0.0	discard	32_3_in_6	Parallel run loop
auto	8.651091643465453	0.0	discard	13_DOMINO_in_3	Parallel run loop
auto	5.211584754678705	0.0	discard	38_4_in_5	Parallel run loop
auto	11.10639567382138	0.0	discard	22_DOMINO_in_3	Parallel run loop
auto	4.669097318272951	0.0	discard	19_3_in_3	Parallel run loop
auto	10.95333223592899	0.0	discard	21_DOMINO_in_3	Parallel run loop
auto	3.6763761876784358	0.0	discard	29_4_in_6	Parallel run loop
auto	3.6445784427723638	0.0	discard	28_4_in_6	Parallel run loop
auto	3.9979180710521085	0.0	discard	33_4_in_6	Parallel run loop
auto	5.1332484788868875	0.0	discard	35_4_in_5	Parallel run loop
auto	3.415902270245124	0.0	keep	24_4_in_6	Parallel run loop
auto	2.6863951488447557	0.0	discard	37_3_in_6	Parallel run loop
auto	2.989736754164845	0.0	discard	32_4_in_8	Parallel run loop
auto	3.504561196287405	0.0	discard	26_4_in_6	Parallel run loop
auto	13.820493131853882	0.0	discard	25_6_in_3	Parallel run loop
auto	4.4185853093579075	0.0	discard	40_4_in_6	Parallel run loop
auto	5.349950852901027	0.0	discard	40_4_in_5	Parallel run loop
auto	10.651500718525643	0.0	discard	20_DOMINO_in_3	Parallel run loop
auto	1.8262321636215084	0.0	discard	31_3_in_8	Parallel run loop
auto	3.307035932447277	0.0	discard	40_4_in_8	Parallel run loop
auto	11.165530888178623	0.0	keep	23_DOMINO_in_3	Parallel run loop
auto	14.05678443804131	0.0	discard	39_5_in_3	Parallel run loop
auto	2.485835231656688	0.0	discard	32_3_in_6	Parallel run loop
auto	5.005146389003712	0.0	discard	33_4_in_5	Parallel run loop
auto	2.7228640292078126	0.0	discard	29_4_in_8	Parallel run loop
auto	12.771121686878123	0.0	discard	32_5_in_3	Parallel run loop
auto	5.27213836413791	0.0	discard	37_4_in_5	Parallel run loop
auto	2.519017470378839	0.0	discard	25_4_in_8	Parallel run loop
auto	3.6653630364358016	0.0	keep	29_4_in_6	Parallel run loop
auto	3.5363199517738764	0.0	discard	27_4_in_6	Parallel run loop
auto	4.041621768437455	0.0	discard	36_4_in_6	Parallel run loop
auto	11.960108969580684	0.0	discard	18_6_in_3	Parallel run loop
auto	4.786866784335104	0.0	discard	30_4_in_5	Parallel run loop
auto	13.884493816920813	0.0	discard	38_5_in_3	Parallel run loop
auto	4.726818672940521	0.0	discard	32_4_in_5	Parallel run loop
auto	12.910495881561323	0.0	discard	33_5_in_3	Parallel run loop
auto	2.9051992788582677	0.0	discard	33_4_in_8	Parallel run loop
auto	2.989736754164845	0.0	discard	32_4_in_8	Parallel run loop
auto	4.039388675701329	0.0	discard	35_4_in_6	Parallel run loop
auto	5.1332484788868875	0.0	discard	35_4_in_5	Parallel run loop
auto	2.485835231656688	0.0	discard	32_3_in_6	Parallel run loop
auto	10.95333223592899	0.0	discard	21_DOMINO_in_3	Parallel run loop
auto	2.382191620351339	0.0	discard	21_4_in_8	Parallel run loop
auto	3.8703076298444965	0.0	keep	16_DOMINO_in_6	Parallel run loop
auto	2.9476053891229426	0.0	discard	35_4_in_8	Parallel run loop
auto	14.077674238257678	0.0	discard	25_6_in_3	Parallel run loop
auto	3.4350859463154606	0.0	discard	24_4_in_6	Parallel run loop
auto	11.10639567382138	0.0	discard	22_DOMINO_in_3	Parallel run loop
auto	8.651091643465453	0.0	discard	13_DOMINO_in_3	Parallel run loop
auto	12.261313043390997	0.0	discard	27_DOMINO_in_3	Parallel run loop
auto	11.260853826103226	0.0	discard	23_DOMINO_in_3	Parallel run loop
auto	5.280525489060489	0.0	discard	38_4_in_5	Parallel run loop
auto	3.504561196287405	0.0	discard	26_4_in_6	Parallel run loop
auto	4.669097318272951	0.0	discard	19_3_in_3	Parallel run loop
auto	11.966322751034012	0.0	discard	26_DOMINO_in_3	Parallel run loop
auto	3.6624815992249897	0.0	discard	28_4_in_6	Parallel run loop
auto	11.881182844607538	0.0	discard	25_DOMINO_in_3	Parallel run loop
auto	2.8993617483110063	0.0	discard	30_4_in_8	Parallel run loop
auto	5.442588749725697	0.0	discard	40_4_in_5	Parallel run loop
auto	10.651500718525643	0.0	discard	20_DOMINO_in_3	Parallel run loop
auto	13.884493816920813	0.0	discard	38_5_in_3	Parallel run loop
auto	3.673803496257401	0.0	discard	29_4_in_6	Parallel run loop
auto	1.8262321636215084	0.0	discard	31_3_in_8	Parallel run loop
auto	11.966322751034012	0.0	discard	26_DOMINO_in_3	Parallel run loop
auto	3.6202401745206276	0.0	keep	28_4_in_6	Parallel run loop
auto	3.597673853599941	0.0	discard	27_4_in_6	Parallel run loop
auto	4.312502508422498	0.0	keep	40_4_in_6	Parallel run loop
auto	12.771121686878123	0.0	discard	32_5_in_3	Parallel run loop
auto	3.178905265988797	0.0	discard	40_4_in_8	Parallel run loop
auto	3.4550683368527557	0.0	discard	24_4_in_6	Parallel run loop
auto	14.05678443804131	0.0	discard	39_5_in_3	Parallel run loop
auto	2.7228640292078126	0.0	discard	29_4_in_8	Parallel run loop
auto	4.061667638367384	0.0	discard	35_4_in_6	Parallel run loop
auto	2.5152513691822214	0.0	discard	32_3_in_6	Parallel run loop
auto	4.837830673478732	0.0	discard	32_4_in_5	Parallel run loop
auto	2.9051992788582677	0.0	discard	33_4_in_8	Parallel run loop
auto	3.8768930781381097	0.0	discard	16_DOMINO_in_6	Parallel run loop
auto	4.92794766605847	0.0	discard	35_4_in_5	Parallel run loop
auto	12.910495881561323	0.0	discard	33_5_in_3	Parallel run loop
auto	2.9476053891229426	0.0	discard	35_4_in_8	Parallel run loop
auto	5.020158214781784	0.0	discard	37_4_in_5	Parallel run loop
auto	11.78013726824729	0.0	discard	25_DOMINO_in_3	Parallel run loop
auto	11.960108969580684	0.0	discard	18_6_in_3	Parallel run loop
auto	4.041621768437455	0.0	discard	36_4_in_6	Parallel run loop
auto	3.89258090088692	0.0	discard	33_4_in_6	Parallel run loop
auto	2.519017470378839	0.0	discard	25_4_in_8	Parallel run loop
auto	5.005146389003712	0.0	discard	33_4_in_5	Parallel run loop
auto	2.382191620351339	0.0	discard	21_4_in_8	Parallel run loop
auto	4.738998116491754	0.0	discard	30_4_in_5	Parallel run loop
auto	4.3467079220165505	0.0	discard	40_4_in_6	Parallel run loop
auto	13.946930352147506	0.0	discard	25_6_in_3	Parallel run loop
