commit	score	memory_gb	status	problem	description
auto	8.42219704630891	0.0	discard	14_DOMINO_in_TAN	Parallel run loop
auto	1.89165931459218	0.0	discard	12_TAN_in_DOMINO	Parallel run loop
auto	2.271288926959304	0.0	discard	22_TAN_in_6	Parallel run loop
auto	4.729536631931697	0.0	discard	19_tan_in_tan	Parallel run loop
auto	1.249366653376161	0.0	discard	12_TAN_in_8	Parallel run loop
auto	5.474709635576648	0.0	keep	26_tan_in_tan	Parallel run loop
auto	5.32333653998721	0.0	discard	24_tan_in_tan	Parallel run loop
auto	8.966214411204323	0.0	discard	16_DOMINO_in_TAN	Parallel run loop
auto	2.0001616407760103	0.0	discard	14_TAN_in_DOMINO	Parallel run loop
auto	4.399292678920288	0.0	discard	17_tan_in_tan	Parallel run loop
auto	1.504962924277851	0.0	discard	11_tan_in_cir	Parallel run loop
auto	4.180868981824639	0.0	discard	15_tan_in_tan	Parallel run loop
auto	4.61203026158967	0.0	discard	15_TAN_in_3	Parallel run loop
auto	3.4420908138378827	0.0	discard	20_TAN_in_4	Parallel run loop
auto	2.5948972960942824	0.0	keep	19_TAN_in_5	Parallel run loop
auto	1.3473195291947468	0.0	discard	6_TAN_in_DOMINO	Parallel run loop
auto	1.0903961800724427	0.0	discard	9_TAN_in_8	Parallel run loop
auto	4.860368863295339	0.0	discard	23_3_in_tan	Parallel run loop
auto	2.1503352557147117	0.0	discard	13_TAN_in_5	Parallel run loop
auto	1.6997701539863892	0.0	discard	12_TAN_in_6	Parallel run loop
auto	1.7489369801125592	0.0	discard	15_tan_in_cir	Parallel run loop
auto	11.820682276697985	0.0	discard	20_6_in_TAN	Parallel run loop
auto	1.8318572592700877	0.0	discard	14_TAN_in_6	Parallel run loop
auto	5.610107013670145	0.0	discard	27_tan_in_tan	Parallel run loop
auto	3.7454927197499943	0.0	keep	24_TAN_in_4	Parallel run loop
auto	1.3465210871106505	0.0	discard	14_TAN_in_8	Parallel run loop
auto	1.203980987832925	0.0	discard	11_TAN_in_8	Parallel run loop
auto	1.9866162193040848	0.0	keep	11_TAN_in_5	Parallel run loop
auto	0.9496035849179189	0.0	discard	2_TAN_in_DOMINO	Parallel run loop
auto	0.9340577012333658	0.0	discard	3_tan_in_cir	Parallel run loop
auto	2.366889709248003	0.0	discard	4_3_in_tan	Parallel run loop
auto	1.8977361788735476	0.0	discard	10_TAN_in_5	Parallel run loop
auto	1.249366653376161	0.0	discard	12_TAN_in_8	Parallel run loop
auto	1.886679605202572	0.0	keep	12_TAN_in_DOMINO	Parallel run loop
auto	2.4719440872562815	0.0	discard	17_TAN_in_5	Parallel run loop
auto	2.7787972337337923	0.0	discard	22_TAN_in_5	Parallel run loop
auto	2.0001616407760103	0.0	discard	14_TAN_in_DOMINO	Parallel run loop
auto	2.270834691886802	0.0	discard	22_TAN_in_6	Parallel run loop
auto	1.8879231561393415	0.0	discard	15_TAN_in_6	Parallel run loop
auto	5.50742494426421	0.0	discard	26_tan_in_tan	Parallel run loop
auto	8.966214411204323	0.0	discard	16_DOMINO_in_TAN	Parallel run loop
auto	1.5105941147975273	0.0	discard	11_tan_in_cir	Parallel run loop
auto	1.9581643987272404	0.0	discard	19_tan_in_cir	Parallel run loop
auto	2.0735254832397785	0.0	discard	18_TAN_in_6	Parallel run loop
auto	0.9943350788220494	0.0	discard	7_TAN_in_8	Parallel run loop
auto	2.155474857013442	0.0	keep	20_TAN_in_6	Parallel run loop
auto	3.781497644960352	0.0	discard	24_TAN_in_4	Parallel run loop
auto	2.1454609417641386	0.0	keep	13_TAN_in_5	Parallel run loop
auto	11.820682276697985	0.0	discard	20_6_in_TAN	Parallel run loop
auto	0.7239009551121717	0.0	discard	3_TAN_in_8	Parallel run loop
auto	1.6944547446924734	0.0	keep	12_TAN_in_6	Parallel run loop
auto	3.4591698930386263	0.0	discard	20_TAN_in_4	Parallel run loop
auto	1.8309941025580165	0.0	discard	14_TAN_in_6	Parallel run loop
auto	0.7948030556679802	0.0	discard	2_TAN_in_6	Parallel run loop
auto	1.7581535629954326	0.0	discard	15_tan_in_cir	Parallel run loop
auto	1.3465210871106505	0.0	discard	14_TAN_in_8	Parallel run loop
auto	1.9876146945680135	0.0	discard	11_TAN_in_5	Parallel run loop
auto	1.0949358415689194	0.0	discard	9_TAN_in_8	Parallel run loop
auto	0.988845219611748	0.0	keep	3_TAN_in_6	Parallel run loop
auto	6.502700541228166	0.0	keep	5_6_in_TAN	Parallel run loop
auto	4.861439648783421	0.0	discard	23_3_in_tan	Parallel run loop
auto	1.3473195291947468	0.0	discard	6_TAN_in_DOMINO	Parallel run loop
auto	2.617312110770477	0.0	discard	19_TAN_in_5	Parallel run loop
auto	1.504962924277851	0.0	discard	11_tan_in_cir	Parallel run loop
auto	1.892574130407503	0.0	discard	15_TAN_in_6	Parallel run loop
auto	8.961717264371641	0.0	discard	16_DOMINO_in_TAN	Parallel run loop
auto	1.8977361788735476	0.0	discard	10_TAN_in_5	Parallel run loop
auto	5.56795006449429	0.0	discard	26_tan_in_tan	Parallel run loop
auto	0.9496035849179189	0.0	discard	2_TAN_in_DOMINO	Parallel run loop
auto	2.0713766743861064	0.0	discard	18_TAN_in_6	Parallel run loop
auto	2.166379820482807	0.0	discard	20_TAN_in_6	Parallel run loop
auto	1.89165931459218	0.0	discard	12_TAN_in_DOMINO	Parallel run loop
auto	0.9340577012333658	0.0	discard	3_tan_in_cir	Parallel run loop
auto	1.249366653376161	0.0	discard	12_TAN_in_8	Parallel run loop
auto	2.2692931620207903	0.0	discard	22_TAN_in_6	Parallel run loop
auto	1.9581643987272404	0.0	discard	19_tan_in_cir	Parallel run loop
auto	2.7787972337337923	0.0	discard	22_TAN_in_5	Parallel run loop
auto	2.0001616407760103	0.0	discard	14_TAN_in_DOMINO	Parallel run loop
auto	1.3473195291947468	0.0	discard	6_TAN_in_DOMINO	Parallel run loop
auto	0.7239009551121717	0.0	discard	3_TAN_in_8	Parallel run loop
auto	5.750980409876445	0.0	keep	4_6_in_TAN	Parallel run loop
auto	2.366889709248003	0.0	discard	4_3_in_tan	Parallel run loop
auto	4.000418878849831	0.0	discard	5_4_in_tan	Parallel run loop
auto	11.843471290376822	0.0	discard	20_6_in_TAN	Parallel run loop
auto	3.7996324685986336	0.0	discard	24_TAN_in_4	Parallel run loop
auto	0.7948030556679802	0.0	discard	2_TAN_in_6	Parallel run loop
auto	0.988845219611748	0.0	discard	3_TAN_in_6	Parallel run loop
auto	1.3586766556946088	0.0	discard	14_TAN_in_8	Parallel run loop
auto	1.7581535629954326	0.0	discard	15_tan_in_cir	Parallel run loop
auto	1.8203624145856552	0.0	discard	14_TAN_in_6	Parallel run loop
auto	6.502700541228166	0.0	discard	5_6_in_TAN	Parallel run loop
auto	3.5359419812187443	0.0	discard	4_4_in_tan	Parallel run loop
auto	1.6936270487238907	0.0	keep	12_TAN_in_6	Parallel run loop
auto	2.156823081993509	0.0	discard	13_TAN_in_5	Parallel run loop
auto	1.1256829428589297	0.0	discard	5_tan_in_cir	Parallel run loop
auto	1.9876146945680135	0.0	discard	11_TAN_in_5	Parallel run loop
auto	3.4591698930386263	0.0	discard	20_TAN_in_4	Parallel run loop
auto	2.618364006551198	0.0	discard	19_TAN_in_5	Parallel run loop
auto	4.860368863295339	0.0	discard	23_3_in_tan	Parallel run loop
auto	5.165512471866258	0.0	discard	5_5_in_TAN	Parallel run loop
auto	6.037303673815075	0.0	discard	7_5_in_TAN	Parallel run loop
auto	0.9496035849179189	0.0	discard	2_TAN_in_DOMINO	Parallel run loop
auto	2.7787972337337923	0.0	discard	22_TAN_in_5	Parallel run loop
auto	1.249366653376161	0.0	discard	12_TAN_in_8	Parallel run loop
auto	8.966214411204323	0.0	discard	16_DOMINO_in_TAN	Parallel run loop
auto	8.742684287632692	0.0	discard	5_8_in_TAN	Parallel run loop
auto	2.2692931620207903	0.0	discard	22_TAN_in_6	Parallel run loop
auto	2.0001616407760103	0.0	discard	14_TAN_in_DOMINO	Parallel run loop
auto	1.886679605202572	0.0	discard	12_TAN_in_DOMINO	Parallel run loop
auto	1.9510144151839988	0.0	discard	19_tan_in_cir	Parallel run loop
auto	1.8934284055457367	0.0	discard	15_TAN_in_6	Parallel run loop
auto	2.170234734757977	0.0	discard	20_TAN_in_6	Parallel run loop
auto	4.63360301012611	0.0	discard	4_5_in_TAN	Parallel run loop
auto	2.0669004761025747	0.0	discard	18_TAN_in_6	Parallel run loop
auto	0.9340577012333658	0.0	discard	3_tan_in_cir	Parallel run loop
auto	5.750980409876445	0.0	discard	4_6_in_TAN	Parallel run loop
auto	2.600726364463759	0.0	discard	19_TAN_in_5	Parallel run loop
auto	1.7576420253418965	0.0	discard	15_tan_in_cir	Parallel run loop
auto	1.8238237577441734	0.0	discard	14_TAN_in_6	Parallel run loop
auto	8.774670272977028	0.0	discard	8_CIRCLE_in_TAN	Parallel run loop
auto	1.6936270487238907	0.0	discard	12_TAN_in_6	Parallel run loop
auto	3.433534947097662	0.0	discard	20_TAN_in_4	Parallel run loop
auto	4.000418878849831	0.0	discard	5_4_in_tan	Parallel run loop
auto	2.156823081993509	0.0	discard	13_TAN_in_5	Parallel run loop
auto	4.862855451151466	0.0	discard	23_3_in_tan	Parallel run loop
auto	0.988845219611748	0.0	discard	3_TAN_in_6	Parallel run loop
auto	0.7948030556679802	0.0	discard	2_TAN_in_6	Parallel run loop
auto	7.399285812321998	0.0	discard	7_6_in_TAN	Parallel run loop
auto	0.7239009551121717	0.0	discard	3_TAN_in_8	Parallel run loop
auto	0.9441194914703256	0.0	discard	2_TAN_in_5	Parallel run loop
auto	2.366889709248003	0.0	discard	4_3_in_tan	Parallel run loop
auto	0.9496035849179189	0.0	discard	2_TAN_in_DOMINO	Parallel run loop
auto	5.165512471866258	0.0	discard	5_5_in_TAN	Parallel run loop
auto	6.502700541228166	0.0	discard	5_6_in_TAN	Parallel run loop
auto	6.037303673815075	0.0	discard	7_5_in_TAN	Parallel run loop
auto	3.5359419812187443	0.0	discard	4_4_in_tan	Parallel run loop
auto	8.774670272977028	0.0	discard	8_CIRCLE_in_TAN	Parallel run loop
auto	1.1256829428589297	0.0	discard	5_tan_in_cir	Parallel run loop
auto	2.280044846762315	0.0	discard	22_TAN_in_6	Parallel run loop
auto	4.63360301012611	0.0	discard	4_5_in_TAN	Parallel run loop
auto	1.2427204687244904	0.0	keep	12_TAN_in_8	Parallel run loop
auto	1.892574130407503	0.0	discard	15_TAN_in_6	Parallel run loop
auto	2.7787972337337923	0.0	discard	22_TAN_in_5	Parallel run loop
auto	2.0001616407760103	0.0	discard	14_TAN_in_DOMINO	Parallel run loop
auto	5.750980409876445	0.0	discard	4_6_in_TAN	Parallel run loop
auto	8.742684287632692	0.0	discard	5_8_in_TAN	Parallel run loop
auto	1.9581643987272404	0.0	discard	19_tan_in_cir	Parallel run loop
auto	2.0669004761025747	0.0	discard	18_TAN_in_6	Parallel run loop
auto	0.8809993518818027	0.0	discard	5_TAN_in_8	Parallel run loop
auto	9.949886007733342	0.0	discard	7_8_in_TAN	Parallel run loop
auto	2.5402421229873364	0.0	discard	5_3_in_tan	Parallel run loop
auto	0.9340577012333658	0.0	discard	3_tan_in_cir	Parallel run loop
auto	1.886679605202572	0.0	discard	12_TAN_in_DOMINO	Parallel run loop
auto	2.1717951091300955	0.0	discard	20_TAN_in_6	Parallel run loop
auto	2.618364006551198	0.0	discard	19_TAN_in_5	Parallel run loop
auto	0.988845219611748	0.0	discard	3_TAN_in_6	Parallel run loop
auto	1.6936270487238907	0.0	discard	12_TAN_in_6	Parallel run loop
auto	7.835146019226511	0.0	discard	8_6_in_TAN	Parallel run loop
auto	10.060099554417164	0.0	discard	11_CIRCLE_in_TAN	Parallel run loop
auto	1.8314591832860605	0.0	discard	14_TAN_in_6	Parallel run loop
auto	2.1503352557147117	0.0	discard	13_TAN_in_5	Parallel run loop
auto	8.283236519597178	0.0	discard	9_6_in_TAN	Parallel run loop
auto	10.656958373798044	0.0	discard	8_8_in_TAN	Parallel run loop
auto	4.829316194195958	0.0	discard	4_DOMINO_in_TAN	Parallel run loop
auto	4.870188196581505	0.0	discard	23_3_in_tan	Parallel run loop
auto	6.7429962728646755	0.0	discard	6_6_in_TAN	Parallel run loop
auto	3.4515188781164845	0.0	discard	20_TAN_in_4	Parallel run loop
auto	4.000418878849831	0.0	discard	5_4_in_tan	Parallel run loop
auto	8.774670272977028	0.0	discard	8_CIRCLE_in_TAN	Parallel run loop
auto	5.4824064146790965	0.0	discard	6_5_in_TAN	Parallel run loop
auto	6.6959808625151345	0.0	discard	9_5_in_TAN	Parallel run loop
auto	6.502700541228166	0.0	discard	5_6_in_TAN	Parallel run loop
auto	0.7948030556679802	0.0	discard	2_TAN_in_6	Parallel run loop
auto	4.63360301012611	0.0	discard	4_5_in_TAN	Parallel run loop
auto	7.399285812321998	0.0	discard	7_6_in_TAN	Parallel run loop
auto	4.82921070439029	0.0	discard	8_4_in_tan	Parallel run loop
auto	1.060533204507968	0.0	keep	4_TAN_in_6	Parallel run loop
auto	3.5359419812187443	0.0	discard	4_4_in_tan	Parallel run loop
auto	2.366889709248003	0.0	discard	4_3_in_tan	Parallel run loop
auto	5.165512471866258	0.0	discard	5_5_in_TAN	Parallel run loop
auto	6.037303673815075	0.0	discard	7_5_in_TAN	Parallel run loop
auto	0.9441194914703256	0.0	discard	2_TAN_in_5	Parallel run loop
auto	0.7239009551121717	0.0	discard	3_TAN_in_8	Parallel run loop
auto	1.1256829428589297	0.0	discard	5_tan_in_cir	Parallel run loop
auto	1.249366653376161	0.0	discard	12_TAN_in_8	Parallel run loop
auto	9.949886007733342	0.0	discard	7_8_in_TAN	Parallel run loop
auto	1.8961722889913053	0.0	discard	12_TAN_in_DOMINO	Parallel run loop
auto	1.8343799392496154	0.0	discard	14_TAN_in_6	Parallel run loop
auto	0.8809341152377284	0.0	discard	5_TAN_in_8	Parallel run loop
auto	5.750980409876445	0.0	discard	4_6_in_TAN	Parallel run loop
auto	7.835146019226511	0.0	discard	8_6_in_TAN	Parallel run loop
auto	1.6997701539863892	0.0	discard	12_TAN_in_6	Parallel run loop
auto	10.425000438970166	0.0	keep	12_CIRCLE_in_TAN	Parallel run loop
auto	8.742684287632692	0.0	discard	5_8_in_TAN	Parallel run loop
auto	6.30717362885674	0.0	discard	8_5_in_TAN	Parallel run loop
auto	2.156823081993509	0.0	discard	13_TAN_in_5	Parallel run loop
auto	9.065627577737525	0.0	keep	11_6_in_TAN	Parallel run loop
auto	3.455839806682196	0.0	discard	20_TAN_in_4	Parallel run loop
auto	0.988845219611748	0.0	discard	3_TAN_in_6	Parallel run loop
auto	2.5402421229873364	0.0	discard	5_3_in_tan	Parallel run loop
auto	6.6959808625151345	0.0	discard	9_5_in_TAN	Parallel run loop
auto	5.4824064146790965	0.0	discard	6_5_in_TAN	Parallel run loop
auto	8.283236519597178	0.0	discard	9_6_in_TAN	Parallel run loop
auto	6.502700541228166	0.0	discard	5_6_in_TAN	Parallel run loop
auto	4.000418878849831	0.0	discard	5_4_in_tan	Parallel run loop
auto	10.79951154399235	0.0	discard	13_CIRCLE_in_TAN	Parallel run loop
auto	8.774670272977028	0.0	discard	8_CIRCLE_in_TAN	Parallel run loop
auto	11.14241489605376	0.0	discard	14_CIRCLE_in_TAN	Parallel run loop
auto	10.060099554417164	0.0	discard	11_CIRCLE_in_TAN	Parallel run loop
auto	4.829316194195958	0.0	discard	4_DOMINO_in_TAN	Parallel run loop
auto	6.7429962728646755	0.0	discard	6_6_in_TAN	Parallel run loop
auto	10.656958373798044	0.0	discard	8_8_in_TAN	Parallel run loop
auto	5.750980409876445	0.0	discard	4_6_in_TAN	Parallel run loop
auto	1.1058007189045806	0.0	discard	3_TAN_in_5	Parallel run loop
auto	4.82921070439029	0.0	discard	8_4_in_tan	Parallel run loop
auto	3.5359419812187443	0.0	discard	4_4_in_tan	Parallel run loop
auto	0.9441194914703256	0.0	discard	2_TAN_in_5	Parallel run loop
auto	4.63360301012611	0.0	discard	4_5_in_TAN	Parallel run loop
auto	5.165512471866258	0.0	discard	5_5_in_TAN	Parallel run loop
auto	7.399285812321998	0.0	discard	7_6_in_TAN	Parallel run loop
auto	9.949886007733342	0.0	discard	7_8_in_TAN	Parallel run loop
auto	7.354278105218379	0.0	keep	11_5_in_TAN	Parallel run loop
auto	6.983349989737053	0.0	discard	10_5_in_TAN	Parallel run loop
auto	9.417592955989575	0.0	keep	12_6_in_TAN	Parallel run loop
auto	6.037303673815075	0.0	discard	7_5_in_TAN	Parallel run loop
auto	6.2427324747115325	0.0	discard	7_DOMINO_in_TAN	Parallel run loop
auto	8.742684287632692	0.0	discard	5_8_in_TAN	Parallel run loop
auto	2.5402421229873364	0.0	discard	5_3_in_tan	Parallel run loop
auto	2.537345539752651	0.0	discard	4_TAN_in_3	Parallel run loop
auto	2.156823081993509	0.0	discard	13_TAN_in_5	Parallel run loop
auto	1.89165931459218	0.0	discard	12_TAN_in_DOMINO	Parallel run loop
auto	6.30717362885674	0.0	discard	8_5_in_TAN	Parallel run loop
auto	9.065627577737525	0.0	discard	11_6_in_TAN	Parallel run loop
auto	11.895195662590702	0.0	keep	16_CIRCLE_in_TAN	Parallel run loop
auto	1.1256829428589297	0.0	discard	5_tan_in_cir	Parallel run loop
auto	6.6959808625151345	0.0	discard	9_5_in_TAN	Parallel run loop
auto	8.536475570780645	0.0	discard	10_6_in_TAN	Parallel run loop
auto	5.4824064146790965	0.0	discard	6_5_in_TAN	Parallel run loop
auto	0.8809341152377284	0.0	discard	5_TAN_in_8	Parallel run loop
auto	7.835146019226511	0.0	discard	8_6_in_TAN	Parallel run loop
auto	10.425000438970166	0.0	discard	12_CIRCLE_in_TAN	Parallel run loop
auto	1.2806341809933837	0.0	discard	4_TAN_in_5	Parallel run loop
auto	1.060533204507968	0.0	discard	4_TAN_in_6	Parallel run loop
auto	10.79951154399235	0.0	discard	13_CIRCLE_in_TAN	Parallel run loop
auto	4.414299592203655	0.0	discard	7_4_in_tan	Parallel run loop
auto	8.283236519597178	0.0	discard	9_6_in_TAN	Parallel run loop
auto	4.82921070439029	0.0	discard	8_4_in_tan	Parallel run loop
auto	10.656958373798044	0.0	discard	8_8_in_TAN	Parallel run loop
auto	12.546625092194388	0.0	discard	18_CIRCLE_in_TAN	Parallel run loop
auto	6.7429962728646755	0.0	discard	6_6_in_TAN	Parallel run loop
auto	10.060099554417164	0.0	discard	11_CIRCLE_in_TAN	Parallel run loop
auto	11.14241489605376	0.0	discard	14_CIRCLE_in_TAN	Parallel run loop
auto	1.2643873834277326	0.0	discard	7_tan_in_cir	Parallel run loop
auto	8.472419234749125	0.0	discard	15_5_in_TAN	Parallel run loop
auto	9.707984980743891	0.0	discard	13_6_in_TAN	Parallel run loop
auto	4.829316194195958	0.0	discard	4_DOMINO_in_TAN	Parallel run loop
auto	13.22099484931051	0.0	discard	13_8_in_TAN	Parallel run loop
auto	0.9441194914703256	0.0	discard	2_TAN_in_5	Parallel run loop
auto	7.399285812321998	0.0	discard	7_6_in_TAN	Parallel run loop
auto	2.5402421229873364	0.0	discard	5_3_in_tan	Parallel run loop
auto	2.537345539752651	0.0	discard	4_TAN_in_3	Parallel run loop
auto	6.30717362885674	0.0	discard	8_5_in_TAN	Parallel run loop
auto	5.2426949496987065	0.0	discard	5_DOMINO_in_TAN	Parallel run loop
auto	1.1058007189045806	0.0	discard	3_TAN_in_5	Parallel run loop
auto	10.056842493708587	0.0	discard	14_6_in_TAN	Parallel run loop
auto	10.739585950399325	0.0	discard	16_6_in_TAN	Parallel run loop
auto	4.82921070439029	0.0	discard	8_4_in_tan	Parallel run loop
auto	8.18292113792307	0.0	discard	14_5_in_TAN	Parallel run loop
auto	12.158105901660921	0.0	discard	17_CIRCLE_in_TAN	Parallel run loop
auto	1.2806341809933837	0.0	discard	4_TAN_in_5	Parallel run loop
auto	5.4824064146790965	0.0	discard	6_5_in_TAN	Parallel run loop
auto	12.65723687109974	0.0	discard	12_8_in_TAN	Parallel run loop
auto	9.420968794476451	0.0	discard	12_6_in_TAN	Parallel run loop
auto	6.2427324747115325	0.0	discard	7_DOMINO_in_TAN	Parallel run loop
auto	9.067003345140972	0.0	discard	11_6_in_TAN	Parallel run loop
auto	8.283236519597178	0.0	discard	9_6_in_TAN	Parallel run loop
auto	7.355241781903901	0.0	discard	11_5_in_TAN	Parallel run loop
auto	7.543358287651718	0.0	keep	12_5_in_TAN	Parallel run loop
auto	10.425000438970166	0.0	discard	12_CIRCLE_in_TAN	Parallel run loop
auto	6.983349989737053	0.0	discard	10_5_in_TAN	Parallel run loop
auto	9.949886007733342	0.0	discard	7_8_in_TAN	Parallel run loop
auto	7.835146019226511	0.0	discard	8_6_in_TAN	Parallel run loop
auto	12.362131078860386	0.0	discard	11_8_in_TAN	Parallel run loop
auto	6.6959808625151345	0.0	discard	9_5_in_TAN	Parallel run loop
auto	11.14241489605376	0.0	discard	14_CIRCLE_in_TAN	Parallel run loop
auto	10.79951154399235	0.0	discard	13_CIRCLE_in_TAN	Parallel run loop
auto	10.060099554417164	0.0	discard	11_CIRCLE_in_TAN	Parallel run loop
auto	1.060533204507968	0.0	discard	4_TAN_in_6	Parallel run loop
auto	4.414299592203655	0.0	discard	7_4_in_tan	Parallel run loop
auto	6.7429962728646755	0.0	discard	6_6_in_TAN	Parallel run loop
auto	12.799619338927066	0.0	discard	19_CIRCLE_in_TAN	Parallel run loop
auto	8.537422921529911	0.0	discard	10_6_in_TAN	Parallel run loop
auto	0.8809341152377284	0.0	discard	5_TAN_in_8	Parallel run loop
auto	11.896107577869277	0.0	discard	16_CIRCLE_in_TAN	Parallel run loop
auto	10.656958373798044	0.0	discard	8_8_in_TAN	Parallel run loop
auto	9.70887278540827	0.0	discard	13_6_in_TAN	Parallel run loop
auto	7.833030636917253	0.0	keep	13_5_in_TAN	Parallel run loop
auto	13.093800411987209	0.0	discard	20_CIRCLE_in_TAN	Parallel run loop
auto	1.2806341809933837	0.0	discard	4_TAN_in_5	Parallel run loop
auto	12.546625092194388	0.0	discard	18_CIRCLE_in_TAN	Parallel run loop
auto	8.482697307604045	0.0	discard	15_5_in_TAN	Parallel run loop
auto	12.65728940948758	0.0	discard	12_8_in_TAN	Parallel run loop
auto	8.180562910713755	0.0	discard	14_5_in_TAN	Parallel run loop
auto	12.158105901660921	0.0	discard	17_CIRCLE_in_TAN	Parallel run loop
auto	1.1058007189045806	0.0	discard	3_TAN_in_5	Parallel run loop
auto	1.2643873834277326	0.0	discard	7_tan_in_cir	Parallel run loop
auto	13.57244125419423	0.0	discard	14_8_in_TAN	Parallel run loop
auto	4.829316194195958	0.0	discard	4_DOMINO_in_TAN	Parallel run loop
auto	10.340610768613228	0.0	keep	15_6_in_TAN	Parallel run loop
auto	10.057682434390053	0.0	discard	14_6_in_TAN	Parallel run loop
auto	13.223570199355342	0.0	discard	13_8_in_TAN	Parallel run loop
auto	8.670181085414658	0.0	keep	16_5_in_TAN	Parallel run loop
auto	6.30717362885674	0.0	discard	8_5_in_TAN	Parallel run loop
auto	3.0744322748224056	0.0	discard	8_3_in_tan	Parallel run loop
auto	10.425000438970166	0.0	discard	12_CIRCLE_in_TAN	Parallel run loop
auto	6.983349989737053	0.0	discard	10_5_in_TAN	Parallel run loop
auto	0.9257201651728294	0.0	discard	6_TAN_in_8	Parallel run loop
auto	7.354278105218379	0.0	discard	11_5_in_TAN	Parallel run loop
auto	9.415914792636134	0.0	keep	12_6_in_TAN	Parallel run loop
auto	9.065627577737525	0.0	discard	11_6_in_TAN	Parallel run loop
auto	10.723932220391713	0.0	discard	16_6_in_TAN	Parallel run loop
auto	15.352631895501817	0.0	keep	18_8_in_TAN	Parallel run loop
auto	2.537345539752651	0.0	discard	4_TAN_in_3	Parallel run loop
auto	5.2426949496987065	0.0	discard	5_DOMINO_in_TAN	Parallel run loop
auto	1.3015884503782176	0.0	discard	5_TAN_in_DOMINO	Parallel run loop
auto	4.953480532948613	0.0	discard	9_4_in_tan	Parallel run loop
auto	7.543450537864642	0.0	discard	12_5_in_TAN	Parallel run loop
auto	6.2427324747115325	0.0	discard	7_DOMINO_in_TAN	Parallel run loop
auto	4.414299592203655	0.0	discard	7_4_in_tan	Parallel run loop
auto	10.79951154399235	0.0	discard	13_CIRCLE_in_TAN	Parallel run loop
auto	11.14241489605376	0.0	discard	14_CIRCLE_in_TAN	Parallel run loop
auto	1.060533204507968	0.0	discard	4_TAN_in_6	Parallel run loop
auto	11.897378925680249	0.0	discard	16_CIRCLE_in_TAN	Parallel run loop
