commit	score	memory_gb	status	problem	description
auto	5.309456355946519	0.0	discard	8_4_in_3	Parallel run loop
auto	10.954631231581505	0.0	discard	41_4_in_3	Parallel run loop
auto	11.020518488177382	0.0	discard	42_4_in_3	Parallel run loop
auto	3.2320607503195915	0.0	discard	3_4_in_3	Parallel run loop
auto	6.309947848401362	0.0	discard	12_4_in_3	Parallel run loop
auto	9.788162657043223	0.0	discard	33_4_in_3	Parallel run loop
auto	10.776309862715156	0.0	discard	40_4_in_3	Parallel run loop
auto	8.469111224383393	0.0	discard	23_4_in_3	Parallel run loop
auto	8.62854070237444	0.0	keep	26_4_in_3	Parallel run loop
auto	7.732841467558333	0.0	discard	18_6_in_4	Parallel run loop
auto	4.438943384678697	0.0	discard	5_6_in_4	Parallel run loop
auto	6.388553067875531	0.0	discard	13_4_in_3	Parallel run loop
auto	3.491959731325357	0.0	discard	3_6_in_4	Parallel run loop
auto	8.418144246325605	0.0	keep	21_6_in_4	Parallel run loop
auto	8.522156032410958	0.0	discard	24_4_in_3	Parallel run loop
auto	4.154707933020685	0.0	discard	4_4_in_3	Parallel run loop
auto	8.563014759510843	0.0	discard	25_4_in_3	Parallel run loop
auto	9.13726962239043	0.0	discard	25_6_in_4	Parallel run loop
auto	8.089384994607542	0.0	discard	20_6_in_4	Parallel run loop
auto	7.387955541169579	0.0	discard	18_4_in_3	Parallel run loop
auto	8.710054883820813	0.0	keep	27_4_in_3	Parallel run loop
auto	4.309409782028365	0.0	discard	5_4_in_3	Parallel run loop
auto	10.599771163337323	0.0	discard	39_4_in_3	Parallel run loop
auto	9.470140881710233	0.0	discard	27_6_in_4	Parallel run loop
auto	9.807451120192226	0.0	discard	32_4_in_3	Parallel run loop
auto	9.859456383527776	0.0	discard	34_4_in_3	Parallel run loop
auto	9.658856519281578	0.0	discard	31_4_in_3	Parallel run loop
auto	6.57626910209534	0.0	discard	15_4_in_3	Parallel run loop
auto	10.12146122489197	0.0	discard	36_4_in_3	Parallel run loop
auto	10.087489862056094	0.0	discard	35_4_in_3	Parallel run loop
auto	10.99797948619615	0.0	discard	41_4_in_3	Parallel run loop
auto	4.815183322352559	0.0	discard	6_6_in_4	Parallel run loop
auto	6.154772890366584	0.0	discard	11_4_in_3	Parallel run loop
auto	11.01851023958955	0.0	discard	43_4_in_3	Parallel run loop
auto	10.93955256506185	0.0	discard	42_4_in_3	Parallel run loop
auto	6.105336428074948	0.0	discard	10_6_in_4	Parallel run loop
auto	7.15750196563385	0.0	discard	16_4_in_3	Parallel run loop
auto	8.544308625528066	0.0	discard	24_4_in_3	Parallel run loop
auto	6.3886915059595815	0.0	discard	13_4_in_3	Parallel run loop
auto	3.491959731325357	0.0	discard	3_6_in_4	Parallel run loop
auto	10.791219693178732	0.0	discard	40_4_in_3	Parallel run loop
auto	8.77353560955463	0.0	discard	26_4_in_3	Parallel run loop
auto	5.15538249832505	0.0	discard	7_4_in_3	Parallel run loop
auto	8.38856865696147	0.0	discard	23_4_in_3	Parallel run loop
auto	9.784109077071728	0.0	discard	33_4_in_3	Parallel run loop
auto	7.890561392360599	0.0	discard	18_6_in_4	Parallel run loop
auto	9.139001188342593	0.0	discard	25_6_in_4	Parallel run loop
auto	8.620168250920733	0.0	discard	25_4_in_3	Parallel run loop
auto	4.154750717508222	0.0	discard	4_4_in_3	Parallel run loop
auto	8.436420781955537	0.0	discard	21_6_in_4	Parallel run loop
auto	8.089384994607542	0.0	discard	20_6_in_4	Parallel run loop
auto	7.387955541169579	0.0	discard	18_4_in_3	Parallel run loop
auto	4.309409782028365	0.0	discard	5_4_in_3	Parallel run loop
auto	10.599771163337323	0.0	discard	39_4_in_3	Parallel run loop
auto	8.851527856275144	0.0	discard	27_4_in_3	Parallel run loop
auto	9.340448099000856	0.0	keep	27_6_in_4	Parallel run loop
auto	9.860409477809945	0.0	discard	34_4_in_3	Parallel run loop
auto	6.57626910209534	0.0	discard	15_4_in_3	Parallel run loop
auto	10.096814507517992	0.0	discard	36_4_in_3	Parallel run loop
auto	9.597130699747467	0.0	discard	31_4_in_3	Parallel run loop
auto	6.154772890366584	0.0	discard	11_4_in_3	Parallel run loop
auto	9.725566438207675	0.0	discard	32_4_in_3	Parallel run loop
auto	6.105491953617294	0.0	discard	10_6_in_4	Parallel run loop
auto	10.940553511555468	0.0	discard	41_4_in_3	Parallel run loop
auto	10.962847283113646	0.0	discard	42_4_in_3	Parallel run loop
auto	11.01851023958955	0.0	discard	43_4_in_3	Parallel run loop
auto	10.087489862056094	0.0	discard	35_4_in_3	Parallel run loop
auto	5.309456355946519	0.0	discard	8_4_in_3	Parallel run loop
auto	9.784109077071728	0.0	discard	33_4_in_3	Parallel run loop
auto	6.3985247233180775	0.0	discard	13_4_in_3	Parallel run loop
auto	8.510168966570657	0.0	discard	23_4_in_3	Parallel run loop
auto	8.547858197084475	0.0	discard	24_4_in_3	Parallel run loop
auto	8.62854070237444	0.0	discard	26_4_in_3	Parallel run loop
auto	6.339849586688972	0.0	discard	11_6_in_4	Parallel run loop
auto	10.776309862715156	0.0	discard	40_4_in_3	Parallel run loop
auto	4.813853256562242	0.0	discard	6_6_in_4	Parallel run loop
auto	8.620168250920733	0.0	discard	25_4_in_3	Parallel run loop
auto	9.100998092955923	0.0	discard	25_6_in_4	Parallel run loop
auto	3.232052318453766	0.0	discard	3_4_in_3	Parallel run loop
auto	7.730171820979289	0.0	discard	18_6_in_4	Parallel run loop
auto	8.089384994607542	0.0	discard	20_6_in_4	Parallel run loop
auto	8.418144246325605	0.0	discard	21_6_in_4	Parallel run loop
auto	3.491959731325357	0.0	discard	3_6_in_4	Parallel run loop
auto	8.809282096424507	0.0	discard	27_4_in_3	Parallel run loop
auto	10.599771163337323	0.0	discard	39_4_in_3	Parallel run loop
auto	7.387955541169579	0.0	discard	18_4_in_3	Parallel run loop
auto	5.154784542108047	0.0	discard	7_4_in_3	Parallel run loop
auto	9.859456383527776	0.0	discard	34_4_in_3	Parallel run loop
auto	9.513940573292547	0.0	discard	27_6_in_4	Parallel run loop
auto	6.538606514812582	0.0	discard	15_4_in_3	Parallel run loop
auto	9.472120229746906	0.0	discard	31_4_in_3	Parallel run loop
auto	10.143929657656013	0.0	discard	36_4_in_3	Parallel run loop
auto	6.155985978687121	0.0	discard	11_4_in_3	Parallel run loop
auto	6.105491953617294	0.0	discard	10_6_in_4	Parallel run loop
auto	10.935004358179606	0.0	discard	41_4_in_3	Parallel run loop
auto	9.725566438207675	0.0	discard	32_4_in_3	Parallel run loop
auto	9.851848888201381	0.0	discard	33_4_in_3	Parallel run loop
auto	10.947326139296766	0.0	discard	42_4_in_3	Parallel run loop
auto	11.058125893868384	0.0	discard	43_4_in_3	Parallel run loop
auto	6.3985247233180775	0.0	discard	13_4_in_3	Parallel run loop
auto	4.154707933020685	0.0	discard	4_4_in_3	Parallel run loop
auto	8.620941418099708	0.0	discard	24_4_in_3	Parallel run loop
auto	9.947912163569963	0.0	discard	35_4_in_3	Parallel run loop
auto	8.472237346101952	0.0	discard	23_4_in_3	Parallel run loop
auto	8.774947412252958	0.0	discard	26_4_in_3	Parallel run loop
auto	10.776309862715156	0.0	discard	40_4_in_3	Parallel run loop
auto	4.30942692978523	0.0	discard	5_4_in_3	Parallel run loop
auto	4.814811523641814	0.0	discard	6_6_in_4	Parallel run loop
auto	3.232052318453766	0.0	discard	3_4_in_3	Parallel run loop
auto	9.133632768392987	0.0	discard	25_6_in_4	Parallel run loop
auto	8.43048885754377	0.0	discard	21_6_in_4	Parallel run loop
auto	8.627146868055858	0.0	discard	25_4_in_3	Parallel run loop
auto	7.895559522258137	0.0	discard	18_6_in_4	Parallel run loop
auto	7.9698125572835865	0.0	discard	20_6_in_4	Parallel run loop
auto	5.309763263875329	0.0	discard	8_4_in_3	Parallel run loop
auto	7.387955541169579	0.0	discard	18_4_in_3	Parallel run loop
auto	10.599771163337323	0.0	discard	39_4_in_3	Parallel run loop
auto	8.774117417357346	0.0	discard	27_4_in_3	Parallel run loop
auto	5.155403441090606	0.0	discard	7_4_in_3	Parallel run loop
auto	9.941828928227496	0.0	discard	34_4_in_3	Parallel run loop
auto	9.513940573292547	0.0	discard	27_6_in_4	Parallel run loop
auto	6.538606514812582	0.0	discard	15_4_in_3	Parallel run loop
auto	10.087378355933945	0.0	discard	36_4_in_3	Parallel run loop
auto	9.626511010509864	0.0	discard	31_4_in_3	Parallel run loop
auto	6.155976403489312	0.0	discard	11_4_in_3	Parallel run loop
auto	9.743762411586093	0.0	discard	32_4_in_3	Parallel run loop
auto	3.491959014509597	0.0	discard	3_6_in_4	Parallel run loop
auto	10.897851805187772	0.0	discard	41_4_in_3	Parallel run loop
auto	4.154750717508222	0.0	discard	4_4_in_3	Parallel run loop
auto	8.543233031931807	0.0	discard	24_4_in_3	Parallel run loop
auto	10.963768808251237	0.0	discard	42_4_in_3	Parallel run loop
auto	11.01851023958955	0.0	discard	43_4_in_3	Parallel run loop
auto	9.784109077071728	0.0	discard	33_4_in_3	Parallel run loop
auto	10.097412765164298	0.0	discard	35_4_in_3	Parallel run loop
auto	8.387756670050605	0.0	discard	23_4_in_3	Parallel run loop
auto	6.309719735191199	0.0	discard	12_4_in_3	Parallel run loop
auto	6.3886915059595815	0.0	discard	13_4_in_3	Parallel run loop
auto	4.437844418212015	0.0	keep	5_6_in_4	Parallel run loop
auto	4.814266722270147	0.0	discard	6_6_in_4	Parallel run loop
auto	7.15750196563385	0.0	discard	16_4_in_3	Parallel run loop
auto	10.776309862715156	0.0	discard	40_4_in_3	Parallel run loop
auto	8.556205176387037	0.0	discard	25_4_in_3	Parallel run loop
auto	8.43048885754377	0.0	discard	21_6_in_4	Parallel run loop
auto	7.896213403030092	0.0	discard	18_6_in_4	Parallel run loop
auto	8.089384994607542	0.0	discard	20_6_in_4	Parallel run loop
auto	9.149636321582882	0.0	discard	25_6_in_4	Parallel run loop
auto	6.339849586688972	0.0	discard	11_6_in_4	Parallel run loop
auto	9.859456383527776	0.0	discard	34_4_in_3	Parallel run loop
auto	8.853422291130135	0.0	discard	27_4_in_3	Parallel run loop
auto	10.599771163337323	0.0	discard	39_4_in_3	Parallel run loop
auto	7.387955541169579	0.0	discard	18_4_in_3	Parallel run loop
auto	4.309409782028365	0.0	discard	5_4_in_3	Parallel run loop
auto	6.535702885886159	0.0	keep	15_4_in_3	Parallel run loop
auto	9.619043541412415	0.0	discard	31_4_in_3	Parallel run loop
auto	9.94955176918249	0.0	discard	36_4_in_3	Parallel run loop
auto	9.474361225301514	0.0	discard	27_6_in_4	Parallel run loop
auto	5.15538249832505	0.0	discard	7_4_in_3	Parallel run loop
auto	3.232052318453766	0.0	discard	3_4_in_3	Parallel run loop
auto	9.743762411586093	0.0	discard	32_4_in_3	Parallel run loop
auto	5.3094071869005	0.0	keep	8_4_in_3	Parallel run loop
auto	10.897851805187772	0.0	discard	41_4_in_3	Parallel run loop
auto	9.788162657043223	0.0	discard	33_4_in_3	Parallel run loop
auto	8.541657663661779	0.0	discard	24_4_in_3	Parallel run loop
auto	3.491959014509597	0.0	discard	3_6_in_4	Parallel run loop
auto	8.419120872869083	0.0	discard	23_4_in_3	Parallel run loop
auto	11.01851023958955	0.0	discard	43_4_in_3	Parallel run loop
auto	10.947326139296766	0.0	discard	42_4_in_3	Parallel run loop
auto	8.627146868055858	0.0	discard	25_4_in_3	Parallel run loop
auto	6.464138476178089	0.0	discard	13_4_in_3	Parallel run loop
auto	9.978484550475846	0.0	discard	35_4_in_3	Parallel run loop
auto	4.154707933020685	0.0	discard	4_4_in_3	Parallel run loop
auto	4.3094996669154355	0.0	discard	6_4_in_3	Parallel run loop
auto	4.440722088808257	0.0	discard	5_6_in_4	Parallel run loop
auto	7.9698125572835865	0.0	discard	20_6_in_4	Parallel run loop
auto	10.776309862715156	0.0	discard	40_4_in_3	Parallel run loop
auto	7.763371982027166	0.0	discard	18_6_in_4	Parallel run loop
auto	8.418144246325605	0.0	discard	21_6_in_4	Parallel run loop
auto	9.100998092955923	0.0	discard	25_6_in_4	Parallel run loop
auto	6.309719735191199	0.0	discard	12_4_in_3	Parallel run loop
auto	10.629098076349557	0.0	discard	39_4_in_3	Parallel run loop
auto	8.787266326248679	0.0	discard	27_4_in_3	Parallel run loop
auto	9.568740837752681	0.0	discard	31_4_in_3	Parallel run loop
auto	9.942756554192467	0.0	discard	34_4_in_3	Parallel run loop
auto	7.4645934216366685	0.0	discard	18_4_in_3	Parallel run loop
auto	9.474361225301514	0.0	discard	27_6_in_4	Parallel run loop
auto	6.538606514812582	0.0	discard	15_4_in_3	Parallel run loop
auto	4.309418543637569	0.0	discard	5_4_in_3	Parallel run loop
auto	10.084746520076973	0.0	discard	36_4_in_3	Parallel run loop
auto	9.790985922535151	0.0	discard	32_4_in_3	Parallel run loop
auto	10.868935062578375	0.0	discard	41_4_in_3	Parallel run loop
auto	7.156356652777619	0.0	keep	16_4_in_3	Parallel run loop
auto	5.309456355946519	0.0	discard	8_4_in_3	Parallel run loop
auto	3.2320607503195915	0.0	discard	3_4_in_3	Parallel run loop
auto	8.465628025883607	0.0	discard	24_4_in_3	Parallel run loop
auto	3.4919620863456333	0.0	discard	3_6_in_4	Parallel run loop
auto	8.476561809186272	0.0	discard	23_4_in_3	Parallel run loop
auto	11.0472029386499	0.0	discard	43_4_in_3	Parallel run loop
auto	9.62977971352941	0.0	keep	33_4_in_3	Parallel run loop
auto	6.311944792464991	0.0	keep	13_4_in_3	Parallel run loop
auto	5.155344374810373	0.0	discard	7_4_in_3	Parallel run loop
auto	11.07710167451943	0.0	discard	42_4_in_3	Parallel run loop
auto	10.097412765164298	0.0	discard	35_4_in_3	Parallel run loop
auto	8.620168250920733	0.0	discard	25_4_in_3	Parallel run loop
auto	7.891441860326138	0.0	discard	18_6_in_4	Parallel run loop
auto	7.309824033492363	0.0	discard	17_4_in_3	Parallel run loop
auto	8.418144246325605	0.0	discard	21_6_in_4	Parallel run loop
auto	6.339849586688972	0.0	discard	11_6_in_4	Parallel run loop
auto	10.776309862715156	0.0	discard	40_4_in_3	Parallel run loop
auto	6.1054109000054515	0.0	discard	10_6_in_4	Parallel run loop
auto	8.007004166810876	0.0	discard	20_6_in_4	Parallel run loop
auto	9.13726962239043	0.0	discard	25_6_in_4	Parallel run loop
auto	8.795573943635429	0.0	discard	27_4_in_3	Parallel run loop
auto	10.553856672609996	0.0	keep	39_4_in_3	Parallel run loop
auto	9.54070433367155	0.0	discard	31_4_in_3	Parallel run loop
auto	7.464812585357712	0.0	discard	18_4_in_3	Parallel run loop
auto	6.538606514812582	0.0	discard	15_4_in_3	Parallel run loop
auto	9.513940573292547	0.0	discard	27_6_in_4	Parallel run loop
auto	9.931786194765044	0.0	discard	34_4_in_3	Parallel run loop
auto	4.154707933020685	0.0	discard	4_4_in_3	Parallel run loop
auto	5.309910838673369	0.0	discard	9_4_in_3	Parallel run loop
auto	6.310815180659962	0.0	discard	12_4_in_3	Parallel run loop
auto	10.948752044343436	0.0	discard	41_4_in_3	Parallel run loop
auto	7.15750196563385	0.0	discard	16_4_in_3	Parallel run loop
auto	10.097240077527125	0.0	discard	36_4_in_3	Parallel run loop
auto	4.309418543637569	0.0	discard	5_4_in_3	Parallel run loop
auto	8.419120872869083	0.0	discard	23_4_in_3	Parallel run loop
auto	8.558054602350422	0.0	discard	24_4_in_3	Parallel run loop
auto	11.08648515346674	0.0	discard	43_4_in_3	Parallel run loop
auto	9.815178898030123	0.0	discard	33_4_in_3	Parallel run loop
auto	9.70420703924515	0.0	discard	32_4_in_3	Parallel run loop
auto	6.3985247233180775	0.0	discard	13_4_in_3	Parallel run loop
auto	10.014055011131939	0.0	discard	35_4_in_3	Parallel run loop
auto	8.43048885754377	0.0	discard	21_6_in_4	Parallel run loop
auto	7.908773594888604	0.0	discard	18_6_in_4	Parallel run loop
auto	5.1553690662282134	0.0	discard	7_4_in_3	Parallel run loop
auto	8.563014759510843	0.0	discard	25_4_in_3	Parallel run loop
auto	10.947326139296766	0.0	discard	42_4_in_3	Parallel run loop
auto	3.491959731325357	0.0	discard	3_6_in_4	Parallel run loop
auto	4.4389418771467595	0.0	discard	5_6_in_4	Parallel run loop
auto	9.118021638826727	0.0	discard	25_6_in_4	Parallel run loop
auto	10.790271115595846	0.0	discard	40_4_in_3	Parallel run loop
auto	6.764428342593895	0.0	discard	13_6_in_4	Parallel run loop
auto	7.953493270840081	0.0	keep	20_6_in_4	Parallel run loop
auto	10.599771163337323	0.0	discard	39_4_in_3	Parallel run loop
auto	7.387955541169579	0.0	discard	18_4_in_3	Parallel run loop
auto	9.631514356730015	0.0	discard	31_4_in_3	Parallel run loop
auto	8.793324245426204	0.0	discard	27_4_in_3	Parallel run loop
auto	6.467495835495332	0.0	keep	15_4_in_3	Parallel run loop
auto	9.455403984086399	0.0	discard	27_6_in_4	Parallel run loop
auto	9.942756554192467	0.0	discard	34_4_in_3	Parallel run loop
auto	4.813853256562242	0.0	discard	6_6_in_4	Parallel run loop
auto	4.154750717508222	0.0	discard	4_4_in_3	Parallel run loop
auto	6.339849586688972	0.0	discard	11_6_in_4	Parallel run loop
auto	11.01851023958955	0.0	discard	43_4_in_3	Parallel run loop
auto	8.464736694537937	0.0	discard	23_4_in_3	Parallel run loop
auto	10.872403099395017	0.0	discard	41_4_in_3	Parallel run loop
auto	10.088422645839744	0.0	discard	36_4_in_3	Parallel run loop
auto	4.3094996669154355	0.0	discard	6_4_in_3	Parallel run loop
auto	9.788162657043223	0.0	discard	33_4_in_3	Parallel run loop
auto	8.543233031931807	0.0	discard	24_4_in_3	Parallel run loop
auto	8.627146868055858	0.0	discard	25_4_in_3	Parallel run loop
auto	4.30942692978523	0.0	discard	5_4_in_3	Parallel run loop
auto	9.743383159804818	0.0	discard	32_4_in_3	Parallel run loop
auto	7.309824033492363	0.0	discard	17_4_in_3	Parallel run loop
auto	10.776309862715156	0.0	discard	40_4_in_3	Parallel run loop
auto	10.963768808251237	0.0	discard	42_4_in_3	Parallel run loop
auto	7.763371982027166	0.0	discard	18_6_in_4	Parallel run loop
auto	6.105336428074948	0.0	discard	10_6_in_4	Parallel run loop
auto	8.411983349748004	0.0	keep	21_6_in_4	Parallel run loop
auto	10.087489862056094	0.0	discard	35_4_in_3	Parallel run loop
auto	5.309910838673369	0.0	discard	9_4_in_3	Parallel run loop
auto	6.309719735191199	0.0	discard	12_4_in_3	Parallel run loop
auto	9.149636321582882	0.0	discard	25_6_in_4	Parallel run loop
auto	5.309456355946519	0.0	discard	8_4_in_3	Parallel run loop
auto	8.022138981393471	0.0	discard	20_6_in_4	Parallel run loop
auto	9.71074039755066	0.0	discard	31_4_in_3	Parallel run loop
auto	7.387955541169579	0.0	discard	18_4_in_3	Parallel run loop
auto	9.455403984086399	0.0	discard	27_6_in_4	Parallel run loop
auto	6.550215823709726	0.0	discard	15_4_in_3	Parallel run loop
auto	8.819050170221848	0.0	discard	27_4_in_3	Parallel run loop
auto	10.599771163337323	0.0	discard	39_4_in_3	Parallel run loop
auto	9.859456383527776	0.0	discard	34_4_in_3	Parallel run loop
auto	4.8151242401285455	0.0	discard	6_6_in_4	Parallel run loop
auto	3.7250031912651163	0.0	discard	4_6_in_4	Parallel run loop
auto	5.15538249832505	0.0	discard	7_4_in_3	Parallel run loop
auto	10.098856662009045	0.0	discard	36_4_in_3	Parallel run loop
auto	3.4919620863456333	0.0	discard	3_6_in_4	Parallel run loop
auto	10.940638114596652	0.0	discard	41_4_in_3	Parallel run loop
auto	11.01851023958955	0.0	discard	43_4_in_3	Parallel run loop
auto	4.438123057858091	0.0	discard	5_6_in_4	Parallel run loop
auto	4.154750717508222	0.0	discard	4_4_in_3	Parallel run loop
auto	9.775120571259194	0.0	discard	32_4_in_3	Parallel run loop
auto	8.396884250139657	0.0	discard	23_4_in_3	Parallel run loop
auto	7.309824033492363	0.0	discard	17_4_in_3	Parallel run loop
auto	8.627146868055858	0.0	discard	25_4_in_3	Parallel run loop
auto	8.543233031931807	0.0	discard	24_4_in_3	Parallel run loop
auto	9.930998260660033	0.0	discard	35_4_in_3	Parallel run loop
auto	8.43048885754377	0.0	discard	21_6_in_4	Parallel run loop
auto	6.764428342593895	0.0	discard	13_6_in_4	Parallel run loop
auto	10.776309862715156	0.0	discard	40_4_in_3	Parallel run loop
auto	6.309719735191199	0.0	discard	12_4_in_3	Parallel run loop
auto	7.766032072953816	0.0	discard	18_6_in_4	Parallel run loop
auto	11.044659619702836	0.0	discard	42_4_in_3	Parallel run loop
auto	6.155976403489312	0.0	discard	11_4_in_3	Parallel run loop
auto	4.309409782028365	0.0	discard	5_4_in_3	Parallel run loop
auto	9.149636321582882	0.0	discard	25_6_in_4	Parallel run loop
auto	8.089384994607542	0.0	discard	20_6_in_4	Parallel run loop
auto	7.387955541169579	0.0	discard	18_4_in_3	Parallel run loop
auto	9.513015228126159	0.0	discard	31_4_in_3	Parallel run loop
auto	9.492725968698753	0.0	discard	27_6_in_4	Parallel run loop
auto	9.792319311040318	0.0	keep	34_4_in_3	Parallel run loop
auto	7.154764083641414	0.0	keep	16_4_in_3	Parallel run loop
auto	8.793906030236618	0.0	discard	27_4_in_3	Parallel run loop
auto	6.339849586688972	0.0	discard	11_6_in_4	Parallel run loop
auto	10.599771163337323	0.0	discard	39_4_in_3	Parallel run loop
auto	5.1555613069564314	0.0	discard	7_4_in_3	Parallel run loop
auto	3.2320607503195915	0.0	discard	3_4_in_3	Parallel run loop
auto	6.388840407653808	0.0	discard	12_6_in_4	Parallel run loop
auto	11.01851023958955	0.0	discard	43_4_in_3	Parallel run loop
auto	11.031769768280068	0.0	discard	41_4_in_3	Parallel run loop
auto	4.43966052326285	0.0	discard	5_6_in_4	Parallel run loop
auto	10.143929657656013	0.0	discard	36_4_in_3	Parallel run loop
auto	8.541657663661779	0.0	discard	24_4_in_3	Parallel run loop
auto	8.315893168578013	0.0	keep	23_4_in_3	Parallel run loop
auto	8.627146868055858	0.0	discard	25_4_in_3	Parallel run loop
auto	4.3094996669154355	0.0	discard	6_4_in_3	Parallel run loop
auto	8.169777396534393	0.0	discard	22_4_in_3	Parallel run loop
auto	9.70420703924515	0.0	discard	32_4_in_3	Parallel run loop
auto	7.7379955374790645	0.0	discard	18_6_in_4	Parallel run loop
auto	6.104982492730227	0.0	discard	10_6_in_4	Parallel run loop
auto	10.006441244416514	0.0	discard	35_4_in_3	Parallel run loop
auto	8.43048885754377	0.0	discard	21_6_in_4	Parallel run loop
auto	10.776309862715156	0.0	discard	40_4_in_3	Parallel run loop
auto	4.154750717508222	0.0	discard	4_4_in_3	Parallel run loop
auto	11.057079850967028	0.0	discard	42_4_in_3	Parallel run loop
auto	5.309456355946519	0.0	discard	8_4_in_3	Parallel run loop
auto	5.309910838673369	0.0	discard	9_4_in_3	Parallel run loop
auto	9.102186995346187	0.0	discard	25_6_in_4	Parallel run loop
auto	3.7250031912651163	0.0	discard	4_6_in_4	Parallel run loop
auto	9.545807131724317	0.0	discard	31_4_in_3	Parallel run loop
auto	7.387785192386595	0.0	discard	18_4_in_3	Parallel run loop
auto	8.778728171903877	0.0	discard	27_4_in_3	Parallel run loop
auto	9.470140881710233	0.0	discard	27_6_in_4	Parallel run loop
auto	9.93747924572593	0.0	discard	34_4_in_3	Parallel run loop
auto	7.154764083641414	0.0	discard	16_4_in_3	Parallel run loop
auto	4.309418543637569	0.0	discard	5_4_in_3	Parallel run loop
auto	3.4919620863456333	0.0	discard	3_6_in_4	Parallel run loop
auto	6.759508156569627	0.0	discard	13_6_in_4	Parallel run loop
auto	6.155976403489312	0.0	discard	11_4_in_3	Parallel run loop
