commit	score	memory_gb	status	problem	description
auto	2.182868631020293	0.0	keep	7_6_in_8	Parallel run loop
auto	6.770204241184824	0.0	keep	15_8_in_DOMINO	Parallel run loop
auto	7.133647806355392	0.0	keep	26_6_in_5	Parallel run loop
auto	7.740807294603693	0.0	keep	29_8_in_8	Parallel run loop
auto	3.4486979930530217	0.0	keep	24_5_in_8	Parallel run loop
auto	5.367169851784146	0.0	keep	31_5_in_6	Parallel run loop
auto	5.614111830886864	0.0	keep	21_DOMINO_in_5	Parallel run loop
auto	6.092400121952731	0.0	keep	19_8_in_CIRCLE	Parallel run loop
auto	5.313757978623284	0.0	keep	21_6_in_CIRCLE	Parallel run loop
auto	3.518280693712854	0.0	keep	21_DOMINO_in_8	Parallel run loop
auto	7.040090537085883	0.0	keep	30_8_in_8	Parallel run loop
auto	4.674723850526608	0.0	keep	26_5_in_6	Parallel run loop
auto	3.590069631434398	0.0	keep	19_6_in_8	Parallel run loop
auto	5.29290972296808	0.0	keep	22_5_in_5	Parallel run loop
auto	6.964848399803586	0.0	keep	25_6_in_5	Parallel run loop
auto	3.8214106685872355	0.0	keep	30_5_in_8	Parallel run loop
auto	4.960801954210347	0.0	keep	15_6_in_DOMINO	Parallel run loop
auto	3.840608533906711	0.0	keep	10_DOMINO_in_5	Parallel run loop
auto	5.570010378462801	0.0	keep	24_5_in_5	Parallel run loop
auto	5.862711194567863	0.0	keep	21_6_in_DOMINO	Parallel run loop
auto	5.185501973522223	0.0	keep	29_5_in_6	Parallel run loop
auto	7.183821505483945	0.0	keep	27_6_in_5	Parallel run loop
auto	4.508473817561804	0.0	keep	24_5_in_6	Parallel run loop
auto	3.7678213853494107	0.0	keep	17_5_in_6	Parallel run loop
auto	5.751531659184749	0.0	keep	26_6_in_6	Parallel run loop
auto	3.7031796535755417	0.0	keep	14_DOMINO_in_6	Parallel run loop
auto	4.63100252209216	0.0	keep	17_6_in_6	Parallel run loop
auto	6.526596407914662	0.0	keep	30_DOMINO_in_5	Parallel run loop
auto	5.48752785415649	0.0	keep	24_6_in_6	Parallel run loop
auto	4.670094356720682	0.0	keep	22_DOMINO_in_6	Parallel run loop
auto	6.641454933829111	0.0	keep	27_8_in_8	Parallel run loop
auto	5.442859412642044	0.0	keep	18_6_in_DOMINO	Parallel run loop
auto	5.418323367092372	0.0	keep	27_6_in_CIRCLE	Parallel run loop
auto	7.8179153188508375	0.0	keep	32_6_in_5	Parallel run loop
auto	5.763930351322336	0.0	keep	22_DOMINO_in_5	Parallel run loop
auto	6.020851560697969	0.0	keep	28_6_in_6	Parallel run loop
auto	2.9915110622347365	0.0	keep	16_DOMINO_in_8	Parallel run loop
auto	4.73179950548483	0.0	keep	27_5_in_6	Parallel run loop
auto	6.043227433847628	0.0	keep	25_5_in_5	Parallel run loop
auto	4.536959608086233	0.0	keep	14_DOMINO_in_5	Parallel run loop
auto	8.83295101890341	0.0	keep	31_6_in_5	Parallel run loop
auto	2.9753252488090425	0.0	keep	9_DOMINO_in_6	Parallel run loop
auto	3.5633637932644753	0.0	keep	13_DOMINO_in_6	Parallel run loop
auto	3.9297511539461447	0.0	keep	27_DOMINO_in_8	Parallel run loop
auto	7.381369149313744	0.0	keep	29_6_in_5	Parallel run loop
auto	5.462699387502675	0.0	keep	23_5_in_5	Parallel run loop
auto	7.251662044115522	0.0	keep	28_6_in_5	Parallel run loop
auto	3.8519938429381386	0.0	keep	18_5_in_6	Parallel run loop
auto	5.8404326963229245	0.0	keep	30_5_in_6	Parallel run loop
auto	6.324160616592605	0.0	keep	26_5_in_5	Parallel run loop
auto	4.388526600503097	0.0	keep	20_DOMINO_in_6	Parallel run loop
auto	1.7534315209270457	0.0	keep	6_DOMINO_in_8	Parallel run loop
auto	4.074211999157604	0.0	keep	16_DOMINO_in_6	Parallel run loop
auto	2.7851652599783856	0.0	keep	14_DOMINO_in_8	Parallel run loop
auto	4.214904418594042	0.0	keep	12_DOMINO_in_5	Parallel run loop
auto	6.437110716913375	0.0	keep	18_8_in_6	Parallel run loop
auto	4.05610815599106	0.0	keep	17_DOMINO_in_6	Parallel run loop
auto	6.368759820485222	0.0	keep	32_6_in_6	Parallel run loop
auto	7.46448773734188	0.0	keep	30_6_in_5	Parallel run loop
auto	5.506546578821588	0.0	keep	28_DOMINO_in_6	Parallel run loop
auto	2.743110402550752	0.0	keep	13_DOMINO_in_8	Parallel run loop
auto	6.701557764590032	0.0	keep	29_DOMINO_in_5	Parallel run loop
auto	3.129666749246597	0.0	keep	18_DOMINO_in_8	Parallel run loop
auto	4.475541745046282	0.0	keep	16_5_in_5	Parallel run loop
auto	4.652128172683757	0.0	keep	15_DOMINO_in_5	Parallel run loop
auto	3.9477453679953984	0.0	keep	11_DOMINO_in_5	Parallel run loop
auto	3.9771802467528956	0.0	keep	7_8_in_6	Parallel run loop
auto	5.869549848295244	0.0	keep	24_DOMINO_in_5	Parallel run loop
auto	3.002053140435838	0.0	keep	17_DOMINO_in_8	Parallel run loop
auto	6.005529234953876	0.0	keep	28_8_in_8	Parallel run loop
auto	3.2950538242750733	0.0	keep	20_DOMINO_in_8	Parallel run loop
auto	3.2358001236068357	0.0	keep	19_DOMINO_in_8	Parallel run loop
auto	5.234208130662085	0.0	keep	19_DOMINO_in_5	Parallel run loop
auto	5.501686529560237	0.0	keep	20_DOMINO_in_5	Parallel run loop
auto	2.365289384810053	0.0	keep	7_5_in_6	Parallel run loop
auto	5.8996881781481765	0.0	keep	27_6_in_6	Parallel run loop
auto	5.900107481896659	0.0	keep	25_DOMINO_in_5	Parallel run loop
auto	6.18017261138789	0.0	keep	27_DOMINO_in_5	Parallel run loop
auto	4.826751055230346	0.0	keep	16_DOMINO_in_5	Parallel run loop
auto	4.358468202622958	0.0	keep	13_DOMINO_in_5	Parallel run loop
auto	3.577021531457959	0.0	keep	22_DOMINO_in_8	Parallel run loop
auto	4.313014325741137	0.0	keep	19_DOMINO_in_6	Parallel run loop
auto	3.9661818180175907	0.0	keep	15_DOMINO_in_6	Parallel run loop
auto	5.42487534175108	0.0	keep	29_DOMINO_in_6	Parallel run loop
auto	5.206629226857864	0.0	keep	27_DOMINO_in_6	Parallel run loop
auto	4.172034538067222	0.0	keep	28_DOMINO_in_8	Parallel run loop
auto	3.886410372020647	0.0	keep	19_5_in_6	Parallel run loop
auto	6.098803994165773	0.0	keep	26_DOMINO_in_5	Parallel run loop
auto	6.260266141703968	0.0	keep	23_DOMINO_in_5	Parallel run loop
auto	4.813425863934019	0.0	keep	23_DOMINO_in_6	Parallel run loop
auto	6.282130860438569	0.0	keep	28_DOMINO_in_5	Parallel run loop
auto	4.932205764807428	0.0	keep	29_DOMINO_in_8	Parallel run loop
auto	2.88701111080539	0.0	keep	7_6_in_6	Parallel run loop
auto	4.993124152560439	0.0	keep	17_DOMINO_in_5	Parallel run loop
auto	6.301860726586056	0.0	keep	33_6_in_6	Parallel run loop
auto	3.7947647362218606	0.0	keep	25_DOMINO_in_8	Parallel run loop
auto	4.621349430444607	0.0	keep	18_6_in_6	Parallel run loop
auto	5.069114024073276	0.0	keep	26_DOMINO_in_6	Parallel run loop
auto	4.150433535926765	0.0	keep	18_DOMINO_in_6	Parallel run loop
auto	5.1194162339411	0.0	keep	18_DOMINO_in_5	Parallel run loop
auto	6.448136467114426	0.0	keep	19_8_in_6	Parallel run loop
auto	5.5165731796094635	0.0	keep	30_DOMINO_in_6	Parallel run loop
auto	4.967893251041706	0.0	keep	25_DOMINO_in_6	Parallel run loop
auto	4.198789294208267	0.0	keep	24_DOMINO_in_8	Parallel run loop
auto	3.60511706931935	0.0	keep	23_DOMINO_in_8	Parallel run loop
auto	5.013861864361179	0.0	keep	24_DOMINO_in_6	Parallel run loop
auto	4.898211593777919	0.0	keep	30_DOMINO_in_8	Parallel run loop
auto	5.18229106406766	0.0	keep	31_DOMINO_in_8	Parallel run loop
auto	3.9069115345308734	0.0	keep	26_DOMINO_in_8	Parallel run loop
auto	4.667249123233281	0.0	keep	19_6_in_6	Parallel run loop
auto	4.774038446212972	0.0	keep	11_6_in_5	Parallel run loop
auto	5.197932449442212	0.0	keep	25_6_in_CIRCLE	Parallel run loop
auto	4.861278188951596	0.0	keep	28_5_in_6	Parallel run loop
auto	3.5096510820028146	0.0	keep	27_5_in_8	Parallel run loop
auto	5.465666255018317	0.0	keep	23_6_in_6	Parallel run loop
auto	4.68620237775619	0.0	keep	21_6_in_CIRCLE	Parallel run loop
auto	2.2312929342669907	0.0	keep	6_5_in_CIRCLE	Parallel run loop
auto	6.090749152360154	0.0	keep	29_8_in_8	Parallel run loop
auto	7.680763819026371	0.0	keep	31_6_in_5	Parallel run loop
auto	2.804808373925404	0.0	keep	10_5_in_CIRCLE	Parallel run loop
auto	2.0052721736657615	0.0	keep	7_DOMINO_in_8	Parallel run loop
auto	4.75127218611163	0.0	discard	10_8_in_CIRCLE	Parallel run loop
auto	3.900860751232619	0.0	keep	28_DOMINO_in_8	Parallel run loop
auto	5.703447277666007	0.0	keep	26_5_in_5	Parallel run loop
auto	3.026588588751193	0.0	keep	12_5_in_CIRCLE	Parallel run loop
auto	4.970853579895428	0.0	keep	30_5_in_6	Parallel run loop
auto	2.8900148954966616	0.0	discard	9_5_in_6	Parallel run loop
auto	5.815470563365018	0.0	keep	27_8_in_8	Parallel run loop
auto	6.156533643123495	0.0	keep	30_8_in_8	Parallel run loop
auto	4.033652173451082	0.0	keep	29_DOMINO_in_8	Parallel run loop
auto	2.6341109191657477	0.0	keep	9_6_in_8	Parallel run loop
auto	5.790189669490146	0.0	discard	13_8_in_6	Parallel run loop
auto	6.3086008314667135	0.0	discard	10_8_in_5	Parallel run loop
auto	5.682660290105599	0.0	keep	23_DOMINO_in_5	Parallel run loop
auto	3.8369336484278946	0.0	discard	13_6_in_CIRCLE	Parallel run loop
auto	3.235250786986958	0.0	keep	14_5_in_CIRCLE	Parallel run loop
auto	5.628638076460831	0.0	keep	15_8_in_CIRCLE	Parallel run loop
auto	5.994170884047151	0.0	discard	9_8_in_5	Parallel run loop
auto	3.4115105969609285	0.0	keep	13_5_in_6	Parallel run loop
auto	2.5069731037578142	0.0	discard	13_5_in_8	Parallel run loop
auto	3.4389739282988523	0.0	keep	16_5_in_CIRCLE	Parallel run loop
auto	4.5621185844222865	0.0	keep	10_6_in_5	Parallel run loop
auto	3.9493073634468594	0.0	discard	11_6_in_6	Parallel run loop
auto	3.655338197289365	0.0	keep	24_DOMINO_in_8	Parallel run loop
auto	8.102774853359481	0.0	discard	20_8_in_DOMINO	Parallel run loop
auto	4.697834635053744	0.0	discard	19_5_in_DOMINO	Parallel run loop
auto	6.497991980936347	0.0	discard	11_8_in_5	Parallel run loop
auto	3.7301866469305605	0.0	keep	26_DOMINO_in_8	Parallel run loop
auto	4.092933717725107	0.0	keep	30_DOMINO_in_8	Parallel run loop
auto	4.1556935896769716	0.0	keep	31_DOMINO_in_8	Parallel run loop
auto	5.736101805919613	0.0	keep	16_8_in_CIRCLE	Parallel run loop
auto	3.078972759133498	0.0	keep	13_5_in_CIRCLE	Parallel run loop
auto	4.8203042879733635	0.0	discard	20_5_in_DOMINO	Parallel run loop
auto	4.569815862524372	0.0	discard	18_5_in_DOMINO	Parallel run loop
auto	4.299527754809248	0.0	keep	16_5_in_DOMINO	Parallel run loop
auto	6.064838671903889	0.0	keep	18_8_in_CIRCLE	Parallel run loop
auto	4.776862821368748	0.0	keep	17_8_in_8	Parallel run loop
auto	3.909947918442856	0.0	keep	21_5_in_CIRCLE	Parallel run loop
auto	3.652300870990018	0.0	keep	15_5_in_6	Parallel run loop
auto	2.753158087297144	0.0	keep	16_5_in_8	Parallel run loop
auto	3.61663420966025	0.0	keep	18_5_in_CIRCLE	Parallel run loop
auto	2.800033514793103	0.0	keep	10_5_in_CIRCLE	Parallel run loop
auto	3.34153837716045	0.0	keep	11_DOMINO_in_6	Parallel run loop
auto	4.75127218611163	0.0	discard	10_8_in_CIRCLE	Parallel run loop
auto	3.999265229145284	0.0	keep	22_5_in_CIRCLE	Parallel run loop
auto	3.019322822474101	0.0	keep	12_5_in_CIRCLE	Parallel run loop
auto	2.8900148954966616	0.0	discard	9_5_in_6	Parallel run loop
auto	4.462543691563868	0.0	keep	15_8_in_8	Parallel run loop
auto	4.787429691394307	0.0	discard	11_6_in_5	Parallel run loop
auto	3.509321008744731	0.0	keep	17_5_in_CIRCLE	Parallel run loop
auto	2.6447738834161796	0.0	discard	9_6_in_8	Parallel run loop
auto	2.4007400073217737	0.0	discard	12_5_in_8	Parallel run loop
auto	5.790189669490146	0.0	discard	13_8_in_6	Parallel run loop
auto	6.3086008314667135	0.0	discard	10_8_in_5	Parallel run loop
auto	3.4923893631002816	0.0	keep	17_6_in_8	Parallel run loop
auto	2.5657391214187344	0.0	keep	14_5_in_8	Parallel run loop
auto	3.8369336484278946	0.0	discard	13_6_in_CIRCLE	Parallel run loop
auto	3.8005742239848876	0.0	keep	20_5_in_CIRCLE	Parallel run loop
auto	2.462150627779868	0.0	keep	11_DOMINO_in_8	Parallel run loop
auto	2.5069731037578142	0.0	discard	13_5_in_8	Parallel run loop
auto	5.994170884047151	0.0	discard	9_8_in_5	Parallel run loop
auto	4.475245630635559	0.0	discard	15_6_in_6	Parallel run loop
auto	5.616806384346602	0.0	keep	15_8_in_CIRCLE	Parallel run loop
auto	4.302780923114252	0.0	keep	17_6_in_CIRCLE	Parallel run loop
auto	3.49361042507589	0.0	keep	8_DOMINO_in_5	Parallel run loop
auto	6.99904873201843	0.0	keep	20_8_in_6	Parallel run loop
auto	6.497991980936347	0.0	discard	11_8_in_5	Parallel run loop
auto	4.076902504166756	0.0	keep	23_5_in_CIRCLE	Parallel run loop
auto	4.409839693042728	0.0	discard	17_5_in_DOMINO	Parallel run loop
auto	4.904537362780794	0.0	discard	21_5_in_DOMINO	Parallel run loop
auto	4.697834635053744	0.0	discard	19_5_in_DOMINO	Parallel run loop
auto	4.309862100185108	0.0	discard	16_5_in_DOMINO	Parallel run loop
auto	4.8203042879733635	0.0	discard	20_5_in_DOMINO	Parallel run loop
auto	8.102774853359481	0.0	discard	20_8_in_DOMINO	Parallel run loop
auto	4.569815862524372	0.0	discard	18_5_in_DOMINO	Parallel run loop
auto	3.572870031894738	0.0	keep	18_6_in_8	Parallel run loop
auto	4.4901170642273724	0.0	keep	21_DOMINO_in_6	Parallel run loop
auto	3.645260226224486	0.0	keep	15_5_in_6	Parallel run loop
auto	4.758844808330094	0.0	keep	17_8_in_8	Parallel run loop
auto	8.382506079934158	0.0	discard	22_8_in_DOMINO	Parallel run loop
auto	2.9018881122062448	0.0	keep	18_5_in_8	Parallel run loop
auto	7.160232969366078	0.0	discard	16_8_in_DOMINO	Parallel run loop
auto	2.820084221336549	0.0	keep	17_5_in_8	Parallel run loop
auto	2.329547642765257	0.0	keep	10_DOMINO_in_8	Parallel run loop
auto	4.75127218611163	0.0	discard	10_8_in_CIRCLE	Parallel run loop
auto	5.396363285804716	0.0	keep	22_8_in_8	Parallel run loop
auto	2.8900148954966616	0.0	discard	9_5_in_6	Parallel run loop
auto	5.091739006169618	0.0	keep	24_6_in_CIRCLE	Parallel run loop
auto	3.133252010302697	0.0	keep	21_5_in_8	Parallel run loop
auto	2.4007400073217737	0.0	discard	12_5_in_8	Parallel run loop
auto	4.787429691394307	0.0	discard	11_6_in_5	Parallel run loop
auto	3.1997886445277595	0.0	keep	22_5_in_8	Parallel run loop
auto	5.790189669490146	0.0	discard	13_8_in_6	Parallel run loop
auto	3.9349734831282106	0.0	keep	22_6_in_8	Parallel run loop
auto	3.4599247985454893	0.0	keep	12_DOMINO_in_6	Parallel run loop
auto	6.2478639807772485	0.0	discard	16_8_in_6	Parallel run loop
auto	3.8369336484278946	0.0	discard	13_6_in_CIRCLE	Parallel run loop
auto	2.198140734442995	0.0	keep	9_DOMINO_in_8	Parallel run loop
auto	2.4710354843797564	0.0	discard	11_DOMINO_in_8	Parallel run loop
auto	3.4859760445346586	0.0	keep	17_6_in_8	Parallel run loop
auto	3.484133155549617	0.0	keep	14_5_in_6	Parallel run loop
auto	2.5069731037578142	0.0	discard	13_5_in_8	Parallel run loop
auto	3.6721132563744656	0.0	keep	19_5_in_CIRCLE	Parallel run loop
auto	4.475245630635559	0.0	discard	15_6_in_6	Parallel run loop
auto	4.155944003662484	0.0	keep	20_5_in_6	Parallel run loop
auto	5.693379391606711	0.0	discard	19_6_in_DOMINO	Parallel run loop
auto	5.83127628478469	0.0	keep	20_6_in_DOMINO	Parallel run loop
auto	6.497991980936347	0.0	discard	11_8_in_5	Parallel run loop
auto	4.142682808536443	0.0	keep	24_5_in_CIRCLE	Parallel run loop
auto	4.409839693042728	0.0	discard	17_5_in_DOMINO	Parallel run loop
auto	4.904537362780794	0.0	discard	21_5_in_DOMINO	Parallel run loop
auto	4.258724526836574	0.0	keep	21_5_in_6	Parallel run loop
auto	4.309862100185108	0.0	discard	16_5_in_DOMINO	Parallel run loop
auto	4.697834635053744	0.0	discard	19_5_in_DOMINO	Parallel run loop
auto	2.443517572612156	0.0	keep	6_DOMINO_in_6	Parallel run loop
auto	4.8203042879733635	0.0	discard	20_5_in_DOMINO	Parallel run loop
auto	4.569815862524372	0.0	discard	18_5_in_DOMINO	Parallel run loop
auto	3.638610263513514	0.0	keep	15_5_in_6	Parallel run loop
auto	8.102774853359481	0.0	discard	20_8_in_DOMINO	Parallel run loop
auto	6.281350871924349	0.0	discard	20_6_in_5	Parallel run loop
auto	3.5674703234347533	0.0	keep	18_6_in_8	Parallel run loop
auto	3.7187369621593063	0.0	keep	16_5_in_6	Parallel run loop
auto	3.727304819600954	0.0	keep	20_6_in_8	Parallel run loop
auto	8.382506079934158	0.0	discard	22_8_in_DOMINO	Parallel run loop
auto	4.75127218611163	0.0	discard	10_8_in_CIRCLE	Parallel run loop
auto	2.8900148954966616	0.0	discard	9_5_in_6	Parallel run loop
auto	2.959425959855693	0.0	keep	19_5_in_8	Parallel run loop
auto	7.160232969366078	0.0	discard	16_8_in_DOMINO	Parallel run loop
auto	6.146608374864791	0.0	keep	22_6_in_DOMINO	Parallel run loop
auto	4.749142922997121	0.0	keep	11_6_in_5	Parallel run loop
auto	2.4007400073217737	0.0	discard	12_5_in_8	Parallel run loop
auto	3.2633220163411067	0.0	keep	23_5_in_8	Parallel run loop
auto	2.8934369172816097	0.0	keep	18_5_in_8	Parallel run loop
auto	6.402577326431777	0.0	keep	21_6_in_5	Parallel run loop
auto	2.324083875658053	0.0	keep	10_DOMINO_in_8	Parallel run loop
auto	2.8118778949422008	0.0	keep	17_5_in_8	Parallel run loop
auto	3.8369336484278946	0.0	discard	13_6_in_CIRCLE	Parallel run loop
auto	5.790189669490146	0.0	discard	13_8_in_6	Parallel run loop
auto	4.937278320594882	0.0	keep	22_5_in_DOMINO	Parallel run loop
auto	3.4799250675482436	0.0	keep	17_6_in_8	Parallel run loop
auto	2.5069731037578142	0.0	discard	13_5_in_8	Parallel run loop
auto	6.54433802021737	0.0	keep	22_6_in_5	Parallel run loop
auto	5.377293477291475	0.0	keep	22_8_in_8	Parallel run loop
auto	3.819465338042965	0.0	keep	21_6_in_8	Parallel run loop
auto	4.475245630635559	0.0	discard	15_6_in_6	Parallel run loop
auto	5.562005919418596	0.0	keep	24_8_in_8	Parallel run loop
auto	2.469306278371665	0.0	discard	11_DOMINO_in_8	Parallel run loop
auto	4.333923241366794	0.0	keep	22_5_in_6	Parallel run loop
auto	3.124299666083074	0.0	keep	21_5_in_8	Parallel run loop
auto	5.09725209874807	0.0	keep	20_8_in_8	Parallel run loop
auto	3.2080940897797676	0.0	discard	22_5_in_8	Parallel run loop
auto	4.904537362780794	0.0	discard	21_5_in_DOMINO	Parallel run loop
auto	4.9389490726376035	0.0	keep	19_8_in_8	Parallel run loop
auto	3.9299173735844306	0.0	keep	22_6_in_8	Parallel run loop
auto	6.2478639807772485	0.0	discard	16_8_in_6	Parallel run loop
auto	4.697834635053744	0.0	discard	19_5_in_DOMINO	Parallel run loop
auto	4.53850664765424	0.0	keep	16_6_in_6	Parallel run loop
auto	4.8203042879733635	0.0	discard	20_5_in_DOMINO	Parallel run loop
auto	4.569815862524372	0.0	discard	18_5_in_DOMINO	Parallel run loop
auto	4.409839693042728	0.0	discard	17_5_in_DOMINO	Parallel run loop
auto	3.479943526755655	0.0	keep	14_5_in_6	Parallel run loop
auto	4.309862100185108	0.0	discard	16_5_in_DOMINO	Parallel run loop
auto	5.8434126687983206	0.0	discard	20_6_in_DOMINO	Parallel run loop
auto	8.102774853359481	0.0	discard	20_8_in_DOMINO	Parallel run loop
auto	5.693379391606711	0.0	discard	19_6_in_DOMINO	Parallel run loop
auto	4.151474159026857	0.0	keep	20_5_in_6	Parallel run loop
auto	6.700106835949054	0.0	discard	23_6_in_5	Parallel run loop
auto	4.2541346268160325	0.0	keep	21_5_in_6	Parallel run loop
auto	5.671778254092202	0.0	keep	25_8_in_8	Parallel run loop
auto	4.1298735618884885	0.0	keep	24_5_in_CIRCLE	Parallel run loop
auto	3.5623955010957657	0.0	keep	18_6_in_8	Parallel run loop
auto	3.714638890050593	0.0	keep	16_5_in_6	Parallel run loop
auto	6.281350871924349	0.0	discard	20_6_in_5	Parallel run loop
auto	8.382506079934158	0.0	discard	22_8_in_DOMINO	Parallel run loop
auto	4.724899297287477	0.0	keep	11_6_in_5	Parallel run loop
auto	7.160232969366078	0.0	discard	16_8_in_DOMINO	Parallel run loop
auto	3.2564747573333848	0.0	keep	23_5_in_8	Parallel run loop
auto	5.437747503273199	0.0	keep	23_8_in_8	Parallel run loop
auto	3.3691323783991427	0.0	keep	25_5_in_8	Parallel run loop
auto	3.567191205685717	0.0	keep	28_5_in_8	Parallel run loop
auto	6.107722653084625	0.0	keep	22_6_in_DOMINO	Parallel run loop
auto	4.43132074898442	0.0	keep	23_5_in_6	Parallel run loop
auto	5.29540470083123	0.0	keep	22_6_in_6	Parallel run loop
auto	5.358975508363075	0.0	keep	22_8_in_8	Parallel run loop
auto	4.475245630635559	0.0	discard	15_6_in_6	Parallel run loop
auto	3.816148138344318	0.0	keep	21_6_in_8	Parallel run loop
auto	3.76458482821966	0.0	keep	31_5_in_8	Parallel run loop
auto	4.330905711998268	0.0	keep	22_5_in_6	Parallel run loop
auto	4.224131662018365	0.0	keep	14_5_in_5	Parallel run loop
auto	3.448583845726221	0.0	keep	26_5_in_8	Parallel run loop
auto	2.464372354683038	0.0	discard	11_DOMINO_in_8	Parallel run loop
auto	3.627715492468421	0.0	keep	29_5_in_8	Parallel run loop
auto	5.08100826606695	0.0	keep	20_8_in_8	Parallel run loop
auto	3.2080940897797676	0.0	discard	22_5_in_8	Parallel run loop
auto	5.751474952889565	0.0	keep	26_8_in_8	Parallel run loop
auto	2.81519422308548	0.0	keep	15_DOMINO_in_8	Parallel run loop
auto	6.817316351277816	0.0	keep	24_6_in_5	Parallel run loop
auto	4.59260950858139	0.0	keep	25_5_in_6	Parallel run loop
auto	4.904537362780794	0.0	discard	21_5_in_DOMINO	Parallel run loop
auto	5.162533653034662	0.0	keep	21_5_in_5	Parallel run loop
auto	6.2478639807772485	0.0	discard	16_8_in_6	Parallel run loop
auto	3.925178763774446	0.0	keep	22_6_in_8	Parallel run loop
auto	4.558228051991228	0.0	discard	16_6_in_6	Parallel run loop
auto	5.638356292340858	0.0	keep	25_6_in_6	Parallel run loop
auto	4.409839693042728	0.0	discard	17_5_in_DOMINO	Parallel run loop
auto	4.309862100185108	0.0	discard	16_5_in_DOMINO	Parallel run loop
auto	7.048417234585714	0.0	keep	26_6_in_5	Parallel run loop
auto	3.293533327193608	0.0	keep	24_5_in_8	Parallel run loop
auto	3.4760210565934737	0.0	keep	14_5_in_6	Parallel run loop
auto	5.422755618210451	0.0	keep	21_DOMINO_in_5	Parallel run loop
auto	3.342329739257678	0.0	keep	21_DOMINO_in_8	Parallel run loop
auto	5.8434126687983206	0.0	discard	20_6_in_DOMINO	Parallel run loop
auto	6.0953254095291225	0.0	discard	19_8_in_CIRCLE	Parallel run loop
auto	5.115248712199355	0.0	keep	31_5_in_6	Parallel run loop
auto	4.1472960965539265	0.0	keep	20_5_in_6	Parallel run loop
auto	5.693379391606711	0.0	discard	19_6_in_DOMINO	Parallel run loop
auto	5.278208251889842	0.0	keep	22_5_in_5	Parallel run loop
auto	6.700106835949054	0.0	discard	23_6_in_5	Parallel run loop
auto	4.249844223171721	0.0	keep	21_5_in_6	Parallel run loop
auto	4.6741342922859515	0.0	keep	26_5_in_6	Parallel run loop
auto	5.696462874024032	0.0	discard	25_8_in_8	Parallel run loop
auto	6.281350871924349	0.0	discard	20_6_in_5	Parallel run loop
auto	3.710807033854501	0.0	keep	16_5_in_6	Parallel run loop
auto	8.382506079934158	0.0	discard	22_8_in_DOMINO	Parallel run loop
auto	7.160232969366078	0.0	discard	16_8_in_DOMINO	Parallel run loop
auto	6.933907362932419	0.0	keep	25_6_in_5	Parallel run loop
