commit	score	memory_gb	status	problem	description
auto	1.4907913083877036	0.0	keep	7_3_in_DOMINO	Parallel run loop
auto	2.691885261928479	0.0	discard	23_3_in_circle	Parallel run loop
auto	2.9998371987679295	0.0	discard	28_3_in_circle	Parallel run loop
auto	2.8842403619754964	0.0	discard	26_3_in_circle	Parallel run loop
auto	2.082955428165058	0.0	keep	16_3_in_DOMINO	Parallel run loop
auto	2.940534535359192	0.0	discard	27_3_in_circle	Parallel run loop
auto	2.8224961075245623	0.0	discard	25_3_in_circle	Parallel run loop
auto	3.1246472936956535	0.0	discard	30_3_in_circle	Parallel run loop
auto	3.1592144216156113	0.0	keep	31_3_in_circle	Parallel run loop
auto	3.0559091244492644	0.0	discard	29_3_in_circle	Parallel run loop
auto	1.3763322075192148	0.0	discard	6_3_in_DOMINO	Parallel run loop
auto	1.1204680284017543	0.0	discard	4_3_in_DOMINO	Parallel run loop
auto	1.2748051192828511	0.0	discard	8_3_in_circle	Parallel run loop
auto	0.9680088680085646	0.0	discard	3_3_in_DOMINO	Parallel run loop
auto	2.5616841659486527	0.0	keep	21_3_in_DOMINO	Parallel run loop
auto	2.6408428395495847	0.0	discard	22_3_in_DOMINO	Parallel run loop
auto	2.399478073751509	0.0	keep	19_3_in_DOMINO	Parallel run loop
auto	2.21527082820787	0.0	keep	18_3_in_DOMINO	Parallel run loop
auto	1.4830513649835477	0.0	discard	11_3_in_circle	Parallel run loop
auto	1.56307865221544	0.0	discard	8_3_in_DOMINO	Parallel run loop
auto	1.8690958074146495	0.0	keep	13_3_in_DOMINO	Parallel run loop
auto	2.4838763174772893	0.0	keep	20_3_in_circle	Parallel run loop
auto	2.506933334411813	0.0	discard	20_3_in_DOMINO	Parallel run loop
auto	2.2765882974661054	0.0	keep	17_3_in_DOMINO	Parallel run loop
auto	1.7141192426593264	0.0	discard	9_3_in_DOMINO	Parallel run loop
auto	1.6549223038095542	0.0	discard	15_3_in_circle	Parallel run loop
auto	0.9535501642403865	0.0	discard	3_3_in_circle	Parallel run loop
auto	1.7029189896133312	0.0	discard	16_3_in_circle	Parallel run loop
auto	1.5230514075566917	0.0	discard	12_3_in_circle	Parallel run loop
auto	2.02058938648662	0.0	keep	15_3_in_DOMINO	Parallel run loop
auto	1.1610009831196497	0.0	discard	7_3_in_circle	Parallel run loop
auto	1.911646754271575	0.0	discard	14_3_in_DOMINO	Parallel run loop
auto	1.5377331965196364	0.0	discard	13_3_in_circle	Parallel run loop
auto	2.6905395884591243	0.0	keep	23_3_in_circle	Parallel run loop
auto	3.0004372562148	0.0	discard	28_3_in_circle	Parallel run loop
auto	2.8897259025580873	0.0	discard	26_3_in_circle	Parallel run loop
auto	2.9434766878356737	0.0	discard	27_3_in_circle	Parallel run loop
auto	2.8140408856084544	0.0	discard	25_3_in_circle	Parallel run loop
auto	2.036453048536894	0.0	keep	16_3_in_DOMINO	Parallel run loop
auto	0.9839779248667476	0.0	discard	4_3_in_circle	Parallel run loop
auto	1.2631707571078108	0.0	discard	5_3_in_DOMINO	Parallel run loop
auto	3.162338297674939	0.0	discard	31_3_in_circle	Parallel run loop
auto	1.490840291646784	0.0	discard	7_3_in_DOMINO	Parallel run loop
auto	2.569102871308993	0.0	discard	21_3_in_DOMINO	Parallel run loop
auto	1.743197279660388	0.0	discard	17_3_in_circle	Parallel run loop
auto	1.7530469032987281	0.0	discard	11_3_in_DOMINO	Parallel run loop
auto	1.7439957676520519	0.0	discard	12_3_in_DOMINO	Parallel run loop
auto	1.3234977954899296	0.0	discard	9_3_in_circle	Parallel run loop
auto	2.411838675815264	0.0	discard	19_3_in_DOMINO	Parallel run loop
auto	1.617666058427277	0.0	discard	14_3_in_circle	Parallel run loop
auto	1.3763322075192148	0.0	discard	6_3_in_DOMINO	Parallel run loop
auto	2.206177420765484	0.0	keep	18_3_in_DOMINO	Parallel run loop
auto	1.8647078872964393	0.0	keep	13_3_in_DOMINO	Parallel run loop
auto	2.497670097768537	0.0	discard	20_3_in_circle	Parallel run loop
auto	1.1204680284017543	0.0	discard	4_3_in_DOMINO	Parallel run loop
auto	2.2169104217168516	0.0	keep	17_3_in_DOMINO	Parallel run loop
auto	0.9680088680085646	0.0	discard	3_3_in_DOMINO	Parallel run loop
auto	0.9535501642403865	0.0	discard	3_3_in_circle	Parallel run loop
auto	1.6549223038095542	0.0	discard	15_3_in_circle	Parallel run loop
auto	1.56307865221544	0.0	discard	8_3_in_DOMINO	Parallel run loop
auto	1.7029189896133312	0.0	discard	16_3_in_circle	Parallel run loop
auto	1.7141192426593264	0.0	discard	9_3_in_DOMINO	Parallel run loop
auto	2.0127560216081934	0.0	keep	15_3_in_DOMINO	Parallel run loop
auto	2.6958595308852895	0.0	discard	23_3_in_circle	Parallel run loop
auto	1.1610009831196497	0.0	discard	7_3_in_circle	Parallel run loop
auto	2.8885701855690598	0.0	discard	26_3_in_circle	Parallel run loop
auto	1.911646754271575	0.0	discard	14_3_in_DOMINO	Parallel run loop
auto	1.5377331965196364	0.0	discard	13_3_in_circle	Parallel run loop
auto	3.746847963455798	0.0	discard	11_3_in_3	Parallel run loop
auto	2.8165747891883566	0.0	discard	25_3_in_circle	Parallel run loop
auto	0.9839779248667476	0.0	discard	4_3_in_circle	Parallel run loop
auto	2.0931053288197297	0.0	discard	16_3_in_DOMINO	Parallel run loop
auto	3.1766016015547653	0.0	discard	31_3_in_circle	Parallel run loop
auto	1.490840291646784	0.0	discard	7_3_in_DOMINO	Parallel run loop
auto	1.2631707571078108	0.0	discard	5_3_in_DOMINO	Parallel run loop
auto	2.57862663622855	0.0	discard	21_3_in_DOMINO	Parallel run loop
auto	1.7530469032987281	0.0	discard	11_3_in_DOMINO	Parallel run loop
auto	1.743197279660388	0.0	discard	17_3_in_circle	Parallel run loop
auto	2.3954929938292144	0.0	keep	19_3_in_DOMINO	Parallel run loop
auto	1.3234977954899296	0.0	discard	9_3_in_circle	Parallel run loop
auto	1.7439957676520519	0.0	discard	12_3_in_DOMINO	Parallel run loop
auto	1.617666058427277	0.0	discard	14_3_in_circle	Parallel run loop
auto	1.3763322075192148	0.0	discard	6_3_in_DOMINO	Parallel run loop
auto	2.1994686430660058	0.0	keep	18_3_in_DOMINO	Parallel run loop
auto	1.8612165324280032	0.0	keep	13_3_in_DOMINO	Parallel run loop
auto	1.1204680284017543	0.0	discard	4_3_in_DOMINO	Parallel run loop
auto	4.020316954443297	0.0	discard	13_3_in_3	Parallel run loop
auto	2.1592510720107905	0.0	keep	17_3_in_DOMINO	Parallel run loop
auto	0.9680088680085646	0.0	discard	3_3_in_DOMINO	Parallel run loop
auto	0.9535501642403865	0.0	discard	3_3_in_circle	Parallel run loop
auto	1.56307865221544	0.0	discard	8_3_in_DOMINO	Parallel run loop
auto	1.7029189896133312	0.0	discard	16_3_in_circle	Parallel run loop
auto	1.7141192426593264	0.0	discard	9_3_in_DOMINO	Parallel run loop
auto	2.704500531668594	0.0	discard	23_3_in_circle	Parallel run loop
auto	2.0069170391190774	0.0	keep	15_3_in_DOMINO	Parallel run loop
auto	5.719122467319307	0.0	discard	26_3_in_3	Parallel run loop
auto	1.1610009831196497	0.0	discard	7_3_in_circle	Parallel run loop
auto	1.911646754271575	0.0	discard	14_3_in_DOMINO	Parallel run loop
auto	1.5377331965196364	0.0	discard	13_3_in_circle	Parallel run loop
auto	0.9839779248667476	0.0	discard	4_3_in_circle	Parallel run loop
auto	1.2631707571078108	0.0	discard	5_3_in_DOMINO	Parallel run loop
auto	2.1382757009637388	0.0	discard	16_3_in_DOMINO	Parallel run loop
auto	1.490840291646784	0.0	discard	7_3_in_DOMINO	Parallel run loop
auto	6.007630917812645	0.0	discard	32_3_in_3	Parallel run loop
auto	1.7530469032987281	0.0	discard	11_3_in_DOMINO	Parallel run loop
auto	1.743197279660388	0.0	discard	17_3_in_circle	Parallel run loop
auto	1.3234977954899296	0.0	discard	9_3_in_circle	Parallel run loop
auto	1.7439957676520519	0.0	discard	12_3_in_DOMINO	Parallel run loop
auto	6.944178033476889	0.0	discard	42_3_in_3	Parallel run loop
auto	2.4901149670854683	0.0	discard	19_3_in_DOMINO	Parallel run loop
auto	1.3763322075192148	0.0	discard	6_3_in_DOMINO	Parallel run loop
auto	1.617666058427277	0.0	discard	14_3_in_circle	Parallel run loop
auto	6.6767400597425315	0.0	discard	37_3_in_3	Parallel run loop
auto	6.7633242158791695	0.0	keep	39_3_in_3	Parallel run loop
auto	7.015974820954202	0.0	discard	44_3_in_3	Parallel run loop
auto	1.8583855818557053	0.0	keep	13_3_in_DOMINO	Parallel run loop
auto	2.194281985843369	0.0	keep	18_3_in_DOMINO	Parallel run loop
auto	1.1204680284017543	0.0	discard	4_3_in_DOMINO	Parallel run loop
auto	0.9680088680085646	0.0	discard	3_3_in_DOMINO	Parallel run loop
auto	2.1484623758608303	0.0	keep	17_3_in_DOMINO	Parallel run loop
auto	1.56307865221544	0.0	discard	8_3_in_DOMINO	Parallel run loop
auto	2.3083079972991536	0.0	keep	18_3_in_circle	Parallel run loop
auto	2.4362779953799674	0.0	discard	19_3_in_circle	Parallel run loop
auto	6.998537660296441	0.0	discard	43_3_in_3	Parallel run loop
auto	2.6354201271283175	0.0	discard	22_3_in_circle	Parallel run loop
auto	2.0023760399769976	0.0	keep	15_3_in_DOMINO	Parallel run loop
auto	1.1610009831196497	0.0	discard	7_3_in_circle	Parallel run loop
auto	1.911646754271575	0.0	discard	14_3_in_DOMINO	Parallel run loop
auto	2.5686272542026876	0.0	discard	21_3_in_circle	Parallel run loop
auto	1.5377331965196364	0.0	discard	13_3_in_circle	Parallel run loop
auto	2.506929058600118	0.0	discard	20_3_in_circle	Parallel run loop
auto	7.682459677785787	0.0	keep	50_3_in_3	Parallel run loop
auto	3.1177802827751018	0.0	discard	30_3_in_circle	Parallel run loop
auto	7.253785455633186	0.0	keep	46_3_in_3	Parallel run loop
auto	3.010957712701827	0.0	discard	28_3_in_circle	Parallel run loop
auto	1.490840291646784	0.0	discard	7_3_in_DOMINO	Parallel run loop
auto	3.058354952242918	0.0	discard	29_3_in_circle	Parallel run loop
auto	2.949959789506253	0.0	discard	27_3_in_circle	Parallel run loop
auto	1.743197279660388	0.0	discard	17_3_in_circle	Parallel run loop
auto	2.834092678127672	0.0	discard	25_3_in_circle	Parallel run loop
auto	2.698826756407839	0.0	discard	23_3_in_circle	Parallel run loop
auto	1.7439957676520519	0.0	discard	12_3_in_DOMINO	Parallel run loop
auto	2.8998581709647437	0.0	discard	26_3_in_circle	Parallel run loop
auto	3.1750136183823834	0.0	discard	31_3_in_circle	Parallel run loop
auto	1.2748051192828511	0.0	discard	8_3_in_circle	Parallel run loop
auto	1.8560588841102648	0.0	keep	13_3_in_DOMINO	Parallel run loop
auto	2.1901568541161303	0.0	keep	18_3_in_DOMINO	Parallel run loop
auto	1.4830513649835477	0.0	discard	11_3_in_circle	Parallel run loop
auto	6.805899464980523	0.0	discard	37_3_in_3	Parallel run loop
auto	6.719109562749771	0.0	keep	39_3_in_3	Parallel run loop
auto	1.4007623159126743	0.0	discard	10_3_in_circle	Parallel run loop
auto	2.1408269351054066	0.0	keep	17_3_in_DOMINO	Parallel run loop
auto	1.5230514075566917	0.0	discard	12_3_in_circle	Parallel run loop
auto	2.4338428134173826	0.0	discard	19_3_in_circle	Parallel run loop
auto	1.8272854274759711	0.0	keep	18_3_in_circle	Parallel run loop
auto	1.7011773066844613	0.0	discard	10_3_in_DOMINO	Parallel run loop
auto	2.931723676723068	0.0	discard	11_4_in_DOMINO	Parallel run loop
auto	1.998750484297148	0.0	keep	15_3_in_DOMINO	Parallel run loop
auto	3.0104540932523642	0.0	discard	13_4_in_DOMINO	Parallel run loop
auto	2.5776336519213063	0.0	discard	21_3_in_circle	Parallel run loop
auto	3.746847963455798	0.0	discard	11_3_in_3	Parallel run loop
auto	3.1205876885453137	0.0	discard	30_3_in_circle	Parallel run loop
auto	2.643847752583437	0.0	discard	16_4_in_CIRCLE	Parallel run loop
auto	2.6322593617733867	0.0	discard	22_3_in_circle	Parallel run loop
auto	6.998537660296441	0.0	discard	43_3_in_3	Parallel run loop
auto	1.6549223038095542	0.0	discard	15_3_in_circle	Parallel run loop
auto	1.7029189896133312	0.0	discard	16_3_in_circle	Parallel run loop
auto	2.95557032195552	0.0	discard	27_3_in_circle	Parallel run loop
auto	4.020316954443297	0.0	discard	13_3_in_3	Parallel run loop
auto	2.498169706728185	0.0	discard	20_3_in_circle	Parallel run loop
auto	2.6493074961029754	0.0	discard	22_3_in_DOMINO	Parallel run loop
auto	2.5174851252635637	0.0	discard	20_3_in_DOMINO	Parallel run loop
auto	7.629966147768929	0.0	keep	50_3_in_3	Parallel run loop
auto	2.9479967602447665	0.0	discard	20_4_in_CIRCLE	Parallel run loop
auto	2.8016697604273646	0.0	discard	18_4_in_CIRCLE	Parallel run loop
auto	7.409842021561194	0.0	discard	46_3_in_3	Parallel run loop
auto	3.0136689300711863	0.0	discard	28_3_in_circle	Parallel run loop
auto	1.8541272338431962	0.0	keep	13_3_in_DOMINO	Parallel run loop
auto	3.06172116207965	0.0	discard	29_3_in_circle	Parallel run loop
auto	2.1868130017968426	0.0	keep	18_3_in_DOMINO	Parallel run loop
auto	2.710728353537295	0.0	discard	23_3_in_circle	Parallel run loop
auto	2.8776782496867814	0.0	discard	19_4_in_CIRCLE	Parallel run loop
auto	2.1350533229105015	0.0	keep	17_3_in_DOMINO	Parallel run loop
auto	2.8905929937413104	0.0	discard	26_3_in_circle	Parallel run loop
auto	2.4101064650945814	0.0	keep	19_3_in_circle	Parallel run loop
auto	6.6103927531808395	0.0	keep	39_3_in_3	Parallel run loop
auto	2.8162931317094375	0.0	discard	25_3_in_circle	Parallel run loop
auto	1.8178633650138765	0.0	keep	18_3_in_circle	Parallel run loop
auto	3.1674023423129984	0.0	discard	31_3_in_circle	Parallel run loop
auto	1.9958036489838187	0.0	keep	15_3_in_DOMINO	Parallel run loop
auto	2.558884506436323	0.0	discard	21_3_in_circle	Parallel run loop
auto	1.2748051192828511	0.0	discard	8_3_in_circle	Parallel run loop
auto	1.4830513649835477	0.0	discard	11_3_in_circle	Parallel run loop
auto	1.4007623159126743	0.0	discard	10_3_in_circle	Parallel run loop
auto	2.6534029554683034	0.0	discard	22_3_in_circle	Parallel run loop
auto	1.5230514075566917	0.0	discard	12_3_in_circle	Parallel run loop
auto	1.7011773066844613	0.0	discard	10_3_in_DOMINO	Parallel run loop
auto	2.874818647722945	0.0	discard	11_4_in_DOMINO	Parallel run loop
auto	3.0104540932523642	0.0	discard	13_4_in_DOMINO	Parallel run loop
auto	2.645071781795077	0.0	discard	22_3_in_DOMINO	Parallel run loop
auto	2.580174353866316	0.0	discard	21_3_in_DOMINO	Parallel run loop
auto	3.115803431953349	0.0	discard	23_4_in_CIRCLE	Parallel run loop
auto	3.1227729739540426	0.0	discard	30_3_in_circle	Parallel run loop
auto	3.746847963455798	0.0	discard	11_3_in_3	Parallel run loop
auto	1.6549223038095542	0.0	discard	15_3_in_circle	Parallel run loop
auto	2.643847752583437	0.0	discard	16_4_in_CIRCLE	Parallel run loop
auto	1.7029189896133312	0.0	discard	16_3_in_circle	Parallel run loop
auto	6.958931064159313	0.0	keep	43_3_in_3	Parallel run loop
auto	3.052854590117277	0.0	discard	29_3_in_circle	Parallel run loop
auto	1.8804777931882963	0.0	discard	13_3_in_DOMINO	Parallel run loop
auto	2.1840653595801687	0.0	keep	18_3_in_DOMINO	Parallel run loop
auto	2.5034216383112504	0.0	discard	20_3_in_circle	Parallel run loop
auto	2.9373015641792013	0.0	keep	27_3_in_circle	Parallel run loop
auto	7.628307408682151	0.0	keep	50_3_in_3	Parallel run loop
auto	2.422521817946605	0.0	discard	19_3_in_circle	Parallel run loop
auto	4.020316954443297	0.0	discard	13_3_in_3	Parallel run loop
auto	2.1305246985657265	0.0	keep	17_3_in_DOMINO	Parallel run loop
auto	2.8219316365280185	0.0	discard	25_3_in_circle	Parallel run loop
auto	3.0058431774459886	0.0	discard	28_3_in_circle	Parallel run loop
auto	1.8086519807424566	0.0	keep	18_3_in_circle	Parallel run loop
auto	1.9933774251199539	0.0	keep	15_3_in_DOMINO	Parallel run loop
auto	2.5815031973131495	0.0	discard	21_3_in_circle	Parallel run loop
auto	2.702878236970587	0.0	discard	23_3_in_circle	Parallel run loop
auto	6.940912390839882	0.0	discard	39_3_in_3	Parallel run loop
auto	2.888281328550503	0.0	discard	26_3_in_circle	Parallel run loop
auto	2.504928489545246	0.0	discard	20_3_in_DOMINO	Parallel run loop
auto	2.9479967602447665	0.0	discard	20_4_in_CIRCLE	Parallel run loop
auto	2.8016697604273646	0.0	discard	18_4_in_CIRCLE	Parallel run loop
auto	3.1705714874236546	0.0	discard	31_3_in_circle	Parallel run loop
auto	2.8776782496867814	0.0	discard	19_4_in_CIRCLE	Parallel run loop
auto	3.8034922878807986	0.0	discard	22_4_in_DOMINO	Parallel run loop
auto	1.2748051192828511	0.0	discard	8_3_in_circle	Parallel run loop
auto	1.4830513649835477	0.0	discard	11_3_in_circle	Parallel run loop
auto	1.4007623159126743	0.0	discard	10_3_in_circle	Parallel run loop
auto	3.1064519114939206	0.0	discard	21_4_in_CIRCLE	Parallel run loop
auto	4.895691169369647	0.0	keep	20_3_in_3	Parallel run loop
auto	2.649955600521817	0.0	discard	22_3_in_circle	Parallel run loop
auto	1.5230514075566917	0.0	discard	12_3_in_circle	Parallel run loop
auto	1.7011773066844613	0.0	discard	10_3_in_DOMINO	Parallel run loop
auto	3.067851038736012	0.0	discard	29_3_in_circle	Parallel run loop
auto	2.931723676723068	0.0	discard	11_4_in_DOMINO	Parallel run loop
auto	3.0104540932523642	0.0	discard	13_4_in_DOMINO	Parallel run loop
auto	2.181784613735859	0.0	keep	18_3_in_DOMINO	Parallel run loop
auto	2.949851180296473	0.0	discard	27_3_in_circle	Parallel run loop
auto	2.419616390096634	0.0	discard	19_3_in_circle	Parallel run loop
auto	6.9673699289329925	0.0	discard	43_3_in_3	Parallel run loop
auto	3.1243348289662842	0.0	discard	30_3_in_circle	Parallel run loop
auto	2.1599791937891735	0.0	discard	17_3_in_DOMINO	Parallel run loop
auto	3.746847963455798	0.0	discard	11_3_in_3	Parallel run loop
auto	2.643847752583437	0.0	discard	16_4_in_CIRCLE	Parallel run loop
auto	1.8204190752494187	0.0	discard	18_3_in_circle	Parallel run loop
auto	7.626774668354092	0.0	keep	50_3_in_3	Parallel run loop
auto	2.509186423284701	0.0	discard	20_3_in_circle	Parallel run loop
auto	1.9913604363862547	0.0	keep	15_3_in_DOMINO	Parallel run loop
auto	2.8966699214202953	0.0	discard	26_3_in_circle	Parallel run loop
auto	1.6549223038095542	0.0	discard	15_3_in_circle	Parallel run loop
auto	1.7029189896133312	0.0	discard	16_3_in_circle	Parallel run loop
auto	2.5152202947340356	0.0	discard	20_3_in_DOMINO	Parallel run loop
auto	2.834376115739246	0.0	discard	25_3_in_circle	Parallel run loop
auto	4.020316954443297	0.0	discard	13_3_in_3	Parallel run loop
auto	3.0142717542793247	0.0	discard	28_3_in_circle	Parallel run loop
auto	2.6260947155205696	0.0	keep	22_3_in_DOMINO	Parallel run loop
auto	2.557093824558012	0.0	keep	21_3_in_circle	Parallel run loop
auto	2.713711944582438	0.0	discard	23_3_in_circle	Parallel run loop
auto	3.115803431953349	0.0	discard	23_4_in_CIRCLE	Parallel run loop
auto	4.52607678217151	0.0	discard	17_3_in_3	Parallel run loop
auto	3.8688750047412386	0.0	discard	23_4_in_DOMINO	Parallel run loop
auto	4.889790434054783	0.0	keep	20_3_in_3	Parallel run loop
auto	3.1791440267938826	0.0	discard	31_3_in_circle	Parallel run loop
auto	2.9479967602447665	0.0	discard	20_4_in_CIRCLE	Parallel run loop
auto	2.8016697604273646	0.0	discard	18_4_in_CIRCLE	Parallel run loop
auto	2.5796583447972865	0.0	discard	21_3_in_DOMINO	Parallel run loop
auto	2.8776782496867814	0.0	discard	19_4_in_CIRCLE	Parallel run loop
auto	1.2748051192828511	0.0	discard	8_3_in_circle	Parallel run loop
auto	1.4830513649835477	0.0	discard	11_3_in_circle	Parallel run loop
auto	2.1798766076797254	0.0	keep	18_3_in_DOMINO	Parallel run loop
auto	2.4171978622436106	0.0	discard	19_3_in_circle	Parallel run loop
auto	3.112795573913613	0.0	discard	30_3_in_circle	Parallel run loop
auto	2.6063272731152285	0.0	keep	22_3_in_circle	Parallel run loop
auto	1.4007623159126743	0.0	discard	10_3_in_circle	Parallel run loop
auto	3.05071823289682	0.0	discard	29_3_in_circle	Parallel run loop
auto	1.5230514075566917	0.0	discard	12_3_in_circle	Parallel run loop
auto	2.941896927464176	0.0	discard	27_3_in_circle	Parallel run loop
auto	1.9896710920705543	0.0	keep	15_3_in_DOMINO	Parallel run loop
auto	1.8204190752494187	0.0	discard	18_3_in_circle	Parallel run loop
auto	2.874818647722945	0.0	discard	11_4_in_DOMINO	Parallel run loop
auto	1.7011773066844613	0.0	discard	10_3_in_DOMINO	Parallel run loop
auto	3.746847963455798	0.0	discard	11_3_in_3	Parallel run loop
auto	3.0104540932523642	0.0	discard	13_4_in_DOMINO	Parallel run loop
auto	6.9673699289329925	0.0	discard	43_3_in_3	Parallel run loop
auto	2.6187340268084585	0.0	keep	22_3_in_DOMINO	Parallel run loop
auto	2.643847752583437	0.0	discard	16_4_in_CIRCLE	Parallel run loop
auto	3.775354954031959	0.0	keep	22_4_in_DOMINO	Parallel run loop
auto	2.553235144544326	0.0	keep	21_3_in_circle	Parallel run loop
auto	2.459744717990842	0.0	keep	20_3_in_circle	Parallel run loop
auto	2.866412503795237	0.0	keep	26_3_in_circle	Parallel run loop
auto	7.675106763760255	0.0	discard	50_3_in_3	Parallel run loop
auto	1.6549223038095542	0.0	discard	15_3_in_circle	Parallel run loop
auto	2.782697908838877	0.0	keep	25_3_in_circle	Parallel run loop
auto	1.7029189896133312	0.0	discard	16_3_in_circle	Parallel run loop
auto	2.986367587238712	0.0	keep	28_3_in_circle	Parallel run loop
auto	4.884265773219949	0.0	keep	20_3_in_3	Parallel run loop
auto	4.020316954443297	0.0	discard	13_3_in_3	Parallel run loop
auto	2.6915493891581197	0.0	discard	23_3_in_circle	Parallel run loop
auto	3.9241229167278884	0.0	discard	24_4_in_DOMINO	Parallel run loop
auto	3.1064519114939206	0.0	discard	21_4_in_CIRCLE	Parallel run loop
auto	2.363651906519185	0.0	keep	19_3_in_circle	Parallel run loop
auto	2.4901149670854683	0.0	discard	19_3_in_DOMINO	Parallel run loop
auto	2.1782706054647423	0.0	keep	18_3_in_DOMINO	Parallel run loop
auto	3.0935549867671677	0.0	discard	30_3_in_circle	Parallel run loop
auto	2.593847731640479	0.0	keep	22_3_in_circle	Parallel run loop
auto	3.162970860217274	0.0	discard	31_3_in_circle	Parallel run loop
auto	3.0565203979636526	0.0	discard	29_3_in_circle	Parallel run loop
auto	2.9342575489732474	0.0	keep	27_3_in_circle	Parallel run loop
auto	2.9479967602447665	0.0	discard	20_4_in_CIRCLE	Parallel run loop
auto	1.2748051192828511	0.0	discard	8_3_in_circle	Parallel run loop
auto	1.9882478075142807	0.0	keep	15_3_in_DOMINO	Parallel run loop
auto	1.8204190752494187	0.0	discard	18_3_in_circle	Parallel run loop
auto	1.4830513649835477	0.0	discard	11_3_in_circle	Parallel run loop
auto	2.646516594600204	0.0	discard	22_3_in_DOMINO	Parallel run loop
auto	2.8016697604273646	0.0	discard	18_4_in_CIRCLE	Parallel run loop
auto	3.115803431953349	0.0	discard	23_4_in_CIRCLE	Parallel run loop
auto	1.4007623159126743	0.0	discard	10_3_in_circle	Parallel run loop
auto	2.56786054366147	0.0	discard	21_3_in_circle	Parallel run loop
auto	2.422244753987762	0.0	keep	20_3_in_circle	Parallel run loop
auto	2.89509308275729	0.0	discard	26_3_in_circle	Parallel run loop
