commit	score	memory_gb	status	problem	description
auto	1.6593731136943732	0.0	discard	8_3_in_5	Parallel run loop
auto	1.6593731136943732	0.0	discard	8_3_in_5	Parallel run loop
auto	1.6593731136943732	0.0	discard	8_3_in_5	Parallel run loop
auto	4.044636069278394	0.0	discard	12_CIRCLE_in_CIRCLE	Parallel run loop
auto	4.538260254000323	0.0	discard	15_CIRCLE_in_CIRCLE	Parallel run loop
auto	4.345096413036063	0.0	discard	14_CIRCLE_in_CIRCLE	Parallel run loop
auto	4.809960188594904	0.0	discard	17_CIRCLE_in_CIRCLE	Parallel run loop
auto	1.6632647724434986	0.0	discard	8_3_in_5	Parallel run loop
auto	4.63348722009616	0.0	discard	16_CIRCLE_in_CIRCLE	Parallel run loop
auto	5.143321280120154	0.0	discard	20_CIRCLE_in_CIRCLE	Parallel run loop
auto	4.883494798545663	0.0	discard	18_CIRCLE_in_CIRCLE	Parallel run loop
auto	1.6632647724434986	0.0	discard	8_3_in_5	Parallel run loop
auto	1.6632647724434986	0.0	discard	8_3_in_5	Parallel run loop
auto	1.6632647724434986	0.0	discard	8_3_in_5	Parallel run loop
auto	1.6632647724434986	0.0	discard	8_3_in_5	Parallel run loop
auto	1.6632647724434986	0.0	discard	8_3_in_5	Parallel run loop
auto	1.6632647724434986	0.0	discard	8_3_in_5	Parallel run loop
auto	1.6632647724434986	0.0	discard	8_3_in_5	Parallel run loop
auto	1.6632647724434986	0.0	discard	8_3_in_5	Parallel run loop
auto	1.6632647724434986	0.0	discard	8_3_in_5	Parallel run loop
auto	1.6632647724434986	0.0	discard	8_3_in_5	Parallel run loop
auto	4.044636069278394	0.0	discard	12_CIRCLE_in_CIRCLE	Parallel run loop
auto	4.538260254000323	0.0	discard	15_CIRCLE_in_CIRCLE	Parallel run loop
auto	4.809960188594904	0.0	discard	17_CIRCLE_in_CIRCLE	Parallel run loop
auto	4.345096413036063	0.0	discard	14_CIRCLE_in_CIRCLE	Parallel run loop
auto	4.883494798545663	0.0	discard	18_CIRCLE_in_CIRCLE	Parallel run loop
auto	4.63348722009616	0.0	discard	16_CIRCLE_in_CIRCLE	Parallel run loop
auto	5.143321280120154	0.0	discard	20_CIRCLE_in_CIRCLE	Parallel run loop
auto	1.6632647724434986	0.0	discard	8_3_in_5	Parallel run loop
auto	1.6632647724434986	0.0	discard	8_3_in_5	Parallel run loop
auto	1.6632647724434986	0.0	discard	8_3_in_5	Parallel run loop
auto	1.6632647724434986	0.0	discard	8_3_in_5	Parallel run loop
auto	1.6632647724434986	0.0	discard	8_3_in_5	Parallel run loop
auto	1.6632647724434986	0.0	discard	8_3_in_5	Parallel run loop
auto	1.6632647724434986	0.0	discard	8_3_in_5	Parallel run loop
auto	1.6632647724434986	0.0	discard	8_3_in_5	Parallel run loop
auto	1.6632647724434986	0.0	discard	8_3_in_5	Parallel run loop
auto	1.6632647724434986	0.0	discard	8_3_in_5	Parallel run loop
auto	1.6632647724434986	0.0	discard	8_3_in_5	Parallel run loop
auto	4.044636069278394	0.0	discard	12_CIRCLE_in_CIRCLE	Parallel run loop
auto	4.538260254000323	0.0	discard	15_CIRCLE_in_CIRCLE	Parallel run loop
auto	4.809960188594904	0.0	discard	17_CIRCLE_in_CIRCLE	Parallel run loop
auto	4.345096413036063	0.0	discard	14_CIRCLE_in_CIRCLE	Parallel run loop
auto	4.883494798545663	0.0	discard	18_CIRCLE_in_CIRCLE	Parallel run loop
auto	4.63348722009616	0.0	discard	16_CIRCLE_in_CIRCLE	Parallel run loop
auto	5.143321280120154	0.0	discard	20_CIRCLE_in_CIRCLE	Parallel run loop
auto	1.6632647724434986	0.0	discard	8_3_in_5	Parallel run loop
auto	1.6632647724434986	0.0	discard	8_3_in_5	Parallel run loop
auto	1.6632647724434986	0.0	discard	8_3_in_5	Parallel run loop
auto	1.6632647724434986	0.0	discard	8_3_in_5	Parallel run loop
auto	1.6632647724434986	0.0	discard	8_3_in_5	Parallel run loop
auto	1.6632647724434986	0.0	discard	8_3_in_5	Parallel run loop
auto	1.6632647724434986	0.0	discard	8_3_in_5	Parallel run loop
auto	1.6632647724434986	0.0	discard	8_3_in_5	Parallel run loop
auto	1.6632647724434986	0.0	discard	8_3_in_5	Parallel run loop
auto	1.6632647724434986	0.0	discard	8_3_in_5	Parallel run loop
auto	1.6632647724434986	0.0	discard	8_3_in_5	Parallel run loop
auto	4.044636069278394	0.0	discard	12_CIRCLE_in_CIRCLE	Parallel run loop
auto	4.538260254000323	0.0	discard	15_CIRCLE_in_CIRCLE	Parallel run loop
auto	4.809960188594904	0.0	discard	17_CIRCLE_in_CIRCLE	Parallel run loop
auto	4.345096413036063	0.0	discard	14_CIRCLE_in_CIRCLE	Parallel run loop
auto	4.883494798545663	0.0	discard	18_CIRCLE_in_CIRCLE	Parallel run loop
auto	4.63348722009616	0.0	discard	16_CIRCLE_in_CIRCLE	Parallel run loop
auto	5.143321280120154	0.0	discard	20_CIRCLE_in_CIRCLE	Parallel run loop
auto	1.6632647724434986	0.0	discard	8_3_in_5	Parallel run loop
auto	1.6632647724434986	0.0	discard	8_3_in_5	Parallel run loop
auto	1.6632647724434986	0.0	discard	8_3_in_5	Parallel run loop
auto	1.6632647724434986	0.0	discard	8_3_in_5	Parallel run loop
auto	1.6632647724434986	0.0	discard	8_3_in_5	Parallel run loop
auto	1.6632647724434986	0.0	discard	8_3_in_5	Parallel run loop
auto	1.6632647724434986	0.0	discard	8_3_in_5	Parallel run loop
auto	1.6632647724434986	0.0	discard	8_3_in_5	Parallel run loop
auto	1.6632647724434986	0.0	discard	8_3_in_5	Parallel run loop
auto	1.6632647724434986	0.0	discard	8_3_in_5	Parallel run loop
auto	1.6632647724434986	0.0	discard	8_3_in_5	Parallel run loop
auto	4.044636069278394	0.0	discard	12_CIRCLE_in_CIRCLE	Parallel run loop
auto	4.538260254000323	0.0	discard	15_CIRCLE_in_CIRCLE	Parallel run loop
auto	4.809960188594904	0.0	discard	17_CIRCLE_in_CIRCLE	Parallel run loop
auto	4.345096413036063	0.0	discard	14_CIRCLE_in_CIRCLE	Parallel run loop
auto	4.883494798545663	0.0	discard	18_CIRCLE_in_CIRCLE	Parallel run loop
auto	4.63348722009616	0.0	discard	16_CIRCLE_in_CIRCLE	Parallel run loop
auto	5.143321280120154	0.0	discard	20_CIRCLE_in_CIRCLE	Parallel run loop
auto	1.6632647724434986	0.0	discard	8_3_in_5	Parallel run loop
auto	1.6632647724434986	0.0	discard	8_3_in_5	Parallel run loop
auto	1.6632647724434986	0.0	discard	8_3_in_5	Parallel run loop
auto	1.6632647724434986	0.0	discard	8_3_in_5	Parallel run loop
auto	1.6632647724434986	0.0	discard	8_3_in_5	Parallel run loop
auto	1.6632647724434986	0.0	discard	8_3_in_5	Parallel run loop
auto	1.6632647724434986	0.0	discard	8_3_in_5	Parallel run loop
auto	1.6632647724434986	0.0	discard	8_3_in_5	Parallel run loop
auto	1.6632647724434986	0.0	discard	8_3_in_5	Parallel run loop
auto	1.6632647724434986	0.0	discard	8_3_in_5	Parallel run loop
auto	1.6632647724434986	0.0	discard	8_3_in_5	Parallel run loop
auto	4.044636069278394	0.0	discard	12_CIRCLE_in_CIRCLE	Parallel run loop
auto	4.538260254000323	0.0	discard	15_CIRCLE_in_CIRCLE	Parallel run loop
auto	4.809960188594904	0.0	discard	17_CIRCLE_in_CIRCLE	Parallel run loop
auto	4.345096413036063	0.0	discard	14_CIRCLE_in_CIRCLE	Parallel run loop
auto	4.883494798545663	0.0	discard	18_CIRCLE_in_CIRCLE	Parallel run loop
auto	4.63348722009616	0.0	discard	16_CIRCLE_in_CIRCLE	Parallel run loop
auto	5.143321280120154	0.0	discard	20_CIRCLE_in_CIRCLE	Parallel run loop
auto	1.6632647724434986	0.0	discard	8_3_in_5	Parallel run loop
auto	1.6632647724434986	0.0	discard	8_3_in_5	Parallel run loop
auto	1.6632647724434986	0.0	discard	8_3_in_5	Parallel run loop
auto	1.6632647724434986	0.0	discard	8_3_in_5	Parallel run loop
auto	1.6632647724434986	0.0	discard	8_3_in_5	Parallel run loop
auto	1.6632647724434986	0.0	discard	8_3_in_5	Parallel run loop
auto	1.6632647724434986	0.0	discard	8_3_in_5	Parallel run loop
auto	1.6632647724434986	0.0	discard	8_3_in_5	Parallel run loop
auto	1.6632647724434986	0.0	discard	8_3_in_5	Parallel run loop
auto	1.6632647724434986	0.0	discard	8_3_in_5	Parallel run loop
auto	1.6632647724434986	0.0	discard	8_3_in_5	Parallel run loop
auto	4.044636069278394	0.0	discard	12_CIRCLE_in_CIRCLE	Parallel run loop
auto	4.538260254000323	0.0	discard	15_CIRCLE_in_CIRCLE	Parallel run loop
auto	4.809960188594904	0.0	discard	17_CIRCLE_in_CIRCLE	Parallel run loop
auto	4.345096413036063	0.0	discard	14_CIRCLE_in_CIRCLE	Parallel run loop
auto	4.883494798545663	0.0	discard	18_CIRCLE_in_CIRCLE	Parallel run loop
auto	4.63348722009616	0.0	discard	16_CIRCLE_in_CIRCLE	Parallel run loop
auto	5.143321280120154	0.0	discard	20_CIRCLE_in_CIRCLE	Parallel run loop
auto	1.6632647724434986	0.0	discard	8_3_in_5	Parallel run loop
auto	1.6632647724434986	0.0	discard	8_3_in_5	Parallel run loop
auto	1.6632647724434986	0.0	discard	8_3_in_5	Parallel run loop
auto	1.6632647724434986	0.0	discard	8_3_in_5	Parallel run loop
auto	1.6632647724434986	0.0	discard	8_3_in_5	Parallel run loop
auto	1.6632647724434986	0.0	discard	8_3_in_5	Parallel run loop
auto	1.6632647724434986	0.0	discard	8_3_in_5	Parallel run loop
auto	1.6632647724434986	0.0	discard	8_3_in_5	Parallel run loop
auto	1.6632647724434986	0.0	discard	8_3_in_5	Parallel run loop
auto	1.6632647724434986	0.0	discard	8_3_in_5	Parallel run loop
auto	1.6632647724434986	0.0	discard	8_3_in_5	Parallel run loop
auto	4.044636069278394	0.0	discard	12_CIRCLE_in_CIRCLE	Parallel run loop
auto	4.538260254000323	0.0	discard	15_CIRCLE_in_CIRCLE	Parallel run loop
auto	4.345096413036063	0.0	discard	14_CIRCLE_in_CIRCLE	Parallel run loop
auto	4.809960188594904	0.0	discard	17_CIRCLE_in_CIRCLE	Parallel run loop
auto	4.63348722009616	0.0	discard	16_CIRCLE_in_CIRCLE	Parallel run loop
auto	4.883494798545663	0.0	discard	18_CIRCLE_in_CIRCLE	Parallel run loop
auto	5.143321280120154	0.0	discard	20_CIRCLE_in_CIRCLE	Parallel run loop
auto	1.6632647724434986	0.0	discard	8_3_in_5	Parallel run loop
auto	1.6632647724434986	0.0	discard	8_3_in_5	Parallel run loop
auto	1.6632647724434986	0.0	discard	8_3_in_5	Parallel run loop
auto	1.6632647724434986	0.0	discard	8_3_in_5	Parallel run loop
auto	1.6632647724434986	0.0	discard	8_3_in_5	Parallel run loop
auto	1.6632647724434986	0.0	discard	8_3_in_5	Parallel run loop
auto	1.6632647724434986	0.0	discard	8_3_in_5	Parallel run loop
auto	1.6632647724434986	0.0	discard	8_3_in_5	Parallel run loop
auto	1.6632647724434986	0.0	discard	8_3_in_5	Parallel run loop
auto	1.6632647724434986	0.0	discard	8_3_in_5	Parallel run loop
auto	1.6632647724434986	0.0	discard	8_3_in_5	Parallel run loop
auto	4.044636069278394	0.0	discard	12_CIRCLE_in_CIRCLE	Parallel run loop
auto	4.538260254000323	0.0	discard	15_CIRCLE_in_CIRCLE	Parallel run loop
auto	4.809960188594904	0.0	discard	17_CIRCLE_in_CIRCLE	Parallel run loop
auto	4.345096413036063	0.0	discard	14_CIRCLE_in_CIRCLE	Parallel run loop
auto	4.883494798545663	0.0	discard	18_CIRCLE_in_CIRCLE	Parallel run loop
auto	4.63348722009616	0.0	discard	16_CIRCLE_in_CIRCLE	Parallel run loop
auto	5.143321280120154	0.0	discard	20_CIRCLE_in_CIRCLE	Parallel run loop
auto	1.6632647724434986	0.0	discard	8_3_in_5	Parallel run loop
auto	1.6632647724434986	0.0	discard	8_3_in_5	Parallel run loop
auto	1.6632647724434986	0.0	discard	8_3_in_5	Parallel run loop
auto	1.6632647724434986	0.0	discard	8_3_in_5	Parallel run loop
auto	1.6632647724434986	0.0	discard	8_3_in_5	Parallel run loop
auto	1.6632647724434986	0.0	discard	8_3_in_5	Parallel run loop
auto	1.6632647724434986	0.0	discard	8_3_in_5	Parallel run loop
auto	1.6632647724434986	0.0	discard	8_3_in_5	Parallel run loop
auto	1.6632647724434986	0.0	discard	8_3_in_5	Parallel run loop
auto	1.6632647724434986	0.0	discard	8_3_in_5	Parallel run loop
auto	1.6632647724434986	0.0	discard	8_3_in_5	Parallel run loop
auto	4.044636069278394	0.0	discard	12_CIRCLE_in_CIRCLE	Parallel run loop
auto	4.538260254000323	0.0	discard	15_CIRCLE_in_CIRCLE	Parallel run loop
auto	4.809960188594904	0.0	discard	17_CIRCLE_in_CIRCLE	Parallel run loop
auto	4.345096413036063	0.0	discard	14_CIRCLE_in_CIRCLE	Parallel run loop
auto	4.883494798545663	0.0	discard	18_CIRCLE_in_CIRCLE	Parallel run loop
auto	4.63348722009616	0.0	discard	16_CIRCLE_in_CIRCLE	Parallel run loop
auto	5.143321280120154	0.0	discard	20_CIRCLE_in_CIRCLE	Parallel run loop
auto	1.6632647724434986	0.0	discard	8_3_in_5	Parallel run loop
auto	1.6632647724434986	0.0	discard	8_3_in_5	Parallel run loop
auto	1.6632647724434986	0.0	discard	8_3_in_5	Parallel run loop
auto	1.6632647724434986	0.0	discard	8_3_in_5	Parallel run loop
auto	1.6632647724434986	0.0	discard	8_3_in_5	Parallel run loop
auto	1.6632647724434986	0.0	discard	8_3_in_5	Parallel run loop
auto	1.6632647724434986	0.0	discard	8_3_in_5	Parallel run loop
auto	1.6632647724434986	0.0	discard	8_3_in_5	Parallel run loop
auto	1.6632647724434986	0.0	discard	8_3_in_5	Parallel run loop
auto	1.6632647724434986	0.0	discard	8_3_in_5	Parallel run loop
auto	1.6632647724434986	0.0	discard	8_3_in_5	Parallel run loop
auto	4.044636069278394	0.0	discard	12_CIRCLE_in_CIRCLE	Parallel run loop
auto	4.538260254000323	0.0	discard	15_CIRCLE_in_CIRCLE	Parallel run loop
auto	4.809960188594904	0.0	discard	17_CIRCLE_in_CIRCLE	Parallel run loop
auto	4.345096413036063	0.0	discard	14_CIRCLE_in_CIRCLE	Parallel run loop
auto	4.883494798545663	0.0	discard	18_CIRCLE_in_CIRCLE	Parallel run loop
auto	4.63348722009616	0.0	discard	16_CIRCLE_in_CIRCLE	Parallel run loop
auto	5.143321280120154	0.0	discard	20_CIRCLE_in_CIRCLE	Parallel run loop
auto	1.6632647724434986	0.0	discard	8_3_in_5	Parallel run loop
auto	1.6632647724434986	0.0	discard	8_3_in_5	Parallel run loop
auto	1.6632647724434986	0.0	discard	8_3_in_5	Parallel run loop
auto	1.6632647724434986	0.0	discard	8_3_in_5	Parallel run loop
auto	1.6632647724434986	0.0	discard	8_3_in_5	Parallel run loop
auto	1.6632647724434986	0.0	discard	8_3_in_5	Parallel run loop
auto	1.6632647724434986	0.0	discard	8_3_in_5	Parallel run loop
auto	1.6632647724434986	0.0	discard	8_3_in_5	Parallel run loop
auto	1.6632647724434986	0.0	discard	8_3_in_5	Parallel run loop
auto	1.6632647724434986	0.0	discard	8_3_in_5	Parallel run loop
auto	1.6632647724434986	0.0	discard	8_3_in_5	Parallel run loop
auto	4.044636069278394	0.0	discard	12_CIRCLE_in_CIRCLE	Parallel run loop
auto	4.538260254000323	0.0	discard	15_CIRCLE_in_CIRCLE	Parallel run loop
auto	4.809960188594904	0.0	discard	17_CIRCLE_in_CIRCLE	Parallel run loop
auto	4.345096413036063	0.0	discard	14_CIRCLE_in_CIRCLE	Parallel run loop
auto	4.883494798545663	0.0	discard	18_CIRCLE_in_CIRCLE	Parallel run loop
auto	4.63348722009616	0.0	discard	16_CIRCLE_in_CIRCLE	Parallel run loop
auto	5.143321280120154	0.0	discard	20_CIRCLE_in_CIRCLE	Parallel run loop
auto	1.6632647724434986	0.0	discard	8_3_in_5	Parallel run loop
auto	1.6632647724434986	0.0	discard	8_3_in_5	Parallel run loop
auto	1.6632647724434986	0.0	discard	8_3_in_5	Parallel run loop
auto	1.6632647724434986	0.0	discard	8_3_in_5	Parallel run loop
auto	1.6632647724434986	0.0	discard	8_3_in_5	Parallel run loop
auto	1.6632647724434986	0.0	discard	8_3_in_5	Parallel run loop
auto	1.6632647724434986	0.0	discard	8_3_in_5	Parallel run loop
auto	1.6632647724434986	0.0	discard	8_3_in_5	Parallel run loop
auto	1.6632647724434986	0.0	discard	8_3_in_5	Parallel run loop
auto	1.6632647724434986	0.0	discard	8_3_in_5	Parallel run loop
auto	1.6632647724434986	0.0	discard	8_3_in_5	Parallel run loop
auto	4.044636069278394	0.0	discard	12_CIRCLE_in_CIRCLE	Parallel run loop
auto	4.538260254000323	0.0	discard	15_CIRCLE_in_CIRCLE	Parallel run loop
auto	4.809960188594904	0.0	discard	17_CIRCLE_in_CIRCLE	Parallel run loop
auto	4.345096413036063	0.0	discard	14_CIRCLE_in_CIRCLE	Parallel run loop
auto	4.883494798545663	0.0	discard	18_CIRCLE_in_CIRCLE	Parallel run loop
auto	4.63348722009616	0.0	discard	16_CIRCLE_in_CIRCLE	Parallel run loop
auto	5.143321280120154	0.0	discard	20_CIRCLE_in_CIRCLE	Parallel run loop
auto	1.6632647724434986	0.0	discard	8_3_in_5	Parallel run loop
auto	1.6632647724434986	0.0	discard	8_3_in_5	Parallel run loop
auto	1.6632647724434986	0.0	discard	8_3_in_5	Parallel run loop
auto	1.6632647724434986	0.0	discard	8_3_in_5	Parallel run loop
auto	1.6632647724434986	0.0	discard	8_3_in_5	Parallel run loop
auto	1.6632647724434986	0.0	discard	8_3_in_5	Parallel run loop
auto	1.6632647724434986	0.0	discard	8_3_in_5	Parallel run loop
auto	1.6632647724434986	0.0	discard	8_3_in_5	Parallel run loop
auto	1.6632647724434986	0.0	discard	8_3_in_5	Parallel run loop
auto	1.6632647724434986	0.0	discard	8_3_in_5	Parallel run loop
auto	1.6632647724434986	0.0	discard	8_3_in_5	Parallel run loop
auto	4.044636069278394	0.0	discard	12_CIRCLE_in_CIRCLE	Parallel run loop
auto	4.538260254000323	0.0	discard	15_CIRCLE_in_CIRCLE	Parallel run loop
auto	4.809960188594904	0.0	discard	17_CIRCLE_in_CIRCLE	Parallel run loop
auto	4.345096413036063	0.0	discard	14_CIRCLE_in_CIRCLE	Parallel run loop
auto	4.883494798545663	0.0	discard	18_CIRCLE_in_CIRCLE	Parallel run loop
auto	4.63348722009616	0.0	discard	16_CIRCLE_in_CIRCLE	Parallel run loop
auto	5.143321280120154	0.0	discard	20_CIRCLE_in_CIRCLE	Parallel run loop
auto	1.6632647724434986	0.0	discard	8_3_in_5	Parallel run loop
auto	1.6632647724434986	0.0	discard	8_3_in_5	Parallel run loop
auto	1.6632647724434986	0.0	discard	8_3_in_5	Parallel run loop
auto	1.6632647724434986	0.0	discard	8_3_in_5	Parallel run loop
auto	1.6632647724434986	0.0	discard	8_3_in_5	Parallel run loop
auto	1.6632647724434986	0.0	discard	8_3_in_5	Parallel run loop
auto	1.6632647724434986	0.0	discard	8_3_in_5	Parallel run loop
auto	1.6632647724434986	0.0	discard	8_3_in_5	Parallel run loop
auto	1.6632647724434986	0.0	discard	8_3_in_5	Parallel run loop
auto	1.6632647724434986	0.0	discard	8_3_in_5	Parallel run loop
auto	1.6632647724434986	0.0	discard	8_3_in_5	Parallel run loop
auto	4.044636069278394	0.0	discard	12_CIRCLE_in_CIRCLE	Parallel run loop
auto	4.538260254000323	0.0	discard	15_CIRCLE_in_CIRCLE	Parallel run loop
auto	4.809960188594904	0.0	discard	17_CIRCLE_in_CIRCLE	Parallel run loop
auto	4.345096413036063	0.0	discard	14_CIRCLE_in_CIRCLE	Parallel run loop
auto	4.883494798545663	0.0	discard	18_CIRCLE_in_CIRCLE	Parallel run loop
auto	4.63348722009616	0.0	discard	16_CIRCLE_in_CIRCLE	Parallel run loop
auto	5.143321280120154	0.0	discard	20_CIRCLE_in_CIRCLE	Parallel run loop
auto	1.6632647724434986	0.0	discard	8_3_in_5	Parallel run loop
auto	1.6632647724434986	0.0	discard	8_3_in_5	Parallel run loop
auto	1.6632647724434986	0.0	discard	8_3_in_5	Parallel run loop
auto	1.6632647724434986	0.0	discard	8_3_in_5	Parallel run loop
auto	1.6632647724434986	0.0	discard	8_3_in_5	Parallel run loop
auto	1.6632647724434986	0.0	discard	8_3_in_5	Parallel run loop
auto	1.6632647724434986	0.0	discard	8_3_in_5	Parallel run loop
auto	1.6632647724434986	0.0	discard	8_3_in_5	Parallel run loop
auto	1.6632647724434986	0.0	discard	8_3_in_5	Parallel run loop
auto	1.6632647724434986	0.0	discard	8_3_in_5	Parallel run loop
auto	1.6632647724434986	0.0	discard	8_3_in_5	Parallel run loop
auto	4.044636069278394	0.0	discard	12_CIRCLE_in_CIRCLE	Parallel run loop
auto	4.538260254000323	0.0	discard	15_CIRCLE_in_CIRCLE	Parallel run loop
auto	4.809960188594904	0.0	discard	17_CIRCLE_in_CIRCLE	Parallel run loop
auto	4.345096413036063	0.0	discard	14_CIRCLE_in_CIRCLE	Parallel run loop
auto	4.883494798545663	0.0	discard	18_CIRCLE_in_CIRCLE	Parallel run loop
auto	4.63348722009616	0.0	discard	16_CIRCLE_in_CIRCLE	Parallel run loop
auto	5.143321280120154	0.0	discard	20_CIRCLE_in_CIRCLE	Parallel run loop
auto	1.6632647724434986	0.0	discard	8_3_in_5	Parallel run loop
auto	1.6632647724434986	0.0	discard	8_3_in_5	Parallel run loop
auto	1.6632647724434986	0.0	discard	8_3_in_5	Parallel run loop
auto	1.6632647724434986	0.0	discard	8_3_in_5	Parallel run loop
auto	1.6632647724434986	0.0	discard	8_3_in_5	Parallel run loop
auto	1.6632647724434986	0.0	discard	8_3_in_5	Parallel run loop
auto	1.6632647724434986	0.0	discard	8_3_in_5	Parallel run loop
auto	1.6632647724434986	0.0	discard	8_3_in_5	Parallel run loop
auto	1.6632647724434986	0.0	discard	8_3_in_5	Parallel run loop
auto	1.6632647724434986	0.0	discard	8_3_in_5	Parallel run loop
auto	1.6632647724434986	0.0	discard	8_3_in_5	Parallel run loop
auto	2.694665449000631	0.0	keep	24_3_in_5	Auto run attempts=5000
auto	2.674689822064729	0.0	keep	24_3_in_5	Auto run attempts=50000
auto	2.708323128391939	0.0	discard	24_3_in_5	Auto run attempts=500000
auto	0.0	0.0	crash	5_DOMINO_in_CIRCLE	Parallel run loop
auto	0.0	0.0	crash	6_DOMINO_in_DOMINO	Parallel run loop
auto	2.1803977449531997	0.0	keep	5_DOMINO_in_CIRCLE	Auto run attempts=500
auto	1.9794956013202119	0.0	keep	4_DOMINO_in_CIRCLE	Auto run attempts=5000
auto	2.9613484137103105	0.0	keep	10_DOMINO_in_CIRCLE	Parallel run loop
auto	3.129593114964544	0.0	keep	11_DOMINO_in_CIRCLE	Parallel run loop
auto	2.683101976654936	0.0	keep	8_DOMINO_in_CIRCLE	Parallel run loop
auto	2.795516246865456	0.0	keep	9_DOMINO_in_CIRCLE	Parallel run loop
auto	3.8120310049873556	0.0	keep	11_DOMINO_in_DOMINO	Parallel run loop
auto	3.2599392308742945	0.0	keep	12_DOMINO_in_CIRCLE	Parallel run loop
auto	2.51462067223684	0.0	keep	7_DOMINO_in_CIRCLE	Parallel run loop
auto	3.4277025566543116	0.0	keep	13_DOMINO_in_CIRCLE	Parallel run loop
auto	4.000050536106652	0.0	keep	12_DOMINO_in_DOMINO	Parallel run loop
auto	4.317761489322863	0.0	keep	19_DOMINO_in_CIRCLE	Parallel run loop
auto	3.8989651067273714	0.0	keep	16_DOMINO_in_CIRCLE	Parallel run loop
auto	3.5871020005034144	0.0	keep	14_DOMINO_in_CIRCLE	Parallel run loop
auto	3.7559514868442787	0.0	keep	15_DOMINO_in_CIRCLE	Parallel run loop
auto	4.029021717899894	0.0	keep	17_DOMINO_in_CIRCLE	Parallel run loop
auto	4.904922293069894	0.0	keep	19_DOMINO_in_DOMINO	Parallel run loop
auto	5.00019924135547	0.0	keep	20_DOMINO_in_DOMINO	Parallel run loop
auto	4.176623619213401	0.0	keep	18_DOMINO_in_CIRCLE	Parallel run loop
auto	4.450800538982013	0.0	keep	20_DOMINO_in_CIRCLE	Parallel run loop
auto	2.9174892150649567	0.0	keep	6_DOMINO_in_DOMINO	Parallel run loop
auto	2.6915521371235593	0.0	discard	8_DOMINO_in_CIRCLE	Parallel run loop
auto	2.9540367047381437	0.0	keep	10_DOMINO_in_CIRCLE	Parallel run loop
auto	3.1860393694450497	0.0	discard	11_DOMINO_in_CIRCLE	Parallel run loop
auto	3.2168355077568664	0.0	keep	12_DOMINO_in_CIRCLE	Parallel run loop
auto	3.827281560659983	0.0	discard	11_DOMINO_in_DOMINO	Parallel run loop
auto	2.803879883664299	0.0	discard	9_DOMINO_in_CIRCLE	Parallel run loop
auto	3.3310477972440418	0.0	keep	13_DOMINO_in_CIRCLE	Parallel run loop
auto	4.1467392743280715	0.0	keep	19_DOMINO_in_CIRCLE	Parallel run loop
auto	3.427668362544437	0.0	keep	14_DOMINO_in_CIRCLE	Parallel run loop
auto	3.9304257386451296	0.0	keep	12_DOMINO_in_DOMINO	Parallel run loop
