commit	score	memory_gb	status	problem	description
auto	11.601428732325022	0.0	discard	19_6_in_TAN	Parallel run loop
auto	1.3230763515031798	0.0	keep	8_tan_in_cir	Parallel run loop
auto	0.9896175122548959	0.0	keep	7_TAN_in_8	Parallel run loop
auto	8.920621241935889	0.0	discard	17_5_in_TAN	Parallel run loop
auto	9.424438859419284	0.0	discard	19_5_in_TAN	Parallel run loop
auto	1.5105495647610865	0.0	discard	6_TAN_in_5	Parallel run loop
auto	1.390167778937827	0.0	discard	9_tan_in_cir	Parallel run loop
auto	11.843471290376822	0.0	keep	20_6_in_TAN	Parallel run loop
auto	9.655712941895908	0.0	discard	20_5_in_TAN	Parallel run loop
auto	1.7376607751745106	0.0	discard	8_TAN_in_5	Parallel run loop
auto	1.447046343723036	0.0	discard	10_tan_in_cir	Parallel run loop
auto	8.966214411204323	0.0	keep	16_DOMINO_in_TAN	Parallel run loop
auto	1.2561125654339858	0.0	discard	6_TAN_in_6	Parallel run loop
auto	1.0949358415689194	0.0	keep	9_TAN_in_8	Parallel run loop
auto	6.376015494322555	0.0	discard	16_4_in_tan	Parallel run loop
auto	8.005170339036384	0.0	keep	13_DOMINO_in_TAN	Parallel run loop
auto	1.8139454457591047	0.0	discard	9_TAN_in_5	Parallel run loop
auto	1.504962924277851	0.0	keep	11_tan_in_cir	Parallel run loop
auto	1.3203673212301983	0.0	discard	7_TAN_in_6	Parallel run loop
auto	7.397191275245892	0.0	keep	22_4_in_tan	Parallel run loop
auto	7.795676713641822	0.0	discard	24_4_in_tan	Parallel run loop
auto	1.3859249957020598	0.0	discard	8_TAN_in_6	Parallel run loop
auto	9.863712339156736	0.0	discard	20_DOMINO_in_TAN	Parallel run loop
auto	4.4742123979253705	0.0	discard	19_3_in_tan	Parallel run loop
auto	4.209923157769256	0.0	discard	17_3_in_tan	Parallel run loop
auto	0.8231141511692444	0.0	discard	4_TAN_in_8	Parallel run loop
auto	1.8960328379604285	0.0	keep	10_TAN_in_5	Parallel run loop
auto	1.2643873834277326	0.0	keep	7_tan_in_cir	Parallel run loop
auto	11.303290353085066	0.0	discard	18_6_in_TAN	Parallel run loop
auto	1.6362682929797132	0.0	discard	7_TAN_in_5	Parallel run loop
auto	1.626611168274944	0.0	discard	11_TAN_in_6	Parallel run loop
auto	1.813770557669719	0.0	discard	16_tan_in_cir	Parallel run loop
auto	1.5729113440868143	0.0	keep	12_tan_in_cir	Parallel run loop
auto	4.575460934555159	0.0	keep	20_3_in_tan	Parallel run loop
auto	3.3706023521542736	0.0	keep	8_TAN_in_3	Parallel run loop
auto	1.2091936063247888	0.0	discard	6_tan_in_cir	Parallel run loop
auto	1.9876146945680135	0.0	keep	11_TAN_in_5	Parallel run loop
auto	1.4638645831566406	0.0	discard	9_TAN_in_6	Parallel run loop
auto	8.417235929584315	0.0	keep	14_DOMINO_in_TAN	Parallel run loop
auto	10.989060908265987	0.0	keep	17_6_in_TAN	Parallel run loop
auto	1.8576866571479955	0.0	keep	17_tan_in_cir	Parallel run loop
auto	12.361712385842385	0.0	keep	11_8_in_TAN	Parallel run loop
auto	8.961717264371641	0.0	keep	16_DOMINO_in_TAN	Parallel run loop
auto	1.3772652545298265	0.0	discard	9_tan_in_cir	Parallel run loop
auto	11.843471290376822	0.0	discard	20_6_in_TAN	Parallel run loop
auto	1.5111529662670666	0.0	discard	6_TAN_in_5	Parallel run loop
auto	8.920269498222936	0.0	discard	17_5_in_TAN	Parallel run loop
auto	9.406688544105446	0.0	keep	19_5_in_TAN	Parallel run loop
auto	11.51922073240496	0.0	discard	19_6_in_TAN	Parallel run loop
auto	0.9896175122548959	0.0	discard	7_TAN_in_8	Parallel run loop
auto	9.656188730106692	0.0	discard	20_5_in_TAN	Parallel run loop
auto	1.4452356679756153	0.0	keep	10_tan_in_cir	Parallel run loop
auto	1.7288418335380458	0.0	keep	8_TAN_in_5	Parallel run loop
auto	1.3230763515031798	0.0	discard	8_tan_in_cir	Parallel run loop
auto	1.8139454457591047	0.0	discard	9_TAN_in_5	Parallel run loop
auto	1.2404105002372954	0.0	discard	6_TAN_in_6	Parallel run loop
auto	1.3203673212301983	0.0	discard	7_TAN_in_6	Parallel run loop
auto	1.0949358415689194	0.0	discard	9_TAN_in_8	Parallel run loop
auto	1.6362682929797132	0.0	discard	7_TAN_in_5	Parallel run loop
auto	7.795676713641822	0.0	discard	24_4_in_tan	Parallel run loop
auto	6.376015494322555	0.0	discard	16_4_in_tan	Parallel run loop
auto	11.30323539523437	0.0	keep	18_6_in_TAN	Parallel run loop
auto	1.3883118882843977	0.0	discard	8_TAN_in_6	Parallel run loop
auto	0.8231141511692444	0.0	discard	4_TAN_in_8	Parallel run loop
auto	9.972561366457574	0.0	discard	20_DOMINO_in_TAN	Parallel run loop
auto	7.415495147623473	0.0	discard	22_4_in_tan	Parallel run loop
auto	1.8966122946781359	0.0	discard	10_TAN_in_5	Parallel run loop
auto	1.5105941147975273	0.0	discard	11_tan_in_cir	Parallel run loop
auto	1.8629461937439822	0.0	discard	17_tan_in_cir	Parallel run loop
auto	9.419573239705542	0.0	discard	18_DOMINO_in_TAN	Parallel run loop
auto	4.2116998839058075	0.0	discard	17_3_in_tan	Parallel run loop
auto	1.4575217049470242	0.0	discard	9_TAN_in_6	Parallel run loop
auto	4.577628575754991	0.0	discard	20_3_in_tan	Parallel run loop
auto	1.2091936063247888	0.0	discard	6_tan_in_cir	Parallel run loop
auto	8.966214411204323	0.0	discard	16_DOMINO_in_TAN	Parallel run loop
auto	8.418875344248848	0.0	discard	14_DOMINO_in_TAN	Parallel run loop
auto	1.3772652545298265	0.0	discard	9_tan_in_cir	Parallel run loop
auto	12.350593537941913	0.0	keep	11_8_in_TAN	Parallel run loop
auto	3.3840351898633885	0.0	discard	8_TAN_in_3	Parallel run loop
auto	3.592250529741708	0.0	discard	9_TAN_in_3	Parallel run loop
auto	1.5604206565242398	0.0	discard	10_TAN_in_6	Parallel run loop
auto	9.230951750218626	0.0	discard	17_DOMINO_in_TAN	Parallel run loop
auto	4.479077395024006	0.0	discard	19_3_in_tan	Parallel run loop
auto	1.443940750465152	0.0	keep	10_tan_in_cir	Parallel run loop
auto	9.684853391971192	0.0	discard	19_DOMINO_in_TAN	Parallel run loop
auto	1.7293131895528022	0.0	discard	8_TAN_in_5	Parallel run loop
auto	1.3230763515031798	0.0	discard	8_tan_in_cir	Parallel run loop
auto	1.5113626169151502	0.0	discard	6_TAN_in_5	Parallel run loop
auto	1.0903961800724427	0.0	keep	9_TAN_in_8	Parallel run loop
auto	1.8139454457591047	0.0	discard	9_TAN_in_5	Parallel run loop
auto	1.9876146945680135	0.0	discard	11_TAN_in_5	Parallel run loop
auto	1.2561125654339858	0.0	discard	6_TAN_in_6	Parallel run loop
auto	1.6212188122854785	0.0	discard	11_TAN_in_6	Parallel run loop
auto	9.442545751470437	0.0	discard	19_5_in_TAN	Parallel run loop
auto	1.3203673212301983	0.0	discard	7_TAN_in_6	Parallel run loop
auto	8.920269498222936	0.0	discard	17_5_in_TAN	Parallel run loop
auto	11.827230625216353	0.0	keep	20_6_in_TAN	Parallel run loop
auto	0.9898812646259407	0.0	discard	7_TAN_in_8	Parallel run loop
auto	11.534309647536988	0.0	discard	19_6_in_TAN	Parallel run loop
auto	9.64854002812037	0.0	discard	20_5_in_TAN	Parallel run loop
auto	0.8231141511692444	0.0	discard	4_TAN_in_8	Parallel run loop
auto	11.310223927437338	0.0	discard	18_6_in_TAN	Parallel run loop
auto	5.068071312299632	0.0	keep	25_3_in_tan	Parallel run loop
auto	9.99316640007752	0.0	discard	20_DOMINO_in_TAN	Parallel run loop
auto	1.5105941147975273	0.0	discard	11_tan_in_cir	Parallel run loop
auto	1.3883118882843977	0.0	discard	8_TAN_in_6	Parallel run loop
auto	1.8977361788735476	0.0	discard	10_TAN_in_5	Parallel run loop
auto	1.6397363084911005	0.0	discard	7_TAN_in_5	Parallel run loop
auto	3.7734263999297917	0.0	discard	10_TAN_in_3	Parallel run loop
auto	6.376015494322555	0.0	discard	16_4_in_tan	Parallel run loop
auto	1.4638645831566406	0.0	discard	9_TAN_in_6	Parallel run loop
auto	1.7010233084261923	0.0	keep	12_TAN_in_6	Parallel run loop
auto	7.415495147623473	0.0	discard	22_4_in_tan	Parallel run loop
auto	7.789997604497211	0.0	discard	24_4_in_tan	Parallel run loop
auto	2.020403925008484	0.0	discard	20_tan_in_cir	Parallel run loop
auto	1.9671278028093129	0.0	keep	19_tan_in_cir	Parallel run loop
auto	2.1755484501277005	0.0	discard	13_TAN_in_5	Parallel run loop
auto	1.732958658283716	0.0	discard	8_TAN_in_5	Parallel run loop
auto	3.3840351898633885	0.0	discard	8_TAN_in_3	Parallel run loop
auto	1.445329430350457	0.0	discard	10_tan_in_cir	Parallel run loop
auto	8.002913760932323	0.0	discard	26_4_in_tan	Parallel run loop
auto	1.3317478817528021	0.0	discard	8_tan_in_cir	Parallel run loop
auto	1.390167778937827	0.0	discard	9_tan_in_cir	Parallel run loop
auto	1.2092691782952918	0.0	discard	6_tan_in_cir	Parallel run loop
auto	1.8139454457591047	0.0	discard	9_TAN_in_5	Parallel run loop
auto	1.0903961800724427	0.0	discard	9_TAN_in_8	Parallel run loop
auto	2.0793724207444617	0.0	keep	12_TAN_in_5	Parallel run loop
auto	1.5113626169151502	0.0	discard	6_TAN_in_5	Parallel run loop
auto	1.8024204131731285	0.0	discard	16_tan_in_cir	Parallel run loop
auto	8.418057557594052	0.0	discard	14_DOMINO_in_TAN	Parallel run loop
auto	4.4742123979253705	0.0	discard	19_3_in_tan	Parallel run loop
auto	1.5613937697579168	0.0	keep	12_tan_in_cir	Parallel run loop
auto	4.050523832565846	0.0	discard	16_3_in_tan	Parallel run loop
auto	9.64854002812037	0.0	discard	20_5_in_TAN	Parallel run loop
auto	1.5604206565242398	0.0	discard	10_TAN_in_6	Parallel run loop
auto	1.504962924277851	0.0	discard	11_tan_in_cir	Parallel run loop
auto	9.180385646846057	0.0	discard	17_DOMINO_in_TAN	Parallel run loop
auto	8.920269498222936	0.0	discard	17_5_in_TAN	Parallel run loop
auto	9.411320497507997	0.0	discard	19_5_in_TAN	Parallel run loop
auto	1.2404105002372954	0.0	discard	6_TAN_in_6	Parallel run loop
auto	3.5942715950687028	0.0	discard	9_TAN_in_3	Parallel run loop
auto	4.759542013606984	0.0	keep	22_3_in_tan	Parallel run loop
auto	11.8299996018399	0.0	discard	20_6_in_TAN	Parallel run loop
auto	1.3203673212301983	0.0	discard	7_TAN_in_6	Parallel run loop
auto	8.961717264371641	0.0	discard	16_DOMINO_in_TAN	Parallel run loop
auto	0.9896175122548959	0.0	discard	7_TAN_in_8	Parallel run loop
auto	11.534309647536988	0.0	discard	19_6_in_TAN	Parallel run loop
auto	1.3473195291947468	0.0	discard	6_TAN_in_DOMINO	Parallel run loop
auto	1.447046343723036	0.0	discard	10_tan_in_cir	Parallel run loop
auto	6.376015494322555	0.0	discard	16_4_in_tan	Parallel run loop
auto	4.595706317489151	0.0	discard	20_3_in_tan	Parallel run loop
auto	1.9104917584535055	0.0	keep	18_tan_in_cir	Parallel run loop
auto	7.795676713641822	0.0	discard	24_4_in_tan	Parallel run loop
auto	7.415495147623473	0.0	discard	22_4_in_tan	Parallel run loop
auto	3.383483963648874	0.0	discard	8_TAN_in_3	Parallel run loop
auto	9.419573239705542	0.0	discard	18_DOMINO_in_TAN	Parallel run loop
auto	1.3859249957020598	0.0	discard	8_TAN_in_6	Parallel run loop
auto	1.626611168274944	0.0	discard	11_TAN_in_6	Parallel run loop
auto	1.0904711599848518	0.0	discard	9_TAN_in_8	Parallel run loop
auto	1.504962924277851	0.0	discard	11_tan_in_cir	Parallel run loop
auto	1.2045383347277112	0.0	discard	11_TAN_in_8	Parallel run loop
auto	1.9876146945680135	0.0	discard	11_TAN_in_5	Parallel run loop
auto	1.8864455664123283	0.0	discard	17_tan_in_cir	Parallel run loop
auto	4.209030014025937	0.0	keep	17_3_in_tan	Parallel run loop
auto	9.586918260057402	0.0	keep	19_DOMINO_in_TAN	Parallel run loop
auto	4.883811785887208	0.0	discard	23_3_in_tan	Parallel run loop
auto	8.418057557594052	0.0	discard	14_DOMINO_in_TAN	Parallel run loop
auto	4.281762002917909	0.0	keep	18_3_in_tan	Parallel run loop
auto	2.3356393793944	0.0	discard	15_TAN_in_5	Parallel run loop
auto	10.003223051994581	0.0	discard	20_DOMINO_in_TAN	Parallel run loop
auto	1.6453902761540076	0.0	discard	13_tan_in_cir	Parallel run loop
auto	1.9581643987272404	0.0	keep	19_tan_in_cir	Parallel run loop
auto	1.4666135151384418	0.0	discard	9_TAN_in_6	Parallel run loop
auto	5.093717247928289	0.0	discard	25_3_in_tan	Parallel run loop
auto	1.6997701539863892	0.0	keep	12_TAN_in_6	Parallel run loop
auto	4.49067785485852	0.0	discard	19_3_in_tan	Parallel run loop
auto	3.7811931423618796	0.0	discard	10_TAN_in_3	Parallel run loop
auto	5.352864581711419	0.0	discard	28_3_in_tan	Parallel run loop
auto	1.8977361788735476	0.0	discard	10_TAN_in_5	Parallel run loop
auto	9.419461214920503	0.0	discard	19_5_in_TAN	Parallel run loop
auto	2.0223593713936583	0.0	discard	20_tan_in_cir	Parallel run loop
auto	1.8024204131731285	0.0	discard	16_tan_in_cir	Parallel run loop
auto	8.966214411204323	0.0	discard	16_DOMINO_in_TAN	Parallel run loop
auto	4.912517713729553	0.0	keep	24_3_in_tan	Parallel run loop
auto	2.60407248972354	0.0	keep	19_TAN_in_5	Parallel run loop
auto	1.5613937697579168	0.0	discard	12_tan_in_cir	Parallel run loop
auto	2.0936220258032052	0.0	discard	12_TAN_in_5	Parallel run loop
auto	9.227124334442703	0.0	discard	17_DOMINO_in_TAN	Parallel run loop
auto	5.442485306082487	0.0	keep	29_3_in_tan	Parallel run loop
auto	11.843471290376822	0.0	discard	20_6_in_TAN	Parallel run loop
auto	7.959569148970783	0.0	keep	26_4_in_tan	Parallel run loop
auto	4.772951183144171	0.0	discard	22_3_in_tan	Parallel run loop
auto	0.9896175122548959	0.0	discard	7_TAN_in_8	Parallel run loop
auto	2.163158270560177	0.0	discard	13_TAN_in_5	Parallel run loop
auto	3.5806431076845198	0.0	discard	9_TAN_in_3	Parallel run loop
auto	7.415280865162174	0.0	discard	22_4_in_tan	Parallel run loop
auto	1.7617839489044753	0.0	discard	13_TAN_in_6	Parallel run loop
auto	1.5499932449108802	0.0	keep	10_TAN_in_6	Parallel run loop
auto	4.050189437941385	0.0	discard	16_3_in_tan	Parallel run loop
auto	2.4029280662165178	0.0	discard	16_TAN_in_5	Parallel run loop
auto	1.3473195291947468	0.0	discard	6_TAN_in_DOMINO	Parallel run loop
auto	9.419573239705542	0.0	discard	18_DOMINO_in_TAN	Parallel run loop
auto	1.8576866571479955	0.0	discard	17_tan_in_cir	Parallel run loop
auto	4.590816345868092	0.0	discard	20_3_in_tan	Parallel run loop
auto	5.139798158914161	0.0	discard	26_3_in_tan	Parallel run loop
auto	1.9295625017515452	0.0	keep	16_TAN_in_6	Parallel run loop
auto	4.288082510013906	0.0	discard	18_3_in_tan	Parallel run loop
auto	1.824551161430048	0.0	keep	14_TAN_in_6	Parallel run loop
auto	8.417235929584315	0.0	discard	14_DOMINO_in_TAN	Parallel run loop
auto	9.67281408978073	0.0	discard	19_DOMINO_in_TAN	Parallel run loop
auto	1.9104917584535055	0.0	discard	18_tan_in_cir	Parallel run loop
auto	4.861439648783421	0.0	keep	23_3_in_tan	Parallel run loop
auto	1.7407125510202037	0.0	keep	15_tan_in_cir	Parallel run loop
auto	1.9876146945680135	0.0	discard	11_TAN_in_5	Parallel run loop
auto	2.020403925008484	0.0	discard	20_tan_in_cir	Parallel run loop
auto	1.8977361788735476	0.0	discard	10_TAN_in_5	Parallel run loop
auto	1.6474013856088567	0.0	discard	13_tan_in_cir	Parallel run loop
auto	1.8827655178598182	0.0	keep	15_TAN_in_6	Parallel run loop
auto	2.258587073050062	0.0	keep	14_TAN_in_5	Parallel run loop
auto	1.1970834389028067	0.0	keep	11_TAN_in_8	Parallel run loop
auto	1.6997701539863892	0.0	discard	12_TAN_in_6	Parallel run loop
auto	5.342002460317513	0.0	keep	28_3_in_tan	Parallel run loop
auto	2.6697872839424672	0.0	discard	20_TAN_in_5	Parallel run loop
auto	4.118261553339798	0.0	discard	12_TAN_in_3	Parallel run loop
auto	3.760439063866493	0.0	keep	10_TAN_in_3	Parallel run loop
auto	2.3317001406671167	0.0	discard	15_TAN_in_5	Parallel run loop
auto	2.708856093603248	0.0	keep	21_TAN_in_5	Parallel run loop
auto	1.137270275289659	0.0	keep	10_TAN_in_8	Parallel run loop
auto	1.626611168274944	0.0	discard	11_TAN_in_6	Parallel run loop
auto	3.9369058626833966	0.0	discard	11_TAN_in_3	Parallel run loop
auto	5.068071312299632	0.0	discard	25_3_in_tan	Parallel run loop
auto	5.271509368145633	0.0	discard	27_3_in_tan	Parallel run loop
auto	1.793107117272836	0.0	keep	16_tan_in_cir	Parallel run loop
auto	5.425962750286699	0.0	keep	29_3_in_tan	Parallel run loop
auto	2.607218753097511	0.0	discard	19_TAN_in_5	Parallel run loop
auto	2.3960589289508563	0.0	discard	16_TAN_in_5	Parallel run loop
auto	1.577440824066254	0.0	discard	12_tan_in_cir	Parallel run loop
auto	2.77517724746961	0.0	keep	22_TAN_in_5	Parallel run loop
auto	2.4526440902472317	0.0	keep	17_TAN_in_5	Parallel run loop
auto	2.1593744675828312	0.0	discard	13_TAN_in_5	Parallel run loop
auto	7.978783479811537	0.0	discard	26_4_in_tan	Parallel run loop
auto	2.070233441878359	0.0	keep	12_TAN_in_5	Parallel run loop
auto	4.050523832565846	0.0	discard	16_3_in_tan	Parallel run loop
auto	9.180385646846057	0.0	discard	17_DOMINO_in_TAN	Parallel run loop
auto	1.9581643987272404	0.0	discard	19_tan_in_cir	Parallel run loop
auto	1.3473195291947468	0.0	discard	6_TAN_in_DOMINO	Parallel run loop
auto	4.743564407753624	0.0	discard	16_TAN_in_3	Parallel run loop
auto	1.9121789521201409	0.0	discard	18_tan_in_cir	Parallel run loop
auto	1.7581535629954326	0.0	discard	15_tan_in_cir	Parallel run loop
auto	4.791877970190121	0.0	discard	22_3_in_tan	Parallel run loop
auto	5.537367083951278	0.0	discard	30_3_in_tan	Parallel run loop
auto	1.7615854481361177	0.0	discard	13_TAN_in_6	Parallel run loop
auto	1.5604206565242398	0.0	discard	10_TAN_in_6	Parallel run loop
auto	2.0060799017735222	0.0	keep	17_TAN_in_6	Parallel run loop
auto	3.592250529741708	0.0	discard	9_TAN_in_3	Parallel run loop
auto	1.6546755061949667	0.0	discard	9_TAN_in_DOMINO	Parallel run loop
auto	4.299161491435599	0.0	discard	13_TAN_in_3	Parallel run loop
auto	2.160621152361705	0.0	keep	20_TAN_in_6	Parallel run loop
auto	1.8331005581006128	0.0	discard	14_TAN_in_6	Parallel run loop
auto	9.419573239705542	0.0	discard	18_DOMINO_in_TAN	Parallel run loop
auto	2.4143759459845033	0.0	discard	10_TAN_in_4	Parallel run loop
auto	1.8788288695927609	0.0	discard	17_tan_in_cir	Parallel run loop
auto	5.12744046544915	0.0	keep	26_3_in_tan	Parallel run loop
auto	4.862855451151466	0.0	discard	23_3_in_tan	Parallel run loop
auto	2.7425221982845853	0.0	discard	21_TAN_in_5	Parallel run loop
auto	4.100617325904745	0.0	discard	12_TAN_in_3	Parallel run loop
auto	2.329902177684208	0.0	discard	15_TAN_in_5	Parallel run loop
auto	4.28753814632513	0.0	discard	18_3_in_tan	Parallel run loop
auto	2.5437694911458215	0.0	discard	18_TAN_in_5	Parallel run loop
auto	1.8864828706095909	0.0	discard	15_TAN_in_6	Parallel run loop
auto	2.6697872839424672	0.0	discard	20_TAN_in_5	Parallel run loop
auto	1.2047780013162246	0.0	discard	11_TAN_in_8	Parallel run loop
auto	1.9583409162859535	0.0	discard	16_TAN_in_6	Parallel run loop
auto	1.1361456296896022	0.0	keep	10_TAN_in_8	Parallel run loop
auto	1.9876146945680135	0.0	discard	11_TAN_in_5	Parallel run loop
auto	9.684853391971192	0.0	discard	19_DOMINO_in_TAN	Parallel run loop
auto	5.271509368145633	0.0	discard	27_3_in_tan	Parallel run loop
auto	2.0669004761025747	0.0	keep	18_TAN_in_6	Parallel run loop
auto	5.3692790855949974	0.0	discard	28_3_in_tan	Parallel run loop
auto	5.068071312299632	0.0	discard	25_3_in_tan	Parallel run loop
auto	1.6454177752334516	0.0	discard	13_tan_in_cir	Parallel run loop
auto	1.6951721621359996	0.0	keep	12_TAN_in_6	Parallel run loop
auto	3.9369058626833966	0.0	discard	11_TAN_in_3	Parallel run loop
auto	2.020403925008484	0.0	discard	20_tan_in_cir	Parallel run loop
auto	1.9581643987272404	0.0	discard	19_tan_in_cir	Parallel run loop
auto	2.264769095521482	0.0	discard	14_TAN_in_5	Parallel run loop
auto	4.462618174279335	0.0	discard	14_TAN_in_3	Parallel run loop
auto	3.7734263999297917	0.0	discard	10_TAN_in_3	Parallel run loop
auto	2.063580257379813	0.0	keep	12_TAN_in_5	Parallel run loop
auto	2.4719440872562815	0.0	discard	17_TAN_in_5	Parallel run loop
auto	2.407322698744036	0.0	discard	16_TAN_in_5	Parallel run loop
auto	2.1503352557147117	0.0	keep	13_TAN_in_5	Parallel run loop
auto	8.003747761263343	0.0	discard	26_4_in_tan	Parallel run loop
auto	2.6095937625365315	0.0	discard	19_TAN_in_5	Parallel run loop
auto	4.829681082361415	0.0	keep	17_TAN_in_3	Parallel run loop
auto	1.793107117272836	0.0	discard	16_tan_in_cir	Parallel run loop
auto	5.539085674253651	0.0	discard	30_3_in_tan	Parallel run loop
auto	2.2615651718030727	0.0	keep	22_TAN_in_6	Parallel run loop
auto	4.761003079746083	0.0	discard	22_3_in_tan	Parallel run loop
auto	2.170234734757977	0.0	discard	20_TAN_in_6	Parallel run loop
auto	5.442485306082487	0.0	discard	29_3_in_tan	Parallel run loop
auto	1.9104917584535055	0.0	discard	18_tan_in_cir	Parallel run loop
auto	4.758119941179373	0.0	discard	16_TAN_in_3	Parallel run loop
auto	1.7620396119652357	0.0	discard	13_TAN_in_6	Parallel run loop
auto	2.0130401364880104	0.0	discard	17_TAN_in_6	Parallel run loop
auto	2.688637692455787	0.0	keep	12_TAN_in_4	Parallel run loop
auto	1.7581535629954326	0.0	discard	15_tan_in_cir	Parallel run loop
auto	2.7787972337337923	0.0	discard	22_TAN_in_5	Parallel run loop
auto	1.3473195291947468	0.0	discard	6_TAN_in_DOMINO	Parallel run loop
auto	4.052695395365154	0.0	discard	16_3_in_tan	Parallel run loop
auto	4.246359730228952	0.0	keep	13_TAN_in_3	Parallel run loop
auto	1.6546755061949667	0.0	discard	9_TAN_in_DOMINO	Parallel run loop
auto	2.6697872839424672	0.0	discard	20_TAN_in_5	Parallel run loop
auto	4.864974079537623	0.0	discard	23_3_in_tan	Parallel run loop
auto	2.0669004761025747	0.0	discard	18_TAN_in_6	Parallel run loop
auto	2.536298836261779	0.0	discard	18_TAN_in_5	Parallel run loop
auto	5.34471429791033	0.0	discard	28_3_in_tan	Parallel run loop
auto	5.131612000648393	0.0	discard	26_3_in_tan	Parallel run loop
auto	2.414518530137704	0.0	discard	10_TAN_in_4	Parallel run loop
auto	4.289744276231275	0.0	discard	18_3_in_tan	Parallel run loop
auto	5.26602638472001	0.0	discard	27_3_in_tan	Parallel run loop
auto	1.872093482556069	0.0	keep	15_TAN_in_6	Parallel run loop
auto	1.9295625017515452	0.0	discard	16_TAN_in_6	Parallel run loop
auto	1.8139250057612826	0.0	keep	14_TAN_in_6	Parallel run loop
auto	2.3304338397716844	0.0	discard	15_TAN_in_5	Parallel run loop
auto	2.218173234560762	0.0	keep	21_TAN_in_6	Parallel run loop
auto	1.5970633799429717	0.0	discard	20_TAN_in_8	Parallel run loop
auto	1.193617473051707	0.0	keep	11_TAN_in_8	Parallel run loop
auto	4.100617325904745	0.0	discard	12_TAN_in_3	Parallel run loop
auto	2.124164524801941	0.0	discard	19_TAN_in_6	Parallel run loop
auto	2.2459747015595886	0.0	keep	14_TAN_in_5	Parallel run loop
auto	5.461591029659076	0.0	discard	21_TAN_in_3	Parallel run loop
auto	2.7426836742761345	0.0	discard	21_TAN_in_5	Parallel run loop
auto	1.1404790496776407	0.0	discard	10_TAN_in_8	Parallel run loop
auto	1.975438014399217	0.0	discard	13_TAN_in_DOMINO	Parallel run loop
