commit	score	memory_gb	status	problem	description
auto	5.237116424734032	0.0	discard	40_3_in_4	Parallel run loop
auto	3.748461122703134	0.0	discard	22_3_in_4	Parallel run loop
auto	5.733612008577337	0.0	discard	46_3_in_4	Parallel run loop
auto	3.132540905122791	0.0	discard	22_3_in_5	Parallel run loop
auto	5.348248603110638	0.0	discard	41_3_in_4	Parallel run loop
auto	2.822222290083315	0.0	discard	18_3_in_5	Parallel run loop
auto	4.922716835388077	0.0	discard	36_3_in_4	Parallel run loop
auto	4.116804367421597	0.0	discard	26_3_in_4	Parallel run loop
auto	1.8622688553197417	0.0	discard	8_3_in_5	Parallel run loop
auto	4.532368551844021	0.0	discard	43_3_in_5	Parallel run loop
auto	5.9807153129879	0.0	discard	48_3_in_4	Parallel run loop
auto	4.540956932923005	0.0	discard	44_3_in_5	Parallel run loop
auto	3.3594821625882365	0.0	discard	25_3_in_5	Parallel run loop
auto	4.962539217593427	0.0	discard	49_3_in_5	Parallel run loop
auto	5.448373874455705	0.0	discard	43_3_in_4	Parallel run loop
auto	3.952879848957269	0.0	discard	24_3_in_4	Parallel run loop
auto	4.195203913420825	0.0	discard	27_3_in_4	Parallel run loop
auto	4.907456492425814	0.0	discard	48_3_in_5	Parallel run loop
auto	2.0821228162382606	0.0	discard	10_3_in_5	Parallel run loop
auto	3.8794229644833824	0.0	discard	33_3_in_5	Parallel run loop
auto	4.154738088032755	0.0	discard	37_3_in_5	Parallel run loop
auto	5.614319760495019	0.0	discard	45_3_in_4	Parallel run loop
auto	5.1019414086673605	0.0	discard	50_3_in_5	Parallel run loop
auto	2.730060500023808	0.0	discard	17_3_in_5	Parallel run loop
auto	5.17001137115581	0.0	discard	39_3_in_4	Parallel run loop
auto	1.9760313814866208	0.0	discard	9_3_in_5	Parallel run loop
auto	4.03982741189093	0.0	discard	25_3_in_4	Parallel run loop
auto	2.2835311026997083	0.0	discard	12_3_in_5	Parallel run loop
auto	4.459348066577679	0.0	discard	41_3_in_5	Parallel run loop
auto	1.473596073018363	0.0	discard	5_3_in_5	Parallel run loop
auto	2.859761438979893	0.0	discard	13_3_in_4	Parallel run loop
auto	3.774784549829717	0.0	discard	22_3_in_4	Parallel run loop
auto	4.809234157448433	0.0	discard	46_3_in_5	Parallel run loop
auto	3.4843078030057724	0.0	discard	27_3_in_5	Parallel run loop
auto	4.227339180952171	0.0	discard	38_3_in_5	Parallel run loop
auto	3.142427105667114	0.0	discard	22_3_in_5	Parallel run loop
auto	3.5624737904636077	0.0	discard	28_3_in_5	Parallel run loop
auto	5.553453579087331	0.0	keep	46_3_in_4	Parallel run loop
auto	3.6273173872505122	0.0	discard	29_3_in_5	Parallel run loop
auto	4.49577648726146	0.0	keep	31_3_in_4	Parallel run loop
auto	4.273020699907327	0.0	discard	28_3_in_4	Parallel run loop
auto	3.6961230302984407	0.0	discard	30_3_in_5	Parallel run loop
auto	5.061680865850144	0.0	discard	49_3_in_5	Parallel run loop
auto	4.04393797282226	0.0	keep	36_3_in_5	Parallel run loop
auto	4.49107930456314	0.0	discard	44_3_in_5	Parallel run loop
auto	4.6314979312199895	0.0	discard	45_3_in_5	Parallel run loop
auto	5.48255193307576	0.0	discard	43_3_in_4	Parallel run loop
auto	3.804871631238319	0.0	discard	32_3_in_5	Parallel run loop
auto	4.9494385803528385	0.0	discard	48_3_in_5	Parallel run loop
auto	4.973242494168026	0.0	discard	37_3_in_4	Parallel run loop
auto	2.0819084747264767	0.0	discard	10_3_in_5	Parallel run loop
auto	3.6587304296046885	0.0	discard	21_3_in_4	Parallel run loop
auto	5.600410848822905	0.0	discard	45_3_in_4	Parallel run loop
auto	3.272288149798548	0.0	discard	24_3_in_5	Parallel run loop
auto	4.724862720322461	0.0	discard	34_3_in_4	Parallel run loop
auto	5.874269763163611	0.0	discard	47_3_in_4	Parallel run loop
auto	2.2815168614507546	0.0	discard	12_3_in_5	Parallel run loop
auto	1.9752519195954434	0.0	discard	9_3_in_5	Parallel run loop
auto	2.9862556177622426	0.0	discard	20_3_in_5	Parallel run loop
auto	1.4729352234059303	0.0	discard	5_3_in_5	Parallel run loop
auto	3.065395027236656	0.0	discard	21_3_in_5	Parallel run loop
auto	5.601237022628351	0.0	discard	44_3_in_4	Parallel run loop
auto	2.9043263500098107	0.0	discard	19_3_in_5	Parallel run loop
auto	3.492428065573333	0.0	discard	27_3_in_5	Parallel run loop
auto	4.116524389600064	0.0	discard	26_3_in_4	Parallel run loop
auto	5.166736437532656	0.0	discard	40_3_in_4	Parallel run loop
auto	2.8175169543904457	0.0	discard	18_3_in_5	Parallel run loop
auto	2.6482431989594692	0.0	discard	16_3_in_5	Parallel run loop
auto	5.278775218308477	0.0	discard	41_3_in_4	Parallel run loop
auto	5.785517877120283	0.0	discard	46_3_in_4	Parallel run loop
auto	3.349767790666522	0.0	discard	25_3_in_5	Parallel run loop
auto	4.272276323793011	0.0	discard	28_3_in_4	Parallel run loop
auto	4.492409468153637	0.0	discard	42_3_in_5	Parallel run loop
auto	4.503246809473478	0.0	discard	31_3_in_4	Parallel run loop
auto	4.646215964428969	0.0	discard	44_3_in_5	Parallel run loop
auto	4.730194123090132	0.0	discard	45_3_in_5	Parallel run loop
auto	4.091871112434221	0.0	discard	36_3_in_5	Parallel run loop
auto	5.463500133988421	0.0	discard	43_3_in_4	Parallel run loop
auto	1.8618307617596228	0.0	discard	8_3_in_5	Parallel run loop
auto	4.505402828109341	0.0	discard	43_3_in_5	Parallel run loop
auto	3.822151894222357	0.0	discard	32_3_in_5	Parallel run loop
auto	4.984598539348893	0.0	discard	37_3_in_4	Parallel run loop
auto	2.0817701848787395	0.0	discard	10_3_in_5	Parallel run loop
auto	3.6769914328192908	0.0	discard	21_3_in_4	Parallel run loop
auto	4.342890520909809	0.0	discard	29_3_in_4	Parallel run loop
auto	3.256867308824029	0.0	discard	24_3_in_5	Parallel run loop
auto	4.705103798988685	0.0	discard	34_3_in_4	Parallel run loop
auto	3.882312189306401	0.0	discard	33_3_in_5	Parallel run loop
auto	6.01180006271446	0.0	discard	48_3_in_4	Parallel run loop
auto	4.116528864163394	0.0	discard	37_3_in_5	Parallel run loop
auto	2.281407978215319	0.0	discard	12_3_in_5	Parallel run loop
auto	3.4263992633050004	0.0	discard	26_3_in_5	Parallel run loop
auto	4.832027731394896	0.0	discard	35_3_in_4	Parallel run loop
auto	3.2139935668779662	0.0	discard	23_3_in_5	Parallel run loop
auto	5.143267160812842	0.0	discard	40_3_in_4	Parallel run loop
auto	3.9517335767444055	0.0	discard	34_3_in_5	Parallel run loop
auto	4.6057798550261815	0.0	discard	32_3_in_4	Parallel run loop
auto	4.091138332725485	0.0	discard	26_3_in_4	Parallel run loop
auto	5.143037194483781	0.0	discard	39_3_in_4	Parallel run loop
auto	5.376385337168578	0.0	discard	41_3_in_4	Parallel run loop
auto	2.719608503601381	0.0	discard	17_3_in_5	Parallel run loop
auto	4.026093243921116	0.0	discard	25_3_in_4	Parallel run loop
auto	4.28690862967755	0.0	discard	39_3_in_5	Parallel run loop
auto	4.518240689982818	0.0	discard	31_3_in_4	Parallel run loop
auto	2.859089057449552	0.0	discard	13_3_in_4	Parallel run loop
auto	4.51076565850779	0.0	discard	42_3_in_5	Parallel run loop
auto	4.764865590095546	0.0	discard	46_3_in_5	Parallel run loop
auto	5.405456367019215	0.0	discard	43_3_in_4	Parallel run loop
auto	4.53923657403915	0.0	discard	43_3_in_5	Parallel run loop
auto	1.8622758371280028	0.0	discard	8_3_in_5	Parallel run loop
auto	4.216205350975018	0.0	discard	38_3_in_5	Parallel run loop
auto	5.005803815812155	0.0	discard	37_3_in_4	Parallel run loop
auto	3.753122027120179	0.0	discard	31_3_in_5	Parallel run loop
auto	3.6092735393824897	0.0	discard	29_3_in_5	Parallel run loop
auto	3.666502384553034	0.0	discard	21_3_in_4	Parallel run loop
auto	3.3795218258047717	0.0	discard	18_3_in_4	Parallel run loop
auto	3.2616196161985975	0.0	discard	24_3_in_5	Parallel run loop
auto	4.340132761681174	0.0	discard	29_3_in_4	Parallel run loop
auto	4.718916217069138	0.0	discard	34_3_in_4	Parallel run loop
auto	4.164107251987663	0.0	discard	37_3_in_5	Parallel run loop
auto	3.695476082982423	0.0	discard	30_3_in_5	Parallel run loop
auto	3.892521826822933	0.0	discard	33_3_in_5	Parallel run loop
auto	2.562612448250824	0.0	discard	15_3_in_5	Parallel run loop
auto	2.4677213984693607	0.0	discard	14_3_in_5	Parallel run loop
auto	5.251646743601267	0.0	discard	40_3_in_4	Parallel run loop
auto	1.6123349591374612	0.0	discard	6_3_in_5	Parallel run loop
auto	3.56543508840125	0.0	discard	28_3_in_5	Parallel run loop
auto	5.86088578299584	0.0	discard	47_3_in_4	Parallel run loop
auto	4.095160259276424	0.0	discard	26_3_in_4	Parallel run loop
auto	4.448665521049719	0.0	discard	41_3_in_5	Parallel run loop
auto	2.7273215232000463	0.0	discard	17_3_in_5	Parallel run loop
auto	5.146826139553591	0.0	discard	39_3_in_4	Parallel run loop
auto	3.965478921690845	0.0	discard	34_3_in_5	Parallel run loop
auto	4.37140440311537	0.0	discard	40_3_in_5	Parallel run loop
auto	3.478170262691319	0.0	discard	19_3_in_4	Parallel run loop
auto	4.021423392759449	0.0	discard	25_3_in_4	Parallel run loop
auto	2.878172002845515	0.0	discard	19_3_in_5	Parallel run loop
auto	4.713691172240886	0.0	discard	46_3_in_5	Parallel run loop
auto	5.534832410535292	0.0	discard	43_3_in_4	Parallel run loop
auto	2.9666019517081716	0.0	discard	20_3_in_5	Parallel run loop
auto	3.058931773898277	0.0	discard	21_3_in_5	Parallel run loop
auto	4.999798135488359	0.0	discard	37_3_in_4	Parallel run loop
auto	3.3665765081138175	0.0	discard	18_3_in_4	Parallel run loop
auto	3.734530119081263	0.0	discard	31_3_in_5	Parallel run loop
auto	5.604376703353074	0.0	discard	44_3_in_4	Parallel run loop
auto	3.6235123721505014	0.0	discard	29_3_in_5	Parallel run loop
auto	4.655507818363169	0.0	discard	33_3_in_4	Parallel run loop
auto	3.6759562300311948	0.0	discard	21_3_in_4	Parallel run loop
auto	4.348586371092687	0.0	discard	29_3_in_4	Parallel run loop
auto	3.26251797852577	0.0	discard	24_3_in_5	Parallel run loop
auto	2.637231541539241	0.0	discard	16_3_in_5	Parallel run loop
auto	2.1860537501654402	0.0	discard	11_3_in_5	Parallel run loop
auto	2.8163283500315996	0.0	discard	18_3_in_5	Parallel run loop
auto	5.695072417501406	0.0	keep	48_3_in_4	Parallel run loop
auto	3.3587831981419414	0.0	discard	25_3_in_5	Parallel run loop
auto	5.25304994543078	0.0	discard	40_3_in_4	Parallel run loop
auto	4.853529562132143	0.0	discard	47_3_in_5	Parallel run loop
auto	5.166404649175369	0.0	discard	39_3_in_4	Parallel run loop
auto	5.0797690773455955	0.0	discard	38_3_in_4	Parallel run loop
auto	4.843714032558991	0.0	discard	35_3_in_4	Parallel run loop
auto	3.3963959312410235	0.0	discard	26_3_in_5	Parallel run loop
auto	2.9861653511517487	0.0	discard	20_3_in_5	Parallel run loop
auto	4.965018560660275	0.0	discard	48_3_in_5	Parallel run loop
auto	4.106543448467859	0.0	discard	26_3_in_4	Parallel run loop
auto	2.3771966606191923	0.0	discard	13_3_in_5	Parallel run loop
auto	3.48502747325075	0.0	discard	19_3_in_4	Parallel run loop
auto	3.0592809793182054	0.0	discard	21_3_in_5	Parallel run loop
auto	3.9341918462685124	0.0	discard	24_3_in_4	Parallel run loop
auto	1.9752552834029304	0.0	discard	9_3_in_5	Parallel run loop
auto	1.7415211398684618	0.0	discard	7_3_in_5	Parallel run loop
auto	4.586341834648401	0.0	discard	32_3_in_4	Parallel run loop
auto	3.7412226433545794	0.0	discard	31_3_in_5	Parallel run loop
auto	4.666229436502782	0.0	discard	33_3_in_4	Parallel run loop
auto	4.7871002244129865	0.0	discard	46_3_in_5	Parallel run loop
auto	3.210422090186213	0.0	discard	23_3_in_5	Parallel run loop
auto	2.8811135454379424	0.0	discard	19_3_in_5	Parallel run loop
auto	4.029777872933036	0.0	discard	25_3_in_4	Parallel run loop
auto	3.665850980638859	0.0	discard	21_3_in_4	Parallel run loop
auto	4.292645028691155	0.0	discard	39_3_in_5	Parallel run loop
auto	3.271638856423078	0.0	discard	24_3_in_5	Parallel run loop
auto	3.3862250980543913	0.0	discard	18_3_in_4	Parallel run loop
auto	4.3511141196659855	0.0	discard	29_3_in_4	Parallel run loop
auto	2.6366962961555953	0.0	discard	16_3_in_5	Parallel run loop
auto	3.4933551186582825	0.0	discard	27_3_in_5	Parallel run loop
auto	2.8577351862961518	0.0	discard	13_3_in_4	Parallel run loop
auto	3.8634089314641056	0.0	discard	23_3_in_4	Parallel run loop
auto	5.8324362040494035	0.0	discard	48_3_in_4	Parallel run loop
auto	4.199810257857482	0.0	discard	38_3_in_5	Parallel run loop
auto	3.678013431379621	0.0	discard	30_3_in_5	Parallel run loop
auto	2.557715064191962	0.0	discard	15_3_in_5	Parallel run loop
auto	3.424013383267671	0.0	discard	26_3_in_5	Parallel run loop
auto	3.54487158735491	0.0	discard	28_3_in_5	Parallel run loop
auto	4.704621625904206	0.0	discard	45_3_in_5	Parallel run loop
auto	3.055226718942238	0.0	discard	21_3_in_5	Parallel run loop
auto	1.6123349393385715	0.0	discard	6_3_in_5	Parallel run loop
auto	2.468776277298151	0.0	discard	14_3_in_5	Parallel run loop
auto	3.948423803070374	0.0	discard	24_3_in_4	Parallel run loop
auto	4.0953450472937885	0.0	discard	26_3_in_4	Parallel run loop
auto	2.890567483946603	0.0	discard	19_3_in_5	Parallel run loop
auto	4.058258917377271	0.0	discard	36_3_in_5	Parallel run loop
auto	4.018010305445042	0.0	discard	35_3_in_5	Parallel run loop
auto	4.596782470705274	0.0	discard	32_3_in_4	Parallel run loop
auto	4.031299679580806	0.0	discard	25_3_in_4	Parallel run loop
auto	4.277826030551173	0.0	discard	28_3_in_4	Parallel run loop
auto	5.040007929111208	0.0	discard	49_3_in_5	Parallel run loop
auto	3.814643444860872	0.0	discard	32_3_in_5	Parallel run loop
auto	4.438135853570912	0.0	discard	30_3_in_4	Parallel run loop
auto	4.416211481719038	0.0	discard	41_3_in_5	Parallel run loop
auto	1.9748261961908327	0.0	discard	9_3_in_5	Parallel run loop
auto	5.791676946907376	0.0	discard	47_3_in_4	Parallel run loop
auto	3.274083047719634	0.0	discard	24_3_in_5	Parallel run loop
auto	2.6433659984771567	0.0	discard	16_3_in_5	Parallel run loop
auto	3.3837192280310675	0.0	discard	18_3_in_4	Parallel run loop
auto	4.352567403401032	0.0	discard	29_3_in_4	Parallel run loop
auto	4.31713892619498	0.0	discard	40_3_in_5	Parallel run loop
auto	5.503868428599859	0.0	discard	44_3_in_4	Parallel run loop
auto	4.917055661982271	0.0	discard	36_3_in_4	Parallel run loop
auto	2.8586521776536236	0.0	discard	13_3_in_4	Parallel run loop
auto	4.198666214898308	0.0	discard	38_3_in_5	Parallel run loop
auto	3.6884644374880717	0.0	discard	30_3_in_5	Parallel run loop
auto	5.9615587859198635	0.0	discard	48_3_in_4	Parallel run loop
auto	5.794978717846507	0.0	discard	46_3_in_4	Parallel run loop
auto	3.561554138996337	0.0	discard	28_3_in_5	Parallel run loop
auto	4.122516664592857	0.0	discard	26_3_in_4	Parallel run loop
auto	2.1837394684394607	0.0	discard	11_3_in_5	Parallel run loop
auto	5.344815474203816	0.0	discard	41_3_in_4	Parallel run loop
auto	3.060457101844983	0.0	discard	21_3_in_5	Parallel run loop
auto	2.8042651414659834	0.0	discard	18_3_in_5	Parallel run loop
auto	4.436564864296361	0.0	discard	42_3_in_5	Parallel run loop
auto	3.346912273220901	0.0	discard	25_3_in_5	Parallel run loop
auto	1.8630005476255431	0.0	discard	8_3_in_5	Parallel run loop
auto	4.0632823550469785	0.0	discard	36_3_in_5	Parallel run loop
auto	4.286245127636816	0.0	discard	28_3_in_4	Parallel run loop
auto	2.90728689550601	0.0	discard	19_3_in_5	Parallel run loop
auto	4.4212635806252445	0.0	discard	41_3_in_5	Parallel run loop
auto	5.891834870409866	0.0	discard	47_3_in_4	Parallel run loop
auto	4.039367787066776	0.0	discard	25_3_in_4	Parallel run loop
auto	4.59946234432177	0.0	discard	32_3_in_4	Parallel run loop
auto	5.095156343034218	0.0	discard	38_3_in_4	Parallel run loop
auto	1.97525368828094	0.0	discard	9_3_in_5	Parallel run loop
auto	3.819503105919198	0.0	discard	32_3_in_5	Parallel run loop
auto	4.523814521267815	0.0	discard	43_3_in_5	Parallel run loop
auto	3.3878902676035745	0.0	discard	18_3_in_4	Parallel run loop
auto	2.6438877147254303	0.0	discard	16_3_in_5	Parallel run loop
auto	5.311268372818509	0.0	discard	42_3_in_4	Parallel run loop
auto	4.572590739621241	0.0	discard	44_3_in_5	Parallel run loop
auto	4.120996670385742	0.0	discard	37_3_in_5	Parallel run loop
auto	3.884218075618089	0.0	discard	33_3_in_5	Parallel run loop
auto	4.915625872347349	0.0	discard	36_3_in_4	Parallel run loop
auto	4.209828242224128	0.0	discard	38_3_in_5	Parallel run loop
auto	5.946967979994372	0.0	discard	48_3_in_4	Parallel run loop
auto	4.853529562132143	0.0	discard	47_3_in_5	Parallel run loop
auto	3.6899556465884937	0.0	discard	30_3_in_5	Parallel run loop
auto	4.894899033642789	0.0	discard	48_3_in_5	Parallel run loop
auto	4.816471150651467	0.0	discard	35_3_in_4	Parallel run loop
auto	2.0821567498332754	0.0	discard	10_3_in_5	Parallel run loop
auto	2.3777269333022377	0.0	discard	13_3_in_5	Parallel run loop
auto	2.8200685004394157	0.0	discard	18_3_in_5	Parallel run loop
auto	3.955310952667762	0.0	discard	34_3_in_5	Parallel run loop
auto	3.05921591174379	0.0	discard	21_3_in_5	Parallel run loop
auto	3.358216079635682	0.0	discard	25_3_in_5	Parallel run loop
auto	4.447192192146039	0.0	discard	42_3_in_5	Parallel run loop
auto	1.741520770223661	0.0	discard	7_3_in_5	Parallel run loop
auto	3.1963897255840794	0.0	discard	23_3_in_5	Parallel run loop
auto	4.091271349279114	0.0	discard	36_3_in_5	Parallel run loop
auto	2.7319232459426477	0.0	discard	17_3_in_5	Parallel run loop
auto	3.8608263972409755	0.0	discard	23_3_in_4	Parallel run loop
auto	2.2816481127522126	0.0	discard	12_3_in_5	Parallel run loop
auto	4.2975919889362055	0.0	discard	39_3_in_5	Parallel run loop
auto	4.202465385370532	0.0	discard	27_3_in_4	Parallel run loop
auto	3.619526695731555	0.0	discard	29_3_in_5	Parallel run loop
auto	3.495472417044167	0.0	discard	27_3_in_5	Parallel run loop
auto	5.359237027459405	0.0	discard	42_3_in_4	Parallel run loop
auto	2.636656870206178	0.0	discard	16_3_in_5	Parallel run loop
auto	4.474688448301578	0.0	discard	43_3_in_5	Parallel run loop
auto	1.9760299001296233	0.0	discard	9_3_in_5	Parallel run loop
auto	2.555678465883357	0.0	discard	15_3_in_5	Parallel run loop
auto	4.608433735991281	0.0	discard	44_3_in_5	Parallel run loop
auto	4.117743525315562	0.0	discard	37_3_in_5	Parallel run loop
auto	2.4678213233976103	0.0	discard	14_3_in_5	Parallel run loop
auto	4.2073404454031555	0.0	discard	38_3_in_5	Parallel run loop
auto	4.689279261767693	0.0	discard	45_3_in_5	Parallel run loop
auto	3.6928606376399267	0.0	discard	30_3_in_5	Parallel run loop
auto	5.9776538219821225	0.0	discard	48_3_in_4	Parallel run loop
auto	1.612334936447202	0.0	discard	6_3_in_5	Parallel run loop
auto	4.952487030382339	0.0	discard	48_3_in_5	Parallel run loop
auto	2.082192480955474	0.0	discard	10_3_in_5	Parallel run loop
auto	4.5195058594993895	0.0	discard	31_3_in_4	Parallel run loop
auto	1.4717154757482183	0.0	keep	5_3_in_5	Parallel run loop
auto	1.741521221301153	0.0	discard	7_3_in_5	Parallel run loop
auto	2.8236853756498417	0.0	discard	18_3_in_5	Parallel run loop
auto	4.023372187251647	0.0	discard	35_3_in_5	Parallel run loop
auto	4.441890804372221	0.0	discard	30_3_in_4	Parallel run loop
auto	3.3567483212266356	0.0	discard	25_3_in_5	Parallel run loop
auto	4.48316846774775	0.0	discard	42_3_in_5	Parallel run loop
auto	3.129204340694294	0.0	discard	22_3_in_5	Parallel run loop
auto	4.755190055921902	0.0	discard	34_3_in_4	Parallel run loop
auto	4.963580242468016	0.0	discard	49_3_in_5	Parallel run loop
auto	4.31071927174737	0.0	discard	40_3_in_5	Parallel run loop
auto	3.6179798192113863	0.0	discard	29_3_in_5	Parallel run loop
auto	2.2805368354963758	0.0	discard	12_3_in_5	Parallel run loop
auto	2.976022174399324	0.0	discard	20_3_in_5	Parallel run loop
auto	3.488650837088868	0.0	discard	19_3_in_4	Parallel run loop
auto	5.5830839181587875	0.0	discard	44_3_in_4	Parallel run loop
auto	4.667508287200281	0.0	discard	33_3_in_4	Parallel run loop
auto	4.573434105529997	0.0	discard	43_3_in_5	Parallel run loop
auto	2.6418969462180266	0.0	discard	16_3_in_5	Parallel run loop
auto	5.374594355996011	0.0	discard	42_3_in_4	Parallel run loop
auto	5.689739198883511	0.0	discard	46_3_in_4	Parallel run loop
auto	4.112444628681092	0.0	discard	37_3_in_5	Parallel run loop
auto	5.698753170775475	0.0	discard	45_3_in_4	Parallel run loop
auto	4.712788992696744	0.0	discard	45_3_in_5	Parallel run loop
auto	5.213009881243715	0.0	discard	41_3_in_4	Parallel run loop
auto	2.1849726914991363	0.0	discard	11_3_in_5	Parallel run loop
auto	4.232610837986472	0.0	discard	38_3_in_5	Parallel run loop
auto	3.693823797733613	0.0	discard	30_3_in_5	Parallel run loop
auto	1.473594118390091	0.0	discard	5_3_in_5	Parallel run loop
auto	5.078565434721058	0.0	discard	38_3_in_4	Parallel run loop
auto	1.8618305143111635	0.0	discard	8_3_in_5	Parallel run loop
auto	4.429927492405404	0.0	discard	30_3_in_4	Parallel run loop
auto	4.897610570157744	0.0	discard	47_3_in_5	Parallel run loop
auto	3.8887981448770907	0.0	discard	33_3_in_5	Parallel run loop
auto	4.840708009893318	0.0	discard	35_3_in_4	Parallel run loop
auto	3.9519068491809177	0.0	discard	24_3_in_4	Parallel run loop
auto	2.3735653384503954	0.0	keep	13_3_in_5	Parallel run loop
auto	3.4265937945984533	0.0	discard	26_3_in_5	Parallel run loop
auto	4.495331778266723	0.0	discard	42_3_in_5	Parallel run loop
auto	4.764512564221682	0.0	discard	34_3_in_4	Parallel run loop
auto	3.13577331215726	0.0	discard	22_3_in_5	Parallel run loop
auto	3.2064324599122767	0.0	discard	23_3_in_5	Parallel run loop
auto	3.956454504327308	0.0	discard	34_3_in_5	Parallel run loop
auto	2.9716883690367526	0.0	discard	20_3_in_5	Parallel run loop
auto	3.6104773748344225	0.0	discard	29_3_in_5	Parallel run loop
auto	2.282343386524282	0.0	discard	12_3_in_5	Parallel run loop
auto	4.236170942224652	0.0	discard	39_3_in_5	Parallel run loop
auto	5.157303844649163	0.0	discard	39_3_in_4	Parallel run loop
auto	2.7252674766822715	0.0	discard	17_3_in_5	Parallel run loop
auto	2.857662484438064	0.0	discard	13_3_in_4	Parallel run loop
auto	4.717631832716371	0.0	discard	46_3_in_5	Parallel run loop
auto	5.374550409844722	0.0	discard	42_3_in_4	Parallel run loop
auto	5.672483923821609	0.0	discard	46_3_in_4	Parallel run loop
auto	4.116232553171244	0.0	discard	37_3_in_5	Parallel run loop
auto	3.749181083423319	0.0	discard	22_3_in_4	Parallel run loop
auto	3.8625834624759565	0.0	discard	23_3_in_4	Parallel run loop
auto	5.311346813901449	0.0	discard	41_3_in_4	Parallel run loop
auto	3.4941017353977895	0.0	discard	27_3_in_5	Parallel run loop
auto	3.7404109479860237	0.0	discard	31_3_in_5	Parallel run loop
