commit	score	memory_gb	status	problem	description
auto	9.748219324694178	0.0	discard	32_4_in_3	Parallel run loop
auto	9.931786194765044	0.0	discard	34_4_in_3	Parallel run loop
auto	4.438079146634743	0.0	discard	5_6_in_4	Parallel run loop
auto	10.940553511555468	0.0	discard	41_4_in_3	Parallel run loop
auto	8.777281780065374	0.0	discard	27_4_in_3	Parallel run loop
auto	6.156313508302863	0.0	discard	11_4_in_3	Parallel run loop
auto	8.619398901246518	0.0	discard	25_4_in_3	Parallel run loop
auto	8.568395832409651	0.0	discard	24_4_in_3	Parallel run loop
auto	7.15750196563385	0.0	discard	16_4_in_3	Parallel run loop
auto	10.087378355933945	0.0	discard	36_4_in_3	Parallel run loop
auto	5.155861673652515	0.0	discard	7_4_in_3	Parallel run loop
auto	4.154750717508222	0.0	discard	4_4_in_3	Parallel run loop
auto	9.426331391908217	0.0	discard	30_4_in_3	Parallel run loop
auto	11.01851023958955	0.0	discard	43_4_in_3	Parallel run loop
auto	6.339849586688972	0.0	discard	11_6_in_4	Parallel run loop
auto	10.01756455102368	0.0	discard	35_4_in_3	Parallel run loop
auto	10.947326139296766	0.0	discard	42_4_in_3	Parallel run loop
auto	4.814436351262699	0.0	discard	6_6_in_4	Parallel run loop
auto	10.734548854156785	0.0	discard	40_4_in_3	Parallel run loop
auto	10.625528379341857	0.0	discard	39_4_in_3	Parallel run loop
auto	7.321655420249306	0.0	discard	16_6_in_4	Parallel run loop
auto	7.7379955374790645	0.0	discard	18_6_in_4	Parallel run loop
auto	5.464261083124018	0.0	discard	10_4_in_3	Parallel run loop
auto	3.2320607503195915	0.0	discard	3_4_in_3	Parallel run loop
auto	7.47650969637775	0.0	discard	19_4_in_3	Parallel run loop
auto	9.455403984086399	0.0	discard	27_6_in_4	Parallel run loop
auto	6.465828989260902	0.0	discard	14_4_in_3	Parallel run loop
auto	7.6118300851610385	0.0	discard	17_6_in_4	Parallel run loop
auto	7.387955541169579	0.0	discard	18_4_in_3	Parallel run loop
auto	9.235193419721474	0.0	discard	29_4_in_3	Parallel run loop
auto	8.388805753357856	0.0	keep	21_6_in_4	Parallel run loop
auto	9.622155676435591	0.0	discard	31_4_in_3	Parallel run loop
auto	4.4402975277080206	0.0	discard	5_6_in_4	Parallel run loop
auto	9.81626260602841	0.0	discard	32_4_in_3	Parallel run loop
auto	9.97856733021505	0.0	discard	34_4_in_3	Parallel run loop
auto	8.563014759510843	0.0	discard	25_4_in_3	Parallel run loop
auto	8.893973736111443	0.0	discard	27_4_in_3	Parallel run loop
auto	6.388840407653808	0.0	discard	12_6_in_4	Parallel run loop
auto	8.591953675831972	0.0	discard	24_4_in_3	Parallel run loop
auto	6.1559260035413	0.0	discard	11_4_in_3	Parallel run loop
auto	10.925576039713834	0.0	discard	41_4_in_3	Parallel run loop
auto	8.802642295860062	0.0	discard	24_6_in_4	Parallel run loop
auto	10.938599347826347	0.0	discard	43_4_in_3	Parallel run loop
auto	8.17655419606886	0.0	discard	22_4_in_3	Parallel run loop
auto	10.097240077527125	0.0	discard	36_4_in_3	Parallel run loop
auto	10.776309862715156	0.0	discard	40_4_in_3	Parallel run loop
auto	7.7379955374790645	0.0	discard	18_6_in_4	Parallel run loop
auto	10.100856434129922	0.0	discard	35_4_in_3	Parallel run loop
auto	10.940453535155875	0.0	discard	42_4_in_3	Parallel run loop
auto	4.813853256562242	0.0	discard	6_6_in_4	Parallel run loop
auto	7.929378074021842	0.0	discard	19_6_in_4	Parallel run loop
auto	4.3094996669154355	0.0	discard	6_4_in_3	Parallel run loop
auto	5.464261083124018	0.0	discard	10_4_in_3	Parallel run loop
auto	4.154750717508222	0.0	discard	4_4_in_3	Parallel run loop
auto	10.599771163337323	0.0	discard	39_4_in_3	Parallel run loop
auto	7.314643766276765	0.0	discard	17_4_in_3	Parallel run loop
auto	10.47736351943713	0.0	discard	38_4_in_3	Parallel run loop
auto	9.513940573292547	0.0	discard	27_6_in_4	Parallel run loop
auto	6.10550490885787	0.0	discard	10_6_in_4	Parallel run loop
auto	7.387955541169579	0.0	discard	18_4_in_3	Parallel run loop
auto	8.668469913995917	0.0	discard	23_6_in_4	Parallel run loop
auto	8.43048885754377	0.0	discard	21_6_in_4	Parallel run loop
auto	5.309910838673369	0.0	discard	9_4_in_3	Parallel run loop
auto	5.310951552627792	0.0	discard	8_4_in_3	Parallel run loop
auto	9.659578206958082	0.0	discard	32_4_in_3	Parallel run loop
auto	9.942756554192467	0.0	discard	34_4_in_3	Parallel run loop
auto	8.541657663661779	0.0	discard	24_4_in_3	Parallel run loop
auto	8.563014759510843	0.0	discard	25_4_in_3	Parallel run loop
auto	5.518467821941	0.0	discard	9_6_in_4	Parallel run loop
auto	9.54070433367155	0.0	discard	31_4_in_3	Parallel run loop
auto	8.819050170221848	0.0	discard	27_4_in_3	Parallel run loop
auto	6.309719735191199	0.0	discard	12_4_in_3	Parallel run loop
auto	10.928481796362327	0.0	discard	41_4_in_3	Parallel run loop
auto	8.802553337531233	0.0	discard	24_6_in_4	Parallel run loop
auto	8.578042711805615	0.0	discard	22_6_in_4	Parallel run loop
auto	11.01851023958955	0.0	discard	43_4_in_3	Parallel run loop
auto	4.813853256562242	0.0	discard	6_6_in_4	Parallel run loop
auto	9.93298811681792	0.0	keep	36_4_in_3	Parallel run loop
auto	7.730063257741899	0.0	discard	18_6_in_4	Parallel run loop
auto	5.464284052078732	0.0	discard	10_4_in_3	Parallel run loop
auto	10.92685747137244	0.0	keep	42_4_in_3	Parallel run loop
auto	10.776309862715156	0.0	discard	40_4_in_3	Parallel run loop
auto	3.7250031912651163	0.0	discard	4_6_in_4	Parallel run loop
auto	3.4919620863456333	0.0	discard	3_6_in_4	Parallel run loop
auto	10.043200894965349	0.0	discard	35_4_in_3	Parallel run loop
auto	10.619926529082107	0.0	discard	39_4_in_3	Parallel run loop
auto	4.309409782028365	0.0	discard	5_4_in_3	Parallel run loop
auto	10.549071817935308	0.0	discard	38_4_in_3	Parallel run loop
auto	9.387012158269462	0.0	discard	30_4_in_3	Parallel run loop
auto	7.15750196563385	0.0	discard	16_4_in_3	Parallel run loop
auto	6.339849586688972	0.0	discard	11_6_in_4	Parallel run loop
auto	9.513940573292547	0.0	discard	27_6_in_4	Parallel run loop
auto	7.387955541169579	0.0	discard	18_4_in_3	Parallel run loop
auto	5.309910838673369	0.0	discard	9_4_in_3	Parallel run loop
auto	3.232052318453766	0.0	discard	3_4_in_3	Parallel run loop
auto	8.465628025883607	0.0	discard	24_4_in_3	Parallel run loop
auto	4.154750717508222	0.0	discard	4_4_in_3	Parallel run loop
auto	8.620168250920733	0.0	discard	25_4_in_3	Parallel run loop
auto	9.723301078217673	0.0	discard	32_4_in_3	Parallel run loop
auto	6.965068880086202	0.0	discard	15_6_in_4	Parallel run loop
auto	7.626602931549492	0.0	discard	17_6_in_4	Parallel run loop
auto	9.931246793297	0.0	discard	34_4_in_3	Parallel run loop
auto	8.793324245426204	0.0	discard	27_4_in_3	Parallel run loop
auto	9.630362326238838	0.0	discard	31_4_in_3	Parallel run loop
auto	6.465828989260902	0.0	discard	14_4_in_3	Parallel run loop
auto	6.388840407653808	0.0	discard	12_6_in_4	Parallel run loop
auto	10.858375939486251	0.0	discard	41_4_in_3	Parallel run loop
auto	10.088422645839744	0.0	discard	36_4_in_3	Parallel run loop
auto	8.583374246046413	0.0	discard	22_6_in_4	Parallel run loop
auto	11.01851023958955	0.0	discard	43_4_in_3	Parallel run loop
auto	3.7250031912651163	0.0	discard	4_6_in_4	Parallel run loop
auto	10.938891194679247	0.0	discard	42_4_in_3	Parallel run loop
auto	5.464170765559673	0.0	discard	10_4_in_3	Parallel run loop
auto	10.776309862715156	0.0	discard	40_4_in_3	Parallel run loop
auto	7.730063257741899	0.0	discard	18_6_in_4	Parallel run loop
auto	10.01756455102368	0.0	discard	35_4_in_3	Parallel run loop
auto	8.235860320707761	0.0	discard	22_4_in_3	Parallel run loop
auto	4.309409782028365	0.0	discard	5_4_in_3	Parallel run loop
auto	7.620768472631966	0.0	discard	20_4_in_3	Parallel run loop
auto	10.553856672609996	0.0	discard	39_4_in_3	Parallel run loop
auto	9.426331391908217	0.0	discard	30_4_in_3	Parallel run loop
auto	7.929378074021842	0.0	discard	19_6_in_4	Parallel run loop
auto	4.3094996669154355	0.0	discard	6_4_in_3	Parallel run loop
auto	7.387955541169579	0.0	discard	18_4_in_3	Parallel run loop
auto	9.470140881710233	0.0	discard	27_6_in_4	Parallel run loop
auto	5.309910838673369	0.0	discard	9_4_in_3	Parallel run loop
auto	8.553044291559809	0.0	discard	24_4_in_3	Parallel run loop
auto	7.309824033492363	0.0	discard	17_4_in_3	Parallel run loop
auto	8.627146868055858	0.0	discard	25_4_in_3	Parallel run loop
auto	9.743762411586093	0.0	discard	32_4_in_3	Parallel run loop
auto	8.666274702120212	0.0	discard	23_6_in_4	Parallel run loop
auto	9.859456383527776	0.0	discard	34_4_in_3	Parallel run loop
auto	6.107071604883561	0.0	discard	10_6_in_4	Parallel run loop
auto	5.309456355946519	0.0	discard	8_4_in_3	Parallel run loop
auto	8.793324245426204	0.0	discard	27_4_in_3	Parallel run loop
auto	6.389836172109448	0.0	discard	12_6_in_4	Parallel run loop
auto	7.471317325000314	0.0	discard	19_4_in_3	Parallel run loop
auto	10.940553511555468	0.0	discard	41_4_in_3	Parallel run loop
auto	11.084714241479588	0.0	discard	43_4_in_3	Parallel run loop
auto	10.090481997169428	0.0	discard	36_4_in_3	Parallel run loop
auto	9.472120229746906	0.0	discard	31_4_in_3	Parallel run loop
auto	4.154707933020685	0.0	discard	4_4_in_3	Parallel run loop
auto	3.7250037826503797	0.0	discard	4_6_in_4	Parallel run loop
auto	7.321655420249306	0.0	discard	16_6_in_4	Parallel run loop
auto	5.464426528891365	0.0	discard	10_4_in_3	Parallel run loop
auto	7.766032072953816	0.0	discard	18_6_in_4	Parallel run loop
auto	9.978484550475846	0.0	discard	35_4_in_3	Parallel run loop
auto	10.963768808251237	0.0	discard	42_4_in_3	Parallel run loop
auto	7.619752690266041	0.0	discard	20_4_in_3	Parallel run loop
auto	5.518243205207405	0.0	discard	9_6_in_4	Parallel run loop
auto	10.776309862715156	0.0	discard	40_4_in_3	Parallel run loop
auto	10.599771163337323	0.0	discard	39_4_in_3	Parallel run loop
auto	9.471674556783666	0.0	discard	30_4_in_3	Parallel run loop
auto	6.3099065073493055	0.0	discard	12_4_in_3	Parallel run loop
auto	9.155322484320232	0.0	keep	29_4_in_3	Parallel run loop
auto	9.492725968698753	0.0	discard	27_6_in_4	Parallel run loop
auto	7.387955541169579	0.0	discard	18_4_in_3	Parallel run loop
auto	8.627146868055858	0.0	discard	25_4_in_3	Parallel run loop
auto	5.309910838673369	0.0	discard	9_4_in_3	Parallel run loop
auto	7.3117146997828435	0.0	discard	17_4_in_3	Parallel run loop
auto	9.778644827556382	0.0	discard	32_4_in_3	Parallel run loop
auto	8.620972216247035	0.0	discard	24_4_in_3	Parallel run loop
auto	8.691431098054807	0.0	discard	23_6_in_4	Parallel run loop
auto	3.491959731325357	0.0	discard	3_6_in_4	Parallel run loop
auto	9.933537883294077	0.0	discard	34_4_in_3	Parallel run loop
auto	4.438938361146937	0.0	discard	5_6_in_4	Parallel run loop
auto	11.01851023958955	0.0	discard	43_4_in_3	Parallel run loop
auto	8.787911269234767	0.0	discard	27_4_in_3	Parallel run loop
auto	8.778031375178879	0.0	discard	28_4_in_3	Parallel run loop
auto	6.1565716198033105	0.0	discard	11_4_in_3	Parallel run loop
auto	10.940638114596652	0.0	discard	41_4_in_3	Parallel run loop
auto	9.472120229746906	0.0	discard	31_4_in_3	Parallel run loop
auto	10.083766968179313	0.0	discard	36_4_in_3	Parallel run loop
auto	4.154750717508222	0.0	discard	4_4_in_3	Parallel run loop
auto	6.338931668269073	0.0	discard	11_6_in_4	Parallel run loop
auto	7.15750196563385	0.0	discard	16_4_in_3	Parallel run loop
auto	7.732841467558333	0.0	discard	18_6_in_4	Parallel run loop
auto	3.232052318453766	0.0	discard	3_4_in_3	Parallel run loop
auto	10.09033025722551	0.0	discard	35_4_in_3	Parallel run loop
auto	5.518209420977355	0.0	discard	9_6_in_4	Parallel run loop
auto	11.108688289472683	0.0	discard	42_4_in_3	Parallel run loop
auto	10.776309862715156	0.0	discard	40_4_in_3	Parallel run loop
auto	6.964032152020095	0.0	discard	15_6_in_4	Parallel run loop
auto	9.388275547398601	0.0	discard	30_4_in_3	Parallel run loop
auto	10.599771163337323	0.0	discard	39_4_in_3	Parallel run loop
auto	6.309742244641608	0.0	discard	12_4_in_3	Parallel run loop
auto	9.246638397085151	0.0	discard	29_4_in_3	Parallel run loop
auto	8.619398901246518	0.0	discard	25_4_in_3	Parallel run loop
auto	7.4649060914044565	0.0	discard	18_4_in_3	Parallel run loop
auto	9.494664213518936	0.0	discard	27_6_in_4	Parallel run loop
auto	7.626602931549492	0.0	discard	17_6_in_4	Parallel run loop
auto	6.465828989260902	0.0	discard	14_4_in_3	Parallel run loop
auto	9.659578206958082	0.0	discard	32_4_in_3	Parallel run loop
auto	8.235227417004392	0.0	discard	22_4_in_3	Parallel run loop
auto	9.781117907555876	0.0	keep	34_4_in_3	Parallel run loop
auto	3.491959731325357	0.0	discard	3_6_in_4	Parallel run loop
auto	8.541657663661779	0.0	discard	24_4_in_3	Parallel run loop
auto	8.890225068412505	0.0	discard	27_4_in_3	Parallel run loop
auto	11.01851023958955	0.0	discard	43_4_in_3	Parallel run loop
auto	4.3094996669154355	0.0	discard	6_4_in_3	Parallel run loop
auto	8.829708445580817	0.0	discard	24_6_in_4	Parallel run loop
auto	7.929378074021842	0.0	discard	19_6_in_4	Parallel run loop
auto	7.764013147826299	0.0	discard	18_6_in_4	Parallel run loop
auto	9.619043541412415	0.0	discard	31_4_in_3	Parallel run loop
auto	10.127216022213453	0.0	discard	36_4_in_3	Parallel run loop
auto	6.105336428074948	0.0	discard	10_6_in_4	Parallel run loop
auto	6.339849586688972	0.0	discard	11_6_in_4	Parallel run loop
auto	10.67098149521078	0.0	discard	38_4_in_3	Parallel run loop
auto	10.954631231581505	0.0	discard	41_4_in_3	Parallel run loop
auto	10.963768808251237	0.0	discard	42_4_in_3	Parallel run loop
auto	3.2320607503195915	0.0	discard	3_4_in_3	Parallel run loop
auto	10.024237774570201	0.0	discard	35_4_in_3	Parallel run loop
auto	5.309763263875329	0.0	discard	8_4_in_3	Parallel run loop
auto	10.790271115595846	0.0	discard	40_4_in_3	Parallel run loop
auto	6.964000014504972	0.0	discard	15_6_in_4	Parallel run loop
auto	10.599771163337323	0.0	discard	39_4_in_3	Parallel run loop
auto	9.411542589474388	0.0	discard	30_4_in_3	Parallel run loop
auto	4.154750717508222	0.0	discard	4_4_in_3	Parallel run loop
auto	8.619398901246518	0.0	discard	25_4_in_3	Parallel run loop
auto	7.471317325000314	0.0	discard	19_4_in_3	Parallel run loop
auto	9.455403984086399	0.0	discard	27_6_in_4	Parallel run loop
auto	7.387785192386595	0.0	discard	18_4_in_3	Parallel run loop
auto	7.321045141554854	0.0	discard	16_6_in_4	Parallel run loop
auto	8.583622466271388	0.0	discard	22_6_in_4	Parallel run loop
auto	9.807451120192226	0.0	discard	32_4_in_3	Parallel run loop
auto	5.154784542108047	0.0	discard	7_4_in_3	Parallel run loop
auto	9.930000949909395	0.0	discard	34_4_in_3	Parallel run loop
auto	8.541657663661779	0.0	discard	24_4_in_3	Parallel run loop
auto	4.439000354968679	0.0	discard	5_6_in_4	Parallel run loop
auto	6.757360875104138	0.0	discard	13_6_in_4	Parallel run loop
auto	11.01851023958955	0.0	discard	43_4_in_3	Parallel run loop
auto	6.155976403489312	0.0	discard	11_4_in_3	Parallel run loop
auto	8.793324245426204	0.0	discard	27_4_in_3	Parallel run loop
auto	9.71074039755066	0.0	discard	31_4_in_3	Parallel run loop
auto	7.895559522258137	0.0	discard	18_6_in_4	Parallel run loop
auto	8.778031375178879	0.0	discard	28_4_in_3	Parallel run loop
auto	10.143929657656013	0.0	discard	36_4_in_3	Parallel run loop
auto	6.105363004468739	0.0	discard	10_6_in_4	Parallel run loop
auto	4.309409782028365	0.0	discard	5_4_in_3	Parallel run loop
auto	10.940638114596652	0.0	discard	41_4_in_3	Parallel run loop
auto	7.15750196563385	0.0	discard	16_4_in_3	Parallel run loop
auto	3.232052318453766	0.0	discard	3_4_in_3	Parallel run loop
auto	4.814811523641814	0.0	discard	6_6_in_4	Parallel run loop
auto	10.023868786739488	0.0	discard	35_4_in_3	Parallel run loop
auto	10.947326139296766	0.0	discard	42_4_in_3	Parallel run loop
auto	6.465828989260902	0.0	discard	14_4_in_3	Parallel run loop
auto	10.776309862715156	0.0	discard	40_4_in_3	Parallel run loop
auto	7.626602931549492	0.0	discard	17_6_in_4	Parallel run loop
auto	10.629098076349557	0.0	discard	39_4_in_3	Parallel run loop
auto	8.621102567739802	0.0	discard	25_4_in_3	Parallel run loop
auto	6.388840407653808	0.0	discard	12_6_in_4	Parallel run loop
auto	9.492725968698753	0.0	discard	27_6_in_4	Parallel run loop
auto	7.4645934216366685	0.0	discard	18_4_in_3	Parallel run loop
auto	7.317715611254468	0.0	discard	16_6_in_4	Parallel run loop
auto	7.471317325000314	0.0	discard	19_4_in_3	Parallel run loop
auto	5.155053785931084	0.0	discard	7_4_in_3	Parallel run loop
auto	9.635678491132731	0.0	discard	32_4_in_3	Parallel run loop
auto	8.578042711805615	0.0	discard	22_6_in_4	Parallel run loop
auto	8.522156032410958	0.0	discard	24_4_in_3	Parallel run loop
auto	9.942756554192467	0.0	discard	34_4_in_3	Parallel run loop
auto	4.438079146634743	0.0	discard	5_6_in_4	Parallel run loop
auto	6.759508156569627	0.0	discard	13_6_in_4	Parallel run loop
auto	6.156158862392684	0.0	discard	11_4_in_3	Parallel run loop
auto	8.710054883820813	0.0	discard	27_4_in_3	Parallel run loop
auto	10.793099502019745	0.0	keep	41_4_in_3	Parallel run loop
auto	9.48849637296931	0.0	discard	31_4_in_3	Parallel run loop
auto	11.103647942559064	0.0	discard	43_4_in_3	Parallel run loop
auto	6.105491953617294	0.0	discard	10_6_in_4	Parallel run loop
auto	4.154707933020685	0.0	discard	4_4_in_3	Parallel run loop
auto	9.255840516534487	0.0	discard	26_6_in_4	Parallel run loop
auto	7.9061745767615585	0.0	discard	18_6_in_4	Parallel run loop
auto	8.169007764022572	0.0	discard	22_4_in_3	Parallel run loop
auto	10.098856662009045	0.0	discard	36_4_in_3	Parallel run loop
auto	3.232052318453766	0.0	discard	3_4_in_3	Parallel run loop
auto	7.742742602208797	0.0	discard	21_4_in_3	Parallel run loop
auto	9.96978936594856	0.0	discard	35_4_in_3	Parallel run loop
auto	10.947326139296766	0.0	discard	42_4_in_3	Parallel run loop
auto	7.6219607966966265	0.0	discard	20_4_in_3	Parallel run loop
auto	10.776309862715156	0.0	discard	40_4_in_3	Parallel run loop
auto	8.809587606435105	0.0	discard	24_6_in_4	Parallel run loop
auto	10.599771163337323	0.0	discard	39_4_in_3	Parallel run loop
auto	8.627146868055858	0.0	discard	25_4_in_3	Parallel run loop
auto	9.492725968698753	0.0	discard	27_6_in_4	Parallel run loop
auto	7.932811760780142	0.0	discard	19_6_in_4	Parallel run loop
auto	7.387785192386595	0.0	discard	18_4_in_3	Parallel run loop
auto	5.15538249832505	0.0	discard	7_4_in_3	Parallel run loop
auto	7.314643766276765	0.0	discard	17_4_in_3	Parallel run loop
auto	4.3094996669154355	0.0	discard	6_4_in_3	Parallel run loop
auto	9.7852784482145	0.0	discard	32_4_in_3	Parallel run loop
auto	8.583374246046413	0.0	discard	22_6_in_4	Parallel run loop
auto	10.54730395235312	0.0	discard	38_4_in_3	Parallel run loop
auto	9.934621969128687	0.0	discard	34_4_in_3	Parallel run loop
auto	8.541657663661779	0.0	discard	24_4_in_3	Parallel run loop
auto	6.156893685363397	0.0	discard	11_4_in_3	Parallel run loop
auto	8.863359895089951	0.0	discard	27_4_in_3	Parallel run loop
auto	11.079659249974432	0.0	discard	41_4_in_3	Parallel run loop
auto	8.668732316988185	0.0	discard	23_6_in_4	Parallel run loop
auto	9.635390066119172	0.0	discard	31_4_in_3	Parallel run loop
auto	11.01851023958955	0.0	discard	43_4_in_3	Parallel run loop
auto	7.891441860326138	0.0	discard	18_6_in_4	Parallel run loop
auto	6.105491953617294	0.0	discard	10_6_in_4	Parallel run loop
auto	4.154750717508222	0.0	discard	4_4_in_3	Parallel run loop
auto	8.1695937920627	0.0	discard	22_4_in_3	Parallel run loop
auto	10.143929657656013	0.0	discard	36_4_in_3	Parallel run loop
auto	5.309456355946519	0.0	discard	8_4_in_3	Parallel run loop
auto	5.518386109617193	0.0	discard	9_6_in_4	Parallel run loop
auto	6.309487118510109	0.0	keep	12_4_in_3	Parallel run loop
auto	10.93955256506185	0.0	discard	42_4_in_3	Parallel run loop
auto	10.102256807489026	0.0	discard	35_4_in_3	Parallel run loop
auto	3.7250037826503797	0.0	discard	4_6_in_4	Parallel run loop
auto	10.786341192256783	0.0	discard	40_4_in_3	Parallel run loop
auto	9.162858936716923	0.0	discard	29_4_in_3	Parallel run loop
auto	10.599771163337323	0.0	discard	39_4_in_3	Parallel run loop
auto	3.4919620863456333	0.0	discard	3_6_in_4	Parallel run loop
auto	9.455403984086399	0.0	discard	27_6_in_4	Parallel run loop
auto	8.778031375178879	0.0	discard	28_4_in_3	Parallel run loop
auto	7.387955541169579	0.0	discard	18_4_in_3	Parallel run loop
auto	8.556205176387037	0.0	discard	25_4_in_3	Parallel run loop
auto	4.309409782028365	0.0	discard	5_4_in_3	Parallel run loop
auto	7.15750196563385	0.0	discard	16_4_in_3	Parallel run loop
auto	9.775183849920632	0.0	discard	32_4_in_3	Parallel run loop
auto	8.465628025883607	0.0	discard	24_4_in_3	Parallel run loop
auto	9.859456383527776	0.0	discard	34_4_in_3	Parallel run loop
auto	10.482628060400357	0.0	discard	38_4_in_3	Parallel run loop
auto	6.339849586688972	0.0	discard	11_6_in_4	Parallel run loop
auto	8.893973736111443	0.0	discard	27_4_in_3	Parallel run loop
auto	4.814811523641814	0.0	discard	6_6_in_4	Parallel run loop
auto	7.730063257741899	0.0	discard	18_6_in_4	Parallel run loop
auto	11.01851023958955	0.0	discard	43_4_in_3	Parallel run loop
auto	10.940553511555468	0.0	discard	41_4_in_3	Parallel run loop
auto	6.964504529811943	0.0	discard	15_6_in_4	Parallel run loop
auto	6.465828989260902	0.0	discard	14_4_in_3	Parallel run loop
auto	9.526816723345474	0.0	discard	31_4_in_3	Parallel run loop
auto	7.606741618201064	0.0	discard	17_6_in_4	Parallel run loop
auto	5.518363429384226	0.0	discard	9_6_in_4	Parallel run loop
auto	8.154847614937545	0.0	keep	22_4_in_3	Parallel run loop
auto	6.105830236540242	0.0	discard	10_6_in_4	Parallel run loop
auto	6.309610676595008	0.0	discard	12_4_in_3	Parallel run loop
auto	6.3875537765814325	0.0	discard	12_6_in_4	Parallel run loop
auto	9.979446891609653	0.0	discard	36_4_in_3	Parallel run loop
auto	10.006441244416514	0.0	discard	35_4_in_3	Parallel run loop
auto	11.044659619702836	0.0	discard	42_4_in_3	Parallel run loop
auto	10.776309862715156	0.0	discard	40_4_in_3	Parallel run loop
auto	9.310827711934628	0.0	discard	29_4_in_3	Parallel run loop
auto	10.599771163337323	0.0	discard	39_4_in_3	Parallel run loop
auto	3.491959014509597	0.0	discard	3_6_in_4	Parallel run loop
auto	4.154750717508222	0.0	discard	4_4_in_3	Parallel run loop
auto	9.492725968698753	0.0	discard	27_6_in_4	Parallel run loop
