commit	score	memory_gb	status	problem	description
auto	1.8616888755218255	0.0	discard	8_3_in_5	Parallel run loop
auto	4.425128053433011	0.0	discard	30_3_in_4	Parallel run loop
auto	3.562813759701511	0.0	discard	28_3_in_5	Parallel run loop
auto	2.5606362223850603	0.0	discard	15_3_in_5	Parallel run loop
auto	2.4688967306173613	0.0	discard	14_3_in_5	Parallel run loop
auto	3.416285739460254	0.0	discard	26_3_in_5	Parallel run loop
auto	1.6123349438661214	0.0	discard	6_3_in_5	Parallel run loop
auto	4.201439739180242	0.0	discard	27_3_in_4	Parallel run loop
auto	3.14106685416155	0.0	discard	22_3_in_5	Parallel run loop
auto	2.374223282272644	0.0	discard	13_3_in_5	Parallel run loop
auto	4.5220566324298375	0.0	discard	31_3_in_4	Parallel run loop
auto	4.019215137712795	0.0	discard	35_3_in_5	Parallel run loop
auto	3.19329960068489	0.0	discard	23_3_in_5	Parallel run loop
auto	3.956556800953949	0.0	discard	34_3_in_5	Parallel run loop
auto	4.4164561591819345	0.0	discard	42_3_in_5	Parallel run loop
auto	4.279514601526429	0.0	discard	28_3_in_4	Parallel run loop
auto	2.971026839691382	0.0	discard	20_3_in_5	Parallel run loop
auto	3.8164288337255727	0.0	discard	32_3_in_5	Parallel run loop
auto	4.935938486384009	0.0	discard	37_3_in_4	Parallel run loop
auto	5.12059465222729	0.0	discard	39_3_in_4	Parallel run loop
auto	4.285230877236812	0.0	discard	39_3_in_5	Parallel run loop
auto	2.729044607375285	0.0	discard	17_3_in_5	Parallel run loop
auto	2.8582540205428524	0.0	discard	13_3_in_4	Parallel run loop
auto	4.126620081555289	0.0	discard	37_3_in_5	Parallel run loop
auto	4.98873841659809	0.0	discard	49_3_in_5	Parallel run loop
auto	5.311642457987124	0.0	discard	42_3_in_4	Parallel run loop
auto	4.749867816181471	0.0	discard	46_3_in_5	Parallel run loop
auto	3.755720236755241	0.0	discard	22_3_in_4	Parallel run loop
auto	5.851850638772317	0.0	discard	47_3_in_4	Parallel run loop
auto	4.4294758905232285	0.0	discard	41_3_in_5	Parallel run loop
auto	4.355470407153589	0.0	discard	40_3_in_5	Parallel run loop
auto	3.7544551052241784	0.0	discard	31_3_in_5	Parallel run loop
auto	1.8618724747838635	0.0	discard	8_3_in_5	Parallel run loop
auto	5.078194909884769	0.0	discard	50_3_in_5	Parallel run loop
auto	2.464591588163734	0.0	discard	14_3_in_5	Parallel run loop
auto	4.441737675619229	0.0	discard	30_3_in_4	Parallel run loop
auto	3.4936674836714294	0.0	discard	19_3_in_4	Parallel run loop
auto	3.424520048551096	0.0	discard	26_3_in_5	Parallel run loop
auto	5.237116424734032	0.0	discard	40_3_in_4	Parallel run loop
auto	5.445331421812782	0.0	discard	44_3_in_4	Parallel run loop
auto	2.376932585132274	0.0	discard	13_3_in_5	Parallel run loop
auto	4.934258753305389	0.0	discard	36_3_in_4	Parallel run loop
auto	4.677483442158049	0.0	discard	33_3_in_4	Parallel run loop
auto	2.184004462690606	0.0	discard	11_3_in_5	Parallel run loop
auto	5.679742162088725	0.0	discard	45_3_in_4	Parallel run loop
auto	4.646215964428969	0.0	discard	44_3_in_5	Parallel run loop
auto	5.014317456276139	0.0	discard	38_3_in_4	Parallel run loop
auto	3.214811773702218	0.0	discard	23_3_in_5	Parallel run loop
auto	4.48316846774775	0.0	discard	42_3_in_5	Parallel run loop
auto	5.156370458973232	0.0	discard	39_3_in_4	Parallel run loop
auto	3.8818585118048112	0.0	discard	33_3_in_5	Parallel run loop
auto	5.00759827031038	0.0	discard	37_3_in_4	Parallel run loop
auto	4.844170539715427	0.0	discard	47_3_in_5	Parallel run loop
auto	2.8586338031523	0.0	discard	13_3_in_4	Parallel run loop
auto	4.2800489006868725	0.0	discard	39_3_in_5	Parallel run loop
auto	4.82355633608025	0.0	discard	35_3_in_4	Parallel run loop
auto	4.887679370187197	0.0	discard	48_3_in_5	Parallel run loop
auto	2.0821032351988555	0.0	discard	10_3_in_5	Parallel run loop
auto	3.7586077940677565	0.0	discard	22_3_in_4	Parallel run loop
auto	4.690507989582655	0.0	discard	46_3_in_5	Parallel run loop
auto	5.874269763163611	0.0	discard	47_3_in_4	Parallel run loop
auto	4.459348066577679	0.0	discard	41_3_in_5	Parallel run loop
auto	4.332893743282368	0.0	discard	40_3_in_5	Parallel run loop
auto	3.9500957689134673	0.0	discard	24_3_in_4	Parallel run loop
auto	1.7415214586440524	0.0	discard	7_3_in_5	Parallel run loop
auto	1.862273628753661	0.0	discard	8_3_in_5	Parallel run loop
auto	2.4695811917504584	0.0	discard	14_3_in_5	Parallel run loop
auto	4.5970322416396225	0.0	discard	32_3_in_4	Parallel run loop
auto	5.621508897352507	0.0	discard	44_3_in_4	Parallel run loop
auto	3.4881096110199383	0.0	discard	27_3_in_5	Parallel run loop
auto	3.8626480110558608	0.0	discard	23_3_in_4	Parallel run loop
auto	2.5609157138887055	0.0	discard	15_3_in_5	Parallel run loop
auto	2.375362003438843	0.0	discard	13_3_in_5	Parallel run loop
auto	3.5595144306340862	0.0	discard	28_3_in_5	Parallel run loop
auto	4.202436806606633	0.0	discard	27_3_in_4	Parallel run loop
auto	4.685639810987329	0.0	discard	45_3_in_5	Parallel run loop
auto	1.6123349279648755	0.0	discard	6_3_in_5	Parallel run loop
auto	4.518206579860219	0.0	discard	31_3_in_4	Parallel run loop
auto	5.078565434721058	0.0	discard	38_3_in_4	Parallel run loop
auto	1.4723570373296153	0.0	discard	5_3_in_5	Parallel run loop
auto	4.270978267630961	0.0	discard	28_3_in_4	Parallel run loop
auto	4.005824043677923	0.0	discard	35_3_in_5	Parallel run loop
auto	3.88254236857303	0.0	discard	33_3_in_5	Parallel run loop
auto	4.064874316102221	0.0	discard	36_3_in_5	Parallel run loop
auto	4.296582505538383	0.0	discard	39_3_in_5	Parallel run loop
auto	4.829577907708746	0.0	discard	47_3_in_5	Parallel run loop
auto	4.81875319402258	0.0	discard	35_3_in_4	Parallel run loop
auto	4.742895026010762	0.0	discard	46_3_in_5	Parallel run loop
auto	3.818625116705767	0.0	discard	32_3_in_5	Parallel run loop
auto	4.892466851092141	0.0	discard	48_3_in_5	Parallel run loop
auto	5.354033574645506	0.0	discard	43_3_in_4	Parallel run loop
auto	3.6799718244326534	0.0	discard	21_3_in_4	Parallel run loop
auto	4.2976421254012696	0.0	discard	40_3_in_5	Parallel run loop
auto	4.748584891030987	0.0	discard	34_3_in_4	Parallel run loop
auto	5.000729469232406	0.0	discard	49_3_in_5	Parallel run loop
auto	1.863002713985935	0.0	discard	8_3_in_5	Parallel run loop
auto	3.956048450718379	0.0	discard	24_3_in_4	Parallel run loop
auto	3.4918692322660774	0.0	discard	19_3_in_4	Parallel run loop
auto	3.4946080655121414	0.0	discard	27_3_in_5	Parallel run loop
auto	4.596782470705274	0.0	discard	32_3_in_4	Parallel run loop
auto	5.244840757282829	0.0	discard	40_3_in_4	Parallel run loop
auto	2.9081604904777936	0.0	discard	19_3_in_5	Parallel run loop
auto	5.091176834155003	0.0	discard	50_3_in_5	Parallel run loop
auto	2.37684223131284	0.0	discard	13_3_in_5	Parallel run loop
auto	2.559499747497553	0.0	discard	15_3_in_5	Parallel run loop
auto	3.559220017523539	0.0	discard	28_3_in_5	Parallel run loop
auto	4.723494157403891	0.0	discard	45_3_in_5	Parallel run loop
auto	4.903852556960076	0.0	discard	36_3_in_4	Parallel run loop
auto	5.081264288470827	0.0	discard	38_3_in_4	Parallel run loop
auto	1.4724628250496448	0.0	discard	5_3_in_5	Parallel run loop
auto	5.76458904575124	0.0	discard	46_3_in_4	Parallel run loop
auto	4.258772328588308	0.0	discard	28_3_in_4	Parallel run loop
auto	4.002497350671502	0.0	discard	35_3_in_5	Parallel run loop
auto	1.6123349330933001	0.0	discard	6_3_in_5	Parallel run loop
auto	4.076228129168676	0.0	discard	36_3_in_5	Parallel run loop
auto	4.805429580421634	0.0	discard	35_3_in_4	Parallel run loop
auto	4.278389765532251	0.0	discard	39_3_in_5	Parallel run loop
auto	3.877229950593242	0.0	discard	33_3_in_5	Parallel run loop
auto	4.779666244041401	0.0	discard	47_3_in_5	Parallel run loop
auto	4.863085602278968	0.0	discard	48_3_in_5	Parallel run loop
auto	4.77129101399303	0.0	discard	46_3_in_5	Parallel run loop
auto	3.812416125595936	0.0	discard	32_3_in_5	Parallel run loop
auto	5.486253611839995	0.0	discard	43_3_in_4	Parallel run loop
auto	4.660363864093438	0.0	discard	33_3_in_4	Parallel run loop
auto	5.669494159712282	0.0	discard	45_3_in_4	Parallel run loop
auto	4.335426874249968	0.0	discard	40_3_in_5	Parallel run loop
auto	2.1840976433439385	0.0	discard	11_3_in_5	Parallel run loop
auto	5.290151929930984	0.0	discard	41_3_in_4	Parallel run loop
auto	4.98873841659809	0.0	discard	49_3_in_5	Parallel run loop
auto	2.817156033930347	0.0	discard	18_3_in_5	Parallel run loop
auto	4.545698950837966	0.0	discard	43_3_in_5	Parallel run loop
auto	4.3540919282396	0.0	discard	29_3_in_4	Parallel run loop
auto	3.3534012890953875	0.0	discard	25_3_in_5	Parallel run loop
auto	4.656049982961445	0.0	discard	44_3_in_5	Parallel run loop
auto	3.929484082471946	0.0	discard	34_3_in_5	Parallel run loop
auto	2.0821669026718532	0.0	discard	10_3_in_5	Parallel run loop
auto	4.916952242396287	0.0	discard	36_3_in_4	Parallel run loop
auto	1.7422884897033333	0.0	discard	7_3_in_5	Parallel run loop
auto	2.7251244774147225	0.0	discard	17_3_in_5	Parallel run loop
auto	1.6123349472565631	0.0	discard	6_3_in_5	Parallel run loop
auto	1.4735928706184067	0.0	discard	5_3_in_5	Parallel run loop
auto	4.020714631472071	0.0	discard	25_3_in_4	Parallel run loop
auto	5.785517877120283	0.0	discard	46_3_in_4	Parallel run loop
auto	4.018340396051984	0.0	discard	35_3_in_5	Parallel run loop
auto	3.8775925667556717	0.0	discard	33_3_in_5	Parallel run loop
auto	4.765639655504489	0.0	discard	47_3_in_5	Parallel run loop
auto	4.839546577991858	0.0	discard	35_3_in_4	Parallel run loop
auto	1.9758924300367413	0.0	discard	9_3_in_5	Parallel run loop
auto	4.2830134468568914	0.0	discard	28_3_in_4	Parallel run loop
auto	5.081313644131968	0.0	discard	38_3_in_4	Parallel run loop
auto	2.2811822351463933	0.0	discard	12_3_in_5	Parallel run loop
auto	3.847449455941858	0.0	discard	23_3_in_4	Parallel run loop
auto	4.885323483481671	0.0	discard	48_3_in_5	Parallel run loop
auto	3.611799876680068	0.0	discard	29_3_in_5	Parallel run loop
auto	3.7332334461675405	0.0	discard	31_3_in_5	Parallel run loop
auto	3.812414424671086	0.0	discard	32_3_in_5	Parallel run loop
auto	4.201341661288393	0.0	discard	27_3_in_4	Parallel run loop
auto	3.394770683742094	0.0	discard	18_3_in_4	Parallel run loop
auto	2.1857148273161284	0.0	discard	11_3_in_5	Parallel run loop
auto	5.351753118841093	0.0	discard	41_3_in_4	Parallel run loop
auto	4.5214004433256205	0.0	discard	31_3_in_4	Parallel run loop
auto	4.991913837014778	0.0	discard	37_3_in_4	Parallel run loop
auto	3.358406483914047	0.0	discard	25_3_in_5	Parallel run loop
auto	3.2856766685510217	0.0	discard	24_3_in_5	Parallel run loop
auto	5.050664314199193	0.0	discard	49_3_in_5	Parallel run loop
auto	3.686560150424175	0.0	discard	21_3_in_4	Parallel run loop
auto	4.9322414696520935	0.0	discard	36_3_in_4	Parallel run loop
auto	3.960948487430107	0.0	discard	34_3_in_5	Parallel run loop
auto	4.456216683674166	0.0	discard	41_3_in_5	Parallel run loop
auto	4.734284622785082	0.0	discard	34_3_in_4	Parallel run loop
auto	3.1429881339027053	0.0	discard	22_3_in_5	Parallel run loop
auto	5.851219388596868	0.0	discard	47_3_in_4	Parallel run loop
auto	2.73069134091889	0.0	discard	17_3_in_5	Parallel run loop
auto	4.275406189129384	0.0	discard	28_3_in_4	Parallel run loop
auto	3.876338251390918	0.0	discard	33_3_in_5	Parallel run loop
auto	4.0228407638315336	0.0	discard	25_3_in_4	Parallel run loop
auto	2.979270953677378	0.0	discard	20_3_in_5	Parallel run loop
auto	4.823764949458131	0.0	discard	35_3_in_4	Parallel run loop
auto	3.6207279726157693	0.0	discard	29_3_in_5	Parallel run loop
auto	5.761724730717903	0.0	discard	46_3_in_4	Parallel run loop
auto	4.851018009306468	0.0	discard	47_3_in_5	Parallel run loop
auto	4.012301062706419	0.0	discard	35_3_in_5	Parallel run loop
auto	3.0579697775844052	0.0	discard	21_3_in_5	Parallel run loop
auto	3.749422440407203	0.0	discard	31_3_in_5	Parallel run loop
auto	3.800508235504553	0.0	discard	32_3_in_5	Parallel run loop
auto	3.860565250053721	0.0	discard	23_3_in_4	Parallel run loop
auto	4.854825713986834	0.0	discard	48_3_in_5	Parallel run loop
auto	2.28126667860246	0.0	discard	12_3_in_5	Parallel run loop
auto	5.084195995724824	0.0	discard	50_3_in_5	Parallel run loop
auto	5.202958105962411	0.0	discard	40_3_in_4	Parallel run loop
auto	3.4828020876435586	0.0	discard	19_3_in_4	Parallel run loop
auto	5.515530459907589	0.0	discard	44_3_in_4	Parallel run loop
auto	2.9015337674702075	0.0	discard	19_3_in_5	Parallel run loop
auto	4.999798135488359	0.0	discard	37_3_in_4	Parallel run loop
auto	4.667308396814935	0.0	discard	33_3_in_4	Parallel run loop
auto	4.121797120335564	0.0	discard	26_3_in_4	Parallel run loop
auto	2.8221699793639474	0.0	discard	18_3_in_5	Parallel run loop
auto	5.674564119611208	0.0	discard	45_3_in_4	Parallel run loop
auto	4.587521368368386	0.0	discard	43_3_in_5	Parallel run loop
auto	2.7323158489913495	0.0	discard	17_3_in_5	Parallel run loop
auto	4.363811548825123	0.0	discard	29_3_in_4	Parallel run loop
auto	5.976799738945055	0.0	discard	48_3_in_4	Parallel run loop
auto	4.00831383536189	0.0	discard	25_3_in_4	Parallel run loop
auto	4.616371063946292	0.0	discard	44_3_in_5	Parallel run loop
auto	2.082185029053124	0.0	discard	10_3_in_5	Parallel run loop
auto	3.4251767739406307	0.0	discard	26_3_in_5	Parallel run loop
auto	2.972355378164544	0.0	discard	20_3_in_5	Parallel run loop
auto	3.8716498857127517	0.0	discard	33_3_in_5	Parallel run loop
auto	4.282465733963264	0.0	discard	28_3_in_4	Parallel run loop
auto	4.014710428664767	0.0	discard	35_3_in_5	Parallel run loop
auto	3.9426728989866686	0.0	discard	24_3_in_4	Parallel run loop
auto	3.2136381465684503	0.0	discard	23_3_in_5	Parallel run loop
auto	1.7415210083628885	0.0	discard	7_3_in_5	Parallel run loop
auto	3.818753300532484	0.0	discard	32_3_in_5	Parallel run loop
auto	5.141138507800263	0.0	discard	39_3_in_4	Parallel run loop
auto	3.854147513072246	0.0	discard	23_3_in_4	Parallel run loop
auto	2.2814340429656776	0.0	discard	12_3_in_5	Parallel run loop
auto	3.0588442079966995	0.0	discard	21_3_in_5	Parallel run loop
auto	4.579382815535255	0.0	discard	32_3_in_4	Parallel run loop
auto	4.828489535757953	0.0	discard	48_3_in_5	Parallel run loop
auto	5.133632601613065	0.0	discard	40_3_in_4	Parallel run loop
auto	1.9752560571051547	0.0	discard	9_3_in_5	Parallel run loop
auto	3.499887551951389	0.0	discard	19_3_in_4	Parallel run loop
auto	2.859556521032866	0.0	discard	13_3_in_4	Parallel run loop
auto	3.775323746437888	0.0	discard	22_3_in_4	Parallel run loop
auto	3.4934234920700242	0.0	discard	27_3_in_5	Parallel run loop
auto	3.3904334541840435	0.0	discard	18_3_in_4	Parallel run loop
auto	4.215468173515719	0.0	discard	38_3_in_5	Parallel run loop
auto	4.202634798340783	0.0	discard	27_3_in_4	Parallel run loop
auto	2.5567839328403337	0.0	discard	15_3_in_5	Parallel run loop
auto	3.677919463659403	0.0	discard	30_3_in_5	Parallel run loop
auto	3.56397361051064	0.0	discard	28_3_in_5	Parallel run loop
auto	4.737110659037927	0.0	discard	45_3_in_5	Parallel run loop
auto	2.4689241327201854	0.0	discard	14_3_in_5	Parallel run loop
auto	4.039103526473579	0.0	discard	25_3_in_4	Parallel run loop
auto	4.513158864077281	0.0	discard	31_3_in_4	Parallel run loop
auto	4.420394739704022	0.0	discard	30_3_in_4	Parallel run loop
auto	3.883727563717111	0.0	discard	33_3_in_5	Parallel run loop
auto	2.9860454138834225	0.0	discard	20_3_in_5	Parallel run loop
auto	5.517198529351735	0.0	discard	43_3_in_4	Parallel run loop
auto	4.099553342497298	0.0	discard	36_3_in_5	Parallel run loop
auto	4.727609295528331	0.0	discard	34_3_in_4	Parallel run loop
auto	5.150174803862911	0.0	discard	39_3_in_4	Parallel run loop
auto	3.943185730411505	0.0	discard	24_3_in_4	Parallel run loop
auto	3.2831868062084197	0.0	discard	24_3_in_5	Parallel run loop
auto	3.1198588062366595	0.0	discard	22_3_in_5	Parallel run loop
auto	3.8532403975682996	0.0	discard	23_3_in_4	Parallel run loop
auto	5.754195396894121	0.0	discard	47_3_in_4	Parallel run loop
auto	4.9100494799506755	0.0	discard	48_3_in_5	Parallel run loop
auto	3.6656110908257373	0.0	discard	21_3_in_4	Parallel run loop
auto	4.423262093203331	0.0	discard	41_3_in_5	Parallel run loop
auto	4.583384314934757	0.0	discard	32_3_in_4	Parallel run loop
auto	2.8916701390337343	0.0	discard	19_3_in_5	Parallel run loop
auto	5.624717886543204	0.0	discard	44_3_in_4	Parallel run loop
auto	5.094725432292961	0.0	discard	50_3_in_5	Parallel run loop
auto	4.664100084636167	0.0	discard	33_3_in_4	Parallel run loop
auto	2.183618950652628	0.0	discard	11_3_in_5	Parallel run loop
auto	5.680311059194407	0.0	discard	45_3_in_4	Parallel run loop
auto	2.64515392807585	0.0	discard	16_3_in_5	Parallel run loop
auto	3.494908211877011	0.0	discard	27_3_in_5	Parallel run loop
auto	5.155859197620414	0.0	discard	40_3_in_4	Parallel run loop
auto	5.3302093344000046	0.0	discard	41_3_in_4	Parallel run loop
auto	2.799933736286392	0.0	discard	18_3_in_5	Parallel run loop
auto	4.12412269264182	0.0	discard	26_3_in_4	Parallel run loop
auto	3.3547581284635486	0.0	discard	25_3_in_5	Parallel run loop
auto	4.519699865161984	0.0	discard	31_3_in_4	Parallel run loop
auto	4.442841456224359	0.0	discard	30_3_in_4	Parallel run loop
auto	4.035616279167761	0.0	discard	25_3_in_4	Parallel run loop
auto	3.6913543938980142	0.0	discard	30_3_in_5	Parallel run loop
auto	4.549971733868087	0.0	discard	43_3_in_5	Parallel run loop
auto	4.346814062506598	0.0	discard	29_3_in_4	Parallel run loop
auto	4.749306097096103	0.0	discard	34_3_in_4	Parallel run loop
auto	5.167216293855436	0.0	discard	39_3_in_4	Parallel run loop
auto	5.794486782932585	0.0	discard	48_3_in_4	Parallel run loop
auto	4.613193520329596	0.0	discard	44_3_in_5	Parallel run loop
auto	3.9363470947964783	0.0	discard	24_3_in_4	Parallel run loop
auto	4.152091264647593	0.0	discard	37_3_in_5	Parallel run loop
auto	3.6484263553397263	0.0	discard	21_3_in_4	Parallel run loop
auto	3.4258561444594893	0.0	discard	26_3_in_5	Parallel run loop
auto	3.1245831865394225	0.0	discard	22_3_in_5	Parallel run loop
auto	5.755380818196604	0.0	discard	47_3_in_4	Parallel run loop
auto	3.848192327826167	0.0	discard	23_3_in_4	Parallel run loop
auto	4.5802665091389585	0.0	discard	32_3_in_4	Parallel run loop
auto	5.417347981222088	0.0	discard	42_3_in_4	Parallel run loop
auto	2.08213441626222	0.0	discard	10_3_in_5	Parallel run loop
auto	3.9517335767444055	0.0	discard	34_3_in_5	Parallel run loop
auto	5.042365929223363	0.0	discard	50_3_in_5	Parallel run loop
auto	5.6823724933020054	0.0	discard	45_3_in_4	Parallel run loop
auto	4.675200824323773	0.0	discard	33_3_in_4	Parallel run loop
auto	5.247521742555183	0.0	discard	40_3_in_4	Parallel run loop
auto	1.741521188705603	0.0	discard	7_3_in_5	Parallel run loop
auto	3.2154864400750682	0.0	discard	23_3_in_5	Parallel run loop
auto	2.184803390739283	0.0	discard	11_3_in_5	Parallel run loop
auto	2.8095308160760593	0.0	discard	18_3_in_5	Parallel run loop
auto	2.8593571326339666	0.0	discard	13_3_in_4	Parallel run loop
auto	4.171392446927153	0.0	discard	38_3_in_5	Parallel run loop
auto	3.3282688543462338	0.0	discard	25_3_in_5	Parallel run loop
auto	3.7746999870409446	0.0	discard	22_3_in_4	Parallel run loop
auto	1.9747986312856793	0.0	discard	9_3_in_5	Parallel run loop
auto	4.3619375866577	0.0	discard	29_3_in_4	Parallel run loop
auto	4.757797006016469	0.0	discard	34_3_in_4	Parallel run loop
auto	3.7579018758582117	0.0	discard	31_3_in_5	Parallel run loop
auto	4.518621397175735	0.0	discard	31_3_in_4	Parallel run loop
auto	5.913138778426218	0.0	discard	48_3_in_4	Parallel run loop
auto	3.9419505920395683	0.0	discard	24_3_in_4	Parallel run loop
auto	3.6195598369389637	0.0	discard	29_3_in_5	Parallel run loop
auto	3.3805434269409487	0.0	discard	18_3_in_4	Parallel run loop
auto	4.1949345994447365	0.0	discard	27_3_in_4	Parallel run loop
auto	3.669102210507659	0.0	discard	21_3_in_4	Parallel run loop
auto	2.5525833423346125	0.0	discard	15_3_in_5	Parallel run loop
auto	5.713687909043916	0.0	discard	47_3_in_4	Parallel run loop
auto	3.4225972743971083	0.0	discard	26_3_in_5	Parallel run loop
auto	3.1171354434636678	0.0	discard	22_3_in_5	Parallel run loop
auto	4.57088964902199	0.0	discard	32_3_in_4	Parallel run loop
auto	4.676865706221167	0.0	discard	45_3_in_5	Parallel run loop
auto	3.5491200664749725	0.0	discard	28_3_in_5	Parallel run loop
auto	2.082136972769762	0.0	discard	10_3_in_5	Parallel run loop
auto	1.7415209721125642	0.0	discard	7_3_in_5	Parallel run loop
auto	3.9556883959265563	0.0	discard	34_3_in_5	Parallel run loop
auto	4.6785851176988436	0.0	discard	33_3_in_4	Parallel run loop
auto	5.080762807461953	0.0	discard	50_3_in_5	Parallel run loop
auto	1.6127718387037564	0.0	discard	6_3_in_5	Parallel run loop
auto	2.470790010286466	0.0	discard	14_3_in_5	Parallel run loop
auto	1.4723582020540358	0.0	discard	5_3_in_5	Parallel run loop
auto	4.088930957799324	0.0	discard	36_3_in_5	Parallel run loop
auto	3.2863204628312412	0.0	discard	24_3_in_5	Parallel run loop
auto	1.97524392766155	0.0	discard	9_3_in_5	Parallel run loop
auto	2.8202454481095653	0.0	discard	18_3_in_5	Parallel run loop
auto	4.216205350975018	0.0	discard	38_3_in_5	Parallel run loop
auto	4.997682734828203	0.0	discard	49_3_in_5	Parallel run loop
auto	5.001471450161825	0.0	discard	37_3_in_4	Parallel run loop
auto	4.389285173751878	0.0	discard	41_3_in_5	Parallel run loop
auto	5.51660053943319	0.0	discard	43_3_in_4	Parallel run loop
auto	3.342645355572021	0.0	discard	25_3_in_5	Parallel run loop
auto	3.3879043836168075	0.0	discard	18_3_in_4	Parallel run loop
auto	2.554431353779944	0.0	discard	15_3_in_5	Parallel run loop
auto	3.671488082998394	0.0	discard	21_3_in_4	Parallel run loop
auto	3.1329838656661297	0.0	discard	22_3_in_5	Parallel run loop
auto	3.948613998824418	0.0	discard	24_3_in_4	Parallel run loop
auto	4.2034973658443535	0.0	discard	27_3_in_4	Parallel run loop
auto	3.060945454081722	0.0	discard	21_3_in_5	Parallel run loop
auto	4.356255745635118	0.0	discard	40_3_in_5	Parallel run loop
auto	4.586638807342354	0.0	discard	32_3_in_4	Parallel run loop
auto	3.558173703915672	0.0	discard	28_3_in_5	Parallel run loop
auto	3.4873029346188384	0.0	discard	19_3_in_4	Parallel run loop
auto	5.819466407913129	0.0	discard	47_3_in_4	Parallel run loop
auto	4.670166910151832	0.0	discard	45_3_in_5	Parallel run loop
