commit	score	memory_gb	status	problem	description
auto	4.8203042879733635	0.0	discard	20_5_in_DOMINO	Parallel run loop
auto	2.40887962868564	0.0	keep	6_CIRCLE_in_8	Auto run attempts=5000
auto	2.99935673673655	0.0	keep	5_CIRCLE_in_6	Parallel run loop
auto	3.709403638696858	0.0	keep	8_CIRCLE_in_6	Parallel run loop
auto	4.1193610079274485	0.0	keep	10_CIRCLE_in_6	Parallel run loop
auto	4.011850126531809	0.0	keep	9_CIRCLE_in_6	Parallel run loop
auto	4.564586453758822	0.0	keep	8_CIRCLE_in_5	Parallel run loop
auto	4.825027890101098	0.0	keep	9_CIRCLE_in_5	Parallel run loop
auto	5.095202624832034	0.0	keep	10_CIRCLE_in_5	Parallel run loop
auto	4.236123080364597	0.0	keep	7_CIRCLE_in_5	Parallel run loop
auto	4.30940205832741	0.0	keep	11_CIRCLE_in_6	Parallel run loop
auto	5.2404316106068185	0.0	keep	11_CIRCLE_in_5	Parallel run loop
auto	4.619964531942141	0.0	keep	13_CIRCLE_in_6	Parallel run loop
auto	5.65178863390449	0.0	keep	13_CIRCLE_in_5	Parallel run loop
auto	4.961394742524031	0.0	keep	15_CIRCLE_in_6	Parallel run loop
auto	5.678142415213435	0.0	keep	20_CIRCLE_in_6	Parallel run loop
auto	5.407790335955908	0.0	keep	12_CIRCLE_in_5	Parallel run loop
auto	6.419473677274734	0.0	keep	17_CIRCLE_in_5	Parallel run loop
auto	5.9518626702293895	0.0	keep	22_CIRCLE_in_6	Parallel run loop
auto	6.778065004264964	0.0	keep	19_CIRCLE_in_5	Parallel run loop
auto	6.945282047637263	0.0	keep	20_CIRCLE_in_5	Parallel run loop
auto	7.397529647342157	0.0	keep	23_CIRCLE_in_5	Parallel run loop
auto	7.10728744626499	0.0	keep	21_CIRCLE_in_5	Parallel run loop
auto	6.586943826855408	0.0	keep	18_CIRCLE_in_5	Parallel run loop
auto	7.272215005802625	0.0	keep	22_CIRCLE_in_5	Parallel run loop
auto	5.80861846709775	0.0	keep	14_CIRCLE_in_5	Parallel run loop
auto	7.53449550935743	0.0	keep	24_CIRCLE_in_5	Parallel run loop
auto	5.9451690931654015	0.0	keep	15_CIRCLE_in_5	Parallel run loop
auto	4.666572918703828	0.0	keep	14_CIRCLE_in_6	Parallel run loop
auto	6.129622797698456	0.0	keep	16_CIRCLE_in_5	Parallel run loop
auto	6.011917896554221	0.0	keep	23_CIRCLE_in_6	Parallel run loop
auto	6.119856182001635	0.0	keep	24_CIRCLE_in_6	Parallel run loop
auto	4.999366341805162	0.0	keep	16_CIRCLE_in_6	Parallel run loop
auto	3.709403638696858	0.0	discard	8_CIRCLE_in_6	Parallel run loop
auto	4.011844785498147	0.0	keep	9_CIRCLE_in_6	Parallel run loop
auto	5.709404389000288	0.0	keep	21_CIRCLE_in_6	Parallel run loop
auto	4.564583476097915	0.0	keep	8_CIRCLE_in_5	Parallel run loop
auto	3.0048765309284766	0.0	discard	5_CIRCLE_in_6	Parallel run loop
auto	4.243434570955204	0.0	discard	7_CIRCLE_in_5	Parallel run loop
auto	2.9269635902496747	0.0	discard	6_DOMINO_in_DOMINO	Parallel run loop
auto	2.232167754713471	0.0	discard	6_5_in_CIRCLE	Parallel run loop
auto	2.1805188668511373	0.0	discard	5_DOMINO_in_CIRCLE	Parallel run loop
auto	4.309402171560432	0.0	keep	12_CIRCLE_in_6	Parallel run loop
auto	5.133562868544002	0.0	keep	17_CIRCLE_in_6	Parallel run loop
auto	5.1037699175000775	0.0	discard	10_CIRCLE_in_5	Parallel run loop
auto	4.318513001799295	0.0	discard	11_CIRCLE_in_6	Parallel run loop
auto	4.12797135408049	0.0	discard	10_CIRCLE_in_6	Parallel run loop
auto	5.249993253398876	0.0	discard	11_CIRCLE_in_5	Parallel run loop
auto	4.833201512916723	0.0	discard	9_CIRCLE_in_5	Parallel run loop
auto	6.43194942569877	0.0	discard	17_CIRCLE_in_5	Parallel run loop
auto	5.662456632949463	0.0	discard	13_CIRCLE_in_5	Parallel run loop
auto	5.418179850967894	0.0	discard	12_CIRCLE_in_5	Parallel run loop
auto	4.630369722961516	0.0	discard	13_CIRCLE_in_6	Parallel run loop
auto	6.599903143158532	0.0	discard	18_CIRCLE_in_5	Parallel run loop
auto	2.8096957407169842	0.0	discard	10_5_in_CIRCLE	Parallel run loop
auto	6.958928960648025	0.0	discard	20_CIRCLE_in_5	Parallel run loop
auto	4.97258179399648	0.0	discard	15_CIRCLE_in_6	Parallel run loop
auto	7.2866078512870835	0.0	discard	22_CIRCLE_in_5	Parallel run loop
auto	7.316774901816174	0.0	discard	21_CIRCLE_in_5	Parallel run loop
auto	4.6785157712076435	0.0	discard	14_CIRCLE_in_6	Parallel run loop
auto	5.691485834794928	0.0	discard	20_CIRCLE_in_6	Parallel run loop
auto	6.7913096927045595	0.0	discard	19_CIRCLE_in_5	Parallel run loop
auto	6.142396280676911	0.0	discard	16_CIRCLE_in_5	Parallel run loop
auto	3.0249325226413832	0.0	discard	12_5_in_CIRCLE	Parallel run loop
auto	3.0048765309284766	0.0	discard	5_CIRCLE_in_6	Parallel run loop
auto	6.135395762849153	0.0	discard	24_CIRCLE_in_6	Parallel run loop
auto	4.929814055285817	0.0	keep	29_5_in_6	Parallel run loop
auto	5.012029695954504	0.0	discard	16_CIRCLE_in_6	Parallel run loop
auto	4.243434570955204	0.0	discard	7_CIRCLE_in_5	Parallel run loop
auto	5.957464100021371	0.0	discard	15_CIRCLE_in_5	Parallel run loop
auto	7.549945952587069	0.0	discard	24_CIRCLE_in_5	Parallel run loop
auto	6.026928329812663	0.0	discard	23_CIRCLE_in_6	Parallel run loop
auto	5.965887068319776	0.0	discard	22_CIRCLE_in_6	Parallel run loop
auto	3.7169287845483785	0.0	discard	8_CIRCLE_in_6	Parallel run loop
auto	4.572208146659769	0.0	discard	8_CIRCLE_in_5	Parallel run loop
auto	4.732098524266093	0.0	discard	24_DOMINO_in_6	Parallel run loop
auto	4.019324103529966	0.0	discard	9_CIRCLE_in_6	Parallel run loop
auto	5.820050941652189	0.0	discard	14_CIRCLE_in_5	Parallel run loop
auto	7.41250409295838	0.0	discard	23_CIRCLE_in_5	Parallel run loop
auto	5.724090613301625	0.0	discard	21_CIRCLE_in_6	Parallel run loop
auto	3.237983563377362	0.0	discard	14_5_in_CIRCLE	Parallel run loop
auto	2.1805188668511373	0.0	discard	5_DOMINO_in_CIRCLE	Parallel run loop
auto	2.9269635902496747	0.0	discard	6_DOMINO_in_DOMINO	Parallel run loop
auto	2.232167754713471	0.0	discard	6_5_in_CIRCLE	Parallel run loop
auto	4.309401176440426	0.0	keep	12_CIRCLE_in_6	Parallel run loop
auto	3.0048765309284766	0.0	discard	5_CIRCLE_in_6	Parallel run loop
auto	4.243434570955204	0.0	discard	7_CIRCLE_in_5	Parallel run loop
auto	5.1037699175000775	0.0	discard	10_CIRCLE_in_5	Parallel run loop
auto	5.418179850967894	0.0	discard	12_CIRCLE_in_5	Parallel run loop
auto	5.249993253398876	0.0	discard	11_CIRCLE_in_5	Parallel run loop
auto	4.833201512916723	0.0	discard	9_CIRCLE_in_5	Parallel run loop
auto	5.662456632949463	0.0	discard	13_CIRCLE_in_5	Parallel run loop
auto	3.7169287845483785	0.0	discard	8_CIRCLE_in_6	Parallel run loop
auto	6.599903143158532	0.0	discard	18_CIRCLE_in_5	Parallel run loop
auto	5.133571200613463	0.0	discard	17_CIRCLE_in_6	Parallel run loop
auto	7.121334267304427	0.0	discard	21_CIRCLE_in_5	Parallel run loop
auto	6.026928329812663	0.0	discard	23_CIRCLE_in_6	Parallel run loop
auto	4.720282463373158	0.0	keep	24_DOMINO_in_6	Parallel run loop
auto	4.12797135408049	0.0	discard	10_CIRCLE_in_6	Parallel run loop
auto	2.8096957407169842	0.0	discard	10_5_in_CIRCLE	Parallel run loop
auto	2.7565782330234603	0.0	discard	10_6_in_8	Parallel run loop
auto	5.965887068319776	0.0	discard	22_CIRCLE_in_6	Parallel run loop
auto	4.929814055285817	0.0	discard	29_5_in_6	Parallel run loop
auto	4.630369722961516	0.0	discard	13_CIRCLE_in_6	Parallel run loop
auto	5.820050941652189	0.0	discard	14_CIRCLE_in_5	Parallel run loop
auto	6.958928960648025	0.0	discard	20_CIRCLE_in_5	Parallel run loop
auto	5.691485834794928	0.0	discard	20_CIRCLE_in_6	Parallel run loop
auto	5.012029695954504	0.0	discard	16_CIRCLE_in_6	Parallel run loop
auto	4.019324103529966	0.0	discard	9_CIRCLE_in_6	Parallel run loop
auto	6.7913096927045595	0.0	discard	19_CIRCLE_in_5	Parallel run loop
auto	7.549945952587069	0.0	discard	24_CIRCLE_in_5	Parallel run loop
auto	6.135395762849153	0.0	discard	24_CIRCLE_in_6	Parallel run loop
auto	4.6785157712076435	0.0	discard	14_CIRCLE_in_6	Parallel run loop
auto	6.43194942569877	0.0	discard	17_CIRCLE_in_5	Parallel run loop
auto	4.97258179399648	0.0	discard	15_CIRCLE_in_6	Parallel run loop
auto	4.572208146659769	0.0	discard	8_CIRCLE_in_5	Parallel run loop
auto	6.142396280676911	0.0	discard	16_CIRCLE_in_5	Parallel run loop
auto	4.318513001799295	0.0	discard	11_CIRCLE_in_6	Parallel run loop
auto	7.2866078512870835	0.0	discard	22_CIRCLE_in_5	Parallel run loop
auto	5.957464100021371	0.0	discard	15_CIRCLE_in_5	Parallel run loop
auto	3.087624644501296	0.0	discard	13_6_in_8	Parallel run loop
auto	7.41250409295838	0.0	discard	23_CIRCLE_in_5	Parallel run loop
auto	5.724090613301625	0.0	discard	21_CIRCLE_in_6	Parallel run loop
auto	2.1805188668511373	0.0	discard	5_DOMINO_in_CIRCLE	Parallel run loop
auto	3.0048765309284766	0.0	discard	5_CIRCLE_in_6	Parallel run loop
auto	2.9269635902496747	0.0	discard	6_DOMINO_in_DOMINO	Parallel run loop
auto	4.243434570955204	0.0	discard	7_CIRCLE_in_5	Parallel run loop
auto	2.232167754713471	0.0	discard	6_5_in_CIRCLE	Parallel run loop
auto	3.7169287845483785	0.0	discard	8_CIRCLE_in_6	Parallel run loop
auto	4.019324103529966	0.0	discard	9_CIRCLE_in_6	Parallel run loop
auto	4.833201512916723	0.0	discard	9_CIRCLE_in_5	Parallel run loop
auto	5.1037699175000775	0.0	discard	10_CIRCLE_in_5	Parallel run loop
auto	5.418179850967894	0.0	discard	12_CIRCLE_in_5	Parallel run loop
auto	6.026928329812663	0.0	discard	23_CIRCLE_in_6	Parallel run loop
auto	4.630369722961516	0.0	discard	13_CIRCLE_in_6	Parallel run loop
auto	7.121334267304427	0.0	discard	21_CIRCLE_in_5	Parallel run loop
auto	5.691485834794928	0.0	discard	20_CIRCLE_in_6	Parallel run loop
auto	5.012029695954504	0.0	discard	16_CIRCLE_in_6	Parallel run loop
auto	4.318513001799295	0.0	discard	11_CIRCLE_in_6	Parallel run loop
auto	3.0249325226413832	0.0	discard	12_5_in_CIRCLE	Parallel run loop
auto	5.662456632949463	0.0	discard	13_CIRCLE_in_5	Parallel run loop
auto	4.6785157712076435	0.0	discard	14_CIRCLE_in_6	Parallel run loop
auto	4.929814055285817	0.0	discard	29_5_in_6	Parallel run loop
auto	5.249993253398876	0.0	discard	11_CIRCLE_in_5	Parallel run loop
auto	6.142396280676911	0.0	discard	16_CIRCLE_in_5	Parallel run loop
auto	4.97258179399648	0.0	discard	15_CIRCLE_in_6	Parallel run loop
auto	7.549945952587069	0.0	discard	24_CIRCLE_in_5	Parallel run loop
auto	5.965887068319776	0.0	discard	22_CIRCLE_in_6	Parallel run loop
auto	4.692513407635144	0.0	keep	24_DOMINO_in_6	Parallel run loop
auto	4.572208146659769	0.0	discard	8_CIRCLE_in_5	Parallel run loop
auto	2.8096957407169842	0.0	discard	10_5_in_CIRCLE	Parallel run loop
auto	6.958928960648025	0.0	discard	20_CIRCLE_in_5	Parallel run loop
auto	6.7913096927045595	0.0	discard	19_CIRCLE_in_5	Parallel run loop
auto	5.133571200613463	0.0	discard	17_CIRCLE_in_6	Parallel run loop
auto	6.135395762849153	0.0	discard	24_CIRCLE_in_6	Parallel run loop
auto	4.309406330199947	0.0	discard	12_CIRCLE_in_6	Parallel run loop
auto	6.43194942569877	0.0	discard	17_CIRCLE_in_5	Parallel run loop
auto	4.12797135408049	0.0	discard	10_CIRCLE_in_6	Parallel run loop
auto	5.820050941652189	0.0	discard	14_CIRCLE_in_5	Parallel run loop
auto	6.599903143158532	0.0	discard	18_CIRCLE_in_5	Parallel run loop
auto	5.957464100021371	0.0	discard	15_CIRCLE_in_5	Parallel run loop
auto	3.237983563377362	0.0	discard	14_5_in_CIRCLE	Parallel run loop
auto	7.2866078512870835	0.0	discard	22_CIRCLE_in_5	Parallel run loop
auto	2.9269635902496747	0.0	discard	6_DOMINO_in_DOMINO	Parallel run loop
auto	2.232167754713471	0.0	discard	6_5_in_CIRCLE	Parallel run loop
auto	2.1805188668511373	0.0	discard	5_DOMINO_in_CIRCLE	Parallel run loop
auto	5.1037699175000775	0.0	discard	10_CIRCLE_in_5	Parallel run loop
auto	4.318513001799295	0.0	discard	11_CIRCLE_in_6	Parallel run loop
auto	4.833201512916723	0.0	discard	9_CIRCLE_in_5	Parallel run loop
auto	5.249993253398876	0.0	discard	11_CIRCLE_in_5	Parallel run loop
auto	5.691485834794928	0.0	discard	20_CIRCLE_in_6	Parallel run loop
auto	5.418179850967894	0.0	discard	12_CIRCLE_in_5	Parallel run loop
auto	4.97258179399648	0.0	discard	15_CIRCLE_in_6	Parallel run loop
auto	4.630369722961516	0.0	discard	13_CIRCLE_in_6	Parallel run loop
auto	5.662456632949463	0.0	discard	13_CIRCLE_in_5	Parallel run loop
auto	3.0249325226413832	0.0	discard	12_5_in_CIRCLE	Parallel run loop
auto	6.142396280676911	0.0	discard	16_CIRCLE_in_5	Parallel run loop
auto	4.77154037136806	0.0	discard	24_DOMINO_in_6	Parallel run loop
auto	5.012029695954504	0.0	discard	16_CIRCLE_in_6	Parallel run loop
auto	7.549945952587069	0.0	discard	24_CIRCLE_in_5	Parallel run loop
auto	5.965887068319776	0.0	discard	22_CIRCLE_in_6	Parallel run loop
auto	2.7565782330234603	0.0	discard	10_6_in_8	Parallel run loop
auto	7.41250409295838	0.0	discard	23_CIRCLE_in_5	Parallel run loop
auto	3.087624644501296	0.0	discard	13_6_in_8	Parallel run loop
auto	7.121334267304427	0.0	discard	21_CIRCLE_in_5	Parallel run loop
auto	4.574769884311197	0.0	discard	10_6_in_5	Parallel run loop
auto	3.0793548370246726	0.0	discard	13_5_in_CIRCLE	Parallel run loop
auto	6.135395762849153	0.0	discard	24_CIRCLE_in_6	Parallel run loop
auto	6.026928329812663	0.0	discard	23_CIRCLE_in_6	Parallel run loop
auto	4.929814055285817	0.0	discard	29_5_in_6	Parallel run loop
auto	4.6785157712076435	0.0	discard	14_CIRCLE_in_6	Parallel run loop
auto	5.724090613301625	0.0	discard	21_CIRCLE_in_6	Parallel run loop
auto	2.8096957407169842	0.0	discard	10_5_in_CIRCLE	Parallel run loop
auto	5.133571200613463	0.0	discard	17_CIRCLE_in_6	Parallel run loop
auto	4.77739666595167	0.0	discard	17_8_in_8	Parallel run loop
auto	6.7913096927045595	0.0	discard	19_CIRCLE_in_5	Parallel run loop
auto	6.958928960648025	0.0	discard	20_CIRCLE_in_5	Parallel run loop
auto	2.232167754713471	0.0	discard	6_5_in_CIRCLE	Parallel run loop
auto	3.6577034435756794	0.0	discard	15_5_in_6	Parallel run loop
auto	2.9269635902496747	0.0	discard	6_DOMINO_in_DOMINO	Parallel run loop
auto	6.599903143158532	0.0	discard	18_CIRCLE_in_5	Parallel run loop
auto	5.957464100021371	0.0	discard	15_CIRCLE_in_5	Parallel run loop
auto	4.12797135408049	0.0	discard	10_CIRCLE_in_6	Parallel run loop
auto	5.820050941652189	0.0	discard	14_CIRCLE_in_5	Parallel run loop
auto	4.309402874516071	0.0	discard	12_CIRCLE_in_6	Parallel run loop
auto	6.43194942569877	0.0	discard	17_CIRCLE_in_5	Parallel run loop
auto	7.2866078512870835	0.0	discard	22_CIRCLE_in_5	Parallel run loop
auto	2.1805188668511373	0.0	discard	5_DOMINO_in_CIRCLE	Parallel run loop
auto	3.616547745836317	0.0	keep	18_5_in_CIRCLE	Parallel run loop
auto	2.757555254323801	0.0	discard	16_5_in_8	Parallel run loop
auto	3.0249325226413832	0.0	discard	12_5_in_CIRCLE	Parallel run loop
auto	7.41250409295838	0.0	discard	23_CIRCLE_in_5	Parallel run loop
auto	3.087624644501296	0.0	discard	13_6_in_8	Parallel run loop
auto	3.237983563377362	0.0	discard	14_5_in_CIRCLE	Parallel run loop
auto	3.5015432852757242	0.0	discard	8_DOMINO_in_5	Parallel run loop
auto	4.316151292780971	0.0	discard	17_6_in_CIRCLE	Parallel run loop
auto	2.7565782330234603	0.0	discard	10_6_in_8	Parallel run loop
auto	3.498395495831623	0.0	discard	17_6_in_8	Parallel run loop
auto	5.105393906000926	0.0	discard	24_6_in_CIRCLE	Parallel run loop
auto	4.480124023637546	0.0	discard	15_8_in_8	Parallel run loop
auto	4.455507583380141	0.0	keep	21_DOMINO_in_6	Parallel run loop
auto	4.574769884311197	0.0	discard	10_6_in_5	Parallel run loop
auto	4.929814055285817	0.0	discard	29_5_in_6	Parallel run loop
auto	3.8008538929495774	0.0	discard	20_5_in_CIRCLE	Parallel run loop
auto	3.509704759175081	0.0	discard	17_5_in_CIRCLE	Parallel run loop
auto	2.57086553360258	0.0	discard	14_5_in_8	Parallel run loop
auto	7.021084739848574	0.0	discard	20_8_in_6	Parallel run loop
auto	3.0793548370246726	0.0	discard	13_5_in_CIRCLE	Parallel run loop
auto	3.9982536857362456	0.0	keep	22_5_in_CIRCLE	Parallel run loop
auto	4.77739666595167	0.0	discard	17_8_in_8	Parallel run loop
auto	3.6577034435756794	0.0	discard	15_5_in_6	Parallel run loop
auto	5.133752647951886	0.0	discard	17_CIRCLE_in_6	Parallel run loop
auto	3.201035699156441	0.0	discard	22_5_in_8	Parallel run loop
auto	5.724090613301625	0.0	discard	21_CIRCLE_in_6	Parallel run loop
auto	2.8096957407169842	0.0	discard	10_5_in_CIRCLE	Parallel run loop
auto	5.211512366335625	0.0	discard	25_6_in_CIRCLE	Parallel run loop
auto	4.072528361684914	0.0	discard	23_5_in_CIRCLE	Parallel run loop
auto	6.42361900877598	0.0	discard	21_6_in_5	Parallel run loop
auto	3.7491238161458025	0.0	discard	20_6_in_8	Parallel run loop
auto	2.901054354602868	0.0	discard	18_5_in_8	Parallel run loop
auto	3.2668521998149376	0.0	discard	23_5_in_8	Parallel run loop
auto	4.950411303539053	0.0	discard	22_5_in_DOMINO	Parallel run loop
auto	3.616547745836317	0.0	discard	18_5_in_CIRCLE	Parallel run loop
auto	2.8192851731777258	0.0	discard	17_5_in_8	Parallel run loop
auto	3.498395495831623	0.0	discard	17_6_in_8	Parallel run loop
auto	3.087624644501296	0.0	discard	13_6_in_8	Parallel run loop
auto	6.566008958695746	0.0	discard	22_6_in_5	Parallel run loop
auto	3.5015432852757242	0.0	discard	8_DOMINO_in_5	Parallel run loop
auto	5.381237089465599	0.0	discard	22_8_in_8	Parallel run loop
auto	5.679885998161292	0.0	discard	25_8_in_8	Parallel run loop
auto	3.0249325226413832	0.0	discard	12_5_in_CIRCLE	Parallel run loop
auto	2.7565782330234603	0.0	discard	10_6_in_8	Parallel run loop
auto	4.316151292780971	0.0	discard	17_6_in_CIRCLE	Parallel run loop
auto	4.309402112087078	0.0	discard	12_CIRCLE_in_6	Parallel run loop
auto	3.3195455222733887	0.0	discard	13_DOMINO_in_CIRCLE	Parallel run loop
auto	3.237983563377362	0.0	discard	14_5_in_CIRCLE	Parallel run loop
auto	5.105393906000926	0.0	discard	24_6_in_CIRCLE	Parallel run loop
auto	2.757555254323801	0.0	discard	16_5_in_8	Parallel run loop
auto	2.6315066934704827	0.0	keep	7_DOMINO_in_6	Parallel run loop
auto	3.1326434895629753	0.0	discard	21_5_in_8	Parallel run loop
auto	4.929814055285817	0.0	discard	29_5_in_6	Parallel run loop
auto	7.021084739848574	0.0	discard	20_8_in_6	Parallel run loop
auto	3.509704759175081	0.0	discard	17_5_in_CIRCLE	Parallel run loop
auto	4.77739666595167	0.0	discard	17_8_in_8	Parallel run loop
auto	3.0793548370246726	0.0	discard	13_5_in_CIRCLE	Parallel run loop
auto	4.480124023637546	0.0	discard	15_8_in_8	Parallel run loop
auto	4.124297951923563	0.0	keep	24_5_in_CIRCLE	Parallel run loop
auto	3.6577034435756794	0.0	discard	15_5_in_6	Parallel run loop
auto	3.9982536857362456	0.0	discard	22_5_in_CIRCLE	Parallel run loop
auto	3.8008538929495774	0.0	discard	20_5_in_CIRCLE	Parallel run loop
auto	4.574769884311197	0.0	discard	10_6_in_5	Parallel run loop
auto	4.462196194395418	0.0	discard	21_DOMINO_in_6	Parallel run loop
auto	2.57086553360258	0.0	discard	14_5_in_8	Parallel run loop
auto	3.087624644501296	0.0	discard	13_6_in_8	Parallel run loop
auto	3.5015432852757242	0.0	discard	8_DOMINO_in_5	Parallel run loop
auto	3.935981746673115	0.0	discard	12_DOMINO_in_DOMINO	Parallel run loop
auto	4.738880780683014	0.0	discard	11_6_in_5	Parallel run loop
auto	3.498395495831623	0.0	discard	17_6_in_8	Parallel run loop
auto	3.616547745836317	0.0	discard	18_5_in_CIRCLE	Parallel run loop
auto	4.072121108848746	0.0	keep	23_5_in_CIRCLE	Parallel run loop
auto	4.26706542800429	0.0	discard	21_5_in_6	Parallel run loop
auto	5.319190116042833	0.0	discard	22_6_in_6	Parallel run loop
auto	3.2668521998149376	0.0	discard	23_5_in_8	Parallel run loop
auto	5.105393906000926	0.0	discard	24_6_in_CIRCLE	Parallel run loop
auto	6.42361900877598	0.0	discard	21_6_in_5	Parallel run loop
auto	3.7491238161458025	0.0	discard	20_6_in_8	Parallel run loop
auto	3.509704759175081	0.0	discard	17_5_in_CIRCLE	Parallel run loop
auto	3.237983563377362	0.0	discard	14_5_in_CIRCLE	Parallel run loop
auto	3.201035699156441	0.0	discard	22_5_in_8	Parallel run loop
auto	2.757555254323801	0.0	discard	16_5_in_8	Parallel run loop
auto	7.021084739848574	0.0	discard	20_8_in_6	Parallel run loop
auto	2.6315066934704827	0.0	discard	7_DOMINO_in_6	Parallel run loop
auto	4.950411303539053	0.0	discard	22_5_in_DOMINO	Parallel run loop
auto	5.445689579242635	0.0	discard	23_8_in_8	Parallel run loop
auto	2.7565782330234603	0.0	discard	10_6_in_8	Parallel run loop
auto	3.582215248748605	0.0	discard	28_5_in_8	Parallel run loop
auto	2.901054354602868	0.0	discard	18_5_in_8	Parallel run loop
auto	6.566008958695746	0.0	discard	22_6_in_5	Parallel run loop
auto	4.316151292780971	0.0	discard	17_6_in_CIRCLE	Parallel run loop
auto	5.381237089465599	0.0	discard	22_8_in_8	Parallel run loop
auto	2.8192851731777258	0.0	discard	17_5_in_8	Parallel run loop
auto	4.929814055285817	0.0	discard	29_5_in_6	Parallel run loop
auto	3.3835587963854876	0.0	discard	25_5_in_8	Parallel run loop
auto	5.211512366335625	0.0	discard	25_6_in_CIRCLE	Parallel run loop
auto	4.309406330199947	0.0	discard	12_CIRCLE_in_6	Parallel run loop
auto	4.77739666595167	0.0	discard	17_8_in_8	Parallel run loop
auto	3.0793548370246726	0.0	discard	13_5_in_CIRCLE	Parallel run loop
auto	3.6577034435756794	0.0	discard	15_5_in_6	Parallel run loop
auto	3.9982536857362456	0.0	discard	22_5_in_CIRCLE	Parallel run loop
auto	3.8008538929495774	0.0	discard	20_5_in_CIRCLE	Parallel run loop
auto	3.832919053395452	0.0	discard	21_6_in_8	Parallel run loop
auto	4.574769884311197	0.0	discard	10_6_in_5	Parallel run loop
auto	4.480124023637546	0.0	discard	15_8_in_8	Parallel run loop
auto	3.5015432852757242	0.0	discard	8_DOMINO_in_5	Parallel run loop
auto	2.757555254323801	0.0	discard	16_5_in_8	Parallel run loop
auto	4.23160540718142	0.0	discard	14_5_in_5	Parallel run loop
auto	3.4223270717610794	0.0	discard	14_DOMINO_in_CIRCLE	Parallel run loop
auto	3.3195455222733887	0.0	discard	13_DOMINO_in_CIRCLE	Parallel run loop
auto	3.498395495831623	0.0	discard	17_6_in_8	Parallel run loop
auto	4.484115710697501	0.0	discard	21_DOMINO_in_6	Parallel run loop
auto	2.57086553360258	0.0	discard	14_5_in_8	Parallel run loop
auto	4.697192598913602	0.0	discard	21_6_in_CIRCLE	Parallel run loop
auto	4.12471042296586	0.0	discard	24_5_in_CIRCLE	Parallel run loop
auto	3.582215248748605	0.0	discard	28_5_in_8	Parallel run loop
auto	5.1860614802694025	0.0	discard	21_5_in_5	Parallel run loop
auto	4.929814055285817	0.0	discard	29_5_in_6	Parallel run loop
auto	3.1326434895629753	0.0	discard	21_5_in_8	Parallel run loop
auto	3.935981746673115	0.0	discard	12_DOMINO_in_DOMINO	Parallel run loop
auto	3.2668521998149376	0.0	discard	23_5_in_8	Parallel run loop
