commit	score	memory_gb	status	problem	description
auto	10.097240077527125	0.0	discard	36_4_in_3	Parallel run loop
auto	5.518349167917388	0.0	discard	9_6_in_4	Parallel run loop
auto	3.2320607503195915	0.0	discard	3_4_in_3	Parallel run loop
auto	4.8147711483287665	0.0	discard	6_6_in_4	Parallel run loop
auto	6.310183212243213	0.0	discard	12_4_in_3	Parallel run loop
auto	10.560916324773153	0.0	discard	39_4_in_3	Parallel run loop
auto	11.01851023958955	0.0	discard	43_4_in_3	Parallel run loop
auto	10.940553511555468	0.0	discard	41_4_in_3	Parallel run loop
auto	9.877528661157257	0.0	discard	35_4_in_3	Parallel run loop
auto	5.464690948684724	0.0	discard	10_4_in_3	Parallel run loop
auto	7.387955541169579	0.0	discard	18_4_in_3	Parallel run loop
auto	9.513940573292547	0.0	discard	27_6_in_4	Parallel run loop
auto	7.62481355040273	0.0	discard	20_4_in_3	Parallel run loop
auto	9.622155676435591	0.0	discard	31_4_in_3	Parallel run loop
auto	8.471858809614375	0.0	discard	24_4_in_3	Parallel run loop
auto	8.627146868055858	0.0	discard	25_4_in_3	Parallel run loop
auto	6.465828989260902	0.0	discard	14_4_in_3	Parallel run loop
auto	6.963996744975704	0.0	keep	15_6_in_4	Parallel run loop
auto	8.861794685311292	0.0	discard	27_4_in_3	Parallel run loop
auto	9.701718871914597	0.0	discard	33_4_in_3	Parallel run loop
auto	9.780062142228132	0.0	discard	32_4_in_3	Parallel run loop
auto	6.388840407653808	0.0	discard	12_6_in_4	Parallel run loop
auto	8.156687169662156	0.0	discard	22_4_in_3	Parallel run loop
auto	6.388054329084989	0.0	discard	13_4_in_3	Parallel run loop
auto	9.255840516534487	0.0	discard	26_6_in_4	Parallel run loop
auto	8.076108978517055	0.0	discard	20_6_in_4	Parallel run loop
auto	4.154750717508222	0.0	discard	4_4_in_3	Parallel run loop
auto	7.742742602208797	0.0	discard	21_4_in_3	Parallel run loop
auto	9.883661321007729	0.0	discard	34_4_in_3	Parallel run loop
auto	8.79744222560545	0.0	discard	24_6_in_4	Parallel run loop
auto	10.791219693178732	0.0	discard	40_4_in_3	Parallel run loop
auto	5.518421711656798	0.0	discard	9_6_in_4	Parallel run loop
auto	10.941341261088779	0.0	discard	42_4_in_3	Parallel run loop
auto	10.090848203208573	0.0	discard	36_4_in_3	Parallel run loop
auto	4.8147711483287665	0.0	discard	6_6_in_4	Parallel run loop
auto	7.929378074021842	0.0	discard	19_6_in_4	Parallel run loop
auto	10.876370870591666	0.0	discard	41_4_in_3	Parallel run loop
auto	4.3094996669154355	0.0	discard	6_4_in_3	Parallel run loop
auto	10.599771163337323	0.0	discard	39_4_in_3	Parallel run loop
auto	11.01851023958955	0.0	discard	43_4_in_3	Parallel run loop
auto	9.962835199544473	0.0	discard	35_4_in_3	Parallel run loop
auto	7.387955541169579	0.0	discard	18_4_in_3	Parallel run loop
auto	9.455403984086399	0.0	discard	27_6_in_4	Parallel run loop
auto	7.309824033492363	0.0	discard	17_4_in_3	Parallel run loop
auto	9.513015228126159	0.0	discard	31_4_in_3	Parallel run loop
auto	10.549071817935308	0.0	discard	38_4_in_3	Parallel run loop
auto	8.619398901246518	0.0	discard	25_4_in_3	Parallel run loop
auto	8.465628025883607	0.0	discard	24_4_in_3	Parallel run loop
auto	9.777575516071225	0.0	discard	32_4_in_3	Parallel run loop
auto	7.471317325000314	0.0	discard	19_4_in_3	Parallel run loop
auto	6.96445270547868	0.0	discard	15_6_in_4	Parallel run loop
auto	6.388787349151957	0.0	discard	12_6_in_4	Parallel run loop
auto	8.793324245426204	0.0	discard	27_4_in_3	Parallel run loop
auto	5.309910838673369	0.0	discard	9_4_in_3	Parallel run loop
auto	8.159343201959462	0.0	discard	22_4_in_3	Parallel run loop
auto	8.774947412252958	0.0	discard	26_4_in_3	Parallel run loop
auto	6.3985247233180775	0.0	discard	13_4_in_3	Parallel run loop
auto	7.319749233109036	0.0	discard	16_6_in_4	Parallel run loop
auto	10.795436940955522	0.0	discard	40_4_in_3	Parallel run loop
auto	5.1555613069564314	0.0	discard	7_4_in_3	Parallel run loop
auto	9.859456383527776	0.0	discard	34_4_in_3	Parallel run loop
auto	8.583374246046413	0.0	discard	22_6_in_4	Parallel run loop
auto	11.057079850967028	0.0	discard	42_4_in_3	Parallel run loop
auto	3.7250031912651163	0.0	discard	4_6_in_4	Parallel run loop
auto	10.01425611560985	0.0	discard	36_4_in_3	Parallel run loop
auto	3.491959731325357	0.0	discard	3_6_in_4	Parallel run loop
auto	10.24640052316183	0.0	discard	37_4_in_3	Parallel run loop
auto	7.929378074021842	0.0	discard	19_6_in_4	Parallel run loop
auto	4.439000354968679	0.0	discard	5_6_in_4	Parallel run loop
auto	10.599771163337323	0.0	discard	39_4_in_3	Parallel run loop
auto	10.01756455102368	0.0	discard	35_4_in_3	Parallel run loop
auto	11.005520545002303	0.0	discard	41_4_in_3	Parallel run loop
auto	10.938599347826347	0.0	discard	43_4_in_3	Parallel run loop
auto	6.764428342593895	0.0	discard	13_6_in_4	Parallel run loop
auto	7.387955541169579	0.0	discard	18_4_in_3	Parallel run loop
auto	9.630499639624855	0.0	discard	31_4_in_3	Parallel run loop
auto	9.453859029064638	0.0	discard	27_6_in_4	Parallel run loop
auto	8.627146868055858	0.0	discard	25_4_in_3	Parallel run loop
auto	8.541657663661779	0.0	discard	24_4_in_3	Parallel run loop
auto	8.778031375178879	0.0	discard	28_4_in_3	Parallel run loop
auto	6.154772890366584	0.0	discard	11_4_in_3	Parallel run loop
auto	9.659578206958082	0.0	discard	32_4_in_3	Parallel run loop
auto	8.819050170221848	0.0	discard	27_4_in_3	Parallel run loop
auto	8.320099620937464	0.0	discard	23_4_in_3	Parallel run loop
auto	9.482626977216624	0.0	discard	30_4_in_3	Parallel run loop
auto	6.388840407653808	0.0	discard	12_6_in_4	Parallel run loop
auto	7.321655420249306	0.0	discard	16_6_in_4	Parallel run loop
auto	4.309409782028365	0.0	discard	5_4_in_3	Parallel run loop
auto	8.166113608019216	0.0	discard	22_4_in_3	Parallel run loop
auto	8.578042711805615	0.0	discard	22_6_in_4	Parallel run loop
auto	10.776309862715156	0.0	discard	40_4_in_3	Parallel run loop
auto	6.4651486294270235	0.0	discard	13_4_in_3	Parallel run loop
auto	9.931246793297	0.0	discard	34_4_in_3	Parallel run loop
auto	3.2320607503195915	0.0	discard	3_4_in_3	Parallel run loop
auto	5.464261083124018	0.0	discard	10_4_in_3	Parallel run loop
auto	7.15750196563385	0.0	discard	16_4_in_3	Parallel run loop
auto	10.947326139296766	0.0	discard	42_4_in_3	Parallel run loop
auto	6.339849586688972	0.0	discard	11_6_in_4	Parallel run loop
auto	10.599771163337323	0.0	discard	39_4_in_3	Parallel run loop
auto	11.01851023958955	0.0	discard	43_4_in_3	Parallel run loop
auto	10.004519810681641	0.0	discard	35_4_in_3	Parallel run loop
auto	10.951836854576245	0.0	discard	41_4_in_3	Parallel run loop
auto	6.465828989260902	0.0	discard	14_4_in_3	Parallel run loop
auto	10.08995002629652	0.0	discard	36_4_in_3	Parallel run loop
auto	9.775923840163465	0.0	discard	33_4_in_3	Parallel run loop
auto	8.620972216247035	0.0	discard	24_4_in_3	Parallel run loop
auto	7.4645934216366685	0.0	discard	18_4_in_3	Parallel run loop
auto	7.606741618201064	0.0	discard	17_6_in_4	Parallel run loop
auto	9.474361225301514	0.0	discard	27_6_in_4	Parallel run loop
auto	9.62351876597532	0.0	discard	31_4_in_3	Parallel run loop
auto	8.783958262090518	0.0	discard	27_4_in_3	Parallel run loop
auto	9.255840516534487	0.0	discard	26_6_in_4	Parallel run loop
auto	8.563014759510843	0.0	discard	25_4_in_3	Parallel run loop
auto	9.81626260602841	0.0	discard	32_4_in_3	Parallel run loop
auto	8.400840174312453	0.0	discard	23_4_in_3	Parallel run loop
auto	6.155976403489312	0.0	discard	11_4_in_3	Parallel run loop
auto	4.154750717508222	0.0	discard	4_4_in_3	Parallel run loop
auto	8.807448787223308	0.0	discard	24_6_in_4	Parallel run loop
auto	4.3094996669154355	0.0	discard	6_4_in_3	Parallel run loop
auto	7.742742602208797	0.0	discard	21_4_in_3	Parallel run loop
auto	4.309418543637569	0.0	discard	5_4_in_3	Parallel run loop
auto	10.791219693178732	0.0	discard	40_4_in_3	Parallel run loop
auto	8.617823912698872	0.0	discard	22_6_in_4	Parallel run loop
auto	9.845341491853466	0.0	discard	34_4_in_3	Parallel run loop
auto	10.433111037339204	0.0	discard	38_4_in_3	Parallel run loop
auto	8.667979194105069	0.0	discard	23_6_in_4	Parallel run loop
auto	7.31236927865076	0.0	discard	17_4_in_3	Parallel run loop
auto	10.947326139296766	0.0	discard	42_4_in_3	Parallel run loop
auto	6.105808789705966	0.0	discard	10_6_in_4	Parallel run loop
auto	5.309910838673369	0.0	discard	9_4_in_3	Parallel run loop
auto	9.775923840163465	0.0	discard	33_4_in_3	Parallel run loop
auto	9.96093481479161	0.0	discard	35_4_in_3	Parallel run loop
auto	11.01851023958955	0.0	discard	43_4_in_3	Parallel run loop
auto	10.71237837799699	0.0	discard	39_4_in_3	Parallel run loop
auto	10.929690989571514	0.0	discard	41_4_in_3	Parallel run loop
auto	10.086806034066448	0.0	discard	36_4_in_3	Parallel run loop
auto	5.309456355946519	0.0	discard	8_4_in_3	Parallel run loop
auto	8.620972216247035	0.0	discard	24_4_in_3	Parallel run loop
auto	9.455403984086399	0.0	discard	27_6_in_4	Parallel run loop
auto	7.47650969637775	0.0	discard	19_4_in_3	Parallel run loop
auto	7.4669807785704645	0.0	discard	18_4_in_3	Parallel run loop
auto	8.851527856275144	0.0	discard	27_4_in_3	Parallel run loop
auto	9.62790088658898	0.0	discard	31_4_in_3	Parallel run loop
auto	9.255840516534487	0.0	discard	26_6_in_4	Parallel run loop
auto	9.712041007344903	0.0	discard	32_4_in_3	Parallel run loop
auto	6.309947848401362	0.0	discard	12_4_in_3	Parallel run loop
auto	6.154772890366584	0.0	discard	11_4_in_3	Parallel run loop
auto	8.563014759510843	0.0	discard	25_4_in_3	Parallel run loop
auto	3.7250031912651163	0.0	discard	4_6_in_4	Parallel run loop
auto	5.155053785931084	0.0	discard	7_4_in_3	Parallel run loop
auto	8.472237346101952	0.0	discard	23_4_in_3	Parallel run loop
auto	8.774947412252958	0.0	discard	26_4_in_3	Parallel run loop
auto	10.273658222250052	0.0	discard	37_4_in_3	Parallel run loop
auto	10.786341192256783	0.0	discard	40_4_in_3	Parallel run loop
auto	6.57626910209534	0.0	discard	15_4_in_3	Parallel run loop
auto	8.583374246046413	0.0	discard	22_6_in_4	Parallel run loop
auto	8.668469913995917	0.0	discard	23_6_in_4	Parallel run loop
auto	9.933537883294077	0.0	discard	34_4_in_3	Parallel run loop
auto	7.311097994808766	0.0	discard	17_4_in_3	Parallel run loop
auto	10.941341261088779	0.0	discard	42_4_in_3	Parallel run loop
auto	9.233300706453429	0.0	discard	29_4_in_3	Parallel run loop
auto	6.106830973924127	0.0	discard	10_6_in_4	Parallel run loop
auto	10.100856434129922	0.0	discard	35_4_in_3	Parallel run loop
auto	11.01851023958955	0.0	discard	43_4_in_3	Parallel run loop
auto	9.701718871914597	0.0	discard	33_4_in_3	Parallel run loop
auto	10.619926529082107	0.0	discard	39_4_in_3	Parallel run loop
auto	10.940553511555468	0.0	discard	41_4_in_3	Parallel run loop
auto	10.143929657656013	0.0	discard	36_4_in_3	Parallel run loop
auto	3.4919620863456333	0.0	discard	3_6_in_4	Parallel run loop
auto	8.591953675831972	0.0	discard	24_4_in_3	Parallel run loop
auto	9.474361225301514	0.0	discard	27_6_in_4	Parallel run loop
auto	6.758530280097716	0.0	discard	13_6_in_4	Parallel run loop
auto	4.438123057858091	0.0	discard	5_6_in_4	Parallel run loop
auto	7.4645934216366685	0.0	discard	18_4_in_3	Parallel run loop
auto	9.635390066119172	0.0	discard	31_4_in_3	Parallel run loop
auto	8.793906030236618	0.0	discard	27_4_in_3	Parallel run loop
auto	9.468390635852147	0.0	discard	30_4_in_3	Parallel run loop
auto	8.627146868055858	0.0	discard	25_4_in_3	Parallel run loop
auto	7.15750196563385	0.0	discard	16_4_in_3	Parallel run loop
auto	9.743762411586093	0.0	discard	32_4_in_3	Parallel run loop
auto	8.778031375178879	0.0	discard	28_4_in_3	Parallel run loop
auto	6.339849586688972	0.0	discard	11_6_in_4	Parallel run loop
auto	8.089384994607542	0.0	discard	20_6_in_4	Parallel run loop
auto	5.464261083124018	0.0	discard	10_4_in_3	Parallel run loop
auto	3.232052318453766	0.0	discard	3_4_in_3	Parallel run loop
auto	4.815183322352559	0.0	discard	6_6_in_4	Parallel run loop
auto	10.776309862715156	0.0	discard	40_4_in_3	Parallel run loop
auto	8.626434343123188	0.0	discard	22_6_in_4	Parallel run loop
auto	9.942756554192467	0.0	discard	34_4_in_3	Parallel run loop
auto	6.964581745490916	0.0	discard	15_6_in_4	Parallel run loop
auto	8.666274702120212	0.0	discard	23_6_in_4	Parallel run loop
auto	7.6651078665839885	0.0	discard	17_6_in_4	Parallel run loop
auto	6.465828989260902	0.0	discard	14_4_in_3	Parallel run loop
auto	10.947326139296766	0.0	discard	42_4_in_3	Parallel run loop
auto	11.01851023958955	0.0	discard	43_4_in_3	Parallel run loop
auto	10.940553511555468	0.0	discard	41_4_in_3	Parallel run loop
auto	10.09033025722551	0.0	discard	35_4_in_3	Parallel run loop
auto	10.599771163337323	0.0	discard	39_4_in_3	Parallel run loop
auto	9.783113701199017	0.0	discard	33_4_in_3	Parallel run loop
auto	4.154750717508222	0.0	discard	4_4_in_3	Parallel run loop
auto	10.090848203208573	0.0	discard	36_4_in_3	Parallel run loop
auto	1.7706427928987616	0.0	keep	5_TAN_in_4	Auto run attempts=1000
auto	1.862142861770641	0.0	keep	2_L_in_6	Auto run attempts=20
auto	1.199329630148091	0.0	keep	4_3_in_5	Auto run attempts=50
auto	3.621594402137817	0.0	keep	3_L_in_4	Auto run attempts=50
auto	0.522694087062294	0.0	keep	3_3_in_L	Auto run attempts=50
auto	3.6261051814297343	0.0	discard	3_L_in_4	Auto run attempts=10
auto	3.6261051814297343	0.0	discard	3_L_in_4	Auto run attempts=10
auto	3.0219262000733296	0.0	discard	4_6_in_5	Auto run attempts=50
auto	3.0219262000733296	0.0	discard	4_6_in_5	Auto run attempts=50
auto	3.0219262000733296	0.0	discard	4_6_in_5	Auto run attempts=50
auto	3.0219262000733296	0.0	discard	4_6_in_5	Auto run attempts=50
auto	1.9788046921054667	0.0	keep	8_4_in_CIRCLE	Parallel run loop
auto	1.5811409365011266	0.0	keep	5_4_in_CIRCLE	Parallel run loop
auto	1.2884727610798294	0.0	keep	3_4_in_CIRCLE	Parallel run loop
auto	1.6885450821236676	0.0	keep	6_4_in_CIRCLE	Parallel run loop
auto	1.8027801715130694	0.0	keep	7_4_in_CIRCLE	Parallel run loop
auto	2.0776110620772843	0.0	keep	9_4_in_CIRCLE	Parallel run loop
auto	2.2138868882706713	0.0	keep	11_4_in_CIRCLE	Parallel run loop
auto	2.1213242420380247	0.0	keep	10_4_in_CIRCLE	Parallel run loop
auto	2.8052640946118728	0.0	keep	11_4_in_DOMINO	Parallel run loop
auto	2.5045040035272095	0.0	keep	14_4_in_CIRCLE	Parallel run loop
auto	2.897203954596426	0.0	keep	12_4_in_DOMINO	Parallel run loop
auto	3.0000246257693	0.0	keep	13_4_in_DOMINO	Parallel run loop
auto	11.407042400184585	0.0	keep	13_CIRCLE_in_3	Parallel run loop
auto	4.792049696275617	0.0	keep	17_CIRCLE_in_CIRCLE	Parallel run loop
auto	4.029653631456982	0.0	keep	12_CIRCLE_in_CIRCLE	Parallel run loop
auto	4.521808642531515	0.0	keep	15_CIRCLE_in_CIRCLE	Parallel run loop
auto	2.471413011309539	0.0	keep	9_4_in_DOMINO	Parallel run loop
auto	2.642658855793978	0.0	keep	16_4_in_CIRCLE	Parallel run loop
auto	2.360743020340796	0.0	keep	13_4_in_CIRCLE	Parallel run loop
auto	2.533694503945198	0.0	keep	15_4_in_CIRCLE	Parallel run loop
auto	4.3284563187822975	0.0	keep	14_CIRCLE_in_CIRCLE	Parallel run loop
auto	2.677737171847006	0.0	keep	17_4_in_CIRCLE	Parallel run loop
auto	4.615463307860416	0.0	keep	16_CIRCLE_in_CIRCLE	Parallel run loop
auto	2.9793574186395926	0.0	keep	20_4_in_CIRCLE	Parallel run loop
auto	3.1590245109501134	0.0	keep	22_4_in_CIRCLE	Parallel run loop
auto	5.1223780819223546	0.0	keep	20_CIRCLE_in_CIRCLE	Parallel run loop
auto	2.7876710309853765	0.0	keep	18_4_in_CIRCLE	Parallel run loop
auto	4.863717375030539	0.0	keep	18_CIRCLE_in_CIRCLE	Parallel run loop
auto	11.464317228661605	0.0	keep	14_CIRCLE_in_3	Parallel run loop
auto	2.2361302572410375	0.0	keep	12_4_in_CIRCLE	Parallel run loop
auto	2.862113316150418	0.0	keep	19_4_in_CIRCLE	Parallel run loop
auto	3.7877138673670863	0.0	keep	22_4_in_DOMINO	Parallel run loop
auto	3.253038612340175	0.0	keep	23_4_in_CIRCLE	Parallel run loop
auto	3.0663960533976655	0.0	keep	21_4_in_CIRCLE	Parallel run loop
auto	3.864556172035201	0.0	keep	23_4_in_DOMINO	Parallel run loop
auto	3.453960078999148	0.0	keep	25_4_in_CIRCLE	Parallel run loop
auto	3.350785956913408	0.0	keep	24_4_in_CIRCLE	Parallel run loop
auto	3.9029694332807283	0.0	keep	31_4_in_CIRCLE	Parallel run loop
auto	3.9737574606956207	0.0	keep	32_4_in_CIRCLE	Parallel run loop
auto	3.8310642442420386	0.0	keep	30_4_in_CIRCLE	Parallel run loop
auto	3.9176905185549984	0.0	keep	24_4_in_DOMINO	Parallel run loop
auto	3.4477657216928637	0.0	keep	19_4_in_DOMINO	Parallel run loop
auto	3.749384260497382	0.0	keep	29_4_in_CIRCLE	Parallel run loop
auto	3.674973215672349	0.0	keep	28_4_in_CIRCLE	Parallel run loop
auto	3.9648433701253083	0.0	keep	25_4_in_DOMINO	Parallel run loop
auto	3.521868185335603	0.0	keep	26_4_in_CIRCLE	Parallel run loop
auto	4.043853383063221	0.0	keep	33_4_in_CIRCLE	Parallel run loop
auto	3.5968622108346717	0.0	keep	27_4_in_CIRCLE	Parallel run loop
auto	4.000056511075171	0.0	keep	26_4_in_DOMINO	Parallel run loop
auto	4.88782756345443	0.0	keep	38_4_in_DOMINO	Parallel run loop
auto	4.114530145388304	0.0	keep	34_4_in_CIRCLE	Parallel run loop
auto	4.797835944426026	0.0	keep	37_4_in_DOMINO	Parallel run loop
auto	5.000462803754726	0.0	keep	39_4_in_DOMINO	Parallel run loop
auto	4.950384593799293	0.0	keep	40_4_in_DOMINO	Parallel run loop
auto	4.1864284382568	0.0	keep	35_4_in_CIRCLE	Parallel run loop
auto	5.001719211188356	0.0	keep	41_4_in_DOMINO	Parallel run loop
auto	4.567538114889926	0.0	keep	33_4_in_DOMINO	Parallel run loop
auto	4.500408698117066	0.0	keep	34_4_in_DOMINO	Parallel run loop
auto	1.9302984084799009	0.0	keep	4_4_in_DOMINO	Parallel run loop
auto	5.00082158077448	0.0	keep	42_4_in_DOMINO	Parallel run loop
auto	2.7921177873553034	0.0	keep	11_4_in_DOMINO	Parallel run loop
auto	3.0104540932523642	0.0	discard	13_4_in_DOMINO	Parallel run loop
auto	2.643847752583437	0.0	discard	16_4_in_CIRCLE	Parallel run loop
auto	2.9272761022686486	0.0	keep	20_4_in_CIRCLE	Parallel run loop
auto	3.034659308252546	0.0	keep	22_4_in_CIRCLE	Parallel run loop
auto	3.7699391057109604	0.0	keep	31_4_in_CIRCLE	Parallel run loop
auto	3.831414265379299	0.0	keep	32_4_in_CIRCLE	Parallel run loop
auto	3.6986148257478813	0.0	keep	30_4_in_CIRCLE	Parallel run loop
auto	2.8016697604273646	0.0	discard	18_4_in_CIRCLE	Parallel run loop
auto	3.610650607446699	0.0	keep	29_4_in_CIRCLE	Parallel run loop
auto	3.542118141393038	0.0	keep	28_4_in_CIRCLE	Parallel run loop
auto	2.8776782496867814	0.0	discard	19_4_in_CIRCLE	Parallel run loop
auto	3.1062776126793237	0.0	keep	23_4_in_CIRCLE	Parallel run loop
auto	3.385160352592969	0.0	keep	26_4_in_CIRCLE	Parallel run loop
auto	3.9068086853654047	0.0	keep	33_4_in_CIRCLE	Parallel run loop
auto	3.4610691651651218	0.0	keep	27_4_in_CIRCLE	Parallel run loop
auto	3.968002154718916	0.0	keep	34_4_in_CIRCLE	Parallel run loop
auto	3.8808777937331325	0.0	discard	23_4_in_DOMINO	Parallel run loop
auto	3.8034922878807986	0.0	discard	22_4_in_DOMINO	Parallel run loop
auto	3.1064519114939206	0.0	discard	21_4_in_CIRCLE	Parallel run loop
auto	3.3028873105543313	0.0	keep	25_4_in_CIRCLE	Parallel run loop
auto	4.033340134559778	0.0	keep	35_4_in_CIRCLE	Parallel run loop
auto	3.2148902668406225	0.0	keep	24_4_in_CIRCLE	Parallel run loop
auto	3.906440523943029	0.0	keep	24_4_in_DOMINO	Parallel run loop
auto	4.014200476639972	0.0	discard	25_4_in_DOMINO	Parallel run loop
auto	4.020360663309433	0.0	discard	26_4_in_DOMINO	Parallel run loop
auto	2.8012059274101717	0.0	discard	11_4_in_DOMINO	Parallel run loop
auto	4.842892429526913	0.0	keep	38_4_in_DOMINO	Parallel run loop
auto	3.0104540932523642	0.0	discard	13_4_in_DOMINO	Parallel run loop
auto	4.787069204038174	0.0	keep	37_4_in_DOMINO	Parallel run loop
auto	2.643847752583437	0.0	discard	16_4_in_CIRCLE	Parallel run loop
auto	3.7363017755890975	0.0	keep	31_4_in_CIRCLE	Parallel run loop
auto	2.9479967602447665	0.0	discard	20_4_in_CIRCLE	Parallel run loop
auto	3.8017880596829317	0.0	keep	32_4_in_CIRCLE	Parallel run loop
auto	3.6608514475077105	0.0	keep	30_4_in_CIRCLE	Parallel run loop
auto	2.8016697604273646	0.0	discard	18_4_in_CIRCLE	Parallel run loop
auto	4.951629970152763	0.0	keep	39_4_in_DOMINO	Parallel run loop
auto	2.8776782496867814	0.0	discard	19_4_in_CIRCLE	Parallel run loop
auto	3.631402274099691	0.0	discard	29_4_in_CIRCLE	Parallel run loop
auto	3.0781836552823467	0.0	keep	23_4_in_CIRCLE	Parallel run loop
auto	3.584777514148173	0.0	discard	28_4_in_CIRCLE	Parallel run loop
auto	3.887469729687588	0.0	keep	33_4_in_CIRCLE	Parallel run loop
auto	3.361277673168526	0.0	keep	26_4_in_CIRCLE	Parallel run loop
auto	3.9539973434835405	0.0	keep	34_4_in_CIRCLE	Parallel run loop
auto	3.4031290733920567	0.0	keep	27_4_in_CIRCLE	Parallel run loop
auto	3.8808777937331325	0.0	discard	23_4_in_DOMINO	Parallel run loop
auto	3.8034922878807986	0.0	discard	22_4_in_DOMINO	Parallel run loop
auto	3.1064519114939206	0.0	discard	21_4_in_CIRCLE	Parallel run loop
auto	4.0263742364571495	0.0	keep	35_4_in_CIRCLE	Parallel run loop
auto	3.1927103888319	0.0	keep	25_4_in_CIRCLE	Parallel run loop
auto	3.149660484527543	0.0	keep	24_4_in_CIRCLE	Parallel run loop
auto	3.9241229167278884	0.0	discard	24_4_in_DOMINO	Parallel run loop
auto	4.014200476639972	0.0	discard	25_4_in_DOMINO	Parallel run loop
auto	2.8012059274101717	0.0	discard	11_4_in_DOMINO	Parallel run loop
auto	4.020360663309433	0.0	discard	26_4_in_DOMINO	Parallel run loop
auto	3.0104540932523642	0.0	discard	13_4_in_DOMINO	Parallel run loop
auto	2.643847752583437	0.0	discard	16_4_in_CIRCLE	Parallel run loop
auto	4.941235105550325	0.0	keep	40_4_in_DOMINO	Parallel run loop
auto	2.9479967602447665	0.0	discard	20_4_in_CIRCLE	Parallel run loop
auto	5.034186680493225	0.0	discard	38_4_in_DOMINO	Parallel run loop
auto	3.7364237438117933	0.0	discard	31_4_in_CIRCLE	Parallel run loop
auto	2.8016697604273646	0.0	discard	18_4_in_CIRCLE	Parallel run loop
auto	3.5206741293960166	0.0	keep	30_4_in_CIRCLE	Parallel run loop
auto	3.7201595605209654	0.0	keep	32_4_in_CIRCLE	Parallel run loop
auto	2.8776782496867814	0.0	discard	19_4_in_CIRCLE	Parallel run loop
auto	4.810812353443134	0.0	discard	37_4_in_DOMINO	Parallel run loop
auto	3.877134109256151	0.0	keep	33_4_in_CIRCLE	Parallel run loop
auto	3.115803431953349	0.0	discard	23_4_in_CIRCLE	Parallel run loop
