commit	score	memory_gb	status	problem	description
auto	5.929597324436657	0.0	discard	48_3_in_4	Parallel run loop
auto	2.90668473262429	0.0	discard	19_3_in_5	Parallel run loop
auto	1.7415210383219066	0.0	discard	7_3_in_5	Parallel run loop
auto	3.948800657908777	0.0	discard	34_3_in_5	Parallel run loop
auto	1.4717817830983368	0.0	discard	5_3_in_5	Parallel run loop
auto	4.0839924009099215	0.0	discard	36_3_in_5	Parallel run loop
auto	5.580378387007341	0.0	discard	44_3_in_4	Parallel run loop
auto	2.6472479673349247	0.0	discard	16_3_in_5	Parallel run loop
auto	1.9760347408703653	0.0	discard	9_3_in_5	Parallel run loop
auto	5.098313459946513	0.0	discard	50_3_in_5	Parallel run loop
auto	4.924736823133839	0.0	discard	36_3_in_4	Parallel run loop
auto	5.761724730717903	0.0	discard	46_3_in_4	Parallel run loop
auto	4.456356655070911	0.0	discard	42_3_in_5	Parallel run loop
auto	4.099205259288894	0.0	discard	26_3_in_4	Parallel run loop
auto	3.356177175891247	0.0	discard	25_3_in_5	Parallel run loop
auto	3.681440123460129	0.0	discard	21_3_in_4	Parallel run loop
auto	4.422056896058394	0.0	discard	41_3_in_5	Parallel run loop
auto	1.8622723004191593	0.0	discard	8_3_in_5	Parallel run loop
auto	5.3499918398455115	0.0	discard	41_3_in_4	Parallel run loop
auto	3.126831642952583	0.0	discard	22_3_in_5	Parallel run loop
auto	5.523259260697218	0.0	discard	43_3_in_4	Parallel run loop
auto	5.366447415984795	0.0	discard	42_3_in_4	Parallel run loop
auto	2.5579609242769745	0.0	discard	15_3_in_5	Parallel run loop
auto	3.5555978613172337	0.0	discard	28_3_in_5	Parallel run loop
auto	4.708440774722989	0.0	discard	45_3_in_5	Parallel run loop
auto	4.129488552760525	0.0	discard	37_3_in_5	Parallel run loop
auto	5.802928164894558	0.0	discard	48_3_in_4	Parallel run loop
auto	4.589849951911184	0.0	discard	44_3_in_5	Parallel run loop
auto	5.100913327074751	0.0	discard	38_3_in_4	Parallel run loop
auto	3.468060179153874	0.0	discard	19_3_in_4	Parallel run loop
auto	4.51504652331018	0.0	discard	43_3_in_5	Parallel run loop
auto	2.3751286200987587	0.0	discard	13_3_in_5	Parallel run loop
auto	5.738797947989674	0.0	discard	47_3_in_4	Parallel run loop
auto	2.8997740331083426	0.0	discard	19_3_in_5	Parallel run loop
auto	1.7415207914826145	0.0	discard	7_3_in_5	Parallel run loop
auto	1.473592472197917	0.0	discard	5_3_in_5	Parallel run loop
auto	3.2113415829947454	0.0	discard	23_3_in_5	Parallel run loop
auto	4.894371710129382	0.0	discard	36_3_in_4	Parallel run loop
auto	2.2809007239451358	0.0	discard	12_3_in_5	Parallel run loop
auto	2.737924355345415	0.0	discard	17_3_in_5	Parallel run loop
auto	3.7755732078794058	0.0	discard	22_3_in_4	Parallel run loop
auto	2.857568285484163	0.0	discard	13_3_in_4	Parallel run loop
auto	4.780181091478305	0.0	discard	46_3_in_5	Parallel run loop
auto	4.22969762274517	0.0	discard	39_3_in_5	Parallel run loop
auto	1.6123349283158912	0.0	discard	6_3_in_5	Parallel run loop
auto	3.483426811457104	0.0	discard	27_3_in_5	Parallel run loop
auto	3.6277870324665935	0.0	discard	29_3_in_5	Parallel run loop
auto	3.6831806891837506	0.0	discard	30_3_in_5	Parallel run loop
auto	4.426952268707845	0.0	discard	41_3_in_5	Parallel run loop
auto	3.3581962865360193	0.0	discard	25_3_in_5	Parallel run loop
auto	4.480246146456048	0.0	discard	42_3_in_5	Parallel run loop
auto	2.466707612043534	0.0	discard	14_3_in_5	Parallel run loop
auto	3.477428483437989	0.0	discard	19_3_in_4	Parallel run loop
auto	3.557699210775021	0.0	discard	28_3_in_5	Parallel run loop
auto	4.624682772791294	0.0	discard	44_3_in_5	Parallel run loop
auto	4.576846746639815	0.0	discard	43_3_in_5	Parallel run loop
auto	3.7595387247829732	0.0	discard	31_3_in_5	Parallel run loop
auto	2.556670699454337	0.0	discard	15_3_in_5	Parallel run loop
auto	5.971086359809669	0.0	discard	48_3_in_4	Parallel run loop
auto	4.432414689487735	0.0	discard	30_3_in_4	Parallel run loop
auto	4.964032411740377	0.0	discard	37_3_in_4	Parallel run loop
auto	5.379913259996092	0.0	discard	42_3_in_4	Parallel run loop
auto	4.6929965981694926	0.0	discard	45_3_in_5	Parallel run loop
auto	5.754668441328534	0.0	discard	47_3_in_4	Parallel run loop
auto	3.27451044037248	0.0	discard	24_3_in_5	Parallel run loop
auto	5.029698568659449	0.0	discard	49_3_in_5	Parallel run loop
auto	1.7415209130522538	0.0	discard	7_3_in_5	Parallel run loop
auto	4.3620227855576355	0.0	discard	40_3_in_5	Parallel run loop
auto	2.9022641792491104	0.0	discard	19_3_in_5	Parallel run loop
auto	4.92548759598695	0.0	discard	36_3_in_4	Parallel run loop
auto	2.281833961287802	0.0	discard	12_3_in_5	Parallel run loop
auto	2.978697224883824	0.0	discard	20_3_in_5	Parallel run loop
auto	4.299771615833073	0.0	discard	39_3_in_5	Parallel run loop
auto	2.8582751542342395	0.0	discard	13_3_in_4	Parallel run loop
auto	3.0613289023839085	0.0	discard	21_3_in_5	Parallel run loop
auto	5.440472858791266	0.0	discard	44_3_in_4	Parallel run loop
auto	3.494815378712013	0.0	discard	27_3_in_5	Parallel run loop
auto	5.6558684755321496	0.0	discard	45_3_in_4	Parallel run loop
auto	4.425709645578415	0.0	discard	41_3_in_5	Parallel run loop
auto	3.691837118509828	0.0	discard	30_3_in_5	Parallel run loop
auto	4.502590708349205	0.0	discard	42_3_in_5	Parallel run loop
auto	5.689092123500306	0.0	discard	46_3_in_4	Parallel run loop
auto	3.486452370750221	0.0	discard	19_3_in_4	Parallel run loop
auto	2.6431567764102857	0.0	discard	16_3_in_5	Parallel run loop
auto	5.239643909263239	0.0	discard	41_3_in_4	Parallel run loop
auto	2.1831181048744353	0.0	keep	11_3_in_5	Parallel run loop
auto	3.558165075207818	0.0	discard	28_3_in_5	Parallel run loop
auto	4.10610368697918	0.0	discard	26_3_in_4	Parallel run loop
auto	4.656049982961445	0.0	discard	44_3_in_5	Parallel run loop
auto	4.975700269816607	0.0	discard	37_3_in_4	Parallel run loop
auto	1.8618556783625688	0.0	discard	8_3_in_5	Parallel run loop
auto	2.553750740240545	0.0	discard	15_3_in_5	Parallel run loop
auto	4.591425484454163	0.0	discard	45_3_in_5	Parallel run loop
auto	5.0900951944982715	0.0	discard	38_3_in_4	Parallel run loop
auto	4.3460118094812765	0.0	discard	29_3_in_4	Parallel run loop
auto	5.76311397297169	0.0	discard	47_3_in_4	Parallel run loop
auto	4.113664266953121	0.0	discard	37_3_in_5	Parallel run loop
auto	4.909876385398196	0.0	discard	47_3_in_5	Parallel run loop
auto	4.84752314405961	0.0	discard	35_3_in_4	Parallel run loop
auto	3.427654606622236	0.0	discard	26_3_in_5	Parallel run loop
auto	1.741302549419614	0.0	discard	7_3_in_5	Parallel run loop
auto	2.082835991858295	0.0	discard	10_3_in_5	Parallel run loop
auto	2.3782120596940812	0.0	discard	13_3_in_5	Parallel run loop
auto	3.2171431614932273	0.0	discard	23_3_in_5	Parallel run loop
auto	5.186971215069596	0.0	discard	39_3_in_4	Parallel run loop
auto	2.8578656965405065	0.0	discard	13_3_in_4	Parallel run loop
auto	2.716529018488219	0.0	keep	17_3_in_5	Parallel run loop
auto	5.611159178505066	0.0	discard	44_3_in_4	Parallel run loop
auto	3.6908900401707005	0.0	discard	30_3_in_5	Parallel run loop
auto	4.7871002244129865	0.0	discard	46_3_in_5	Parallel run loop
auto	3.7717778928562176	0.0	discard	22_3_in_4	Parallel run loop
auto	5.674564119611208	0.0	discard	45_3_in_4	Parallel run loop
auto	4.222375790947403	0.0	discard	38_3_in_5	Parallel run loop
auto	3.488787478180563	0.0	discard	19_3_in_4	Parallel run loop
auto	5.8114415421891445	0.0	discard	46_3_in_4	Parallel run loop
auto	3.7386215932369655	0.0	discard	31_3_in_5	Parallel run loop
auto	3.617564221783761	0.0	discard	29_3_in_5	Parallel run loop
auto	2.184113316827124	0.0	discard	11_3_in_5	Parallel run loop
auto	4.180701904370921	0.0	discard	27_3_in_4	Parallel run loop
auto	3.3794413918349644	0.0	discard	18_3_in_4	Parallel run loop
auto	5.2869321449745525	0.0	discard	41_3_in_4	Parallel run loop
auto	4.099902619957448	0.0	discard	26_3_in_4	Parallel run loop
auto	4.94611631431379	0.0	discard	37_3_in_4	Parallel run loop
auto	1.8622738679919528	0.0	discard	8_3_in_5	Parallel run loop
auto	4.694982079279858	0.0	discard	45_3_in_5	Parallel run loop
auto	2.4667475748230054	0.0	discard	14_3_in_5	Parallel run loop
auto	4.351610873160315	0.0	discard	29_3_in_4	Parallel run loop
auto	4.1099824604207615	0.0	discard	37_3_in_5	Parallel run loop
auto	1.6123349320824532	0.0	discard	6_3_in_5	Parallel run loop
auto	1.7415209844959807	0.0	discard	7_3_in_5	Parallel run loop
auto	4.515820030247655	0.0	discard	31_3_in_4	Parallel run loop
auto	4.278839976416659	0.0	discard	28_3_in_4	Parallel run loop
auto	3.827475410375657	0.0	discard	32_3_in_5	Parallel run loop
auto	4.024842005050836	0.0	discard	35_3_in_5	Parallel run loop
auto	2.7348130536538497	0.0	discard	17_3_in_5	Parallel run loop
auto	4.091871112434221	0.0	discard	36_3_in_5	Parallel run loop
auto	2.859160060143747	0.0	discard	13_3_in_4	Parallel run loop
auto	4.443781336424065	0.0	discard	30_3_in_4	Parallel run loop
auto	5.537220782817872	0.0	discard	43_3_in_4	Parallel run loop
auto	4.728885506296419	0.0	discard	34_3_in_4	Parallel run loop
auto	3.2850444744109897	0.0	discard	24_3_in_5	Parallel run loop
auto	4.173929060550221	0.0	discard	38_3_in_5	Parallel run loop
auto	5.023012218450543	0.0	discard	49_3_in_5	Parallel run loop
auto	5.248882792288608	0.0	discard	40_3_in_4	Parallel run loop
auto	2.987135679186676	0.0	discard	20_3_in_5	Parallel run loop
auto	4.319688712961276	0.0	discard	40_3_in_5	Parallel run loop
auto	3.045944189603822	0.0	discard	21_3_in_5	Parallel run loop
auto	2.184698476332327	0.0	discard	11_3_in_5	Parallel run loop
auto	4.655367476907289	0.0	discard	33_3_in_4	Parallel run loop
auto	4.189034677679612	0.0	discard	27_3_in_4	Parallel run loop
auto	2.6449404683964035	0.0	discard	16_3_in_5	Parallel run loop
auto	3.3888395806390625	0.0	discard	18_3_in_4	Parallel run loop
auto	4.994973721928029	0.0	discard	37_3_in_4	Parallel run loop
auto	4.122010831845911	0.0	discard	26_3_in_4	Parallel run loop
auto	2.464408192998839	0.0	discard	14_3_in_5	Parallel run loop
auto	5.304534472945514	0.0	discard	41_3_in_4	Parallel run loop
auto	4.991698510164087	0.0	discard	38_3_in_4	Parallel run loop
auto	2.8201089707925204	0.0	discard	18_3_in_5	Parallel run loop
auto	4.347946557981782	0.0	discard	29_3_in_4	Parallel run loop
auto	4.120656828017062	0.0	discard	37_3_in_5	Parallel run loop
auto	1.6123349331599344	0.0	discard	6_3_in_5	Parallel run loop
auto	4.511860012813937	0.0	discard	31_3_in_4	Parallel run loop
auto	1.7415208677587173	0.0	discard	7_3_in_5	Parallel run loop
auto	4.438752437300346	0.0	discard	43_3_in_5	Parallel run loop
auto	4.817383670404271	0.0	discard	47_3_in_5	Parallel run loop
auto	2.8595205280699094	0.0	discard	13_3_in_4	Parallel run loop
auto	5.280656588544078	0.0	discard	42_3_in_4	Parallel run loop
auto	4.842493763894582	0.0	discard	35_3_in_4	Parallel run loop
auto	3.425754412392281	0.0	discard	26_3_in_5	Parallel run loop
auto	4.72054838376292	0.0	discard	34_3_in_4	Parallel run loop
auto	2.3758528333735964	0.0	discard	13_3_in_5	Parallel run loop
auto	2.082249635452869	0.0	discard	10_3_in_5	Parallel run loop
auto	3.278717691832365	0.0	discard	24_3_in_5	Parallel run loop
auto	5.157303844649163	0.0	discard	39_3_in_4	Parallel run loop
auto	3.0288109232127978	0.0	keep	21_3_in_5	Parallel run loop
auto	3.950072293576013	0.0	discard	34_3_in_5	Parallel run loop
auto	4.207172460779992	0.0	discard	38_3_in_5	Parallel run loop
auto	3.193290057917118	0.0	discard	23_3_in_5	Parallel run loop
auto	4.03395537845791	0.0	discard	25_3_in_4	Parallel run loop
auto	4.6625748808308	0.0	discard	33_3_in_4	Parallel run loop
auto	1.9752343193314466	0.0	discard	9_3_in_5	Parallel run loop
auto	4.203571201533864	0.0	discard	27_3_in_4	Parallel run loop
auto	4.233178518575633	0.0	discard	39_3_in_5	Parallel run loop
auto	4.110639822810189	0.0	discard	26_3_in_4	Parallel run loop
auto	5.271334150600021	0.0	discard	41_3_in_4	Parallel run loop
auto	2.815246222135766	0.0	discard	18_3_in_5	Parallel run loop
auto	4.978928733240983	0.0	discard	37_3_in_4	Parallel run loop
auto	2.466831869726447	0.0	discard	14_3_in_5	Parallel run loop
auto	3.389480642220638	0.0	discard	18_3_in_4	Parallel run loop
auto	5.058166227347352	0.0	discard	38_3_in_4	Parallel run loop
auto	2.2814138957971757	0.0	discard	12_3_in_5	Parallel run loop
auto	1.6123349279526509	0.0	discard	6_3_in_5	Parallel run loop
auto	4.1094622160339265	0.0	discard	37_3_in_5	Parallel run loop
auto	4.520388012798357	0.0	discard	31_3_in_4	Parallel run loop
auto	3.7759085324483843	0.0	discard	22_3_in_4	Parallel run loop
auto	5.42024606848092	0.0	discard	42_3_in_4	Parallel run loop
auto	4.760693385365639	0.0	discard	46_3_in_5	Parallel run loop
auto	4.566817653497825	0.0	discard	43_3_in_5	Parallel run loop
auto	3.866502569858283	0.0	discard	23_3_in_4	Parallel run loop
auto	3.284481646817797	0.0	discard	24_3_in_5	Parallel run loop
auto	4.756910900637155	0.0	discard	34_3_in_4	Parallel run loop
auto	3.4946801762054878	0.0	discard	27_3_in_5	Parallel run loop
auto	3.7426689933538424	0.0	discard	31_3_in_5	Parallel run loop
auto	3.625672617697556	0.0	discard	29_3_in_5	Parallel run loop
auto	3.2153728803214854	0.0	discard	23_3_in_5	Parallel run loop
auto	4.008768863399098	0.0	discard	35_3_in_5	Parallel run loop
auto	1.4735934845693035	0.0	discard	5_3_in_5	Parallel run loop
auto	3.9497496970845885	0.0	discard	34_3_in_5	Parallel run loop
auto	4.283007247897312	0.0	discard	28_3_in_4	Parallel run loop
auto	3.0634243952470155	0.0	discard	21_3_in_5	Parallel run loop
auto	4.0590501119768865	0.0	discard	36_3_in_5	Parallel run loop
auto	1.9748102647247503	0.0	discard	9_3_in_5	Parallel run loop
auto	4.656028968468122	0.0	discard	33_3_in_4	Parallel run loop
auto	4.260376886248762	0.0	discard	39_3_in_5	Parallel run loop
auto	3.8037428012903143	0.0	discard	32_3_in_5	Parallel run loop
auto	5.454007186657561	0.0	discard	43_3_in_4	Parallel run loop
auto	2.4666939588497057	0.0	discard	14_3_in_5	Parallel run loop
auto	4.308914407426947	0.0	discard	40_3_in_5	Parallel run loop
auto	4.966256840369471	0.0	discard	49_3_in_5	Parallel run loop
auto	5.329026542356188	0.0	discard	41_3_in_4	Parallel run loop
auto	4.428489554689896	0.0	discard	30_3_in_4	Parallel run loop
auto	2.979466783711956	0.0	discard	20_3_in_5	Parallel run loop
auto	5.034467245998453	0.0	discard	38_3_in_4	Parallel run loop
auto	1.612334929235357	0.0	discard	6_3_in_5	Parallel run loop
auto	4.103682599294582	0.0	discard	37_3_in_5	Parallel run loop
auto	2.9015660669460637	0.0	discard	19_3_in_5	Parallel run loop
auto	5.603678535346468	0.0	discard	44_3_in_4	Parallel run loop
auto	5.045377507433841	0.0	discard	50_3_in_5	Parallel run loop
auto	5.244840757282829	0.0	discard	40_3_in_4	Parallel run loop
auto	4.90245842663322	0.0	discard	36_3_in_4	Parallel run loop
auto	3.289283479267469	0.0	discard	24_3_in_5	Parallel run loop
auto	2.649361403270992	0.0	discard	16_3_in_5	Parallel run loop
auto	5.81827963431856	0.0	discard	46_3_in_4	Parallel run loop
auto	5.58580093192579	0.0	discard	45_3_in_4	Parallel run loop
auto	3.21105937629369	0.0	discard	23_3_in_5	Parallel run loop
auto	4.493924228272134	0.0	discard	42_3_in_5	Parallel run loop
auto	3.7619567638470017	0.0	discard	31_3_in_5	Parallel run loop
auto	4.005277566339347	0.0	discard	35_3_in_5	Parallel run loop
auto	3.923053609177237	0.0	discard	34_3_in_5	Parallel run loop
auto	1.8622743803751687	0.0	discard	8_3_in_5	Parallel run loop
auto	4.282730015094234	0.0	discard	28_3_in_4	Parallel run loop
auto	4.676514957314901	0.0	discard	33_3_in_4	Parallel run loop
auto	4.563960759695766	0.0	discard	44_3_in_5	Parallel run loop
auto	4.289794480616933	0.0	discard	39_3_in_5	Parallel run loop
auto	4.089084990644118	0.0	discard	36_3_in_5	Parallel run loop
auto	3.885487097790889	0.0	discard	33_3_in_5	Parallel run loop
auto	3.8233020304667815	0.0	discard	32_3_in_5	Parallel run loop
auto	2.4654320579789277	0.0	discard	14_3_in_5	Parallel run loop
auto	4.979730114547783	0.0	discard	49_3_in_5	Parallel run loop
auto	3.4228599881721182	0.0	discard	26_3_in_5	Parallel run loop
auto	5.487134698912385	0.0	discard	43_3_in_4	Parallel run loop
auto	4.340367246635505	0.0	discard	40_3_in_5	Parallel run loop
auto	4.802706191482471	0.0	discard	35_3_in_4	Parallel run loop
auto	5.018306190000216	0.0	discard	38_3_in_4	Parallel run loop
auto	4.8277019229280045	0.0	discard	47_3_in_5	Parallel run loop
auto	4.143613934209347	0.0	discard	37_3_in_5	Parallel run loop
auto	4.759362585879908	0.0	discard	48_3_in_5	Parallel run loop
auto	5.110057367503531	0.0	discard	50_3_in_5	Parallel run loop
auto	5.603678535346468	0.0	discard	44_3_in_4	Parallel run loop
auto	4.899192857033831	0.0	discard	36_3_in_4	Parallel run loop
auto	2.0841949454609203	0.0	discard	10_3_in_5	Parallel run loop
auto	3.935950776481037	0.0	discard	24_3_in_4	Parallel run loop
auto	5.674564119611208	0.0	discard	45_3_in_4	Parallel run loop
auto	2.3768832453155335	0.0	discard	13_3_in_5	Parallel run loop
auto	3.2010835721261195	0.0	discard	23_3_in_5	Parallel run loop
auto	4.593529505134262	0.0	discard	32_3_in_4	Parallel run loop
auto	5.082479134875117	0.0	discard	39_3_in_4	Parallel run loop
auto	3.9857846317411907	0.0	discard	35_3_in_5	Parallel run loop
auto	1.8618716603107164	0.0	discard	8_3_in_5	Parallel run loop
auto	3.9538377231806394	0.0	discard	34_3_in_5	Parallel run loop
auto	4.038424754524147	0.0	discard	25_3_in_4	Parallel run loop
auto	2.7378286820079976	0.0	discard	17_3_in_5	Parallel run loop
auto	4.562712511363263	0.0	discard	44_3_in_5	Parallel run loop
auto	2.2819571984719733	0.0	discard	12_3_in_5	Parallel run loop
auto	4.754239031409417	0.0	discard	46_3_in_5	Parallel run loop
auto	2.4689141638590084	0.0	discard	14_3_in_5	Parallel run loop
auto	3.737168748120898	0.0	discard	22_3_in_4	Parallel run loop
auto	3.8583484465639817	0.0	discard	23_3_in_4	Parallel run loop
auto	4.663887214005215	0.0	discard	33_3_in_4	Parallel run loop
auto	4.805429580421634	0.0	discard	35_3_in_4	Parallel run loop
auto	4.332066155880467	0.0	discard	40_3_in_5	Parallel run loop
auto	3.426597504011504	0.0	discard	26_3_in_5	Parallel run loop
auto	3.4882423045071786	0.0	discard	27_3_in_5	Parallel run loop
auto	4.931264383124489	0.0	discard	49_3_in_5	Parallel run loop
auto	5.48559626152193	0.0	discard	43_3_in_4	Parallel run loop
auto	3.617266739221202	0.0	discard	29_3_in_5	Parallel run loop
auto	3.678225306143217	0.0	discard	30_3_in_5	Parallel run loop
auto	5.068608299149818	0.0	discard	38_3_in_4	Parallel run loop
auto	4.711691053245578	0.0	keep	48_3_in_5	Parallel run loop
auto	4.442359209667605	0.0	discard	30_3_in_4	Parallel run loop
auto	1.4721694205581617	0.0	discard	5_3_in_5	Parallel run loop
auto	4.9136849345560885	0.0	discard	36_3_in_4	Parallel run loop
auto	3.685910490222061	0.0	discard	21_3_in_4	Parallel run loop
auto	4.433359356028343	0.0	discard	41_3_in_5	Parallel run loop
auto	3.906056380944342	0.0	keep	24_3_in_4	Parallel run loop
auto	5.503059953130056	0.0	discard	45_3_in_4	Parallel run loop
auto	4.016641778510792	0.0	discard	35_3_in_5	Parallel run loop
auto	3.2065402506167855	0.0	discard	23_3_in_5	Parallel run loop
auto	5.176271208117	0.0	discard	39_3_in_4	Parallel run loop
auto	3.1259134352899474	0.0	discard	22_3_in_5	Parallel run loop
auto	2.9845998987099747	0.0	discard	20_3_in_5	Parallel run loop
auto	1.862271666097419	0.0	discard	8_3_in_5	Parallel run loop
auto	3.7780553281177593	0.0	discard	22_3_in_4	Parallel run loop
auto	4.658079499870596	0.0	discard	44_3_in_5	Parallel run loop
auto	5.260284381638306	0.0	discard	40_3_in_4	Parallel run loop
auto	2.8857676307683255	0.0	discard	19_3_in_5	Parallel run loop
auto	2.8114070986570225	0.0	discard	18_3_in_5	Parallel run loop
auto	2.640827805863469	0.0	discard	16_3_in_5	Parallel run loop
auto	5.758890713402495	0.0	discard	46_3_in_4	Parallel run loop
auto	4.806915320751893	0.0	discard	35_3_in_4	Parallel run loop
auto	4.695692740254608	0.0	discard	46_3_in_5	Parallel run loop
auto	2.1842709921064674	0.0	discard	11_3_in_5	Parallel run loop
auto	4.480614255460139	0.0	discard	42_3_in_5	Parallel run loop
auto	3.490642278539897	0.0	discard	27_3_in_5	Parallel run loop
auto	5.51660053943319	0.0	discard	43_3_in_4	Parallel run loop
auto	4.3666181256228285	0.0	discard	40_3_in_5	Parallel run loop
auto	3.681631470291354	0.0	discard	30_3_in_5	Parallel run loop
auto	3.6170308112233998	0.0	discard	29_3_in_5	Parallel run loop
auto	5.016470904425224	0.0	discard	49_3_in_5	Parallel run loop
auto	3.3384800134969757	0.0	discard	25_3_in_5	Parallel run loop
auto	4.887656741278456	0.0	discard	48_3_in_5	Parallel run loop
auto	4.591230666149093	0.0	discard	43_3_in_5	Parallel run loop
auto	4.421136186709407	0.0	discard	30_3_in_4	Parallel run loop
auto	1.472161885925641	0.0	discard	5_3_in_5	Parallel run loop
auto	4.363638201597165	0.0	discard	29_3_in_4	Parallel run loop
auto	5.996814663389013	0.0	discard	48_3_in_4	Parallel run loop
auto	3.9525242824523072	0.0	discard	24_3_in_4	Parallel run loop
auto	5.641211908500692	0.0	discard	45_3_in_4	Parallel run loop
auto	5.463160843043507	0.0	discard	42_3_in_4	Parallel run loop
auto	2.376740105796256	0.0	discard	13_3_in_5	Parallel run loop
auto	4.025341708587841	0.0	discard	35_3_in_5	Parallel run loop
auto	3.883971622498746	0.0	discard	33_3_in_5	Parallel run loop
auto	4.599120532315853	0.0	discard	32_3_in_4	Parallel run loop
auto	2.648701413838529	0.0	discard	16_3_in_5	Parallel run loop
auto	4.869176772209432	0.0	discard	47_3_in_5	Parallel run loop
auto	2.986466100346024	0.0	discard	20_3_in_5	Parallel run loop
auto	2.0821881605889043	0.0	discard	10_3_in_5	Parallel run loop
auto	4.017844320431772	0.0	discard	25_3_in_4	Parallel run loop
auto	2.184603285048305	0.0	discard	11_3_in_5	Parallel run loop
auto	4.790403160203201	0.0	discard	35_3_in_4	Parallel run loop
auto	2.7356847057614573	0.0	discard	17_3_in_5	Parallel run loop
auto	5.651698750236632	0.0	discard	46_3_in_4	Parallel run loop
auto	4.804130046880683	0.0	discard	46_3_in_5	Parallel run loop
auto	2.892930565995893	0.0	discard	19_3_in_5	Parallel run loop
auto	4.974461249419517	0.0	discard	49_3_in_5	Parallel run loop
auto	1.9758352538910382	0.0	discard	9_3_in_5	Parallel run loop
auto	5.485418169334942	0.0	discard	43_3_in_4	Parallel run loop
