commit	score	memory_gb	status	problem	description
auto	4.916221201185569	0.0	discard	33_4_in_5	Parallel run loop
auto	13.884493816920813	0.0	discard	38_5_in_3	Parallel run loop
auto	2.8470158834265256	0.0	discard	29_4_in_8	Parallel run loop
auto	3.586179123899204	0.0	discard	27_4_in_6	Parallel run loop
auto	4.786866784335104	0.0	discard	30_4_in_5	Parallel run loop
auto	11.966322751034012	0.0	discard	26_DOMINO_in_3	Parallel run loop
auto	7.00613779632392	0.0	discard	46_3_in_3	Parallel run loop
auto	4.041621768437455	0.0	discard	36_4_in_6	Parallel run loop
auto	11.10639567382138	0.0	discard	22_DOMINO_in_3	Parallel run loop
auto	4.8942446995982385	0.0	discard	20_3_in_3	Parallel run loop
auto	3.504561196287405	0.0	discard	26_4_in_6	Parallel run loop
auto	3.89258090088692	0.0	discard	33_4_in_6	Parallel run loop
auto	5.1332484788868875	0.0	discard	35_4_in_5	Parallel run loop
auto	2.9476053891229426	0.0	discard	35_4_in_8	Parallel run loop
auto	12.771121686878123	0.0	discard	32_5_in_3	Parallel run loop
auto	2.8900148954966616	0.0	discard	9_5_in_6	Parallel run loop
auto	5.442588749725697	0.0	discard	40_4_in_5	Parallel run loop
auto	11.881182844607538	0.0	discard	25_DOMINO_in_3	Parallel run loop
auto	4.3142279407623825	0.0	discard	40_4_in_6	Parallel run loop
auto	12.910495881561323	0.0	discard	33_5_in_3	Parallel run loop
auto	3.307035932447277	0.0	discard	40_4_in_8	Parallel run loop
auto	5.33386413036413	0.0	discard	38_4_in_5	Parallel run loop
auto	10.95333223592899	0.0	discard	21_DOMINO_in_3	Parallel run loop
auto	2.7702964943057093	0.0	discard	30_4_in_8	Parallel run loop
auto	5.27213836413791	0.0	discard	37_4_in_5	Parallel run loop
auto	11.505387066184918	0.0	discard	24_DOMINO_in_3	Parallel run loop
auto	4.817105164761469	0.0	discard	33_4_in_5	Parallel run loop
auto	6.835647451099712	0.0	discard	19_DOMINO_in_4	Parallel run loop
auto	13.820493131853882	0.0	discard	25_6_in_3	Parallel run loop
auto	14.05678443804131	0.0	discard	39_5_in_3	Parallel run loop
auto	2.9051992788582677	0.0	discard	33_4_in_8	Parallel run loop
auto	3.5363199517738764	0.0	discard	27_4_in_6	Parallel run loop
auto	4.726818672940521	0.0	discard	32_4_in_5	Parallel run loop
auto	6.281350871924349	0.0	discard	20_6_in_5	Parallel run loop
auto	3.4155606800180993	0.0	keep	24_4_in_6	Parallel run loop
auto	8.651091643465453	0.0	discard	13_DOMINO_in_3	Parallel run loop
auto	5.9728961010757065	0.0	discard	14_DOMINO_in_4	Parallel run loop
auto	3.8369336484278946	0.0	discard	13_6_in_CIRCLE	Parallel run loop
auto	12.261313043390997	0.0	discard	27_DOMINO_in_3	Parallel run loop
auto	11.966322751034012	0.0	discard	26_DOMINO_in_3	Parallel run loop
auto	4.353668569763149	0.0	discard	40_4_in_6	Parallel run loop
auto	7.160232969366078	0.0	discard	16_8_in_DOMINO	Parallel run loop
auto	5.384931350321754	0.0	discard	23_5_in_5	Parallel run loop
auto	3.441963337181655	0.0	discard	24_4_in_6	Parallel run loop
auto	2.519017470378839	0.0	discard	25_4_in_8	Parallel run loop
auto	2.382191620351339	0.0	discard	21_4_in_8	Parallel run loop
auto	4.885880125978864	0.0	discard	33_4_in_5	Parallel run loop
auto	2.8599677294777037	0.0	discard	32_4_in_8	Parallel run loop
auto	11.960108969580684	0.0	discard	18_6_in_3	Parallel run loop
auto	13.884493816920813	0.0	discard	38_5_in_3	Parallel run loop
auto	13.820493131853882	0.0	discard	25_6_in_3	Parallel run loop
auto	12.910495881561323	0.0	discard	33_5_in_3	Parallel run loop
auto	2.7228640292078126	0.0	discard	29_4_in_8	Parallel run loop
auto	4.786866784335104	0.0	discard	30_4_in_5	Parallel run loop
auto	10.651500718525643	0.0	discard	20_DOMINO_in_3	Parallel run loop
auto	3.5565355460026677	0.0	discard	27_4_in_6	Parallel run loop
auto	11.10639567382138	0.0	discard	22_DOMINO_in_3	Parallel run loop
auto	2.4007400073217737	0.0	discard	12_5_in_8	Parallel run loop
auto	7.00613779632392	0.0	discard	46_3_in_3	Parallel run loop
auto	6.884056633069832	0.0	discard	19_DOMINO_in_4	Parallel run loop
auto	5.189558730537238	0.0	discard	38_4_in_5	Parallel run loop
auto	10.95333223592899	0.0	discard	21_DOMINO_in_3	Parallel run loop
auto	11.78013726824729	0.0	discard	25_DOMINO_in_3	Parallel run loop
auto	5.14997676716272	0.0	discard	37_4_in_5	Parallel run loop
auto	5.013542161156744	0.0	discard	35_4_in_5	Parallel run loop
auto	2.9476053891229426	0.0	discard	35_4_in_8	Parallel run loop
auto	12.771121686878123	0.0	discard	32_5_in_3	Parallel run loop
auto	2.7702964943057093	0.0	discard	30_4_in_8	Parallel run loop
auto	3.178905265988797	0.0	discard	40_4_in_8	Parallel run loop
auto	5.349950852901027	0.0	discard	40_4_in_5	Parallel run loop
auto	8.651091643465453	0.0	discard	13_DOMINO_in_3	Parallel run loop
auto	4.75127218611163	0.0	discard	10_8_in_CIRCLE	Parallel run loop
auto	4.475245630635559	0.0	discard	15_6_in_6	Parallel run loop
auto	11.165425559759298	0.0	discard	20_DOMINO_in_3	Parallel run loop
auto	6.497991980936347	0.0	discard	11_8_in_5	Parallel run loop
auto	3.43130924050511	0.0	discard	24_4_in_6	Parallel run loop
auto	11.938700863690155	0.0	discard	24_DOMINO_in_3	Parallel run loop
auto	4.697834635053744	0.0	discard	19_5_in_DOMINO	Parallel run loop
auto	5.005146389003712	0.0	discard	33_4_in_5	Parallel run loop
auto	13.884493816920813	0.0	discard	38_5_in_3	Parallel run loop
auto	11.966322751034012	0.0	discard	26_DOMINO_in_3	Parallel run loop
auto	5.33386413036413	0.0	discard	38_4_in_5	Parallel run loop
auto	8.102774853359481	0.0	discard	20_8_in_DOMINO	Parallel run loop
auto	5.790189669490146	0.0	discard	13_8_in_6	Parallel run loop
auto	2.989736754164845	0.0	discard	32_4_in_8	Parallel run loop
auto	4.456305253160654	0.0	discard	40_4_in_6	Parallel run loop
auto	3.6066797412045304	0.0	discard	27_4_in_6	Parallel run loop
auto	5.102893955208136	0.0	discard	20_8_in_8	Parallel run loop
auto	4.8203042879733635	0.0	discard	20_5_in_DOMINO	Parallel run loop
auto	6.835647451099712	0.0	discard	19_DOMINO_in_4	Parallel run loop
auto	4.95906101564547	0.0	discard	32_4_in_5	Parallel run loop
auto	11.10639567382138	0.0	discard	22_DOMINO_in_3	Parallel run loop
auto	13.820493131853882	0.0	discard	25_6_in_3	Parallel run loop
auto	14.05678443804131	0.0	discard	39_5_in_3	Parallel run loop
auto	11.78013726824729	0.0	discard	25_DOMINO_in_3	Parallel run loop
auto	12.910495881561323	0.0	discard	33_5_in_3	Parallel run loop
auto	12.261313043390997	0.0	discard	27_DOMINO_in_3	Parallel run loop
auto	11.960108969580684	0.0	discard	18_6_in_3	Parallel run loop
auto	4.985636633418775	0.0	keep	37_4_in_5	Parallel run loop
auto	7.00613779632392	0.0	discard	46_3_in_3	Parallel run loop
auto	5.013542161156744	0.0	discard	35_4_in_5	Parallel run loop
auto	5.777467632032182	0.0	discard	26_8_in_8	Parallel run loop
auto	10.95333223592899	0.0	discard	21_DOMINO_in_3	Parallel run loop
auto	5.663881359656193	0.0	discard	25_6_in_6	Parallel run loop
auto	3.4155606800180993	0.0	discard	24_4_in_6	Parallel run loop
auto	4.904537362780794	0.0	discard	21_5_in_DOMINO	Parallel run loop
auto	12.771121686878123	0.0	discard	32_5_in_3	Parallel run loop
auto	5.994170884047151	0.0	discard	9_8_in_5	Parallel run loop
auto	6.2478639807772485	0.0	discard	16_8_in_6	Parallel run loop
auto	8.651091643465453	0.0	discard	13_DOMINO_in_3	Parallel run loop
auto	2.6447738834161796	0.0	discard	9_6_in_8	Parallel run loop
auto	6.884056633069832	0.0	discard	19_DOMINO_in_4	Parallel run loop
auto	11.505387066184918	0.0	discard	24_DOMINO_in_3	Parallel run loop
auto	10.651500718525643	0.0	discard	20_DOMINO_in_3	Parallel run loop
auto	4.409839693042728	0.0	discard	17_5_in_DOMINO	Parallel run loop
auto	3.593359018649055	0.0	discard	27_4_in_6	Parallel run loop
auto	4.786866784335104	0.0	discard	30_4_in_5	Parallel run loop
auto	4.309862100185108	0.0	discard	16_5_in_DOMINO	Parallel run loop
auto	2.5069731037578142	0.0	discard	13_5_in_8	Parallel run loop
auto	11.960108969580684	0.0	discard	18_6_in_3	Parallel run loop
auto	7.812784092602333	0.0	discard	32_6_in_5	Parallel run loop
auto	6.0953254095291225	0.0	discard	19_8_in_CIRCLE	Parallel run loop
auto	4.569815862524372	0.0	discard	18_5_in_DOMINO	Parallel run loop
auto	5.33386413036413	0.0	discard	38_4_in_5	Parallel run loop
auto	5.949837118888085	0.0	discard	28_6_in_6	Parallel run loop
auto	4.916221201185569	0.0	discard	33_4_in_5	Parallel run loop
auto	6.3086008314667135	0.0	discard	10_8_in_5	Parallel run loop
auto	4.978661277247053	0.0	keep	37_4_in_5	Parallel run loop
auto	3.449889360597646	0.0	discard	24_4_in_6	Parallel run loop
auto	12.910495881561323	0.0	discard	33_5_in_3	Parallel run loop
auto	6.700106835949054	0.0	discard	23_6_in_5	Parallel run loop
auto	12.261313043390997	0.0	discard	27_DOMINO_in_3	Parallel run loop
auto	5.8434126687983206	0.0	discard	20_6_in_DOMINO	Parallel run loop
auto	4.558228051991228	0.0	discard	16_6_in_6	Parallel run loop
auto	13.884493816920813	0.0	discard	38_5_in_3	Parallel run loop
auto	5.693379391606711	0.0	discard	19_6_in_DOMINO	Parallel run loop
auto	11.966322751034012	0.0	discard	26_DOMINO_in_3	Parallel run loop
auto	5.6215705425904785	0.0	discard	25_5_in_5	Parallel run loop
auto	7.676416747555321	0.0	discard	31_6_in_5	Parallel run loop
auto	11.10639567382138	0.0	discard	22_DOMINO_in_3	Parallel run loop
auto	14.05678443804131	0.0	discard	39_5_in_3	Parallel run loop
auto	5.302443940088193	0.0	discard	22_5_in_5	Parallel run loop
auto	3.6117328818765433	0.0	discard	27_4_in_6	Parallel run loop
auto	4.973692147620266	0.0	discard	35_4_in_5	Parallel run loop
auto	13.820493131853882	0.0	discard	25_6_in_3	Parallel run loop
auto	10.95333223592899	0.0	discard	21_DOMINO_in_3	Parallel run loop
auto	4.726818672940521	0.0	discard	32_4_in_5	Parallel run loop
auto	12.771121686878123	0.0	discard	32_5_in_3	Parallel run loop
auto	11.960108969580684	0.0	discard	18_6_in_3	Parallel run loop
auto	5.442588749725697	0.0	discard	40_4_in_5	Parallel run loop
auto	7.160232969366078	0.0	discard	16_8_in_DOMINO	Parallel run loop
auto	11.78013726824729	0.0	discard	25_DOMINO_in_3	Parallel run loop
auto	4.697834635053744	0.0	discard	19_5_in_DOMINO	Parallel run loop
auto	3.9493073634468594	0.0	discard	11_6_in_6	Parallel run loop
auto	3.8369336484278946	0.0	discard	13_6_in_CIRCLE	Parallel run loop
auto	5.384931350321754	0.0	discard	23_5_in_5	Parallel run loop
auto	5.929933782606769	0.0	discard	14_DOMINO_in_4	Parallel run loop
auto	11.505387066184918	0.0	discard	24_DOMINO_in_3	Parallel run loop
auto	8.102774853359481	0.0	discard	20_8_in_DOMINO	Parallel run loop
auto	6.281350871924349	0.0	discard	20_6_in_5	Parallel run loop
auto	8.651091643465453	0.0	discard	13_DOMINO_in_3	Parallel run loop
auto	4.786866784335104	0.0	discard	30_4_in_5	Parallel run loop
auto	2.4007400073217737	0.0	discard	12_5_in_8	Parallel run loop
auto	5.27213836413791	0.0	discard	37_4_in_5	Parallel run loop
auto	5.33386413036413	0.0	discard	38_4_in_5	Parallel run loop
auto	8.382506079934158	0.0	discard	22_8_in_DOMINO	Parallel run loop
auto	10.651500718525643	0.0	discard	20_DOMINO_in_3	Parallel run loop
auto	5.790189669490146	0.0	discard	13_8_in_6	Parallel run loop
auto	4.817105164761469	0.0	discard	33_4_in_5	Parallel run loop
auto	5.994170884047151	0.0	discard	9_8_in_5	Parallel run loop
auto	4.8203042879733635	0.0	discard	20_5_in_DOMINO	Parallel run loop
auto	12.261313043390997	0.0	discard	27_DOMINO_in_3	Parallel run loop
auto	11.10639567382138	0.0	discard	22_DOMINO_in_3	Parallel run loop
auto	7.812784092602333	0.0	discard	32_6_in_5	Parallel run loop
auto	10.95333223592899	0.0	discard	21_DOMINO_in_3	Parallel run loop
auto	12.910495881561323	0.0	discard	33_5_in_3	Parallel run loop
auto	5.442588749725697	0.0	discard	40_4_in_5	Parallel run loop
auto	4.475245630635559	0.0	discard	15_6_in_6	Parallel run loop
auto	4.558228051991228	0.0	discard	16_6_in_6	Parallel run loop
auto	6.3086008314667135	0.0	discard	10_8_in_5	Parallel run loop
auto	5.9728961010757065	0.0	discard	14_DOMINO_in_4	Parallel run loop
auto	6.497991980936347	0.0	discard	11_8_in_5	Parallel run loop
auto	5.663881359656193	0.0	discard	25_6_in_6	Parallel run loop
auto	4.726818672940521	0.0	discard	32_4_in_5	Parallel run loop
auto	14.05678443804131	0.0	discard	39_5_in_3	Parallel run loop
auto	5.1332484788868875	0.0	discard	35_4_in_5	Parallel run loop
auto	6.2478639807772485	0.0	discard	16_8_in_6	Parallel run loop
auto	13.820493131853882	0.0	discard	25_6_in_3	Parallel run loop
auto	4.75127218611163	0.0	discard	10_8_in_CIRCLE	Parallel run loop
auto	13.884493816920813	0.0	discard	38_5_in_3	Parallel run loop
auto	12.771121686878123	0.0	discard	32_5_in_3	Parallel run loop
auto	11.960108969580684	0.0	discard	18_6_in_3	Parallel run loop
auto	5.777467632032182	0.0	discard	26_8_in_8	Parallel run loop
auto	4.409839693042728	0.0	discard	17_5_in_DOMINO	Parallel run loop
auto	5.102893955208136	0.0	discard	20_8_in_8	Parallel run loop
auto	4.569815862524372	0.0	discard	18_5_in_DOMINO	Parallel run loop
auto	4.309862100185108	0.0	discard	16_5_in_DOMINO	Parallel run loop
auto	4.904537362780794	0.0	discard	21_5_in_DOMINO	Parallel run loop
auto	6.0953254095291225	0.0	discard	19_8_in_CIRCLE	Parallel run loop
auto	2.6447738834161796	0.0	discard	9_6_in_8	Parallel run loop
auto	8.651091643465453	0.0	discard	13_DOMINO_in_3	Parallel run loop
auto	11.012066424423661	0.0	discard	22_DOMINO_in_3	Parallel run loop
auto	13.820493131853882	0.0	discard	25_6_in_3	Parallel run loop
auto	12.852061883041317	0.0	discard	27_DOMINO_in_3	Parallel run loop
auto	11.165425559759298	0.0	discard	20_DOMINO_in_3	Parallel run loop
auto	2.5069731037578142	0.0	discard	13_5_in_8	Parallel run loop
auto	6.884056633069832	0.0	discard	19_DOMINO_in_4	Parallel run loop
auto	10.95333223592899	0.0	discard	21_DOMINO_in_3	Parallel run loop
auto	4.671241677623867	0.0	discard	30_4_in_5	Parallel run loop
auto	14.05678443804131	0.0	discard	39_5_in_3	Parallel run loop
auto	3.9493073634468594	0.0	discard	11_6_in_6	Parallel run loop
auto	4.95906101564547	0.0	discard	32_4_in_5	Parallel run loop
auto	6.700106835949054	0.0	discard	23_6_in_5	Parallel run loop
auto	5.949837118888085	0.0	discard	28_6_in_6	Parallel run loop
auto	5.442588749725697	0.0	discard	40_4_in_5	Parallel run loop
auto	5.1332484788868875	0.0	discard	35_4_in_5	Parallel run loop
auto	5.2410191339504175	0.0	discard	38_4_in_5	Parallel run loop
auto	11.966322751034012	0.0	discard	26_DOMINO_in_3	Parallel run loop
auto	11.881182844607538	0.0	discard	25_DOMINO_in_3	Parallel run loop
auto	13.884493816920813	0.0	discard	38_5_in_3	Parallel run loop
auto	7.676416747555321	0.0	discard	31_6_in_5	Parallel run loop
auto	8.382506079934158	0.0	discard	22_8_in_DOMINO	Parallel run loop
auto	5.384931350321754	0.0	discard	23_5_in_5	Parallel run loop
auto	5.302443940088193	0.0	discard	22_5_in_5	Parallel run loop
auto	3.8369336484278946	0.0	discard	13_6_in_CIRCLE	Parallel run loop
auto	7.160232969366078	0.0	discard	16_8_in_DOMINO	Parallel run loop
auto	5.6215705425904785	0.0	discard	25_5_in_5	Parallel run loop
auto	12.910495881561323	0.0	discard	33_5_in_3	Parallel run loop
auto	5.693379391606711	0.0	discard	19_6_in_DOMINO	Parallel run loop
auto	5.8434126687983206	0.0	discard	20_6_in_DOMINO	Parallel run loop
auto	6.281350871924349	0.0	discard	20_6_in_5	Parallel run loop
auto	4.817105164761469	0.0	discard	33_4_in_5	Parallel run loop
auto	4.697834635053744	0.0	discard	19_5_in_DOMINO	Parallel run loop
auto	11.505387066184918	0.0	discard	24_DOMINO_in_3	Parallel run loop
auto	2.4007400073217737	0.0	discard	12_5_in_8	Parallel run loop
auto	12.771121686878123	0.0	discard	32_5_in_3	Parallel run loop
auto	11.10639567382138	0.0	discard	22_DOMINO_in_3	Parallel run loop
auto	11.960108969580684	0.0	discard	18_6_in_3	Parallel run loop
auto	13.820493131853882	0.0	discard	25_6_in_3	Parallel run loop
auto	8.102774853359481	0.0	discard	20_8_in_DOMINO	Parallel run loop
auto	8.651091643465453	0.0	discard	13_DOMINO_in_3	Parallel run loop
auto	4.75127218611163	0.0	discard	10_8_in_CIRCLE	Parallel run loop
auto	6.497991980936347	0.0	discard	11_8_in_5	Parallel run loop
auto	4.475245630635559	0.0	discard	15_6_in_6	Parallel run loop
auto	12.261313043390997	0.0	discard	27_DOMINO_in_3	Parallel run loop
auto	10.651500718525643	0.0	discard	20_DOMINO_in_3	Parallel run loop
auto	4.904537362780794	0.0	discard	21_5_in_DOMINO	Parallel run loop
auto	5.790189669490146	0.0	discard	13_8_in_6	Parallel run loop
auto	5.994170884047151	0.0	discard	9_8_in_5	Parallel run loop
auto	4.8203042879733635	0.0	discard	20_5_in_DOMINO	Parallel run loop
auto	6.3086008314667135	0.0	discard	10_8_in_5	Parallel run loop
auto	6.0953254095291225	0.0	discard	19_8_in_CIRCLE	Parallel run loop
auto	4.569815862524372	0.0	discard	18_5_in_DOMINO	Parallel run loop
auto	5.777467632032182	0.0	discard	26_8_in_8	Parallel run loop
auto	5.442588749725697	0.0	discard	40_4_in_5	Parallel run loop
auto	4.786866784335104	0.0	discard	30_4_in_5	Parallel run loop
auto	6.2478639807772485	0.0	discard	16_8_in_6	Parallel run loop
auto	12.910495881561323	0.0	discard	33_5_in_3	Parallel run loop
auto	5.33386413036413	0.0	discard	38_4_in_5	Parallel run loop
auto	4.558228051991228	0.0	discard	16_6_in_6	Parallel run loop
auto	13.884493816920813	0.0	discard	38_5_in_3	Parallel run loop
auto	4.309862100185108	0.0	discard	16_5_in_DOMINO	Parallel run loop
auto	4.8287150492886575	0.0	discard	33_4_in_5	Parallel run loop
auto	7.812784092602333	0.0	discard	32_6_in_5	Parallel run loop
auto	4.774308315899103	0.0	discard	32_4_in_5	Parallel run loop
auto	5.102893955208136	0.0	discard	20_8_in_8	Parallel run loop
auto	14.05678443804131	0.0	discard	39_5_in_3	Parallel run loop
auto	5.1332484788868875	0.0	discard	35_4_in_5	Parallel run loop
auto	5.663881359656193	0.0	discard	25_6_in_6	Parallel run loop
auto	12.059293801707227	0.0	discard	24_DOMINO_in_3	Parallel run loop
auto	13.820493131853882	0.0	discard	25_6_in_3	Parallel run loop
auto	4.409839693042728	0.0	discard	17_5_in_DOMINO	Parallel run loop
auto	2.5069731037578142	0.0	discard	13_5_in_8	Parallel run loop
auto	5.8434126687983206	0.0	discard	20_6_in_DOMINO	Parallel run loop
auto	6.700106835949054	0.0	discard	23_6_in_5	Parallel run loop
auto	2.6447738834161796	0.0	discard	9_6_in_8	Parallel run loop
auto	5.693379391606711	0.0	discard	19_6_in_DOMINO	Parallel run loop
auto	11.960108969580684	0.0	discard	18_6_in_3	Parallel run loop
auto	5.949837118888085	0.0	discard	28_6_in_6	Parallel run loop
auto	12.771121686878123	0.0	discard	32_5_in_3	Parallel run loop
auto	2.4195050032821817	0.0	keep	22_3_in_DOMINO	Parallel run loop
auto	8.651091643465453	0.0	discard	13_DOMINO_in_3	Parallel run loop
auto	5.929933782606769	0.0	discard	14_DOMINO_in_4	Parallel run loop
auto	3.9493073634468594	0.0	discard	11_6_in_6	Parallel run loop
auto	3.8369336484278946	0.0	discard	13_6_in_CIRCLE	Parallel run loop
auto	10.95333223592899	0.0	discard	21_DOMINO_in_3	Parallel run loop
auto	6.884056633069832	0.0	discard	19_DOMINO_in_4	Parallel run loop
auto	11.966322751034012	0.0	discard	26_DOMINO_in_3	Parallel run loop
auto	11.165425559759298	0.0	discard	20_DOMINO_in_3	Parallel run loop
auto	2.4007400073217737	0.0	discard	12_5_in_8	Parallel run loop
auto	8.102774853359481	0.0	discard	20_8_in_DOMINO	Parallel run loop
auto	5.302443940088193	0.0	discard	22_5_in_5	Parallel run loop
auto	5.6215705425904785	0.0	discard	25_5_in_5	Parallel run loop
auto	11.881182844607538	0.0	discard	25_DOMINO_in_3	Parallel run loop
auto	4.475245630635559	0.0	discard	15_6_in_6	Parallel run loop
auto	4.843428274429765	0.0	discard	33_4_in_5	Parallel run loop
auto	5.790189669490146	0.0	discard	13_8_in_6	Parallel run loop
auto	5.384931350321754	0.0	discard	23_5_in_5	Parallel run loop
auto	8.382506079934158	0.0	discard	22_8_in_DOMINO	Parallel run loop
auto	12.261313043390997	0.0	discard	27_DOMINO_in_3	Parallel run loop
auto	5.994170884047151	0.0	discard	9_8_in_5	Parallel run loop
auto	7.676416747555321	0.0	discard	31_6_in_5	Parallel run loop
auto	5.102893955208136	0.0	discard	20_8_in_8	Parallel run loop
auto	12.910495881561323	0.0	discard	33_5_in_3	Parallel run loop
auto	4.75127218611163	0.0	discard	10_8_in_CIRCLE	Parallel run loop
auto	13.884493816920813	0.0	discard	38_5_in_3	Parallel run loop
auto	6.497991980936347	0.0	discard	11_8_in_5	Parallel run loop
auto	4.697834635053744	0.0	discard	19_5_in_DOMINO	Parallel run loop
auto	5.777467632032182	0.0	discard	26_8_in_8	Parallel run loop
auto	7.160232969366078	0.0	discard	16_8_in_DOMINO	Parallel run loop
auto	6.281350871924349	0.0	discard	20_6_in_5	Parallel run loop
auto	4.8203042879733635	0.0	discard	20_5_in_DOMINO	Parallel run loop
auto	14.05678443804131	0.0	discard	39_5_in_3	Parallel run loop
auto	11.10639567382138	0.0	discard	22_DOMINO_in_3	Parallel run loop
auto	5.929933782606769	0.0	discard	14_DOMINO_in_4	Parallel run loop
auto	6.2478639807772485	0.0	discard	16_8_in_6	Parallel run loop
auto	5.663881359656193	0.0	discard	25_6_in_6	Parallel run loop
auto	4.558228051991228	0.0	discard	16_6_in_6	Parallel run loop
auto	4.904537362780794	0.0	discard	21_5_in_DOMINO	Parallel run loop
auto	11.960108969580684	0.0	discard	18_6_in_3	Parallel run loop
auto	8.651091643465453	0.0	discard	13_DOMINO_in_3	Parallel run loop
auto	2.5069731037578142	0.0	discard	13_5_in_8	Parallel run loop
auto	2.6447738834161796	0.0	discard	9_6_in_8	Parallel run loop
auto	6.835647451099712	0.0	discard	19_DOMINO_in_4	Parallel run loop
auto	10.95333223592899	0.0	discard	21_DOMINO_in_3	Parallel run loop
auto	2.4195050032821817	0.0	discard	22_3_in_DOMINO	Parallel run loop
auto	4.409839693042728	0.0	discard	17_5_in_DOMINO	Parallel run loop
auto	12.771121686878123	0.0	discard	32_5_in_3	Parallel run loop
auto	11.966322751034012	0.0	discard	26_DOMINO_in_3	Parallel run loop
auto	6.700106835949054	0.0	discard	23_6_in_5	Parallel run loop
auto	13.884493816920813	0.0	discard	38_5_in_3	Parallel run loop
auto	6.0953254095291225	0.0	discard	19_8_in_CIRCLE	Parallel run loop
auto	3.2342712519580337	0.0	discard	12_DOMINO_in_CIRCLE	Parallel run loop
auto	5.012765064798198	0.0	discard	20_DOMINO_in_DOMINO	Parallel run loop
auto	5.6215705425904785	0.0	discard	25_5_in_5	Parallel run loop
auto	10.651500718525643	0.0	discard	20_DOMINO_in_3	Parallel run loop
