commit	score	memory_gb	status	problem	description
auto	4.122661303363914	0.0	discard	35_4_in_CIRCLE	Parallel run loop
auto	5.029602176115146	0.0	discard	42_4_in_DOMINO	Parallel run loop
auto	2.9479967602447665	0.0	discard	20_4_in_CIRCLE	Parallel run loop
auto	1.7029189896133312	0.0	discard	16_3_in_circle	Parallel run loop
auto	3.7364237438117933	0.0	discard	31_4_in_CIRCLE	Parallel run loop
auto	6.773117703585962	0.0	discard	37_3_in_3	Parallel run loop
auto	4.044636069278394	0.0	discard	12_CIRCLE_in_CIRCLE	Parallel run loop
auto	6.940912390839882	0.0	discard	39_3_in_3	Parallel run loop
auto	1.2748051192828511	0.0	discard	8_3_in_circle	Parallel run loop
auto	11.413488992180232	0.0	discard	13_CIRCLE_in_3	Parallel run loop
auto	3.2232942054853804	0.0	discard	25_4_in_CIRCLE	Parallel run loop
auto	1.4830513649835477	0.0	discard	11_3_in_circle	Parallel run loop
auto	1.6549223038095542	0.0	discard	15_3_in_circle	Parallel run loop
auto	4.538260254000323	0.0	discard	15_CIRCLE_in_CIRCLE	Parallel run loop
auto	1.8204190752494187	0.0	discard	18_3_in_circle	Parallel run loop
auto	5.023275579401488	0.0	discard	39_4_in_DOMINO	Parallel run loop
auto	3.0482570050526587	0.0	discard	13_4_in_DOMINO	Parallel run loop
auto	1.8582158012495773	0.0	discard	19_3_in_circle	Parallel run loop
auto	2.8776782496867814	0.0	discard	19_4_in_CIRCLE	Parallel run loop
auto	1.4007623159126743	0.0	discard	10_3_in_circle	Parallel run loop
auto	4.809960188594904	0.0	discard	17_CIRCLE_in_CIRCLE	Parallel run loop
auto	2.8016697604273646	0.0	discard	18_4_in_CIRCLE	Parallel run loop
auto	4.345096413036063	0.0	discard	14_CIRCLE_in_CIRCLE	Parallel run loop
auto	1.8958192025625156	0.0	discard	20_3_in_circle	Parallel run loop
auto	1.5230514075566917	0.0	discard	12_3_in_circle	Parallel run loop
auto	3.1064519114939206	0.0	discard	21_4_in_CIRCLE	Parallel run loop
auto	3.9641227017335576	0.0	discard	22_4_in_DOMINO	Parallel run loop
auto	3.8281160934956127	0.0	discard	34_4_in_CIRCLE	Parallel run loop
auto	4.63348722009616	0.0	discard	16_CIRCLE_in_CIRCLE	Parallel run loop
auto	4.108256491675653	0.0	discard	35_4_in_CIRCLE	Parallel run loop
auto	4.883494798545663	0.0	discard	18_CIRCLE_in_CIRCLE	Parallel run loop
auto	5.143321280120154	0.0	discard	20_CIRCLE_in_CIRCLE	Parallel run loop
auto	4.019565593893119	0.0	discard	33_4_in_CIRCLE	Parallel run loop
auto	2.643847752583437	0.0	discard	16_4_in_CIRCLE	Parallel run loop
auto	5.019525795832946	0.0	discard	41_4_in_DOMINO	Parallel run loop
auto	11.471632991608798	0.0	discard	14_CIRCLE_in_3	Parallel run loop
auto	3.265553306575606	0.0	discard	26_4_in_CIRCLE	Parallel run loop
auto	3.631402274099691	0.0	discard	29_4_in_CIRCLE	Parallel run loop
auto	3.115803431953349	0.0	discard	23_4_in_CIRCLE	Parallel run loop
auto	6.06037645787977	0.0	discard	32_3_in_3	Parallel run loop
auto	3.5236257287305413	0.0	discard	30_4_in_CIRCLE	Parallel run loop
auto	4.943502864466721	0.0	discard	40_4_in_DOMINO	Parallel run loop
auto	4.00437912608468	0.0	discard	25_4_in_DOMINO	Parallel run loop
auto	2.9479967602447665	0.0	discard	20_4_in_CIRCLE	Parallel run loop
auto	1.7029189896133312	0.0	discard	16_3_in_circle	Parallel run loop
auto	4.867215641034746	0.0	discard	38_4_in_DOMINO	Parallel run loop
auto	4.020316954443297	0.0	discard	13_3_in_3	Parallel run loop
auto	4.044636069278394	0.0	discard	12_CIRCLE_in_CIRCLE	Parallel run loop
auto	11.413488992180232	0.0	discard	13_CIRCLE_in_3	Parallel run loop
auto	1.2748051192828511	0.0	discard	8_3_in_circle	Parallel run loop
auto	3.7364237438117933	0.0	discard	31_4_in_CIRCLE	Parallel run loop
auto	1.4830513649835477	0.0	discard	11_3_in_circle	Parallel run loop
auto	4.538260254000323	0.0	discard	15_CIRCLE_in_CIRCLE	Parallel run loop
auto	1.6549223038095542	0.0	discard	15_3_in_circle	Parallel run loop
auto	3.2232942054853804	0.0	discard	25_4_in_CIRCLE	Parallel run loop
auto	1.8204190752494187	0.0	discard	18_3_in_circle	Parallel run loop
auto	7.015974820954202	0.0	discard	44_3_in_3	Parallel run loop
auto	4.809960188594904	0.0	discard	17_CIRCLE_in_CIRCLE	Parallel run loop
auto	3.9241229167278884	0.0	discard	24_4_in_DOMINO	Parallel run loop
auto	4.965060044085815	0.0	discard	21_3_in_3	Parallel run loop
auto	1.4007623159126743	0.0	discard	10_3_in_circle	Parallel run loop
auto	4.345096413036063	0.0	discard	14_CIRCLE_in_CIRCLE	Parallel run loop
auto	1.8582158012495773	0.0	discard	19_3_in_circle	Parallel run loop
auto	1.5230514075566917	0.0	discard	12_3_in_circle	Parallel run loop
auto	2.8776782496867814	0.0	discard	19_4_in_CIRCLE	Parallel run loop
auto	2.8016697604273646	0.0	discard	18_4_in_CIRCLE	Parallel run loop
auto	1.8958192025625156	0.0	discard	20_3_in_circle	Parallel run loop
auto	3.1064519114939206	0.0	discard	21_4_in_CIRCLE	Parallel run loop
auto	4.63348722009616	0.0	discard	16_CIRCLE_in_CIRCLE	Parallel run loop
auto	4.475096077264324	0.0	discard	33_4_in_DOMINO	Parallel run loop
auto	4.883494798545663	0.0	discard	18_CIRCLE_in_CIRCLE	Parallel run loop
auto	5.143321280120154	0.0	discard	20_CIRCLE_in_CIRCLE	Parallel run loop
auto	2.643847752583437	0.0	discard	16_4_in_CIRCLE	Parallel run loop
auto	6.047215182458681	0.0	discard	30_3_in_3	Parallel run loop
auto	5.927325264360006	0.0	discard	31_3_in_3	Parallel run loop
auto	4.019565593893119	0.0	discard	33_4_in_CIRCLE	Parallel run loop
auto	11.471632991608798	0.0	discard	14_CIRCLE_in_3	Parallel run loop
auto	3.631402274099691	0.0	discard	29_4_in_CIRCLE	Parallel run loop
auto	4.867215641034746	0.0	discard	38_4_in_DOMINO	Parallel run loop
auto	7.030922742455542	0.0	discard	45_3_in_3	Parallel run loop
auto	3.265553306575606	0.0	discard	26_4_in_CIRCLE	Parallel run loop
auto	3.115803431953349	0.0	discard	23_4_in_CIRCLE	Parallel run loop
auto	3.5236257287305413	0.0	discard	30_4_in_CIRCLE	Parallel run loop
auto	1.7029189896133312	0.0	discard	16_3_in_circle	Parallel run loop
auto	6.84302398719644	0.0	discard	38_3_in_3	Parallel run loop
auto	2.9479967602447665	0.0	discard	20_4_in_CIRCLE	Parallel run loop
auto	5.661931242646113	0.0	discard	26_3_in_3	Parallel run loop
auto	4.044636069278394	0.0	discard	12_CIRCLE_in_CIRCLE	Parallel run loop
auto	11.413488992180232	0.0	discard	13_CIRCLE_in_3	Parallel run loop
auto	1.2748051192828511	0.0	discard	8_3_in_circle	Parallel run loop
auto	4.020360663309433	0.0	discard	26_4_in_DOMINO	Parallel run loop
auto	4.538260254000323	0.0	discard	15_CIRCLE_in_CIRCLE	Parallel run loop
auto	1.4830513649835477	0.0	discard	11_3_in_circle	Parallel run loop
auto	1.6549223038095542	0.0	discard	15_3_in_circle	Parallel run loop
auto	6.9673699289329925	0.0	discard	43_3_in_3	Parallel run loop
auto	3.7364237438117933	0.0	discard	31_4_in_CIRCLE	Parallel run loop
auto	1.8204190752494187	0.0	discard	18_3_in_circle	Parallel run loop
auto	4.809960188594904	0.0	discard	17_CIRCLE_in_CIRCLE	Parallel run loop
auto	3.2232942054853804	0.0	discard	25_4_in_CIRCLE	Parallel run loop
auto	1.4007623159126743	0.0	discard	10_3_in_circle	Parallel run loop
auto	4.345096413036063	0.0	discard	14_CIRCLE_in_CIRCLE	Parallel run loop
auto	4.510334332905153	0.0	discard	34_4_in_DOMINO	Parallel run loop
auto	1.8582158012495773	0.0	discard	19_3_in_circle	Parallel run loop
auto	1.5230514075566917	0.0	discard	12_3_in_circle	Parallel run loop
auto	5.029602176115146	0.0	discard	42_4_in_DOMINO	Parallel run loop
auto	3.8281160934956127	0.0	discard	34_4_in_CIRCLE	Parallel run loop
auto	5.927325264360006	0.0	discard	31_3_in_3	Parallel run loop
auto	2.8776782496867814	0.0	discard	19_4_in_CIRCLE	Parallel run loop
auto	2.8016697604273646	0.0	discard	18_4_in_CIRCLE	Parallel run loop
auto	4.63348722009616	0.0	discard	16_CIRCLE_in_CIRCLE	Parallel run loop
auto	4.883494798545663	0.0	discard	18_CIRCLE_in_CIRCLE	Parallel run loop
auto	1.8958192025625156	0.0	discard	20_3_in_circle	Parallel run loop
auto	5.143321280120154	0.0	discard	20_CIRCLE_in_CIRCLE	Parallel run loop
auto	5.085037051003258	0.0	discard	38_4_in_DOMINO	Parallel run loop
auto	3.1064519114939206	0.0	discard	21_4_in_CIRCLE	Parallel run loop
auto	2.643847752583437	0.0	discard	16_4_in_CIRCLE	Parallel run loop
auto	11.471632991608798	0.0	discard	14_CIRCLE_in_3	Parallel run loop
auto	5.719122467319307	0.0	discard	26_3_in_3	Parallel run loop
auto	3.8688750047412386	0.0	discard	23_4_in_DOMINO	Parallel run loop
auto	4.019565593893119	0.0	discard	33_4_in_CIRCLE	Parallel run loop
auto	3.265553306575606	0.0	discard	26_4_in_CIRCLE	Parallel run loop
auto	7.0779489011835555	0.0	discard	42_3_in_3	Parallel run loop
auto	3.631402274099691	0.0	discard	29_4_in_CIRCLE	Parallel run loop
auto	3.115803431953349	0.0	discard	23_4_in_CIRCLE	Parallel run loop
auto	1.7029189896133312	0.0	discard	16_3_in_circle	Parallel run loop
auto	2.9024064399558376	0.0	discard	11_4_in_DOMINO	Parallel run loop
auto	3.5236257287305413	0.0	discard	30_4_in_CIRCLE	Parallel run loop
auto	4.044636069278394	0.0	discard	12_CIRCLE_in_CIRCLE	Parallel run loop
auto	11.413488992180232	0.0	discard	13_CIRCLE_in_3	Parallel run loop
auto	2.9479967602447665	0.0	discard	20_4_in_CIRCLE	Parallel run loop
auto	1.2748051192828511	0.0	discard	8_3_in_circle	Parallel run loop
auto	4.538260254000323	0.0	discard	15_CIRCLE_in_CIRCLE	Parallel run loop
auto	6.773117703585962	0.0	discard	37_3_in_3	Parallel run loop
auto	1.4830513649835477	0.0	discard	11_3_in_circle	Parallel run loop
auto	1.6549223038095542	0.0	discard	15_3_in_circle	Parallel run loop
auto	6.910804457618678	0.0	discard	41_3_in_3	Parallel run loop
auto	4.809960188594904	0.0	discard	17_CIRCLE_in_CIRCLE	Parallel run loop
auto	1.8204190752494187	0.0	discard	18_3_in_circle	Parallel run loop
auto	3.7364237438117933	0.0	discard	31_4_in_CIRCLE	Parallel run loop
auto	4.345096413036063	0.0	discard	14_CIRCLE_in_CIRCLE	Parallel run loop
auto	1.4007623159126743	0.0	discard	10_3_in_circle	Parallel run loop
auto	6.809573200582781	0.0	discard	39_3_in_3	Parallel run loop
auto	5.927325264360006	0.0	discard	31_3_in_3	Parallel run loop
auto	1.8582158012495773	0.0	discard	19_3_in_circle	Parallel run loop
auto	3.2232942054853804	0.0	discard	25_4_in_CIRCLE	Parallel run loop
auto	1.5230514075566917	0.0	discard	12_3_in_circle	Parallel run loop
auto	3.0223172208985285	0.0	discard	13_4_in_DOMINO	Parallel run loop
auto	1.932475012484084	0.0	discard	21_3_in_circle	Parallel run loop
auto	4.63348722009616	0.0	discard	16_CIRCLE_in_CIRCLE	Parallel run loop
auto	4.883494798545663	0.0	discard	18_CIRCLE_in_CIRCLE	Parallel run loop
auto	2.8776782496867814	0.0	discard	19_4_in_CIRCLE	Parallel run loop
auto	3.746847963455798	0.0	discard	11_3_in_3	Parallel run loop
auto	2.8016697604273646	0.0	discard	18_4_in_CIRCLE	Parallel run loop
auto	5.143321280120154	0.0	discard	20_CIRCLE_in_CIRCLE	Parallel run loop
auto	5.023275579401488	0.0	discard	39_4_in_DOMINO	Parallel run loop
auto	2.848831780259015	0.0	discard	11_4_in_DOMINO	Parallel run loop
auto	11.471632991608798	0.0	discard	14_CIRCLE_in_3	Parallel run loop
auto	3.7914164805615247	0.0	discard	22_4_in_DOMINO	Parallel run loop
auto	1.8958192025625156	0.0	discard	20_3_in_circle	Parallel run loop
auto	5.019525795832946	0.0	discard	41_4_in_DOMINO	Parallel run loop
auto	6.020497735748146	0.0	discard	32_3_in_3	Parallel run loop
auto	4.020316954443297	0.0	discard	13_3_in_3	Parallel run loop
auto	4.00437912608468	0.0	discard	25_4_in_DOMINO	Parallel run loop
auto	4.943502864466721	0.0	discard	40_4_in_DOMINO	Parallel run loop
auto	1.7029189896133312	0.0	discard	16_3_in_circle	Parallel run loop
auto	4.019565593893119	0.0	discard	33_4_in_CIRCLE	Parallel run loop
auto	3.631402274099691	0.0	discard	29_4_in_CIRCLE	Parallel run loop
auto	11.413488992180232	0.0	discard	13_CIRCLE_in_3	Parallel run loop
auto	4.044636069278394	0.0	discard	12_CIRCLE_in_CIRCLE	Parallel run loop
auto	1.2748051192828511	0.0	discard	8_3_in_circle	Parallel run loop
auto	3.9241229167278884	0.0	discard	24_4_in_DOMINO	Parallel run loop
auto	4.538260254000323	0.0	discard	15_CIRCLE_in_CIRCLE	Parallel run loop
auto	6.959075514447739	0.0	discard	41_3_in_3	Parallel run loop
auto	7.015974820954202	0.0	discard	44_3_in_3	Parallel run loop
auto	1.4830513649835477	0.0	discard	11_3_in_circle	Parallel run loop
auto	6.155257820131821	0.0	discard	31_3_in_3	Parallel run loop
auto	1.6549223038095542	0.0	discard	15_3_in_circle	Parallel run loop
auto	6.940912390839882	0.0	discard	39_3_in_3	Parallel run loop
auto	4.809960188594904	0.0	discard	17_CIRCLE_in_CIRCLE	Parallel run loop
auto	3.0223172208985285	0.0	discard	13_4_in_DOMINO	Parallel run loop
auto	4.345096413036063	0.0	discard	14_CIRCLE_in_CIRCLE	Parallel run loop
auto	1.8204190752494187	0.0	discard	18_3_in_circle	Parallel run loop
auto	1.4007623159126743	0.0	discard	10_3_in_circle	Parallel run loop
auto	2.9024064399558376	0.0	discard	11_4_in_DOMINO	Parallel run loop
auto	1.5230514075566917	0.0	discard	12_3_in_circle	Parallel run loop
auto	1.8582158012495773	0.0	discard	19_3_in_circle	Parallel run loop
auto	3.1064519114939206	0.0	discard	21_4_in_CIRCLE	Parallel run loop
auto	4.965060044085815	0.0	discard	21_3_in_3	Parallel run loop
auto	4.63348722009616	0.0	discard	16_CIRCLE_in_CIRCLE	Parallel run loop
auto	3.7364237438117933	0.0	discard	31_4_in_CIRCLE	Parallel run loop
auto	3.9641227017335576	0.0	discard	22_4_in_DOMINO	Parallel run loop
auto	4.883494798545663	0.0	discard	18_CIRCLE_in_CIRCLE	Parallel run loop
auto	5.143321280120154	0.0	discard	20_CIRCLE_in_CIRCLE	Parallel run loop
auto	6.102824021708157	0.0	discard	30_3_in_3	Parallel run loop
auto	5.984737071313207	0.0	discard	32_3_in_3	Parallel run loop
auto	11.471632991608798	0.0	discard	14_CIRCLE_in_3	Parallel run loop
auto	3.265553306575606	0.0	discard	26_4_in_CIRCLE	Parallel run loop
auto	4.475096077264324	0.0	discard	33_4_in_DOMINO	Parallel run loop
auto	3.5236257287305413	0.0	discard	30_4_in_CIRCLE	Parallel run loop
auto	3.115803431953349	0.0	discard	23_4_in_CIRCLE	Parallel run loop
auto	3.2232942054853804	0.0	discard	25_4_in_CIRCLE	Parallel run loop
auto	2.643847752583437	0.0	discard	16_4_in_CIRCLE	Parallel run loop
auto	1.7029189896133312	0.0	discard	16_3_in_circle	Parallel run loop
auto	7.030922742455542	0.0	discard	45_3_in_3	Parallel run loop
auto	6.84302398719644	0.0	discard	38_3_in_3	Parallel run loop
auto	4.020360663309433	0.0	discard	26_4_in_DOMINO	Parallel run loop
auto	11.413488992180232	0.0	discard	13_CIRCLE_in_3	Parallel run loop
auto	4.044636069278394	0.0	discard	12_CIRCLE_in_CIRCLE	Parallel run loop
auto	1.2748051192828511	0.0	discard	8_3_in_circle	Parallel run loop
auto	6.9673699289329925	0.0	discard	43_3_in_3	Parallel run loop
auto	6.866970338907654	0.0	discard	41_3_in_3	Parallel run loop
auto	4.538260254000323	0.0	discard	15_CIRCLE_in_CIRCLE	Parallel run loop
auto	2.8776782496867814	0.0	discard	19_4_in_CIRCLE	Parallel run loop
auto	4.510334332905153	0.0	discard	34_4_in_DOMINO	Parallel run loop
auto	2.9024064399558376	0.0	discard	11_4_in_DOMINO	Parallel run loop
auto	1.4830513649835477	0.0	discard	11_3_in_circle	Parallel run loop
auto	1.6549223038095542	0.0	discard	15_3_in_circle	Parallel run loop
auto	4.019565593893119	0.0	discard	33_4_in_CIRCLE	Parallel run loop
auto	2.9479967602447665	0.0	discard	20_4_in_CIRCLE	Parallel run loop
auto	4.809960188594904	0.0	discard	17_CIRCLE_in_CIRCLE	Parallel run loop
auto	4.345096413036063	0.0	discard	14_CIRCLE_in_CIRCLE	Parallel run loop
auto	4.118540496763505	0.0	discard	35_4_in_CIRCLE	Parallel run loop
auto	1.8204190752494187	0.0	discard	18_3_in_circle	Parallel run loop
auto	1.4007623159126743	0.0	discard	10_3_in_circle	Parallel run loop
auto	5.029602176115146	0.0	discard	42_4_in_DOMINO	Parallel run loop
auto	1.5230514075566917	0.0	discard	12_3_in_circle	Parallel run loop
auto	4.63348722009616	0.0	discard	16_CIRCLE_in_CIRCLE	Parallel run loop
auto	5.0055607612139665	0.0	discard	37_4_in_DOMINO	Parallel run loop
auto	3.8281160934956127	0.0	discard	34_4_in_CIRCLE	Parallel run loop
auto	3.631402274099691	0.0	discard	29_4_in_CIRCLE	Parallel run loop
auto	4.883494798545663	0.0	discard	18_CIRCLE_in_CIRCLE	Parallel run loop
auto	5.143321280120154	0.0	discard	20_CIRCLE_in_CIRCLE	Parallel run loop
auto	3.8688750047412386	0.0	discard	23_4_in_DOMINO	Parallel run loop
auto	11.471632991608798	0.0	discard	14_CIRCLE_in_3	Parallel run loop
auto	7.833756045824614	0.0	discard	50_3_in_3	Parallel run loop
auto	7.142421307876803	0.0	discard	42_3_in_3	Parallel run loop
auto	2.8016697604273646	0.0	discard	18_4_in_CIRCLE	Parallel run loop
auto	3.746847963455798	0.0	discard	11_3_in_3	Parallel run loop
auto	1.932475012484084	0.0	discard	21_3_in_circle	Parallel run loop
auto	6.773117703585962	0.0	discard	37_3_in_3	Parallel run loop
auto	5.977930657320277	0.0	discard	29_3_in_3	Parallel run loop
auto	3.7364237438117933	0.0	discard	31_4_in_CIRCLE	Parallel run loop
auto	1.7029189896133312	0.0	discard	16_3_in_circle	Parallel run loop
auto	5.023275579401488	0.0	discard	39_4_in_DOMINO	Parallel run loop
auto	2.848831780259015	0.0	discard	11_4_in_DOMINO	Parallel run loop
auto	11.413488992180232	0.0	discard	13_CIRCLE_in_3	Parallel run loop
auto	1.8958192025625156	0.0	discard	20_3_in_circle	Parallel run loop
auto	4.044636069278394	0.0	discard	12_CIRCLE_in_CIRCLE	Parallel run loop
auto	1.2748051192828511	0.0	discard	8_3_in_circle	Parallel run loop
auto	5.019525795832946	0.0	discard	41_4_in_DOMINO	Parallel run loop
auto	4.538260254000323	0.0	discard	15_CIRCLE_in_CIRCLE	Parallel run loop
auto	4.943502864466721	0.0	discard	40_4_in_DOMINO	Parallel run loop
auto	4.020316954443297	0.0	discard	13_3_in_3	Parallel run loop
auto	2.997631887181299	0.0	discard	28_3_in_circle	Parallel run loop
auto	3.973861928861215	0.0	discard	25_4_in_DOMINO	Parallel run loop
auto	1.4830513649835477	0.0	discard	11_3_in_circle	Parallel run loop
auto	1.8582158012495773	0.0	discard	19_3_in_circle	Parallel run loop
auto	1.6549223038095542	0.0	discard	15_3_in_circle	Parallel run loop
auto	7.015974820954202	0.0	discard	44_3_in_3	Parallel run loop
auto	4.809960188594904	0.0	discard	17_CIRCLE_in_CIRCLE	Parallel run loop
auto	4.345096413036063	0.0	discard	14_CIRCLE_in_CIRCLE	Parallel run loop
auto	3.9241229167278884	0.0	discard	24_4_in_DOMINO	Parallel run loop
auto	3.1064519114939206	0.0	discard	21_4_in_CIRCLE	Parallel run loop
auto	4.965060044085815	0.0	discard	21_3_in_3	Parallel run loop
auto	1.8204190752494187	0.0	discard	18_3_in_circle	Parallel run loop
auto	1.5230514075566917	0.0	discard	12_3_in_circle	Parallel run loop
auto	1.4007623159126743	0.0	discard	10_3_in_circle	Parallel run loop
auto	4.63348722009616	0.0	discard	16_CIRCLE_in_CIRCLE	Parallel run loop
auto	2.8457208316848197	0.0	keep	26_3_in_circle	Parallel run loop
auto	4.883494798545663	0.0	discard	18_CIRCLE_in_CIRCLE	Parallel run loop
auto	4.475096077264324	0.0	discard	33_4_in_DOMINO	Parallel run loop
auto	5.143321280120154	0.0	discard	20_CIRCLE_in_CIRCLE	Parallel run loop
auto	5.996957272103385	0.0	discard	30_3_in_3	Parallel run loop
auto	11.471632991608798	0.0	discard	14_CIRCLE_in_3	Parallel run loop
auto	3.265553306575606	0.0	discard	26_4_in_CIRCLE	Parallel run loop
auto	2.931723676723068	0.0	discard	11_4_in_DOMINO	Parallel run loop
auto	3.5236257287305413	0.0	discard	30_4_in_CIRCLE	Parallel run loop
auto	3.115803431953349	0.0	discard	23_4_in_CIRCLE	Parallel run loop
auto	5.719122467319307	0.0	discard	26_3_in_3	Parallel run loop
auto	3.2232942054853804	0.0	discard	25_4_in_CIRCLE	Parallel run loop
auto	2.643847752583437	0.0	discard	16_4_in_CIRCLE	Parallel run loop
auto	1.7029189896133312	0.0	discard	16_3_in_circle	Parallel run loop
auto	6.84302398719644	0.0	discard	38_3_in_3	Parallel run loop
auto	7.030922742455542	0.0	discard	45_3_in_3	Parallel run loop
auto	4.00437912608468	0.0	discard	25_4_in_DOMINO	Parallel run loop
auto	4.020360663309433	0.0	discard	26_4_in_DOMINO	Parallel run loop
auto	11.413488992180232	0.0	discard	13_CIRCLE_in_3	Parallel run loop
auto	6.9673699289329925	0.0	discard	43_3_in_3	Parallel run loop
auto	4.044636069278394	0.0	discard	12_CIRCLE_in_CIRCLE	Parallel run loop
auto	1.2748051192828511	0.0	discard	8_3_in_circle	Parallel run loop
auto	4.510334332905153	0.0	discard	34_4_in_DOMINO	Parallel run loop
auto	4.538260254000323	0.0	discard	15_CIRCLE_in_CIRCLE	Parallel run loop
auto	2.8776782496867814	0.0	discard	19_4_in_CIRCLE	Parallel run loop
auto	1.4830513649835477	0.0	discard	11_3_in_circle	Parallel run loop
auto	2.9479967602447665	0.0	discard	20_4_in_CIRCLE	Parallel run loop
auto	4.083271160528228	0.0	discard	35_4_in_CIRCLE	Parallel run loop
auto	4.019565593893119	0.0	discard	33_4_in_CIRCLE	Parallel run loop
auto	2.890862057652783	0.0	discard	26_3_in_circle	Parallel run loop
auto	1.6549223038095542	0.0	discard	15_3_in_circle	Parallel run loop
auto	4.345096413036063	0.0	discard	14_CIRCLE_in_CIRCLE	Parallel run loop
auto	4.809960188594904	0.0	discard	17_CIRCLE_in_CIRCLE	Parallel run loop
auto	5.029602176115146	0.0	discard	42_4_in_DOMINO	Parallel run loop
auto	5.0055607612139665	0.0	discard	37_4_in_DOMINO	Parallel run loop
auto	1.5230514075566917	0.0	discard	12_3_in_circle	Parallel run loop
auto	1.8204190752494187	0.0	discard	18_3_in_circle	Parallel run loop
auto	1.4007623159126743	0.0	discard	10_3_in_circle	Parallel run loop
auto	3.631402274099691	0.0	discard	29_4_in_CIRCLE	Parallel run loop
auto	4.63348722009616	0.0	discard	16_CIRCLE_in_CIRCLE	Parallel run loop
auto	3.8281160934956127	0.0	discard	34_4_in_CIRCLE	Parallel run loop
auto	4.883494798545663	0.0	discard	18_CIRCLE_in_CIRCLE	Parallel run loop
auto	5.143321280120154	0.0	discard	20_CIRCLE_in_CIRCLE	Parallel run loop
auto	7.912884894772335	0.0	discard	50_3_in_3	Parallel run loop
auto	3.8688750047412386	0.0	discard	23_4_in_DOMINO	Parallel run loop
auto	11.471632991608798	0.0	discard	14_CIRCLE_in_3	Parallel run loop
auto	2.8016697604273646	0.0	discard	18_4_in_CIRCLE	Parallel run loop
auto	7.142421307876803	0.0	discard	42_3_in_3	Parallel run loop
auto	4.00437912608468	0.0	discard	25_4_in_DOMINO	Parallel run loop
auto	6.773117703585962	0.0	discard	37_3_in_3	Parallel run loop
auto	3.7364237438117933	0.0	discard	31_4_in_CIRCLE	Parallel run loop
auto	1.932475012484084	0.0	discard	21_3_in_circle	Parallel run loop
