commit	score	memory_gb	status	problem	description
auto	8.556205176387037	0.0	discard	25_4_in_3	Parallel run loop
auto	7.387955541169579	0.0	discard	18_4_in_3	Parallel run loop
auto	7.6282607946591146	0.0	discard	21_4_in_3	Parallel run loop
auto	9.918104734563531	0.0	discard	34_4_in_3	Parallel run loop
auto	8.471518827955164	0.0	discard	24_4_in_3	Parallel run loop
auto	9.70420703924515	0.0	discard	32_4_in_3	Parallel run loop
auto	9.255840516534487	0.0	discard	26_6_in_4	Parallel run loop
auto	7.66760922185908	0.0	discard	20_4_in_3	Parallel run loop
auto	8.800222039362415	0.0	discard	24_6_in_4	Parallel run loop
auto	8.793324245426204	0.0	discard	27_4_in_3	Parallel run loop
auto	11.01851023958955	0.0	discard	43_4_in_3	Parallel run loop
auto	7.929378074021842	0.0	discard	19_6_in_4	Parallel run loop
auto	9.635390066119172	0.0	discard	31_4_in_3	Parallel run loop
auto	10.933591371805527	0.0	discard	41_4_in_3	Parallel run loop
auto	7.7379955374790645	0.0	discard	18_6_in_4	Parallel run loop
auto	4.3094996669154355	0.0	discard	6_4_in_3	Parallel run loop
auto	5.518355914176592	0.0	discard	9_6_in_4	Parallel run loop
auto	7.616186786313882	0.0	discard	17_6_in_4	Parallel run loop
auto	6.309650599267663	0.0	discard	12_4_in_3	Parallel run loop
auto	8.156687169662156	0.0	discard	22_4_in_3	Parallel run loop
auto	7.313097213390867	0.0	discard	17_4_in_3	Parallel run loop
auto	8.668767924782731	0.0	discard	23_6_in_4	Parallel run loop
auto	10.941341261088779	0.0	discard	42_4_in_3	Parallel run loop
auto	10.05213745737268	0.0	discard	35_4_in_3	Parallel run loop
auto	10.090481997169428	0.0	discard	36_4_in_3	Parallel run loop
auto	6.390048561930935	0.0	discard	12_6_in_4	Parallel run loop
auto	5.309910838673369	0.0	discard	9_4_in_3	Parallel run loop
auto	10.790271115595846	0.0	discard	40_4_in_3	Parallel run loop
auto	10.599771163337323	0.0	discard	39_4_in_3	Parallel run loop
auto	7.387785192386595	0.0	discard	18_4_in_3	Parallel run loop
auto	3.491959731325357	0.0	discard	3_6_in_4	Parallel run loop
auto	8.620168250920733	0.0	discard	25_4_in_3	Parallel run loop
auto	9.513940573292547	0.0	discard	27_6_in_4	Parallel run loop
auto	5.309456355946519	0.0	discard	8_4_in_3	Parallel run loop
auto	9.859456383527776	0.0	discard	34_4_in_3	Parallel run loop
auto	7.470689960011099	0.0	discard	19_4_in_3	Parallel run loop
auto	8.553044291559809	0.0	discard	24_4_in_3	Parallel run loop
auto	7.315017526280247	0.0	keep	16_6_in_4	Parallel run loop
auto	9.807451120192226	0.0	discard	32_4_in_3	Parallel run loop
auto	3.7250037826503797	0.0	discard	4_6_in_4	Parallel run loop
auto	8.810557480845203	0.0	discard	24_6_in_4	Parallel run loop
auto	4.154750717508222	0.0	discard	4_4_in_3	Parallel run loop
auto	8.77391027500456	0.0	discard	27_4_in_3	Parallel run loop
auto	7.908773594888604	0.0	discard	18_6_in_4	Parallel run loop
auto	9.472120229746906	0.0	discard	31_4_in_3	Parallel run loop
auto	4.440722088808257	0.0	discard	5_6_in_4	Parallel run loop
auto	11.01851023958955	0.0	discard	43_4_in_3	Parallel run loop
auto	7.626602931549492	0.0	discard	17_6_in_4	Parallel run loop
auto	7.316514759436738	0.0	discard	17_4_in_3	Parallel run loop
auto	6.764428342593895	0.0	discard	13_6_in_4	Parallel run loop
auto	6.309719735191199	0.0	discard	12_4_in_3	Parallel run loop
auto	10.933591371805527	0.0	discard	41_4_in_3	Parallel run loop
auto	8.778031375178879	0.0	discard	28_4_in_3	Parallel run loop
auto	4.309409782028365	0.0	discard	5_4_in_3	Parallel run loop
auto	8.167656738950274	0.0	discard	22_4_in_3	Parallel run loop
auto	10.088803322429495	0.0	discard	35_4_in_3	Parallel run loop
auto	11.057079850967028	0.0	discard	42_4_in_3	Parallel run loop
auto	10.090481997169428	0.0	discard	36_4_in_3	Parallel run loop
auto	10.776309862715156	0.0	discard	40_4_in_3	Parallel run loop
auto	7.15750196563385	0.0	discard	16_4_in_3	Parallel run loop
auto	10.599771163337323	0.0	discard	39_4_in_3	Parallel run loop
auto	8.627146868055858	0.0	discard	25_4_in_3	Parallel run loop
auto	6.339849586688972	0.0	discard	11_6_in_4	Parallel run loop
auto	7.387955541169579	0.0	discard	18_4_in_3	Parallel run loop
auto	9.513940573292547	0.0	discard	27_6_in_4	Parallel run loop
auto	5.309456355946519	0.0	discard	8_4_in_3	Parallel run loop
auto	7.471317325000314	0.0	discard	19_4_in_3	Parallel run loop
auto	9.97856733021505	0.0	discard	34_4_in_3	Parallel run loop
auto	8.522156032410958	0.0	discard	24_4_in_3	Parallel run loop
auto	7.319749233109036	0.0	discard	16_6_in_4	Parallel run loop
auto	8.774117417357346	0.0	discard	27_4_in_3	Parallel run loop
auto	9.70420703924515	0.0	discard	32_4_in_3	Parallel run loop
auto	4.813853256562242	0.0	discard	6_6_in_4	Parallel run loop
auto	5.464261083124018	0.0	discard	10_4_in_3	Parallel run loop
auto	6.964887949747074	0.0	discard	15_6_in_4	Parallel run loop
auto	9.503810945828404	0.0	discard	31_4_in_3	Parallel run loop
auto	6.309719735191199	0.0	discard	12_4_in_3	Parallel run loop
auto	9.255840516534487	0.0	discard	26_6_in_4	Parallel run loop
auto	7.9061745767615585	0.0	discard	18_6_in_4	Parallel run loop
auto	11.01851023958955	0.0	discard	43_4_in_3	Parallel run loop
auto	8.778031375178879	0.0	discard	28_4_in_3	Parallel run loop
auto	7.7121682150609985	0.0	discard	21_4_in_3	Parallel run loop
auto	10.940553511555468	0.0	discard	41_4_in_3	Parallel run loop
auto	4.154750717508222	0.0	discard	4_4_in_3	Parallel run loop
auto	6.465828989260902	0.0	discard	14_4_in_3	Parallel run loop
auto	8.159343201959462	0.0	discard	22_4_in_3	Parallel run loop
auto	7.620768472631966	0.0	discard	20_4_in_3	Parallel run loop
auto	9.954262907010387	0.0	discard	35_4_in_3	Parallel run loop
auto	10.947326139296766	0.0	discard	42_4_in_3	Parallel run loop
auto	10.085923514679424	0.0	discard	36_4_in_3	Parallel run loop
auto	10.791219693178732	0.0	discard	40_4_in_3	Parallel run loop
auto	7.929378074021842	0.0	discard	19_6_in_4	Parallel run loop
auto	10.599771163337323	0.0	discard	39_4_in_3	Parallel run loop
auto	4.3094996669154355	0.0	discard	6_4_in_3	Parallel run loop
auto	7.387955541169579	0.0	discard	18_4_in_3	Parallel run loop
auto	9.513940573292547	0.0	discard	27_6_in_4	Parallel run loop
auto	8.627146868055858	0.0	discard	25_4_in_3	Parallel run loop
auto	10.663053679659281	0.0	discard	38_4_in_3	Parallel run loop
auto	8.687194129676884	0.0	discard	23_6_in_4	Parallel run loop
auto	9.883661321007729	0.0	discard	34_4_in_3	Parallel run loop
auto	7.316375030447305	0.0	discard	16_6_in_4	Parallel run loop
auto	8.59991571441429	0.0	discard	24_4_in_3	Parallel run loop
auto	8.78138974141751	0.0	discard	27_4_in_3	Parallel run loop
auto	9.757625332536449	0.0	discard	32_4_in_3	Parallel run loop
auto	9.472120229746906	0.0	discard	31_4_in_3	Parallel run loop
auto	5.155344374810373	0.0	discard	7_4_in_3	Parallel run loop
auto	5.309910838673369	0.0	discard	9_4_in_3	Parallel run loop
auto	7.89207958392019	0.0	discard	18_6_in_4	Parallel run loop
auto	3.7250031912651163	0.0	discard	4_6_in_4	Parallel run loop
auto	8.578042711805615	0.0	discard	22_6_in_4	Parallel run loop
auto	6.964000014504972	0.0	discard	15_6_in_4	Parallel run loop
auto	4.439000354968679	0.0	discard	5_6_in_4	Parallel run loop
auto	9.248873243871442	0.0	discard	29_4_in_3	Parallel run loop
auto	6.75734611947217	0.0	discard	13_6_in_4	Parallel run loop
auto	11.088054288961093	0.0	discard	43_4_in_3	Parallel run loop
auto	10.99787383052886	0.0	discard	41_4_in_3	Parallel run loop
auto	10.100856434129922	0.0	discard	35_4_in_3	Parallel run loop
auto	6.156893685363397	0.0	discard	11_4_in_3	Parallel run loop
auto	8.236289814969588	0.0	discard	22_4_in_3	Parallel run loop
auto	10.790271115595846	0.0	discard	40_4_in_3	Parallel run loop
auto	9.941338147908723	0.0	discard	36_4_in_3	Parallel run loop
auto	9.471674556783666	0.0	discard	30_4_in_3	Parallel run loop
auto	4.30942692978523	0.0	discard	5_4_in_3	Parallel run loop
auto	11.057079850967028	0.0	discard	42_4_in_3	Parallel run loop
auto	10.599771163337323	0.0	discard	39_4_in_3	Parallel run loop
auto	4.154750717508222	0.0	discard	4_4_in_3	Parallel run loop
auto	8.627146868055858	0.0	discard	25_4_in_3	Parallel run loop
auto	7.465594074136727	0.0	discard	18_4_in_3	Parallel run loop
auto	9.474361225301514	0.0	discard	27_6_in_4	Parallel run loop
auto	7.15750196563385	0.0	discard	16_4_in_3	Parallel run loop
auto	6.339849586688972	0.0	discard	11_6_in_4	Parallel run loop
auto	7.321045141554854	0.0	discard	16_6_in_4	Parallel run loop
auto	8.541657663661779	0.0	discard	24_4_in_3	Parallel run loop
auto	9.940946873872878	0.0	discard	34_4_in_3	Parallel run loop
auto	9.748219324694178	0.0	discard	32_4_in_3	Parallel run loop
auto	8.793906030236618	0.0	discard	27_4_in_3	Parallel run loop
auto	9.640490371249061	0.0	discard	31_4_in_3	Parallel run loop
auto	5.15538249832505	0.0	discard	7_4_in_3	Parallel run loop
auto	4.814977901128664	0.0	discard	6_6_in_4	Parallel run loop
auto	8.583374246046413	0.0	discard	22_6_in_4	Parallel run loop
auto	6.759309212678789	0.0	discard	13_6_in_4	Parallel run loop
auto	7.895347569715662	0.0	discard	18_6_in_4	Parallel run loop
auto	6.964063388869967	0.0	discard	15_6_in_4	Parallel run loop
auto	3.2320607503195915	0.0	discard	3_4_in_3	Parallel run loop
auto	11.01851023958955	0.0	discard	43_4_in_3	Parallel run loop
auto	6.388840407653808	0.0	discard	12_6_in_4	Parallel run loop
auto	10.934110033460978	0.0	discard	41_4_in_3	Parallel run loop
auto	5.464524742438333	0.0	discard	10_4_in_3	Parallel run loop
auto	9.255840516534487	0.0	discard	26_6_in_4	Parallel run loop
auto	10.091697833051867	0.0	discard	36_4_in_3	Parallel run loop
auto	6.467078494287158	0.0	discard	14_4_in_3	Parallel run loop
auto	10.058776159423706	0.0	discard	35_4_in_3	Parallel run loop
auto	10.930094204549755	0.0	discard	42_4_in_3	Parallel run loop
auto	7.620768472631966	0.0	discard	20_4_in_3	Parallel run loop
auto	7.742742602208797	0.0	discard	21_4_in_3	Parallel run loop
auto	10.629098076349557	0.0	discard	39_4_in_3	Parallel run loop
auto	10.790271115595846	0.0	discard	40_4_in_3	Parallel run loop
auto	8.619398901246518	0.0	discard	25_4_in_3	Parallel run loop
auto	8.79744222560545	0.0	discard	24_6_in_4	Parallel run loop
auto	7.387785192386595	0.0	discard	18_4_in_3	Parallel run loop
auto	9.472867934776529	0.0	discard	27_6_in_4	Parallel run loop
auto	7.932811760780142	0.0	discard	19_6_in_4	Parallel run loop
auto	4.3094996669154355	0.0	discard	6_4_in_3	Parallel run loop
auto	7.315643541926898	0.0	discard	17_4_in_3	Parallel run loop
auto	9.895112609681343	0.0	discard	34_4_in_3	Parallel run loop
auto	9.807451120192226	0.0	discard	32_4_in_3	Parallel run loop
auto	8.541657663661779	0.0	discard	24_4_in_3	Parallel run loop
auto	10.643308551417803	0.0	discard	38_4_in_3	Parallel run loop
auto	8.595654912679807	0.0	discard	22_6_in_4	Parallel run loop
auto	8.787408360486632	0.0	discard	27_4_in_3	Parallel run loop
auto	4.154750717508222	0.0	discard	4_4_in_3	Parallel run loop
auto	9.631514356730015	0.0	discard	31_4_in_3	Parallel run loop
auto	8.671154478085834	0.0	discard	23_6_in_4	Parallel run loop
auto	7.9061745767615585	0.0	discard	18_6_in_4	Parallel run loop
auto	5.313726164808948	0.0	discard	9_4_in_3	Parallel run loop
auto	5.309456355946519	0.0	discard	8_4_in_3	Parallel run loop
auto	11.01851023958955	0.0	discard	43_4_in_3	Parallel run loop
auto	3.7250037826503797	0.0	discard	4_6_in_4	Parallel run loop
auto	7.47650969637775	0.0	discard	19_4_in_3	Parallel run loop
auto	10.935004358179606	0.0	discard	41_4_in_3	Parallel run loop
auto	6.3888974532209355	0.0	discard	12_6_in_4	Parallel run loop
auto	9.977849425522537	0.0	discard	36_4_in_3	Parallel run loop
auto	5.518346442879487	0.0	discard	9_6_in_4	Parallel run loop
auto	11.057079850967028	0.0	discard	42_4_in_3	Parallel run loop
auto	9.162723052300567	0.0	discard	29_4_in_3	Parallel run loop
auto	3.491959731325357	0.0	discard	3_6_in_4	Parallel run loop
auto	10.059349683152524	0.0	discard	35_4_in_3	Parallel run loop
auto	10.599771163337323	0.0	discard	39_4_in_3	Parallel run loop
auto	10.776309862715156	0.0	discard	40_4_in_3	Parallel run loop
auto	7.4645934216366685	0.0	discard	18_4_in_3	Parallel run loop
auto	9.455403984086399	0.0	discard	27_6_in_4	Parallel run loop
auto	8.778031375178879	0.0	discard	28_4_in_3	Parallel run loop
auto	4.439000354968679	0.0	discard	5_6_in_4	Parallel run loop
auto	8.62156318392373	0.0	discard	25_4_in_3	Parallel run loop
auto	8.802553337531233	0.0	discard	24_6_in_4	Parallel run loop
auto	8.620972216247035	0.0	discard	24_4_in_3	Parallel run loop
auto	6.156421400406855	0.0	discard	11_4_in_3	Parallel run loop
auto	9.70420703924515	0.0	discard	32_4_in_3	Parallel run loop
auto	10.549071817935308	0.0	discard	38_4_in_3	Parallel run loop
auto	9.934621969128687	0.0	discard	34_4_in_3	Parallel run loop
auto	8.662236449092912	0.0	discard	23_6_in_4	Parallel run loop
auto	8.856773859040588	0.0	discard	27_4_in_3	Parallel run loop
auto	9.582891221293432	0.0	discard	31_4_in_3	Parallel run loop
auto	9.476365490918097	0.0	discard	30_4_in_3	Parallel run loop
auto	4.309418543637569	0.0	discard	5_4_in_3	Parallel run loop
auto	7.15750196563385	0.0	discard	16_4_in_3	Parallel run loop
auto	7.715875493458835	0.0	keep	18_6_in_4	Parallel run loop
auto	10.938599347826347	0.0	discard	43_4_in_3	Parallel run loop
auto	6.339849586688972	0.0	discard	11_6_in_4	Parallel run loop
auto	4.814266722270147	0.0	discard	6_6_in_4	Parallel run loop
auto	5.309456355946519	0.0	discard	8_4_in_3	Parallel run loop
auto	4.154707933020685	0.0	discard	4_4_in_3	Parallel run loop
auto	3.232052318453766	0.0	discard	3_4_in_3	Parallel run loop
auto	10.922262976669163	0.0	discard	41_4_in_3	Parallel run loop
auto	11.020518488177382	0.0	discard	42_4_in_3	Parallel run loop
auto	10.12146122489197	0.0	discard	36_4_in_3	Parallel run loop
auto	5.464261083124018	0.0	discard	10_4_in_3	Parallel run loop
auto	10.076744023871674	0.0	discard	35_4_in_3	Parallel run loop
auto	10.599771163337323	0.0	discard	39_4_in_3	Parallel run loop
auto	10.776309862715156	0.0	discard	40_4_in_3	Parallel run loop
auto	9.170480985456972	0.0	discard	29_4_in_3	Parallel run loop
auto	6.465828989260902	0.0	discard	14_4_in_3	Parallel run loop
auto	9.513940573292547	0.0	discard	27_6_in_4	Parallel run loop
auto	7.387955541169579	0.0	discard	18_4_in_3	Parallel run loop
auto	7.6118300851610385	0.0	discard	17_6_in_4	Parallel run loop
auto	8.627146868055858	0.0	discard	25_4_in_3	Parallel run loop
auto	8.800510614999979	0.0	discard	24_6_in_4	Parallel run loop
auto	8.549770312314937	0.0	discard	24_4_in_3	Parallel run loop
auto	9.255840516534487	0.0	discard	26_6_in_4	Parallel run loop
auto	8.668767924782731	0.0	discard	23_6_in_4	Parallel run loop
auto	9.939323322782652	0.0	discard	34_4_in_3	Parallel run loop
auto	9.725566438207675	0.0	discard	32_4_in_3	Parallel run loop
auto	7.742742602208797	0.0	discard	21_4_in_3	Parallel run loop
auto	11.01851023958955	0.0	discard	43_4_in_3	Parallel run loop
auto	8.893973736111443	0.0	discard	27_4_in_3	Parallel run loop
auto	7.932811760780142	0.0	discard	19_6_in_4	Parallel run loop
auto	9.472120229746906	0.0	discard	31_4_in_3	Parallel run loop
auto	4.3094996669154355	0.0	discard	6_4_in_3	Parallel run loop
auto	7.908773594888604	0.0	discard	18_6_in_4	Parallel run loop
auto	7.309824033492363	0.0	discard	17_4_in_3	Parallel run loop
auto	4.814811523641814	0.0	discard	6_6_in_4	Parallel run loop
auto	7.6219607966966265	0.0	discard	20_4_in_3	Parallel run loop
auto	3.232066114699316	0.0	discard	3_4_in_3	Parallel run loop
auto	4.154707933020685	0.0	discard	4_4_in_3	Parallel run loop
auto	6.105830236540242	0.0	discard	10_6_in_4	Parallel run loop
auto	5.313726164808948	0.0	discard	9_4_in_3	Parallel run loop
auto	10.090016410968007	0.0	discard	35_4_in_3	Parallel run loop
auto	10.12146122489197	0.0	discard	36_4_in_3	Parallel run loop
auto	10.619926529082107	0.0	discard	39_4_in_3	Parallel run loop
auto	10.940553511555468	0.0	discard	41_4_in_3	Parallel run loop
auto	11.044659619702836	0.0	discard	42_4_in_3	Parallel run loop
auto	10.776309862715156	0.0	discard	40_4_in_3	Parallel run loop
auto	7.47650969637775	0.0	discard	19_4_in_3	Parallel run loop
auto	5.518209420977355	0.0	discard	9_6_in_4	Parallel run loop
auto	9.474361225301514	0.0	discard	27_6_in_4	Parallel run loop
auto	7.387955541169579	0.0	discard	18_4_in_3	Parallel run loop
auto	7.626602931549492	0.0	discard	17_6_in_4	Parallel run loop
auto	8.627146868055858	0.0	discard	25_4_in_3	Parallel run loop
auto	8.620972216247035	0.0	discard	24_4_in_3	Parallel run loop
auto	3.7250031912651163	0.0	discard	4_6_in_4	Parallel run loop
auto	5.155053785931084	0.0	discard	7_4_in_3	Parallel run loop
auto	9.659578206958082	0.0	discard	32_4_in_3	Parallel run loop
auto	3.491966624935928	0.0	discard	3_6_in_4	Parallel run loop
auto	9.928503593750683	0.0	discard	34_4_in_3	Parallel run loop
auto	4.440446747110393	0.0	discard	5_6_in_4	Parallel run loop
auto	6.155976403489312	0.0	discard	11_4_in_3	Parallel run loop
auto	11.01851023958955	0.0	discard	43_4_in_3	Parallel run loop
auto	9.623677409017692	0.0	discard	31_4_in_3	Parallel run loop
auto	8.778031375178879	0.0	discard	28_4_in_3	Parallel run loop
auto	8.799146647270007	0.0	discard	27_4_in_3	Parallel run loop
auto	7.314643766276765	0.0	discard	17_4_in_3	Parallel run loop
auto	7.15750196563385	0.0	discard	16_4_in_3	Parallel run loop
auto	6.759508156569627	0.0	discard	13_6_in_4	Parallel run loop
auto	4.309409782028365	0.0	discard	5_4_in_3	Parallel run loop
auto	4.154750717508222	0.0	discard	4_4_in_3	Parallel run loop
auto	6.339849586688972	0.0	discard	11_6_in_4	Parallel run loop
auto	9.471674556783666	0.0	discard	30_4_in_3	Parallel run loop
auto	10.599771163337323	0.0	discard	39_4_in_3	Parallel run loop
auto	5.464450724159364	0.0	discard	10_4_in_3	Parallel run loop
auto	10.081269992882202	0.0	discard	35_4_in_3	Parallel run loop
auto	10.776309862715156	0.0	discard	40_4_in_3	Parallel run loop
auto	10.90719391843809	0.0	discard	41_4_in_3	Parallel run loop
auto	11.057079850967028	0.0	discard	42_4_in_3	Parallel run loop
auto	10.064106535642859	0.0	discard	36_4_in_3	Parallel run loop
auto	6.964000014504972	0.0	discard	15_6_in_4	Parallel run loop
auto	7.464231441122713	0.0	discard	18_4_in_3	Parallel run loop
auto	9.510755639083786	0.0	discard	27_6_in_4	Parallel run loop
auto	5.5182658077084294	0.0	discard	9_6_in_4	Parallel run loop
auto	6.465828989260902	0.0	discard	14_4_in_3	Parallel run loop
auto	8.619398901246518	0.0	discard	25_4_in_3	Parallel run loop
auto	8.465628025883607	0.0	discard	24_4_in_3	Parallel run loop
auto	3.7250031912651163	0.0	discard	4_6_in_4	Parallel run loop
auto	9.788689998247959	0.0	discard	32_4_in_3	Parallel run loop
auto	6.393229738822146	0.0	discard	12_6_in_4	Parallel run loop
auto	9.255840516534487	0.0	discard	26_6_in_4	Parallel run loop
auto	7.742742602208797	0.0	discard	21_4_in_3	Parallel run loop
auto	9.472120229746906	0.0	discard	31_4_in_3	Parallel run loop
auto	10.006133574979062	0.0	discard	34_4_in_3	Parallel run loop
auto	6.156421400406855	0.0	discard	11_4_in_3	Parallel run loop
auto	4.3094996669154355	0.0	discard	6_4_in_3	Parallel run loop
auto	10.938599347826347	0.0	discard	43_4_in_3	Parallel run loop
auto	8.853422291130135	0.0	discard	27_4_in_3	Parallel run loop
auto	7.620768472631966	0.0	discard	20_4_in_3	Parallel run loop
auto	7.932811760780142	0.0	discard	19_6_in_4	Parallel run loop
auto	10.433111037339204	0.0	discard	38_4_in_3	Parallel run loop
auto	10.776309862715156	0.0	discard	40_4_in_3	Parallel run loop
auto	7.47650969637775	0.0	discard	19_4_in_3	Parallel run loop
auto	5.309910838673369	0.0	discard	9_4_in_3	Parallel run loop
auto	6.104982492730227	0.0	discard	10_6_in_4	Parallel run loop
auto	5.309456355946519	0.0	discard	8_4_in_3	Parallel run loop
auto	10.629098076349557	0.0	discard	39_4_in_3	Parallel run loop
auto	10.098297774740265	0.0	discard	35_4_in_3	Parallel run loop
auto	10.940638114596652	0.0	discard	41_4_in_3	Parallel run loop
auto	11.095365680688142	0.0	discard	42_4_in_3	Parallel run loop
auto	7.3211725522845335	0.0	discard	16_6_in_4	Parallel run loop
auto	6.964000014504972	0.0	discard	15_6_in_4	Parallel run loop
auto	10.090848203208573	0.0	discard	36_4_in_3	Parallel run loop
auto	9.513940573292547	0.0	discard	27_6_in_4	Parallel run loop
auto	5.518421711656798	0.0	discard	9_6_in_4	Parallel run loop
auto	7.387955541169579	0.0	discard	18_4_in_3	Parallel run loop
auto	6.309719735191199	0.0	discard	12_4_in_3	Parallel run loop
auto	5.155344374810373	0.0	discard	7_4_in_3	Parallel run loop
auto	8.59991571441429	0.0	discard	24_4_in_3	Parallel run loop
auto	8.627146868055858	0.0	discard	25_4_in_3	Parallel run loop
auto	3.7250031912651163	0.0	discard	4_6_in_4	Parallel run loop
auto	9.788689998247959	0.0	discard	32_4_in_3	Parallel run loop
auto	9.472120229746906	0.0	discard	31_4_in_3	Parallel run loop
auto	8.591017798125398	0.0	discard	22_6_in_4	Parallel run loop
auto	9.91945963826023	0.0	discard	34_4_in_3	Parallel run loop
auto	10.208937371323803	0.0	discard	37_4_in_3	Parallel run loop
auto	6.156893685363397	0.0	discard	11_4_in_3	Parallel run loop
auto	7.620768472631966	0.0	discard	20_4_in_3	Parallel run loop
auto	9.170480985456972	0.0	discard	29_4_in_3	Parallel run loop
auto	11.01851023958955	0.0	discard	43_4_in_3	Parallel run loop
auto	8.856773859040588	0.0	discard	27_4_in_3	Parallel run loop
auto	3.491959014509597	0.0	discard	3_6_in_4	Parallel run loop
auto	10.661641312303162	0.0	discard	38_4_in_3	Parallel run loop
auto	10.701388793332898	0.0	keep	40_4_in_3	Parallel run loop
auto	4.438123057858091	0.0	discard	5_6_in_4	Parallel run loop
auto	6.105017969064268	0.0	discard	10_6_in_4	Parallel run loop
auto	10.790948656114363	0.0	keep	41_4_in_3	Parallel run loop
auto	6.764428342593895	0.0	discard	13_6_in_4	Parallel run loop
auto	9.877528661157257	0.0	discard	35_4_in_3	Parallel run loop
auto	8.778031375178879	0.0	discard	28_4_in_3	Parallel run loop
auto	10.947326139296766	0.0	discard	42_4_in_3	Parallel run loop
auto	6.964000014504972	0.0	discard	15_6_in_4	Parallel run loop
auto	10.625528379341857	0.0	discard	39_4_in_3	Parallel run loop
auto	9.472785287505902	0.0	discard	30_4_in_3	Parallel run loop
