commit	score	memory_gb	status	problem	description
6748b08	1.80349	2.0	keep	5_3_in_4	tune basinhopping (niter=30, T=0.2, stepsize=0.12)
d8e38da	2.770	2.0	keep	5_4_in_4	baseline: 5 squares in square, 30 attempts
49bfe39	2.707	2.0	keep	5_4_in_4	increase attempts to 300
1538805	2.7071	2.0	keep	5_4_in_4	increase attempts to 2000 (marginal)
3c7832e	1.2527	2.0	keep	5_3_in_6	baseline: 5 triangles in hexagon, 300 attempts
035f452	1.373	0.0	discard	6_3_in_6	trivial problem (best_value=1); switch problem
0fbdcf9	1.7320269	0.0	keep	5_4_in_6	baseline 5 squares in hexagon (Rust, 3000 attempts, 280s)
15a6c6b	1.7319968	0.0	keep	5_4_in_6	increase RUST_ATTEMPTS to 5000; beat previous 1.7320269
84e4225	1.7319937	0.0	keep	5_4_in_6	increase RUST_ATTEMPTS to 10000; slight improvement over 1.7319968
78cc406	1.8031153	0.0	keep	5_3_in_4	Rust baseline 10000 attempts; beat 1.80349 + image render integrated
0057990	1.8031153	0.0	discard	5_3_in_4	double attempts (20000) no improvement; switch problem
4f60726	1.2558855	0.0	keep	5_3_in_6	Rust baseline 20000 attempts; image OK
04b97f1	1.2531508	0.0	keep	5_3_in_6	RUST_ATTEMPTS=40000; beat 1.2558855
12beec1	1.2523728	0.0	keep	5_3_in_6	RUST_ATTEMPTS=60000; beat 1.2531508
41e05b9	0.9591986	0.0	keep	5_3_in_8	Rust 60000 baseline
a5c8b91	1.1344415	0.0	keep	7_3_in_8	Rust 60000 baseline
6883a97	1.1342611	0.0	keep	7_3_in_8	Rust 80000; beat 1.1344415
17cd434	1.1208521	0.0	keep	4_3_in_6	Rust 80000 baseline
a028f0a	1.6869273	0.0	keep	9_3_in_6	Rust 80000 baseline
653d6fe	1.6835087	0.0	keep	9_3_in_6	Rust 100000; beat 1.6869273
d43252b	1.6802344	0.0	keep	9_3_in_6	Rust 150000; beat 1.6835087
59aa866	1.1444471	0.0	keep	3_3_in_5	Rust 80000 baseline
	0.8570982	2.0	keep	4_3_in_8	baseline 4 triangles in octagon (Rust, 80000)
dca1853	0.8583033	2.0	discard	4_3_in_8	increase RUST_ATTEMPTS to 100000; no improvement
860ac5c	4.3856	0.0	keep	8_5_in_4	baseline (Rust, 150k attempts)
ebcedb0	4.3851	0.0	keep	8_5_in_4	increase attempts to 250k; slight improvement
081d785	4.3884	0.0	discard	8_5_in_4	400k attempts worse than 4.3851; discard
6395a56	2.3983	0.0	keep	12_5_in_8	baseline (Rust, 150k attempts)
52f5379	2.4064	0.0	discard	12_5_in_8	250k worse than 2.3983; discard
4039eb9	1.9870	0.0	keep	5_6_in_8	baseline (Rust, 150k attempts)
b865092	1.9870	0.0	discard	5_6_in_8	250k no improvement; discard
9aef728	1.9405	0.0	keep	6_3_in_4	baseline (Rust, 150k attempts)
603bee0	1.9408	0.0	discard	6_3_in_4	250k worse than 1.9405; discard
704f9f3	1.3432	0.0	keep	6_4_in_8	baseline (Rust, 150k attempts)
0e3e58b	1.3433	0.0	discard	6_4_in_8	250k worse than 1.3432; discard
1f8109c	1.5749	0.0	keep	8_4_in_8	baseline (Rust, 150k attempts)
15aab5d	1.5719	0.0	keep	8_4_in_8	250k improved vs 150k (1.5719 < 1.5749)
0c8f28e	1.5740	0.0	discard	8_4_in_8	400k worse than 1.5719; switch problem
c94b24e	2.4092	0.0	keep	8_6_in_8	baseline (Rust, 150k attempts)
ebab9ed	2.4092	0.0	discard	8_6_in_8	250k no improvement; discard
4775c0a	1.2857	0.0	keep	9_3_in_8	baseline (Rust, 150k attempts)
b78e35b	2.1572	0.0	keep	8_4_in_6	baseline (Rust, 150k attempts)
0c3aa2d	2.155278	0.0	keep	8_4_in_6	250k attempts improved vs 150k
5a15b27	2.1569	0.0	discard	8_4_in_6	400k worse than 2.155278; switch problem
f8e9942	1.7707	0.0	keep	10_3_in_6	baseline (Rust, 150k)
7b47a50	1.7746	0.0	discard	10_3_in_6	250k worse than 1.7707; discard
f0c90ed	1.7719	0.0	discard	10_3_in_6	400k worse than 1.7707; discard
ba0968b	1.7729	0.0	discard	10_3_in_6	700k worse than 1.7707; discard
767fb25	1.7718	0.0	discard	10_3_in_6	1M worse than 1.7707; 5x no improve; switch problem
51d58a9	1.9513	0.0	keep	5_4_in_5	baseline (Rust, 150k)
9bc6681	1.9513	0.0	discard	5_4_in_5	250k no improve; discard
3b6f49f	1.9517	0.0	discard	5_4_in_5	400k worse than 1.9513; switch problem
c061654	2.4218	0.0	keep	7_4_in_5	baseline (Rust, 150k)
508656a	2.42163	0.0	keep	7_4_in_5	250k improved vs baseline
b8cba9b	2.42195	0.0	discard	7_4_in_5	400k worse than 2.42163; discard
	2.42163	0.0	keep	7_4_in_5	700k match but no improve; done
ddf4712	2.1855	0.0	keep	6_4_in_5	baseline (Rust, Adam optimizer)
469d4be	2.18552	0.0	keep	6_4_in_5	increase RUST_ATTEMPTS to 250k
c1ac877	2.185518	0.0	keep	6_4_in_5	increase RUST_ATTEMPTS to 400k
88187a5	2.18554	0.0	discard	6_4_in_5	baseline test with Adam optimizer
a1ba205	1.613517	0.0	keep	6_3_in_5	baseline test with Adam optimizer
43e2453	1.613517	0.0	discard	6_3_in_5	increase RUST_ATTEMPTS to 600k
9470194	1.7563012	0.0	keep	4_6_in_8	baseline with analytical gradient optimizer
bf16567	1.7563008	0.0	keep	4_6_in_8	increase RUST_ATTEMPTS to 250k
91432e7	1.7563006	0.0	keep	4_6_in_8	increase RUST_ATTEMPTS to 400k
9f90583	1.9870768	0.0	keep	5_6_in_8	baseline with analytical gradient optimizer
7e86a01	1.9870794	0.0	discard	5_6_in_8	increase RUST_ATTEMPTS to 300k
56f1608	1.9870788	0.0	discard	5_6_in_8	increase RUST_ATTEMPTS to 500k
c0f75cf	2.3229407	0.0	keep	6_5_in_6	baseline with analytical gradient optimizer
f51f585	2.3229451	0.0	discard	6_5_in_6	increase RUST_ATTEMPTS to 300k
4d570ea	2.1539174	0.0	keep	8_4_in_6	baseline with analytical gradient optimizer
e84778f	2.1539806	0.0	discard	8_4_in_6	increase RUST_ATTEMPTS to 500k
63ce592	3.8830248	0.0	keep	6_5_in_4	baseline with analytical gradient optimizer
53aa473	3.8830304	0.0	discard	6_5_in_4	increase RUST_ATTEMPTS to 300k
f9e407a	1.6129894	0.0	keep	6_3_in_5	baseline with analytical gradient optimizer
bd12299	1.6127718	0.0	keep	6_3_in_5	increase RUST_ATTEMPTS to 300k
8bbdbe8	1.6127718	0.0	discard	6_3_in_5	increase RUST_ATTEMPTS to 400k
1ed90dd	2.2802589	0.0	keep	12_3_in_5	baseline with analytical gradient optimizer
c67b1b3	2.2807284	0.0	discard	12_3_in_5	increase RUST_ATTEMPTS to 300k
f8fb4e4	1.8629983	0.0	keep	8_3_in_5	baseline with analytical gradient optimizer
auto	0.9999184350601231	0.0	keep	1_3_in_3	Auto run attempts=1000
auto	3.0151615489897288	0.0	keep	4_6_in_5	Auto run attempts=2000
auto	3.0151615489897288	0.0	discard	4_6_in_5	Auto run attempts=2000
auto	3.0152269370217324	0.0	discard	4_6_in_5	Auto run attempts=2000
auto	2.465911549324087	0.0	keep	2_6_in_5	Auto run attempts=2000
auto	3.3560717428343176	0.0	keep	2_8_in_5	Auto run attempts=2000
auto	3.744133006793236	0.0	keep	3_8_in_5	Auto run attempts=2000
auto	2.742837139438206	0.0	keep	3_6_in_5	Auto run attempts=2000
auto	1.6064519097368366	0.0	keep	3_6_in_8	Auto run attempts=2000
auto	3.744131632294112	0.0	keep	3_8_in_5	Auto run attempts=5000
auto	2.742826175682922	0.0	keep	3_6_in_5	Auto run attempts=5000
auto	4.101263596036302	0.0	keep	4_8_in_5	Auto run attempts=2000
auto	1.6064518065238693	0.0	keep	3_6_in_8	Auto run attempts=5000
auto	1.9870877690502582	0.0	discard	5_6_in_8	Auto run attempts=2000
auto	3.015219978066057	0.0	discard	4_6_in_5	Auto run attempts=5000
auto	3.6289381872426887	0.0	keep	9_6_in_6	Auto run attempts=10000
auto	2.164378317225257	0.0	keep	6_6_in_8	Auto run attempts=5000
auto	3.744131632294112	0.0	discard	3_8_in_5	Auto run attempts=5000
auto	2.742826175682922	0.0	discard	3_6_in_5	Auto run attempts=5000
auto	1.6064518065238693	0.0	discard	3_6_in_8	Auto run attempts=5000
auto	3.744131632294112	0.0	discard	3_8_in_5	Auto run attempts=5000
auto	2.742826175682922	0.0	discard	3_6_in_5	Auto run attempts=5000
auto	4.1012610892265275	0.0	keep	4_8_in_5	Auto run attempts=5000
auto	1.6064518065238693	0.0	discard	3_6_in_8	Auto run attempts=5000
auto	1.9870877690502582	0.0	discard	5_6_in_8	Auto run attempts=5000
auto	3.015219978066057	0.0	discard	4_6_in_5	Auto run attempts=5000
auto	3.628935545351786	0.0	keep	9_6_in_6	Auto run attempts=10000
auto	2.1643635287453797	0.0	keep	6_6_in_8	Auto run attempts=5000
auto	3.744131632294112	0.0	discard	3_8_in_5	Auto run attempts=5000
auto	2.742826175682922	0.0	discard	3_6_in_5	Auto run attempts=5000
auto	1.6064518065238693	0.0	discard	3_6_in_8	Auto run attempts=5000
auto	3.744131632294112	0.0	discard	3_8_in_5	Auto run attempts=5000
auto	2.742826175682922	0.0	discard	3_6_in_5	Auto run attempts=5000
auto	4.1012610892265275	0.0	discard	4_8_in_5	Auto run attempts=5000
auto	1.6064518065238693	0.0	discard	3_6_in_8	Auto run attempts=5000
auto	1.9870877690502582	0.0	discard	5_6_in_8	Auto run attempts=5000
auto	3.015219978066057	0.0	discard	4_6_in_5	Auto run attempts=5000
auto	3.6289387190497373	0.0	discard	9_6_in_6	Auto run attempts=10000
auto	2.1643635287453797	0.0	discard	6_6_in_8	Auto run attempts=5000
auto	3.744131632294112	0.0	discard	3_8_in_5	Auto run attempts=5000
auto	2.742826175682922	0.0	discard	3_6_in_5	Auto run attempts=5000
auto	1.6064518065238693	0.0	discard	3_6_in_8	Auto run attempts=5000
auto	3.744131632294112	0.0	discard	3_8_in_5	Auto run attempts=5000
auto	2.742826175682922	0.0	discard	3_6_in_5	Auto run attempts=5000
auto	4.1012610892265275	0.0	discard	4_8_in_5	Auto run attempts=5000
auto	4.1492118237956745	0.0	keep	8_6_in_5	Auto run attempts=10000
auto	6.05047071874171	0.0	keep	9_8_in_5	Auto run attempts=100
auto	3.9430750834645236	0.0	keep	11_6_in_6	Auto run attempts=10000
auto	2.767933702382454	0.0	keep	10_6_in_8	Auto run attempts=10000
auto	4.101597380040266	0.0	discard	4_8_in_5	Auto run attempts=5000
auto	4.157344301738447	0.0	discard	8_6_in_5	Auto run attempts=10000
auto	2.6435172336221453	0.0	keep	9_6_in_8	Auto run attempts=10000
auto	2.666628487560574	0.0	keep	5_6_in_6	Auto run attempts=5000
auto	3.7370363216596365	0.0	keep	10_6_in_6	Auto run attempts=10000
auto	2.869746533171968	0.0	keep	11_6_in_8	Auto run attempts=10000
auto	3.551443871957106	0.0	keep	6_6_in_5	Auto run attempts=5000
auto	2.1659813145507174	0.0	discard	6_6_in_8	Auto run attempts=5000
auto	5.981470840585326	0.0	keep	9_8_in_5	Auto run attempts=10000
auto	4.34440516599146	0.0	keep	9_6_in_5	Auto run attempts=10000
auto	6.295140264885341	0.0	keep	10_8_in_5	Auto run attempts=10000
auto	5.256554068205588	0.0	keep	7_8_in_5	Auto run attempts=5000
auto	5.620301379188071	0.0	keep	8_8_in_5	Auto run attempts=10000
auto	4.157344301738447	0.0	discard	8_6_in_5	Auto run attempts=10000
auto	2.6435172336221453	0.0	discard	9_6_in_8	Auto run attempts=10000
auto	2.666628487560574	0.0	discard	5_6_in_6	Auto run attempts=5000
auto	3.657455572403886	0.0	discard	9_6_in_6	Auto run attempts=10000
auto	3.9418345010262885	0.0	keep	11_6_in_6	Auto run attempts=10000
auto	2.767933702382454	0.0	discard	10_6_in_8	Auto run attempts=10000
auto	4.586738396690827	0.0	keep	10_6_in_5	Auto run attempts=10000
auto	1.7562837004469616	0.0	keep	4_6_in_8	Auto run attempts=5000
auto	3.7370363216596365	0.0	discard	10_6_in_6	Auto run attempts=10000
auto	3.2204833916000335	0.0	keep	5_6_in_5	Auto run attempts=5000
auto	3.3147499620614598	0.0	keep	8_6_in_6	Auto run attempts=10000
auto	2.869746533171968	0.0	discard	11_6_in_8	Auto run attempts=10000
auto	3.551443871957106	0.0	discard	6_6_in_5	Auto run attempts=5000
auto	2.1659813145507174	0.0	discard	6_6_in_8	Auto run attempts=5000
auto	5.981470840585326	0.0	discard	9_8_in_5	Auto run attempts=10000
auto	4.34440516599146	0.0	discard	9_6_in_5	Auto run attempts=10000
auto	6.318188217306871	0.0	discard	10_8_in_5	Auto run attempts=10000
auto	5.256554068205588	0.0	discard	7_8_in_5	Auto run attempts=5000
auto	5.620301379188071	0.0	discard	8_8_in_5	Auto run attempts=10000
auto	4.157344301738447	0.0	discard	8_6_in_5	Auto run attempts=10000
auto	2.6435172336221453	0.0	discard	9_6_in_8	Auto run attempts=10000
auto	3.80240236321914	0.0	keep	7_6_in_5	Auto run attempts=5000
auto	2.666628487560574	0.0	discard	5_6_in_6	Auto run attempts=5000
auto	3.657455572403886	0.0	discard	9_6_in_6	Auto run attempts=10000
auto	3.9430750834645236	0.0	discard	11_6_in_6	Auto run attempts=10000
auto	2.767933702382454	0.0	discard	10_6_in_8	Auto run attempts=10000
auto	4.586738396690827	0.0	discard	10_6_in_5	Auto run attempts=10000
auto	1.7562837004469616	0.0	discard	4_6_in_8	Auto run attempts=5000
auto	3.7370363216596365	0.0	discard	10_6_in_6	Auto run attempts=10000
auto	3.2204833916000335	0.0	discard	5_6_in_5	Auto run attempts=5000
auto	3.3147499620614598	0.0	discard	8_6_in_6	Auto run attempts=10000
auto	6.482921070776286	0.0	keep	11_8_in_5	Auto run attempts=10000
auto	2.869746533171968	0.0	discard	11_6_in_8	Auto run attempts=10000
auto	3.551443871957106	0.0	discard	6_6_in_5	Auto run attempts=5000
auto	5.981470840585326	0.0	discard	9_8_in_5	Auto run attempts=10000
auto	4.770572805257783	0.0	keep	6_8_in_5	Auto run attempts=5000
auto	4.34440516599146	0.0	discard	9_6_in_5	Auto run attempts=10000
auto	3.09741608386456	0.0	keep	13_6_in_8	Auto run attempts=10000
auto	6.295140264885341	0.0	discard	10_8_in_5	Auto run attempts=10000
auto	5.256554068205588	0.0	discard	7_8_in_5	Auto run attempts=5000
auto	2.666678387864216	0.0	discard	5_6_in_6	Auto run attempts=1000
auto	5.63126721247686	0.0	discard	8_8_in_5	Auto run attempts=50
auto	4.1868621539967386	0.0	discard	8_6_in_5	Auto run attempts=200
auto	2.6792630612662935	0.0	discard	9_6_in_8	Auto run attempts=120
auto	3.8193272322910725	0.0	discard	7_6_in_5	Auto run attempts=50
auto	3.6492750595215986	0.0	discard	9_6_in_6	Auto run attempts=500
auto	3.9362699149929097	0.0	keep	11_6_in_6	Auto run attempts=500
auto	2.7446080738430743	0.0	keep	10_6_in_8	Auto run attempts=500
auto	7.8073003743021765	0.0	keep	11_6_in_5	Auto run attempts=500
auto	6.71938110679768	0.0	keep	12_8_in_5	Auto run attempts=500
auto	4.678135881223721	0.0	discard	10_6_in_5	Auto run attempts=500
auto	4.33817209229885	0.0	keep	5_8_in_5	Auto run attempts=500
auto	1.7563013757597399	0.0	discard	4_6_in_8	Auto run attempts=500
auto	6.332218102502023	0.0	discard	10_6_in_6	Auto run attempts=800
auto	3.5396202975495186	0.0	discard	5_6_in_5	Auto run attempts=500
auto	3.314477169278608	0.0	keep	8_6_in_6	Auto run attempts=500
auto	10.200729524728695	0.0	discard	11_8_in_5	Auto run attempts=500
auto	3.284144430190815	0.0	keep	15_6_in_8	Auto run attempts=500
604218f	3.2841715532928952	0.0	discard	15_6_in_8	Auto 15_6_in_8 attempts=2000 no improve
d42c557	3.0724251058134984	0.0	keep	13_6_in_8	Auto 13_6_in_8 improve over 3.0974
auto	1.8630702536974426	0.0	discard	8_3_in_5	Auto run attempts=50
auto	1.864683142075156	0.0	discard	8_3_in_5	Auto run attempts=50
auto	1.8647878955649861	0.0	discard	8_3_in_5	Auto run attempts=50
auto	1.8661277294537264	0.0	discard	8_3_in_5	Auto run attempts=5
auto	4.154707933020684	0.0	keep	4_4_in_3	Parallel run loop
auto	5.154752352831597	0.0	keep	7_4_in_3	Parallel run loop
auto	1.6123349279510846	0.0	keep	6_3_in_5	Parallel run loop
auto	1.4783979251891741	0.0	keep	3_3_in_4	Parallel run loop
auto	2.2843323027186626	0.0	discard	12_3_in_5	Parallel run loop
auto	4.30942692978523	0.0	keep	5_4_in_3	Parallel run loop
auto	3.491959014509597	0.0	keep	3_6_in_4	Parallel run loop
auto	5.309651875366746	0.0	keep	8_4_in_3	Parallel run loop
auto	4.438938361146937	0.0	keep	5_6_in_4	Parallel run loop
auto	3.2320649913102013	0.0	keep	3_4_in_3	Parallel run loop
auto	4.815183322352559	0.0	keep	6_6_in_4	Parallel run loop
auto	6.154783759677939	0.0	keep	11_4_in_3	Parallel run loop
auto	2.9772326063708436	0.0	keep	6_3_in_3	Parallel run loop
auto	1.5925243467289931	0.0	keep	4_3_in_4	Parallel run loop
auto	6.105017969064268	0.0	keep	10_6_in_4	Parallel run loop
auto	6.310019702504776	0.0	keep	12_4_in_3	Parallel run loop
auto	1.6200680717530058	0.0	discard	6_3_in_5	Parallel run loop
auto	1.3242755807730342	0.0	keep	4_3_in_5	Parallel run loop
auto	6.333631309387911	0.0	keep	11_6_in_4	Parallel run loop
auto	2.2831198708975147	0.0	discard	12_3_in_5	Parallel run loop
auto	7.15750196563385	0.0	keep	16_4_in_3	Parallel run loop
auto	1.7498735144668087	0.0	keep	7_3_in_5	Parallel run loop
auto	1.986413371159551	0.0	keep	9_3_in_5	Parallel run loop
auto	7.310131457947138	0.0	keep	17_4_in_3	Parallel run loop
auto	5.392015471377237	0.0	keep	9_4_in_3	Parallel run loop
auto	1.948944984673332	0.0	discard	6_3_in_4	Parallel run loop
auto	1.5837110595166848	0.0	keep	4_3_in_4	Parallel run loop
auto	2.389659079584457	0.0	keep	9_3_in_4	Parallel run loop
auto	6.764428342593895	0.0	keep	13_6_in_4	Parallel run loop
auto	4.3094996669154355	0.0	keep	6_4_in_3	Parallel run loop
auto	6.464378013276984	0.0	keep	13_4_in_3	Parallel run loop
auto	1.3242755807730342	0.0	discard	4_3_in_5	Parallel run loop
auto	3.7250037826503797	0.0	keep	4_6_in_4	Parallel run loop
auto	2.293712589121678	0.0	discard	12_3_in_5	Parallel run loop
auto	2.105101180188391	0.0	keep	7_3_in_4	Parallel run loop
auto	1.986413371159551	0.0	discard	9_3_in_5	Parallel run loop
auto	1.7498735144668087	0.0	discard	7_3_in_5	Parallel run loop
auto	7.682872437703093	0.0	keep	17_6_in_4	Parallel run loop
auto	1.5854776416978478	0.0	discard	4_3_in_4	Parallel run loop
auto	5.313726164808948	0.0	keep	9_4_in_3	Parallel run loop
auto	2.389659079584457	0.0	discard	9_3_in_4	Parallel run loop
auto	1.948944984673332	0.0	discard	6_3_in_4	Parallel run loop
auto	6.388384628405314	0.0	keep	12_6_in_4	Parallel run loop
auto	2.0841937579647527	0.0	keep	10_3_in_5	Parallel run loop
auto	1.3242755807730342	0.0	discard	4_3_in_5	Parallel run loop
auto	6.464378013276984	0.0	discard	13_4_in_3	Parallel run loop
auto	2.105101180188391	0.0	discard	7_3_in_4	Parallel run loop
auto	2.5189218409294862	0.0	keep	10_3_in_4	Parallel run loop
auto	8.155007596594247	0.0	keep	22_4_in_3	Parallel run loop
auto	1.986413371159551	0.0	discard	9_3_in_5	Parallel run loop
auto	8.43048885754377	0.0	keep	21_6_in_4	Parallel run loop
auto	2.7446635859551374	0.0	keep	12_3_in_4	Parallel run loop
auto	7.7379955374790645	0.0	keep	18_6_in_4	Parallel run loop
auto	1.583711059565369	0.0	discard	4_3_in_4	Parallel run loop
auto	8.583374246046413	0.0	keep	22_6_in_4	Parallel run loop
auto	7.471317325000314	0.0	keep	19_4_in_3	Parallel run loop
auto	7.929378074021842	0.0	keep	19_6_in_4	Parallel run loop
auto	8.472237346101952	0.0	keep	23_4_in_3	Parallel run loop
auto	2.2397815410677104	0.0	keep	8_3_in_4	Parallel run loop
auto	5.518597387761732	0.0	keep	9_6_in_4	Parallel run loop
auto	6.964000014504972	0.0	keep	15_6_in_4	Parallel run loop
auto	9.310827711934628	0.0	keep	29_4_in_3	Parallel run loop
auto	7.626450925723101	0.0	keep	20_4_in_3	Parallel run loop
auto	7.465594074136727	0.0	keep	18_4_in_3	Parallel run loop
auto	3.729640593560089	0.0	keep	11_3_in_3	Parallel run loop
auto	9.541643379937524	0.0	keep	30_4_in_3	Parallel run loop
auto	7.321045141554854	0.0	keep	16_6_in_4	Parallel run loop
auto	8.661852189412814	0.0	keep	23_6_in_4	Parallel run loop
auto	2.6298733853627354	0.0	keep	11_3_in_4	Parallel run loop
auto	9.083749787439356	0.0	keep	25_6_in_4	Parallel run loop
auto	8.620168250920733	0.0	keep	25_4_in_3	Parallel run loop
auto	5.46460145615038	0.0	keep	10_4_in_3	Parallel run loop
auto	3.881099749755177	0.0	keep	12_3_in_3	Parallel run loop
auto	8.591953675831972	0.0	keep	24_4_in_3	Parallel run loop
auto	6.467078494287158	0.0	keep	14_4_in_3	Parallel run loop
auto	9.255840516534487	0.0	keep	26_6_in_4	Parallel run loop
auto	7.606741618201064	0.0	keep	17_6_in_4	Parallel run loop
auto	2.184012389940221	0.0	keep	11_3_in_5	Parallel run loop
auto	1.7415210527927882	0.0	keep	7_3_in_5	Parallel run loop
auto	8.812109068402295	0.0	keep	24_6_in_4	Parallel run loop
auto	2.464510295907062	0.0	keep	14_3_in_5	Parallel run loop
auto	2.374406362007358	0.0	keep	13_3_in_5	Parallel run loop
auto	6.464800161899369	0.0	discard	13_4_in_3	Parallel run loop
auto	2.095052900818078	0.0	keep	7_3_in_4	Parallel run loop
auto	1.3168226749548522	0.0	keep	4_3_in_5	Parallel run loop
auto	2.082961462235238	0.0	keep	10_3_in_5	Parallel run loop
auto	2.377142364865082	0.0	keep	9_3_in_4	Parallel run loop
auto	3.0756382885430744	0.0	keep	15_3_in_4	Parallel run loop
auto	2.5058708098095974	0.0	keep	10_3_in_4	Parallel run loop
auto	1.5837110595400408	0.0	discard	4_3_in_4	Parallel run loop
auto	2.627063518387486	0.0	keep	11_3_in_4	Parallel run loop
auto	1.9746278835054172	0.0	keep	9_3_in_5	Parallel run loop
auto	1.9403160823204826	0.0	keep	6_3_in_4	Parallel run loop
auto	8.469703524678517	0.0	keep	23_4_in_3	Parallel run loop
auto	8.43048885754377	0.0	discard	21_6_in_4	Parallel run loop
auto	8.774947412252958	0.0	keep	26_4_in_3	Parallel run loop
auto	7.387955541169579	0.0	keep	18_4_in_3	Parallel run loop
auto	2.240492604517753	0.0	discard	8_3_in_4	Parallel run loop
auto	3.731855633710615	0.0	discard	11_3_in_3	Parallel run loop
auto	2.7441016751651715	0.0	keep	12_3_in_4	Parallel run loop
auto	7.730063257741899	0.0	keep	18_6_in_4	Parallel run loop
auto	9.492725968698753	0.0	keep	27_6_in_4	Parallel run loop
auto	9.31330480896625	0.0	discard	29_4_in_3	Parallel run loop
auto	4.000031403723894	0.0	keep	13_3_in_3	Parallel run loop
auto	3.1825511289968693	0.0	keep	16_3_in_4	Parallel run loop
auto	9.778001675551085	0.0	keep	33_4_in_3	Parallel run loop
auto	3.5000315615295814	0.0	keep	10_3_in_3	Parallel run loop
auto	9.399512651983235	0.0	keep	30_4_in_3	Parallel run loop
auto	1.4722107410112513	0.0	keep	5_3_in_5	Parallel run loop
auto	2.9700707477962434	0.0	keep	14_3_in_4	Parallel run loop
auto	9.118021638826727	0.0	discard	25_6_in_4	Parallel run loop
auto	8.007004166810876	0.0	keep	20_6_in_4	Parallel run loop
auto	9.749653181334807	0.0	keep	32_4_in_3	Parallel run loop
auto	8.620168250920733	0.0	discard	25_4_in_3	Parallel run loop
auto	1.7415210279474596	0.0	keep	7_3_in_5	Parallel run loop
auto	3.2946279876108426	0.0	keep	17_3_in_4	Parallel run loop
auto	2.1840418155567236	0.0	discard	11_3_in_5	Parallel run loop
auto	2.3758528333735964	0.0	discard	13_3_in_5	Parallel run loop
auto	10.260221039654585	0.0	keep	37_4_in_3	Parallel run loop
auto	8.591953675831972	0.0	discard	24_4_in_3	Parallel run loop
auto	9.617379286828163	0.0	keep	31_4_in_3	Parallel run loop
auto	9.255840516534487	0.0	discard	26_6_in_4	Parallel run loop
auto	2.0820842883643	0.0	keep	10_3_in_5	Parallel run loop
auto	10.549071817935308	0.0	keep	38_4_in_3	Parallel run loop
auto	6.4650137242969805	0.0	discard	13_4_in_3	Parallel run loop
auto	2.4692645311271075	0.0	discard	14_3_in_5	Parallel run loop
auto	2.3762137055500516	0.0	keep	9_3_in_4	Parallel run loop
auto	2.0950533698910805	0.0	discard	7_3_in_4	Parallel run loop
