commit	score	memory_gb	status	problem	description
auto	10.08577996978017	0.0	discard	36_4_in_3	Parallel run loop
auto	8.668469913995917	0.0	discard	23_6_in_4	Parallel run loop
auto	6.105892815049579	0.0	discard	10_6_in_4	Parallel run loop
auto	5.309910838673369	0.0	discard	9_4_in_3	Parallel run loop
auto	10.599771163337323	0.0	discard	39_4_in_3	Parallel run loop
auto	8.627146868055858	0.0	discard	25_4_in_3	Parallel run loop
auto	5.309558418357594	0.0	discard	8_4_in_3	Parallel run loop
auto	7.320688416480677	0.0	discard	16_6_in_4	Parallel run loop
auto	7.387785192386595	0.0	discard	18_4_in_3	Parallel run loop
auto	6.466356312686539	0.0	discard	13_4_in_3	Parallel run loop
auto	9.764047421699717	0.0	discard	32_4_in_3	Parallel run loop
auto	8.591953675831972	0.0	discard	24_4_in_3	Parallel run loop
auto	9.513940573292547	0.0	discard	27_6_in_4	Parallel run loop
auto	8.787911269234767	0.0	discard	27_4_in_3	Parallel run loop
auto	9.472120229746906	0.0	discard	31_4_in_3	Parallel run loop
auto	8.169777396534393	0.0	discard	22_4_in_3	Parallel run loop
auto	6.310183212243213	0.0	discard	12_4_in_3	Parallel run loop
auto	4.309418543637569	0.0	discard	5_4_in_3	Parallel run loop
auto	5.518421711656798	0.0	discard	9_6_in_4	Parallel run loop
auto	9.97856733021505	0.0	discard	34_4_in_3	Parallel run loop
auto	5.154752352831598	0.0	discard	7_4_in_3	Parallel run loop
auto	10.260221039654585	0.0	discard	37_4_in_3	Parallel run loop
auto	3.7250031912651163	0.0	discard	4_6_in_4	Parallel run loop
auto	9.241141600630085	0.0	discard	29_4_in_3	Parallel run loop
auto	10.776309862715156	0.0	discard	40_4_in_3	Parallel run loop
auto	10.947326139296766	0.0	discard	42_4_in_3	Parallel run loop
auto	9.31544946515176	0.0	keep	30_4_in_3	Parallel run loop
auto	10.940553511555468	0.0	discard	41_4_in_3	Parallel run loop
auto	3.491959014509597	0.0	discard	3_6_in_4	Parallel run loop
auto	10.08463795876588	0.0	discard	35_4_in_3	Parallel run loop
auto	10.938599347826347	0.0	discard	43_4_in_3	Parallel run loop
auto	4.438079146634743	0.0	discard	5_6_in_4	Parallel run loop
auto	10.089613446336648	0.0	discard	36_4_in_3	Parallel run loop
auto	10.549071817935308	0.0	discard	38_4_in_3	Parallel run loop
auto	10.629301108045512	0.0	discard	39_4_in_3	Parallel run loop
auto	8.778031375178879	0.0	discard	28_4_in_3	Parallel run loop
auto	6.155277173792816	0.0	discard	11_4_in_3	Parallel run loop
auto	5.309456355946519	0.0	discard	8_4_in_3	Parallel run loop
auto	7.321778962739246	0.0	discard	16_6_in_4	Parallel run loop
auto	8.627146868055858	0.0	discard	25_4_in_3	Parallel run loop
auto	7.387785192386595	0.0	discard	18_4_in_3	Parallel run loop
auto	7.15750196563385	0.0	discard	16_4_in_3	Parallel run loop
auto	8.522156032410958	0.0	discard	24_4_in_3	Parallel run loop
auto	9.779861028333272	0.0	discard	32_4_in_3	Parallel run loop
auto	9.510755639083786	0.0	discard	27_6_in_4	Parallel run loop
auto	9.472120229746906	0.0	discard	31_4_in_3	Parallel run loop
auto	6.339849586688972	0.0	discard	11_6_in_4	Parallel run loop
auto	8.778728171903877	0.0	discard	27_4_in_3	Parallel run loop
auto	3.2320607503195915	0.0	discard	3_4_in_3	Parallel run loop
auto	6.309719735191199	0.0	discard	12_4_in_3	Parallel run loop
auto	6.465828989260902	0.0	discard	14_4_in_3	Parallel run loop
auto	5.1555613069564314	0.0	discard	7_4_in_3	Parallel run loop
auto	5.464261083124018	0.0	discard	10_4_in_3	Parallel run loop
auto	9.93560557688718	0.0	discard	34_4_in_3	Parallel run loop
auto	6.964063388869967	0.0	discard	15_6_in_4	Parallel run loop
auto	9.255840516534487	0.0	discard	26_6_in_4	Parallel run loop
auto	11.07710167451943	0.0	discard	42_4_in_3	Parallel run loop
auto	9.469339623961535	0.0	discard	30_4_in_3	Parallel run loop
auto	10.776309862715156	0.0	discard	40_4_in_3	Parallel run loop
auto	3.491959014509597	0.0	discard	3_6_in_4	Parallel run loop
auto	10.940553511555468	0.0	discard	41_4_in_3	Parallel run loop
auto	10.044741357915102	0.0	discard	35_4_in_3	Parallel run loop
auto	11.01851023958955	0.0	discard	43_4_in_3	Parallel run loop
auto	4.437844418212015	0.0	discard	5_6_in_4	Parallel run loop
auto	10.114070725303288	0.0	discard	36_4_in_3	Parallel run loop
auto	4.154750717508222	0.0	discard	4_4_in_3	Parallel run loop
auto	10.599771163337323	0.0	discard	39_4_in_3	Parallel run loop
auto	7.621978133043869	0.0	discard	20_4_in_3	Parallel run loop
auto	6.155482912776057	0.0	discard	11_4_in_3	Parallel run loop
auto	8.796684966115714	0.0	discard	24_6_in_4	Parallel run loop
auto	7.464193496093027	0.0	discard	18_4_in_3	Parallel run loop
auto	4.3094996669154355	0.0	discard	6_4_in_3	Parallel run loop
auto	8.563014759510843	0.0	discard	25_4_in_3	Parallel run loop
auto	7.309824033492363	0.0	discard	17_4_in_3	Parallel run loop
auto	9.748219324694178	0.0	discard	32_4_in_3	Parallel run loop
auto	8.465628025883607	0.0	discard	24_4_in_3	Parallel run loop
auto	9.474361225301514	0.0	discard	27_6_in_4	Parallel run loop
auto	9.635390066119172	0.0	discard	31_4_in_3	Parallel run loop
auto	8.853422291130135	0.0	discard	27_4_in_3	Parallel run loop
auto	6.104982492730227	0.0	discard	10_6_in_4	Parallel run loop
auto	8.662041094421634	0.0	discard	23_6_in_4	Parallel run loop
auto	3.232052318453766	0.0	discard	3_4_in_3	Parallel run loop
auto	8.665248578220082	0.0	discard	26_4_in_3	Parallel run loop
auto	5.309910838673369	0.0	discard	9_4_in_3	Parallel run loop
auto	5.518421711656798	0.0	discard	9_6_in_4	Parallel run loop
auto	10.24640052316183	0.0	discard	37_4_in_3	Parallel run loop
auto	8.595654912679807	0.0	discard	22_6_in_4	Parallel run loop
auto	9.859456383527776	0.0	discard	34_4_in_3	Parallel run loop
auto	10.795436940955522	0.0	discard	40_4_in_3	Parallel run loop
auto	10.92685747137244	0.0	discard	42_4_in_3	Parallel run loop
auto	9.541643379937524	0.0	discard	30_4_in_3	Parallel run loop
auto	10.906163496715966	0.0	discard	41_4_in_3	Parallel run loop
auto	3.7250031912651163	0.0	discard	4_6_in_4	Parallel run loop
auto	11.01851023958955	0.0	discard	43_4_in_3	Parallel run loop
auto	9.965257733014607	0.0	discard	35_4_in_3	Parallel run loop
auto	10.090848203208573	0.0	discard	36_4_in_3	Parallel run loop
auto	4.438123057858091	0.0	discard	5_6_in_4	Parallel run loop
auto	10.599771163337323	0.0	discard	39_4_in_3	Parallel run loop
auto	9.170480985456972	0.0	discard	29_4_in_3	Parallel run loop
auto	7.6232880299409125	0.0	discard	20_4_in_3	Parallel run loop
auto	6.1565716198033105	0.0	discard	11_4_in_3	Parallel run loop
auto	8.802712457436023	0.0	discard	24_6_in_4	Parallel run loop
auto	6.759508156569627	0.0	discard	13_6_in_4	Parallel run loop
auto	7.387785192386595	0.0	discard	18_4_in_3	Parallel run loop
auto	8.778031375178879	0.0	discard	28_4_in_3	Parallel run loop
auto	8.627146868055858	0.0	discard	25_4_in_3	Parallel run loop
auto	9.764047421699717	0.0	discard	32_4_in_3	Parallel run loop
auto	9.472867934776529	0.0	discard	27_6_in_4	Parallel run loop
auto	9.48566769368882	0.0	discard	31_4_in_3	Parallel run loop
auto	8.465628025883607	0.0	discard	24_4_in_3	Parallel run loop
auto	6.1061179029979	0.0	discard	10_6_in_4	Parallel run loop
auto	8.703975468913475	0.0	discard	23_6_in_4	Parallel run loop
auto	8.777271024521832	0.0	discard	27_4_in_3	Parallel run loop
auto	3.232066114699316	0.0	discard	3_4_in_3	Parallel run loop
auto	5.309910838673369	0.0	discard	9_4_in_3	Parallel run loop
auto	5.518421711656798	0.0	discard	9_6_in_4	Parallel run loop
auto	10.260221039654585	0.0	discard	37_4_in_3	Parallel run loop
auto	7.15750196563385	0.0	discard	16_4_in_3	Parallel run loop
auto	10.776309862715156	0.0	discard	40_4_in_3	Parallel run loop
auto	8.76508594090868	0.0	discard	26_4_in_3	Parallel run loop
auto	9.931246793297	0.0	discard	34_4_in_3	Parallel run loop
auto	10.951287000341134	0.0	discard	42_4_in_3	Parallel run loop
auto	6.33822102492758	0.0	discard	11_6_in_4	Parallel run loop
auto	10.087378355933945	0.0	discard	36_4_in_3	Parallel run loop
auto	10.99787383052886	0.0	discard	41_4_in_3	Parallel run loop
auto	11.01851023958955	0.0	discard	43_4_in_3	Parallel run loop
auto	9.947912163569963	0.0	discard	35_4_in_3	Parallel run loop
auto	3.7250031912651163	0.0	discard	4_6_in_4	Parallel run loop
auto	4.438079146634743	0.0	discard	5_6_in_4	Parallel run loop
auto	4.814211891248772	0.0	discard	6_6_in_4	Parallel run loop
auto	10.599771163337323	0.0	discard	39_4_in_3	Parallel run loop
auto	5.464261083124018	0.0	discard	10_4_in_3	Parallel run loop
auto	6.964000014504972	0.0	discard	15_6_in_4	Parallel run loop
auto	6.4642062051880504	0.0	discard	14_4_in_3	Parallel run loop
auto	6.764428342593895	0.0	discard	13_6_in_4	Parallel run loop
auto	7.387955541169579	0.0	discard	18_4_in_3	Parallel run loop
auto	8.627146868055858	0.0	discard	25_4_in_3	Parallel run loop
auto	7.606741618201064	0.0	discard	17_6_in_4	Parallel run loop
auto	9.504892211207693	0.0	discard	27_6_in_4	Parallel run loop
auto	9.76927574261506	0.0	discard	32_4_in_3	Parallel run loop
auto	9.472120229746906	0.0	discard	31_4_in_3	Parallel run loop
auto	8.591953675831972	0.0	discard	24_4_in_3	Parallel run loop
auto	6.465368393894356	0.0	discard	13_4_in_3	Parallel run loop
auto	6.394949499925404	0.0	discard	12_6_in_4	Parallel run loop
auto	4.154707933020685	0.0	discard	4_4_in_3	Parallel run loop
auto	5.309910838673369	0.0	discard	9_4_in_3	Parallel run loop
auto	8.1695937920627	0.0	discard	22_4_in_3	Parallel run loop
auto	8.828547359664359	0.0	discard	27_4_in_3	Parallel run loop
auto	9.29492544076272	0.0	discard	26_6_in_4	Parallel run loop
auto	7.742742602208797	0.0	discard	21_4_in_3	Parallel run loop
auto	10.776309862715156	0.0	discard	40_4_in_3	Parallel run loop
auto	9.97856733021505	0.0	discard	34_4_in_3	Parallel run loop
auto	8.774947412252958	0.0	discard	26_4_in_3	Parallel run loop
auto	7.929378074021842	0.0	discard	19_6_in_4	Parallel run loop
auto	11.033915133390982	0.0	discard	42_4_in_3	Parallel run loop
auto	10.12146122489197	0.0	discard	36_4_in_3	Parallel run loop
auto	4.3094996669154355	0.0	discard	6_4_in_3	Parallel run loop
auto	10.95031226862635	0.0	discard	41_4_in_3	Parallel run loop
auto	7.315643541926898	0.0	discard	17_4_in_3	Parallel run loop
auto	11.01851023958955	0.0	discard	43_4_in_3	Parallel run loop
auto	10.097190031594906	0.0	discard	35_4_in_3	Parallel run loop
auto	4.4389418771467595	0.0	discard	5_6_in_4	Parallel run loop
auto	10.63535180366191	0.0	discard	39_4_in_3	Parallel run loop
auto	6.964000014504972	0.0	discard	15_6_in_4	Parallel run loop
auto	10.39164287236779	0.0	discard	38_4_in_3	Parallel run loop
auto	5.309456355946519	0.0	discard	8_4_in_3	Parallel run loop
auto	7.471317325000314	0.0	discard	19_4_in_3	Parallel run loop
auto	7.387955541169579	0.0	discard	18_4_in_3	Parallel run loop
auto	9.513940573292547	0.0	discard	27_6_in_4	Parallel run loop
auto	9.743762411586093	0.0	discard	32_4_in_3	Parallel run loop
auto	7.605038036934168	0.0	keep	17_6_in_4	Parallel run loop
auto	8.556205176387037	0.0	discard	25_4_in_3	Parallel run loop
auto	8.568395832409651	0.0	discard	24_4_in_3	Parallel run loop
auto	7.321655420249306	0.0	discard	16_6_in_4	Parallel run loop
auto	9.597130699747467	0.0	discard	31_4_in_3	Parallel run loop
auto	6.309719735191199	0.0	discard	12_4_in_3	Parallel run loop
auto	8.793324245426204	0.0	discard	27_4_in_3	Parallel run loop
auto	5.155053785931084	0.0	discard	7_4_in_3	Parallel run loop
auto	8.162114037535801	0.0	discard	22_4_in_3	Parallel run loop
auto	8.583374246046413	0.0	discard	22_6_in_4	Parallel run loop
auto	3.491959014509597	0.0	discard	3_6_in_4	Parallel run loop
auto	10.776309862715156	0.0	discard	40_4_in_3	Parallel run loop
auto	9.163796204927412	0.0	discard	29_4_in_3	Parallel run loop
auto	7.929378074021842	0.0	discard	19_6_in_4	Parallel run loop
auto	8.783346076547309	0.0	discard	28_4_in_3	Parallel run loop
auto	9.942756554192467	0.0	discard	34_4_in_3	Parallel run loop
auto	10.090848203208573	0.0	discard	36_4_in_3	Parallel run loop
auto	11.057079850967028	0.0	discard	42_4_in_3	Parallel run loop
auto	4.309409782028365	0.0	discard	5_4_in_3	Parallel run loop
auto	7.15750196563385	0.0	discard	16_4_in_3	Parallel run loop
auto	6.339849586688972	0.0	discard	11_6_in_4	Parallel run loop
auto	11.01851023958955	0.0	discard	43_4_in_3	Parallel run loop
auto	10.906163496715966	0.0	discard	41_4_in_3	Parallel run loop
auto	9.947912163569963	0.0	discard	35_4_in_3	Parallel run loop
auto	10.599771163337323	0.0	discard	39_4_in_3	Parallel run loop
auto	10.546284708358085	0.0	discard	38_4_in_3	Parallel run loop
auto	6.964063388869967	0.0	discard	15_6_in_4	Parallel run loop
auto	7.464754201119399	0.0	discard	18_4_in_3	Parallel run loop
auto	5.309456355946519	0.0	discard	8_4_in_3	Parallel run loop
auto	7.471317325000314	0.0	discard	19_4_in_3	Parallel run loop
auto	9.453859029064638	0.0	discard	27_6_in_4	Parallel run loop
auto	8.627146868055858	0.0	discard	25_4_in_3	Parallel run loop
auto	9.768048852798472	0.0	discard	32_4_in_3	Parallel run loop
auto	7.626602931549492	0.0	discard	17_6_in_4	Parallel run loop
auto	8.620972216247035	0.0	discard	24_4_in_3	Parallel run loop
auto	9.635390066119172	0.0	discard	31_4_in_3	Parallel run loop
auto	4.813853256562242	0.0	discard	6_6_in_4	Parallel run loop
auto	5.4648198148837395	0.0	discard	10_4_in_3	Parallel run loop
auto	8.169777396534393	0.0	discard	22_4_in_3	Parallel run loop
auto	8.77391027500456	0.0	discard	27_4_in_3	Parallel run loop
auto	6.465828989260902	0.0	discard	14_4_in_3	Parallel run loop
auto	8.626434343123188	0.0	discard	22_6_in_4	Parallel run loop
auto	6.388840407653808	0.0	discard	12_6_in_4	Parallel run loop
auto	8.778031375178879	0.0	discard	28_4_in_3	Parallel run loop
auto	9.170480985456972	0.0	discard	29_4_in_3	Parallel run loop
auto	10.776309862715156	0.0	discard	40_4_in_3	Parallel run loop
auto	6.389392912785975	0.0	discard	13_4_in_3	Parallel run loop
auto	9.859456383527776	0.0	discard	34_4_in_3	Parallel run loop
auto	11.057079850967028	0.0	discard	42_4_in_3	Parallel run loop
auto	4.30942692978523	0.0	discard	5_4_in_3	Parallel run loop
auto	10.907658739035652	0.0	discard	41_4_in_3	Parallel run loop
auto	10.091697833051867	0.0	discard	36_4_in_3	Parallel run loop
auto	9.255840516534487	0.0	discard	26_6_in_4	Parallel run loop
auto	4.154750717508222	0.0	discard	4_4_in_3	Parallel run loop
auto	11.01851023958955	0.0	discard	43_4_in_3	Parallel run loop
auto	10.560841650097062	0.0	discard	38_4_in_3	Parallel run loop
auto	7.629777982122117	0.0	discard	21_4_in_3	Parallel run loop
auto	10.586851353332005	0.0	discard	39_4_in_3	Parallel run loop
auto	10.087489862056094	0.0	discard	35_4_in_3	Parallel run loop
auto	7.387955541169579	0.0	discard	18_4_in_3	Parallel run loop
auto	7.6208696685191635	0.0	discard	20_4_in_3	Parallel run loop
auto	8.829708445580817	0.0	discard	24_6_in_4	Parallel run loop
auto	9.455403984086399	0.0	discard	27_6_in_4	Parallel run loop
auto	8.627146868055858	0.0	discard	25_4_in_3	Parallel run loop
auto	9.804395072432143	0.0	discard	32_4_in_3	Parallel run loop
auto	7.672544750072969	0.0	discard	17_6_in_4	Parallel run loop
auto	8.568395832409651	0.0	discard	24_4_in_3	Parallel run loop
auto	4.3094996669154355	0.0	discard	6_4_in_3	Parallel run loop
auto	7.309824033492363	0.0	discard	17_4_in_3	Parallel run loop
auto	9.472120229746906	0.0	discard	31_4_in_3	Parallel run loop
auto	8.78138974141751	0.0	discard	27_4_in_3	Parallel run loop
auto	8.68353387001922	0.0	discard	23_6_in_4	Parallel run loop
auto	6.105491953617294	0.0	discard	10_6_in_4	Parallel run loop
auto	5.518532244662861	0.0	discard	9_6_in_4	Parallel run loop
auto	7.320596602769465	0.0	discard	16_6_in_4	Parallel run loop
auto	6.309719735191199	0.0	discard	12_4_in_3	Parallel run loop
auto	9.162858936716923	0.0	discard	29_4_in_3	Parallel run loop
auto	9.931786194765044	0.0	discard	34_4_in_3	Parallel run loop
auto	10.776309862715156	0.0	discard	40_4_in_3	Parallel run loop
auto	6.465070897142405	0.0	discard	13_4_in_3	Parallel run loop
auto	10.947326139296766	0.0	discard	42_4_in_3	Parallel run loop
auto	5.155344374810373	0.0	discard	7_4_in_3	Parallel run loop
auto	10.090481997169428	0.0	discard	36_4_in_3	Parallel run loop
auto	10.935004358179606	0.0	discard	41_4_in_3	Parallel run loop
auto	11.01851023958955	0.0	discard	43_4_in_3	Parallel run loop
auto	10.260221039654585	0.0	discard	37_4_in_3	Parallel run loop
auto	3.7250031912651163	0.0	discard	4_6_in_4	Parallel run loop
auto	3.491959731325357	0.0	discard	3_6_in_4	Parallel run loop
auto	10.619926529082107	0.0	discard	39_4_in_3	Parallel run loop
auto	6.75734611947217	0.0	discard	13_6_in_4	Parallel run loop
auto	9.929544493780412	0.0	discard	35_4_in_3	Parallel run loop
auto	7.387955541169579	0.0	discard	18_4_in_3	Parallel run loop
auto	6.154772890366584	0.0	discard	11_4_in_3	Parallel run loop
auto	9.513940573292547	0.0	discard	27_6_in_4	Parallel run loop
auto	8.627146868055858	0.0	discard	25_4_in_3	Parallel run loop
auto	8.46460647756217	0.0	discard	23_4_in_3	Parallel run loop
auto	7.620768472631966	0.0	discard	20_4_in_3	Parallel run loop
auto	9.779166974127829	0.0	discard	32_4_in_3	Parallel run loop
auto	8.516252654347987	0.0	discard	24_4_in_3	Parallel run loop
auto	7.1567989308092335	0.0	discard	16_4_in_3	Parallel run loop
auto	9.472120229746906	0.0	discard	31_4_in_3	Parallel run loop
auto	6.339816417014669	0.0	discard	11_6_in_4	Parallel run loop
auto	8.664069756654692	0.0	discard	23_6_in_4	Parallel run loop
auto	4.814636736279653	0.0	discard	6_6_in_4	Parallel run loop
auto	8.865129767555105	0.0	discard	27_4_in_3	Parallel run loop
auto	5.464628679574047	0.0	discard	10_4_in_3	Parallel run loop
auto	9.170480985456972	0.0	discard	29_4_in_3	Parallel run loop
auto	7.321045141554854	0.0	discard	16_6_in_4	Parallel run loop
auto	3.2320607503195915	0.0	discard	3_4_in_3	Parallel run loop
auto	6.467317663817359	0.0	discard	14_4_in_3	Parallel run loop
auto	9.942756554192467	0.0	discard	34_4_in_3	Parallel run loop
auto	11.057079850967028	0.0	discard	42_4_in_3	Parallel run loop
auto	10.776309862715156	0.0	discard	40_4_in_3	Parallel run loop
auto	10.096814507517992	0.0	discard	36_4_in_3	Parallel run loop
auto	9.851848888201381	0.0	discard	33_4_in_3	Parallel run loop
auto	9.255840516534487	0.0	discard	26_6_in_4	Parallel run loop
auto	6.388840407653808	0.0	discard	12_6_in_4	Parallel run loop
auto	11.01851023958955	0.0	discard	43_4_in_3	Parallel run loop
auto	4.154750717508222	0.0	discard	4_4_in_3	Parallel run loop
auto	10.959045691770195	0.0	discard	41_4_in_3	Parallel run loop
auto	10.599771163337323	0.0	discard	39_4_in_3	Parallel run loop
auto	6.759508156569627	0.0	discard	13_6_in_4	Parallel run loop
auto	10.004519810681641	0.0	discard	35_4_in_3	Parallel run loop
auto	7.465594074136727	0.0	discard	18_4_in_3	Parallel run loop
auto	9.455403984086399	0.0	discard	27_6_in_4	Parallel run loop
auto	6.156893685363397	0.0	discard	11_4_in_3	Parallel run loop
auto	8.627146868055858	0.0	discard	25_4_in_3	Parallel run loop
auto	7.620768472631966	0.0	discard	20_4_in_3	Parallel run loop
auto	7.742742602208797	0.0	discard	21_4_in_3	Parallel run loop
auto	8.542534000129315	0.0	discard	24_4_in_3	Parallel run loop
auto	9.619043541412415	0.0	discard	31_4_in_3	Parallel run loop
auto	7.15750196563385	0.0	discard	16_4_in_3	Parallel run loop
auto	8.668469913995917	0.0	discard	23_6_in_4	Parallel run loop
auto	9.7852784482145	0.0	discard	32_4_in_3	Parallel run loop
auto	6.339849586688972	0.0	discard	11_6_in_4	Parallel run loop
auto	8.818089921110058	0.0	discard	24_6_in_4	Parallel run loop
auto	8.881154331031414	0.0	discard	27_4_in_3	Parallel run loop
auto	4.3094996669154355	0.0	discard	6_4_in_3	Parallel run loop
auto	6.105403409308023	0.0	discard	10_6_in_4	Parallel run loop
auto	5.309910838673369	0.0	discard	9_4_in_3	Parallel run loop
auto	7.929378074021842	0.0	discard	19_6_in_4	Parallel run loop
auto	7.309824033492363	0.0	discard	17_4_in_3	Parallel run loop
auto	11.103279346092311	0.0	discard	42_4_in_3	Parallel run loop
auto	9.859456383527776	0.0	discard	34_4_in_3	Parallel run loop
auto	5.309456355946519	0.0	discard	8_4_in_3	Parallel run loop
auto	10.776309862715156	0.0	discard	40_4_in_3	Parallel run loop
auto	10.03779641185119	0.0	discard	36_4_in_3	Parallel run loop
auto	5.518247053083823	0.0	discard	9_6_in_4	Parallel run loop
auto	7.471317325000314	0.0	discard	19_4_in_3	Parallel run loop
auto	8.774947412252958	0.0	discard	26_4_in_3	Parallel run loop
auto	11.01851023958955	0.0	discard	43_4_in_3	Parallel run loop
auto	6.309719735191199	0.0	discard	12_4_in_3	Parallel run loop
auto	10.981271781615474	0.0	discard	41_4_in_3	Parallel run loop
auto	10.599771163337323	0.0	discard	39_4_in_3	Parallel run loop
auto	10.096523067651853	0.0	discard	35_4_in_3	Parallel run loop
auto	7.387955541169579	0.0	discard	18_4_in_3	Parallel run loop
auto	5.1555613069564314	0.0	discard	7_4_in_3	Parallel run loop
auto	9.44462203203615	0.0	discard	27_6_in_4	Parallel run loop
auto	7.620768472631966	0.0	discard	20_4_in_3	Parallel run loop
auto	9.546959978980627	0.0	discard	31_4_in_3	Parallel run loop
auto	8.465628025883607	0.0	discard	24_4_in_3	Parallel run loop
auto	8.627146868055858	0.0	discard	25_4_in_3	Parallel run loop
auto	8.598138544870572	0.0	discard	22_6_in_4	Parallel run loop
auto	10.333678373040929	0.0	discard	37_4_in_3	Parallel run loop
auto	9.725566438207675	0.0	discard	32_4_in_3	Parallel run loop
auto	6.1061179029979	0.0	discard	10_6_in_4	Parallel run loop
auto	8.793906030236618	0.0	discard	27_4_in_3	Parallel run loop
auto	8.472237346101952	0.0	discard	23_4_in_3	Parallel run loop
auto	3.491959014509597	0.0	discard	3_6_in_4	Parallel run loop
auto	3.7250031912651163	0.0	discard	4_6_in_4	Parallel run loop
auto	4.309409782028365	0.0	discard	5_4_in_3	Parallel run loop
auto	8.778031375178879	0.0	discard	28_4_in_3	Parallel run loop
auto	7.955182075495964	0.0	discard	20_6_in_4	Parallel run loop
auto	9.470231222643518	0.0	discard	30_4_in_3	Parallel run loop
auto	9.883661321007729	0.0	discard	34_4_in_3	Parallel run loop
auto	10.701388793332898	0.0	discard	40_4_in_3	Parallel run loop
auto	10.92685747137244	0.0	discard	42_4_in_3	Parallel run loop
auto	5.309456355946519	0.0	discard	8_4_in_3	Parallel run loop
