commit	score	memory_gb	status	problem	description
auto	3.5988025876044265	0.0	keep	15_DOMINO_in_CIRCLE	Parallel run loop
auto	3.7457394386958307	0.0	keep	16_DOMINO_in_CIRCLE	Parallel run loop
auto	3.876575066622783	0.0	keep	17_DOMINO_in_CIRCLE	Parallel run loop
auto	4.274608496897485	0.0	keep	20_DOMINO_in_CIRCLE	Parallel run loop
auto	4.013609631837386	0.0	keep	18_DOMINO_in_CIRCLE	Parallel run loop
auto	5.024206465002949	0.0	discard	20_DOMINO_in_DOMINO	Parallel run loop
auto	4.927450999448023	0.0	discard	19_DOMINO_in_DOMINO	Parallel run loop
auto	2.1805188668511373	0.0	discard	5_DOMINO_in_CIRCLE	Parallel run loop
auto	2.6915521371235593	0.0	discard	8_DOMINO_in_CIRCLE	Parallel run loop
auto	3.1860393694450497	0.0	discard	11_DOMINO_in_CIRCLE	Parallel run loop
auto	2.9559621946049712	0.0	discard	10_DOMINO_in_CIRCLE	Parallel run loop
auto	2.803879883664299	0.0	discard	9_DOMINO_in_CIRCLE	Parallel run loop
auto	3.827281560659983	0.0	discard	11_DOMINO_in_DOMINO	Parallel run loop
auto	3.2342712519580337	0.0	discard	12_DOMINO_in_CIRCLE	Parallel run loop
auto	3.280698901053327	0.0	keep	13_DOMINO_in_CIRCLE	Parallel run loop
auto	3.3964847243315117	0.0	keep	14_DOMINO_in_CIRCLE	Parallel run loop
auto	4.310535475664031	0.0	discard	19_DOMINO_in_CIRCLE	Parallel run loop
auto	3.9186103619302903	0.0	keep	12_DOMINO_in_DOMINO	Parallel run loop
auto	3.73664239521	0.0	keep	16_DOMINO_in_CIRCLE	Parallel run loop
auto	3.5192591066780743	0.0	keep	15_DOMINO_in_CIRCLE	Parallel run loop
auto	4.183420994860509	0.0	keep	20_DOMINO_in_CIRCLE	Parallel run loop
auto	3.821932870419384	0.0	keep	18_DOMINO_in_CIRCLE	Parallel run loop
auto	3.835858610551346	0.0	keep	17_DOMINO_in_CIRCLE	Parallel run loop
auto	5.024206465002949	0.0	discard	20_DOMINO_in_DOMINO	Parallel run loop
auto	4.927450999448023	0.0	discard	19_DOMINO_in_DOMINO	Parallel run loop
auto	2.613948188790195	0.0	discard	7_DOMINO_in_CIRCLE	Parallel run loop
auto	2.6915521371235593	0.0	discard	8_DOMINO_in_CIRCLE	Parallel run loop
auto	3.1860393694450497	0.0	discard	11_DOMINO_in_CIRCLE	Parallel run loop
auto	2.9559621946049712	0.0	discard	10_DOMINO_in_CIRCLE	Parallel run loop
auto	2.803879883664299	0.0	discard	9_DOMINO_in_CIRCLE	Parallel run loop
auto	2.9269635902496747	0.0	discard	6_DOMINO_in_DOMINO	Parallel run loop
auto	3.827281560659983	0.0	discard	11_DOMINO_in_DOMINO	Parallel run loop
auto	3.2342712519580337	0.0	discard	12_DOMINO_in_CIRCLE	Parallel run loop
auto	3.378680551095493	0.0	keep	14_DOMINO_in_CIRCLE	Parallel run loop
auto	4.310535475664031	0.0	discard	19_DOMINO_in_CIRCLE	Parallel run loop
auto	2.1805188668511373	0.0	discard	5_DOMINO_in_CIRCLE	Parallel run loop
auto	3.739025311560138	0.0	discard	16_DOMINO_in_CIRCLE	Parallel run loop
auto	3.499597863495746	0.0	keep	15_DOMINO_in_CIRCLE	Parallel run loop
auto	4.026627722586935	0.0	keep	20_DOMINO_in_CIRCLE	Parallel run loop
auto	3.8101385993895716	0.0	keep	18_DOMINO_in_CIRCLE	Parallel run loop
auto	3.7434011620441074	0.0	keep	17_DOMINO_in_CIRCLE	Parallel run loop
auto	5.024206465002949	0.0	discard	20_DOMINO_in_DOMINO	Parallel run loop
auto	4.85879491220779	0.0	keep	19_DOMINO_in_DOMINO	Parallel run loop
auto	3.3195455222733887	0.0	discard	13_DOMINO_in_CIRCLE	Parallel run loop
auto	2.6915521371235593	0.0	discard	8_DOMINO_in_CIRCLE	Parallel run loop
auto	3.1860393694450497	0.0	discard	11_DOMINO_in_CIRCLE	Parallel run loop
auto	2.9559621946049712	0.0	discard	10_DOMINO_in_CIRCLE	Parallel run loop
auto	2.803879883664299	0.0	discard	9_DOMINO_in_CIRCLE	Parallel run loop
auto	3.935981746673115	0.0	discard	12_DOMINO_in_DOMINO	Parallel run loop
auto	3.827281560659983	0.0	discard	11_DOMINO_in_DOMINO	Parallel run loop
auto	3.2342712519580337	0.0	discard	12_DOMINO_in_CIRCLE	Parallel run loop
auto	2.613948188790195	0.0	discard	7_DOMINO_in_CIRCLE	Parallel run loop
auto	2.1805188668511373	0.0	discard	5_DOMINO_in_CIRCLE	Parallel run loop
auto	4.310535475664031	0.0	discard	19_DOMINO_in_CIRCLE	Parallel run loop
auto	3.739025311560138	0.0	discard	16_DOMINO_in_CIRCLE	Parallel run loop
auto	3.486075687397012	0.0	keep	15_DOMINO_in_CIRCLE	Parallel run loop
auto	4.079966591040986	0.0	discard	20_DOMINO_in_CIRCLE	Parallel run loop
auto	3.80103773291976	0.0	keep	18_DOMINO_in_CIRCLE	Parallel run loop
auto	3.723559109671062	0.0	keep	17_DOMINO_in_CIRCLE	Parallel run loop
auto	5.024206465002949	0.0	discard	20_DOMINO_in_DOMINO	Parallel run loop
auto	4.882630265799585	0.0	discard	19_DOMINO_in_DOMINO	Parallel run loop
auto	2.9269635902496747	0.0	discard	6_DOMINO_in_DOMINO	Parallel run loop
auto	3.4223270717610794	0.0	discard	14_DOMINO_in_CIRCLE	Parallel run loop
auto	3.3195455222733887	0.0	discard	13_DOMINO_in_CIRCLE	Parallel run loop
auto	2.9559621946049712	0.0	discard	10_DOMINO_in_CIRCLE	Parallel run loop
auto	2.6915521371235593	0.0	discard	8_DOMINO_in_CIRCLE	Parallel run loop
auto	3.935981746673115	0.0	discard	12_DOMINO_in_DOMINO	Parallel run loop
auto	3.1860393694450497	0.0	discard	11_DOMINO_in_CIRCLE	Parallel run loop
auto	3.2342712519580337	0.0	discard	12_DOMINO_in_CIRCLE	Parallel run loop
auto	2.613948188790195	0.0	discard	7_DOMINO_in_CIRCLE	Parallel run loop
auto	2.1805188668511373	0.0	discard	5_DOMINO_in_CIRCLE	Parallel run loop
auto	4.310535475664031	0.0	discard	19_DOMINO_in_CIRCLE	Parallel run loop
auto	3.739025311560138	0.0	discard	16_DOMINO_in_CIRCLE	Parallel run loop
auto	3.532369992899478	0.0	discard	15_DOMINO_in_CIRCLE	Parallel run loop
auto	4.079966591040986	0.0	discard	20_DOMINO_in_CIRCLE	Parallel run loop
auto	3.793808421740319	0.0	keep	18_DOMINO_in_CIRCLE	Parallel run loop
auto	3.7097204024591224	0.0	keep	17_DOMINO_in_CIRCLE	Parallel run loop
auto	2.803879883664299	0.0	discard	9_DOMINO_in_CIRCLE	Parallel run loop
auto	4.882630265799585	0.0	discard	19_DOMINO_in_DOMINO	Parallel run loop
auto	2.9269635902496747	0.0	discard	6_DOMINO_in_DOMINO	Parallel run loop
auto	3.4223270717610794	0.0	discard	14_DOMINO_in_CIRCLE	Parallel run loop
auto	3.3195455222733887	0.0	discard	13_DOMINO_in_CIRCLE	Parallel run loop
auto	3.827281560659983	0.0	discard	11_DOMINO_in_DOMINO	Parallel run loop
auto	5.024206465002949	0.0	discard	20_DOMINO_in_DOMINO	Parallel run loop
auto	3.935981746673115	0.0	discard	12_DOMINO_in_DOMINO	Parallel run loop
auto	2.6915521371235593	0.0	discard	8_DOMINO_in_CIRCLE	Parallel run loop
auto	3.1860393694450497	0.0	discard	11_DOMINO_in_CIRCLE	Parallel run loop
auto	2.613948188790195	0.0	discard	7_DOMINO_in_CIRCLE	Parallel run loop
auto	2.9559621946049712	0.0	discard	10_DOMINO_in_CIRCLE	Parallel run loop
auto	3.2342712519580337	0.0	discard	12_DOMINO_in_CIRCLE	Parallel run loop
auto	3.739025311560138	0.0	discard	16_DOMINO_in_CIRCLE	Parallel run loop
auto	3.532369992899478	0.0	discard	15_DOMINO_in_CIRCLE	Parallel run loop
auto	4.079966591040986	0.0	discard	20_DOMINO_in_CIRCLE	Parallel run loop
auto	3.7879533377259293	0.0	keep	18_DOMINO_in_CIRCLE	Parallel run loop
auto	3.759141572791398	0.0	discard	17_DOMINO_in_CIRCLE	Parallel run loop
auto	2.803879883664299	0.0	discard	9_DOMINO_in_CIRCLE	Parallel run loop
auto	4.882630265799585	0.0	discard	19_DOMINO_in_DOMINO	Parallel run loop
auto	2.2448159807401584	0.0	keep	6_5_in_CIRCLE	Parallel run loop
auto	3.379748256163793	0.0	keep	5_8_in_CIRCLE	Parallel run loop
auto	3.2487893949776403	0.0	keep	5_6_in_DOMINO	Parallel run loop
auto	3.412190038465937	0.0	keep	6_6_in_DOMINO	Parallel run loop
auto	2.03272181014613	0.0	keep	5_5_in_CIRCLE	Parallel run loop
auto	2.4714099800125626	0.0	keep	5_6_in_CIRCLE	Parallel run loop
auto	1.617632919653511	0.0	keep	5_5_in_8	Parallel run loop
auto	2.9903520398567633	0.0	keep	6_8_in_8	Parallel run loop
auto	3.698004722007813	0.0	keep	6_8_in_CIRCLE	Parallel run loop
auto	2.2194979105731463	0.0	keep	5_5_in_6	Parallel run loop
auto	3.718683176646496	0.0	keep	5_8_in_6	Parallel run loop
auto	1.7800787738480903	0.0	keep	6_5_in_8	Parallel run loop
auto	4.287990287177315	0.0	keep	5_8_in_DOMINO	Parallel run loop
auto	2.7017279254073068	0.0	keep	9_5_in_CIRCLE	Parallel run loop
auto	3.301685183089424	0.0	keep	9_6_in_CIRCLE	Parallel run loop
auto	3.3350706296639823	0.0	keep	9_5_in_DOMINO	Parallel run loop
auto	3.4883456646766517	0.0	keep	10_6_in_CIRCLE	Parallel run loop
auto	4.9334906423517095	0.0	keep	9_8_in_6	Parallel run loop
auto	4.731911236779564	0.0	keep	10_8_in_CIRCLE	Parallel run loop
auto	2.810563744065405	0.0	keep	10_5_in_CIRCLE	Parallel run loop
auto	1.7165792692883637	0.0	keep	5_DOMINO_in_8	Parallel run loop
auto	4.461023448046407	0.0	keep	9_8_in_CIRCLE	Parallel run loop
auto	3.5209345875067064	0.0	keep	10_5_in_DOMINO	Parallel run loop
auto	2.4731698921611427	0.0	keep	5_5_in_DOMINO	Parallel run loop
auto	2.7071480467545586	0.0	keep	5_8_in_8	Parallel run loop
auto	4.060235788083775	0.0	keep	9_6_in_DOMINO	Parallel run loop
auto	4.505392888904952	0.0	keep	11_6_in_DOMINO	Parallel run loop
auto	4.882128715462701	0.0	keep	11_8_in_CIRCLE	Parallel run loop
auto	5.830393533977369	0.0	keep	10_8_in_DOMINO	Parallel run loop
auto	3.5902924577299857	0.0	keep	11_6_in_CIRCLE	Parallel run loop
auto	3.9328916733656962	0.0	keep	11_8_in_8	Parallel run loop
auto	2.919773978455972	0.0	keep	7_5_in_DOMINO	Parallel run loop
auto	2.481283560845094	0.0	keep	8_5_in_CIRCLE	Parallel run loop
auto	2.6922843278571964	0.0	keep	6_5_in_DOMINO	Parallel run loop
auto	4.508077960588995	0.0	keep	6_8_in_DOMINO	Parallel run loop
auto	4.566557709972744	0.0	keep	8_8_in_6	Parallel run loop
auto	2.901945782859286	0.0	keep	11_5_in_CIRCLE	Parallel run loop
auto	5.3482215930650865	0.0	keep	11_8_in_6	Parallel run loop
auto	3.9517550324284993	0.0	keep	6_8_in_6	Parallel run loop
auto	5.495387962874541	0.0	keep	9_8_in_DOMINO	Parallel run loop
auto	3.3353820579813593	0.0	keep	8_5_in_5	Parallel run loop
auto	2.719452216859648	0.0	keep	8_5_in_6	Parallel run loop
auto	2.3352348035452555	0.0	keep	11_5_in_8	Parallel run loop
auto	2.010963427499484	0.0	keep	7_DOMINO_in_8	Parallel run loop
auto	2.887323432188493	0.0	keep	6_6_in_6	Parallel run loop
auto	4.124712135933074	0.0	keep	8_8_in_CIRCLE	Parallel run loop
auto	3.0365949777867485	0.0	keep	12_5_in_CIRCLE	Parallel run loop
auto	2.8769663566878974	0.0	keep	9_5_in_6	Parallel run loop
auto	5.069344021054535	0.0	keep	10_8_in_6	Parallel run loop
auto	3.0778174087735874	0.0	keep	8_5_in_DOMINO	Parallel run loop
auto	2.2947270961973794	0.0	keep	7_5_in_CIRCLE	Parallel run loop
auto	3.6174320987557165	0.0	keep	11_5_in_DOMINO	Parallel run loop
auto	2.211504203545943	0.0	keep	10_5_in_8	Parallel run loop
auto	3.7073195460350816	0.0	keep	10_8_in_8	Parallel run loop
auto	6.315037330212945	0.0	keep	12_8_in_DOMINO	Parallel run loop
auto	3.162431841207716	0.0	keep	11_5_in_6	Parallel run loop
auto	4.8162564249882	0.0	keep	13_6_in_DOMINO	Parallel run loop
auto	2.095399706196413	0.0	keep	9_5_in_8	Parallel run loop
auto	5.236082792430488	0.0	keep	13_8_in_CIRCLE	Parallel run loop
auto	5.774076565572148	0.0	keep	13_8_in_6	Parallel run loop
auto	3.2584106401780235	0.0	keep	14_5_in_CIRCLE	Parallel run loop
auto	5.641124029788944	0.0	keep	15_8_in_CIRCLE	Parallel run loop
auto	4.617274529201505	0.0	keep	12_6_in_DOMINO	Parallel run loop
auto	6.031250214982396	0.0	keep	11_8_in_DOMINO	Parallel run loop
auto	3.748947107457924	0.0	keep	12_5_in_DOMINO	Parallel run loop
auto	3.8329225162157257	0.0	keep	13_6_in_CIRCLE	Parallel run loop
auto	3.342438976643318	0.0	keep	15_5_in_CIRCLE	Parallel run loop
auto	3.6846771964957084	0.0	keep	10_5_in_5	Parallel run loop
auto	2.8073311988083587	0.0	keep	5_DOMINO_in_5	Parallel run loop
auto	3.0786967395377114	0.0	keep	7_5_in_5	Parallel run loop
auto	5.002765039485882	0.0	keep	12_8_in_CIRCLE	Parallel run loop
auto	6.1485622123089225	0.0	keep	15_8_in_6	Parallel run loop
auto	3.4730840916600028	0.0	keep	16_5_in_CIRCLE	Parallel run loop
auto	1.9598964344390954	0.0	keep	8_5_in_8	Parallel run loop
auto	6.513821525314956	0.0	keep	13_8_in_DOMINO	Parallel run loop
auto	3.419076826649032	0.0	keep	13_5_in_6	Parallel run loop
auto	5.953764403418401	0.0	keep	17_8_in_CIRCLE	Parallel run loop
auto	2.682429903685507	0.0	keep	15_5_in_8	Parallel run loop
auto	2.9847604921286273	0.0	keep	8_6_in_CIRCLE	Parallel run loop
auto	2.5052538214555913	0.0	keep	13_5_in_8	Parallel run loop
auto	3.8849886045587247	0.0	keep	13_5_in_DOMINO	Parallel run loop
auto	4.082530506062867	0.0	keep	15_6_in_CIRCLE	Parallel run loop
auto	4.177190110394029	0.0	keep	10_6_in_DOMINO	Parallel run loop
auto	3.275348062204641	0.0	keep	8_8_in_8	Parallel run loop
auto	4.171770127680911	0.0	keep	13_8_in_8	Parallel run loop
auto	3.487224509587221	0.0	keep	7_6_in_DOMINO	Parallel run loop
auto	5.7444315016788705	0.0	keep	16_8_in_CIRCLE	Parallel run loop
auto	8.089722651511702	0.0	keep	20_8_in_DOMINO	Parallel run loop
auto	4.686584538793382	0.0	keep	19_5_in_DOMINO	Parallel run loop
auto	4.922616182091373	0.0	keep	12_6_in_5	Parallel run loop
auto	3.2099606383669643	0.0	keep	10_DOMINO_in_6	Parallel run loop
auto	4.8087657944433255	0.0	keep	20_5_in_DOMINO	Parallel run loop
auto	1.8234814096525724	0.0	keep	7_5_in_8	Parallel run loop
auto	4.000478709815032	0.0	keep	12_8_in_8	Parallel run loop
auto	6.971472962287854	0.0	keep	13_8_in_5	Parallel run loop
auto	4.558841191810819	0.0	keep	18_5_in_DOMINO	Parallel run loop
auto	8.224997212393477	0.0	keep	21_8_in_DOMINO	Parallel run loop
auto	4.795558251964339	0.0	keep	17_8_in_8	Parallel run loop
auto	4.324998296212249	0.0	keep	16_5_in_DOMINO	Parallel run loop
auto	3.0955502836327007	0.0	keep	13_5_in_CIRCLE	Parallel run loop
auto	3.6597459716757257	0.0	keep	15_5_in_6	Parallel run loop
auto	2.7652751633416526	0.0	keep	16_5_in_8	Parallel run loop
auto	6.07241321232294	0.0	keep	18_8_in_CIRCLE	Parallel run loop
auto	4.180934001627332	0.0	keep	21_5_in_CIRCLE	Parallel run loop
auto	4.124346091357558	0.0	keep	22_5_in_CIRCLE	Parallel run loop
auto	3.734049545824984	0.0	keep	18_5_in_CIRCLE	Parallel run loop
auto	5.294445349349041	0.0	keep	14_6_in_5	Parallel run loop
auto	5.10247936309483	0.0	keep	13_6_in_5	Parallel run loop
auto	3.3941922413751477	0.0	keep	11_DOMINO_in_6	Parallel run loop
auto	5.3428175757963245	0.0	keep	14_8_in_CIRCLE	Parallel run loop
auto	3.773377197225438	0.0	keep	7_8_in_CIRCLE	Parallel run loop
auto	4.512825325256429	0.0	keep	15_8_in_8	Parallel run loop
auto	3.449923892172803	0.0	keep	9_5_in_5	Parallel run loop
auto	3.613755111948211	0.0	keep	17_5_in_CIRCLE	Parallel run loop
auto	4.601023864233911	0.0	keep	16_8_in_8	Parallel run loop
auto	2.922192066431099	0.0	keep	12_6_in_8	Parallel run loop
auto	3.4991784765228644	0.0	keep	17_6_in_8	Parallel run loop
auto	2.8539527790543495	0.0	keep	8_DOMINO_in_6	Parallel run loop
auto	2.59067578179536	0.0	keep	14_5_in_8	Parallel run loop
auto	5.82153217927277	0.0	keep	17_6_in_5	Parallel run loop
auto	3.3719337995386294	0.0	keep	16_6_in_8	Parallel run loop
auto	3.9063957453843905	0.0	keep	20_5_in_CIRCLE	Parallel run loop
auto	6.371186505657623	0.0	keep	20_8_in_CIRCLE	Parallel run loop
auto	2.518904126416464	0.0	keep	11_DOMINO_in_8	Parallel run loop
auto	4.4575630764188245	0.0	keep	15_6_in_6	Parallel run loop
auto	7.24657571928384	0.0	keep	20_8_in_6	Parallel run loop
auto	4.477770126438488	0.0	keep	23_5_in_CIRCLE	Parallel run loop
auto	4.359896182763006	0.0	keep	17_6_in_CIRCLE	Parallel run loop
auto	7.7813071250623	0.0	keep	19_8_in_DOMINO	Parallel run loop
auto	4.892391081741039	0.0	keep	21_5_in_DOMINO	Parallel run loop
auto	4.897689037307793	0.0	keep	22_6_in_CIRCLE	Parallel run loop
auto	4.1194335210052015	0.0	keep	15_5_in_DOMINO	Parallel run loop
auto	3.973455287834672	0.0	keep	12_5_in_5	Parallel run loop
auto	7.919573634938392	0.0	keep	17_8_in_5	Parallel run loop
auto	4.398883096789043	0.0	keep	17_5_in_DOMINO	Parallel run loop
auto	3.505645804343286	0.0	keep	8_DOMINO_in_5	Parallel run loop
auto	3.7970696253421474	0.0	keep	11_5_in_5	Parallel run loop
auto	4.8609585679789085	0.0	keep	18_8_in_8	Parallel run loop
auto	3.690828347954162	0.0	keep	8_6_in_DOMINO	Parallel run loop
auto	3.606831478752314	0.0	keep	12_6_in_CIRCLE	Parallel run loop
auto	4.282012272184617	0.0	keep	14_8_in_8	Parallel run loop
auto	4.626525709133091	0.0	keep	21_DOMINO_in_6	Parallel run loop
auto	3.5786089818764615	0.0	keep	18_6_in_8	Parallel run loop
auto	8.368216513079963	0.0	keep	22_8_in_DOMINO	Parallel run loop
auto	8.1276807257948	0.0	keep	18_8_in_5	Parallel run loop
auto	4.993994528353886	0.0	keep	23_6_in_CIRCLE	Parallel run loop
auto	7.148109147766812	0.0	keep	16_8_in_DOMINO	Parallel run loop
auto	2.9118212710356306	0.0	keep	18_5_in_8	Parallel run loop
auto	5.618438003287637	0.0	keep	16_6_in_5	Parallel run loop
auto	3.135183895305146	0.0	keep	14_6_in_8	Parallel run loop
auto	8.344521944061078	0.0	keep	19_8_in_5	Parallel run loop
auto	7.16216041655297	0.0	keep	14_8_in_5	Parallel run loop
auto	2.8461201950035018	0.0	keep	17_5_in_8	Parallel run loop
auto	5.416192397326227	0.0	keep	22_8_in_8	Parallel run loop
auto	2.356882531014546	0.0	keep	10_DOMINO_in_8	Parallel run loop
auto	3.0474183386500915	0.0	keep	20_5_in_8	Parallel run loop
auto	5.373934822574327	0.0	keep	24_6_in_CIRCLE	Parallel run loop
auto	5.938576643416377	0.0	keep	25_6_in_CIRCLE	Parallel run loop
auto	2.936824124057404	0.0	keep	10_5_in_6	Parallel run loop
auto	4.269540072498029	0.0	keep	14_6_in_6	Parallel run loop
auto	5.389755950704758	0.0	keep	12_8_in_6	Parallel run loop
auto	3.2151294980423084	0.0	keep	12_5_in_6	Parallel run loop
auto	6.115072999999578	0.0	keep	19_6_in_5	Parallel run loop
auto	5.9487002378805585	0.0	keep	18_6_in_5	Parallel run loop
auto	8.549801055433676	0.0	keep	20_8_in_5	Parallel run loop
auto	3.8776925447610013	0.0	keep	14_6_in_CIRCLE	Parallel run loop
auto	3.227658897536068	0.0	keep	22_5_in_8	Parallel run loop
auto	3.1796227747715844	0.0	keep	21_5_in_8	Parallel run loop
auto	3.488203207993241	0.0	keep	12_DOMINO_in_6	Parallel run loop
auto	3.9403627992086934	0.0	keep	22_6_in_8	Parallel run loop
auto	6.227691973009203	0.0	keep	16_8_in_6	Parallel run loop
auto	2.2089998340522063	0.0	keep	9_DOMINO_in_8	Parallel run loop
auto	3.4886036938630687	0.0	keep	14_5_in_6	Parallel run loop
auto	3.7188271749523367	0.0	keep	19_5_in_CIRCLE	Parallel run loop
auto	5.86850558533507	0.0	keep	20_6_in_DOMINO	Parallel run loop
auto	4.13973978250304	0.0	keep	16_6_in_CIRCLE	Parallel run loop
auto	3.4148062243727244	0.0	keep	9_8_in_8	Parallel run loop
auto	3.941665481313825	0.0	keep	12_6_in_6	Parallel run loop
auto	3.2460583607575746	0.0	keep	7_DOMINO_in_5	Parallel run loop
auto	4.160721571466066	0.0	keep	20_5_in_6	Parallel run loop
auto	4.238069544518656	0.0	keep	24_5_in_CIRCLE	Parallel run loop
auto	5.414199746647559	0.0	keep	15_6_in_5	Parallel run loop
auto	5.681535284189753	0.0	keep	19_6_in_DOMINO	Parallel run loop
auto	4.855540231024056	0.0	keep	14_6_in_DOMINO	Parallel run loop
auto	4.628569206045577	0.0	keep	20_6_in_CIRCLE	Parallel run loop
auto	2.4699692625693257	0.0	keep	6_DOMINO_in_6	Parallel run loop
auto	4.348942375577296	0.0	keep	21_5_in_6	Parallel run loop
auto	6.261004867408969	0.0	keep	20_6_in_5	Parallel run loop
auto	3.7231156166834656	0.0	keep	16_5_in_6	Parallel run loop
auto	4.961270644326138	0.0	keep	19_5_in_5	Parallel run loop
auto	3.804814459859004	0.0	keep	20_6_in_8	Parallel run loop
auto	7.625542337307798	0.0	keep	16_8_in_5	Parallel run loop
auto	2.965576916380911	0.0	keep	19_5_in_8	Parallel run loop
auto	3.2715047858974993	0.0	keep	23_5_in_8	Parallel run loop
auto	6.432434497638354	0.0	keep	21_6_in_5	Parallel run loop
auto	6.186252197432229	0.0	keep	22_6_in_DOMINO	Parallel run loop
auto	5.199831833412223	0.0	keep	21_8_in_8	Parallel run loop
auto	3.0001643064096313	0.0	keep	7_8_in_8	Parallel run loop
auto	4.9647201723283265	0.0	keep	22_5_in_DOMINO	Parallel run loop
auto	7.367389066196936	0.0	keep	15_8_in_5	Parallel run loop
auto	5.266080780732194	0.0	keep	26_6_in_CIRCLE	Parallel run loop
auto	6.574622628785089	0.0	keep	22_6_in_5	Parallel run loop
auto	2.6318810635409817	0.0	keep	7_DOMINO_in_6	Parallel run loop
auto	5.5796258251695745	0.0	keep	24_8_in_8	Parallel run loop
auto	3.874301220309337	0.0	keep	21_6_in_8	Parallel run loop
auto	5.188990856898727	0.0	keep	20_8_in_8	Parallel run loop
auto	4.3371653383127	0.0	keep	22_5_in_6	Parallel run loop
auto	4.954185817862143	0.0	keep	19_8_in_8	Parallel run loop
auto	4.552766879922191	0.0	keep	16_6_in_6	Parallel run loop
auto	5.784092319753361	0.0	keep	14_8_in_6	Parallel run loop
auto	2.9891077837743882	0.0	keep	6_DOMINO_in_5	Parallel run loop
auto	3.9296416606382114	0.0	keep	14_5_in_DOMINO	Parallel run loop
auto	6.357487408141246	0.0	keep	17_8_in_6	Parallel run loop
auto	3.659944318377379	0.0	keep	9_DOMINO_in_5	Parallel run loop
auto	5.689543262957784	0.0	keep	25_8_in_8	Parallel run loop
auto	4.658740172832984	0.0	keep	17_5_in_5	Parallel run loop
auto	6.677739603652575	0.0	keep	23_6_in_5	Parallel run loop
auto	5.494770840388837	0.0	keep	23_8_in_8	Parallel run loop
auto	3.588096386916915	0.0	keep	28_5_in_8	Parallel run loop
auto	4.30053227802715	0.0	keep	27_5_in_8	Parallel run loop
auto	3.439292423320631	0.0	keep	25_5_in_8	Parallel run loop
auto	4.069465436487953	0.0	keep	13_5_in_5	Parallel run loop
auto	6.566717109350519	0.0	keep	14_8_in_DOMINO	Parallel run loop
auto	5.3874802778060635	0.0	keep	22_6_in_6	Parallel run loop
auto	4.464626554413507	0.0	keep	23_5_in_6	Parallel run loop
auto	3.884578760679903	0.0	keep	31_5_in_8	Parallel run loop
auto	6.243487487331579	0.0	keep	23_6_in_6	Parallel run loop
auto	3.4900227685889504	0.0	keep	26_5_in_8	Parallel run loop
auto	3.666913474248022	0.0	keep	29_5_in_8	Parallel run loop
auto	5.035279650543993	0.0	keep	20_5_in_5	Parallel run loop
auto	4.236503266712543	0.0	keep	14_5_in_5	Parallel run loop
auto	4.7777219266896935	0.0	keep	18_5_in_5	Parallel run loop
auto	5.768098124688649	0.0	keep	26_8_in_8	Parallel run loop
auto	7.053799985877653	0.0	keep	24_6_in_5	Parallel run loop
auto	4.624525476551327	0.0	keep	25_5_in_6	Parallel run loop
auto	5.251541540123586	0.0	keep	21_5_in_5	Parallel run loop
auto	3.0106704948079646	0.0	keep	15_DOMINO_in_8	Parallel run loop
auto	5.383664109897997	0.0	keep	28_5_in_6	Parallel run loop
auto	6.132658295072175	0.0	keep	25_6_in_6	Parallel run loop
