commit	score	memory_gb	status	problem	description
auto	3.821722232967094	0.0	discard	32_3_in_5	Parallel run loop
auto	2.858190745295924	0.0	discard	13_3_in_4	Parallel run loop
auto	4.864289719710617	0.0	discard	48_3_in_5	Parallel run loop
auto	5.521016455349248	0.0	discard	43_3_in_4	Parallel run loop
auto	3.956001090788924	0.0	discard	24_3_in_4	Parallel run loop
auto	2.986897671646315	0.0	discard	20_3_in_5	Parallel run loop
auto	3.060926058414585	0.0	discard	21_3_in_5	Parallel run loop
auto	3.141414449653932	0.0	discard	22_3_in_5	Parallel run loop
auto	1.9752460610423561	0.0	discard	9_3_in_5	Parallel run loop
auto	4.34733060947153	0.0	discard	40_3_in_5	Parallel run loop
auto	5.243520531777947	0.0	discard	40_3_in_4	Parallel run loop
auto	5.57171919188146	0.0	discard	44_3_in_4	Parallel run loop
auto	3.4841813600857168	0.0	discard	19_3_in_4	Parallel run loop
auto	4.900570555385496	0.0	discard	36_3_in_4	Parallel run loop
auto	2.6427885140991236	0.0	discard	16_3_in_5	Parallel run loop
auto	3.9997548101258547	0.0	discard	35_3_in_5	Parallel run loop
auto	3.8593598372144324	0.0	discard	23_3_in_4	Parallel run loop
auto	4.21401571905601	0.0	discard	38_3_in_5	Parallel run loop
auto	3.5545267390096074	0.0	discard	28_3_in_5	Parallel run loop
auto	3.748344727305788	0.0	discard	31_3_in_5	Parallel run loop
auto	3.6115070328724115	0.0	discard	29_3_in_5	Parallel run loop
auto	5.028950451929837	0.0	discard	38_3_in_4	Parallel run loop
auto	3.689631491337059	0.0	discard	30_3_in_5	Parallel run loop
auto	4.3818169420312	0.0	discard	41_3_in_5	Parallel run loop
auto	2.183822283255865	0.0	discard	11_3_in_5	Parallel run loop
auto	5.7613891312735666	0.0	discard	46_3_in_4	Parallel run loop
auto	4.671840926000884	0.0	discard	33_3_in_4	Parallel run loop
auto	4.473256872985274	0.0	discard	42_3_in_5	Parallel run loop
auto	2.818787571288079	0.0	discard	18_3_in_5	Parallel run loop
auto	3.7735967219062974	0.0	discard	22_3_in_4	Parallel run loop
auto	4.118656472543277	0.0	discard	26_3_in_4	Parallel run loop
auto	4.140860508585794	0.0	discard	37_3_in_5	Parallel run loop
auto	3.4920331889780556	0.0	discard	27_3_in_5	Parallel run loop
auto	1.9752372248805434	0.0	discard	9_3_in_5	Parallel run loop
auto	3.87506657764253	0.0	discard	33_3_in_5	Parallel run loop
auto	4.575131563158565	0.0	discard	43_3_in_5	Parallel run loop
auto	4.892466851092141	0.0	discard	48_3_in_5	Parallel run loop
auto	3.3577550945103565	0.0	discard	25_3_in_5	Parallel run loop
auto	4.5691724349090626	0.0	discard	44_3_in_5	Parallel run loop
auto	3.9447223664625923	0.0	discard	34_3_in_5	Parallel run loop
auto	4.826805841991402	0.0	discard	35_3_in_4	Parallel run loop
auto	4.848533125673035	0.0	discard	47_3_in_5	Parallel run loop
auto	1.74152080850717	0.0	discard	7_3_in_5	Parallel run loop
auto	3.2027990392413077	0.0	discard	23_3_in_5	Parallel run loop
auto	3.862710013997754	0.0	discard	23_3_in_4	Parallel run loop
auto	3.554075100767405	0.0	discard	28_3_in_5	Parallel run loop
auto	4.018340396051984	0.0	discard	35_3_in_5	Parallel run loop
auto	2.3751167411662975	0.0	discard	13_3_in_5	Parallel run loop
auto	3.41932754163419	0.0	discard	26_3_in_5	Parallel run loop
auto	4.5849390124393	0.0	discard	32_3_in_4	Parallel run loop
auto	2.082123526032778	0.0	discard	10_3_in_5	Parallel run loop
auto	4.181525058512315	0.0	discard	38_3_in_5	Parallel run loop
auto	3.6143078633076007	0.0	discard	29_3_in_5	Parallel run loop
auto	5.009774592434183	0.0	discard	38_3_in_4	Parallel run loop
auto	3.689105641415202	0.0	discard	30_3_in_5	Parallel run loop
auto	2.1838637003505297	0.0	discard	11_3_in_5	Parallel run loop
auto	4.028837670873109	0.0	discard	25_3_in_4	Parallel run loop
auto	2.2811123173053827	0.0	discard	12_3_in_5	Parallel run loop
auto	4.26086488961101	0.0	discard	39_3_in_5	Parallel run loop
auto	2.5568611965963517	0.0	discard	15_3_in_5	Parallel run loop
auto	4.424445508947184	0.0	discard	42_3_in_5	Parallel run loop
auto	2.46829373657482	0.0	discard	14_3_in_5	Parallel run loop
auto	1.6123349327110192	0.0	discard	6_3_in_5	Parallel run loop
auto	1.9752492848811318	0.0	discard	9_3_in_5	Parallel run loop
auto	1.4729295256209733	0.0	discard	5_3_in_5	Parallel run loop
auto	3.8801297349323876	0.0	discard	33_3_in_5	Parallel run loop
auto	3.801892351946052	0.0	discard	32_3_in_5	Parallel run loop
auto	4.087235607410304	0.0	discard	36_3_in_5	Parallel run loop
auto	2.375738022845646	0.0	discard	13_3_in_5	Parallel run loop
auto	2.082145378309763	0.0	discard	10_3_in_5	Parallel run loop
auto	4.982104680357112	0.0	discard	37_3_in_4	Parallel run loop
auto	4.181508381894919	0.0	discard	38_3_in_5	Parallel run loop
auto	1.7418955288056368	0.0	discard	7_3_in_5	Parallel run loop
auto	5.392683072966522	0.0	discard	43_3_in_4	Parallel run loop
auto	4.585764896024146	0.0	discard	32_3_in_4	Parallel run loop
auto	3.426831061104918	0.0	discard	26_3_in_5	Parallel run loop
auto	4.441287105031934	0.0	discard	30_3_in_4	Parallel run loop
auto	4.756042031063173	0.0	discard	34_3_in_4	Parallel run loop
auto	5.016470904425224	0.0	discard	49_3_in_5	Parallel run loop
auto	3.67624003388332	0.0	discard	21_3_in_4	Parallel run loop
auto	3.2765966815067378	0.0	discard	24_3_in_5	Parallel run loop
auto	3.582115939080227	0.0	discard	20_3_in_4	Parallel run loop
auto	5.748853997043414	0.0	discard	47_3_in_4	Parallel run loop
auto	3.128610377842075	0.0	discard	22_3_in_5	Parallel run loop
auto	3.6121091818991373	0.0	discard	29_3_in_5	Parallel run loop
auto	5.010797783184875	0.0	discard	38_3_in_4	Parallel run loop
auto	2.9826947481256063	0.0	discard	20_3_in_5	Parallel run loop
auto	4.0028899609094255	0.0	keep	25_3_in_4	Parallel run loop
auto	2.1842256107581366	0.0	discard	11_3_in_5	Parallel run loop
auto	2.4687703515113615	0.0	discard	14_3_in_5	Parallel run loop
auto	4.382322300346171	0.0	keep	42_3_in_5	Parallel run loop
auto	4.2975919889362055	0.0	discard	39_3_in_5	Parallel run loop
auto	2.5593393575654066	0.0	discard	15_3_in_5	Parallel run loop
auto	3.822590015910944	0.0	discard	32_3_in_5	Parallel run loop
auto	2.376202227155764	0.0	discard	13_3_in_5	Parallel run loop
auto	1.4721618857987302	0.0	discard	5_3_in_5	Parallel run loop
auto	1.612334932486663	0.0	discard	6_3_in_5	Parallel run loop
auto	1.9747021170622572	0.0	discard	9_3_in_5	Parallel run loop
auto	2.2817621814646207	0.0	discard	12_3_in_5	Parallel run loop
auto	3.061010826311199	0.0	discard	21_3_in_5	Parallel run loop
auto	5.000010319707201	0.0	discard	37_3_in_4	Parallel run loop
auto	3.8885071406031613	0.0	discard	33_3_in_5	Parallel run loop
auto	5.084195995724824	0.0	discard	50_3_in_5	Parallel run loop
auto	3.661851720221246	0.0	discard	21_3_in_4	Parallel run loop
auto	4.2105088799647765	0.0	discard	38_3_in_5	Parallel run loop
auto	4.588213274762125	0.0	discard	32_3_in_4	Parallel run loop
auto	5.25304994543078	0.0	discard	40_3_in_4	Parallel run loop
auto	3.474444727589557	0.0	discard	19_3_in_4	Parallel run loop
auto	5.352984094039623	0.0	keep	43_3_in_4	Parallel run loop
auto	5.5964302941099415	0.0	discard	44_3_in_4	Parallel run loop
auto	5.616256647791648	0.0	discard	45_3_in_4	Parallel run loop
auto	4.661114489122559	0.0	discard	33_3_in_4	Parallel run loop
auto	5.229827016739769	0.0	discard	41_3_in_4	Parallel run loop
auto	4.88308800372257	0.0	discard	36_3_in_4	Parallel run loop
auto	5.664982516820259	0.0	keep	46_3_in_4	Parallel run loop
auto	5.719360262362574	0.0	discard	47_3_in_4	Parallel run loop
auto	3.614579252540923	0.0	discard	29_3_in_5	Parallel run loop
auto	5.031913296930033	0.0	discard	38_3_in_4	Parallel run loop
auto	4.0354426929720395	0.0	discard	25_3_in_4	Parallel run loop
auto	2.983637456468405	0.0	discard	20_3_in_5	Parallel run loop
auto	4.118396305353627	0.0	discard	26_3_in_4	Parallel run loop
auto	2.8146618728244883	0.0	discard	18_3_in_5	Parallel run loop
auto	4.271321485707183	0.0	discard	39_3_in_5	Parallel run loop
auto	4.473932311285248	0.0	discard	42_3_in_5	Parallel run loop
auto	2.281618468812332	0.0	discard	12_3_in_5	Parallel run loop
auto	1.473592243833092	0.0	discard	5_3_in_5	Parallel run loop
auto	1.61233493594318	0.0	discard	6_3_in_5	Parallel run loop
auto	3.8170016362162804	0.0	discard	32_3_in_5	Parallel run loop
auto	1.9752468696905114	0.0	discard	9_3_in_5	Parallel run loop
auto	3.3557015194412054	0.0	discard	25_3_in_5	Parallel run loop
auto	1.8641606449453922	0.0	discard	8_3_in_5	Parallel run loop
auto	2.3772344891890627	0.0	discard	13_3_in_5	Parallel run loop
auto	3.476356018745095	0.0	discard	19_3_in_4	Parallel run loop
auto	5.05461090924511	0.0	discard	50_3_in_5	Parallel run loop
auto	4.35061729638691	0.0	keep	29_3_in_4	Parallel run loop
auto	4.567529985166569	0.0	discard	43_3_in_5	Parallel run loop
auto	4.593747444168572	0.0	discard	32_3_in_4	Parallel run loop
auto	5.458666540882543	0.0	discard	43_3_in_4	Parallel run loop
auto	3.6830378276180937	0.0	discard	21_3_in_4	Parallel run loop
auto	4.633284650309261	0.0	discard	44_3_in_5	Parallel run loop
auto	5.926032818881223	0.0	discard	48_3_in_4	Parallel run loop
auto	5.734691893353765	0.0	discard	46_3_in_4	Parallel run loop
auto	4.895274592928993	0.0	discard	36_3_in_4	Parallel run loop
auto	4.663467634209655	0.0	discard	33_3_in_4	Parallel run loop
auto	4.132911007435674	0.0	discard	37_3_in_5	Parallel run loop
auto	3.621858123846187	0.0	discard	29_3_in_5	Parallel run loop
auto	5.616624346903507	0.0	discard	45_3_in_4	Parallel run loop
auto	5.807274721653209	0.0	discard	47_3_in_4	Parallel run loop
auto	5.391716024923637	0.0	discard	42_3_in_4	Parallel run loop
auto	4.794241664767041	0.0	discard	47_3_in_5	Parallel run loop
auto	4.117467785840696	0.0	discard	26_3_in_4	Parallel run loop
auto	2.8172476892155127	0.0	discard	18_3_in_5	Parallel run loop
auto	4.005273312735106	0.0	discard	25_3_in_4	Parallel run loop
auto	4.831035797280756	0.0	discard	35_3_in_4	Parallel run loop
auto	2.2819609527119584	0.0	discard	12_3_in_5	Parallel run loop
auto	4.468595669874904	0.0	discard	42_3_in_5	Parallel run loop
auto	3.950072293576013	0.0	discard	34_3_in_5	Parallel run loop
auto	3.200260725450008	0.0	discard	23_3_in_5	Parallel run loop
auto	3.948932834327308	0.0	discard	24_3_in_4	Parallel run loop
auto	2.8583250803370848	0.0	discard	13_3_in_4	Parallel run loop
auto	4.33978453294204	0.0	keep	29_3_in_4	Parallel run loop
auto	3.756086451726561	0.0	discard	31_3_in_5	Parallel run loop
auto	4.201837137129562	0.0	discard	27_3_in_4	Parallel run loop
auto	4.814448867625991	0.0	discard	46_3_in_5	Parallel run loop
auto	2.3767949851857426	0.0	discard	13_3_in_5	Parallel run loop
auto	3.2848172892826764	0.0	discard	24_3_in_5	Parallel run loop
auto	3.4956770013695766	0.0	discard	19_3_in_4	Parallel run loop
auto	4.943167343588895	0.0	discard	49_3_in_5	Parallel run loop
auto	3.3844831958044064	0.0	discard	18_3_in_4	Parallel run loop
auto	4.435699573893803	0.0	discard	30_3_in_4	Parallel run loop
auto	4.732251113435828	0.0	discard	34_3_in_4	Parallel run loop
auto	5.525525648101554	0.0	discard	43_3_in_4	Parallel run loop
auto	3.579597086460894	0.0	discard	20_3_in_4	Parallel run loop
auto	4.127828943407568	0.0	discard	37_3_in_5	Parallel run loop
auto	4.883767137744209	0.0	discard	36_3_in_4	Parallel run loop
auto	4.438726344183587	0.0	discard	41_3_in_5	Parallel run loop
auto	5.79929471485055	0.0	discard	47_3_in_4	Parallel run loop
auto	5.55747663389788	0.0	keep	45_3_in_4	Parallel run loop
auto	3.130205302441814	0.0	discard	22_3_in_5	Parallel run loop
auto	4.076228129168676	0.0	discard	36_3_in_5	Parallel run loop
auto	5.932996747424285	0.0	discard	48_3_in_4	Parallel run loop
auto	4.739510616252587	0.0	discard	47_3_in_5	Parallel run loop
auto	4.831035797280756	0.0	discard	35_3_in_4	Parallel run loop
auto	3.0622079068582124	0.0	discard	21_3_in_5	Parallel run loop
auto	4.104954482164783	0.0	discard	26_3_in_4	Parallel run loop
auto	4.35065662291361	0.0	discard	40_3_in_5	Parallel run loop
auto	4.036072374052227	0.0	discard	25_3_in_4	Parallel run loop
auto	4.493924228272134	0.0	discard	42_3_in_5	Parallel run loop
auto	3.949297891545804	0.0	discard	24_3_in_4	Parallel run loop
auto	3.2128824242092584	0.0	discard	23_3_in_5	Parallel run loop
auto	5.344815474203816	0.0	discard	41_3_in_4	Parallel run loop
auto	2.9063566116156383	0.0	discard	19_3_in_5	Parallel run loop
auto	1.862270725281359	0.0	discard	8_3_in_5	Parallel run loop
auto	4.347551012491243	0.0	discard	29_3_in_4	Parallel run loop
auto	5.553503207265787	0.0	discard	44_3_in_4	Parallel run loop
auto	5.254467501146454	0.0	discard	40_3_in_4	Parallel run loop
auto	4.5968407216861245	0.0	discard	44_3_in_5	Parallel run loop
auto	3.356548013333152	0.0	discard	25_3_in_5	Parallel run loop
auto	3.1223115056883906	0.0	discard	22_3_in_5	Parallel run loop
auto	4.544303673740963	0.0	discard	43_3_in_5	Parallel run loop
auto	4.717401912967071	0.0	discard	34_3_in_4	Parallel run loop
auto	3.4172790183013086	0.0	discard	26_3_in_5	Parallel run loop
auto	5.305351201883148	0.0	discard	42_3_in_4	Parallel run loop
auto	4.89348638628278	0.0	discard	36_3_in_4	Parallel run loop
auto	4.994668908813568	0.0	discard	49_3_in_5	Parallel run loop
auto	2.082140261640289	0.0	discard	10_3_in_5	Parallel run loop
auto	4.897357243038764	0.0	discard	48_3_in_5	Parallel run loop
auto	5.6920833603522825	0.0	discard	47_3_in_4	Parallel run loop
auto	3.58677665283775	0.0	discard	20_3_in_4	Parallel run loop
auto	4.752426089677706	0.0	discard	47_3_in_5	Parallel run loop
auto	1.741520776226328	0.0	discard	7_3_in_5	Parallel run loop
auto	5.855428389862899	0.0	discard	48_3_in_4	Parallel run loop
auto	3.942308690494909	0.0	discard	34_3_in_5	Parallel run loop
auto	5.668311766146055	0.0	discard	45_3_in_4	Parallel run loop
auto	2.8573510036876137	0.0	discard	13_3_in_4	Parallel run loop
auto	4.365451708663859	0.0	discard	40_3_in_5	Parallel run loop
auto	4.119581326334441	0.0	discard	26_3_in_4	Parallel run loop
auto	2.7299679229561598	0.0	discard	17_3_in_5	Parallel run loop
auto	3.751335757705845	0.0	discard	31_3_in_5	Parallel run loop
auto	4.713691172240886	0.0	discard	46_3_in_5	Parallel run loop
auto	4.15885848290376	0.0	keep	27_3_in_4	Parallel run loop
auto	3.368575402876833	0.0	discard	18_3_in_4	Parallel run loop
auto	2.5593923828875704	0.0	discard	15_3_in_5	Parallel run loop
auto	3.6837915922262283	0.0	discard	30_3_in_5	Parallel run loop
auto	4.624608583310271	0.0	discard	44_3_in_5	Parallel run loop
auto	4.337681349050957	0.0	keep	29_3_in_4	Parallel run loop
auto	4.0861330571667045	0.0	discard	36_3_in_5	Parallel run loop
auto	4.519384531618445	0.0	discard	31_3_in_4	Parallel run loop
auto	2.465611425096576	0.0	discard	14_3_in_5	Parallel run loop
auto	4.441435840260274	0.0	discard	30_3_in_4	Parallel run loop
auto	3.41822678737151	0.0	discard	26_3_in_5	Parallel run loop
auto	3.1391935080397837	0.0	discard	22_3_in_5	Parallel run loop
auto	4.5523209371899	0.0	discard	43_3_in_5	Parallel run loop
auto	5.35427732490942	0.0	discard	42_3_in_4	Parallel run loop
auto	4.734901836014946	0.0	discard	34_3_in_4	Parallel run loop
auto	4.904798716783879	0.0	discard	36_3_in_4	Parallel run loop
auto	4.9494385803528385	0.0	discard	48_3_in_5	Parallel run loop
auto	5.763448738999975	0.0	discard	47_3_in_4	Parallel run loop
auto	4.974727710547362	0.0	discard	37_3_in_4	Parallel run loop
auto	3.27554516215835	0.0	discard	24_3_in_5	Parallel run loop
auto	4.355707329072416	0.0	discard	41_3_in_5	Parallel run loop
auto	1.7419930002092654	0.0	discard	7_3_in_5	Parallel run loop
auto	3.9262577871373177	0.0	discard	34_3_in_5	Parallel run loop
auto	5.832350442130772	0.0	discard	48_3_in_4	Parallel run loop
auto	4.772820204095091	0.0	discard	47_3_in_5	Parallel run loop
auto	5.5138870450926	0.0	keep	45_3_in_4	Parallel run loop
auto	2.85775306651173	0.0	discard	13_3_in_4	Parallel run loop
auto	2.7334055665325514	0.0	discard	17_3_in_5	Parallel run loop
auto	3.0578206881502736	0.0	discard	21_3_in_5	Parallel run loop
auto	2.981635179132359	0.0	discard	20_3_in_5	Parallel run loop
auto	4.794243437084722	0.0	discard	46_3_in_5	Parallel run loop
auto	3.3887725656080283	0.0	discard	18_3_in_4	Parallel run loop
auto	4.199736889469693	0.0	discard	27_3_in_4	Parallel run loop
auto	3.730523852919141	0.0	keep	31_3_in_5	Parallel run loop
auto	3.670157491643775	0.0	keep	30_3_in_5	Parallel run loop
auto	5.095380419820268	0.0	discard	50_3_in_5	Parallel run loop
auto	4.3554406811355575	0.0	discard	29_3_in_4	Parallel run loop
auto	4.077132942143334	0.0	discard	36_3_in_5	Parallel run loop
auto	5.558556064452694	0.0	discard	44_3_in_4	Parallel run loop
auto	4.626307932661024	0.0	discard	44_3_in_5	Parallel run loop
auto	2.468049596551582	0.0	discard	14_3_in_5	Parallel run loop
auto	2.9034024442295974	0.0	discard	19_3_in_5	Parallel run loop
auto	3.4232303547546863	0.0	discard	26_3_in_5	Parallel run loop
auto	4.434470511563462	0.0	discard	30_3_in_4	Parallel run loop
auto	5.3771096939265455	0.0	discard	42_3_in_4	Parallel run loop
auto	3.136222971147528	0.0	discard	22_3_in_5	Parallel run loop
auto	5.739872203071457	0.0	discard	46_3_in_4	Parallel run loop
auto	5.2334266494413555	0.0	discard	40_3_in_4	Parallel run loop
auto	4.674562777471559	0.0	discard	33_3_in_4	Parallel run loop
auto	4.71491928469032	0.0	discard	34_3_in_4	Parallel run loop
auto	5.3140888053704	0.0	discard	41_3_in_4	Parallel run loop
auto	4.408510764879402	0.0	discard	41_3_in_5	Parallel run loop
auto	5.643435511519795	0.0	discard	45_3_in_4	Parallel run loop
auto	3.2759247966325673	0.0	discard	24_3_in_5	Parallel run loop
auto	2.1872097025938535	0.0	discard	11_3_in_5	Parallel run loop
auto	4.821440340074729	0.0	discard	47_3_in_5	Parallel run loop
auto	3.932375721519614	0.0	discard	34_3_in_5	Parallel run loop
auto	5.919616175009755	0.0	discard	48_3_in_4	Parallel run loop
auto	2.821693675434351	0.0	discard	18_3_in_5	Parallel run loop
auto	4.15017415599429	0.0	discard	37_3_in_5	Parallel run loop
auto	2.9850851463036605	0.0	discard	20_3_in_5	Parallel run loop
auto	3.3242390912223763	0.0	keep	25_3_in_5	Parallel run loop
auto	3.7358398490942886	0.0	discard	31_3_in_5	Parallel run loop
auto	1.8616678399803717	0.0	keep	8_3_in_5	Parallel run loop
auto	3.0585055951181466	0.0	discard	21_3_in_5	Parallel run loop
auto	3.8931861389740208	0.0	discard	33_3_in_5	Parallel run loop
auto	3.6878626048815883	0.0	discard	30_3_in_5	Parallel run loop
auto	2.082101885278216	0.0	discard	10_3_in_5	Parallel run loop
auto	4.091871112434221	0.0	discard	36_3_in_5	Parallel run loop
auto	4.820535976011669	0.0	discard	35_3_in_4	Parallel run loop
auto	5.5616010013841555	0.0	discard	44_3_in_4	Parallel run loop
auto	2.467751507592506	0.0	discard	14_3_in_5	Parallel run loop
auto	3.929533630480573	0.0	keep	24_3_in_4	Parallel run loop
auto	3.7600556207515226	0.0	discard	22_3_in_4	Parallel run loop
auto	3.8643050729693815	0.0	discard	23_3_in_4	Parallel run loop
auto	4.443022929155957	0.0	discard	30_3_in_4	Parallel run loop
auto	4.265728460509129	0.0	discard	39_3_in_5	Parallel run loop
auto	5.391716024923637	0.0	discard	42_3_in_4	Parallel run loop
auto	3.2110152886115944	0.0	discard	23_3_in_5	Parallel run loop
auto	4.670985505775849	0.0	discard	33_3_in_4	Parallel run loop
auto	4.738437501213865	0.0	discard	34_3_in_4	Parallel run loop
auto	5.79179118342406	0.0	discard	46_3_in_4	Parallel run loop
auto	2.5558264919200258	0.0	discard	15_3_in_5	Parallel run loop
auto	3.5537909868755717	0.0	discard	28_3_in_5	Parallel run loop
auto	3.2797792515606496	0.0	discard	24_3_in_5	Parallel run loop
auto	3.4825926629073067	0.0	discard	27_3_in_5	Parallel run loop
auto	3.92831951860673	0.0	discard	34_3_in_5	Parallel run loop
auto	5.870973543718415	0.0	discard	48_3_in_4	Parallel run loop
auto	1.6123349285366337	0.0	discard	6_3_in_5	Parallel run loop
auto	4.617449698496022	0.0	keep	45_3_in_5	Parallel run loop
auto	1.4721694286740672	0.0	discard	5_3_in_5	Parallel run loop
auto	4.121686431748756	0.0	discard	37_3_in_5	Parallel run loop
auto	2.9813146120015337	0.0	discard	20_3_in_5	Parallel run loop
auto	3.7522123332156454	0.0	discard	31_3_in_5	Parallel run loop
auto	3.062449635554174	0.0	discard	21_3_in_5	Parallel run loop
auto	3.353681167844072	0.0	discard	25_3_in_5	Parallel run loop
auto	1.8629995005681756	0.0	discard	8_3_in_5	Parallel run loop
auto	2.083115888027414	0.0	discard	10_3_in_5	Parallel run loop
auto	4.512226973028173	0.0	discard	31_3_in_4	Parallel run loop
auto	3.6913543938980142	0.0	discard	30_3_in_5	Parallel run loop
auto	5.587114090265403	0.0	discard	44_3_in_4	Parallel run loop
auto	2.4671157281773706	0.0	discard	14_3_in_5	Parallel run loop
auto	4.8356574757045445	0.0	discard	35_3_in_4	Parallel run loop
auto	3.770191055014981	0.0	discard	22_3_in_4	Parallel run loop
auto	4.0017663859876835	0.0	discard	35_3_in_5	Parallel run loop
auto	4.275169600037679	0.0	discard	39_3_in_5	Parallel run loop
auto	3.9485471340285323	0.0	discard	24_3_in_4	Parallel run loop
auto	4.663467634209655	0.0	discard	33_3_in_4	Parallel run loop
auto	4.9567531909448475	0.0	discard	37_3_in_4	Parallel run loop
auto	4.276638186474581	0.0	discard	28_3_in_4	Parallel run loop
auto	3.820084936704594	0.0	discard	32_3_in_5	Parallel run loop
auto	3.5822380706524606	0.0	discard	20_3_in_4	Parallel run loop
auto	3.673200027001402	0.0	discard	21_3_in_4	Parallel run loop
auto	3.557527263765998	0.0	discard	28_3_in_5	Parallel run loop
auto	4.966256840369471	0.0	discard	49_3_in_5	Parallel run loop
auto	3.4873047779478603	0.0	discard	27_3_in_5	Parallel run loop
auto	3.943656075577568	0.0	discard	34_3_in_5	Parallel run loop
auto	2.553435741861181	0.0	discard	15_3_in_5	Parallel run loop
auto	1.6123349282079364	0.0	discard	6_3_in_5	Parallel run loop
auto	4.338574490107765	0.0	discard	40_3_in_5	Parallel run loop
auto	4.708662387201879	0.0	discard	45_3_in_5	Parallel run loop
auto	5.893450676980291	0.0	discard	48_3_in_4	Parallel run loop
auto	3.7587935087762947	0.0	discard	31_3_in_5	Parallel run loop
auto	1.4735924834536605	0.0	discard	5_3_in_5	Parallel run loop
auto	4.139272693085462	0.0	discard	37_3_in_5	Parallel run loop
auto	2.983545443816297	0.0	discard	20_3_in_5	Parallel run loop
auto	1.8618302541845477	0.0	discard	8_3_in_5	Parallel run loop
auto	3.3369243414203873	0.0	discard	25_3_in_5	Parallel run loop
