commit	score	memory_gb	status	problem	description
auto	6.099537022430237	0.0	discard	31_3_in_3	Parallel run loop
auto	1.7011773066844613	0.0	discard	10_3_in_DOMINO	Parallel run loop
auto	2.205379219764513	0.0	discard	18_3_in_DOMINO	Parallel run loop
auto	4.943502864466721	0.0	discard	40_4_in_DOMINO	Parallel run loop
auto	7.030922742455542	0.0	discard	45_3_in_3	Parallel run loop
auto	4.965060044085815	0.0	discard	21_3_in_3	Parallel run loop
auto	1.9800993433975598	0.0	keep	15_3_in_DOMINO	Parallel run loop
auto	4.475096077264324	0.0	discard	33_4_in_DOMINO	Parallel run loop
auto	4.993029491890905	0.0	keep	41_4_in_DOMINO	Parallel run loop
auto	3.8688750047412386	0.0	discard	23_4_in_DOMINO	Parallel run loop
auto	3.0223172208985285	0.0	discard	13_4_in_DOMINO	Parallel run loop
auto	5.996957272103385	0.0	discard	30_3_in_3	Parallel run loop
auto	4.020360663309433	0.0	discard	26_4_in_DOMINO	Parallel run loop
auto	3.746847963455798	0.0	discard	11_3_in_3	Parallel run loop
auto	6.959075514447739	0.0	discard	41_3_in_3	Parallel run loop
auto	6.84302398719644	0.0	discard	38_3_in_3	Parallel run loop
auto	2.1454772115767358	0.0	discard	17_3_in_DOMINO	Parallel run loop
auto	6.940912390839882	0.0	discard	39_3_in_3	Parallel run loop
auto	2.0092432104642475	0.0	discard	16_3_in_DOMINO	Parallel run loop
auto	4.865553552550122	0.0	keep	20_3_in_3	Parallel run loop
auto	4.877667952465768	0.0	keep	39_4_in_DOMINO	Parallel run loop
auto	7.0202148158818884	0.0	discard	42_3_in_3	Parallel run loop
auto	5.977930657320277	0.0	discard	29_3_in_3	Parallel run loop
auto	4.510334332905153	0.0	discard	34_4_in_DOMINO	Parallel run loop
auto	3.9641227017335576	0.0	discard	22_4_in_DOMINO	Parallel run loop
auto	7.015974820954202	0.0	discard	44_3_in_3	Parallel run loop
auto	6.773117703585962	0.0	discard	37_3_in_3	Parallel run loop
auto	4.020316954443297	0.0	discard	13_3_in_3	Parallel run loop
auto	4.00437912608468	0.0	discard	25_4_in_DOMINO	Parallel run loop
auto	5.984737071313207	0.0	discard	32_3_in_3	Parallel run loop
auto	5.719122467319307	0.0	discard	26_3_in_3	Parallel run loop
auto	2.4901149670854683	0.0	discard	19_3_in_DOMINO	Parallel run loop
auto	5.029602176115146	0.0	discard	42_4_in_DOMINO	Parallel run loop
auto	7.0057225950403	0.0	keep	46_3_in_3	Parallel run loop
auto	1.911646754271575	0.0	discard	14_3_in_DOMINO	Parallel run loop
auto	4.909436345194792	0.0	discard	37_4_in_DOMINO	Parallel run loop
auto	4.965060044085815	0.0	discard	21_3_in_3	Parallel run loop
auto	1.980053383967158	0.0	keep	15_3_in_DOMINO	Parallel run loop
auto	6.9673699289329925	0.0	discard	43_3_in_3	Parallel run loop
auto	1.7011773066844613	0.0	discard	10_3_in_DOMINO	Parallel run loop
auto	4.944104947796166	0.0	discard	38_4_in_DOMINO	Parallel run loop
auto	3.9241229167278884	0.0	discard	24_4_in_DOMINO	Parallel run loop
auto	2.6158059657922257	0.0	discard	22_3_in_DOMINO	Parallel run loop
auto	5.019525795832946	0.0	discard	41_4_in_DOMINO	Parallel run loop
auto	6.04949978512713	0.0	discard	31_3_in_3	Parallel run loop
auto	2.931723676723068	0.0	discard	11_4_in_DOMINO	Parallel run loop
auto	2.1732168171907253	0.0	keep	18_3_in_DOMINO	Parallel run loop
auto	4.8942446995982385	0.0	discard	20_3_in_3	Parallel run loop
auto	4.943502864466721	0.0	discard	40_4_in_DOMINO	Parallel run loop
auto	7.675106763760255	0.0	discard	50_3_in_3	Parallel run loop
auto	4.475096077264324	0.0	discard	33_4_in_DOMINO	Parallel run loop
auto	7.030922742455542	0.0	discard	45_3_in_3	Parallel run loop
auto	3.8688750047412386	0.0	discard	23_4_in_DOMINO	Parallel run loop
auto	5.754406321831056	0.0	discard	29_3_in_3	Parallel run loop
auto	4.020360663309433	0.0	discard	26_4_in_DOMINO	Parallel run loop
auto	3.0482570050526587	0.0	discard	13_4_in_DOMINO	Parallel run loop
auto	5.023275579401488	0.0	discard	39_4_in_DOMINO	Parallel run loop
auto	6.84302398719644	0.0	discard	38_3_in_3	Parallel run loop
auto	3.746847963455798	0.0	discard	11_3_in_3	Parallel run loop
auto	2.564639797156564	0.0	discard	21_3_in_DOMINO	Parallel run loop
auto	6.773117703585962	0.0	discard	37_3_in_3	Parallel run loop
auto	6.154741511348901	0.0	discard	32_3_in_3	Parallel run loop
auto	7.208212168436233	0.0	discard	41_3_in_3	Parallel run loop
auto	6.940912390839882	0.0	discard	39_3_in_3	Parallel run loop
auto	1.9800135476303262	0.0	keep	15_3_in_DOMINO	Parallel run loop
auto	3.9641227017335576	0.0	discard	22_4_in_DOMINO	Parallel run loop
auto	4.020316954443297	0.0	discard	13_3_in_3	Parallel run loop
auto	4.510334332905153	0.0	discard	34_4_in_DOMINO	Parallel run loop
auto	7.0202148158818884	0.0	discard	42_3_in_3	Parallel run loop
auto	2.0092432104642475	0.0	discard	16_3_in_DOMINO	Parallel run loop
auto	7.015974820954202	0.0	discard	44_3_in_3	Parallel run loop
auto	7.356008724792315	0.0	discard	46_3_in_3	Parallel run loop
auto	2.607187603299471	0.0	discard	22_3_in_DOMINO	Parallel run loop
auto	5.910206157614971	0.0	discard	30_3_in_3	Parallel run loop
auto	5.034186680493225	0.0	discard	38_4_in_DOMINO	Parallel run loop
auto	2.4901149670854683	0.0	discard	19_3_in_DOMINO	Parallel run loop
auto	5.019525795832946	0.0	discard	41_4_in_DOMINO	Parallel run loop
auto	2.2046973975212936	0.0	discard	18_3_in_DOMINO	Parallel run loop
auto	1.7011773066844613	0.0	discard	10_3_in_DOMINO	Parallel run loop
auto	1.911646754271575	0.0	discard	14_3_in_DOMINO	Parallel run loop
auto	5.029602176115146	0.0	discard	42_4_in_DOMINO	Parallel run loop
auto	4.8942446995982385	0.0	discard	20_3_in_3	Parallel run loop
auto	3.9241229167278884	0.0	discard	24_4_in_DOMINO	Parallel run loop
auto	5.719122467319307	0.0	discard	26_3_in_3	Parallel run loop
auto	5.923622637634554	0.0	discard	29_3_in_3	Parallel run loop
auto	2.5648962867852427	0.0	discard	21_3_in_DOMINO	Parallel run loop
auto	2.3421438299204427	0.0	discard	20_3_in_DOMINO	Parallel run loop
auto	6.0044857410723464	0.0	discard	31_3_in_3	Parallel run loop
auto	7.030922742455542	0.0	discard	45_3_in_3	Parallel run loop
auto	6.9673699289329925	0.0	discard	43_3_in_3	Parallel run loop
auto	5.0055607612139665	0.0	discard	37_4_in_DOMINO	Parallel run loop
auto	3.8688750047412386	0.0	discard	23_4_in_DOMINO	Parallel run loop
auto	4.943502864466721	0.0	discard	40_4_in_DOMINO	Parallel run loop
auto	6.590620171674847	0.0	discard	37_3_in_3	Parallel run loop
auto	4.475096077264324	0.0	discard	33_4_in_DOMINO	Parallel run loop
auto	1.9799790150916394	0.0	keep	15_3_in_DOMINO	Parallel run loop
auto	2.931723676723068	0.0	discard	11_4_in_DOMINO	Parallel run loop
auto	4.020360663309433	0.0	discard	26_4_in_DOMINO	Parallel run loop
auto	7.625358682018297	0.0	keep	50_3_in_3	Parallel run loop
auto	3.746847963455798	0.0	discard	11_3_in_3	Parallel run loop
auto	3.0223172208985285	0.0	discard	13_4_in_DOMINO	Parallel run loop
auto	2.592627431234506	0.0	discard	22_3_in_DOMINO	Parallel run loop
auto	6.84302398719644	0.0	discard	38_3_in_3	Parallel run loop
auto	5.023275579401488	0.0	discard	39_4_in_DOMINO	Parallel run loop
auto	5.984737071313207	0.0	discard	32_3_in_3	Parallel run loop
auto	5.996957272103385	0.0	discard	30_3_in_3	Parallel run loop
auto	7.012305785085151	0.0	discard	41_3_in_3	Parallel run loop
auto	3.887615286150665	0.0	discard	22_4_in_DOMINO	Parallel run loop
auto	4.020316954443297	0.0	discard	13_3_in_3	Parallel run loop
auto	6.809573200582781	0.0	discard	39_3_in_3	Parallel run loop
auto	4.00437912608468	0.0	discard	25_4_in_DOMINO	Parallel run loop
auto	4.510334332905153	0.0	discard	34_4_in_DOMINO	Parallel run loop
auto	5.019525795832946	0.0	discard	41_4_in_DOMINO	Parallel run loop
auto	2.0092432104642475	0.0	discard	16_3_in_DOMINO	Parallel run loop
auto	2.5546566825113874	0.0	keep	21_3_in_DOMINO	Parallel run loop
auto	7.015974820954202	0.0	discard	44_3_in_3	Parallel run loop
auto	6.968419612588819	0.0	discard	42_3_in_3	Parallel run loop
auto	1.7011773066844613	0.0	discard	10_3_in_DOMINO	Parallel run loop
auto	2.3063373218716916	0.0	keep	20_3_in_DOMINO	Parallel run loop
auto	6.038313795273007	0.0	discard	29_3_in_3	Parallel run loop
auto	4.965060044085815	0.0	discard	21_3_in_3	Parallel run loop
auto	1.911646754271575	0.0	discard	14_3_in_DOMINO	Parallel run loop
auto	5.034186680493225	0.0	discard	38_4_in_DOMINO	Parallel run loop
auto	2.4901149670854683	0.0	discard	19_3_in_DOMINO	Parallel run loop
auto	2.1454772115767358	0.0	discard	17_3_in_DOMINO	Parallel run loop
auto	1.9799490775574375	0.0	keep	15_3_in_DOMINO	Parallel run loop
auto	5.719122467319307	0.0	discard	26_3_in_3	Parallel run loop
auto	2.2046973975212936	0.0	discard	18_3_in_DOMINO	Parallel run loop
auto	2.6165908645564837	0.0	discard	22_3_in_DOMINO	Parallel run loop
auto	5.029602176115146	0.0	discard	42_4_in_DOMINO	Parallel run loop
auto	6.04949978512713	0.0	discard	31_3_in_3	Parallel run loop
auto	3.746847963455798	0.0	discard	11_3_in_3	Parallel run loop
auto	6.84302398719644	0.0	discard	38_3_in_3	Parallel run loop
auto	6.9673699289329925	0.0	discard	43_3_in_3	Parallel run loop
auto	4.979968567667918	0.0	discard	39_4_in_DOMINO	Parallel run loop
auto	7.030922742455542	0.0	discard	45_3_in_3	Parallel run loop
auto	7.624050835826761	0.0	keep	50_3_in_3	Parallel run loop
auto	6.773117703585962	0.0	discard	37_3_in_3	Parallel run loop
auto	4.020316954443297	0.0	discard	13_3_in_3	Parallel run loop
auto	2.9858356422063896	0.0	discard	6_3_in_3	Parallel run loop
auto	2.5561483972087777	0.0	discard	21_3_in_DOMINO	Parallel run loop
auto	5.984737071313207	0.0	discard	32_3_in_3	Parallel run loop
auto	2.0092432104642475	0.0	discard	16_3_in_DOMINO	Parallel run loop
auto	5.996957272103385	0.0	discard	30_3_in_3	Parallel run loop
auto	6.866970338907654	0.0	discard	41_3_in_3	Parallel run loop
auto	1.7011773066844613	0.0	discard	10_3_in_DOMINO	Parallel run loop
auto	6.940912390839882	0.0	discard	39_3_in_3	Parallel run loop
auto	2.3386033177776575	0.0	discard	20_3_in_DOMINO	Parallel run loop
auto	5.019525795832946	0.0	discard	41_4_in_DOMINO	Parallel run loop
auto	5.923622637634554	0.0	discard	29_3_in_3	Parallel run loop
auto	1.911646754271575	0.0	discard	14_3_in_DOMINO	Parallel run loop
auto	1.2631707571078108	0.0	discard	5_3_in_DOMINO	Parallel run loop
auto	4.965060044085815	0.0	discard	21_3_in_3	Parallel run loop
auto	6.968419612588819	0.0	discard	42_3_in_3	Parallel run loop
auto	7.015974820954202	0.0	discard	44_3_in_3	Parallel run loop
auto	2.4901149670854683	0.0	discard	19_3_in_DOMINO	Parallel run loop
auto	2.1454772115767358	0.0	discard	17_3_in_DOMINO	Parallel run loop
auto	1.9799231216142221	0.0	keep	15_3_in_DOMINO	Parallel run loop
auto	2.618161368705861	0.0	discard	22_3_in_DOMINO	Parallel run loop
auto	5.719122467319307	0.0	discard	26_3_in_3	Parallel run loop
auto	2.2046973975212936	0.0	discard	18_3_in_DOMINO	Parallel run loop
auto	1.3763322075192148	0.0	discard	6_3_in_DOMINO	Parallel run loop
auto	1.1204680284017543	0.0	discard	4_3_in_DOMINO	Parallel run loop
auto	0.9680088680085646	0.0	discard	3_3_in_DOMINO	Parallel run loop
auto	3.746847963455798	0.0	discard	11_3_in_3	Parallel run loop
auto	1.7141192426593264	0.0	discard	9_3_in_DOMINO	Parallel run loop
auto	6.099537022430237	0.0	discard	31_3_in_3	Parallel run loop
auto	4.883494798545663	0.0	discard	18_CIRCLE_in_CIRCLE	Parallel run loop
auto	5.143321280120154	0.0	discard	20_CIRCLE_in_CIRCLE	Parallel run loop
auto	2.6272004337398296	0.0	discard	22_3_in_circle	Parallel run loop
auto	11.471632991608798	0.0	discard	14_CIRCLE_in_3	Parallel run loop
auto	2.5694756560891565	0.0	discard	21_3_in_DOMINO	Parallel run loop
auto	3.013863697418503	0.0	discard	28_3_in_circle	Parallel run loop
auto	2.9504831544307137	0.0	discard	27_3_in_circle	Parallel run loop
auto	2.1054855467062894	0.0	discard	16_3_in_DOMINO	Parallel run loop
auto	1.7011773066844613	0.0	discard	10_3_in_DOMINO	Parallel run loop
auto	7.53608085216413	0.0	keep	50_3_in_3	Parallel run loop
auto	3.067750268627813	0.0	discard	29_3_in_circle	Parallel run loop
auto	2.702889059020112	0.0	discard	23_3_in_circle	Parallel run loop
auto	2.303224821411376	0.0	keep	20_3_in_DOMINO	Parallel run loop
auto	6.959075514447739	0.0	discard	41_3_in_3	Parallel run loop
auto	2.8820937842681316	0.0	discard	26_3_in_circle	Parallel run loop
auto	3.118604399571491	0.0	discard	30_3_in_circle	Parallel run loop
auto	1.911646754271575	0.0	discard	14_3_in_DOMINO	Parallel run loop
auto	1.490840291646784	0.0	discard	7_3_in_DOMINO	Parallel run loop
auto	5.977930657320277	0.0	discard	29_3_in_3	Parallel run loop
auto	2.598077942403763	0.0	discard	22_3_in_DOMINO	Parallel run loop
auto	2.1140034221892554	0.0	keep	17_3_in_DOMINO	Parallel run loop
auto	1.9799006162303154	0.0	keep	15_3_in_DOMINO	Parallel run loop
auto	2.4901149670854683	0.0	discard	19_3_in_DOMINO	Parallel run loop
auto	2.8368134405343537	0.0	discard	25_3_in_circle	Parallel run loop
auto	1.2631707571078108	0.0	discard	5_3_in_DOMINO	Parallel run loop
auto	2.2046973975212936	0.0	discard	18_3_in_DOMINO	Parallel run loop
auto	7.0779489011835555	0.0	discard	42_3_in_3	Parallel run loop
auto	3.16076288991657	0.0	discard	31_3_in_circle	Parallel run loop
auto	1.56307865221544	0.0	discard	8_3_in_DOMINO	Parallel run loop
auto	11.413488992180232	0.0	discard	13_CIRCLE_in_3	Parallel run loop
auto	4.538260254000323	0.0	discard	15_CIRCLE_in_CIRCLE	Parallel run loop
auto	4.044636069278394	0.0	discard	12_CIRCLE_in_CIRCLE	Parallel run loop
auto	4.809960188594904	0.0	discard	17_CIRCLE_in_CIRCLE	Parallel run loop
auto	4.345096413036063	0.0	discard	14_CIRCLE_in_CIRCLE	Parallel run loop
auto	4.63348722009616	0.0	discard	16_CIRCLE_in_CIRCLE	Parallel run loop
auto	1.7530469032987281	0.0	discard	11_3_in_DOMINO	Parallel run loop
auto	2.561266065853562	0.0	discard	21_3_in_DOMINO	Parallel run loop
auto	1.3763322075192148	0.0	discard	6_3_in_DOMINO	Parallel run loop
auto	2.936354065765234	0.0	discard	27_3_in_circle	Parallel run loop
auto	1.1204680284017543	0.0	discard	4_3_in_DOMINO	Parallel run loop
auto	2.0092432104642475	0.0	discard	16_3_in_DOMINO	Parallel run loop
auto	1.7011773066844613	0.0	discard	10_3_in_DOMINO	Parallel run loop
auto	0.9680088680085646	0.0	discard	3_3_in_DOMINO	Parallel run loop
auto	2.620116206362302	0.0	discard	22_3_in_circle	Parallel run loop
auto	3.009346065058362	0.0	discard	28_3_in_circle	Parallel run loop
auto	2.868579052234093	0.0	discard	26_3_in_circle	Parallel run loop
auto	2.3006501546154943	0.0	keep	20_3_in_DOMINO	Parallel run loop
auto	4.883494798545663	0.0	discard	18_CIRCLE_in_CIRCLE	Parallel run loop
auto	1.911646754271575	0.0	discard	14_3_in_DOMINO	Parallel run loop
auto	1.7141192426593264	0.0	discard	9_3_in_DOMINO	Parallel run loop
auto	2.6100572311528354	0.0	discard	22_3_in_DOMINO	Parallel run loop
auto	1.9798811015693805	0.0	keep	15_3_in_DOMINO	Parallel run loop
auto	3.0509231178639427	0.0	discard	29_3_in_circle	Parallel run loop
auto	2.1444914350264472	0.0	discard	17_3_in_DOMINO	Parallel run loop
auto	2.6706466197264906	0.0	keep	23_3_in_circle	Parallel run loop
auto	2.4901149670854683	0.0	discard	19_3_in_DOMINO	Parallel run loop
auto	7.912884894772335	0.0	discard	50_3_in_3	Parallel run loop
auto	2.172599983054192	0.0	keep	18_3_in_DOMINO	Parallel run loop
auto	3.110817237216916	0.0	discard	30_3_in_circle	Parallel run loop
auto	1.490840291646784	0.0	discard	7_3_in_DOMINO	Parallel run loop
auto	5.143321280120154	0.0	discard	20_CIRCLE_in_CIRCLE	Parallel run loop
auto	11.471632991608798	0.0	discard	14_CIRCLE_in_3	Parallel run loop
auto	1.2748051192828511	0.0	discard	8_3_in_circle	Parallel run loop
auto	1.4830513649835477	0.0	discard	11_3_in_circle	Parallel run loop
auto	1.4007623159126743	0.0	discard	10_3_in_circle	Parallel run loop
auto	2.8257708630015443	0.0	discard	25_3_in_circle	Parallel run loop
auto	1.2631707571078108	0.0	discard	5_3_in_DOMINO	Parallel run loop
auto	2.580806825835459	0.0	discard	21_3_in_DOMINO	Parallel run loop
auto	3.1715283128702185	0.0	discard	31_3_in_circle	Parallel run loop
auto	1.5230514075566917	0.0	discard	12_3_in_circle	Parallel run loop
auto	2.9481235938772463	0.0	discard	27_3_in_circle	Parallel run loop
auto	1.56307865221544	0.0	discard	8_3_in_DOMINO	Parallel run loop
auto	1.7011773066844613	0.0	discard	10_3_in_DOMINO	Parallel run loop
auto	11.413488992180232	0.0	discard	13_CIRCLE_in_3	Parallel run loop
auto	2.0092432104642475	0.0	discard	16_3_in_DOMINO	Parallel run loop
auto	2.6167120982355048	0.0	discard	22_3_in_circle	Parallel run loop
auto	2.8930671254675895	0.0	discard	26_3_in_circle	Parallel run loop
auto	4.538260254000323	0.0	discard	15_CIRCLE_in_CIRCLE	Parallel run loop
auto	1.3763322075192148	0.0	discard	6_3_in_DOMINO	Parallel run loop
auto	1.911646754271575	0.0	discard	14_3_in_DOMINO	Parallel run loop
auto	2.6100572311528354	0.0	discard	22_3_in_DOMINO	Parallel run loop
auto	1.1204680284017543	0.0	discard	4_3_in_DOMINO	Parallel run loop
auto	2.3332803056569675	0.0	discard	20_3_in_DOMINO	Parallel run loop
auto	3.0686707778040994	0.0	discard	29_3_in_circle	Parallel run loop
auto	1.9798641793532867	0.0	keep	15_3_in_DOMINO	Parallel run loop
auto	2.7107938448930144	0.0	discard	23_3_in_circle	Parallel run loop
auto	2.1444914350264472	0.0	discard	17_3_in_DOMINO	Parallel run loop
auto	2.9964330142723488	0.0	discard	28_3_in_circle	Parallel run loop
auto	3.1139297660882153	0.0	discard	30_3_in_circle	Parallel run loop
auto	2.4901149670854683	0.0	discard	19_3_in_DOMINO	Parallel run loop
auto	2.204112100045143	0.0	discard	18_3_in_DOMINO	Parallel run loop
auto	0.9680088680085646	0.0	discard	3_3_in_DOMINO	Parallel run loop
auto	1.7141192426593264	0.0	discard	9_3_in_DOMINO	Parallel run loop
auto	4.044636069278394	0.0	discard	12_CIRCLE_in_CIRCLE	Parallel run loop
auto	4.809960188594904	0.0	discard	17_CIRCLE_in_CIRCLE	Parallel run loop
auto	4.345096413036063	0.0	discard	14_CIRCLE_in_CIRCLE	Parallel run loop
auto	4.63348722009616	0.0	discard	16_CIRCLE_in_CIRCLE	Parallel run loop
auto	4.883494798545663	0.0	discard	18_CIRCLE_in_CIRCLE	Parallel run loop
auto	1.7530469032987281	0.0	discard	11_3_in_DOMINO	Parallel run loop
auto	2.5831307137677437	0.0	discard	21_3_in_DOMINO	Parallel run loop
auto	1.490840291646784	0.0	discard	7_3_in_DOMINO	Parallel run loop
auto	5.143321280120154	0.0	discard	20_CIRCLE_in_CIRCLE	Parallel run loop
auto	1.8204190752494187	0.0	discard	18_3_in_circle	Parallel run loop
auto	11.471632991608798	0.0	discard	14_CIRCLE_in_3	Parallel run loop
auto	1.7011773066844613	0.0	discard	10_3_in_DOMINO	Parallel run loop
auto	1.2748051192828511	0.0	discard	8_3_in_circle	Parallel run loop
auto	2.831711514351985	0.0	discard	25_3_in_circle	Parallel run loop
auto	1.2631707571078108	0.0	discard	5_3_in_DOMINO	Parallel run loop
auto	2.1054855467062894	0.0	discard	16_3_in_DOMINO	Parallel run loop
auto	1.4830513649835477	0.0	discard	11_3_in_circle	Parallel run loop
auto	3.1610789978163516	0.0	discard	31_3_in_circle	Parallel run loop
auto	2.604581588617785	0.0	discard	22_3_in_DOMINO	Parallel run loop
auto	2.940762122486379	0.0	discard	27_3_in_circle	Parallel run loop
auto	1.911646754271575	0.0	discard	14_3_in_DOMINO	Parallel run loop
auto	1.56307865221544	0.0	discard	8_3_in_DOMINO	Parallel run loop
auto	11.413488992180232	0.0	discard	13_CIRCLE_in_3	Parallel run loop
auto	2.6219510215594384	0.0	discard	22_3_in_circle	Parallel run loop
auto	2.9994310959842085	0.0	discard	28_3_in_circle	Parallel run loop
auto	2.8786371732749907	0.0	discard	26_3_in_circle	Parallel run loop
auto	1.9798495045522577	0.0	keep	15_3_in_DOMINO	Parallel run loop
auto	2.1444914350264472	0.0	discard	17_3_in_DOMINO	Parallel run loop
auto	1.3763322075192148	0.0	discard	6_3_in_DOMINO	Parallel run loop
auto	1.1204680284017543	0.0	discard	4_3_in_DOMINO	Parallel run loop
auto	2.4901149670854683	0.0	discard	19_3_in_DOMINO	Parallel run loop
auto	2.1720699727402595	0.0	keep	18_3_in_DOMINO	Parallel run loop
auto	3.058866236712607	0.0	discard	29_3_in_circle	Parallel run loop
auto	4.538260254000323	0.0	discard	15_CIRCLE_in_CIRCLE	Parallel run loop
auto	2.686773627172595	0.0	discard	23_3_in_circle	Parallel run loop
auto	1.4007623159126743	0.0	discard	10_3_in_circle	Parallel run loop
auto	1.5230514075566917	0.0	discard	12_3_in_circle	Parallel run loop
auto	3.10242894055125	0.0	discard	30_3_in_circle	Parallel run loop
auto	1.6549223038095542	0.0	discard	15_3_in_circle	Parallel run loop
auto	1.7029189896133312	0.0	discard	16_3_in_circle	Parallel run loop
auto	1.8582158012495773	0.0	discard	19_3_in_circle	Parallel run loop
auto	1.8958192025625156	0.0	discard	20_3_in_circle	Parallel run loop
auto	4.044636069278394	0.0	discard	12_CIRCLE_in_CIRCLE	Parallel run loop
auto	4.809960188594904	0.0	discard	17_CIRCLE_in_CIRCLE	Parallel run loop
auto	4.345096413036063	0.0	discard	14_CIRCLE_in_CIRCLE	Parallel run loop
auto	4.63348722009616	0.0	discard	16_CIRCLE_in_CIRCLE	Parallel run loop
auto	4.883494798545663	0.0	discard	18_CIRCLE_in_CIRCLE	Parallel run loop
auto	3.1064519114939206	0.0	discard	21_4_in_CIRCLE	Parallel run loop
auto	3.1579193409248223	0.0	discard	31_3_in_circle	Parallel run loop
auto	2.6147598003438044	0.0	discard	22_3_in_DOMINO	Parallel run loop
auto	2.925801669210812	0.0	keep	27_3_in_circle	Parallel run loop
auto	5.143321280120154	0.0	discard	20_CIRCLE_in_CIRCLE	Parallel run loop
auto	3.265553306575606	0.0	discard	26_4_in_CIRCLE	Parallel run loop
auto	2.640634054257627	0.0	discard	22_3_in_circle	Parallel run loop
auto	11.471632991608798	0.0	discard	14_CIRCLE_in_3	Parallel run loop
auto	2.822946363396399	0.0	discard	25_3_in_circle	Parallel run loop
auto	2.881517394332216	0.0	discard	26_3_in_circle	Parallel run loop
auto	3.0030327539478465	0.0	discard	28_3_in_circle	Parallel run loop
auto	1.9798367782138848	0.0	keep	15_3_in_DOMINO	Parallel run loop
auto	1.2748051192828511	0.0	discard	8_3_in_circle	Parallel run loop
auto	2.11311454464044	0.0	keep	17_3_in_DOMINO	Parallel run loop
auto	1.4830513649835477	0.0	discard	11_3_in_circle	Parallel run loop
auto	3.0600900891551035	0.0	discard	29_3_in_circle	Parallel run loop
auto	1.8204190752494187	0.0	discard	18_3_in_circle	Parallel run loop
auto	2.6322527897590025	0.0	keep	23_3_in_circle	Parallel run loop
auto	2.2036089104428545	0.0	discard	18_3_in_DOMINO	Parallel run loop
