commit	score	memory_gb	status	problem	description
auto	4.080168592572487	0.0	discard	31_DOMINO_in_8	Parallel run loop
auto	2.9988689333566723	0.0	discard	6_8_in_8	Parallel run loop
auto	5.107053947828628	0.0	keep	31_5_in_6	Parallel run loop
auto	4.937033931247914	0.0	keep	29_5_in_6	Parallel run loop
auto	2.232167754713471	0.0	discard	6_5_in_CIRCLE	Parallel run loop
auto	4.069078977365869	0.0	discard	20_DOMINO_in_CIRCLE	Parallel run loop
auto	3.727320758878269	0.0	discard	5_8_in_6	Parallel run loop
auto	3.3927411887210233	0.0	discard	5_8_in_CIRCLE	Parallel run loop
auto	4.671104806138732	0.0	keep	26_5_in_6	Parallel run loop
auto	2.227600303864269	0.0	discard	5_5_in_6	Parallel run loop
auto	4.110242820503859	0.0	discard	18_DOMINO_in_6	Parallel run loop
auto	3.712322839747455	0.0	discard	6_8_in_CIRCLE	Parallel run loop
auto	3.887022406195413	0.0	keep	29_DOMINO_in_8	Parallel run loop
auto	1.7887272021501535	0.0	discard	6_5_in_8	Parallel run loop
auto	3.5764417535910717	0.0	discard	25_DOMINO_in_8	Parallel run loop
auto	2.7056475688823127	0.0	discard	9_5_in_CIRCLE	Parallel run loop
auto	4.934038331021986	0.0	discard	26_DOMINO_in_6	Parallel run loop
auto	3.2531176663263763	0.0	discard	5_6_in_DOMINO	Parallel run loop
auto	4.293483619432756	0.0	discard	5_8_in_DOMINO	Parallel run loop
auto	4.89325663829154	0.0	discard	25_DOMINO_in_6	Parallel run loop
auto	2.4843071937359382	0.0	discard	5_6_in_CIRCLE	Parallel run loop
auto	3.2614080911115835	0.0	discard	19_DOMINO_in_8	Parallel run loop
auto	5.431985989517285	0.0	discard	30_DOMINO_in_6	Parallel run loop
auto	4.725856382520951	0.0	keep	24_DOMINO_in_6	Parallel run loop
auto	5.337528950270475	0.0	discard	29_DOMINO_in_6	Parallel run loop
auto	5.031829263038627	0.0	discard	27_DOMINO_in_6	Parallel run loop
auto	3.431077442578044	0.0	discard	23_DOMINO_in_8	Parallel run loop
auto	3.9573800752399815	0.0	keep	30_DOMINO_in_8	Parallel run loop
auto	4.7393932910143475	0.0	discard	23_DOMINO_in_6	Parallel run loop
auto	4.032706441923925	0.0	keep	31_DOMINO_in_8	Parallel run loop
auto	2.0338761676062855	0.0	discard	5_5_in_CIRCLE	Parallel run loop
auto	7.676416747555321	0.0	discard	31_6_in_5	Parallel run loop
auto	3.6835660678180226	0.0	keep	26_DOMINO_in_8	Parallel run loop
auto	3.5703799076483236	0.0	discard	24_DOMINO_in_8	Parallel run loop
auto	3.4175597497180172	0.0	discard	6_6_in_DOMINO	Parallel run loop
auto	1.6257511872443808	0.0	discard	5_5_in_8	Parallel run loop
auto	4.069078977365869	0.0	discard	20_DOMINO_in_CIRCLE	Parallel run loop
auto	3.4825644057794745	0.0	keep	10_6_in_CIRCLE	Parallel run loop
auto	4.936413193183134	0.0	keep	29_5_in_6	Parallel run loop
auto	4.670795661548032	0.0	keep	26_5_in_6	Parallel run loop
auto	2.9988689333566723	0.0	discard	6_8_in_8	Parallel run loop
auto	2.715199605587582	0.0	discard	5_8_in_8	Parallel run loop
auto	3.3194742793762795	0.0	discard	9_6_in_CIRCLE	Parallel run loop
auto	5.1062112347328	0.0	keep	31_5_in_6	Parallel run loop
auto	4.94557232614842	0.0	discard	9_8_in_6	Parallel run loop
auto	2.232167754713471	0.0	discard	6_5_in_CIRCLE	Parallel run loop
auto	3.727320758878269	0.0	discard	5_8_in_6	Parallel run loop
auto	3.80140790409427	0.0	keep	29_DOMINO_in_8	Parallel run loop
auto	3.5764417535910717	0.0	discard	25_DOMINO_in_8	Parallel run loop
auto	2.227600303864269	0.0	discard	5_5_in_6	Parallel run loop
auto	3.528139528444775	0.0	discard	10_5_in_DOMINO	Parallel run loop
auto	3.3927411887210233	0.0	discard	5_8_in_CIRCLE	Parallel run loop
auto	3.712322839747455	0.0	discard	6_8_in_CIRCLE	Parallel run loop
auto	4.480024298540383	0.0	discard	9_8_in_CIRCLE	Parallel run loop
auto	3.341942287083622	0.0	discard	9_5_in_DOMINO	Parallel run loop
auto	4.739970382626691	0.0	discard	24_DOMINO_in_6	Parallel run loop
auto	1.7887272021501535	0.0	discard	6_5_in_8	Parallel run loop
auto	3.2531176663263763	0.0	discard	5_6_in_DOMINO	Parallel run loop
auto	4.293483619432756	0.0	discard	5_8_in_DOMINO	Parallel run loop
auto	3.431077442578044	0.0	discard	23_DOMINO_in_8	Parallel run loop
auto	2.7056475688823127	0.0	discard	9_5_in_CIRCLE	Parallel run loop
auto	2.4843071937359382	0.0	discard	5_6_in_CIRCLE	Parallel run loop
auto	5.13759272670469	0.0	discard	27_DOMINO_in_6	Parallel run loop
auto	4.026621863429831	0.0	discard	30_DOMINO_in_8	Parallel run loop
auto	1.717814742322048	0.0	discard	5_DOMINO_in_8	Parallel run loop
auto	3.7487368429551218	0.0	discard	26_DOMINO_in_8	Parallel run loop
auto	4.085091429602335	0.0	discard	31_DOMINO_in_8	Parallel run loop
auto	2.4783826951247696	0.0	discard	5_5_in_DOMINO	Parallel run loop
auto	4.513254229052472	0.0	discard	11_6_in_DOMINO	Parallel run loop
auto	4.069078977365869	0.0	discard	20_DOMINO_in_CIRCLE	Parallel run loop
auto	2.0338761676062855	0.0	discard	5_5_in_CIRCLE	Parallel run loop
auto	2.9259899367556788	0.0	discard	7_5_in_DOMINO	Parallel run loop
auto	3.6123575178296905	0.0	discard	11_6_in_CIRCLE	Parallel run loop
auto	3.4175597497180172	0.0	discard	6_6_in_DOMINO	Parallel run loop
auto	1.6257511872443808	0.0	discard	5_5_in_8	Parallel run loop
auto	4.935840344181789	0.0	keep	29_5_in_6	Parallel run loop
auto	4.670510607070165	0.0	keep	26_5_in_6	Parallel run loop
auto	4.067430878148075	0.0	discard	9_6_in_DOMINO	Parallel run loop
auto	2.9988689333566723	0.0	discard	6_8_in_8	Parallel run loop
auto	5.105433105858407	0.0	keep	31_5_in_6	Parallel run loop
auto	3.5012349670061145	0.0	discard	10_6_in_CIRCLE	Parallel run loop
auto	2.715199605587582	0.0	discard	5_8_in_8	Parallel run loop
auto	3.5764417535910717	0.0	discard	25_DOMINO_in_8	Parallel run loop
auto	3.3194742793762795	0.0	discard	9_6_in_CIRCLE	Parallel run loop
auto	3.833926104130867	0.0	discard	29_DOMINO_in_8	Parallel run loop
auto	3.727320758878269	0.0	discard	5_8_in_6	Parallel run loop
auto	4.94557232614842	0.0	discard	9_8_in_6	Parallel run loop
auto	4.904368447733293	0.0	discard	11_8_in_CIRCLE	Parallel run loop
auto	2.232167754713471	0.0	discard	6_5_in_CIRCLE	Parallel run loop
auto	5.839105042742959	0.0	discard	10_8_in_DOMINO	Parallel run loop
auto	3.3927411887210233	0.0	discard	5_8_in_CIRCLE	Parallel run loop
auto	2.227600303864269	0.0	discard	5_5_in_6	Parallel run loop
auto	3.945980521708767	0.0	discard	11_8_in_8	Parallel run loop
auto	3.528139528444775	0.0	discard	10_5_in_DOMINO	Parallel run loop
auto	3.712322839747455	0.0	discard	6_8_in_CIRCLE	Parallel run loop
auto	4.480024298540383	0.0	discard	9_8_in_CIRCLE	Parallel run loop
auto	3.341942287083622	0.0	discard	9_5_in_DOMINO	Parallel run loop
auto	3.2531176663263763	0.0	discard	5_6_in_DOMINO	Parallel run loop
auto	1.7887272021501535	0.0	discard	6_5_in_8	Parallel run loop
auto	4.293483619432756	0.0	discard	5_8_in_DOMINO	Parallel run loop
auto	4.085091429602335	0.0	discard	31_DOMINO_in_8	Parallel run loop
auto	2.482256626695394	0.0	discard	8_5_in_CIRCLE	Parallel run loop
auto	2.7056475688823127	0.0	discard	9_5_in_CIRCLE	Parallel run loop
auto	2.4843071937359382	0.0	discard	5_6_in_CIRCLE	Parallel run loop
auto	2.6981213339973915	0.0	discard	6_5_in_DOMINO	Parallel run loop
auto	4.514862304517881	0.0	discard	6_8_in_DOMINO	Parallel run loop
auto	1.717814742322048	0.0	discard	5_DOMINO_in_8	Parallel run loop
auto	4.578789919294264	0.0	discard	8_8_in_6	Parallel run loop
auto	2.4783826951247696	0.0	discard	5_5_in_DOMINO	Parallel run loop
auto	2.0338761676062855	0.0	discard	5_5_in_CIRCLE	Parallel run loop
auto	4.513254229052472	0.0	discard	11_6_in_DOMINO	Parallel run loop
auto	4.935311761871978	0.0	keep	29_5_in_6	Parallel run loop
auto	3.4175597497180172	0.0	discard	6_6_in_DOMINO	Parallel run loop
auto	4.670247784685389	0.0	keep	26_5_in_6	Parallel run loop
auto	1.6257511872443808	0.0	discard	5_5_in_8	Parallel run loop
auto	2.9988689333566723	0.0	discard	6_8_in_8	Parallel run loop
auto	2.9047374925098137	0.0	discard	11_5_in_CIRCLE	Parallel run loop
auto	5.362635247289482	0.0	discard	11_8_in_6	Parallel run loop
auto	3.833926104130867	0.0	discard	29_DOMINO_in_8	Parallel run loop
auto	5.10471473898235	0.0	keep	31_5_in_6	Parallel run loop
auto	3.9623805299701846	0.0	discard	6_8_in_6	Parallel run loop
auto	2.715199605587582	0.0	discard	5_8_in_8	Parallel run loop
auto	3.6123575178296905	0.0	discard	11_6_in_CIRCLE	Parallel run loop
auto	3.5012349670061145	0.0	discard	10_6_in_CIRCLE	Parallel run loop
auto	3.3194742793762795	0.0	discard	9_6_in_CIRCLE	Parallel run loop
auto	2.731573847783613	0.0	discard	8_5_in_6	Parallel run loop
auto	3.727320758878269	0.0	discard	5_8_in_6	Parallel run loop
auto	2.9259899367556788	0.0	discard	7_5_in_DOMINO	Parallel run loop
auto	4.94557232614842	0.0	discard	9_8_in_6	Parallel run loop
auto	2.232167754713471	0.0	discard	6_5_in_CIRCLE	Parallel run loop
auto	3.3468360532778014	0.0	discard	8_5_in_5	Parallel run loop
auto	2.227600303864269	0.0	discard	5_5_in_6	Parallel run loop
auto	4.067430878148075	0.0	discard	9_6_in_DOMINO	Parallel run loop
auto	3.3927411887210233	0.0	discard	5_8_in_CIRCLE	Parallel run loop
auto	4.904368447733293	0.0	discard	11_8_in_CIRCLE	Parallel run loop
auto	3.528139528444775	0.0	discard	10_5_in_DOMINO	Parallel run loop
auto	3.712322839747455	0.0	discard	6_8_in_CIRCLE	Parallel run loop
auto	4.480024298540383	0.0	discard	9_8_in_CIRCLE	Parallel run loop
auto	3.341942287083622	0.0	discard	9_5_in_DOMINO	Parallel run loop
auto	1.7887272021501535	0.0	discard	6_5_in_8	Parallel run loop
auto	5.5038150704551665	0.0	discard	9_8_in_DOMINO	Parallel run loop
auto	2.8096957407169842	0.0	discard	10_5_in_CIRCLE	Parallel run loop
auto	2.897262290237134	0.0	discard	6_6_in_6	Parallel run loop
auto	2.7056475688823127	0.0	discard	9_5_in_CIRCLE	Parallel run loop
auto	2.4843071937359382	0.0	discard	5_6_in_CIRCLE	Parallel run loop
auto	5.839105042742959	0.0	discard	10_8_in_DOMINO	Parallel run loop
auto	3.945980521708767	0.0	discard	11_8_in_8	Parallel run loop
auto	2.3343366670282952	0.0	keep	11_5_in_8	Parallel run loop
auto	4.934824087205828	0.0	keep	29_5_in_6	Parallel run loop
auto	4.670005476807664	0.0	keep	26_5_in_6	Parallel run loop
auto	1.6257511872443808	0.0	discard	5_5_in_8	Parallel run loop
auto	2.6981213339973915	0.0	discard	6_5_in_DOMINO	Parallel run loop
auto	2.482256626695394	0.0	discard	8_5_in_CIRCLE	Parallel run loop
auto	1.717814742322048	0.0	discard	5_DOMINO_in_8	Parallel run loop
auto	4.144759796535852	0.0	discard	8_8_in_CIRCLE	Parallel run loop
auto	4.514862304517881	0.0	discard	6_8_in_DOMINO	Parallel run loop
auto	3.833926104130867	0.0	discard	29_DOMINO_in_8	Parallel run loop
auto	5.083417758613617	0.0	discard	10_8_in_6	Parallel run loop
auto	4.578789919294264	0.0	discard	8_8_in_6	Parallel run loop
auto	5.137266596489844	0.0	discard	31_5_in_6	Parallel run loop
auto	2.4783826951247696	0.0	discard	5_5_in_DOMINO	Parallel run loop
auto	2.715199605587582	0.0	discard	5_8_in_8	Parallel run loop
auto	5.362635247289482	0.0	discard	11_8_in_6	Parallel run loop
auto	4.513254229052472	0.0	discard	11_6_in_DOMINO	Parallel run loop
auto	3.5012349670061145	0.0	discard	10_6_in_CIRCLE	Parallel run loop
auto	3.3194742793762795	0.0	discard	9_6_in_CIRCLE	Parallel run loop
auto	3.625554767546156	0.0	discard	11_5_in_DOMINO	Parallel run loop
auto	2.9047374925098137	0.0	discard	11_5_in_CIRCLE	Parallel run loop
auto	3.9623805299701846	0.0	discard	6_8_in_6	Parallel run loop
auto	3.6123575178296905	0.0	discard	11_6_in_CIRCLE	Parallel run loop
auto	4.94557232614842	0.0	discard	9_8_in_6	Parallel run loop
auto	2.9259899367556788	0.0	discard	7_5_in_DOMINO	Parallel run loop
auto	2.731573847783613	0.0	discard	8_5_in_6	Parallel run loop
auto	3.0848025018440732	0.0	discard	8_5_in_DOMINO	Parallel run loop
auto	6.324910948264516	0.0	discard	12_8_in_DOMINO	Parallel run loop
auto	2.301873562409722	0.0	discard	7_5_in_CIRCLE	Parallel run loop
auto	3.7204861167355805	0.0	discard	10_8_in_8	Parallel run loop
auto	3.528139528444775	0.0	discard	10_5_in_DOMINO	Parallel run loop
auto	4.480024298540383	0.0	discard	9_8_in_CIRCLE	Parallel run loop
auto	2.2118080678298013	0.0	discard	10_5_in_8	Parallel run loop
auto	4.934374206895752	0.0	keep	29_5_in_6	Parallel run loop
auto	3.341942287083622	0.0	discard	9_5_in_DOMINO	Parallel run loop
auto	3.177349149882355	0.0	discard	11_5_in_6	Parallel run loop
auto	4.825278353773088	0.0	discard	13_6_in_DOMINO	Parallel run loop
auto	3.3468360532778014	0.0	discard	8_5_in_5	Parallel run loop
auto	4.6697820960996435	0.0	keep	26_5_in_6	Parallel run loop
auto	4.067430878148075	0.0	discard	9_6_in_DOMINO	Parallel run loop
auto	2.8096957407169842	0.0	discard	10_5_in_CIRCLE	Parallel run loop
auto	4.904368447733293	0.0	discard	11_8_in_CIRCLE	Parallel run loop
auto	5.5038150704551665	0.0	discard	9_8_in_DOMINO	Parallel run loop
auto	3.833926104130867	0.0	discard	29_DOMINO_in_8	Parallel run loop
auto	2.897262290237134	0.0	discard	6_6_in_6	Parallel run loop
auto	5.262303631584142	0.0	discard	13_8_in_CIRCLE	Parallel run loop
auto	2.005203530355048	0.0	keep	7_DOMINO_in_8	Parallel run loop
auto	6.04077488592788	0.0	discard	11_8_in_DOMINO	Parallel run loop
auto	2.0959010073397857	0.0	discard	9_5_in_8	Parallel run loop
auto	5.839105042742959	0.0	discard	10_8_in_DOMINO	Parallel run loop
auto	2.3335048277690014	0.0	keep	11_5_in_8	Parallel run loop
auto	2.482256626695394	0.0	discard	8_5_in_CIRCLE	Parallel run loop
auto	3.945980521708767	0.0	discard	11_8_in_8	Parallel run loop
auto	5.267893853748814	0.0	discard	7_8_in_5	Parallel run loop
auto	5.632417990309691	0.0	discard	8_8_in_5	Parallel run loop
auto	2.6981213339973915	0.0	discard	6_5_in_DOMINO	Parallel run loop
auto	4.514862304517881	0.0	discard	6_8_in_DOMINO	Parallel run loop
auto	4.626004523607166	0.0	discard	12_6_in_DOMINO	Parallel run loop
auto	4.144759796535852	0.0	discard	8_8_in_CIRCLE	Parallel run loop
auto	2.6752287330593756	0.0	discard	5_6_in_6	Parallel run loop
auto	4.578789919294264	0.0	discard	8_8_in_6	Parallel run loop
auto	1.717814742322048	0.0	discard	5_DOMINO_in_8	Parallel run loop
auto	2.4783826951247696	0.0	discard	5_5_in_DOMINO	Parallel run loop
auto	4.513254229052472	0.0	discard	11_6_in_DOMINO	Parallel run loop
auto	5.083417758613617	0.0	discard	10_8_in_6	Parallel run loop
auto	3.7576743076763917	0.0	discard	12_5_in_DOMINO	Parallel run loop
auto	3.625554767546156	0.0	discard	11_5_in_DOMINO	Parallel run loop
auto	5.362635247289482	0.0	discard	11_8_in_6	Parallel run loop
auto	2.9047374925098137	0.0	discard	11_5_in_CIRCLE	Parallel run loop
auto	3.9623805299701846	0.0	discard	6_8_in_6	Parallel run loop
auto	4.933959236786185	0.0	keep	29_5_in_6	Parallel run loop
auto	2.731573847783613	0.0	discard	8_5_in_6	Parallel run loop
auto	3.0848025018440732	0.0	discard	8_5_in_DOMINO	Parallel run loop
auto	2.9259899367556788	0.0	discard	7_5_in_DOMINO	Parallel run loop
auto	4.669576175961809	0.0	keep	26_5_in_6	Parallel run loop
auto	3.6123575178296905	0.0	discard	11_6_in_CIRCLE	Parallel run loop
auto	2.8090852688546946	0.0	discard	5_DOMINO_in_5	Parallel run loop
auto	3.3390189274621664	0.0	keep	15_5_in_CIRCLE	Parallel run loop
auto	3.698242161628505	0.0	discard	10_5_in_5	Parallel run loop
auto	3.7204861167355805	0.0	discard	10_8_in_8	Parallel run loop
auto	2.301873562409722	0.0	discard	7_5_in_CIRCLE	Parallel run loop
auto	3.0901213766355777	0.0	discard	7_5_in_5	Parallel run loop
auto	6.324910948264516	0.0	discard	12_8_in_DOMINO	Parallel run loop
auto	2.2118080678298013	0.0	discard	10_5_in_8	Parallel run loop
auto	2.8825199114397533	0.0	discard	11_6_in_8	Parallel run loop
auto	5.028859189736653	0.0	discard	12_8_in_CIRCLE	Parallel run loop
auto	3.561048493188362	0.0	discard	6_6_in_5	Parallel run loop
auto	4.825278353773088	0.0	discard	13_6_in_DOMINO	Parallel run loop
auto	3.177349149882355	0.0	discard	11_5_in_6	Parallel run loop
auto	3.3468360532778014	0.0	discard	8_5_in_5	Parallel run loop
auto	4.067430878148075	0.0	discard	9_6_in_DOMINO	Parallel run loop
auto	5.262303631584142	0.0	discard	13_8_in_CIRCLE	Parallel run loop
auto	4.904368447733293	0.0	discard	11_8_in_CIRCLE	Parallel run loop
auto	5.5038150704551665	0.0	discard	9_8_in_DOMINO	Parallel run loop
auto	4.7818533607437725	0.0	discard	6_8_in_5	Parallel run loop
auto	2.8096957407169842	0.0	discard	10_5_in_CIRCLE	Parallel run loop
auto	5.984846717852844	0.0	discard	17_8_in_CIRCLE	Parallel run loop
auto	2.897262290237134	0.0	discard	6_6_in_6	Parallel run loop
auto	6.524385953685497	0.0	discard	13_8_in_DOMINO	Parallel run loop
auto	6.16650656709864	0.0	discard	15_8_in_6	Parallel run loop
auto	4.356225059804148	0.0	discard	9_6_in_5	Parallel run loop
auto	2.0959010073397857	0.0	discard	9_5_in_8	Parallel run loop
auto	5.839105042742959	0.0	discard	10_8_in_DOMINO	Parallel run loop
auto	2.0051998417052825	0.0	keep	7_DOMINO_in_8	Parallel run loop
auto	2.3327346915720666	0.0	keep	11_5_in_8	Parallel run loop
auto	2.482256626695394	0.0	discard	8_5_in_CIRCLE	Parallel run loop
auto	5.267893853748814	0.0	discard	7_8_in_5	Parallel run loop
auto	3.0249325226413832	0.0	discard	12_5_in_CIRCLE	Parallel run loop
auto	6.04077488592788	0.0	discard	11_8_in_DOMINO	Parallel run loop
auto	3.945980521708767	0.0	discard	11_8_in_8	Parallel run loop
auto	4.9335765061479835	0.0	keep	29_5_in_6	Parallel run loop
auto	2.6981213339973915	0.0	discard	6_5_in_DOMINO	Parallel run loop
auto	5.632417990309691	0.0	discard	8_8_in_5	Parallel run loop
auto	1.961731631080694	0.0	discard	8_5_in_8	Parallel run loop
auto	4.144759796535852	0.0	discard	8_8_in_CIRCLE	Parallel run loop
auto	3.8942198794588005	0.0	discard	13_5_in_DOMINO	Parallel run loop
auto	4.626004523607166	0.0	discard	12_6_in_DOMINO	Parallel run loop
auto	4.578789919294264	0.0	discard	8_8_in_6	Parallel run loop
auto	4.514862304517881	0.0	discard	6_8_in_DOMINO	Parallel run loop
auto	2.9900974090750925	0.0	discard	8_6_in_CIRCLE	Parallel run loop
auto	3.8131538775656013	0.0	discard	7_6_in_5	Parallel run loop
auto	3.237983563377362	0.0	discard	14_5_in_CIRCLE	Parallel run loop
auto	5.083417758613617	0.0	discard	10_8_in_6	Parallel run loop
auto	4.1854014009789955	0.0	discard	10_6_in_DOMINO	Parallel run loop
auto	2.685060232664588	0.0	discard	15_5_in_8	Parallel run loop
auto	4.090319119219042	0.0	discard	15_6_in_CIRCLE	Parallel run loop
auto	3.7576743076763917	0.0	discard	12_5_in_DOMINO	Parallel run loop
auto	3.625554767546156	0.0	discard	11_5_in_DOMINO	Parallel run loop
auto	5.362635247289482	0.0	discard	11_8_in_6	Parallel run loop
auto	2.9047374925098137	0.0	discard	11_5_in_CIRCLE	Parallel run loop
auto	2.7565782330234603	0.0	discard	10_6_in_8	Parallel run loop
auto	2.9269635902496747	0.0	discard	6_DOMINO_in_DOMINO	Parallel run loop
auto	3.9623805299701846	0.0	discard	6_8_in_6	Parallel run loop
auto	3.2878617804289507	0.0	discard	8_8_in_8	Parallel run loop
auto	2.334325046090789	0.0	discard	6_5_in_6	Parallel run loop
auto	2.731573847783613	0.0	discard	8_5_in_6	Parallel run loop
auto	3.0848025018440732	0.0	discard	8_5_in_DOMINO	Parallel run loop
auto	6.735575862316236	0.0	discard	12_8_in_5	Parallel run loop
auto	3.698242161628505	0.0	discard	10_5_in_5	Parallel run loop
auto	3.345343483244312	0.0	discard	15_5_in_CIRCLE	Parallel run loop
auto	4.18778997474247	0.0	discard	13_8_in_8	Parallel run loop
auto	2.8090852688546946	0.0	discard	5_DOMINO_in_5	Parallel run loop
auto	4.348618287689763	0.0	discard	5_8_in_5	Parallel run loop
auto	3.7204861167355805	0.0	discard	10_8_in_8	Parallel run loop
auto	6.324910948264516	0.0	discard	12_8_in_DOMINO	Parallel run loop
auto	3.4941454320093825	0.0	discard	7_6_in_DOMINO	Parallel run loop
auto	3.749715252387216	0.0	discard	10_6_in_6	Parallel run loop
auto	5.028859189736653	0.0	discard	12_8_in_CIRCLE	Parallel run loop
auto	2.301873562409722	0.0	discard	7_5_in_CIRCLE	Parallel run loop
auto	3.229490810765495	0.0	discard	5_6_in_5	Parallel run loop
auto	3.3262785051421733	0.0	discard	8_6_in_6	Parallel run loop
auto	4.933223542875898	0.0	keep	29_5_in_6	Parallel run loop
auto	3.0901213766355777	0.0	discard	7_5_in_5	Parallel run loop
auto	2.8825199114397533	0.0	discard	11_6_in_8	Parallel run loop
auto	2.2118080678298013	0.0	discard	10_5_in_8	Parallel run loop
auto	4.825278353773088	0.0	discard	13_6_in_DOMINO	Parallel run loop
auto	3.177349149882355	0.0	discard	11_5_in_6	Parallel run loop
auto	3.561048493188362	0.0	discard	6_6_in_5	Parallel run loop
auto	3.214216984114548	0.0	discard	10_DOMINO_in_6	Parallel run loop
auto	4.937376466774466	0.0	discard	12_6_in_5	Parallel run loop
auto	3.3468360532778014	0.0	discard	8_5_in_5	Parallel run loop
auto	5.262303631584142	0.0	discard	13_8_in_CIRCLE	Parallel run loop
auto	5.5038150704551665	0.0	discard	9_8_in_DOMINO	Parallel run loop
auto	4.7818533607437725	0.0	discard	6_8_in_5	Parallel run loop
auto	4.016020462419165	0.0	discard	12_8_in_8	Parallel run loop
auto	5.984846717852844	0.0	discard	17_8_in_CIRCLE	Parallel run loop
auto	1.8261429737118473	0.0	discard	7_5_in_8	Parallel run loop
auto	2.897262290237134	0.0	discard	6_6_in_6	Parallel run loop
auto	6.16650656709864	0.0	discard	15_8_in_6	Parallel run loop
auto	6.524385953685497	0.0	discard	13_8_in_DOMINO	Parallel run loop
auto	2.0959010073397857	0.0	discard	9_5_in_8	Parallel run loop
auto	4.356225059804148	0.0	discard	9_6_in_5	Parallel run loop
auto	6.04077488592788	0.0	discard	11_8_in_DOMINO	Parallel run loop
auto	3.4285041744862585	0.0	discard	13_5_in_6	Parallel run loop
auto	2.005199643952856	0.0	keep	7_DOMINO_in_8	Parallel run loop
auto	2.332021940481986	0.0	keep	11_5_in_8	Parallel run loop
auto	3.0249325226413832	0.0	discard	12_5_in_CIRCLE	Parallel run loop
auto	3.087624644501296	0.0	discard	13_6_in_8	Parallel run loop
auto	6.988532146169312	0.0	discard	13_8_in_5	Parallel run loop
auto	8.238698760322144	0.0	discard	21_8_in_DOMINO	Parallel run loop
auto	3.4411605671771976	0.0	discard	16_5_in_CIRCLE	Parallel run loop
auto	1.961731631080694	0.0	discard	8_5_in_8	Parallel run loop
auto	2.42115433681355	0.0	discard	8_6_in_8	Parallel run loop
auto	4.626004523607166	0.0	discard	12_6_in_DOMINO	Parallel run loop
auto	3.8942198794588005	0.0	discard	13_5_in_DOMINO	Parallel run loop
auto	4.144759796535852	0.0	discard	8_8_in_CIRCLE	Parallel run loop
auto	3.8131538775656013	0.0	discard	7_6_in_5	Parallel run loop
