commit	score	memory_gb	status	problem	description
auto	4.858633932434746	0.0	discard	47_3_in_5	Parallel run loop
auto	4.4440228639448955	0.0	discard	30_3_in_4	Parallel run loop
auto	4.147705344112939	0.0	discard	37_3_in_5	Parallel run loop
auto	5.094304770686311	0.0	discard	39_3_in_4	Parallel run loop
auto	2.184171722650065	0.0	discard	11_3_in_5	Parallel run loop
auto	3.2750199589980906	0.0	discard	24_3_in_5	Parallel run loop
auto	3.6629550632760237	0.0	discard	21_3_in_4	Parallel run loop
auto	4.748943729194389	0.0	discard	34_3_in_4	Parallel run loop
auto	5.844945900783133	0.0	discard	47_3_in_4	Parallel run loop
auto	4.982934915765285	0.0	discard	49_3_in_5	Parallel run loop
auto	2.64394693212708	0.0	discard	16_3_in_5	Parallel run loop
auto	2.2835352722958264	0.0	discard	12_3_in_5	Parallel run loop
auto	2.857172260633524	0.0	discard	13_3_in_4	Parallel run loop
auto	4.30716242771793	0.0	discard	40_3_in_5	Parallel run loop
auto	4.613133840994336	0.0	discard	45_3_in_5	Parallel run loop
auto	2.9697279865619106	0.0	discard	20_3_in_5	Parallel run loop
auto	4.190285146811472	0.0	discard	38_3_in_5	Parallel run loop
auto	3.474508784678801	0.0	discard	19_3_in_4	Parallel run loop
auto	3.687757602403319	0.0	discard	30_3_in_5	Parallel run loop
auto	5.078806284703757	0.0	discard	38_3_in_4	Parallel run loop
auto	4.122640064869474	0.0	discard	26_3_in_4	Parallel run loop
auto	3.5600359230024075	0.0	discard	28_3_in_5	Parallel run loop
auto	5.045377507433841	0.0	discard	50_3_in_5	Parallel run loop
auto	4.916285772116323	0.0	discard	36_3_in_4	Parallel run loop
auto	4.504087871818774	0.0	discard	42_3_in_5	Parallel run loop
auto	5.425703184487186	0.0	discard	44_3_in_4	Parallel run loop
auto	3.0612282551556413	0.0	discard	21_3_in_5	Parallel run loop
auto	4.5163165537580205	0.0	discard	31_3_in_4	Parallel run loop
auto	5.767484011890236	0.0	discard	46_3_in_4	Parallel run loop
auto	4.988973209871861	0.0	discard	37_3_in_4	Parallel run loop
auto	3.685392720687508	0.0	discard	21_3_in_4	Parallel run loop
auto	5.641211908500692	0.0	discard	45_3_in_4	Parallel run loop
auto	4.848533125673035	0.0	discard	47_3_in_5	Parallel run loop
auto	4.678231595950284	0.0	discard	33_3_in_4	Parallel run loop
auto	4.145332669846357	0.0	discard	37_3_in_5	Parallel run loop
auto	3.2820786341842894	0.0	discard	24_3_in_5	Parallel run loop
auto	2.8195554214056067	0.0	discard	18_3_in_5	Parallel run loop
auto	4.819388904210778	0.0	discard	35_3_in_4	Parallel run loop
auto	3.4150015380228216	0.0	discard	26_3_in_5	Parallel run loop
auto	4.5146292273187525	0.0	discard	43_3_in_5	Parallel run loop
auto	5.9036795337042145	0.0	discard	48_3_in_4	Parallel run loop
auto	5.154075676664995	0.0	discard	39_3_in_4	Parallel run loop
auto	3.3471968748225236	0.0	discard	25_3_in_5	Parallel run loop
auto	4.360782573928273	0.0	discard	29_3_in_4	Parallel run loop
auto	2.970916674926935	0.0	discard	20_3_in_5	Parallel run loop
auto	4.332128195578872	0.0	discard	40_3_in_5	Parallel run loop
auto	2.0827842193545694	0.0	discard	10_3_in_5	Parallel run loop
auto	4.65606965070408	0.0	discard	45_3_in_5	Parallel run loop
auto	2.8576562711532527	0.0	discard	13_3_in_4	Parallel run loop
auto	3.462905304592383	0.0	discard	19_3_in_4	Parallel run loop
auto	3.6883623682797393	0.0	discard	30_3_in_5	Parallel run loop
auto	3.9478202960621878	0.0	discard	24_3_in_4	Parallel run loop
auto	2.3759161713386785	0.0	discard	13_3_in_5	Parallel run loop
auto	3.2083092015967676	0.0	discard	23_3_in_5	Parallel run loop
auto	3.952421238418229	0.0	discard	34_3_in_5	Parallel run loop
auto	4.593160375752356	0.0	discard	32_3_in_4	Parallel run loop
auto	1.7434637198553218	0.0	discard	7_3_in_5	Parallel run loop
auto	5.587114090265403	0.0	discard	44_3_in_4	Parallel run loop
auto	4.03838465144723	0.0	discard	25_3_in_4	Parallel run loop
auto	4.991167690052894	0.0	discard	37_3_in_4	Parallel run loop
auto	3.0622811325187915	0.0	discard	21_3_in_5	Parallel run loop
auto	4.2800489006868725	0.0	discard	39_3_in_5	Parallel run loop
auto	2.7282417056955848	0.0	discard	17_3_in_5	Parallel run loop
auto	4.149709091260264	0.0	discard	37_3_in_5	Parallel run loop
auto	3.8631814809791942	0.0	discard	23_3_in_4	Parallel run loop
auto	3.4937588455798774	0.0	discard	27_3_in_5	Parallel run loop
auto	3.755223491226346	0.0	discard	22_3_in_4	Parallel run loop
auto	5.652565821906268	0.0	discard	45_3_in_4	Parallel run loop
auto	4.533641121995398	0.0	discard	43_3_in_5	Parallel run loop
auto	3.348718194835645	0.0	discard	25_3_in_5	Parallel run loop
auto	3.7485014749733994	0.0	discard	31_3_in_5	Parallel run loop
auto	3.421142855456778	0.0	discard	26_3_in_5	Parallel run loop
auto	4.817910965274055	0.0	discard	35_3_in_4	Parallel run loop
auto	4.1997119232400495	0.0	discard	27_3_in_4	Parallel run loop
auto	2.9822170613945995	0.0	discard	20_3_in_5	Parallel run loop
auto	2.4656384089299186	0.0	discard	14_3_in_5	Parallel run loop
auto	2.554117840367639	0.0	discard	15_3_in_5	Parallel run loop
auto	3.3789459171185836	0.0	discard	18_3_in_4	Parallel run loop
auto	3.6233960772411287	0.0	discard	29_3_in_5	Parallel run loop
auto	1.4735921228588431	0.0	discard	5_3_in_5	Parallel run loop
auto	3.4838464956253423	0.0	discard	19_3_in_4	Parallel run loop
auto	1.6123349313678752	0.0	discard	6_3_in_5	Parallel run loop
auto	4.019919165743542	0.0	discard	35_3_in_5	Parallel run loop
auto	3.212584330164216	0.0	discard	23_3_in_5	Parallel run loop
auto	3.6874451583561685	0.0	discard	30_3_in_5	Parallel run loop
auto	5.498037759550884	0.0	discard	43_3_in_4	Parallel run loop
auto	4.749306097096103	0.0	discard	34_3_in_4	Parallel run loop
auto	4.435620517697065	0.0	discard	30_3_in_4	Parallel run loop
auto	4.968962311953534	0.0	discard	49_3_in_5	Parallel run loop
auto	3.062180116199932	0.0	discard	21_3_in_5	Parallel run loop
auto	5.700649428148879	0.0	discard	47_3_in_4	Parallel run loop
auto	5.006696558271829	0.0	discard	37_3_in_4	Parallel run loop
auto	3.141171387812385	0.0	discard	22_3_in_5	Parallel run loop
auto	4.316813081800303	0.0	keep	41_3_in_5	Parallel run loop
auto	2.732921212646302	0.0	discard	17_3_in_5	Parallel run loop
auto	5.098313459946513	0.0	discard	50_3_in_5	Parallel run loop
auto	3.7769642343208325	0.0	discard	22_3_in_4	Parallel run loop
auto	5.687717369580594	0.0	discard	45_3_in_4	Parallel run loop
auto	2.894909454675583	0.0	discard	19_3_in_5	Parallel run loop
auto	4.476104907860522	0.0	discard	43_3_in_5	Parallel run loop
auto	5.219735338687028	0.0	discard	40_3_in_4	Parallel run loop
auto	4.893050200046	0.0	discard	36_3_in_4	Parallel run loop
auto	3.4232476901540427	0.0	discard	26_3_in_5	Parallel run loop
auto	5.773367334754875	0.0	discard	46_3_in_4	Parallel run loop
auto	3.6257740685653173	0.0	discard	29_3_in_5	Parallel run loop
auto	3.756086451726561	0.0	discard	31_3_in_5	Parallel run loop
auto	2.554976098725148	0.0	discard	15_3_in_5	Parallel run loop
auto	2.4671682783589723	0.0	discard	14_3_in_5	Parallel run loop
auto	2.97529543497079	0.0	discard	20_3_in_5	Parallel run loop
auto	1.6123349299343197	0.0	discard	6_3_in_5	Parallel run loop
auto	4.659461053485593	0.0	discard	33_3_in_4	Parallel run loop
auto	4.2014683007446045	0.0	discard	27_3_in_4	Parallel run loop
auto	3.4717146853976826	0.0	discard	19_3_in_4	Parallel run loop
auto	5.292460736394233	0.0	discard	41_3_in_4	Parallel run loop
auto	2.816059270699699	0.0	discard	18_3_in_5	Parallel run loop
auto	3.6922116570567276	0.0	discard	30_3_in_5	Parallel run loop
auto	5.996814663389013	0.0	discard	48_3_in_4	Parallel run loop
auto	4.35687640760167	0.0	discard	29_3_in_4	Parallel run loop
auto	4.440409463776088	0.0	discard	30_3_in_4	Parallel run loop
auto	5.8388053335596775	0.0	discard	47_3_in_4	Parallel run loop
auto	4.915319526260801	0.0	discard	48_3_in_5	Parallel run loop
auto	4.771053903517818	0.0	discard	34_3_in_4	Parallel run loop
auto	2.375691764586342	0.0	discard	13_3_in_5	Parallel run loop
auto	2.0822569751242352	0.0	discard	10_3_in_5	Parallel run loop
auto	5.45865751482111	0.0	discard	42_3_in_4	Parallel run loop
auto	3.950187933454905	0.0	discard	24_3_in_4	Parallel run loop
auto	2.725202788812977	0.0	discard	17_3_in_5	Parallel run loop
auto	4.3787075983159145	0.0	discard	41_3_in_5	Parallel run loop
auto	4.036343853502161	0.0	discard	25_3_in_4	Parallel run loop
auto	1.741521072952752	0.0	discard	7_3_in_5	Parallel run loop
auto	4.573434105529997	0.0	discard	43_3_in_5	Parallel run loop
auto	3.9576322908418824	0.0	discard	34_3_in_5	Parallel run loop
auto	1.9752512350791838	0.0	discard	9_3_in_5	Parallel run loop
auto	2.883513019150743	0.0	discard	19_3_in_5	Parallel run loop
auto	4.284345381131057	0.0	discard	39_3_in_5	Parallel run loop
auto	4.595390776663955	0.0	discard	32_3_in_4	Parallel run loop
auto	2.2827412939746887	0.0	discard	12_3_in_5	Parallel run loop
auto	3.852570452883397	0.0	discard	23_3_in_4	Parallel run loop
auto	3.4858192357230973	0.0	discard	27_3_in_5	Parallel run loop
auto	2.4643904811029045	0.0	discard	14_3_in_5	Parallel run loop
auto	4.794243437084722	0.0	discard	46_3_in_5	Parallel run loop
auto	2.5565961455273465	0.0	discard	15_3_in_5	Parallel run loop
auto	2.978466432126359	0.0	discard	20_3_in_5	Parallel run loop
auto	1.6123349279763657	0.0	discard	6_3_in_5	Parallel run loop
auto	3.472794472180964	0.0	discard	19_3_in_4	Parallel run loop
auto	5.236125225111304	0.0	discard	41_3_in_4	Parallel run loop
auto	4.216205350975018	0.0	discard	38_3_in_5	Parallel run loop
auto	4.35771172124694	0.0	discard	29_3_in_4	Parallel run loop
auto	3.55586260105812	0.0	discard	28_3_in_5	Parallel run loop
auto	3.3864148825032845	0.0	discard	18_3_in_4	Parallel run loop
auto	4.437106973868311	0.0	discard	30_3_in_4	Parallel run loop
auto	4.965018560660275	0.0	discard	48_3_in_5	Parallel run loop
auto	1.474690715983075	0.0	discard	5_3_in_5	Parallel run loop
auto	5.899132366333242	0.0	discard	47_3_in_4	Parallel run loop
auto	2.0817127899195804	0.0	discard	10_3_in_5	Parallel run loop
auto	4.521185936616594	0.0	discard	31_3_in_4	Parallel run loop
auto	4.265844969663073	0.0	discard	28_3_in_4	Parallel run loop
auto	4.4294758905232285	0.0	discard	41_3_in_5	Parallel run loop
auto	2.730005953563134	0.0	discard	17_3_in_5	Parallel run loop
auto	4.011561035247774	0.0	discard	35_3_in_5	Parallel run loop
auto	4.03515459206874	0.0	discard	25_3_in_4	Parallel run loop
auto	2.905288788387242	0.0	discard	19_3_in_5	Parallel run loop
auto	3.8208876341285665	0.0	discard	32_3_in_5	Parallel run loop
auto	3.2804878225927885	0.0	discard	24_3_in_5	Parallel run loop
auto	4.057445400465329	0.0	discard	36_3_in_5	Parallel run loop
auto	3.686732995068007	0.0	discard	21_3_in_4	Parallel run loop
auto	5.510147045733704	0.0	discard	43_3_in_4	Parallel run loop
auto	2.5526558910577246	0.0	discard	15_3_in_5	Parallel run loop
auto	4.955720338206293	0.0	discard	49_3_in_5	Parallel run loop
auto	2.465805334774626	0.0	discard	14_3_in_5	Parallel run loop
auto	3.4801878912293467	0.0	discard	19_3_in_4	Parallel run loop
auto	1.6123349320824532	0.0	discard	6_3_in_5	Parallel run loop
auto	3.4899370867072834	0.0	discard	27_3_in_5	Parallel run loop
auto	4.340644457214416	0.0	discard	40_3_in_5	Parallel run loop
auto	3.135748922436423	0.0	discard	22_3_in_5	Parallel run loop
auto	5.067400848777269	0.0	discard	50_3_in_5	Parallel run loop
auto	5.5616959847086385	0.0	discard	44_3_in_4	Parallel run loop
auto	5.309889761051815	0.0	discard	41_3_in_4	Parallel run loop
auto	3.3912538584961216	0.0	discard	18_3_in_4	Parallel run loop
auto	3.5596636359716927	0.0	discard	28_3_in_5	Parallel run loop
auto	5.221083367066932	0.0	discard	40_3_in_4	Parallel run loop
auto	4.361812225978763	0.0	discard	29_3_in_4	Parallel run loop
auto	4.9136849345560885	0.0	discard	36_3_in_4	Parallel run loop
auto	5.761724730717903	0.0	discard	46_3_in_4	Parallel run loop
auto	4.6733234870215465	0.0	discard	33_3_in_4	Parallel run loop
auto	2.644976055172884	0.0	discard	16_3_in_5	Parallel run loop
auto	2.08219773890748	0.0	discard	10_3_in_5	Parallel run loop
auto	4.121073112208134	0.0	discard	26_3_in_4	Parallel run loop
auto	4.4420454264935705	0.0	discard	30_3_in_4	Parallel run loop
auto	4.2857964875290016	0.0	discard	28_3_in_4	Parallel run loop
auto	2.805303726163589	0.0	discard	18_3_in_5	Parallel run loop
auto	4.0396212321334755	0.0	discard	25_3_in_4	Parallel run loop
auto	3.999936532652336	0.0	discard	35_3_in_5	Parallel run loop
auto	4.423751002652764	0.0	discard	42_3_in_5	Parallel run loop
auto	1.8622718685158788	0.0	discard	8_3_in_5	Parallel run loop
auto	3.3563637748525914	0.0	discard	25_3_in_5	Parallel run loop
auto	3.286089232841724	0.0	discard	24_3_in_5	Parallel run loop
auto	4.995271840875416	0.0	discard	49_3_in_5	Parallel run loop
auto	5.06103282471824	0.0	discard	38_3_in_4	Parallel run loop
auto	2.5545624864096395	0.0	discard	15_3_in_5	Parallel run loop
auto	5.882751995651736	0.0	discard	48_3_in_4	Parallel run loop
auto	1.6123349349101614	0.0	discard	6_3_in_5	Parallel run loop
auto	3.4912837301121087	0.0	discard	27_3_in_5	Parallel run loop
auto	2.4689916348980185	0.0	discard	14_3_in_5	Parallel run loop
auto	5.363914101110493	0.0	discard	42_3_in_4	Parallel run loop
auto	5.070686620602649	0.0	discard	50_3_in_5	Parallel run loop
auto	4.598252129690084	0.0	discard	44_3_in_5	Parallel run loop
auto	5.462779863602646	0.0	discard	44_3_in_4	Parallel run loop
auto	3.885228311106944	0.0	discard	33_3_in_5	Parallel run loop
auto	4.772820204095091	0.0	discard	47_3_in_5	Parallel run loop
auto	4.826805841991402	0.0	discard	35_3_in_4	Parallel run loop
auto	3.952293979091918	0.0	discard	24_3_in_4	Parallel run loop
auto	5.254467501146454	0.0	discard	40_3_in_4	Parallel run loop
auto	2.3765127714375365	0.0	discard	13_3_in_5	Parallel run loop
auto	2.6463108675760263	0.0	discard	16_3_in_5	Parallel run loop
auto	3.9394261174932343	0.0	discard	34_3_in_5	Parallel run loop
auto	4.3629594867392765	0.0	discard	29_3_in_4	Parallel run loop
auto	1.7415211009578668	0.0	discard	7_3_in_5	Parallel run loop
auto	5.161762520890138	0.0	discard	39_3_in_4	Parallel run loop
auto	3.1975942416541043	0.0	discard	23_3_in_5	Parallel run loop
auto	4.431070638962291	0.0	discard	30_3_in_4	Parallel run loop
auto	2.8126098176131467	0.0	discard	18_3_in_5	Parallel run loop
auto	4.599393210590975	0.0	discard	32_3_in_4	Parallel run loop
auto	1.9760398125523224	0.0	discard	9_3_in_5	Parallel run loop
auto	2.2810808440121866	0.0	discard	12_3_in_5	Parallel run loop
auto	4.016336491648743	0.0	discard	35_3_in_5	Parallel run loop
auto	2.860265024160977	0.0	discard	13_3_in_4	Parallel run loop
auto	3.287476613692143	0.0	discard	24_3_in_5	Parallel run loop
auto	4.222322307331511	0.0	discard	39_3_in_5	Parallel run loop
auto	4.480614255460139	0.0	discard	42_3_in_5	Parallel run loop
auto	3.854926190318763	0.0	discard	23_3_in_4	Parallel run loop
auto	4.796675665443332	0.0	discard	46_3_in_5	Parallel run loop
auto	3.621480496814348	0.0	discard	29_3_in_5	Parallel run loop
auto	4.204620279683429	0.0	discard	38_3_in_5	Parallel run loop
auto	5.010052131385764	0.0	discard	38_3_in_4	Parallel run loop
auto	5.351987130923804	0.0	discard	42_3_in_4	Parallel run loop
auto	4.789654374972898	0.0	discard	47_3_in_5	Parallel run loop
auto	3.7662217348018805	0.0	discard	22_3_in_4	Parallel run loop
auto	3.7466722799179206	0.0	discard	31_3_in_5	Parallel run loop
auto	4.959106622380635	0.0	discard	50_3_in_5	Parallel run loop
auto	4.187417572184392	0.0	discard	27_3_in_4	Parallel run loop
auto	5.557925153123239	0.0	discard	44_3_in_4	Parallel run loop
auto	1.4725178649101631	0.0	discard	5_3_in_5	Parallel run loop
auto	4.087235607410304	0.0	discard	36_3_in_5	Parallel run loop
auto	4.509919206686737	0.0	discard	31_3_in_4	Parallel run loop
auto	3.822812301971383	0.0	discard	32_3_in_5	Parallel run loop
auto	1.7415210155304008	0.0	discard	7_3_in_5	Parallel run loop
auto	2.3764374263728234	0.0	discard	13_3_in_5	Parallel run loop
auto	3.180663856250184	0.0	discard	23_3_in_5	Parallel run loop
auto	3.9514456378247873	0.0	discard	34_3_in_5	Parallel run loop
auto	5.51660053943319	0.0	discard	43_3_in_4	Parallel run loop
auto	4.7026479186705705	0.0	keep	34_3_in_4	Parallel run loop
auto	4.4420454264935705	0.0	discard	30_3_in_4	Parallel run loop
auto	5.15867440262273	0.0	discard	39_3_in_4	Parallel run loop
auto	3.6826758965898496	0.0	discard	21_3_in_4	Parallel run loop
auto	4.299141849692534	0.0	discard	40_3_in_5	Parallel run loop
auto	4.508673142459209	0.0	discard	42_3_in_5	Parallel run loop
auto	2.2830558297682346	0.0	discard	12_3_in_5	Parallel run loop
auto	4.231976680435012	0.0	discard	39_3_in_5	Parallel run loop
auto	4.0179094473840165	0.0	discard	35_3_in_5	Parallel run loop
auto	3.7657340983740215	0.0	discard	22_3_in_4	Parallel run loop
auto	4.918305164102589	0.0	discard	36_3_in_4	Parallel run loop
auto	3.859694395100448	0.0	discard	23_3_in_4	Parallel run loop
auto	5.418194279361049	0.0	discard	42_3_in_4	Parallel run loop
auto	5.047679713048365	0.0	discard	38_3_in_4	Parallel run loop
auto	4.203997930638958	0.0	discard	38_3_in_5	Parallel run loop
auto	3.626444426091549	0.0	discard	29_3_in_5	Parallel run loop
auto	4.856068097359943	0.0	discard	47_3_in_5	Parallel run loop
auto	3.1353335739043215	0.0	discard	22_3_in_5	Parallel run loop
auto	5.077367152530817	0.0	discard	50_3_in_5	Parallel run loop
auto	4.197402808539317	0.0	discard	27_3_in_4	Parallel run loop
auto	5.773367334754875	0.0	discard	46_3_in_4	Parallel run loop
auto	4.661341374466434	0.0	discard	33_3_in_4	Parallel run loop
auto	5.55597694347707	0.0	discard	45_3_in_4	Parallel run loop
auto	4.513594303294373	0.0	discard	31_3_in_4	Parallel run loop
auto	3.356405761163406	0.0	discard	25_3_in_5	Parallel run loop
auto	4.116983576406783	0.0	discard	26_3_in_4	Parallel run loop
auto	2.183466547943945	0.0	discard	11_3_in_5	Parallel run loop
auto	2.3756974812530425	0.0	discard	13_3_in_5	Parallel run loop
auto	3.2134174461833087	0.0	discard	23_3_in_5	Parallel run loop
auto	1.7415210196029896	0.0	discard	7_3_in_5	Parallel run loop
auto	3.958032673969941	0.0	discard	34_3_in_5	Parallel run loop
auto	1.8622725696553284	0.0	discard	8_3_in_5	Parallel run loop
auto	5.950556431427995	0.0	discard	48_3_in_4	Parallel run loop
auto	4.6350746688466264	0.0	discard	44_3_in_5	Parallel run loop
auto	4.756042031063173	0.0	discard	34_3_in_4	Parallel run loop
auto	4.152743121751796	0.0	discard	37_3_in_5	Parallel run loop
auto	3.751410406159607	0.0	discard	22_3_in_4	Parallel run loop
auto	3.4113123294308285	0.0	discard	26_3_in_5	Parallel run loop
auto	4.2975919889362055	0.0	discard	39_3_in_5	Parallel run loop
auto	4.290959911979342	0.0	discard	40_3_in_5	Parallel run loop
auto	3.8835404225603174	0.0	discard	33_3_in_5	Parallel run loop
auto	4.0210172236270045	0.0	discard	35_3_in_5	Parallel run loop
auto	4.901791756556713	0.0	discard	36_3_in_4	Parallel run loop
auto	3.130470678082201	0.0	discard	22_3_in_5	Parallel run loop
auto	4.800898647872873	0.0	discard	35_3_in_4	Parallel run loop
auto	4.858633932434746	0.0	discard	47_3_in_5	Parallel run loop
auto	5.095473584569553	0.0	discard	38_3_in_4	Parallel run loop
auto	5.418725007353125	0.0	discard	42_3_in_4	Parallel run loop
auto	3.847905602880538	0.0	discard	23_3_in_4	Parallel run loop
auto	4.884675831814643	0.0	discard	50_3_in_5	Parallel run loop
auto	4.655238981951727	0.0	discard	33_3_in_4	Parallel run loop
auto	4.1965857708841545	0.0	discard	27_3_in_4	Parallel run loop
auto	3.9372212343845234	0.0	discard	24_3_in_4	Parallel run loop
auto	4.929000756417977	0.0	discard	48_3_in_5	Parallel run loop
auto	5.55747663389788	0.0	discard	45_3_in_4	Parallel run loop
auto	2.183518504410941	0.0	discard	11_3_in_5	Parallel run loop
auto	2.8582895808386106	0.0	discard	13_3_in_4	Parallel run loop
auto	4.597796327739546	0.0	discard	32_3_in_4	Parallel run loop
auto	1.9752447314854706	0.0	discard	9_3_in_5	Parallel run loop
auto	1.7415211546504121	0.0	discard	7_3_in_5	Parallel run loop
auto	2.376319333032766	0.0	discard	13_3_in_5	Parallel run loop
auto	3.7402513220860825	0.0	discard	31_3_in_5	Parallel run loop
auto	4.78476933174566	0.0	discard	46_3_in_5	Parallel run loop
auto	3.3916869229368274	0.0	discard	18_3_in_4	Parallel run loop
auto	4.269561916894254	0.0	discard	28_3_in_4	Parallel run loop
auto	1.4732977421040805	0.0	discard	5_3_in_5	Parallel run loop
auto	4.712788992696744	0.0	discard	45_3_in_5	Parallel run loop
auto	3.7691581326591996	0.0	discard	22_3_in_4	Parallel run loop
auto	3.5569005417498456	0.0	discard	28_3_in_5	Parallel run loop
auto	3.1370291333963536	0.0	discard	22_3_in_5	Parallel run loop
auto	4.993626200803059	0.0	discard	37_3_in_4	Parallel run loop
auto	4.821319636296042	0.0	discard	35_3_in_4	Parallel run loop
auto	4.876374742789703	0.0	discard	36_3_in_4	Parallel run loop
auto	3.4271251909816525	0.0	discard	26_3_in_5	Parallel run loop
auto	4.356534980497981	0.0	discard	40_3_in_5	Parallel run loop
auto	4.087235607410304	0.0	discard	36_3_in_5	Parallel run loop
auto	3.818209795208899	0.0	discard	32_3_in_5	Parallel run loop
auto	4.671267867956932	0.0	discard	33_3_in_4	Parallel run loop
auto	4.18735618648181	0.0	discard	27_3_in_4	Parallel run loop
auto	5.5022988595976425	0.0	discard	43_3_in_4	Parallel run loop
auto	5.414842593548908	0.0	discard	42_3_in_4	Parallel run loop
auto	3.678553174923859	0.0	discard	21_3_in_4	Parallel run loop
auto	4.917787723931915	0.0	discard	49_3_in_5	Parallel run loop
auto	3.8619298410985685	0.0	discard	23_3_in_4	Parallel run loop
auto	3.94308794595706	0.0	discard	24_3_in_4	Parallel run loop
auto	5.028087084610331	0.0	discard	50_3_in_5	Parallel run loop
auto	5.573204402377486	0.0	discard	45_3_in_4	Parallel run loop
auto	5.851219388596868	0.0	discard	47_3_in_4	Parallel run loop
auto	4.595100578059526	0.0	discard	32_3_in_4	Parallel run loop
auto	2.183861630624332	0.0	discard	11_3_in_5	Parallel run loop
auto	4.4106555025540235	0.0	discard	41_3_in_5	Parallel run loop
auto	3.3842176734048453	0.0	discard	18_3_in_4	Parallel run loop
auto	3.7595387247829732	0.0	discard	31_3_in_5	Parallel run loop
auto	2.9047061017748885	0.0	discard	19_3_in_5	Parallel run loop
auto	1.4731234270125722	0.0	discard	5_3_in_5	Parallel run loop
auto	2.648027567955742	0.0	discard	16_3_in_5	Parallel run loop
