commit	score	memory_gb	status	problem	description
auto	2.989736754164845	0.0	discard	32_4_in_8	Parallel run loop
auto	11.10639567382138	0.0	discard	22_DOMINO_in_3	Parallel run loop
auto	13.884493816920813	0.0	discard	38_5_in_3	Parallel run loop
auto	8.651091643465453	0.0	discard	13_DOMINO_in_3	Parallel run loop
auto	3.504561196287405	0.0	discard	26_4_in_6	Parallel run loop
auto	3.4412749789338526	0.0	discard	24_4_in_6	Parallel run loop
auto	4.669097318272951	0.0	discard	19_3_in_3	Parallel run loop
auto	5.32293333882856	0.0	discard	40_4_in_5	Parallel run loop
auto	5.173022929798316	0.0	discard	38_4_in_5	Parallel run loop
auto	2.7702964943057093	0.0	discard	30_4_in_8	Parallel run loop
auto	3.6464012788081015	0.0	discard	28_4_in_6	Parallel run loop
auto	10.95333223592899	0.0	discard	21_DOMINO_in_3	Parallel run loop
auto	11.165425559759298	0.0	discard	20_DOMINO_in_3	Parallel run loop
auto	4.038580838360076	0.0	discard	35_4_in_6	Parallel run loop
auto	3.7177851286492225	0.0	discard	29_4_in_6	Parallel run loop
auto	11.966322751034012	0.0	discard	26_DOMINO_in_3	Parallel run loop
auto	3.89258090088692	0.0	discard	33_4_in_6	Parallel run loop
auto	14.05678443804131	0.0	discard	39_5_in_3	Parallel run loop
auto	12.771121686878123	0.0	discard	32_5_in_3	Parallel run loop
auto	5.079314839349297	0.0	discard	37_4_in_5	Parallel run loop
auto	2.7228640292078126	0.0	discard	29_4_in_8	Parallel run loop
auto	12.910495881561323	0.0	discard	33_5_in_3	Parallel run loop
auto	2.9051992788582677	0.0	discard	33_4_in_8	Parallel run loop
auto	4.726818672940521	0.0	discard	32_4_in_5	Parallel run loop
auto	12.261313043390997	0.0	discard	27_DOMINO_in_3	Parallel run loop
auto	1.8262321636215084	0.0	discard	31_3_in_8	Parallel run loop
auto	4.915675214796237	0.0	discard	35_4_in_5	Parallel run loop
auto	4.701209644746939	0.0	discard	30_4_in_5	Parallel run loop
auto	3.178905265988797	0.0	discard	40_4_in_8	Parallel run loop
auto	11.78013726824729	0.0	discard	25_DOMINO_in_3	Parallel run loop
auto	8.651091643465453	0.0	discard	13_DOMINO_in_3	Parallel run loop
auto	3.440930851435959	0.0	discard	24_4_in_6	Parallel run loop
auto	3.6580890377382107	0.0	discard	28_4_in_6	Parallel run loop
auto	11.960108969580684	0.0	discard	18_6_in_3	Parallel run loop
auto	11.966322751034012	0.0	discard	26_DOMINO_in_3	Parallel run loop
auto	11.10639567382138	0.0	discard	22_DOMINO_in_3	Parallel run loop
auto	10.95333223592899	0.0	discard	21_DOMINO_in_3	Parallel run loop
auto	12.771121686878123	0.0	discard	32_5_in_3	Parallel run loop
auto	4.669097318272951	0.0	discard	19_3_in_3	Parallel run loop
auto	4.534482956184558	0.0	discard	40_4_in_6	Parallel run loop
auto	3.5576027200941724	0.0	discard	27_4_in_6	Parallel run loop
auto	13.884493816920813	0.0	discard	38_5_in_3	Parallel run loop
auto	2.382191620351339	0.0	discard	21_4_in_8	Parallel run loop
auto	5.33386413036413	0.0	discard	38_4_in_5	Parallel run loop
auto	3.504561196287405	0.0	discard	26_4_in_6	Parallel run loop
auto	5.442588749725697	0.0	discard	40_4_in_5	Parallel run loop
auto	4.043834670396796	0.0	discard	35_4_in_6	Parallel run loop
auto	3.178905265988797	0.0	discard	40_4_in_8	Parallel run loop
auto	2.519017470378839	0.0	discard	25_4_in_8	Parallel run loop
auto	5.005146389003712	0.0	discard	33_4_in_5	Parallel run loop
auto	4.028419532222125	0.0	discard	33_4_in_6	Parallel run loop
auto	4.8120642997799035	0.0	discard	32_4_in_5	Parallel run loop
auto	2.9476053891229426	0.0	discard	35_4_in_8	Parallel run loop
auto	4.894582139316073	0.0	discard	35_4_in_5	Parallel run loop
auto	3.8768930781381097	0.0	discard	16_DOMINO_in_6	Parallel run loop
auto	11.881182844607538	0.0	discard	25_DOMINO_in_3	Parallel run loop
auto	4.786866784335104	0.0	discard	30_4_in_5	Parallel run loop
auto	2.7702964943057093	0.0	discard	30_4_in_8	Parallel run loop
auto	14.05678443804131	0.0	discard	39_5_in_3	Parallel run loop
auto	13.820493131853882	0.0	discard	25_6_in_3	Parallel run loop
auto	4.041621768437455	0.0	discard	36_4_in_6	Parallel run loop
auto	12.261313043390997	0.0	discard	27_DOMINO_in_3	Parallel run loop
auto	11.966322751034012	0.0	discard	26_DOMINO_in_3	Parallel run loop
auto	10.651500718525643	0.0	discard	20_DOMINO_in_3	Parallel run loop
auto	2.7228640292078126	0.0	discard	29_4_in_8	Parallel run loop
auto	12.910495881561323	0.0	discard	33_5_in_3	Parallel run loop
auto	3.4519600188840074	0.0	discard	24_4_in_6	Parallel run loop
auto	8.651091643465453	0.0	discard	13_DOMINO_in_3	Parallel run loop
auto	12.771121686878123	0.0	discard	32_5_in_3	Parallel run loop
auto	10.95333223592899	0.0	discard	21_DOMINO_in_3	Parallel run loop
auto	11.10639567382138	0.0	discard	22_DOMINO_in_3	Parallel run loop
auto	5.9728961010757065	0.0	discard	14_DOMINO_in_4	Parallel run loop
auto	6.884056633069832	0.0	discard	19_DOMINO_in_4	Parallel run loop
auto	2.382191620351339	0.0	discard	21_4_in_8	Parallel run loop
auto	3.504561196287405	0.0	discard	26_4_in_6	Parallel run loop
auto	2.519017470378839	0.0	discard	25_4_in_8	Parallel run loop
auto	5.000616751278545	0.0	keep	37_4_in_5	Parallel run loop
auto	2.989736754164845	0.0	discard	32_4_in_8	Parallel run loop
auto	11.960108969580684	0.0	discard	18_6_in_3	Parallel run loop
auto	11.966322751034012	0.0	discard	26_DOMINO_in_3	Parallel run loop
auto	3.178905265988797	0.0	discard	40_4_in_8	Parallel run loop
auto	2.9476053891229426	0.0	discard	35_4_in_8	Parallel run loop
auto	4.362821338449023	0.0	discard	40_4_in_6	Parallel run loop
auto	4.726818672940521	0.0	discard	32_4_in_5	Parallel run loop
auto	4.786866784335104	0.0	discard	30_4_in_5	Parallel run loop
auto	13.884493816920813	0.0	discard	38_5_in_3	Parallel run loop
auto	2.9051992788582677	0.0	discard	33_4_in_8	Parallel run loop
auto	11.505387066184918	0.0	discard	24_DOMINO_in_3	Parallel run loop
auto	7.00613779632392	0.0	discard	46_3_in_3	Parallel run loop
auto	3.444029238189058	0.0	discard	24_4_in_6	Parallel run loop
auto	5.33386413036413	0.0	discard	38_4_in_5	Parallel run loop
auto	3.991526197402004	0.0	discard	33_4_in_6	Parallel run loop
auto	3.8768930781381097	0.0	discard	16_DOMINO_in_6	Parallel run loop
auto	3.5833111845294376	0.0	discard	27_4_in_6	Parallel run loop
auto	13.820493131853882	0.0	discard	25_6_in_3	Parallel run loop
auto	5.1332484788868875	0.0	discard	35_4_in_5	Parallel run loop
auto	4.043025943901063	0.0	discard	35_4_in_6	Parallel run loop
auto	4.843428274429765	0.0	discard	33_4_in_5	Parallel run loop
auto	10.651500718525643	0.0	discard	20_DOMINO_in_3	Parallel run loop
auto	14.05678443804131	0.0	discard	39_5_in_3	Parallel run loop
auto	12.910495881561323	0.0	discard	33_5_in_3	Parallel run loop
auto	11.78013726824729	0.0	discard	25_DOMINO_in_3	Parallel run loop
auto	2.7228640292078126	0.0	discard	29_4_in_8	Parallel run loop
auto	2.7702964943057093	0.0	discard	30_4_in_8	Parallel run loop
auto	4.8942446995982385	0.0	discard	20_3_in_3	Parallel run loop
auto	4.041621768437455	0.0	discard	36_4_in_6	Parallel run loop
auto	12.261313043390997	0.0	discard	27_DOMINO_in_3	Parallel run loop
auto	8.651091643465453	0.0	discard	13_DOMINO_in_3	Parallel run loop
auto	11.10639567382138	0.0	discard	22_DOMINO_in_3	Parallel run loop
auto	11.966322751034012	0.0	discard	26_DOMINO_in_3	Parallel run loop
auto	11.960108969580684	0.0	discard	18_6_in_3	Parallel run loop
auto	6.884056633069832	0.0	discard	19_DOMINO_in_4	Parallel run loop
auto	3.504561196287405	0.0	discard	26_4_in_6	Parallel run loop
auto	4.774308315899103	0.0	discard	32_4_in_5	Parallel run loop
auto	2.382191620351339	0.0	discard	21_4_in_8	Parallel run loop
auto	2.519017470378839	0.0	discard	25_4_in_8	Parallel run loop
auto	3.178905265988797	0.0	discard	40_4_in_8	Parallel run loop
auto	10.95333223592899	0.0	discard	21_DOMINO_in_3	Parallel run loop
auto	4.059637210674349	0.0	discard	35_4_in_6	Parallel run loop
auto	3.884026208775121	0.0	discard	33_4_in_6	Parallel run loop
auto	4.843428274429765	0.0	discard	33_4_in_5	Parallel run loop
auto	3.4599090622817634	0.0	discard	24_4_in_6	Parallel run loop
auto	2.9051992788582677	0.0	discard	33_4_in_8	Parallel run loop
auto	5.442588749725697	0.0	discard	40_4_in_5	Parallel run loop
auto	13.820493131853882	0.0	discard	25_6_in_3	Parallel run loop
auto	12.771121686878123	0.0	discard	32_5_in_3	Parallel run loop
auto	2.8599677294777037	0.0	discard	32_4_in_8	Parallel run loop
auto	4.786866784335104	0.0	discard	30_4_in_5	Parallel run loop
auto	3.8768930781381097	0.0	discard	16_DOMINO_in_6	Parallel run loop
auto	4.990625013249537	0.0	keep	37_4_in_5	Parallel run loop
auto	2.9476053891229426	0.0	discard	35_4_in_8	Parallel run loop
auto	3.610649470360355	0.0	discard	27_4_in_6	Parallel run loop
auto	4.348447039943098	0.0	discard	40_4_in_6	Parallel run loop
auto	11.78013726824729	0.0	discard	25_DOMINO_in_3	Parallel run loop
auto	11.505387066184918	0.0	discard	24_DOMINO_in_3	Parallel run loop
auto	13.884493816920813	0.0	discard	38_5_in_3	Parallel run loop
auto	5.1332484788868875	0.0	discard	35_4_in_5	Parallel run loop
auto	5.33386413036413	0.0	discard	38_4_in_5	Parallel run loop
auto	5.9728961010757065	0.0	discard	14_DOMINO_in_4	Parallel run loop
auto	7.00613779632392	0.0	discard	46_3_in_3	Parallel run loop
auto	2.7228640292078126	0.0	discard	29_4_in_8	Parallel run loop
auto	12.910495881561323	0.0	discard	33_5_in_3	Parallel run loop
auto	14.05678443804131	0.0	discard	39_5_in_3	Parallel run loop
auto	2.3332803056569675	0.0	discard	20_3_in_DOMINO	Parallel run loop
auto	4.041621768437455	0.0	discard	36_4_in_6	Parallel run loop
auto	2.7702964943057093	0.0	discard	30_4_in_8	Parallel run loop
auto	10.651500718525643	0.0	discard	20_DOMINO_in_3	Parallel run loop
auto	4.726818672940521	0.0	discard	32_4_in_5	Parallel run loop
auto	8.651091643465453	0.0	discard	13_DOMINO_in_3	Parallel run loop
auto	12.059293801707227	0.0	discard	24_DOMINO_in_3	Parallel run loop
auto	3.8768930781381097	0.0	discard	16_DOMINO_in_6	Parallel run loop
auto	11.78013726824729	0.0	discard	25_DOMINO_in_3	Parallel run loop
auto	12.482649707867429	0.0	discard	27_DOMINO_in_3	Parallel run loop
auto	2.382191620351339	0.0	discard	21_4_in_8	Parallel run loop
auto	11.960108969580684	0.0	discard	18_6_in_3	Parallel run loop
auto	11.10639567382138	0.0	discard	22_DOMINO_in_3	Parallel run loop
auto	4.885880125978864	0.0	discard	33_4_in_5	Parallel run loop
auto	2.9051992788582677	0.0	discard	33_4_in_8	Parallel run loop
auto	2.7702964943057093	0.0	discard	30_4_in_8	Parallel run loop
auto	5.189558730537238	0.0	discard	38_4_in_5	Parallel run loop
auto	10.95333223592899	0.0	discard	21_DOMINO_in_3	Parallel run loop
auto	5.27213836413791	0.0	discard	37_4_in_5	Parallel run loop
auto	3.504561196287405	0.0	discard	26_4_in_6	Parallel run loop
auto	6.835647451099712	0.0	keep	19_DOMINO_in_4	Parallel run loop
auto	12.771121686878123	0.0	discard	32_5_in_3	Parallel run loop
auto	3.596234999904542	0.0	discard	27_4_in_6	Parallel run loop
auto	3.9999176299153003	0.0	discard	33_4_in_6	Parallel run loop
auto	5.238312809518595	0.0	discard	40_4_in_5	Parallel run loop
auto	2.9476053891229426	0.0	discard	35_4_in_8	Parallel run loop
auto	4.024469808570427	0.0	discard	35_4_in_6	Parallel run loop
auto	2.519017470378839	0.0	discard	25_4_in_8	Parallel run loop
auto	3.178905265988797	0.0	discard	40_4_in_8	Parallel run loop
auto	4.340192422199685	0.0	discard	40_4_in_6	Parallel run loop
auto	13.820493131853882	0.0	discard	25_6_in_3	Parallel run loop
auto	13.884493816920813	0.0	discard	38_5_in_3	Parallel run loop
auto	2.3332803056569675	0.0	discard	20_3_in_DOMINO	Parallel run loop
auto	5.9728961010757065	0.0	discard	14_DOMINO_in_4	Parallel run loop
auto	4.041621768437455	0.0	discard	36_4_in_6	Parallel run loop
auto	2.7228640292078126	0.0	discard	29_4_in_8	Parallel run loop
auto	5.013542161156744	0.0	discard	35_4_in_5	Parallel run loop
auto	3.4292509695885722	0.0	discard	24_4_in_6	Parallel run loop
auto	12.910495881561323	0.0	discard	33_5_in_3	Parallel run loop
auto	10.651500718525643	0.0	discard	20_DOMINO_in_3	Parallel run loop
auto	11.966322751034012	0.0	discard	26_DOMINO_in_3	Parallel run loop
auto	7.00613779632392	0.0	discard	46_3_in_3	Parallel run loop
auto	14.05678443804131	0.0	discard	39_5_in_3	Parallel run loop
auto	4.8942446995982385	0.0	discard	20_3_in_3	Parallel run loop
auto	3.504561196287405	0.0	discard	26_4_in_6	Parallel run loop
auto	5.211584754678705	0.0	discard	38_4_in_5	Parallel run loop
auto	4.843428274429765	0.0	discard	33_4_in_5	Parallel run loop
auto	2.8599677294777037	0.0	discard	32_4_in_8	Parallel run loop
auto	2.7702964943057093	0.0	discard	30_4_in_8	Parallel run loop
auto	3.8768930781381097	0.0	discard	16_DOMINO_in_6	Parallel run loop
auto	6.884056633069832	0.0	discard	19_DOMINO_in_4	Parallel run loop
auto	12.771121686878123	0.0	discard	32_5_in_3	Parallel run loop
auto	4.088690302270994	0.0	discard	33_4_in_6	Parallel run loop
auto	4.107827100454637	0.0	discard	35_4_in_6	Parallel run loop
auto	2.9051992788582677	0.0	discard	33_4_in_8	Parallel run loop
auto	11.960108969580684	0.0	discard	18_6_in_3	Parallel run loop
auto	4.786866784335104	0.0	discard	30_4_in_5	Parallel run loop
auto	8.651091643465453	0.0	discard	13_DOMINO_in_3	Parallel run loop
auto	12.261313043390997	0.0	discard	27_DOMINO_in_3	Parallel run loop
auto	2.382191620351339	0.0	discard	21_4_in_8	Parallel run loop
auto	11.10639567382138	0.0	discard	22_DOMINO_in_3	Parallel run loop
auto	5.0869774472707725	0.0	discard	37_4_in_5	Parallel run loop
auto	3.589408299483216	0.0	discard	27_4_in_6	Parallel run loop
auto	13.946930352147506	0.0	discard	25_6_in_3	Parallel run loop
auto	4.396986122590812	0.0	discard	40_4_in_6	Parallel run loop
auto	5.929933782606769	0.0	keep	14_DOMINO_in_4	Parallel run loop
auto	3.4505794419802474	0.0	discard	24_4_in_6	Parallel run loop
auto	11.78013726824729	0.0	discard	25_DOMINO_in_3	Parallel run loop
auto	2.9476053891229426	0.0	discard	35_4_in_8	Parallel run loop
auto	2.519017470378839	0.0	discard	25_4_in_8	Parallel run loop
auto	13.884493816920813	0.0	discard	38_5_in_3	Parallel run loop
auto	10.95333223592899	0.0	discard	21_DOMINO_in_3	Parallel run loop
auto	12.059293801707227	0.0	discard	24_DOMINO_in_3	Parallel run loop
auto	4.726818672940521	0.0	discard	32_4_in_5	Parallel run loop
auto	3.178905265988797	0.0	discard	40_4_in_8	Parallel run loop
auto	10.651500718525643	0.0	discard	20_DOMINO_in_3	Parallel run loop
auto	4.8942446995982385	0.0	discard	20_3_in_3	Parallel run loop
auto	3.8768930781381097	0.0	discard	16_DOMINO_in_6	Parallel run loop
auto	6.884056633069832	0.0	discard	19_DOMINO_in_4	Parallel run loop
auto	4.955094925113674	0.0	discard	33_4_in_5	Parallel run loop
auto	12.910495881561323	0.0	discard	33_5_in_3	Parallel run loop
auto	2.8599677294777037	0.0	discard	32_4_in_8	Parallel run loop
auto	2.8993617483110063	0.0	discard	30_4_in_8	Parallel run loop
auto	3.504561196287405	0.0	discard	26_4_in_6	Parallel run loop
auto	11.966322751034012	0.0	discard	26_DOMINO_in_3	Parallel run loop
auto	2.7228640292078126	0.0	discard	29_4_in_8	Parallel run loop
auto	7.00613779632392	0.0	discard	46_3_in_3	Parallel run loop
auto	3.6016336703329377	0.0	discard	27_4_in_6	Parallel run loop
auto	2.9051992788582677	0.0	discard	33_4_in_8	Parallel run loop
auto	5.929933782606769	0.0	discard	14_DOMINO_in_4	Parallel run loop
auto	12.771121686878123	0.0	discard	32_5_in_3	Parallel run loop
auto	4.32329779294961	0.0	discard	40_4_in_6	Parallel run loop
auto	5.27213836413791	0.0	discard	37_4_in_5	Parallel run loop
auto	4.041621768437455	0.0	discard	36_4_in_6	Parallel run loop
auto	5.1332484788868875	0.0	discard	35_4_in_5	Parallel run loop
auto	2.382191620351339	0.0	discard	21_4_in_8	Parallel run loop
auto	8.382506079934158	0.0	discard	22_8_in_DOMINO	Parallel run loop
auto	12.261313043390997	0.0	discard	27_DOMINO_in_3	Parallel run loop
auto	5.33386413036413	0.0	discard	38_4_in_5	Parallel run loop
auto	14.497914143320651	0.0	discard	25_6_in_3	Parallel run loop
auto	8.651091643465453	0.0	discard	13_DOMINO_in_3	Parallel run loop
auto	11.960108969580684	0.0	discard	18_6_in_3	Parallel run loop
auto	4.000317661681468	0.0	discard	33_4_in_6	Parallel run loop
auto	11.78013726824729	0.0	discard	25_DOMINO_in_3	Parallel run loop
auto	4.786866784335104	0.0	discard	30_4_in_5	Parallel run loop
auto	14.05678443804131	0.0	discard	39_5_in_3	Parallel run loop
auto	10.651500718525643	0.0	discard	20_DOMINO_in_3	Parallel run loop
auto	13.884493816920813	0.0	discard	38_5_in_3	Parallel run loop
auto	2.519017470378839	0.0	discard	25_4_in_8	Parallel run loop
auto	10.95333223592899	0.0	discard	21_DOMINO_in_3	Parallel run loop
auto	11.966322751034012	0.0	discard	26_DOMINO_in_3	Parallel run loop
auto	2.9476053891229426	0.0	discard	35_4_in_8	Parallel run loop
auto	11.10639567382138	0.0	discard	22_DOMINO_in_3	Parallel run loop
auto	5.258855558773118	0.0	discard	40_4_in_5	Parallel run loop
auto	3.444029238189058	0.0	discard	24_4_in_6	Parallel run loop
auto	4.726818672940521	0.0	discard	32_4_in_5	Parallel run loop
auto	4.077947661273599	0.0	discard	35_4_in_6	Parallel run loop
auto	5.9728961010757065	0.0	discard	14_DOMINO_in_4	Parallel run loop
auto	3.8768930781381097	0.0	discard	16_DOMINO_in_6	Parallel run loop
auto	6.884056633069832	0.0	discard	19_DOMINO_in_4	Parallel run loop
auto	2.382191620351339	0.0	discard	21_4_in_8	Parallel run loop
auto	11.505387066184918	0.0	discard	24_DOMINO_in_3	Parallel run loop
auto	3.5829528534109847	0.0	discard	27_4_in_6	Parallel run loop
auto	12.261313043390997	0.0	discard	27_DOMINO_in_3	Parallel run loop
auto	5.27213836413791	0.0	discard	37_4_in_5	Parallel run loop
auto	4.726818672940521	0.0	discard	32_4_in_5	Parallel run loop
auto	14.05678443804131	0.0	discard	39_5_in_3	Parallel run loop
auto	2.9051992788582677	0.0	discard	33_4_in_8	Parallel run loop
auto	3.504561196287405	0.0	discard	26_4_in_6	Parallel run loop
auto	5.005146389003712	0.0	discard	33_4_in_5	Parallel run loop
auto	11.78013726824729	0.0	discard	25_DOMINO_in_3	Parallel run loop
auto	11.960108969580684	0.0	discard	18_6_in_3	Parallel run loop
auto	13.820493131853882	0.0	discard	25_6_in_3	Parallel run loop
auto	4.372867878955362	0.0	discard	40_4_in_6	Parallel run loop
auto	2.7702964943057093	0.0	discard	30_4_in_8	Parallel run loop
auto	4.786866784335104	0.0	discard	30_4_in_5	Parallel run loop
auto	5.33386413036413	0.0	discard	38_4_in_5	Parallel run loop
auto	5.1332484788868875	0.0	discard	35_4_in_5	Parallel run loop
auto	12.910495881561323	0.0	discard	33_5_in_3	Parallel run loop
auto	2.7228640292078126	0.0	discard	29_4_in_8	Parallel run loop
auto	12.771121686878123	0.0	discard	32_5_in_3	Parallel run loop
auto	7.00613779632392	0.0	discard	46_3_in_3	Parallel run loop
auto	8.651091643465453	0.0	discard	13_DOMINO_in_3	Parallel run loop
auto	4.041621768437455	0.0	discard	36_4_in_6	Parallel run loop
auto	11.012066424423661	0.0	keep	22_DOMINO_in_3	Parallel run loop
auto	11.966322751034012	0.0	discard	26_DOMINO_in_3	Parallel run loop
auto	3.884026208775121	0.0	discard	33_4_in_6	Parallel run loop
auto	10.651500718525643	0.0	discard	20_DOMINO_in_3	Parallel run loop
auto	10.95333223592899	0.0	discard	21_DOMINO_in_3	Parallel run loop
auto	2.9476053891229426	0.0	discard	35_4_in_8	Parallel run loop
auto	13.884493816920813	0.0	discard	38_5_in_3	Parallel run loop
auto	2.519017470378839	0.0	discard	25_4_in_8	Parallel run loop
auto	3.879607989148609	0.0	discard	16_DOMINO_in_6	Parallel run loop
auto	4.885880125978864	0.0	discard	33_4_in_5	Parallel run loop
auto	3.89258090088692	0.0	discard	33_4_in_6	Parallel run loop
auto	5.2410191339504175	0.0	discard	38_4_in_5	Parallel run loop
auto	4.786866784335104	0.0	discard	30_4_in_5	Parallel run loop
auto	3.178905265988797	0.0	discard	40_4_in_8	Parallel run loop
auto	11.881182844607538	0.0	discard	25_DOMINO_in_3	Parallel run loop
auto	3.5579585159457667	0.0	discard	27_4_in_6	Parallel run loop
auto	12.771121686878123	0.0	discard	32_5_in_3	Parallel run loop
auto	5.013542161156744	0.0	discard	35_4_in_5	Parallel run loop
auto	3.504561196287405	0.0	discard	26_4_in_6	Parallel run loop
auto	5.9728961010757065	0.0	discard	14_DOMINO_in_4	Parallel run loop
auto	2.382191620351339	0.0	discard	21_4_in_8	Parallel run loop
auto	6.835647451099712	0.0	discard	19_DOMINO_in_4	Parallel run loop
auto	2.7228640292078126	0.0	discard	29_4_in_8	Parallel run loop
auto	11.960108969580684	0.0	discard	18_6_in_3	Parallel run loop
auto	12.910495881561323	0.0	discard	33_5_in_3	Parallel run loop
auto	4.392151855472973	0.0	discard	40_4_in_6	Parallel run loop
auto	12.600508496988768	0.0	discard	27_DOMINO_in_3	Parallel run loop
auto	12.059293801707227	0.0	discard	24_DOMINO_in_3	Parallel run loop
auto	2.989736754164845	0.0	discard	32_4_in_8	Parallel run loop
auto	4.8942446995982385	0.0	discard	20_3_in_3	Parallel run loop
auto	11.10639567382138	0.0	discard	22_DOMINO_in_3	Parallel run loop
auto	3.415902270245124	0.0	discard	24_4_in_6	Parallel run loop
auto	2.9051992788582677	0.0	discard	33_4_in_8	Parallel run loop
auto	14.077674238257678	0.0	discard	25_6_in_3	Parallel run loop
auto	4.052741345763223	0.0	discard	35_4_in_6	Parallel run loop
auto	5.252476074081871	0.0	discard	40_4_in_5	Parallel run loop
auto	5.27213836413791	0.0	discard	37_4_in_5	Parallel run loop
auto	2.8993617483110063	0.0	discard	30_4_in_8	Parallel run loop
auto	4.95906101564547	0.0	discard	32_4_in_5	Parallel run loop
auto	14.05678443804131	0.0	discard	39_5_in_3	Parallel run loop
auto	8.651091643465453	0.0	discard	13_DOMINO_in_3	Parallel run loop
auto	6.835647451099712	0.0	discard	19_DOMINO_in_4	Parallel run loop
auto	3.439554685537472	0.0	discard	24_4_in_6	Parallel run loop
auto	10.95333223592899	0.0	discard	21_DOMINO_in_3	Parallel run loop
auto	11.712797716181479	0.0	discard	24_DOMINO_in_3	Parallel run loop
auto	2.519017470378839	0.0	discard	25_4_in_8	Parallel run loop
auto	12.852061883041317	0.0	discard	27_DOMINO_in_3	Parallel run loop
auto	2.382191620351339	0.0	discard	21_4_in_8	Parallel run loop
auto	2.989736754164845	0.0	discard	32_4_in_8	Parallel run loop
auto	10.651500718525643	0.0	discard	20_DOMINO_in_3	Parallel run loop
auto	11.960108969580684	0.0	discard	18_6_in_3	Parallel run loop
