commit	score	memory_gb	status	problem	description
auto	5.098419686113854	0.0	keep	28_DOMINO_in_6	Parallel run loop
auto	5.777467632032182	0.0	discard	26_8_in_8	Parallel run loop
auto	6.2478639807772485	0.0	discard	16_8_in_6	Parallel run loop
auto	5.663881359656193	0.0	discard	25_6_in_6	Parallel run loop
auto	2.847707045129096	0.0	discard	15_DOMINO_in_8	Parallel run loop
auto	3.827281560659983	0.0	discard	11_DOMINO_in_DOMINO	Parallel run loop
auto	4.543661599376413	0.0	discard	22_DOMINO_in_6	Parallel run loop
auto	6.3086008314667135	0.0	discard	10_8_in_5	Parallel run loop
auto	4.626301058318689	0.0	discard	19_6_in_6	Parallel run loop
auto	4.439495793991655	0.0	discard	21_DOMINO_in_6	Parallel run loop
auto	2.93656857296528	0.0	discard	9_DOMINO_in_6	Parallel run loop
auto	2.443470535936834	0.0	discard	6_DOMINO_in_6	Parallel run loop
auto	2.0051996327521553	0.0	discard	7_DOMINO_in_8	Parallel run loop
auto	2.198224030578895	0.0	discard	9_DOMINO_in_8	Parallel run loop
auto	2.6315066934704827	0.0	discard	7_DOMINO_in_6	Parallel run loop
auto	2.324171944271372	0.0	discard	10_DOMINO_in_8	Parallel run loop
auto	2.449230726326569	0.0	keep	11_DOMINO_in_8	Parallel run loop
auto	2.6447738834161796	0.0	discard	9_6_in_8	Parallel run loop
auto	3.9723811614364313	0.0	discard	16_DOMINO_in_6	Parallel run loop
auto	3.9095319593326012	0.0	discard	21_5_in_CIRCLE	Parallel run loop
auto	4.1300763018796935	0.0	discard	24_5_in_CIRCLE	Parallel run loop
auto	5.425165163298882	0.0	discard	23_6_in_6	Parallel run loop
auto	6.0953254095291225	0.0	discard	19_8_in_CIRCLE	Parallel run loop
auto	5.746679693947278	0.0	discard	27_6_in_6	Parallel run loop
auto	3.9373484195098065	0.0	discard	19_DOMINO_in_CIRCLE	Parallel run loop
auto	4.441477536678243	0.0	discard	16_5_in_5	Parallel run loop
auto	4.882630265799585	0.0	discard	19_DOMINO_in_DOMINO	Parallel run loop
auto	4.409839693042728	0.0	discard	17_5_in_DOMINO	Parallel run loop
auto	5.8434126687983206	0.0	discard	20_6_in_DOMINO	Parallel run loop
auto	3.659026073253804	0.0	discard	16_DOMINO_in_CIRCLE	Parallel run loop
auto	3.8079170051287923	0.0	discard	15_DOMINO_in_6	Parallel run loop
auto	4.309862100185108	0.0	discard	16_5_in_DOMINO	Parallel run loop
auto	5.949837118888085	0.0	discard	28_6_in_6	Parallel run loop
auto	3.365213031051526	0.0	discard	21_DOMINO_in_8	Parallel run loop
auto	5.310294973685477	0.0	discard	20_DOMINO_in_5	Parallel run loop
auto	3.6720870606044564	0.0	discard	19_5_in_CIRCLE	Parallel run loop
auto	4.733780902267363	0.0	discard	27_5_in_6	Parallel run loop
auto	2.5069731037578142	0.0	discard	13_5_in_8	Parallel run loop
auto	6.700106835949054	0.0	discard	23_6_in_5	Parallel run loop
auto	4.542752912493154	0.0	discard	22_DOMINO_in_6	Parallel run loop
auto	5.302443940088193	0.0	discard	22_5_in_5	Parallel run loop
auto	4.626301058318689	0.0	discard	19_6_in_6	Parallel run loop
auto	3.6508051620464856	0.0	discard	14_DOMINO_in_6	Parallel run loop
auto	5.693379391606711	0.0	discard	19_6_in_DOMINO	Parallel run loop
auto	5.6215705425904785	0.0	discard	25_5_in_5	Parallel run loop
auto	5.098419686113854	0.0	discard	28_DOMINO_in_6	Parallel run loop
auto	7.676416747555321	0.0	discard	31_6_in_5	Parallel run loop
auto	2.847707045129096	0.0	discard	15_DOMINO_in_8	Parallel run loop
auto	8.382506079934158	0.0	discard	22_8_in_DOMINO	Parallel run loop
auto	3.659026073253804	0.0	discard	16_DOMINO_in_CIRCLE	Parallel run loop
auto	2.324171944271372	0.0	discard	10_DOMINO_in_8	Parallel run loop
auto	3.9493073634468594	0.0	discard	11_6_in_6	Parallel run loop
auto	4.1300763018796935	0.0	discard	24_5_in_CIRCLE	Parallel run loop
auto	6.281350871924349	0.0	discard	20_6_in_5	Parallel run loop
auto	2.93656857296528	0.0	discard	9_DOMINO_in_6	Parallel run loop
auto	3.893718850328349	0.0	discard	16_DOMINO_in_6	Parallel run loop
auto	2.443470535936834	0.0	discard	6_DOMINO_in_6	Parallel run loop
auto	3.2342712519580337	0.0	discard	12_DOMINO_in_CIRCLE	Parallel run loop
auto	4.882630265799585	0.0	discard	19_DOMINO_in_DOMINO	Parallel run loop
auto	2.198224030578895	0.0	discard	9_DOMINO_in_8	Parallel run loop
auto	2.485750748629754	0.0	discard	11_DOMINO_in_8	Parallel run loop
auto	2.0051996327521553	0.0	discard	7_DOMINO_in_8	Parallel run loop
auto	4.473366200080101	0.0	discard	21_DOMINO_in_6	Parallel run loop
auto	5.012765064798198	0.0	discard	20_DOMINO_in_DOMINO	Parallel run loop
auto	2.6315066934704827	0.0	discard	7_DOMINO_in_6	Parallel run loop
auto	3.6720870606044564	0.0	discard	19_5_in_CIRCLE	Parallel run loop
auto	3.9095319593326012	0.0	discard	21_5_in_CIRCLE	Parallel run loop
auto	2.8900148954966616	0.0	discard	9_5_in_6	Parallel run loop
auto	2.4007400073217737	0.0	discard	12_5_in_8	Parallel run loop
auto	3.7683056475804717	0.0	discard	17_5_in_6	Parallel run loop
auto	7.160232969366078	0.0	discard	16_8_in_DOMINO	Parallel run loop
auto	3.365213031051526	0.0	discard	21_DOMINO_in_8	Parallel run loop
auto	3.8369336484278946	0.0	discard	13_6_in_CIRCLE	Parallel run loop
auto	8.102774853359481	0.0	discard	20_8_in_DOMINO	Parallel run loop
auto	3.1860393694450497	0.0	discard	11_DOMINO_in_CIRCLE	Parallel run loop
auto	3.759141572791398	0.0	discard	17_DOMINO_in_CIRCLE	Parallel run loop
auto	3.8235622980604758	0.0	discard	15_DOMINO_in_6	Parallel run loop
auto	2.803879883664299	0.0	discard	9_DOMINO_in_CIRCLE	Parallel run loop
auto	4.697834635053744	0.0	discard	19_5_in_DOMINO	Parallel run loop
auto	5.384931350321754	0.0	discard	23_5_in_5	Parallel run loop
auto	4.479815897501027	0.0	discard	24_5_in_6	Parallel run loop
auto	2.443470535936834	0.0	discard	6_DOMINO_in_6	Parallel run loop
auto	2.93656857296528	0.0	discard	9_DOMINO_in_6	Parallel run loop
auto	2.324171944271372	0.0	discard	10_DOMINO_in_8	Parallel run loop
auto	2.9559621946049712	0.0	discard	10_DOMINO_in_CIRCLE	Parallel run loop
auto	4.75127218611163	0.0	discard	10_8_in_CIRCLE	Parallel run loop
auto	3.6989477623597167	0.0	discard	14_DOMINO_in_6	Parallel run loop
auto	6.497991980936347	0.0	discard	11_8_in_5	Parallel run loop
auto	4.475245630635559	0.0	discard	15_6_in_6	Parallel run loop
auto	3.894497710925557	0.0	discard	16_DOMINO_in_6	Parallel run loop
auto	4.8203042879733635	0.0	discard	20_5_in_DOMINO	Parallel run loop
auto	2.847707045129096	0.0	discard	15_DOMINO_in_8	Parallel run loop
auto	5.777467632032182	0.0	discard	26_8_in_8	Parallel run loop
auto	5.790189669490146	0.0	discard	13_8_in_6	Parallel run loop
auto	4.542298637201905	0.0	keep	22_DOMINO_in_6	Parallel run loop
auto	4.282850583980959	0.0	discard	13_DOMINO_in_5	Parallel run loop
auto	2.6315066934704827	0.0	discard	7_DOMINO_in_6	Parallel run loop
auto	5.117831510635021	0.0	discard	28_DOMINO_in_6	Parallel run loop
auto	3.9095319593326012	0.0	discard	21_5_in_CIRCLE	Parallel run loop
auto	5.994170884047151	0.0	discard	9_8_in_5	Parallel run loop
auto	5.102893955208136	0.0	discard	20_8_in_8	Parallel run loop
auto	2.0051996327521553	0.0	discard	7_DOMINO_in_8	Parallel run loop
auto	6.2478639807772485	0.0	discard	16_8_in_6	Parallel run loop
auto	3.827281560659983	0.0	discard	11_DOMINO_in_DOMINO	Parallel run loop
auto	4.409839693042728	0.0	discard	17_5_in_DOMINO	Parallel run loop
auto	7.812784092602333	0.0	discard	32_6_in_5	Parallel run loop
auto	4.569815862524372	0.0	discard	18_5_in_DOMINO	Parallel run loop
auto	6.3086008314667135	0.0	discard	10_8_in_5	Parallel run loop
auto	6.0953254095291225	0.0	discard	19_8_in_CIRCLE	Parallel run loop
auto	4.558228051991228	0.0	discard	16_6_in_6	Parallel run loop
auto	2.198224030578895	0.0	discard	9_DOMINO_in_8	Parallel run loop
auto	4.309862100185108	0.0	discard	16_5_in_DOMINO	Parallel run loop
auto	3.365213031051526	0.0	discard	21_DOMINO_in_8	Parallel run loop
auto	4.904537362780794	0.0	discard	21_5_in_DOMINO	Parallel run loop
auto	4.455507583380141	0.0	discard	21_DOMINO_in_6	Parallel run loop
auto	2.6447738834161796	0.0	discard	9_6_in_8	Parallel run loop
auto	5.663881359656193	0.0	discard	25_6_in_6	Parallel run loop
auto	2.6915521371235593	0.0	discard	8_DOMINO_in_CIRCLE	Parallel run loop
auto	2.5069731037578142	0.0	discard	13_5_in_8	Parallel run loop
auto	4.282850583980959	0.0	discard	13_DOMINO_in_5	Parallel run loop
auto	5.302443940088193	0.0	discard	22_5_in_5	Parallel run loop
auto	2.443470535936834	0.0	discard	6_DOMINO_in_6	Parallel run loop
auto	4.733780902267363	0.0	discard	27_5_in_6	Parallel run loop
auto	3.8102025552077317	0.0	discard	15_DOMINO_in_6	Parallel run loop
auto	7.676416747555321	0.0	discard	31_6_in_5	Parallel run loop
auto	2.93656857296528	0.0	discard	9_DOMINO_in_6	Parallel run loop
auto	5.693379391606711	0.0	discard	19_6_in_DOMINO	Parallel run loop
auto	5.949837118888085	0.0	discard	28_6_in_6	Parallel run loop
auto	2.847707045129096	0.0	discard	15_DOMINO_in_8	Parallel run loop
auto	2.324171944271372	0.0	discard	10_DOMINO_in_8	Parallel run loop
auto	5.6215705425904785	0.0	discard	25_5_in_5	Parallel run loop
auto	6.700106835949054	0.0	discard	23_6_in_5	Parallel run loop
auto	3.893718850328349	0.0	discard	16_DOMINO_in_6	Parallel run loop
auto	5.8434126687983206	0.0	discard	20_6_in_DOMINO	Parallel run loop
auto	2.6315066934704827	0.0	discard	7_DOMINO_in_6	Parallel run loop
auto	2.0051996327521553	0.0	discard	7_DOMINO_in_8	Parallel run loop
auto	3.1860393694450497	0.0	discard	11_DOMINO_in_CIRCLE	Parallel run loop
auto	3.9493073634468594	0.0	discard	11_6_in_6	Parallel run loop
auto	1.971205364122458	0.0	keep	2_DOMINO_in_DOMINO	Parallel run loop
auto	4.121327274071906	0.0	keep	2_8_in_4	Parallel run loop
auto	5.219936469636757	0.0	keep	4_5_in_3	Parallel run loop
auto	3.0158647325112655	0.0	keep	3_CIRCLE_in_5	Parallel run loop
auto	1.5357469254971334	0.0	keep	2_4_in_5	Parallel run loop
auto	5.3819330876927705	0.0	keep	4_DOMINO_in_3	Parallel run loop
auto	2.5358990034416586	0.0	keep	3_6_in_DOMINO	Parallel run loop
auto	2.0000014092791627	0.0	keep	2_8_in_8	Parallel run loop
auto	2.1005153696408363	0.0	keep	3_5_in_DOMINO	Parallel run loop
auto	2.9081173373250686	0.0	keep	3_5_in_4	Parallel run loop
auto	0.7365401171219866	0.0	keep	3_3_in_8	Parallel run loop
auto	2.3373957204435536	0.0	keep	4_5_in_DOMINO	Parallel run loop
auto	2.4472145025616805	0.0	keep	4_5_in_5	Parallel run loop
auto	1.519671715326794	0.0	keep	4_4_in_6	Parallel run loop
auto	1.8297164160655135	0.0	keep	4_5_in_CIRCLE	Parallel run loop
auto	2.236068067823152	0.0	keep	3_5_in_5	Parallel run loop
auto	3.979903381810763	0.0	keep	4_8_in_DOMINO	Parallel run loop
auto	1.2895521768778089	0.0	keep	3_5_in_8	Parallel run loop
auto	6.830192045440366	0.0	keep	5_6_in_3	Parallel run loop
auto	2.889629996220031	0.0	keep	3_8_in_6	Parallel run loop
auto	1.8616688165776094	0.0	keep	2_DOMINO_in_5	Parallel run loop
auto	1.3660338282225761	0.0	keep	3_4_in_6	Parallel run loop
auto	2.7161114801421262	0.0	keep	3_8_in_CIRCLE	Parallel run loop
auto	2.319336543239429	0.0	keep	3_DOMINO_in_5	Parallel run loop
auto	1.6956201574088763	0.0	keep	3_4_in_5	Parallel run loop
auto	2.947442948191439	0.0	keep	4_6_in_DOMINO	Parallel run loop
auto	5.558108891374155	0.0	keep	5_5_in_3	Parallel run loop
auto	9.285064744792447	0.0	keep	5_8_in_3	Parallel run loop
auto	2.2396014534707644	0.0	keep	4_6_in_CIRCLE	Parallel run loop
auto	1.0294382478753528	0.0	keep	3_4_in_8	Parallel run loop
auto	2.17157402403434	0.0	keep	3_8_in_8	Parallel run loop
auto	0.876699268544093	0.0	keep	2_4_in_8	Parallel run loop
auto	2.7669498487571544e-07	0.0	keep	1_8_in_3	Parallel run loop
auto	6.5003483399828905	0.0	keep	7_5_in_3	Parallel run loop
auto	3.314452326160118	0.0	keep	4_CIRCLE_in_5	Parallel run loop
auto	0.9892996887000588	0.0	keep	3_3_in_6	Parallel run loop
auto	8.652151337852702	0.0	keep	4_8_in_3	Parallel run loop
auto	1.861669673765003	0.0	keep	4_4_in_5	Parallel run loop
auto	11.066376749298056	0.0	keep	7_8_in_3	Parallel run loop
auto	3.5136774054888793	0.0	keep	3_8_in_DOMINO	Parallel run loop
auto	4.121649568326254	0.0	keep	3_5_in_3	Parallel run loop
auto	1.5546040447651086	0.0	keep	2_5_in_DOMINO	Parallel run loop
auto	11.510508621315173	0.0	keep	8_8_in_3	Parallel run loop
auto	6.836942457137506	0.0	keep	3_8_in_3	Parallel run loop
auto	2.6665593214202623	0.0	keep	4_CIRCLE_in_6	Parallel run loop
auto	1.9766907913676464	0.0	keep	4_5_in_6	Parallel run loop
auto	3.549056332511809	0.0	keep	5_5_in_4	Parallel run loop
auto	6.511438022198529	0.0	keep	6_8_in_4	Parallel run loop
auto	7.035645216085856	0.0	keep	7_8_in_4	Parallel run loop
auto	1.8946917763403228	0.0	keep	2_6_in_DOMINO	Parallel run loop
auto	1.277365287542202	0.0	keep	7_3_in_6	Parallel run loop
auto	1.4369164936252057	0.0	keep	7_4_in_8	Parallel run loop
auto	3.1025322179905857	0.0	keep	4_5_in_4	Parallel run loop
auto	3.7678117974672194	0.0	keep	5_DOMINO_in_4	Parallel run loop
auto	8.334571071193249	0.0	keep	8_6_in_3	Parallel run loop
auto	2.694154964611209	0.0	keep	9_4_in_5	Parallel run loop
auto	2.5654377741581933	0.0	keep	8_4_in_5	Parallel run loop
auto	2.5886081332922775	0.0	keep	4_DOMINO_in_5	Parallel run loop
auto	8.242817688442235	0.0	keep	10_8_in_4	Parallel run loop
auto	6.309426277028839	0.0	keep	6_DOMINO_in_3	Parallel run loop
auto	13.247374073660659	0.0	keep	11_8_in_3	Parallel run loop
auto	6.8114326062102535	0.0	keep	8_5_in_3	Parallel run loop
auto	1.822111684926714	0.0	keep	6_4_in_6	Parallel run loop
auto	7.93790827796582	0.0	keep	11_5_in_3	Parallel run loop
auto	2.232256557748311	0.0	keep	9_4_in_6	Parallel run loop
auto	4.907548615895785	0.0	keep	10_5_in_4	Parallel run loop
auto	5.828435470809099	0.0	keep	5_8_in_4	Parallel run loop
auto	3.278150372781259	0.0	keep	4_8_in_6	Parallel run loop
auto	2.389029563298287	0.0	keep	4_8_in_8	Parallel run loop
auto	8.193870524987446	0.0	keep	12_5_in_3	Parallel run loop
auto	7.089761997063669	0.0	keep	9_5_in_3	Parallel run loop
auto	4.180372828743098	0.0	keep	7_5_in_4	Parallel run loop
auto	15.662595351861313	0.0	keep	16_8_in_3	Parallel run loop
auto	8.576012989269666	0.0	keep	11_8_in_4	Parallel run loop
auto	5.115745904900878	0.0	keep	11_5_in_4	Parallel run loop
auto	9.548430084825512	0.0	keep	11_6_in_3	Parallel run loop
auto	7.1547083557779665	0.0	keep	8_DOMINO_in_3	Parallel run loop
auto	8.644990984048102	0.0	keep	9_6_in_3	Parallel run loop
auto	1.3569408363551942	0.0	keep	8_3_in_6	Parallel run loop
auto	9.964748566803838	0.0	keep	12_6_in_3	Parallel run loop
auto	5.521152154180106	0.0	keep	13_5_in_4	Parallel run loop
auto	4.600412666833241	0.0	keep	9_5_in_4	Parallel run loop
auto	0.9877875696971208	0.0	keep	8_3_in_8	Parallel run loop
auto	2.40948436918319	0.0	keep	11_4_in_6	Parallel run loop
auto	1.6818419147801118	0.0	keep	10_4_in_8	Parallel run loop
auto	16.077796643193164	0.0	keep	17_8_in_3	Parallel run loop
auto	5.903498335950099	0.0	keep	15_5_in_4	Parallel run loop
auto	1.9833414193351773	0.0	keep	14_4_in_8	Parallel run loop
auto	9.199897969623336	0.0	keep	13_8_in_4	Parallel run loop
auto	6.614052791832837	0.0	keep	7_DOMINO_in_3	Parallel run loop
auto	11.371595632874065	0.0	keep	16_6_in_3	Parallel run loop
auto	10.293805144196833	0.0	keep	13_6_in_3	Parallel run loop
auto	8.379120699169718	0.0	keep	13_5_in_3	Parallel run loop
auto	2.793321203811656	0.0	keep	10_4_in_5	Parallel run loop
auto	9.304804612391116	0.0	keep	16_5_in_3	Parallel run loop
auto	5.698935460853391	0.0	keep	14_5_in_4	Parallel run loop
auto	8.816456661132593	0.0	keep	12_8_in_4	Parallel run loop
auto	9.583477245712984	0.0	keep	17_5_in_3	Parallel run loop
auto	14.043894378809615	0.0	keep	13_8_in_3	Parallel run loop
auto	1.1994139568171645	0.0	keep	12_3_in_8	Parallel run loop
auto	5.232637863951477	0.0	keep	12_5_in_4	Parallel run loop
auto	9.45000931193908	0.0	keep	14_8_in_4	Parallel run loop
auto	6.244705635509875	0.0	keep	17_5_in_4	Parallel run loop
auto	2.0319133500710396	0.0	keep	15_4_in_8	Parallel run loop
auto	1.1456739647912377	0.0	keep	11_3_in_8	Parallel run loop
auto	1.8971544193236975	0.0	keep	13_4_in_8	Parallel run loop
auto	11.644155725239349	0.0	keep	17_6_in_3	Parallel run loop
auto	6.898980293351454	0.0	keep	6_6_in_3	Parallel run loop
auto	5.635408328924276	0.0	keep	6_5_in_3	Parallel run loop
auto	8.593681552142662	0.0	keep	14_5_in_3	Parallel run loop
auto	16.435668404579975	0.0	keep	18_8_in_3	Parallel run loop
auto	11.00214348093553	0.0	keep	23_5_in_3	Parallel run loop
auto	10.762092385951366	0.0	keep	22_5_in_3	Parallel run loop
auto	6.065688009756495	0.0	keep	16_5_in_4	Parallel run loop
auto	9.800365611847313	0.0	keep	18_5_in_3	Parallel run loop
auto	10.449895341199724	0.0	keep	17_8_in_4	Parallel run loop
auto	2.5722863530023186	0.0	keep	13_4_in_6	Parallel run loop
auto	1.6238309749887867	0.0	keep	12_3_in_6	Parallel run loop
auto	6.559110050612426	0.0	keep	19_5_in_4	Parallel run loop
auto	1.2374664980592032	0.0	keep	13_3_in_8	Parallel run loop
auto	7.052476050663169	0.0	keep	22_5_in_4	Parallel run loop
auto	11.189599241303744	0.0	keep	24_5_in_3	Parallel run loop
auto	5.464140210439507	0.0	keep	5_DOMINO_in_3	Parallel run loop
auto	4.901716434720273	0.0	keep	9_DOMINO_in_4	Parallel run loop
auto	7.217484421390451	0.0	keep	23_5_in_4	Parallel run loop
auto	2.7670067685130193	0.0	keep	15_4_in_6	Parallel run loop
auto	10.967928383290833	0.0	keep	19_8_in_4	Parallel run loop
auto	2.890963298341843	0.0	keep	11_4_in_5	Parallel run loop
auto	8.156532445437875	0.0	keep	11_DOMINO_in_3	Parallel run loop
auto	11.95748279452357	0.0	keep	18_6_in_3	Parallel run loop
auto	1.7315566334976624	0.0	keep	11_4_in_8	Parallel run loop
auto	13.423728013287104	0.0	keep	23_6_in_3	Parallel run loop
auto	6.861372084895679	0.0	keep	21_5_in_4	Parallel run loop
auto	14.24080134149529	0.0	keep	14_8_in_3	Parallel run loop
auto	3.3215252332434697	0.0	keep	22_4_in_6	Parallel run loop
auto	7.474835158097073	0.0	keep	25_5_in_4	Parallel run loop
auto	3.235869335425489	0.0	keep	21_4_in_6	Parallel run loop
auto	3.185534421993927	0.0	keep	20_4_in_6	Parallel run loop
auto	9.315789363255375	0.0	keep	6_8_in_3	Parallel run loop
auto	10.614751161659994	0.0	keep	18_8_in_4	Parallel run loop
auto	7.172393485589609	0.0	keep	10_5_in_3	Parallel run loop
auto	16.548007467301627	0.0	keep	19_8_in_3	Parallel run loop
auto	3.4794498406420526	0.0	keep	16_4_in_5	Parallel run loop
auto	6.343083401061137	0.0	keep	18_5_in_4	Parallel run loop
auto	2.443377223844914	0.0	keep	12_4_in_6	Parallel run loop
auto	1.2765583939286202	0.0	keep	14_3_in_8	Parallel run loop
auto	7.3390476696530005	0.0	keep	24_5_in_4	Parallel run loop
auto	9.941680763474293	0.0	keep	19_5_in_3	Parallel run loop
auto	7.317204392650463	0.0	keep	9_DOMINO_in_3	Parallel run loop
auto	1.8612098002862263	0.0	keep	7_4_in_6	Parallel run loop
auto	9.656859274545802	0.0	keep	15_8_in_4	Parallel run loop
auto	12.614395905811715	0.0	keep	31_5_in_3	Parallel run loop
auto	12.40099810232604	0.0	keep	30_5_in_3	Parallel run loop
auto	1.0752147101333656	0.0	keep	10_3_in_8	Parallel run loop
auto	2.820215828613283	0.0	keep	16_4_in_6	Parallel run loop
auto	13.624556050021742	0.0	keep	24_6_in_3	Parallel run loop
auto	12.19971863048491	0.0	keep	29_5_in_3	Parallel run loop
auto	3.12150296309221	0.0	keep	13_4_in_5	Parallel run loop
auto	11.357236002133387	0.0	keep	25_5_in_3	Parallel run loop
auto	6.665279206774115	0.0	keep	20_5_in_4	Parallel run loop
auto	2.476924133157909	0.0	keep	23_4_in_8	Parallel run loop
auto	2.42874741437945	0.0	keep	22_4_in_8	Parallel run loop
auto	10.110839754113679	0.0	keep	20_5_in_3	Parallel run loop
auto	3.371296901013967	0.0	keep	23_4_in_6	Parallel run loop
auto	1.6654792834380523	0.0	keep	13_3_in_6	Parallel run loop
auto	13.007580211414933	0.0	keep	22_6_in_3	Parallel run loop
auto	3.5423581626252667	0.0	keep	17_4_in_5	Parallel run loop
auto	1.3962954396689018	0.0	keep	17_3_in_8	Parallel run loop
auto	11.161660541849523	0.0	keep	20_8_in_4	Parallel run loop
auto	1.7310529605379383	0.0	keep	14_3_in_6	Parallel run loop
auto	8.695062298319634	0.0	keep	15_5_in_3	Parallel run loop
auto	2.621521434701497	0.0	keep	14_4_in_6	Parallel run loop
auto	2.2902639197058985	0.0	keep	20_4_in_8	Parallel run loop
auto	2.886925318404044	0.0	keep	17_4_in_6	Parallel run loop
auto	13.86920973938104	0.0	keep	38_5_in_3	Parallel run loop
auto	2.1675916365044765	0.0	keep	18_4_in_8	Parallel run loop
auto	12.89616597382552	0.0	keep	33_5_in_3	Parallel run loop
auto	1.3762490643022407	0.0	keep	16_3_in_8	Parallel run loop
auto	1.302549355173943	0.0	keep	15_3_in_8	Parallel run loop
auto	13.668045830620615	0.0	keep	37_5_in_3	Parallel run loop
auto	2.230628980054408	0.0	keep	19_4_in_8	Parallel run loop
auto	13.807537279353001	0.0	keep	25_6_in_3	Parallel run loop
auto	2.9698864125834032	0.0	keep	12_4_in_5	Parallel run loop
auto	11.47170033493368	0.0	keep	26_5_in_3	Parallel run loop
auto	12.757186535314492	0.0	keep	32_5_in_3	Parallel run loop
auto	1.4730633621924512	0.0	keep	19_3_in_8	Parallel run loop
auto	9.309713305336976	0.0	keep	15_DOMINO_in_3	Parallel run loop
auto	3.4178812170592687	0.0	keep	24_4_in_6	Parallel run loop
auto	14.80952485461106	0.0	keep	29_6_in_3	Parallel run loop
auto	3.6271310760268243	0.0	keep	18_4_in_5	Parallel run loop
auto	11.618739598198866	0.0	keep	27_5_in_3	Parallel run loop
auto	14.059625404706441	0.0	keep	39_5_in_3	Parallel run loop
auto	16.752700566438442	0.0	keep	20_8_in_3	Parallel run loop
auto	1.5011400082651052	0.0	keep	20_3_in_8	Parallel run loop
auto	14.17889998347914	0.0	keep	40_5_in_3	Parallel run loop
auto	11.80650896318607	0.0	keep	10_8_in_3	Parallel run loop
auto	5.709925539225584	0.0	keep	13_DOMINO_in_4	Parallel run loop
auto	7.6221110686865705	0.0	keep	10_DOMINO_in_3	Parallel run loop
auto	0.815749133016216	0.0	keep	6_3_in_8	Parallel run loop
auto	1.5000038342239952	0.0	keep	11_3_in_6	Parallel run loop
auto	10.202692488209998	0.0	keep	21_5_in_3	Parallel run loop
auto	1.534214598060918	0.0	keep	21_3_in_8	Parallel run loop
auto	11.70163442860188	0.0	keep	28_5_in_3	Parallel run loop
auto	3.714125214951776	0.0	keep	19_4_in_5	Parallel run loop
auto	3.285333931160923	0.0	keep	15_4_in_5	Parallel run loop
auto	2.3363251821049262	0.0	keep	21_4_in_8	Parallel run loop
auto	3.1883791224471407	0.0	keep	14_4_in_5	Parallel run loop
auto	8.637096952104814	0.0	keep	13_DOMINO_in_3	Parallel run loop
