commit	score	memory_gb	status	problem	description
auto	0.876699268544093	0.0	discard	2_4_in_8	Parallel run loop
auto	8.652151337852702	0.0	discard	4_8_in_3	Parallel run loop
auto	4.121327274071906	0.0	discard	2_8_in_4	Parallel run loop
auto	11.495892128497758	0.0	discard	24_DOMINO_in_3	Parallel run loop
auto	0.7365398902319754	0.0	keep	3_3_in_8	Parallel run loop
auto	0.9892996887000588	0.0	discard	3_3_in_6	Parallel run loop
auto	2.7606330544680864	0.0	discard	39_3_in_6	Parallel run loop
auto	2.896412642760914	0.0	discard	33_4_in_8	Parallel run loop
auto	5.219936469636757	0.0	discard	4_5_in_3	Parallel run loop
auto	3.359611268263679	0.0	discard	2_8_in_5	Parallel run loop
auto	3.02700688215011	0.0	discard	46_3_in_6	Parallel run loop
auto	2.9725396241181756	0.0	discard	45_3_in_6	Parallel run loop
auto	1.8795216741215133	0.0	discard	33_3_in_8	Parallel run loop
auto	1.0294375004178038	0.0	keep	3_4_in_8	Parallel run loop
auto	2.7963163285168626	0.0	discard	40_3_in_6	Parallel run loop
auto	3.0158647325112655	0.0	discard	3_CIRCLE_in_5	Parallel run loop
auto	2.8442163642643044	0.0	discard	41_3_in_6	Parallel run loop
auto	2.0037425469517336	0.0	discard	37_3_in_8	Parallel run loop
auto	3.000287116578102	0.0	discard	49_3_in_6	Parallel run loop
auto	1.9217576501003182	0.0	discard	35_3_in_8	Parallel run loop
auto	3.0000645889773474	0.0	discard	47_3_in_6	Parallel run loop
auto	2.1005153696408363	0.0	discard	3_5_in_DOMINO	Parallel run loop
auto	3.9799000189504725	0.0	keep	4_8_in_DOMINO	Parallel run loop
auto	2.5358990034416586	0.0	discard	3_6_in_DOMINO	Parallel run loop
auto	2.588275614046589	0.0	discard	34_3_in_6	Parallel run loop
auto	2.9081173373250686	0.0	discard	3_5_in_4	Parallel run loop
auto	2.0000014092791627	0.0	discard	2_8_in_8	Parallel run loop
auto	1.6956201574088763	0.0	discard	3_4_in_5	Parallel run loop
auto	2.4689455391270005	0.0	discard	2_6_in_5	Parallel run loop
auto	2.9140109200669726	0.0	discard	44_3_in_6	Parallel run loop
auto	2.9943828487962887	0.0	discard	48_3_in_6	Parallel run loop
auto	2.590763574807772	0.0	discard	35_3_in_6	Parallel run loop
auto	3.5136774054888793	0.0	discard	3_8_in_DOMINO	Parallel run loop
auto	2.7662314112006623	0.0	keep	40_3_in_6	Parallel run loop
auto	0.9892995737546343	0.0	keep	3_3_in_6	Parallel run loop
auto	4.121327274071906	0.0	discard	2_8_in_4	Parallel run loop
auto	1.8578496931745732	0.0	discard	33_3_in_8	Parallel run loop
auto	2.83432011119543	0.0	discard	41_3_in_6	Parallel run loop
auto	0.7773356176027824	0.0	discard	4_3_in_8	Parallel run loop
auto	0.7365398902319754	0.0	discard	3_3_in_8	Parallel run loop
auto	0.876699268544093	0.0	discard	2_4_in_8	Parallel run loop
auto	2.8995343067308488	0.0	discard	33_4_in_8	Parallel run loop
auto	5.902346811539842e-38	0.0	keep	1_8_in_3	Parallel run loop
auto	1.5357469254971334	0.0	discard	2_4_in_5	Parallel run loop
auto	2.9373559567208187	0.0	discard	45_3_in_6	Parallel run loop
auto	2.740203855323622	0.0	discard	39_3_in_6	Parallel run loop
auto	1.971205364122458	0.0	discard	2_DOMINO_in_DOMINO	Parallel run loop
auto	11.544246173036706	0.0	discard	24_DOMINO_in_3	Parallel run loop
auto	3.359611268263679	0.0	discard	2_8_in_5	Parallel run loop
auto	2.236068067823152	0.0	discard	3_5_in_5	Parallel run loop
auto	2.1005153696408363	0.0	discard	3_5_in_DOMINO	Parallel run loop
auto	5.219936469636757	0.0	discard	4_5_in_3	Parallel run loop
auto	2.947442396851262	0.0	discard	4_6_in_DOMINO	Parallel run loop
auto	8.652151337852702	0.0	discard	4_8_in_3	Parallel run loop
auto	2.597295154934724	0.0	discard	34_3_in_6	Parallel run loop
auto	1.9694951130107499	0.0	keep	37_3_in_8	Parallel run loop
auto	2.9954552223703494	0.0	discard	47_3_in_6	Parallel run loop
auto	2.5358990034416586	0.0	discard	3_6_in_DOMINO	Parallel run loop
auto	2.908671200148805	0.0	discard	44_3_in_6	Parallel run loop
auto	2.4689455391270005	0.0	discard	2_6_in_5	Parallel run loop
auto	2.9889851736384623	0.0	discard	48_3_in_6	Parallel run loop
auto	1.9234011199206806	0.0	discard	35_3_in_8	Parallel run loop
auto	3.5136774054888793	0.0	discard	3_8_in_DOMINO	Parallel run loop
auto	1.0294375004178038	0.0	discard	3_4_in_8	Parallel run loop
auto	4.121327274071906	0.0	discard	2_8_in_4	Parallel run loop
auto	2.643847676529106	0.0	discard	35_3_in_6	Parallel run loop
auto	3.0158647325112655	0.0	discard	3_CIRCLE_in_5	Parallel run loop
auto	3.032267406968778	0.0	discard	49_3_in_6	Parallel run loop
auto	2.0000014092791627	0.0	discard	2_8_in_8	Parallel run loop
auto	0.7773356176027824	0.0	discard	4_3_in_8	Parallel run loop
auto	3.9799000189504725	0.0	discard	4_8_in_DOMINO	Parallel run loop
auto	0.7365397586108993	0.0	keep	3_3_in_8	Parallel run loop
auto	2.7791534491825645	0.0	discard	39_3_in_6	Parallel run loop
auto	1.3660308937496013	0.0	keep	3_4_in_6	Parallel run loop
auto	2.9226805622841012	0.0	keep	45_3_in_6	Parallel run loop
auto	2.827322344168984	0.0	discard	41_3_in_6	Parallel run loop
auto	0.9892995737546343	0.0	discard	3_3_in_6	Parallel run loop
auto	1.5357469254971334	0.0	discard	2_4_in_5	Parallel run loop
auto	2.9081173373250686	0.0	discard	3_5_in_4	Parallel run loop
auto	2.7911162555526676	0.0	discard	40_3_in_6	Parallel run loop
auto	1.8822177985964996	0.0	discard	33_3_in_8	Parallel run loop
auto	1.6956201574088763	0.0	discard	3_4_in_5	Parallel run loop
auto	0.876699268544093	0.0	discard	2_4_in_8	Parallel run loop
auto	11.496960516608057	0.0	discard	24_DOMINO_in_3	Parallel run loop
auto	8.652151337852702	0.0	discard	4_8_in_3	Parallel run loop
auto	2.947442396851262	0.0	discard	4_6_in_DOMINO	Parallel run loop
auto	2.1005153696408363	0.0	discard	3_5_in_DOMINO	Parallel run loop
auto	2.5358990034416586	0.0	discard	3_6_in_DOMINO	Parallel run loop
auto	2.236068067823152	0.0	discard	3_5_in_5	Parallel run loop
auto	1.971205364122458	0.0	discard	2_DOMINO_in_DOMINO	Parallel run loop
auto	4.3117535506259973e-82	0.0	keep	1_8_in_3	Parallel run loop
auto	5.219936469636757	0.0	discard	4_5_in_3	Parallel run loop
auto	2.716111370352478	0.0	keep	3_8_in_CIRCLE	Parallel run loop
auto	3.075209583102717	0.0	discard	49_3_in_6	Parallel run loop
auto	5.3819330876927705	0.0	discard	4_DOMINO_in_3	Parallel run loop
auto	3.0158647325112655	0.0	discard	3_CIRCLE_in_5	Parallel run loop
auto	1.9995660066806182	0.0	discard	37_3_in_8	Parallel run loop
auto	2.892789388057696	0.0	discard	44_3_in_6	Parallel run loop
auto	1.9215863720066504	0.0	discard	35_3_in_8	Parallel run loop
auto	2.614128832789198	0.0	discard	35_3_in_6	Parallel run loop
auto	3.5136774054888793	0.0	discard	3_8_in_DOMINO	Parallel run loop
auto	2.9943828487962887	0.0	discard	48_3_in_6	Parallel run loop
auto	2.997811595409984	0.0	discard	47_3_in_6	Parallel run loop
auto	1.6956201574088763	0.0	discard	3_4_in_5	Parallel run loop
auto	2.9081173373250686	0.0	discard	3_5_in_4	Parallel run loop
auto	3.9799000189504725	0.0	discard	4_8_in_DOMINO	Parallel run loop
auto	2.1715732346593764	0.0	keep	3_8_in_8	Parallel run loop
auto	2.3373957204435536	0.0	discard	4_5_in_DOMINO	Parallel run loop
auto	2.863717462824268	0.0	discard	41_3_in_6	Parallel run loop
auto	3.030583963782123	0.0	discard	45_3_in_6	Parallel run loop
auto	11.066376749298056	0.0	discard	7_8_in_3	Parallel run loop
auto	2.7913218558340893	0.0	discard	40_3_in_6	Parallel run loop
auto	1.2895521768778089	0.0	discard	3_5_in_8	Parallel run loop
auto	0.7773356176027824	0.0	discard	4_3_in_8	Parallel run loop
auto	0.7365400143333446	0.0	discard	3_3_in_8	Parallel run loop
auto	1.0294375004178038	0.0	discard	3_4_in_8	Parallel run loop
auto	1.3660308937496013	0.0	discard	3_4_in_6	Parallel run loop
auto	2.785535729583611	0.0	discard	39_3_in_6	Parallel run loop
auto	1.9796302646863635	0.0	discard	4_DOMINO_in_CIRCLE	Parallel run loop
auto	2.319336543239429	0.0	discard	3_DOMINO_in_5	Parallel run loop
auto	3.000015083769613	0.0	keep	49_3_in_6	Parallel run loop
auto	5.558108891374155	0.0	discard	5_5_in_3	Parallel run loop
auto	9.285064744792447	0.0	discard	5_8_in_3	Parallel run loop
auto	1.8297164160655135	0.0	discard	4_5_in_CIRCLE	Parallel run loop
auto	1.9960680554511607	0.0	discard	37_3_in_8	Parallel run loop
auto	1.952128410369644e-50	0.0	discard	1_8_in_3	Parallel run loop
auto	2.590763574807772	0.0	discard	35_3_in_6	Parallel run loop
auto	2.947442396851262	0.0	discard	4_6_in_DOMINO	Parallel run loop
auto	2.9836331985473015	0.0	discard	48_3_in_6	Parallel run loop
auto	2.992784062955144	0.0	discard	47_3_in_6	Parallel run loop
auto	1.9217576501003182	0.0	discard	35_3_in_8	Parallel run loop
auto	0.9892995737546343	0.0	discard	3_3_in_6	Parallel run loop
auto	2.9091879380083863	0.0	discard	44_3_in_6	Parallel run loop
auto	8.652151337852702	0.0	discard	4_8_in_3	Parallel run loop
auto	6.830192045440366	0.0	discard	5_6_in_3	Parallel run loop
auto	3.0158647325112655	0.0	discard	3_CIRCLE_in_5	Parallel run loop
auto	2.9081173373250686	0.0	discard	3_5_in_4	Parallel run loop
auto	3.314452326160118	0.0	discard	4_CIRCLE_in_5	Parallel run loop
auto	2.5358990034416586	0.0	discard	3_6_in_DOMINO	Parallel run loop
auto	2.3373957204435536	0.0	discard	4_5_in_DOMINO	Parallel run loop
auto	1.6956201574088763	0.0	discard	3_4_in_5	Parallel run loop
auto	2.236068067823152	0.0	discard	3_5_in_5	Parallel run loop
auto	5.3819330876927705	0.0	discard	4_DOMINO_in_3	Parallel run loop
auto	3.9799000189504725	0.0	discard	4_8_in_DOMINO	Parallel run loop
auto	2.2396014534707644	0.0	discard	4_6_in_CIRCLE	Parallel run loop
auto	2.7452142684237657	0.0	discard	39_3_in_6	Parallel run loop
auto	2.1715732346593764	0.0	discard	3_8_in_8	Parallel run loop
auto	2.8256234789034456	0.0	keep	41_3_in_6	Parallel run loop
auto	6.5003483399828905	0.0	discard	7_5_in_3	Parallel run loop
auto	1.9796302646863635	0.0	discard	4_DOMINO_in_CIRCLE	Parallel run loop
auto	2.7911162555526676	0.0	discard	40_3_in_6	Parallel run loop
auto	2.716111370352478	0.0	discard	3_8_in_CIRCLE	Parallel run loop
auto	1.8616688165776094	0.0	discard	2_DOMINO_in_5	Parallel run loop
auto	11.066376749298056	0.0	discard	7_8_in_3	Parallel run loop
auto	1.2895521768778089	0.0	discard	3_5_in_8	Parallel run loop
auto	1.3660308937496013	0.0	discard	3_4_in_6	Parallel run loop
auto	1.9223782021265425	0.0	discard	35_3_in_8	Parallel run loop
auto	2.319336543239429	0.0	discard	3_DOMINO_in_5	Parallel run loop
auto	1.519671715326794	0.0	discard	4_4_in_6	Parallel run loop
auto	2.978856225947684	0.0	keep	47_3_in_6	Parallel run loop
auto	5.558108891374155	0.0	discard	5_5_in_3	Parallel run loop
auto	3.0633908590566556	0.0	discard	49_3_in_6	Parallel run loop
auto	1.8297164160655135	0.0	discard	4_5_in_CIRCLE	Parallel run loop
auto	2.019602216647833	0.0	discard	37_3_in_8	Parallel run loop
auto	2.6403238805855485	0.0	discard	35_3_in_6	Parallel run loop
auto	2.6665593214202623	0.0	discard	4_CIRCLE_in_6	Parallel run loop
auto	3.1580206908935606	0.0	discard	48_3_in_6	Parallel run loop
auto	1.0294375004178038	0.0	discard	3_4_in_8	Parallel run loop
auto	9.285064744792447	0.0	discard	5_8_in_3	Parallel run loop
auto	1.861669673765003	0.0	discard	4_4_in_5	Parallel run loop
auto	2.7447197201248956	0.0	discard	39_3_in_6	Parallel run loop
auto	2.889629996220031	0.0	discard	3_8_in_6	Parallel run loop
auto	1.9766904220053136	0.0	keep	4_5_in_6	Parallel run loop
auto	7.035615131303261	0.0	keep	7_8_in_4	Parallel run loop
auto	2.3373957204435536	0.0	discard	4_5_in_DOMINO	Parallel run loop
auto	2.4472145025616805	0.0	discard	4_5_in_5	Parallel run loop
auto	2.8154360218555348	0.0	keep	41_3_in_6	Parallel run loop
auto	2.1911938317469376e-29	0.0	discard	1_8_in_3	Parallel run loop
auto	3.5490409630937405	0.0	keep	5_5_in_4	Parallel run loop
auto	2.748877942008237	0.0	keep	40_3_in_6	Parallel run loop
auto	3.314452326160118	0.0	discard	4_CIRCLE_in_5	Parallel run loop
auto	2.947442396851262	0.0	discard	4_6_in_DOMINO	Parallel run loop
auto	11.512280825973622	0.0	discard	8_8_in_3	Parallel run loop
auto	6.830192045440366	0.0	discard	5_6_in_3	Parallel run loop
auto	5.3819330876927705	0.0	discard	4_DOMINO_in_3	Parallel run loop
auto	1.9796302646863635	0.0	discard	4_DOMINO_in_CIRCLE	Parallel run loop
auto	1.8616688165776094	0.0	discard	2_DOMINO_in_5	Parallel run loop
auto	2.319336543239429	0.0	discard	3_DOMINO_in_5	Parallel run loop
auto	11.066376749298056	0.0	discard	7_8_in_3	Parallel run loop
auto	2.716111370352478	0.0	discard	3_8_in_CIRCLE	Parallel run loop
auto	6.5003483399828905	0.0	discard	7_5_in_3	Parallel run loop
auto	3.0001300528555426	0.0	discard	47_3_in_6	Parallel run loop
auto	1.9247729746177151	0.0	discard	35_3_in_8	Parallel run loop
auto	2.2396014534707644	0.0	discard	4_6_in_CIRCLE	Parallel run loop
auto	1.519671715326794	0.0	discard	4_4_in_6	Parallel run loop
auto	3.063409562578452	0.0	discard	49_3_in_6	Parallel run loop
auto	1.3660308937496013	0.0	discard	3_4_in_6	Parallel run loop
auto	3.9799000189504725	0.0	discard	4_8_in_DOMINO	Parallel run loop
auto	2.17157402403434	0.0	discard	3_8_in_8	Parallel run loop
auto	6.511348607795944	0.0	keep	6_8_in_4	Parallel run loop
auto	1.2895521768778089	0.0	discard	3_5_in_8	Parallel run loop
auto	2.785535729583611	0.0	discard	39_3_in_6	Parallel run loop
auto	1.8297164160655135	0.0	discard	4_5_in_CIRCLE	Parallel run loop
auto	3.278148122951711	0.0	keep	4_8_in_6	Parallel run loop
auto	2.6665593214202623	0.0	discard	4_CIRCLE_in_6	Parallel run loop
auto	2.3373957204435536	0.0	discard	4_5_in_DOMINO	Parallel run loop
auto	1.0294375004178038	0.0	discard	3_4_in_8	Parallel run loop
auto	6.8114261065851265	0.0	keep	8_5_in_3	Parallel run loop
auto	2.796595988115674	0.0	discard	40_3_in_6	Parallel run loop
auto	1.9766908508314134	0.0	discard	4_5_in_6	Parallel run loop
auto	2.4472145025616805	0.0	discard	4_5_in_5	Parallel run loop
auto	2.889629996220031	0.0	discard	3_8_in_6	Parallel run loop
auto	1.861669673765003	0.0	discard	4_4_in_5	Parallel run loop
auto	4.180406318261591	0.0	discard	7_5_in_4	Parallel run loop
auto	2.869404348297652	0.0	discard	41_3_in_6	Parallel run loop
auto	8.334571071193249	0.0	discard	8_6_in_3	Parallel run loop
auto	5.558108891374155	0.0	discard	5_5_in_3	Parallel run loop
auto	9.285064744792447	0.0	discard	5_8_in_3	Parallel run loop
auto	1.9796302646863635	0.0	discard	4_DOMINO_in_CIRCLE	Parallel run loop
auto	3.5490409630937405	0.0	discard	5_5_in_4	Parallel run loop
auto	2.977329748069131	0.0	keep	47_3_in_6	Parallel run loop
auto	6.830192045440366	0.0	discard	5_6_in_3	Parallel run loop
auto	11.510477950645116	0.0	keep	8_8_in_3	Parallel run loop
auto	1.5740009890436293	0.0	discard	8_4_in_8	Parallel run loop
auto	3.000287116578102	0.0	discard	49_3_in_6	Parallel run loop
auto	2.716111370352478	0.0	discard	3_8_in_CIRCLE	Parallel run loop
auto	3.314452326160118	0.0	discard	4_CIRCLE_in_5	Parallel run loop
auto	5.3819330876927705	0.0	discard	4_DOMINO_in_3	Parallel run loop
auto	7.035615131303261	0.0	discard	7_8_in_4	Parallel run loop
auto	2.319336543239429	0.0	discard	3_DOMINO_in_5	Parallel run loop
auto	6.5003483399828905	0.0	discard	7_5_in_3	Parallel run loop
auto	1.8616688165776094	0.0	discard	2_DOMINO_in_5	Parallel run loop
auto	11.066376749298056	0.0	discard	7_8_in_3	Parallel run loop
auto	1.3458723336884297	0.0	discard	6_4_in_8	Parallel run loop
auto	6.309426277028839	0.0	discard	6_DOMINO_in_3	Parallel run loop
auto	3.890739211343296	0.0	discard	6_5_in_4	Parallel run loop
auto	1.3660308937496013	0.0	discard	3_4_in_6	Parallel run loop
auto	1.2895521768778089	0.0	discard	3_5_in_8	Parallel run loop
auto	6.511434339515029	0.0	discard	6_8_in_4	Parallel run loop
auto	4.121649568326254	0.0	discard	3_5_in_3	Parallel run loop
auto	1.8297164160655135	0.0	discard	4_5_in_CIRCLE	Parallel run loop
auto	6.811357906855408	0.0	keep	8_5_in_3	Parallel run loop
auto	2.2324384696747983	0.0	discard	9_4_in_6	Parallel run loop
auto	2.1715732346593764	0.0	discard	3_8_in_8	Parallel run loop
auto	3.314452326160118	0.0	discard	4_CIRCLE_in_5	Parallel run loop
auto	2.7963163285168626	0.0	discard	40_3_in_6	Parallel run loop
auto	2.5886081332922775	0.0	discard	4_DOMINO_in_5	Parallel run loop
auto	2.2396014534707644	0.0	discard	4_6_in_CIRCLE	Parallel run loop
auto	1.822111684926714	0.0	discard	6_4_in_6	Parallel run loop
auto	13.24735389968115	0.0	keep	11_8_in_3	Parallel run loop
auto	5.558108891374155	0.0	discard	5_5_in_3	Parallel run loop
auto	2.6665593214202623	0.0	discard	4_CIRCLE_in_6	Parallel run loop
auto	1.519671715326794	0.0	discard	4_4_in_6	Parallel run loop
auto	7.93790827796582	0.0	discard	11_5_in_3	Parallel run loop
auto	1.861669673765003	0.0	discard	4_4_in_5	Parallel run loop
auto	3.1460317041957	0.0	discard	49_3_in_6	Parallel run loop
auto	1.9766904220053136	0.0	discard	4_5_in_6	Parallel run loop
auto	2.889629996220031	0.0	discard	3_8_in_6	Parallel run loop
auto	9.285064744792447	0.0	discard	5_8_in_3	Parallel run loop
auto	1.4369065696866217	0.0	keep	7_4_in_8	Parallel run loop
auto	2.716111370352478	0.0	discard	3_8_in_CIRCLE	Parallel run loop
auto	1.5740009890436293	0.0	discard	8_4_in_8	Parallel run loop
auto	6.830192045440366	0.0	discard	5_6_in_3	Parallel run loop
auto	8.333536267671072	0.0	keep	8_6_in_3	Parallel run loop
auto	2.4472145025616805	0.0	discard	4_5_in_5	Parallel run loop
auto	3.131216799232347	0.0	discard	47_3_in_6	Parallel run loop
auto	11.511253748721417	0.0	discard	8_8_in_3	Parallel run loop
auto	3.278148122951711	0.0	discard	4_8_in_6	Parallel run loop
auto	4.180422633972174	0.0	discard	7_5_in_4	Parallel run loop
auto	2.3890280931586987	0.0	keep	4_8_in_8	Parallel run loop
auto	6.511348607795944	0.0	discard	6_8_in_4	Parallel run loop
auto	1.8616688165776094	0.0	discard	2_DOMINO_in_5	Parallel run loop
auto	6.811357906855408	0.0	discard	8_5_in_3	Parallel run loop
auto	1.3458723336884297	0.0	discard	6_4_in_8	Parallel run loop
auto	0.8036669940717013	0.0	discard	5_3_in_8	Parallel run loop
auto	6.309426277028839	0.0	discard	6_DOMINO_in_3	Parallel run loop
auto	7.0356339305232325	0.0	discard	7_8_in_4	Parallel run loop
auto	3.5490409630937405	0.0	discard	5_5_in_4	Parallel run loop
auto	2.1677454009794803	0.0	discard	8_4_in_6	Parallel run loop
auto	2.5654377741581933	0.0	discard	8_4_in_5	Parallel run loop
auto	3.890739211343296	0.0	discard	6_5_in_4	Parallel run loop
auto	2.232256557748311	0.0	discard	9_4_in_6	Parallel run loop
auto	2.1715732346593764	0.0	discard	3_8_in_8	Parallel run loop
auto	8.191589520112474	0.0	keep	12_5_in_3	Parallel run loop
auto	3.7678117974672194	0.0	discard	5_DOMINO_in_4	Parallel run loop
auto	6.5003483399828905	0.0	discard	7_5_in_3	Parallel run loop
auto	4.121649568326254	0.0	discard	3_5_in_3	Parallel run loop
auto	2.6665593214202623	0.0	discard	4_CIRCLE_in_6	Parallel run loop
auto	1.5546040447651086	0.0	discard	2_5_in_DOMINO	Parallel run loop
auto	1.8221266057306487	0.0	discard	6_4_in_6	Parallel run loop
auto	1.4369065696866217	0.0	discard	7_4_in_8	Parallel run loop
auto	13.249359830706124	0.0	discard	11_8_in_3	Parallel run loop
auto	1.519671715326794	0.0	discard	4_4_in_6	Parallel run loop
auto	1.861669673765003	0.0	discard	4_4_in_5	Parallel run loop
auto	8.2426904265986	0.0	keep	10_8_in_4	Parallel run loop
auto	7.937977905503122	0.0	discard	11_5_in_3	Parallel run loop
auto	2.5886081332922775	0.0	discard	4_DOMINO_in_5	Parallel run loop
auto	7.089787898053598	0.0	discard	9_5_in_3	Parallel run loop
auto	2.2396014534707644	0.0	discard	4_6_in_CIRCLE	Parallel run loop
auto	2.889629996220031	0.0	discard	3_8_in_6	Parallel run loop
auto	1.9766904220053136	0.0	discard	4_5_in_6	Parallel run loop
auto	5.828435470809099	0.0	discard	5_8_in_4	Parallel run loop
auto	0.8036669940717013	0.0	discard	5_3_in_8	Parallel run loop
auto	6.8114326062102535	0.0	discard	8_5_in_3	Parallel run loop
auto	1.2773530686815977	0.0	keep	7_3_in_6	Parallel run loop
auto	6.511434339515029	0.0	discard	6_8_in_4	Parallel run loop
auto	4.906674282171963	0.0	keep	10_5_in_4	Parallel run loop
auto	6.836942457137506	0.0	discard	3_8_in_3	Parallel run loop
auto	3.1025322179905857	0.0	discard	4_5_in_4	Parallel run loop
auto	11.510547028481087	0.0	discard	8_8_in_3	Parallel run loop
auto	4.180372828743098	0.0	discard	7_5_in_4	Parallel run loop
auto	1.3458723336884297	0.0	discard	6_4_in_8	Parallel run loop
auto	6.309426277028839	0.0	discard	6_DOMINO_in_3	Parallel run loop
auto	8.334571071193249	0.0	discard	8_6_in_3	Parallel run loop
auto	2.4472145025616805	0.0	discard	4_5_in_5	Parallel run loop
auto	3.278150372781259	0.0	discard	4_8_in_6	Parallel run loop
auto	1.5740009890436293	0.0	discard	8_4_in_8	Parallel run loop
auto	2.3890280931586987	0.0	discard	4_8_in_8	Parallel run loop
auto	3.7678117974672194	0.0	discard	5_DOMINO_in_4	Parallel run loop
auto	1.5546040447651086	0.0	discard	2_5_in_DOMINO	Parallel run loop
auto	2.5654315664302345	0.0	keep	8_4_in_5	Parallel run loop
auto	8.57617972109546	0.0	discard	11_8_in_4	Parallel run loop
auto	4.121649568326254	0.0	discard	3_5_in_3	Parallel run loop
auto	13.247402348132615	0.0	discard	11_8_in_3	Parallel run loop
auto	7.035615131303261	0.0	discard	7_8_in_4	Parallel run loop
auto	2.23209524305929	0.0	keep	9_4_in_6	Parallel run loop
auto	7.154711647361734	0.0	discard	8_DOMINO_in_3	Parallel run loop
auto	8.191916526657325	0.0	discard	12_5_in_3	Parallel run loop
auto	3.890739211343296	0.0	discard	6_5_in_4	Parallel run loop
auto	2.6940191638137096	0.0	keep	9_4_in_5	Parallel run loop
auto	3.5490409630937405	0.0	discard	5_5_in_4	Parallel run loop
auto	1.4369076315702392	0.0	discard	7_4_in_8	Parallel run loop
auto	1.8221266057306487	0.0	discard	6_4_in_6	Parallel run loop
auto	2.43462951535791	0.0	discard	7_4_in_5	Parallel run loop
auto	1.8946917763403228	0.0	discard	2_6_in_DOMINO	Parallel run loop
auto	2.5886081332922775	0.0	discard	4_DOMINO_in_5	Parallel run loop
auto	5.828435470809099	0.0	discard	5_8_in_4	Parallel run loop
auto	7.93790827796582	0.0	discard	11_5_in_3	Parallel run loop
auto	1.9766904220053136	0.0	discard	4_5_in_6	Parallel run loop
auto	8.242726706535532	0.0	discard	10_8_in_4	Parallel run loop
auto	5.115889186490657	0.0	discard	11_5_in_4	Parallel run loop
auto	3.7678117974672194	0.0	discard	5_DOMINO_in_4	Parallel run loop
auto	4.121649568326254	0.0	discard	3_5_in_3	Parallel run loop
auto	7.090118879585568	0.0	discard	9_5_in_3	Parallel run loop
