commit	score	memory_gb	status	problem	description
auto	4.5482254449477555	0.0	discard	44_3_in_5	Parallel run loop
auto	2.553898236100434	0.0	discard	15_3_in_5	Parallel run loop
auto	4.777923182911854	0.0	discard	46_3_in_5	Parallel run loop
auto	4.6502114301125435	0.0	discard	45_3_in_5	Parallel run loop
auto	1.4733112988527972	0.0	discard	5_3_in_5	Parallel run loop
auto	2.466121524922948	0.0	discard	14_3_in_5	Parallel run loop
auto	1.6123349324720873	0.0	discard	6_3_in_5	Parallel run loop
auto	4.825042646460126	0.0	discard	35_3_in_4	Parallel run loop
auto	4.014216019599866	0.0	discard	35_3_in_5	Parallel run loop
auto	4.121126421036263	0.0	discard	26_3_in_4	Parallel run loop
auto	4.282839274777788	0.0	discard	28_3_in_4	Parallel run loop
auto	4.440465870788271	0.0	discard	30_3_in_4	Parallel run loop
auto	4.719124830539161	0.0	discard	34_3_in_4	Parallel run loop
auto	4.994973721928029	0.0	discard	37_3_in_4	Parallel run loop
auto	1.9752453399855623	0.0	discard	9_3_in_5	Parallel run loop
auto	2.0829542800502256	0.0	discard	10_3_in_5	Parallel run loop
auto	3.2854955332564635	0.0	discard	24_3_in_5	Parallel run loop
auto	3.682084670692966	0.0	discard	21_3_in_4	Parallel run loop
auto	5.000729469232406	0.0	discard	49_3_in_5	Parallel run loop
auto	5.844945900783133	0.0	discard	47_3_in_4	Parallel run loop
auto	2.856450043138434	0.0	discard	13_3_in_4	Parallel run loop
auto	3.058076730932037	0.0	discard	21_3_in_5	Parallel run loop
auto	4.339927473485352	0.0	discard	40_3_in_5	Parallel run loop
auto	3.487817072276372	0.0	discard	27_3_in_5	Parallel run loop
auto	5.293632709653392	0.0	discard	41_3_in_4	Parallel run loop
auto	5.411331920693078	0.0	discard	42_3_in_4	Parallel run loop
auto	4.904251788001746	0.0	discard	36_3_in_4	Parallel run loop
auto	5.628345798382945	0.0	discard	45_3_in_4	Parallel run loop
auto	4.933491242259702	0.0	keep	50_3_in_5	Parallel run loop
auto	2.731812428180871	0.0	discard	17_3_in_5	Parallel run loop
auto	3.68565406076074	0.0	discard	30_3_in_5	Parallel run loop
auto	2.9808463690308096	0.0	discard	20_3_in_5	Parallel run loop
auto	2.1838441649808495	0.0	discard	11_3_in_5	Parallel run loop
auto	4.467286074352201	0.0	keep	44_3_in_5	Parallel run loop
auto	4.695292623891743	0.0	discard	45_3_in_5	Parallel run loop
auto	2.8160408429227397	0.0	discard	18_3_in_5	Parallel run loop
auto	4.758639953044003	0.0	discard	46_3_in_5	Parallel run loop
auto	1.472869645419125	0.0	discard	5_3_in_5	Parallel run loop
auto	2.4674367327916724	0.0	discard	14_3_in_5	Parallel run loop
auto	4.8330393892520345	0.0	discard	35_3_in_4	Parallel run loop
auto	3.9834523819333825	0.0	keep	35_3_in_5	Parallel run loop
auto	4.427252905788712	0.0	discard	30_3_in_4	Parallel run loop
auto	5.069468958857999	0.0	discard	38_3_in_4	Parallel run loop
auto	5.929597324436657	0.0	discard	48_3_in_4	Parallel run loop
auto	4.871884021299947	0.0	discard	47_3_in_5	Parallel run loop
auto	4.573434105529997	0.0	discard	43_3_in_5	Parallel run loop
auto	4.36486087557988	0.0	discard	29_3_in_4	Parallel run loop
auto	3.3888843888255074	0.0	keep	26_3_in_5	Parallel run loop
auto	4.147103315745588	0.0	discard	37_3_in_5	Parallel run loop
auto	3.9475564034626425	0.0	discard	34_3_in_5	Parallel run loop
auto	1.7415208367392434	0.0	discard	7_3_in_5	Parallel run loop
auto	3.2087953700115985	0.0	discard	23_3_in_5	Parallel run loop
auto	3.9475368790472745	0.0	discard	24_3_in_4	Parallel run loop
auto	4.761010941091636	0.0	discard	48_3_in_5	Parallel run loop
auto	4.586035174279099	0.0	discard	32_3_in_4	Parallel run loop
auto	4.0228558176752465	0.0	discard	25_3_in_4	Parallel run loop
auto	5.362666521408643	0.0	discard	42_3_in_4	Parallel run loop
auto	3.037902516636446	0.0	keep	21_3_in_5	Parallel run loop
auto	5.05461090924511	0.0	discard	50_3_in_5	Parallel run loop
auto	4.905141162767265	0.0	discard	36_3_in_4	Parallel run loop
auto	5.274239398750538	0.0	discard	41_3_in_4	Parallel run loop
auto	3.6859034221805262	0.0	discard	30_3_in_5	Parallel run loop
auto	4.225418443273481	0.0	discard	39_3_in_5	Parallel run loop
auto	3.7579018758582117	0.0	discard	31_3_in_5	Parallel run loop
auto	3.7647101244802705	0.0	discard	22_3_in_4	Parallel run loop
auto	3.628742459891808	0.0	discard	29_3_in_5	Parallel run loop
auto	2.978227380319793	0.0	discard	20_3_in_5	Parallel run loop
auto	4.6350746688466264	0.0	discard	44_3_in_5	Parallel run loop
auto	4.0151099006090165	0.0	discard	35_3_in_5	Parallel run loop
auto	4.832873041768879	0.0	discard	35_3_in_4	Parallel run loop
auto	3.3904519203160954	0.0	discard	18_3_in_4	Parallel run loop
auto	3.561379717776799	0.0	discard	28_3_in_5	Parallel run loop
auto	2.5571159829172716	0.0	discard	15_3_in_5	Parallel run loop
auto	4.281418775436012	0.0	discard	28_3_in_4	Parallel run loop
auto	1.6123349509954141	0.0	discard	6_3_in_5	Parallel run loop
auto	4.440011466621993	0.0	discard	30_3_in_4	Parallel run loop
auto	4.988441690022295	0.0	discard	37_3_in_4	Parallel run loop
auto	3.945541471982394	0.0	discard	24_3_in_4	Parallel run loop
auto	5.431820202634463	0.0	discard	43_3_in_4	Parallel run loop
auto	1.7415208664378672	0.0	discard	7_3_in_5	Parallel run loop
auto	3.4224895063224103	0.0	discard	26_3_in_5	Parallel run loop
auto	4.772344962758146	0.0	discard	48_3_in_5	Parallel run loop
auto	4.742393238960607	0.0	discard	34_3_in_4	Parallel run loop
auto	3.278944259181874	0.0	discard	24_3_in_5	Parallel run loop
auto	3.6791508624476785	0.0	discard	21_3_in_4	Parallel run loop
auto	4.871493659257416	0.0	discard	36_3_in_4	Parallel run loop
auto	4.032076001390384	0.0	discard	25_3_in_4	Parallel run loop
auto	5.006923261780616	0.0	discard	49_3_in_5	Parallel run loop
auto	3.0535208412852013	0.0	discard	21_3_in_5	Parallel run loop
auto	3.208689194713935	0.0	discard	23_3_in_5	Parallel run loop
auto	5.348758660950942	0.0	discard	42_3_in_4	Parallel run loop
auto	5.024964688877495	0.0	discard	50_3_in_5	Parallel run loop
auto	3.687270870722558	0.0	discard	30_3_in_5	Parallel run loop
auto	5.336534945954026	0.0	discard	41_3_in_4	Parallel run loop
auto	5.774430926562138	0.0	discard	47_3_in_4	Parallel run loop
auto	3.1294489741884255	0.0	discard	22_3_in_5	Parallel run loop
auto	4.4173569145070894	0.0	discard	41_3_in_5	Parallel run loop
auto	4.34733060947153	0.0	discard	40_3_in_5	Parallel run loop
auto	5.669494159712282	0.0	discard	45_3_in_4	Parallel run loop
auto	2.6437808458475534	0.0	discard	16_3_in_5	Parallel run loop
auto	5.7271232355910735	0.0	discard	46_3_in_4	Parallel run loop
auto	3.77426964153526	0.0	discard	22_3_in_4	Parallel run loop
auto	2.7954319496263142	0.0	keep	18_3_in_5	Parallel run loop
auto	2.18875162303364	0.0	discard	11_3_in_5	Parallel run loop
auto	4.66984759647921	0.0	discard	33_3_in_4	Parallel run loop
auto	1.8622720838192768	0.0	discard	8_3_in_5	Parallel run loop
auto	3.3552897632501315	0.0	discard	25_3_in_5	Parallel run loop
auto	4.5471086147615	0.0	discard	43_3_in_5	Parallel run loop
auto	3.9396574177356634	0.0	discard	24_3_in_4	Parallel run loop
auto	5.058922390152854	0.0	discard	38_3_in_4	Parallel run loop
auto	5.486253611839995	0.0	discard	43_3_in_4	Parallel run loop
auto	3.4169114120878015	0.0	discard	26_3_in_5	Parallel run loop
auto	4.848854088908252	0.0	discard	48_3_in_5	Parallel run loop
auto	4.358594465828277	0.0	discard	29_3_in_4	Parallel run loop
auto	4.8412354199467735	0.0	discard	47_3_in_5	Parallel run loop
auto	4.145332669846357	0.0	discard	37_3_in_5	Parallel run loop
auto	3.2148479778467705	0.0	discard	23_3_in_5	Parallel run loop
auto	5.932996747424285	0.0	discard	48_3_in_4	Parallel run loop
auto	3.0577687055548575	0.0	discard	21_3_in_5	Parallel run loop
auto	4.033358371248067	0.0	discard	25_3_in_4	Parallel run loop
auto	5.098313459946513	0.0	discard	50_3_in_5	Parallel run loop
auto	2.0821052459622593	0.0	discard	10_3_in_5	Parallel run loop
auto	4.890113833258741	0.0	discard	36_3_in_4	Parallel run loop
auto	3.943282963309274	0.0	discard	34_3_in_5	Parallel run loop
auto	5.118426745030366	0.0	discard	39_3_in_4	Parallel run loop
auto	2.379135616866902	0.0	discard	13_3_in_5	Parallel run loop
auto	3.687192461596473	0.0	discard	30_3_in_5	Parallel run loop
auto	4.596047595394476	0.0	discard	32_3_in_4	Parallel run loop
auto	3.1370148299726757	0.0	discard	22_3_in_5	Parallel run loop
auto	2.281719560552744	0.0	discard	12_3_in_5	Parallel run loop
auto	2.643240068428238	0.0	discard	16_3_in_5	Parallel run loop
auto	1.974788090047326	0.0	discard	9_3_in_5	Parallel run loop
auto	2.8206868455694467	0.0	discard	18_3_in_5	Parallel run loop
auto	2.858365202822248	0.0	discard	13_3_in_4	Parallel run loop
auto	4.263502373144794	0.0	discard	39_3_in_5	Parallel run loop
auto	3.862205793382137	0.0	discard	23_3_in_4	Parallel run loop
auto	3.7429737566831425	0.0	discard	22_3_in_4	Parallel run loop
auto	1.862416174405252	0.0	discard	8_3_in_5	Parallel run loop
auto	3.4908321665139126	0.0	discard	27_3_in_5	Parallel run loop
auto	4.230818161588912	0.0	discard	38_3_in_5	Parallel run loop
auto	5.075740362879084	0.0	discard	38_3_in_4	Parallel run loop
auto	3.758611694662672	0.0	discard	31_3_in_5	Parallel run loop
auto	4.341502800816147	0.0	discard	29_3_in_4	Parallel run loop
auto	3.945530020433342	0.0	discard	24_3_in_4	Parallel run loop
auto	3.405075824004262	0.0	discard	26_3_in_5	Parallel run loop
auto	4.831860226806961	0.0	discard	47_3_in_5	Parallel run loop
auto	4.9404894491967974	0.0	discard	48_3_in_5	Parallel run loop
auto	3.058944768747624	0.0	discard	21_3_in_5	Parallel run loop
auto	4.140860508585794	0.0	discard	37_3_in_5	Parallel run loop
auto	3.624380203901829	0.0	discard	29_3_in_5	Parallel run loop
auto	3.3755421118495725	0.0	discard	18_3_in_4	Parallel run loop
auto	3.943395950764466	0.0	discard	34_3_in_5	Parallel run loop
auto	4.199790042762328	0.0	discard	27_3_in_4	Parallel run loop
auto	2.0821321442343774	0.0	discard	10_3_in_5	Parallel run loop
auto	2.554758807517126	0.0	discard	15_3_in_5	Parallel run loop
auto	4.885167252212108	0.0	discard	36_3_in_4	Parallel run loop
auto	5.1373939705447285	0.0	discard	39_3_in_4	Parallel run loop
auto	4.594850033057726	0.0	keep	45_3_in_5	Parallel run loop
auto	3.55435028545507	0.0	discard	28_3_in_5	Parallel run loop
auto	4.587406945572082	0.0	discard	32_3_in_4	Parallel run loop
auto	2.647240149045633	0.0	discard	16_3_in_5	Parallel run loop
auto	2.4678352443556686	0.0	discard	14_3_in_5	Parallel run loop
auto	3.134458029321926	0.0	discard	22_3_in_5	Parallel run loop
auto	2.859452260390261	0.0	discard	13_3_in_4	Parallel run loop
auto	1.6123349330767753	0.0	discard	6_3_in_5	Parallel run loop
auto	2.815944823570833	0.0	discard	18_3_in_5	Parallel run loop
auto	3.8168613352522645	0.0	discard	32_3_in_5	Parallel run loop
auto	4.08044414689453	0.0	discard	36_3_in_5	Parallel run loop
auto	1.4719840926702379	0.0	discard	5_3_in_5	Parallel run loop
auto	4.278080707877572	0.0	discard	28_3_in_4	Parallel run loop
auto	3.775839272718553	0.0	discard	22_3_in_4	Parallel run loop
auto	3.7551750552726033	0.0	discard	31_3_in_5	Parallel run loop
auto	3.679030286017858	0.0	discard	21_3_in_4	Parallel run loop
auto	4.989697451147667	0.0	discard	37_3_in_4	Parallel run loop
auto	3.280717540095799	0.0	discard	24_3_in_5	Parallel run loop
auto	3.41525722514794	0.0	discard	26_3_in_5	Parallel run loop
auto	4.876145609055773	0.0	discard	48_3_in_5	Parallel run loop
auto	4.361813129767265	0.0	discard	29_3_in_4	Parallel run loop
auto	3.9493687821616987	0.0	discard	24_3_in_4	Parallel run loop
auto	4.721683036969594	0.0	discard	34_3_in_4	Parallel run loop
auto	4.129382782905175	0.0	discard	37_3_in_5	Parallel run loop
auto	4.887932299088258	0.0	discard	49_3_in_5	Parallel run loop
auto	4.425709645578415	0.0	discard	41_3_in_5	Parallel run loop
auto	5.82983700250971	0.0	discard	47_3_in_4	Parallel run loop
auto	3.3745052376588314	0.0	discard	18_3_in_4	Parallel run loop
auto	3.53914390568379	0.0	discard	28_3_in_5	Parallel run loop
auto	2.5547866144587945	0.0	discard	15_3_in_5	Parallel run loop
auto	4.900570555385496	0.0	discard	36_3_in_4	Parallel run loop
auto	3.481065967853155	0.0	discard	19_3_in_4	Parallel run loop
auto	4.31989096210617	0.0	discard	40_3_in_5	Parallel run loop
auto	4.680320742610261	0.0	discard	45_3_in_5	Parallel run loop
auto	5.750566983266424	0.0	discard	46_3_in_4	Parallel run loop
auto	5.201165408355971	0.0	discard	40_3_in_4	Parallel run loop
auto	2.8185806872892836	0.0	discard	18_3_in_5	Parallel run loop
auto	4.674880242005657	0.0	discard	33_3_in_4	Parallel run loop
auto	2.183552901485476	0.0	discard	11_3_in_5	Parallel run loop
auto	5.707343503622244	0.0	discard	45_3_in_4	Parallel run loop
auto	1.4735934307806855	0.0	discard	5_3_in_5	Parallel run loop
auto	4.283207422516762	0.0	discard	28_3_in_4	Parallel run loop
auto	3.8206788952770947	0.0	discard	32_3_in_5	Parallel run loop
auto	2.856971069599083	0.0	discard	13_3_in_4	Parallel run loop
auto	4.092476862512821	0.0	discard	36_3_in_5	Parallel run loop
auto	3.283222805302757	0.0	discard	24_3_in_5	Parallel run loop
auto	5.744690457100739	0.0	keep	48_3_in_4	Parallel run loop
auto	3.3341013868105036	0.0	discard	25_3_in_5	Parallel run loop
auto	4.120325320823583	0.0	discard	26_3_in_4	Parallel run loop
auto	3.8890920112006744	0.0	discard	33_3_in_5	Parallel run loop
auto	4.93262672615157	0.0	keep	37_3_in_4	Parallel run loop
auto	1.741520866766487	0.0	discard	7_3_in_5	Parallel run loop
auto	4.562032078387456	0.0	discard	43_3_in_5	Parallel run loop
auto	4.746504056315433	0.0	discard	34_3_in_4	Parallel run loop
auto	3.3751769276516335	0.0	discard	18_3_in_4	Parallel run loop
auto	1.9752434868994524	0.0	discard	9_3_in_5	Parallel run loop
auto	2.375846612170735	0.0	discard	13_3_in_5	Parallel run loop
auto	4.968962311953534	0.0	discard	49_3_in_5	Parallel run loop
auto	2.2832303171733703	0.0	discard	12_3_in_5	Parallel run loop
auto	4.265101731376375	0.0	discard	39_3_in_5	Parallel run loop
auto	4.31844998491346	0.0	discard	40_3_in_5	Parallel run loop
auto	4.894371710129382	0.0	discard	36_3_in_4	Parallel run loop
auto	3.5465755140330404	0.0	discard	28_3_in_5	Parallel run loop
auto	3.4689276614970064	0.0	discard	19_3_in_4	Parallel run loop
auto	2.5565081596646153	0.0	discard	15_3_in_5	Parallel run loop
auto	3.8473670921356797	0.0	discard	23_3_in_4	Parallel run loop
auto	4.152137124180145	0.0	keep	38_3_in_5	Parallel run loop
auto	2.18488759208386	0.0	discard	11_3_in_5	Parallel run loop
auto	3.4891289394435154	0.0	discard	27_3_in_5	Parallel run loop
auto	2.858544936606995	0.0	discard	13_3_in_4	Parallel run loop
auto	5.722187193588698	0.0	discard	46_3_in_4	Parallel run loop
auto	3.623311334981714	0.0	discard	29_3_in_5	Parallel run loop
auto	4.20512018880703	0.0	discard	27_3_in_4	Parallel run loop
auto	2.4679133123886503	0.0	discard	14_3_in_5	Parallel run loop
auto	1.6123349429219833	0.0	discard	6_3_in_5	Parallel run loop
auto	4.517833896537312	0.0	discard	31_3_in_4	Parallel run loop
auto	5.943418243793153	0.0	discard	48_3_in_4	Parallel run loop
auto	3.3536842047922235	0.0	discard	25_3_in_5	Parallel run loop
auto	4.4374341912448125	0.0	discard	30_3_in_4	Parallel run loop
auto	3.9897857031199475	0.0	discard	35_3_in_5	Parallel run loop
auto	5.499210787670189	0.0	discard	43_3_in_4	Parallel run loop
auto	4.998157855515855	0.0	discard	37_3_in_4	Parallel run loop
auto	3.680051860288925	0.0	discard	21_3_in_4	Parallel run loop
auto	1.7415208934363213	0.0	discard	7_3_in_5	Parallel run loop
auto	4.510493453485941	0.0	discard	43_3_in_5	Parallel run loop
auto	1.9759217523863546	0.0	discard	9_3_in_5	Parallel run loop
auto	4.739567670139682	0.0	discard	34_3_in_4	Parallel run loop
auto	3.387085036682701	0.0	discard	18_3_in_4	Parallel run loop
auto	4.963580242468016	0.0	discard	49_3_in_5	Parallel run loop
auto	3.5873658129057695	0.0	discard	20_3_in_4	Parallel run loop
auto	3.4680188049045104	0.0	discard	19_3_in_4	Parallel run loop
auto	4.408043779600383	0.0	discard	41_3_in_5	Parallel run loop
auto	4.303271296636266	0.0	discard	40_3_in_5	Parallel run loop
auto	5.545565328029483	0.0	discard	44_3_in_4	Parallel run loop
auto	5.779207271098406	0.0	discard	47_3_in_4	Parallel run loop
auto	4.263502373144794	0.0	discard	39_3_in_5	Parallel run loop
auto	3.556750445599029	0.0	discard	28_3_in_5	Parallel run loop
auto	5.217609943391875	0.0	discard	40_3_in_4	Parallel run loop
auto	3.4937538479767936	0.0	discard	27_3_in_5	Parallel run loop
auto	5.753312181573567	0.0	discard	46_3_in_4	Parallel run loop
auto	4.654151930289929	0.0	discard	33_3_in_4	Parallel run loop
auto	5.5068625434794205	0.0	keep	45_3_in_4	Parallel run loop
auto	4.092444011989303	0.0	discard	26_3_in_4	Parallel run loop
auto	4.205883684352359	0.0	discard	38_3_in_5	Parallel run loop
auto	5.318307726375001	0.0	discard	41_3_in_4	Parallel run loop
auto	2.467474853823032	0.0	discard	14_3_in_5	Parallel run loop
auto	5.068608299149818	0.0	discard	38_3_in_4	Parallel run loop
auto	1.862270852391448	0.0	discard	8_3_in_5	Parallel run loop
auto	4.48316846774775	0.0	discard	42_3_in_5	Parallel run loop
auto	4.829577907708746	0.0	discard	47_3_in_5	Parallel run loop
auto	4.0017663859876835	0.0	discard	35_3_in_5	Parallel run loop
auto	2.3763449095988185	0.0	discard	13_3_in_5	Parallel run loop
auto	3.876525544461648	0.0	discard	33_3_in_5	Parallel run loop
auto	2.082168623435542	0.0	discard	10_3_in_5	Parallel run loop
auto	4.828639698157974	0.0	discard	35_3_in_4	Parallel run loop
auto	3.682480353133396	0.0	discard	21_3_in_4	Parallel run loop
auto	1.7415210279474596	0.0	discard	7_3_in_5	Parallel run loop
auto	3.9491139102696873	0.0	discard	34_3_in_5	Parallel run loop
auto	3.4739425884646424	0.0	discard	19_3_in_4	Parallel run loop
auto	3.2102396436156426	0.0	discard	23_3_in_5	Parallel run loop
auto	3.3873174066020546	0.0	discard	18_3_in_4	Parallel run loop
auto	3.558158907984423	0.0	discard	28_3_in_5	Parallel run loop
auto	5.003809510261405	0.0	discard	49_3_in_5	Parallel run loop
auto	4.2957865787028675	0.0	discard	40_3_in_5	Parallel run loop
auto	5.807274721653209	0.0	discard	47_3_in_4	Parallel run loop
auto	5.153021075855383	0.0	discard	39_3_in_4	Parallel run loop
auto	4.585484711591597	0.0	discard	32_3_in_4	Parallel run loop
auto	4.254283077855283	0.0	discard	39_3_in_5	Parallel run loop
auto	4.022939790939626	0.0	discard	25_3_in_4	Parallel run loop
auto	2.7249974310545406	0.0	discard	17_3_in_5	Parallel run loop
auto	2.2819497265106814	0.0	discard	12_3_in_5	Parallel run loop
auto	5.536239110928234	0.0	discard	45_3_in_4	Parallel run loop
auto	4.11519441823685	0.0	discard	26_3_in_4	Parallel run loop
auto	5.801457570631635	0.0	discard	46_3_in_4	Parallel run loop
auto	5.333339773085371	0.0	discard	41_3_in_4	Parallel run loop
auto	4.672519094050451	0.0	discard	33_3_in_4	Parallel run loop
auto	1.8622752858782747	0.0	discard	8_3_in_5	Parallel run loop
auto	4.775689047506527	0.0	discard	46_3_in_5	Parallel run loop
auto	2.3753095354872182	0.0	discard	13_3_in_5	Parallel run loop
auto	3.86591706735063	0.0	discard	23_3_in_4	Parallel run loop
auto	4.01717134146939	0.0	discard	35_3_in_5	Parallel run loop
auto	4.858633932434746	0.0	discard	47_3_in_5	Parallel run loop
auto	5.0721030902387945	0.0	discard	38_3_in_4	Parallel run loop
auto	4.218461600041243	0.0	discard	38_3_in_5	Parallel run loop
auto	3.759162489462352	0.0	discard	31_3_in_5	Parallel run loop
auto	3.625923341971663	0.0	discard	29_3_in_5	Parallel run loop
auto	3.484125529776815	0.0	discard	19_3_in_4	Parallel run loop
auto	4.201873442983828	0.0	discard	27_3_in_4	Parallel run loop
auto	3.954937200354723	0.0	discard	34_3_in_5	Parallel run loop
auto	1.6123349418985229	0.0	discard	6_3_in_5	Parallel run loop
auto	1.4735924916566159	0.0	discard	5_3_in_5	Parallel run loop
auto	4.561132686861078	0.0	keep	45_3_in_5	Parallel run loop
auto	4.575952783738667	0.0	discard	32_3_in_4	Parallel run loop
auto	5.043520862041086	0.0	discard	49_3_in_5	Parallel run loop
auto	4.270504221721685	0.0	discard	28_3_in_4	Parallel run loop
auto	4.510707271590469	0.0	discard	31_3_in_4	Parallel run loop
auto	4.350306184780458	0.0	discard	40_3_in_5	Parallel run loop
auto	3.801772215399618	0.0	discard	32_3_in_5	Parallel run loop
auto	5.81551195876393	0.0	discard	47_3_in_4	Parallel run loop
auto	4.021093120997563	0.0	discard	25_3_in_4	Parallel run loop
auto	4.056757505681798	0.0	discard	36_3_in_5	Parallel run loop
auto	2.7177461563499854	0.0	keep	17_3_in_5	Parallel run loop
auto	5.491951460441867	0.0	discard	43_3_in_4	Parallel run loop
auto	4.433848874750047	0.0	discard	30_3_in_4	Parallel run loop
auto	4.119850353166296	0.0	discard	26_3_in_4	Parallel run loop
auto	5.651436199073824	0.0	discard	45_3_in_4	Parallel run loop
auto	3.285273689993606	0.0	discard	24_3_in_5	Parallel run loop
auto	4.433359356028343	0.0	discard	41_3_in_5	Parallel run loop
auto	2.963344864323639	0.0	discard	20_3_in_5	Parallel run loop
auto	4.8460746021895975	0.0	discard	47_3_in_5	Parallel run loop
auto	3.619352052300067	0.0	discard	29_3_in_5	Parallel run loop
auto	4.646354402577558	0.0	discard	33_3_in_4	Parallel run loop
auto	3.13791891076134	0.0	discard	22_3_in_5	Parallel run loop
auto	2.374542391640542	0.0	discard	13_3_in_5	Parallel run loop
auto	3.5895567940622093	0.0	discard	20_3_in_4	Parallel run loop
auto	5.2383714382238535	0.0	discard	40_3_in_4	Parallel run loop
auto	2.894490100452049	0.0	discard	19_3_in_5	Parallel run loop
auto	5.5696101560901825	0.0	discard	44_3_in_4	Parallel run loop
auto	4.603076354823493	0.0	discard	45_3_in_5	Parallel run loop
auto	5.051499597962342	0.0	discard	50_3_in_5	Parallel run loop
auto	2.18457088804288	0.0	discard	11_3_in_5	Parallel run loop
auto	2.6452377666002747	0.0	discard	16_3_in_5	Parallel run loop
auto	4.501108891407314	0.0	discard	42_3_in_5	Parallel run loop
auto	3.3575837057777016	0.0	discard	25_3_in_5	Parallel run loop
auto	4.585374638034089	0.0	discard	32_3_in_4	Parallel run loop
auto	3.8187498822758834	0.0	discard	32_3_in_5	Parallel run loop
auto	4.282665295217591	0.0	discard	28_3_in_4	Parallel run loop
auto	4.544415090187962	0.0	discard	43_3_in_5	Parallel run loop
auto	4.356790514046961	0.0	discard	29_3_in_4	Parallel run loop
auto	4.019043808057727	0.0	discard	25_3_in_4	Parallel run loop
auto	4.063147537675553	0.0	discard	36_3_in_5	Parallel run loop
