commit	score	memory_gb	status	problem	description
auto	2.583568644403222	0.0	discard	22_3_in_DOMINO	Parallel run loop
auto	2.874818647722945	0.0	discard	11_4_in_DOMINO	Parallel run loop
auto	3.746847963455798	0.0	discard	11_3_in_3	Parallel run loop
auto	3.7914164805615247	0.0	discard	22_4_in_DOMINO	Parallel run loop
auto	4.014200476639972	0.0	discard	25_4_in_DOMINO	Parallel run loop
auto	4.020316954443297	0.0	discard	13_3_in_3	Parallel run loop
auto	5.0279184253713805	0.0	discard	41_4_in_DOMINO	Parallel run loop
auto	2.005224330196466	0.0	keep	16_3_in_DOMINO	Parallel run loop
auto	5.97459412235061	0.0	keep	32_3_in_3	Parallel run loop
auto	2.459624797495953	0.0	keep	21_3_in_circle	Parallel run loop
auto	3.9241229167278884	0.0	discard	24_4_in_DOMINO	Parallel run loop
auto	4.943502864466721	0.0	discard	40_4_in_DOMINO	Parallel run loop
auto	4.867215641034746	0.0	discard	38_4_in_DOMINO	Parallel run loop
auto	3.1064519114939206	0.0	discard	21_4_in_CIRCLE	Parallel run loop
auto	1.9814258619960288	0.0	keep	15_3_in_DOMINO	Parallel run loop
auto	1.7011773066844613	0.0	discard	10_3_in_DOMINO	Parallel run loop
auto	2.3465132305432332	0.0	discard	20_3_in_DOMINO	Parallel run loop
auto	4.912194872736637	0.0	discard	20_3_in_3	Parallel run loop
auto	1.911646754271575	0.0	discard	14_3_in_DOMINO	Parallel run loop
auto	2.4901149670854683	0.0	discard	19_3_in_DOMINO	Parallel run loop
auto	4.475096077264324	0.0	discard	33_4_in_DOMINO	Parallel run loop
auto	6.04949978512713	0.0	discard	31_3_in_3	Parallel run loop
auto	3.265553306575606	0.0	discard	26_4_in_CIRCLE	Parallel run loop
auto	3.115803431953349	0.0	discard	23_4_in_CIRCLE	Parallel run loop
auto	3.5236257287305413	0.0	discard	30_4_in_CIRCLE	Parallel run loop
auto	2.643847752583437	0.0	discard	16_4_in_CIRCLE	Parallel run loop
auto	5.610481630703065	0.0	discard	26_3_in_3	Parallel run loop
auto	3.2232942054853804	0.0	discard	25_4_in_CIRCLE	Parallel run loop
auto	4.020360663309433	0.0	discard	26_4_in_DOMINO	Parallel run loop
auto	2.6178995525689905	0.0	discard	22_3_in_DOMINO	Parallel run loop
auto	2.8776782496867814	0.0	discard	19_4_in_CIRCLE	Parallel run loop
auto	4.510334332905153	0.0	discard	34_4_in_DOMINO	Parallel run loop
auto	4.019565593893119	0.0	discard	33_4_in_CIRCLE	Parallel run loop
auto	2.874818647722945	0.0	discard	11_4_in_DOMINO	Parallel run loop
auto	2.9479967602447665	0.0	discard	20_4_in_CIRCLE	Parallel run loop
auto	3.7914164805615247	0.0	discard	22_4_in_DOMINO	Parallel run loop
auto	4.014200476639972	0.0	discard	25_4_in_DOMINO	Parallel run loop
auto	2.0092432104642475	0.0	discard	16_3_in_DOMINO	Parallel run loop
auto	2.0340141568817938	0.0	keep	21_3_in_circle	Parallel run loop
auto	5.984737071313207	0.0	discard	32_3_in_3	Parallel run loop
auto	1.9812012749739183	0.0	keep	15_3_in_DOMINO	Parallel run loop
auto	3.8688750047412386	0.0	discard	23_4_in_DOMINO	Parallel run loop
auto	2.1599791937891735	0.0	discard	17_3_in_DOMINO	Parallel run loop
auto	3.789834932560656	0.0	discard	34_4_in_CIRCLE	Parallel run loop
auto	5.029602176115146	0.0	discard	42_4_in_DOMINO	Parallel run loop
auto	3.631402274099691	0.0	discard	29_4_in_CIRCLE	Parallel run loop
auto	2.8016697604273646	0.0	discard	18_4_in_CIRCLE	Parallel run loop
auto	4.810812353443134	0.0	discard	37_4_in_DOMINO	Parallel run loop
auto	4.467650196539758	0.0	keep	17_3_in_3	Parallel run loop
auto	4.944104947796166	0.0	discard	38_4_in_DOMINO	Parallel run loop
auto	3.0104540932523642	0.0	discard	13_4_in_DOMINO	Parallel run loop
auto	3.746847963455798	0.0	discard	11_3_in_3	Parallel run loop
auto	4.020316954443297	0.0	discard	13_3_in_3	Parallel run loop
auto	1.7011773066844613	0.0	discard	10_3_in_DOMINO	Parallel run loop
auto	5.719122467319307	0.0	discard	26_3_in_3	Parallel run loop
auto	2.607969916037793	0.0	discard	22_3_in_DOMINO	Parallel run loop
auto	3.7364237438117933	0.0	discard	31_4_in_CIRCLE	Parallel run loop
auto	4.943502864466721	0.0	discard	40_4_in_DOMINO	Parallel run loop
auto	5.042168271527541	0.0	discard	39_4_in_DOMINO	Parallel run loop
auto	5.0279184253713805	0.0	discard	41_4_in_DOMINO	Parallel run loop
auto	3.9241229167278884	0.0	discard	24_4_in_DOMINO	Parallel run loop
auto	3.1064519114939206	0.0	discard	21_4_in_CIRCLE	Parallel run loop
auto	4.8790981671037965	0.0	keep	20_3_in_3	Parallel run loop
auto	4.965465729046708	0.0	discard	21_3_in_3	Parallel run loop
auto	7.015974820954202	0.0	discard	44_3_in_3	Parallel run loop
auto	5.908287007383343	0.0	keep	30_3_in_3	Parallel run loop
auto	4.475096077264324	0.0	discard	33_4_in_DOMINO	Parallel run loop
auto	3.265553306575606	0.0	discard	26_4_in_CIRCLE	Parallel run loop
auto	2.0092432104642475	0.0	discard	16_3_in_DOMINO	Parallel run loop
auto	2.4901149670854683	0.0	discard	19_3_in_DOMINO	Parallel run loop
auto	1.919683215418723	0.0	keep	21_3_in_circle	Parallel run loop
auto	1.981007190737486	0.0	keep	15_3_in_DOMINO	Parallel run loop
auto	1.911646754271575	0.0	discard	14_3_in_DOMINO	Parallel run loop
auto	2.848831780259015	0.0	discard	11_4_in_DOMINO	Parallel run loop
auto	3.5236257287305413	0.0	discard	30_4_in_CIRCLE	Parallel run loop
auto	4.494886494098264	0.0	discard	17_3_in_3	Parallel run loop
auto	5.984737071313207	0.0	discard	32_3_in_3	Parallel run loop
auto	3.115803431953349	0.0	discard	23_4_in_CIRCLE	Parallel run loop
auto	3.69940484501468	0.0	discard	34_4_in_CIRCLE	Parallel run loop
auto	3.2232942054853804	0.0	discard	25_4_in_CIRCLE	Parallel run loop
auto	2.643847752583437	0.0	discard	16_4_in_CIRCLE	Parallel run loop
auto	4.020360663309433	0.0	discard	26_4_in_DOMINO	Parallel run loop
auto	6.517165702091847	0.0	keep	38_3_in_3	Parallel run loop
auto	4.867215641034746	0.0	discard	38_4_in_DOMINO	Parallel run loop
auto	2.8776782496867814	0.0	discard	19_4_in_CIRCLE	Parallel run loop
auto	2.9479967602447665	0.0	discard	20_4_in_CIRCLE	Parallel run loop
auto	4.510334332905153	0.0	discard	34_4_in_DOMINO	Parallel run loop
auto	4.019565593893119	0.0	discard	33_4_in_CIRCLE	Parallel run loop
auto	2.1268884916136437	0.0	keep	17_3_in_DOMINO	Parallel run loop
auto	3.8688750047412386	0.0	discard	23_4_in_DOMINO	Parallel run loop
auto	1.7011773066844613	0.0	discard	10_3_in_DOMINO	Parallel run loop
auto	5.029602176115146	0.0	discard	42_4_in_DOMINO	Parallel run loop
auto	4.907233479221433	0.0	discard	20_3_in_3	Parallel run loop
auto	3.631402274099691	0.0	discard	29_4_in_CIRCLE	Parallel run loop
auto	4.7768631259701175	0.0	keep	37_4_in_DOMINO	Parallel run loop
auto	6.944178033476889	0.0	discard	42_3_in_3	Parallel run loop
auto	2.8016697604273646	0.0	discard	18_4_in_CIRCLE	Parallel run loop
auto	2.987276471408153	0.0	keep	13_4_in_DOMINO	Parallel run loop
auto	5.945695637534557	0.0	discard	30_3_in_3	Parallel run loop
auto	3.7364237438117933	0.0	discard	31_4_in_CIRCLE	Parallel run loop
auto	2.1054855467062894	0.0	discard	16_3_in_DOMINO	Parallel run loop
auto	3.746847963455798	0.0	discard	11_3_in_3	Parallel run loop
auto	1.932475012484084	0.0	discard	21_3_in_circle	Parallel run loop
auto	1.9808393805069824	0.0	keep	15_3_in_DOMINO	Parallel run loop
auto	2.8243294355462205	0.0	discard	11_4_in_DOMINO	Parallel run loop
auto	4.494886494098264	0.0	discard	17_3_in_3	Parallel run loop
auto	5.042168271527541	0.0	discard	39_4_in_DOMINO	Parallel run loop
auto	3.7914164805615247	0.0	discard	22_4_in_DOMINO	Parallel run loop
auto	5.984737071313207	0.0	discard	32_3_in_3	Parallel run loop
auto	4.014200476639972	0.0	discard	25_4_in_DOMINO	Parallel run loop
auto	3.789834932560656	0.0	discard	34_4_in_CIRCLE	Parallel run loop
auto	4.020316954443297	0.0	discard	13_3_in_3	Parallel run loop
auto	4.943502864466721	0.0	discard	40_4_in_DOMINO	Parallel run loop
auto	5.0279184253713805	0.0	discard	41_4_in_DOMINO	Parallel run loop
auto	3.9241229167278884	0.0	discard	24_4_in_DOMINO	Parallel run loop
auto	4.965465729046708	0.0	discard	21_3_in_3	Parallel run loop
auto	6.774593747324475	0.0	discard	38_3_in_3	Parallel run loop
auto	2.1565990371879975	0.0	discard	17_3_in_DOMINO	Parallel run loop
auto	4.475096077264324	0.0	discard	33_4_in_DOMINO	Parallel run loop
auto	4.867215641034746	0.0	discard	38_4_in_DOMINO	Parallel run loop
auto	2.4901149670854683	0.0	discard	19_3_in_DOMINO	Parallel run loop
auto	1.911646754271575	0.0	discard	14_3_in_DOMINO	Parallel run loop
auto	7.015974820954202	0.0	discard	44_3_in_3	Parallel run loop
auto	4.907233479221433	0.0	discard	20_3_in_3	Parallel run loop
auto	3.0223172208985285	0.0	discard	13_4_in_DOMINO	Parallel run loop
auto	6.0044857410723464	0.0	discard	31_3_in_3	Parallel run loop
auto	5.719122467319307	0.0	discard	26_3_in_3	Parallel run loop
auto	4.020360663309433	0.0	discard	26_4_in_DOMINO	Parallel run loop
auto	5.015706282268623	0.0	discard	37_4_in_DOMINO	Parallel run loop
auto	2.0092432104642475	0.0	discard	16_3_in_DOMINO	Parallel run loop
auto	7.010415333922441	0.0	keep	45_3_in_3	Parallel run loop
auto	1.7011773066844613	0.0	discard	10_3_in_DOMINO	Parallel run loop
auto	3.8688750047412386	0.0	discard	23_4_in_DOMINO	Parallel run loop
auto	4.510334332905153	0.0	discard	34_4_in_DOMINO	Parallel run loop
auto	1.9806942234761449	0.0	keep	15_3_in_DOMINO	Parallel run loop
auto	2.874818647722945	0.0	discard	11_4_in_DOMINO	Parallel run loop
auto	1.932475012484084	0.0	discard	21_3_in_circle	Parallel run loop
auto	4.494886494098264	0.0	discard	17_3_in_3	Parallel run loop
auto	3.7914164805615247	0.0	discard	22_4_in_DOMINO	Parallel run loop
auto	3.746847963455798	0.0	discard	11_3_in_3	Parallel run loop
auto	5.029602176115146	0.0	discard	42_4_in_DOMINO	Parallel run loop
auto	2.5690036111969987	0.0	discard	21_3_in_DOMINO	Parallel run loop
auto	3.69940484501468	0.0	discard	34_4_in_CIRCLE	Parallel run loop
auto	6.06037645787977	0.0	discard	32_3_in_3	Parallel run loop
auto	5.923622637634554	0.0	discard	29_3_in_3	Parallel run loop
auto	6.572252308246883	0.0	discard	37_3_in_3	Parallel run loop
auto	2.614236874531333	0.0	discard	22_3_in_DOMINO	Parallel run loop
auto	6.944178033476889	0.0	discard	42_3_in_3	Parallel run loop
auto	5.945695637534557	0.0	discard	30_3_in_3	Parallel run loop
auto	4.020316954443297	0.0	discard	13_3_in_3	Parallel run loop
auto	4.014200476639972	0.0	discard	25_4_in_DOMINO	Parallel run loop
auto	5.042168271527541	0.0	discard	39_4_in_DOMINO	Parallel run loop
auto	4.907233479221433	0.0	discard	20_3_in_3	Parallel run loop
auto	6.959075514447739	0.0	discard	41_3_in_3	Parallel run loop
auto	5.034186680493225	0.0	discard	38_4_in_DOMINO	Parallel run loop
auto	3.9241229167278884	0.0	discard	24_4_in_DOMINO	Parallel run loop
auto	4.943502864466721	0.0	discard	40_4_in_DOMINO	Parallel run loop
auto	4.933484324725886	0.0	keep	21_3_in_3	Parallel run loop
auto	5.0279184253713805	0.0	discard	41_4_in_DOMINO	Parallel run loop
auto	2.4901149670854683	0.0	discard	19_3_in_DOMINO	Parallel run loop
auto	4.800923285095721	0.0	discard	37_4_in_DOMINO	Parallel run loop
auto	1.911646754271575	0.0	discard	14_3_in_DOMINO	Parallel run loop
auto	6.84302398719644	0.0	discard	38_3_in_3	Parallel run loop
auto	4.475096077264324	0.0	discard	33_4_in_DOMINO	Parallel run loop
auto	1.980568613935525	0.0	keep	15_3_in_DOMINO	Parallel run loop
auto	1.932475012484084	0.0	discard	21_3_in_circle	Parallel run loop
auto	4.527232011905023	0.0	discard	17_3_in_3	Parallel run loop
auto	5.927325264360006	0.0	discard	31_3_in_3	Parallel run loop
auto	7.015974820954202	0.0	discard	44_3_in_3	Parallel run loop
auto	7.030922742455542	0.0	discard	45_3_in_3	Parallel run loop
auto	5.719122467319307	0.0	discard	26_3_in_3	Parallel run loop
auto	2.5782691554546195	0.0	discard	21_3_in_DOMINO	Parallel run loop
auto	2.123921101777757	0.0	keep	17_3_in_DOMINO	Parallel run loop
auto	4.020360663309433	0.0	discard	26_4_in_DOMINO	Parallel run loop
auto	1.7011773066844613	0.0	discard	10_3_in_DOMINO	Parallel run loop
auto	2.848831780259015	0.0	discard	11_4_in_DOMINO	Parallel run loop
auto	3.0223172208985285	0.0	discard	13_4_in_DOMINO	Parallel run loop
auto	3.8688750047412386	0.0	discard	23_4_in_DOMINO	Parallel run loop
auto	3.746847963455798	0.0	discard	11_3_in_3	Parallel run loop
auto	3.789834932560656	0.0	discard	34_4_in_CIRCLE	Parallel run loop
auto	3.9641227017335576	0.0	discard	22_4_in_DOMINO	Parallel run loop
auto	4.510334332905153	0.0	discard	34_4_in_DOMINO	Parallel run loop
auto	4.907233479221433	0.0	discard	20_3_in_3	Parallel run loop
auto	2.6178995525689905	0.0	discard	22_3_in_DOMINO	Parallel run loop
auto	5.042168271527541	0.0	discard	39_4_in_DOMINO	Parallel run loop
auto	6.038313795273007	0.0	discard	29_3_in_3	Parallel run loop
auto	5.029602176115146	0.0	discard	42_4_in_DOMINO	Parallel run loop
auto	4.965254628867786	0.0	discard	21_3_in_3	Parallel run loop
auto	7.409842021561194	0.0	discard	46_3_in_3	Parallel run loop
auto	4.020316954443297	0.0	discard	13_3_in_3	Parallel run loop
auto	6.805899464980523	0.0	discard	37_3_in_3	Parallel run loop
auto	1.980459883945697	0.0	keep	15_3_in_DOMINO	Parallel run loop
auto	4.04727924129811	0.0	discard	25_4_in_DOMINO	Parallel run loop
auto	6.904049767755655	0.0	keep	42_3_in_3	Parallel run loop
auto	5.90714348330776	0.0	keep	30_3_in_3	Parallel run loop
auto	1.932475012484084	0.0	discard	21_3_in_circle	Parallel run loop
auto	4.767200724965682	0.0	keep	37_4_in_DOMINO	Parallel run loop
auto	3.9241229167278884	0.0	discard	24_4_in_DOMINO	Parallel run loop
auto	2.4901149670854683	0.0	discard	19_3_in_DOMINO	Parallel run loop
auto	7.012305785085151	0.0	discard	41_3_in_3	Parallel run loop
auto	1.911646754271575	0.0	discard	14_3_in_DOMINO	Parallel run loop
auto	4.943502864466721	0.0	discard	40_4_in_DOMINO	Parallel run loop
auto	2.1214706625569297	0.0	keep	17_3_in_DOMINO	Parallel run loop
auto	5.0279184253713805	0.0	discard	41_4_in_DOMINO	Parallel run loop
auto	2.931723676723068	0.0	discard	11_4_in_DOMINO	Parallel run loop
auto	7.360936100618563	0.0	discard	45_3_in_3	Parallel run loop
auto	2.5666924325724576	0.0	discard	21_3_in_DOMINO	Parallel run loop
auto	4.475096077264324	0.0	discard	33_4_in_DOMINO	Parallel run loop
auto	5.927325264360006	0.0	discard	31_3_in_3	Parallel run loop
auto	6.940912390839882	0.0	discard	39_3_in_3	Parallel run loop
auto	6.84302398719644	0.0	discard	38_3_in_3	Parallel run loop
auto	5.564107975010114	0.0	discard	26_3_in_3	Parallel run loop
auto	7.015974820954202	0.0	discard	44_3_in_3	Parallel run loop
auto	1.7011773066844613	0.0	discard	10_3_in_DOMINO	Parallel run loop
auto	2.0092432104642475	0.0	discard	16_3_in_DOMINO	Parallel run loop
auto	6.020497735748146	0.0	discard	32_3_in_3	Parallel run loop
auto	3.0223172208985285	0.0	discard	13_4_in_DOMINO	Parallel run loop
auto	4.9332796669493	0.0	keep	21_3_in_3	Parallel run loop
auto	4.020360663309433	0.0	discard	26_4_in_DOMINO	Parallel run loop
auto	3.746847963455798	0.0	discard	11_3_in_3	Parallel run loop
auto	5.034186680493225	0.0	discard	38_4_in_DOMINO	Parallel run loop
auto	3.8688750047412386	0.0	discard	23_4_in_DOMINO	Parallel run loop
auto	1.9803657386259614	0.0	keep	15_3_in_DOMINO	Parallel run loop
auto	4.510334332905153	0.0	discard	34_4_in_DOMINO	Parallel run loop
auto	5.944606738450671	0.0	discard	30_3_in_3	Parallel run loop
auto	7.1121657759317465	0.0	keep	46_3_in_3	Parallel run loop
auto	4.955505153601827	0.0	discard	37_4_in_DOMINO	Parallel run loop
auto	5.923622637634554	0.0	discard	29_3_in_3	Parallel run loop
auto	6.871016169193654	0.0	keep	42_3_in_3	Parallel run loop
auto	3.7914164805615247	0.0	discard	22_4_in_DOMINO	Parallel run loop
auto	4.020316954443297	0.0	discard	13_3_in_3	Parallel run loop
auto	5.029602176115146	0.0	discard	42_4_in_DOMINO	Parallel run loop
auto	2.11942888816517	0.0	keep	17_3_in_DOMINO	Parallel run loop
auto	2.621043074946997	0.0	discard	22_3_in_DOMINO	Parallel run loop
auto	4.95827511687329	0.0	discard	39_4_in_DOMINO	Parallel run loop
auto	3.9549382776918347	0.0	keep	25_4_in_DOMINO	Parallel run loop
auto	6.805899464980523	0.0	discard	37_3_in_3	Parallel run loop
auto	4.907233479221433	0.0	discard	20_3_in_3	Parallel run loop
auto	2.5764649083920936	0.0	discard	21_3_in_DOMINO	Parallel run loop
auto	3.9241229167278884	0.0	discard	24_4_in_DOMINO	Parallel run loop
auto	1.911646754271575	0.0	discard	14_3_in_DOMINO	Parallel run loop
auto	2.4901149670854683	0.0	discard	19_3_in_DOMINO	Parallel run loop
auto	5.719122467319307	0.0	discard	26_3_in_3	Parallel run loop
auto	2.8012059274101717	0.0	discard	11_4_in_DOMINO	Parallel run loop
auto	7.012305785085151	0.0	discard	41_3_in_3	Parallel run loop
auto	2.3465132305432332	0.0	discard	20_3_in_DOMINO	Parallel run loop
auto	4.943502864466721	0.0	discard	40_4_in_DOMINO	Parallel run loop
auto	5.0279184253713805	0.0	discard	41_4_in_DOMINO	Parallel run loop
auto	4.965060044085815	0.0	discard	21_3_in_3	Parallel run loop
auto	6.0044857410723464	0.0	discard	31_3_in_3	Parallel run loop
auto	1.9802842017554125	0.0	keep	15_3_in_DOMINO	Parallel run loop
auto	4.475096077264324	0.0	discard	33_4_in_DOMINO	Parallel run loop
auto	7.030922742455542	0.0	discard	45_3_in_3	Parallel run loop
auto	1.7011773066844613	0.0	discard	10_3_in_DOMINO	Parallel run loop
auto	6.84302398719644	0.0	discard	38_3_in_3	Parallel run loop
auto	6.809573200582781	0.0	discard	39_3_in_3	Parallel run loop
auto	2.9979201021365647	0.0	discard	13_4_in_DOMINO	Parallel run loop
auto	3.746847963455798	0.0	discard	11_3_in_3	Parallel run loop
auto	3.8688750047412386	0.0	discard	23_4_in_DOMINO	Parallel run loop
auto	4.020360663309433	0.0	discard	26_4_in_DOMINO	Parallel run loop
auto	2.117715721192686	0.0	keep	17_3_in_DOMINO	Parallel run loop
auto	5.984737071313207	0.0	discard	32_3_in_3	Parallel run loop
auto	7.467774064728334	0.0	discard	46_3_in_3	Parallel run loop
auto	7.0779489011835555	0.0	discard	42_3_in_3	Parallel run loop
auto	2.5641268948435303	0.0	discard	21_3_in_DOMINO	Parallel run loop
auto	7.015974820954202	0.0	discard	44_3_in_3	Parallel run loop
auto	4.00437912608468	0.0	discard	25_4_in_DOMINO	Parallel run loop
auto	4.510334332905153	0.0	discard	34_4_in_DOMINO	Parallel run loop
auto	5.977930657320277	0.0	discard	29_3_in_3	Parallel run loop
auto	4.867215641034746	0.0	discard	38_4_in_DOMINO	Parallel run loop
auto	5.042168271527541	0.0	discard	39_4_in_DOMINO	Parallel run loop
auto	4.020316954443297	0.0	discard	13_3_in_3	Parallel run loop
auto	3.7914164805615247	0.0	discard	22_4_in_DOMINO	Parallel run loop
auto	2.1054855467062894	0.0	discard	16_3_in_DOMINO	Parallel run loop
auto	2.931723676723068	0.0	discard	11_4_in_DOMINO	Parallel run loop
auto	5.029602176115146	0.0	discard	42_4_in_DOMINO	Parallel run loop
auto	2.6255028609113724	0.0	discard	22_3_in_DOMINO	Parallel run loop
auto	5.944606738450671	0.0	discard	30_3_in_3	Parallel run loop
auto	4.965060044085815	0.0	discard	21_3_in_3	Parallel run loop
auto	1.9802135698611723	0.0	keep	15_3_in_DOMINO	Parallel run loop
auto	6.450588289129487	0.0	keep	37_3_in_3	Parallel run loop
auto	3.9241229167278884	0.0	discard	24_4_in_DOMINO	Parallel run loop
auto	5.0055607612139665	0.0	discard	37_4_in_DOMINO	Parallel run loop
auto	6.099537022430237	0.0	discard	31_3_in_3	Parallel run loop
auto	2.4901149670854683	0.0	discard	19_3_in_DOMINO	Parallel run loop
auto	1.911646754271575	0.0	discard	14_3_in_DOMINO	Parallel run loop
auto	5.661931242646113	0.0	discard	26_3_in_3	Parallel run loop
auto	7.030922742455542	0.0	discard	45_3_in_3	Parallel run loop
auto	2.116270301921705	0.0	keep	17_3_in_DOMINO	Parallel run loop
auto	4.874268976650741	0.0	keep	20_3_in_3	Parallel run loop
auto	2.586791924647552	0.0	discard	21_3_in_DOMINO	Parallel run loop
auto	4.943502864466721	0.0	discard	40_4_in_DOMINO	Parallel run loop
auto	2.310142639898692	0.0	keep	20_3_in_DOMINO	Parallel run loop
auto	1.7011773066844613	0.0	discard	10_3_in_DOMINO	Parallel run loop
auto	5.0279184253713805	0.0	discard	41_4_in_DOMINO	Parallel run loop
auto	4.475096077264324	0.0	discard	33_4_in_DOMINO	Parallel run loop
auto	3.973861928861215	0.0	discard	25_4_in_DOMINO	Parallel run loop
auto	3.0223172208985285	0.0	discard	13_4_in_DOMINO	Parallel run loop
auto	7.012305785085151	0.0	discard	41_3_in_3	Parallel run loop
auto	3.746847963455798	0.0	discard	11_3_in_3	Parallel run loop
auto	3.8688750047412386	0.0	discard	23_4_in_DOMINO	Parallel run loop
auto	4.020360663309433	0.0	discard	26_4_in_DOMINO	Parallel run loop
auto	6.84302398719644	0.0	discard	38_3_in_3	Parallel run loop
auto	5.984737071313207	0.0	discard	32_3_in_3	Parallel run loop
auto	6.809573200582781	0.0	discard	39_3_in_3	Parallel run loop
auto	7.467774064728334	0.0	discard	46_3_in_3	Parallel run loop
auto	7.0202148158818884	0.0	discard	42_3_in_3	Parallel run loop
auto	1.980152373334403	0.0	keep	15_3_in_DOMINO	Parallel run loop
auto	7.015974820954202	0.0	discard	44_3_in_3	Parallel run loop
auto	5.870922579805827	0.0	keep	30_3_in_3	Parallel run loop
auto	4.510334332905153	0.0	discard	34_4_in_DOMINO	Parallel run loop
auto	7.729663867521279	0.0	discard	50_3_in_3	Parallel run loop
auto	6.038313795273007	0.0	discard	29_3_in_3	Parallel run loop
auto	3.8212838145946755	0.0	discard	22_4_in_DOMINO	Parallel run loop
auto	6.773117703585962	0.0	discard	37_3_in_3	Parallel run loop
auto	5.0055607612139665	0.0	discard	37_4_in_DOMINO	Parallel run loop
auto	4.8866188255227225	0.0	keep	39_4_in_DOMINO	Parallel run loop
auto	5.029602176115146	0.0	discard	42_4_in_DOMINO	Parallel run loop
auto	5.719122467319307	0.0	discard	26_3_in_3	Parallel run loop
auto	2.115045337206107	0.0	keep	17_3_in_DOMINO	Parallel run loop
auto	4.020316954443297	0.0	discard	13_3_in_3	Parallel run loop
auto	4.869760005254777	0.0	keep	20_3_in_3	Parallel run loop
auto	2.0844306912392265	0.0	discard	16_3_in_DOMINO	Parallel run loop
auto	2.3421438299204427	0.0	discard	20_3_in_DOMINO	Parallel run loop
auto	2.4901149670854683	0.0	discard	19_3_in_DOMINO	Parallel run loop
auto	1.911646754271575	0.0	discard	14_3_in_DOMINO	Parallel run loop
auto	3.9241229167278884	0.0	discard	24_4_in_DOMINO	Parallel run loop
auto	2.6147598003438044	0.0	discard	22_3_in_DOMINO	Parallel run loop
auto	4.867215641034746	0.0	discard	38_4_in_DOMINO	Parallel run loop
auto	4.00437912608468	0.0	discard	25_4_in_DOMINO	Parallel run loop
auto	2.848831780259015	0.0	discard	11_4_in_DOMINO	Parallel run loop
