commit	score	memory_gb	status	problem	description
auto	5.27213836413791	0.0	discard	37_4_in_5	Parallel run loop
auto	1.587598796173356	0.0	discard	23_3_in_8	Parallel run loop
auto	3.8939907640676124	0.0	discard	33_4_in_6	Parallel run loop
auto	1.8935679633476563	0.0	discard	34_3_in_8	Parallel run loop
auto	1.5708892985329193	0.0	discard	22_3_in_8	Parallel run loop
auto	1.8341316836445811	0.0	discard	32_3_in_8	Parallel run loop
auto	1.497146383805927	0.0	discard	10_3_in_6	Parallel run loop
auto	2.234908715982915	0.0	keep	26_3_in_6	Parallel run loop
auto	1.6870389317359202	0.0	discard	26_3_in_8	Parallel run loop
auto	2.5152513691822214	0.0	discard	32_3_in_6	Parallel run loop
auto	2.5017738723045313	0.0	keep	33_3_in_6	Parallel run loop
auto	2.1122190059013577	0.0	discard	26_3_in_circle	Parallel run loop
auto	2.2736120830922086	0.0	discard	30_3_in_circle	Parallel run loop
auto	3.3701178247932044	0.0	discard	23_4_in_6	Parallel run loop
auto	1.7802430144454746	0.0	discard	29_3_in_8	Parallel run loop
auto	2.110662555126422	0.0	discard	17_3_in_DOMINO	Parallel run loop
auto	2.1685823362327925	0.0	keep	25_3_in_6	Parallel run loop
auto	1.587598796173356	0.0	discard	23_3_in_8	Parallel run loop
auto	3.8939907640676124	0.0	discard	33_4_in_6	Parallel run loop
auto	1.8935679633476563	0.0	discard	34_3_in_8	Parallel run loop
auto	1.5708892985329193	0.0	discard	22_3_in_8	Parallel run loop
auto	1.8341316836445811	0.0	discard	32_3_in_8	Parallel run loop
auto	1.497146383805927	0.0	discard	10_3_in_6	Parallel run loop
auto	2.234908715982915	0.0	discard	26_3_in_6	Parallel run loop
auto	1.6870389317359202	0.0	discard	26_3_in_8	Parallel run loop
auto	2.3838544843563816	0.0	discard	29_3_in_6	Parallel run loop
auto	2.5017738723045313	0.0	discard	33_3_in_6	Parallel run loop
auto	2.1122190059013577	0.0	discard	26_3_in_circle	Parallel run loop
auto	3.3701178247932044	0.0	discard	23_4_in_6	Parallel run loop
auto	2.605400298791313	0.0	keep	36_3_in_6	Parallel run loop
auto	1.7802430144454746	0.0	discard	29_3_in_8	Parallel run loop
auto	2.110662555126422	0.0	discard	17_3_in_DOMINO	Parallel run loop
auto	2.1685823362327925	0.0	discard	25_3_in_6	Parallel run loop
auto	5.33386413036413	0.0	discard	38_4_in_5	Parallel run loop
auto	1.587598796173356	0.0	discard	23_3_in_8	Parallel run loop
auto	3.8939907640676124	0.0	discard	33_4_in_6	Parallel run loop
auto	1.8935679633476563	0.0	discard	34_3_in_8	Parallel run loop
auto	1.5708892985329193	0.0	discard	22_3_in_8	Parallel run loop
auto	1.8341316836445811	0.0	discard	32_3_in_8	Parallel run loop
auto	1.497146383805927	0.0	discard	10_3_in_6	Parallel run loop
auto	2.234908715982915	0.0	discard	26_3_in_6	Parallel run loop
auto	1.6870389317359202	0.0	discard	26_3_in_8	Parallel run loop
auto	1.1610009831196497	0.0	discard	7_3_in_circle	Parallel run loop
auto	2.5017738723045313	0.0	discard	33_3_in_6	Parallel run loop
auto	2.6863951488447557	0.0	discard	37_3_in_6	Parallel run loop
auto	1.490840291646784	0.0	discard	7_3_in_DOMINO	Parallel run loop
auto	2.8551255601407735	0.0	keep	42_3_in_6	Parallel run loop
auto	3.3701178247932044	0.0	discard	23_4_in_6	Parallel run loop
auto	2.605400298791313	0.0	discard	36_3_in_6	Parallel run loop
auto	1.7802430144454746	0.0	discard	29_3_in_8	Parallel run loop
auto	1.9788046839378193	0.0	discard	8_4_in_CIRCLE	Parallel run loop
auto	2.1685823362327925	0.0	discard	25_3_in_6	Parallel run loop
auto	1.587598796173356	0.0	discard	23_3_in_8	Parallel run loop
auto	1.5708892985329193	0.0	discard	22_3_in_8	Parallel run loop
auto	1.8935679633476563	0.0	discard	34_3_in_8	Parallel run loop
auto	3.8939907640676124	0.0	discard	33_4_in_6	Parallel run loop
auto	1.8341316836445811	0.0	discard	32_3_in_8	Parallel run loop
auto	2.234908715982915	0.0	discard	26_3_in_6	Parallel run loop
auto	1.1610009831196497	0.0	discard	7_3_in_circle	Parallel run loop
auto	1.6870389317359202	0.0	discard	26_3_in_8	Parallel run loop
auto	1.56307865221544	0.0	discard	8_3_in_DOMINO	Parallel run loop
auto	1.3234977954899296	0.0	discard	9_3_in_circle	Parallel run loop
auto	2.5017738723045313	0.0	discard	33_3_in_6	Parallel run loop
auto	3.067362432257697	0.0	discard	22_4_in_CIRCLE	Parallel run loop
auto	3.3701178247932044	0.0	discard	23_4_in_6	Parallel run loop
auto	2.8551255601407735	0.0	discard	42_3_in_6	Parallel run loop
auto	1.7802430144454746	0.0	discard	29_3_in_8	Parallel run loop
auto	2.605400298791313	0.0	discard	36_3_in_6	Parallel run loop
auto	1.617666058427277	0.0	discard	14_3_in_circle	Parallel run loop
auto	2.1685823362327925	0.0	discard	25_3_in_6	Parallel run loop
auto	1.587598796173356	0.0	discard	23_3_in_8	Parallel run loop
auto	1.490840291646784	0.0	discard	7_3_in_DOMINO	Parallel run loop
auto	1.8935679633476563	0.0	discard	34_3_in_8	Parallel run loop
auto	1.1610009831196497	0.0	discard	7_3_in_circle	Parallel run loop
auto	3.8939907640676124	0.0	discard	33_4_in_6	Parallel run loop
auto	1.85529366267059	0.0	discard	32_3_in_8	Parallel run loop
auto	2.234908715982915	0.0	discard	26_3_in_6	Parallel run loop
auto	1.6870389317359202	0.0	discard	26_3_in_8	Parallel run loop
auto	1.9788046839378193	0.0	discard	8_4_in_CIRCLE	Parallel run loop
auto	12.771121686878123	0.0	discard	32_5_in_3	Parallel run loop
auto	2.5017738723045313	0.0	discard	33_3_in_6	Parallel run loop
auto	13.884493816920813	0.0	discard	38_5_in_3	Parallel run loop
auto	1.5377331965196364	0.0	discard	13_3_in_circle	Parallel run loop
auto	14.497914143320651	0.0	discard	25_6_in_3	Parallel run loop
auto	2.605400298791313	0.0	discard	36_3_in_6	Parallel run loop
auto	2.8551255601407735	0.0	discard	42_3_in_6	Parallel run loop
auto	2.1685823362327925	0.0	discard	25_3_in_6	Parallel run loop
auto	1.587598796173356	0.0	discard	23_3_in_8	Parallel run loop
auto	1.56307865221544	0.0	discard	8_3_in_DOMINO	Parallel run loop
auto	1.1610009831196497	0.0	discard	7_3_in_circle	Parallel run loop
auto	2.248775566670574	0.0	discard	26_3_in_6	Parallel run loop
auto	1.597692369655168	0.0	discard	23_3_in_8	Parallel run loop
auto	1.6782288029177286	0.0	keep	26_3_in_8	Parallel run loop
auto	2.5174869510822515	0.0	discard	33_3_in_6	Parallel run loop
auto	2.6218509293051144	0.0	discard	36_3_in_6	Parallel run loop
auto	1.9788046839378193	0.0	discard	8_4_in_CIRCLE	Parallel run loop
auto	1.3234977954899296	0.0	discard	9_3_in_circle	Parallel run loop
auto	2.182303792461438	0.0	discard	25_3_in_6	Parallel run loop
auto	1.8935679633476563	0.0	discard	34_3_in_8	Parallel run loop
auto	1.617666058427277	0.0	discard	14_3_in_circle	Parallel run loop
auto	1.597692369655168	0.0	discard	23_3_in_8	Parallel run loop
auto	2.8870004831185874	0.0	discard	17_4_in_6	Parallel run loop
auto	3.067362432257697	0.0	discard	22_4_in_CIRCLE	Parallel run loop
auto	2.2226394223292862	0.0	keep	26_3_in_6	Parallel run loop
auto	2.182303792461438	0.0	discard	25_3_in_6	Parallel run loop
auto	1.5377331965196364	0.0	discard	13_3_in_circle	Parallel run loop
auto	1.4801224664338222	0.0	discard	19_3_in_8	Parallel run loop
auto	1.4029233710948728	0.0	discard	17_3_in_8	Parallel run loop
auto	1.689001595709032	0.0	discard	26_3_in_8	Parallel run loop
auto	3.9775795791883204	0.0	discard	33_4_in_6	Parallel run loop
auto	3.1518433100634002	0.0	discard	24_4_in_CIRCLE	Parallel run loop
auto	2.735670313730879	0.0	discard	36_3_in_6	Parallel run loop
auto	3.307035932447277	0.0	discard	40_4_in_8	Parallel run loop
auto	13.820493131853882	0.0	discard	25_6_in_3	Parallel run loop
auto	3.3833817024149666	0.0	discard	28_4_in_CIRCLE	Parallel run loop
auto	2.2226394223292862	0.0	discard	26_3_in_6	Parallel run loop
auto	3.684473523968721	0.0	discard	29_4_in_6	Parallel run loop
auto	3.4474751624012594	0.0	discard	24_4_in_6	Parallel run loop
auto	14.05678443804131	0.0	discard	39_5_in_3	Parallel run loop
auto	1.3234977954899296	0.0	discard	9_3_in_circle	Parallel run loop
auto	2.182303792461438	0.0	discard	25_3_in_6	Parallel run loop
auto	3.504561196287405	0.0	discard	26_4_in_6	Parallel run loop
auto	3.642028003096348	0.0	discard	28_4_in_6	Parallel run loop
auto	1.1610009831196497	0.0	discard	7_3_in_circle	Parallel run loop
auto	2.382191620351339	0.0	discard	21_4_in_8	Parallel run loop
auto	12.910495881561323	0.0	discard	33_5_in_3	Parallel run loop
auto	2.8599677294777037	0.0	discard	32_4_in_8	Parallel run loop
auto	1.9788046839378193	0.0	discard	8_4_in_CIRCLE	Parallel run loop
auto	1.8935679633476563	0.0	discard	34_3_in_8	Parallel run loop
auto	1.5400946759899503	0.0	discard	21_3_in_8	Parallel run loop
auto	2.5174869510822515	0.0	discard	33_3_in_6	Parallel run loop
auto	1.7530469032987281	0.0	discard	11_3_in_DOMINO	Parallel run loop
auto	1.743197279660388	0.0	discard	17_3_in_circle	Parallel run loop
auto	2.8726573038401715	0.0	discard	42_3_in_6	Parallel run loop
auto	13.884493816920813	0.0	discard	38_5_in_3	Parallel run loop
auto	1.5104429077839856	0.0	discard	20_3_in_8	Parallel run loop
auto	12.771121686878123	0.0	discard	32_5_in_3	Parallel run loop
auto	11.960108969580684	0.0	discard	18_6_in_3	Parallel run loop
auto	1.7431054324323365	0.0	keep	28_3_in_8	Parallel run loop
auto	1.689001595709032	0.0	discard	26_3_in_8	Parallel run loop
auto	2.8728880787480073	0.0	keep	17_4_in_6	Parallel run loop
auto	2.519017470378839	0.0	discard	25_4_in_8	Parallel run loop
auto	1.617666058427277	0.0	discard	14_3_in_circle	Parallel run loop
auto	1.9788046839378193	0.0	discard	8_4_in_CIRCLE	Parallel run loop
auto	1.3234977954899296	0.0	discard	9_3_in_circle	Parallel run loop
auto	1.5377331965196364	0.0	discard	13_3_in_circle	Parallel run loop
auto	2.182303792461438	0.0	discard	25_3_in_6	Parallel run loop
auto	2.2226394223292862	0.0	discard	26_3_in_6	Parallel run loop
auto	3.067362432257697	0.0	discard	22_4_in_CIRCLE	Parallel run loop
auto	2.8870004831185874	0.0	discard	17_4_in_6	Parallel run loop
auto	1.4801224664338222	0.0	discard	19_3_in_8	Parallel run loop
auto	1.743197279660388	0.0	discard	17_3_in_circle	Parallel run loop
auto	3.5572469598221628	0.0	discard	27_4_in_6	Parallel run loop
auto	3.647130668470488	0.0	discard	28_4_in_6	Parallel run loop
auto	13.946930352147506	0.0	discard	25_6_in_3	Parallel run loop
auto	2.8391425940846426	0.0	keep	42_3_in_6	Parallel run loop
auto	3.4385229223150113	0.0	discard	24_4_in_6	Parallel run loop
auto	1.76341890008406	0.0	discard	28_3_in_8	Parallel run loop
auto	3.1518433100634002	0.0	discard	24_4_in_CIRCLE	Parallel run loop
auto	2.7228640292078126	0.0	discard	29_4_in_8	Parallel run loop
auto	3.178905265988797	0.0	discard	40_4_in_8	Parallel run loop
auto	14.05678443804131	0.0	discard	39_5_in_3	Parallel run loop
auto	2.7702964943057093	0.0	discard	30_4_in_8	Parallel run loop
auto	2.8599677294777037	0.0	discard	32_4_in_8	Parallel run loop
auto	3.709614583727172	0.0	discard	29_4_in_6	Parallel run loop
auto	2.382191620351339	0.0	discard	21_4_in_8	Parallel run loop
auto	1.7530469032987281	0.0	discard	11_3_in_DOMINO	Parallel run loop
auto	3.3833817024149666	0.0	discard	28_4_in_CIRCLE	Parallel run loop
auto	1.5400946759899503	0.0	discard	21_3_in_8	Parallel run loop
auto	12.910495881561323	0.0	discard	33_5_in_3	Parallel run loop
auto	4.95906101564547	0.0	discard	32_4_in_5	Parallel run loop
auto	1.8935679633476563	0.0	discard	34_3_in_8	Parallel run loop
auto	1.4029233710948728	0.0	discard	17_3_in_8	Parallel run loop
auto	2.5174869510822515	0.0	discard	33_3_in_6	Parallel run loop
auto	3.504561196287405	0.0	discard	26_4_in_6	Parallel run loop
auto	1.5104429077839856	0.0	discard	20_3_in_8	Parallel run loop
auto	3.6247657643574387	0.0	discard	32_4_in_CIRCLE	Parallel run loop
auto	2.248775566670574	0.0	discard	26_3_in_6	Parallel run loop
auto	13.884493816920813	0.0	discard	38_5_in_3	Parallel run loop
auto	2.182303792461438	0.0	discard	25_3_in_6	Parallel run loop
auto	12.771121686878123	0.0	discard	32_5_in_3	Parallel run loop
auto	1.3234977954899296	0.0	discard	9_3_in_circle	Parallel run loop
auto	1.617666058427277	0.0	discard	14_3_in_circle	Parallel run loop
auto	1.5377331965196364	0.0	discard	13_3_in_circle	Parallel run loop
auto	1.4801224664338222	0.0	discard	19_3_in_8	Parallel run loop
auto	1.743197279660388	0.0	discard	17_3_in_circle	Parallel run loop
auto	3.067362432257697	0.0	discard	22_4_in_CIRCLE	Parallel run loop
auto	3.4378352521157773	0.0	discard	24_4_in_6	Parallel run loop
auto	3.1518433100634002	0.0	discard	24_4_in_CIRCLE	Parallel run loop
auto	2.5174869510822515	0.0	discard	33_3_in_6	Parallel run loop
auto	13.820493131853882	0.0	discard	25_6_in_3	Parallel run loop
auto	1.76341890008406	0.0	discard	28_3_in_8	Parallel run loop
auto	2.519017470378839	0.0	discard	25_4_in_8	Parallel run loop
auto	3.727091685154652	0.0	discard	29_4_in_6	Parallel run loop
auto	3.178905265988797	0.0	discard	40_4_in_8	Parallel run loop
auto	14.05678443804131	0.0	discard	39_5_in_3	Parallel run loop
auto	1.7948348845423978	0.0	keep	30_3_in_8	Parallel run loop
auto	3.5572469598221628	0.0	discard	27_4_in_6	Parallel run loop
auto	4.049500287227265	0.0	discard	35_4_in_6	Parallel run loop
auto	4.365439947688945	0.0	discard	40_4_in_6	Parallel run loop
auto	5.005146389003712	0.0	discard	33_4_in_5	Parallel run loop
auto	2.7785761222020717	0.0	discard	29_4_in_8	Parallel run loop
auto	2.8599677294777037	0.0	discard	32_4_in_8	Parallel run loop
auto	3.6577232288344375	0.0	discard	28_4_in_6	Parallel run loop
auto	11.960108969580684	0.0	discard	18_6_in_3	Parallel run loop
auto	2.8391425940846426	0.0	discard	42_3_in_6	Parallel run loop
auto	3.6247657643574387	0.0	discard	32_4_in_CIRCLE	Parallel run loop
auto	1.5400946759899503	0.0	discard	21_3_in_8	Parallel run loop
auto	1.4029233710948728	0.0	discard	17_3_in_8	Parallel run loop
auto	1.5104429077839856	0.0	discard	20_3_in_8	Parallel run loop
auto	1.7530469032987281	0.0	discard	11_3_in_DOMINO	Parallel run loop
auto	12.910495881561323	0.0	discard	33_5_in_3	Parallel run loop
auto	4.041621768437455	0.0	discard	36_4_in_6	Parallel run loop
auto	3.504561196287405	0.0	discard	26_4_in_6	Parallel run loop
auto	4.786866784335104	0.0	discard	30_4_in_5	Parallel run loop
auto	4.726818672940521	0.0	discard	32_4_in_5	Parallel run loop
auto	2.382191620351339	0.0	discard	21_4_in_8	Parallel run loop
auto	3.3327492536060515	0.0	keep	28_4_in_CIRCLE	Parallel run loop
auto	12.771121686878123	0.0	discard	32_5_in_3	Parallel run loop
auto	2.5174869510822515	0.0	discard	33_3_in_6	Parallel run loop
auto	13.884493816920813	0.0	discard	38_5_in_3	Parallel run loop
auto	2.9476053891229426	0.0	discard	35_4_in_8	Parallel run loop
auto	1.76341890008406	0.0	discard	28_3_in_8	Parallel run loop
auto	3.2319686697683268	0.0	discard	40_4_in_8	Parallel run loop
auto	3.067362432257697	0.0	discard	22_4_in_CIRCLE	Parallel run loop
auto	1.8262321636215084	0.0	discard	31_3_in_8	Parallel run loop
auto	3.444373675556614	0.0	discard	24_4_in_6	Parallel run loop
auto	2.519017470378839	0.0	discard	25_4_in_8	Parallel run loop
auto	4.250380269111672	0.0	keep	39_4_in_6	Parallel run loop
auto	13.946930352147506	0.0	discard	25_6_in_3	Parallel run loop
auto	3.1518433100634002	0.0	discard	24_4_in_CIRCLE	Parallel run loop
auto	2.8726573038401715	0.0	discard	42_3_in_6	Parallel run loop
auto	2.7702964943057093	0.0	discard	30_4_in_8	Parallel run loop
auto	3.701461995142567	0.0	discard	29_4_in_6	Parallel run loop
auto	1.7948348845423978	0.0	discard	30_3_in_8	Parallel run loop
auto	1.4801224664338222	0.0	discard	19_3_in_8	Parallel run loop
auto	14.05678443804131	0.0	discard	39_5_in_3	Parallel run loop
auto	5.0430818736376715	0.0	discard	35_4_in_5	Parallel run loop
auto	3.6247657643574387	0.0	discard	32_4_in_CIRCLE	Parallel run loop
auto	3.6650463621470197	0.0	discard	28_4_in_6	Parallel run loop
auto	11.960108969580684	0.0	discard	18_6_in_3	Parallel run loop
auto	3.597314086214581	0.0	discard	27_4_in_6	Parallel run loop
auto	4.31336513831651	0.0	keep	40_4_in_6	Parallel run loop
auto	4.067358240087619	0.0	discard	35_4_in_6	Parallel run loop
auto	5.33386413036413	0.0	discard	38_4_in_5	Parallel run loop
auto	2.7228640292078126	0.0	discard	29_4_in_8	Parallel run loop
auto	1.5400946759899503	0.0	discard	21_3_in_8	Parallel run loop
auto	5.005146389003712	0.0	discard	33_4_in_5	Parallel run loop
auto	1.6577100735479915	0.0	discard	25_3_in_8	Parallel run loop
auto	13.884493816920813	0.0	discard	38_5_in_3	Parallel run loop
auto	1.935046816120619	0.0	keep	36_3_in_8	Parallel run loop
auto	2.519017470378839	0.0	discard	25_4_in_8	Parallel run loop
auto	2.382191620351339	0.0	discard	21_4_in_8	Parallel run loop
auto	12.771121686878123	0.0	discard	32_5_in_3	Parallel run loop
auto	4.252931390091071	0.0	discard	39_4_in_6	Parallel run loop
auto	3.178905265988797	0.0	discard	40_4_in_8	Parallel run loop
auto	12.910495881561323	0.0	discard	33_5_in_3	Parallel run loop
auto	1.7948348845423978	0.0	discard	30_3_in_8	Parallel run loop
auto	5.016143493573165	0.0	keep	37_4_in_5	Parallel run loop
auto	1.8262321636215084	0.0	discard	31_3_in_8	Parallel run loop
auto	4.041621768437455	0.0	discard	36_4_in_6	Parallel run loop
auto	4.786866784335104	0.0	discard	30_4_in_5	Parallel run loop
auto	3.440930851435959	0.0	discard	24_4_in_6	Parallel run loop
auto	3.504561196287405	0.0	discard	26_4_in_6	Parallel run loop
auto	1.4029233710948728	0.0	discard	17_3_in_8	Parallel run loop
auto	3.3833817024149666	0.0	discard	28_4_in_CIRCLE	Parallel run loop
auto	4.740295640091791	0.0	discard	32_4_in_5	Parallel run loop
auto	2.9476053891229426	0.0	discard	35_4_in_8	Parallel run loop
auto	1.5104429077839856	0.0	discard	20_3_in_8	Parallel run loop
auto	3.1518433100634002	0.0	discard	24_4_in_CIRCLE	Parallel run loop
auto	2.8599677294777037	0.0	discard	32_4_in_8	Parallel run loop
auto	14.05678443804131	0.0	discard	39_5_in_3	Parallel run loop
auto	1.76341890008406	0.0	discard	28_3_in_8	Parallel run loop
auto	3.734553701160523	0.0	discard	29_4_in_6	Parallel run loop
auto	4.3650034036941765	0.0	discard	40_4_in_6	Parallel run loop
auto	1.5708892985329193	0.0	discard	22_3_in_8	Parallel run loop
auto	13.820493131853882	0.0	discard	25_6_in_3	Parallel run loop
auto	4.917150212350353	0.0	discard	35_4_in_5	Parallel run loop
auto	1.4801224664338222	0.0	discard	19_3_in_8	Parallel run loop
auto	2.7702964943057093	0.0	discard	30_4_in_8	Parallel run loop
auto	1.6386776680031192	0.0	keep	25_3_in_8	Parallel run loop
auto	1.5400946759899503	0.0	discard	21_3_in_8	Parallel run loop
auto	3.5836695514845864	0.0	discard	27_4_in_6	Parallel run loop
auto	3.630754635357503	0.0	keep	28_4_in_6	Parallel run loop
auto	11.960108969580684	0.0	discard	18_6_in_3	Parallel run loop
auto	1.7948348845423978	0.0	discard	30_3_in_8	Parallel run loop
auto	12.771121686878123	0.0	discard	32_5_in_3	Parallel run loop
auto	2.382191620351339	0.0	discard	21_4_in_8	Parallel run loop
auto	2.519017470378839	0.0	discard	25_4_in_8	Parallel run loop
auto	1.8262321636215084	0.0	discard	31_3_in_8	Parallel run loop
auto	1.9582229879796893	0.0	discard	36_3_in_8	Parallel run loop
auto	4.955094925113674	0.0	discard	33_4_in_5	Parallel run loop
auto	3.178905265988797	0.0	discard	40_4_in_8	Parallel run loop
auto	2.7228640292078126	0.0	discard	29_4_in_8	Parallel run loop
auto	13.884493816920813	0.0	discard	38_5_in_3	Parallel run loop
auto	12.910495881561323	0.0	discard	33_5_in_3	Parallel run loop
auto	3.6247657643574387	0.0	discard	32_4_in_CIRCLE	Parallel run loop
auto	4.072242243996223	0.0	discard	35_4_in_6	Parallel run loop
auto	1.4029233710948728	0.0	discard	17_3_in_8	Parallel run loop
auto	13.820493131853882	0.0	discard	25_6_in_3	Parallel run loop
auto	5.0191542333404096	0.0	discard	37_4_in_5	Parallel run loop
auto	1.6386776680031192	0.0	discard	25_3_in_8	Parallel run loop
auto	4.27767130556721	0.0	discard	39_4_in_6	Parallel run loop
auto	5.33386413036413	0.0	discard	38_4_in_5	Parallel run loop
auto	4.950198914229462	0.0	discard	35_4_in_5	Parallel run loop
auto	3.663580563490283	0.0	discard	28_4_in_6	Parallel run loop
auto	1.7948348845423978	0.0	discard	30_3_in_8	Parallel run loop
auto	1.5104429077839856	0.0	discard	20_3_in_8	Parallel run loop
auto	2.989736754164845	0.0	discard	32_4_in_8	Parallel run loop
auto	4.786866784335104	0.0	discard	30_4_in_5	Parallel run loop
auto	14.05678443804131	0.0	discard	39_5_in_3	Parallel run loop
auto	7.03616573595127	0.0	discard	20_DOMINO_in_4	Parallel run loop
auto	2.9476053891229426	0.0	discard	35_4_in_8	Parallel run loop
auto	3.3327492536060515	0.0	discard	28_4_in_CIRCLE	Parallel run loop
auto	12.771121686878123	0.0	discard	32_5_in_3	Parallel run loop
auto	3.4673241397043126	0.0	discard	24_4_in_6	Parallel run loop
auto	4.726818672940521	0.0	discard	32_4_in_5	Parallel run loop
auto	2.485835231656688	0.0	keep	32_3_in_6	Parallel run loop
auto	4.041621768437455	0.0	discard	36_4_in_6	Parallel run loop
auto	3.504561196287405	0.0	discard	26_4_in_6	Parallel run loop
auto	1.4801224664338222	0.0	discard	19_3_in_8	Parallel run loop
auto	1.6577100735479915	0.0	discard	25_3_in_8	Parallel run loop
auto	2.7228640292078126	0.0	discard	29_4_in_8	Parallel run loop
auto	4.3715561497733395	0.0	discard	40_4_in_6	Parallel run loop
auto	3.573648811278568	0.0	discard	27_4_in_6	Parallel run loop
auto	1.8054006274626062	0.0	keep	31_3_in_8	Parallel run loop
auto	2.382191620351339	0.0	discard	21_4_in_8	Parallel run loop
auto	1.935046816120619	0.0	discard	36_3_in_8	Parallel run loop
auto	1.5400946759899503	0.0	discard	21_3_in_8	Parallel run loop
auto	4.862108401795182	0.0	discard	33_4_in_5	Parallel run loop
auto	2.7702964943057093	0.0	discard	30_4_in_8	Parallel run loop
auto	5.0191542333404096	0.0	discard	37_4_in_5	Parallel run loop
auto	1.76341890008406	0.0	discard	28_3_in_8	Parallel run loop
auto	3.704424497709297	0.0	discard	29_4_in_6	Parallel run loop
auto	1.7302612376665731	0.0	discard	27_3_in_8	Parallel run loop
auto	11.960108969580684	0.0	discard	18_6_in_3	Parallel run loop
auto	1.4029233710948728	0.0	discard	17_3_in_8	Parallel run loop
auto	1.5104429077839856	0.0	discard	20_3_in_8	Parallel run loop
auto	3.504561196287405	0.0	discard	26_4_in_6	Parallel run loop
auto	12.771121686878123	0.0	discard	32_5_in_3	Parallel run loop
auto	12.910495881561323	0.0	discard	33_5_in_3	Parallel run loop
