commit	score	memory_gb	status	problem	description
auto	1.6129930610110503	0.0	discard	6_3_in_5	Parallel run loop
auto	3.282007003076337	0.0	discard	24_3_in_5	Parallel run loop
auto	3.1374956207193923	0.0	discard	22_3_in_5	Parallel run loop
auto	1.8629999149184	0.0	discard	8_3_in_5	Parallel run loop
auto	4.73139894770969	0.0	keep	34_3_in_4	Parallel run loop
auto	1.976027659339437	0.0	discard	9_3_in_5	Parallel run loop
auto	3.0548072829227877	0.0	discard	21_3_in_5	Parallel run loop
auto	3.769316702970762	0.0	discard	22_3_in_4	Parallel run loop
auto	4.427186187177719	0.0	discard	30_3_in_4	Parallel run loop
auto	3.5812045351006736	0.0	discard	20_3_in_4	Parallel run loop
auto	2.1839033308575453	0.0	discard	11_3_in_5	Parallel run loop
auto	2.4669851746843605	0.0	discard	14_3_in_5	Parallel run loop
auto	3.4872662014932994	0.0	discard	19_3_in_4	Parallel run loop
auto	2.6456222083840815	0.0	discard	16_3_in_5	Parallel run loop
auto	4.669347970902102	0.0	discard	33_3_in_4	Parallel run loop
auto	3.678392963856205	0.0	keep	30_3_in_5	Parallel run loop
auto	2.801636902401472	0.0	keep	18_3_in_5	Parallel run loop
auto	3.3820917770136356	0.0	discard	18_3_in_4	Parallel run loop
auto	2.8968506758946635	0.0	discard	19_3_in_5	Parallel run loop
auto	2.2815480493738267	0.0	discard	12_3_in_5	Parallel run loop
auto	3.6222244988491314	0.0	discard	29_3_in_5	Parallel run loop
auto	2.084261555326621	0.0	discard	10_3_in_5	Parallel run loop
auto	3.4262381273774287	0.0	discard	26_3_in_5	Parallel run loop
auto	4.995757907269444	0.0	discard	37_3_in_4	Parallel run loop
auto	2.978764098843772	0.0	discard	20_3_in_5	Parallel run loop
auto	1.7415209795947764	0.0	discard	7_3_in_5	Parallel run loop
auto	3.494052355279717	0.0	discard	27_3_in_5	Parallel run loop
auto	2.3761911737342314	0.0	discard	13_3_in_5	Parallel run loop
auto	4.593885446611707	0.0	discard	32_3_in_4	Parallel run loop
auto	3.34757700949049	0.0	discard	25_3_in_5	Parallel run loop
auto	1.473123351925817	0.0	discard	5_3_in_5	Parallel run loop
auto	4.7342969589687565	0.0	discard	34_3_in_4	Parallel run loop
auto	2.5587768213551634	0.0	discard	15_3_in_5	Parallel run loop
auto	3.677456729398737	0.0	discard	21_3_in_4	Parallel run loop
auto	3.0522746206765015	0.0	discard	21_3_in_5	Parallel run loop
auto	3.8731337608672645	0.0	discard	33_3_in_5	Parallel run loop
auto	5.067756183027661	0.0	discard	38_3_in_4	Parallel run loop
auto	4.355520889386444	0.0	discard	29_3_in_4	Parallel run loop
auto	3.1308039530091643	0.0	discard	22_3_in_5	Parallel run loop
auto	3.5740575606050395	0.0	keep	20_3_in_4	Parallel run loop
auto	2.4669674567404027	0.0	discard	14_3_in_5	Parallel run loop
auto	4.43276144021918	0.0	discard	30_3_in_4	Parallel run loop
auto	4.7679614783662085	0.0	discard	47_3_in_5	Parallel run loop
auto	1.612334929828714	0.0	discard	6_3_in_5	Parallel run loop
auto	4.848843986069559	0.0	discard	35_3_in_4	Parallel run loop
auto	3.4775576990437513	0.0	discard	19_3_in_4	Parallel run loop
auto	2.808020254376545	0.0	discard	18_3_in_5	Parallel run loop
auto	1.8622755332068297	0.0	discard	8_3_in_5	Parallel run loop
auto	3.6855834233555655	0.0	discard	30_3_in_5	Parallel run loop
auto	1.9752566374162852	0.0	discard	9_3_in_5	Parallel run loop
auto	2.908499177263905	0.0	discard	19_3_in_5	Parallel run loop
auto	3.95684324496722	0.0	discard	34_3_in_5	Parallel run loop
auto	2.084218236009746	0.0	discard	10_3_in_5	Parallel run loop
auto	3.6269595439337574	0.0	discard	29_3_in_5	Parallel run loop
auto	2.979753376128373	0.0	discard	20_3_in_5	Parallel run loop
auto	2.2808384953839287	0.0	discard	12_3_in_5	Parallel run loop
auto	2.18368232174142	0.0	keep	11_3_in_5	Parallel run loop
auto	3.427151908793224	0.0	discard	26_3_in_5	Parallel run loop
auto	3.3556367555428004	0.0	discard	25_3_in_5	Parallel run loop
auto	2.373970869543096	0.0	keep	13_3_in_5	Parallel run loop
auto	3.4908635152949326	0.0	discard	27_3_in_5	Parallel run loop
auto	4.713562801283345	0.0	keep	34_3_in_4	Parallel run loop
auto	4.569417266909687	0.0	keep	32_3_in_4	Parallel run loop
auto	1.472517866948015	0.0	discard	5_3_in_5	Parallel run loop
auto	5.005399869378004	0.0	keep	38_3_in_4	Parallel run loop
auto	3.211111740756116	0.0	discard	23_3_in_5	Parallel run loop
auto	3.8830095189943075	0.0	discard	33_3_in_5	Parallel run loop
auto	4.351946263713547	0.0	keep	29_3_in_4	Parallel run loop
auto	1.7415209536108187	0.0	discard	7_3_in_5	Parallel run loop
auto	1.6123349281926975	0.0	discard	6_3_in_5	Parallel run loop
auto	3.0515915071614987	0.0	discard	21_3_in_5	Parallel run loop
auto	2.4690980444327453	0.0	discard	14_3_in_5	Parallel run loop
auto	5.090643765807064	0.0	keep	39_3_in_4	Parallel run loop
auto	3.561885030990395	0.0	keep	20_3_in_4	Parallel run loop
auto	4.410032600340793	0.0	keep	30_3_in_4	Parallel run loop
auto	4.685754642392047	0.0	keep	47_3_in_5	Parallel run loop
auto	2.860473617685805	0.0	discard	13_3_in_4	Parallel run loop
auto	3.48773319658033	0.0	discard	19_3_in_4	Parallel run loop
auto	2.8087295952721685	0.0	discard	18_3_in_5	Parallel run loop
auto	1.976028246531454	0.0	discard	9_3_in_5	Parallel run loop
auto	3.6831066200679987	0.0	discard	30_3_in_5	Parallel run loop
auto	2.907357037347664	0.0	discard	19_3_in_5	Parallel run loop
auto	2.733869291564885	0.0	discard	17_3_in_5	Parallel run loop
auto	4.77129101399303	0.0	discard	46_3_in_5	Parallel run loop
auto	3.855053073503376	0.0	discard	23_3_in_4	Parallel run loop
auto	3.7432658385823077	0.0	keep	31_3_in_5	Parallel run loop
auto	3.7761226259346237	0.0	discard	22_3_in_4	Parallel run loop
auto	2.281461000184168	0.0	discard	12_3_in_5	Parallel run loop
auto	2.184061031836693	0.0	discard	11_3_in_5	Parallel run loop
auto	4.720875305652867	0.0	discard	34_3_in_4	Parallel run loop
auto	4.201338300848985	0.0	discard	27_3_in_4	Parallel run loop
auto	2.376183853477225	0.0	discard	13_3_in_5	Parallel run loop
auto	1.8618311377086982	0.0	discard	8_3_in_5	Parallel run loop
auto	3.4939233036605644	0.0	discard	27_3_in_5	Parallel run loop
auto	3.213588893894287	0.0	discard	23_3_in_5	Parallel run loop
auto	4.599216885620205	0.0	discard	32_3_in_4	Parallel run loop
auto	5.029887232151464	0.0	discard	38_3_in_4	Parallel run loop
auto	1.6123349311755402	0.0	discard	6_3_in_5	Parallel run loop
auto	2.082093600943459	0.0	discard	10_3_in_5	Parallel run loop
auto	3.8774103766542862	0.0	discard	33_3_in_5	Parallel run loop
auto	2.553117873774881	0.0	discard	15_3_in_5	Parallel run loop
auto	4.362909984287455	0.0	discard	29_3_in_4	Parallel run loop
auto	5.087371243872151	0.0	keep	39_3_in_4	Parallel run loop
auto	3.379270529794344	0.0	discard	18_3_in_4	Parallel run loop
auto	3.5565134275872303	0.0	discard	28_3_in_5	Parallel run loop
auto	3.5564884188380614	0.0	keep	20_3_in_4	Parallel run loop
auto	4.422885745981985	0.0	discard	30_3_in_4	Parallel run loop
auto	4.746458461456681	0.0	discard	47_3_in_5	Parallel run loop
auto	2.8098431628275424	0.0	discard	18_3_in_5	Parallel run loop
auto	4.523233134502292	0.0	discard	31_3_in_4	Parallel run loop
auto	1.7415208216133675	0.0	discard	7_3_in_5	Parallel run loop
auto	1.4717781499129454	0.0	keep	5_3_in_5	Parallel run loop
auto	2.4686315741347253	0.0	discard	14_3_in_5	Parallel run loop
auto	3.8462972149463677	0.0	discard	23_3_in_4	Parallel run loop
auto	4.7871002244129865	0.0	discard	46_3_in_5	Parallel run loop
auto	3.821722232967094	0.0	discard	32_3_in_5	Parallel run loop
auto	3.68792623073183	0.0	discard	30_3_in_5	Parallel run loop
auto	3.6843551816135545	0.0	discard	21_3_in_4	Parallel run loop
auto	3.7510097520858428	0.0	discard	31_3_in_5	Parallel run loop
auto	2.3770922082969337	0.0	discard	13_3_in_5	Parallel run loop
auto	3.493992600831204	0.0	discard	27_3_in_5	Parallel run loop
auto	4.203720865077085	0.0	discard	27_3_in_4	Parallel run loop
auto	1.8631547263385706	0.0	discard	8_3_in_5	Parallel run loop
auto	1.9747628999136118	0.0	discard	9_3_in_5	Parallel run loop
auto	4.754354640835248	0.0	discard	34_3_in_4	Parallel run loop
auto	2.082168046117364	0.0	discard	10_3_in_5	Parallel run loop
auto	2.1832409781262574	0.0	keep	11_3_in_5	Parallel run loop
auto	4.960932180721833	0.0	discard	49_3_in_5	Parallel run loop
auto	2.281664734507033	0.0	discard	12_3_in_5	Parallel run loop
auto	3.2639361986249087	0.0	discard	24_3_in_5	Parallel run loop
auto	5.8675055890621355	0.0	discard	47_3_in_4	Parallel run loop
auto	3.8793145918449308	0.0	discard	33_3_in_5	Parallel run loop
auto	3.383061026565786	0.0	discard	18_3_in_4	Parallel run loop
auto	3.5532835594217	0.0	discard	28_3_in_5	Parallel run loop
auto	5.134004173654807	0.0	discard	39_3_in_4	Parallel run loop
auto	4.438001132869936	0.0	discard	30_3_in_4	Parallel run loop
auto	2.5552975905580557	0.0	discard	15_3_in_5	Parallel run loop
auto	4.93618043293336	0.0	keep	50_3_in_5	Parallel run loop
auto	3.5730104666162057	0.0	discard	20_3_in_4	Parallel run loop
auto	4.709264802544186	0.0	discard	47_3_in_5	Parallel run loop
auto	1.612334933193575	0.0	discard	6_3_in_5	Parallel run loop
auto	4.67042897901047	0.0	discard	33_3_in_4	Parallel run loop
auto	1.7415210998766584	0.0	discard	7_3_in_5	Parallel run loop
auto	1.4727654735738644	0.0	discard	5_3_in_5	Parallel run loop
auto	3.693265417791151	0.0	discard	30_3_in_5	Parallel run loop
auto	2.816000392497135	0.0	discard	18_3_in_5	Parallel run loop
auto	5.309996556824351	0.0	discard	41_3_in_4	Parallel run loop
auto	3.858815184256813	0.0	discard	23_3_in_4	Parallel run loop
auto	4.123246625337205	0.0	discard	26_3_in_4	Parallel run loop
auto	5.808973948293675	0.0	keep	48_3_in_4	Parallel run loop
auto	3.760512005222408	0.0	discard	31_3_in_5	Parallel run loop
auto	1.9748128445174753	0.0	discard	9_3_in_5	Parallel run loop
auto	4.201578033665125	0.0	discard	27_3_in_4	Parallel run loop
auto	2.375697005154569	0.0	discard	13_3_in_5	Parallel run loop
auto	2.4685760777075347	0.0	discard	14_3_in_5	Parallel run loop
auto	4.829879783746451	0.0	discard	35_3_in_4	Parallel run loop
auto	4.934683003968771	0.0	discard	48_3_in_5	Parallel run loop
auto	2.184352538339819	0.0	discard	11_3_in_5	Parallel run loop
auto	3.2838686996247306	0.0	discard	24_3_in_5	Parallel run loop
auto	3.948195710948896	0.0	discard	24_3_in_4	Parallel run loop
auto	2.0821479981562923	0.0	discard	10_3_in_5	Parallel run loop
auto	5.023012218450543	0.0	discard	49_3_in_5	Parallel run loop
auto	3.9431383544118255	0.0	discard	34_3_in_5	Parallel run loop
auto	3.555845523152025	0.0	discard	28_3_in_5	Parallel run loop
auto	3.3851849864458132	0.0	discard	18_3_in_4	Parallel run loop
auto	2.2814507095924945	0.0	discard	12_3_in_5	Parallel run loop
auto	1.8618736677268886	0.0	discard	8_3_in_5	Parallel run loop
auto	5.657600905983632	0.0	keep	47_3_in_4	Parallel run loop
auto	4.953321711451065	0.0	discard	50_3_in_5	Parallel run loop
auto	5.147536598450751	0.0	discard	39_3_in_4	Parallel run loop
auto	3.566994251458536	0.0	discard	20_3_in_4	Parallel run loop
auto	4.78359044438786	0.0	discard	47_3_in_5	Parallel run loop
auto	4.666822863538866	0.0	discard	33_3_in_4	Parallel run loop
auto	1.612334935566479	0.0	discard	6_3_in_5	Parallel run loop
auto	2.7308535085572356	0.0	discard	17_3_in_5	Parallel run loop
auto	1.4735930228764524	0.0	discard	5_3_in_5	Parallel run loop
auto	4.0850521334227805	0.0	discard	36_3_in_5	Parallel run loop
auto	4.5166166626505975	0.0	discard	31_3_in_4	Parallel run loop
auto	2.858502167301829	0.0	discard	13_3_in_4	Parallel run loop
auto	3.8614413852380354	0.0	discard	23_3_in_4	Parallel run loop
auto	5.929597324436657	0.0	discard	48_3_in_4	Parallel run loop
auto	3.822812301971383	0.0	discard	32_3_in_5	Parallel run loop
auto	3.773769728052564	0.0	discard	22_3_in_4	Parallel run loop
auto	3.678384372843491	0.0	discard	21_3_in_4	Parallel run loop
auto	4.998157855515855	0.0	discard	37_3_in_4	Parallel run loop
auto	1.975245266641215	0.0	discard	9_3_in_5	Parallel run loop
auto	2.376788192523703	0.0	discard	13_3_in_5	Parallel run loop
auto	1.741520852127309	0.0	discard	7_3_in_5	Parallel run loop
auto	2.0816703177002123	0.0	discard	10_3_in_5	Parallel run loop
auto	3.943533120687586	0.0	discard	24_3_in_4	Parallel run loop
auto	5.165136920062304	0.0	discard	40_3_in_4	Parallel run loop
auto	5.017081076380262	0.0	discard	49_3_in_5	Parallel run loop
auto	2.282526468782884	0.0	discard	12_3_in_5	Parallel run loop
auto	5.587114090265403	0.0	discard	44_3_in_4	Parallel run loop
auto	2.6402635103222005	0.0	keep	16_3_in_5	Parallel run loop
auto	2.465623966445043	0.0	discard	14_3_in_5	Parallel run loop
auto	5.798888192034757	0.0	discard	47_3_in_4	Parallel run loop
auto	5.282427458982876	0.0	keep	41_3_in_4	Parallel run loop
auto	1.8622739383677647	0.0	discard	8_3_in_5	Parallel run loop
auto	3.9275954464371217	0.0	keep	34_3_in_5	Parallel run loop
auto	5.1373939705447285	0.0	discard	39_3_in_4	Parallel run loop
auto	3.555929255552535	0.0	keep	20_3_in_4	Parallel run loop
auto	5.070686620602649	0.0	discard	50_3_in_5	Parallel run loop
auto	2.1837907099349776	0.0	discard	11_3_in_5	Parallel run loop
auto	3.3568631063954775	0.0	discard	25_3_in_5	Parallel run loop
auto	4.092476862512821	0.0	discard	36_3_in_5	Parallel run loop
auto	4.115596808950082	0.0	discard	26_3_in_4	Parallel run loop
auto	2.732007303710872	0.0	discard	17_3_in_5	Parallel run loop
auto	4.58388874156798	0.0	discard	43_3_in_5	Parallel run loop
auto	2.860126891969476	0.0	discard	13_3_in_4	Parallel run loop
auto	4.640558059439917	0.0	discard	44_3_in_5	Parallel run loop
auto	3.200794980711011	0.0	keep	23_3_in_5	Parallel run loop
auto	4.815216235356625	0.0	discard	35_3_in_4	Parallel run loop
auto	4.915319526260801	0.0	keep	48_3_in_5	Parallel run loop
auto	5.417044351478737	0.0	discard	42_3_in_4	Parallel run loop
auto	1.9752419886073038	0.0	discard	9_3_in_5	Parallel run loop
auto	5.228677701117023	0.0	discard	40_3_in_4	Parallel run loop
auto	4.223182423368272	0.0	discard	38_3_in_5	Parallel run loop
auto	1.612334935277943	0.0	discard	6_3_in_5	Parallel run loop
auto	3.681252045126282	0.0	discard	21_3_in_4	Parallel run loop
auto	2.0816624500400325	0.0	discard	10_3_in_5	Parallel run loop
auto	3.617976051071234	0.0	discard	29_3_in_5	Parallel run loop
auto	1.7415207652163502	0.0	discard	7_3_in_5	Parallel run loop
auto	4.741096075247791	0.0	discard	46_3_in_5	Parallel run loop
auto	2.644247891280687	0.0	discard	16_3_in_5	Parallel run loop
auto	2.4652187605962332	0.0	discard	14_3_in_5	Parallel run loop
auto	2.5559232338788074	0.0	discard	15_3_in_5	Parallel run loop
auto	5.239388915911843	0.0	keep	41_3_in_4	Parallel run loop
auto	3.772431793856755	0.0	discard	22_3_in_4	Parallel run loop
auto	1.8619464760431805	0.0	discard	8_3_in_5	Parallel run loop
auto	3.9461152167487463	0.0	discard	34_3_in_5	Parallel run loop
auto	5.794113313948808	0.0	discard	47_3_in_4	Parallel run loop
auto	2.376183853477225	0.0	discard	13_3_in_5	Parallel run loop
auto	3.5781902777109544	0.0	discard	20_3_in_4	Parallel run loop
auto	2.2810567560643444	0.0	discard	12_3_in_5	Parallel run loop
auto	1.4720175212422872	0.0	discard	5_3_in_5	Parallel run loop
auto	2.7323676487059054	0.0	discard	17_3_in_5	Parallel run loop
auto	4.5121471333184004	0.0	discard	31_3_in_4	Parallel run loop
auto	4.545698950837966	0.0	keep	43_3_in_5	Parallel run loop
auto	4.123124181466853	0.0	discard	26_3_in_4	Parallel run loop
auto	4.010477889407581	0.0	discard	35_3_in_5	Parallel run loop
auto	3.214050405610152	0.0	discard	23_3_in_5	Parallel run loop
auto	3.8213008669137976	0.0	discard	32_3_in_5	Parallel run loop
auto	4.9847754772189905	0.0	discard	37_3_in_4	Parallel run loop
auto	4.834594736876403	0.0	discard	35_3_in_4	Parallel run loop
auto	2.1839791795050525	0.0	discard	11_3_in_5	Parallel run loop
auto	3.2867657182486067	0.0	discard	24_3_in_5	Parallel run loop
auto	1.9752394669748916	0.0	discard	9_3_in_5	Parallel run loop
auto	4.915319526260801	0.0	discard	48_3_in_5	Parallel run loop
auto	1.7415211268108657	0.0	discard	7_3_in_5	Parallel run loop
auto	3.13858163927497	0.0	discard	22_3_in_5	Parallel run loop
auto	4.43601535585848	0.0	discard	41_3_in_5	Parallel run loop
auto	4.338037420792714	0.0	discard	40_3_in_5	Parallel run loop
auto	2.082410107254271	0.0	discard	10_3_in_5	Parallel run loop
auto	5.300918451365578	0.0	discard	41_3_in_4	Parallel run loop
auto	2.5618419556280747	0.0	discard	15_3_in_5	Parallel run loop
auto	2.46658543201319	0.0	discard	14_3_in_5	Parallel run loop
auto	3.923471452589675	0.0	keep	34_3_in_5	Parallel run loop
auto	1.6123349343104063	0.0	discard	6_3_in_5	Parallel run loop
auto	2.6370485097753296	0.0	keep	16_3_in_5	Parallel run loop
auto	3.6178453475505643	0.0	discard	29_3_in_5	Parallel run loop
auto	4.780181091478305	0.0	discard	46_3_in_5	Parallel run loop
auto	2.2825210292601	0.0	discard	12_3_in_5	Parallel run loop
auto	3.4749579846208545	0.0	discard	19_3_in_4	Parallel run loop
auto	2.9636364242807445	0.0	discard	20_3_in_5	Parallel run loop
auto	5.510118396618576	0.0	keep	44_3_in_4	Parallel run loop
auto	2.889276125195163	0.0	keep	19_3_in_5	Parallel run loop
auto	1.4729382517437977	0.0	discard	5_3_in_5	Parallel run loop
auto	5.794978717846507	0.0	discard	46_3_in_4	Parallel run loop
auto	2.7267716268126065	0.0	discard	17_3_in_5	Parallel run loop
auto	1.865150091772716	0.0	discard	8_3_in_5	Parallel run loop
auto	4.5471086147615	0.0	discard	43_3_in_5	Parallel run loop
auto	3.99280955847488	0.0	keep	35_3_in_5	Parallel run loop
auto	3.3548512625620384	0.0	discard	25_3_in_5	Parallel run loop
auto	2.1840005756627887	0.0	discard	11_3_in_5	Parallel run loop
auto	4.669414131048485	0.0	discard	33_3_in_4	Parallel run loop
auto	4.9989739085753895	0.0	discard	37_3_in_4	Parallel run loop
auto	4.825042646460126	0.0	discard	35_3_in_4	Parallel run loop
auto	4.915319526260801	0.0	discard	48_3_in_5	Parallel run loop
auto	3.212510546033262	0.0	discard	23_3_in_5	Parallel run loop
auto	4.407454570116356	0.0	discard	41_3_in_5	Parallel run loop
auto	5.647952956007288	0.0	keep	45_3_in_4	Parallel run loop
auto	3.626194651604767	0.0	discard	29_3_in_5	Parallel run loop
auto	4.337158486578315	0.0	discard	40_3_in_5	Parallel run loop
auto	4.356312031809176	0.0	discard	29_3_in_4	Parallel run loop
auto	1.741302480727963	0.0	keep	7_3_in_5	Parallel run loop
auto	5.879887617876555	0.0	discard	48_3_in_4	Parallel run loop
auto	5.080052420447588	0.0	discard	38_3_in_4	Parallel run loop
auto	2.46692076071614	0.0	discard	14_3_in_5	Parallel run loop
auto	1.9745999816583595	0.0	keep	9_3_in_5	Parallel run loop
auto	3.489016757376917	0.0	discard	19_3_in_4	Parallel run loop
auto	4.128960978773291	0.0	keep	37_3_in_5	Parallel run loop
auto	3.947879099407685	0.0	discard	34_3_in_5	Parallel run loop
auto	2.979874119835598	0.0	discard	20_3_in_5	Parallel run loop
auto	2.6454091069146624	0.0	discard	16_3_in_5	Parallel run loop
auto	4.613193520329596	0.0	discard	44_3_in_5	Parallel run loop
auto	5.251728161491698	0.0	discard	41_3_in_4	Parallel run loop
auto	2.899557486435371	0.0	discard	19_3_in_5	Parallel run loop
auto	5.507143899560233	0.0	keep	44_3_in_4	Parallel run loop
auto	5.2607077896165695	0.0	keep	42_3_in_4	Parallel run loop
auto	2.284152641201089	0.0	discard	12_3_in_5	Parallel run loop
auto	3.423154964041294	0.0	discard	26_3_in_5	Parallel run loop
auto	3.3556612279080955	0.0	discard	25_3_in_5	Parallel run loop
auto	2.7314538930997747	0.0	discard	17_3_in_5	Parallel run loop
auto	4.638921679552324	0.0	keep	33_3_in_4	Parallel run loop
auto	4.549971733868087	0.0	discard	43_3_in_5	Parallel run loop
auto	4.8291095387918155	0.0	discard	35_3_in_4	Parallel run loop
auto	3.952641702922097	0.0	discard	24_3_in_4	Parallel run loop
auto	4.0108940558382296	0.0	discard	35_3_in_5	Parallel run loop
auto	2.377680188257214	0.0	discard	13_3_in_5	Parallel run loop
auto	5.7132249482627175	0.0	discard	45_3_in_4	Parallel run loop
auto	4.934683003968771	0.0	discard	48_3_in_5	Parallel run loop
auto	5.9622688805178194	0.0	discard	48_3_in_4	Parallel run loop
auto	1.741521089253839	0.0	discard	7_3_in_5	Parallel run loop
auto	1.863147342173624	0.0	discard	8_3_in_5	Parallel run loop
auto	4.356791006586825	0.0	discard	29_3_in_4	Parallel run loop
auto	4.3677964743052975	0.0	discard	40_3_in_5	Parallel run loop
auto	2.8576944903029786	0.0	discard	13_3_in_4	Parallel run loop
auto	2.184000119231139	0.0	discard	11_3_in_5	Parallel run loop
auto	2.64632235265758	0.0	discard	16_3_in_5	Parallel run loop
auto	1.9747622290882303	0.0	discard	9_3_in_5	Parallel run loop
auto	4.438726344183587	0.0	discard	41_3_in_5	Parallel run loop
auto	3.765164554072858	0.0	discard	22_3_in_4	Parallel run loop
auto	5.309996556824351	0.0	discard	41_3_in_4	Parallel run loop
auto	2.4659355544552657	0.0	discard	14_3_in_5	Parallel run loop
auto	3.740292630295907	0.0	keep	31_3_in_5	Parallel run loop
auto	3.387695813606559	0.0	discard	18_3_in_4	Parallel run loop
auto	5.47793347153846	0.0	keep	44_3_in_4	Parallel run loop
auto	4.199693166277639	0.0	discard	27_3_in_4	Parallel run loop
auto	4.133010567214957	0.0	discard	37_3_in_5	Parallel run loop
auto	4.211890671734769	0.0	discard	38_3_in_5	Parallel run loop
auto	5.298384715320234	0.0	discard	42_3_in_4	Parallel run loop
auto	1.612334936953984	0.0	discard	6_3_in_5	Parallel run loop
auto	3.5468551195181495	0.0	discard	28_3_in_5	Parallel run loop
auto	4.511461568353446	0.0	discard	31_3_in_4	Parallel run loop
auto	3.822590015910944	0.0	discard	32_3_in_5	Parallel run loop
auto	4.831035797280756	0.0	discard	35_3_in_4	Parallel run loop
auto	4.2821596558921735	0.0	discard	28_3_in_4	Parallel run loop
auto	3.287251039359204	0.0	discard	24_3_in_5	Parallel run loop
auto	4.532666431949152	0.0	keep	43_3_in_5	Parallel run loop
auto	3.6731964592442723	0.0	discard	21_3_in_4	Parallel run loop
auto	4.064967614482476	0.0	discard	36_3_in_5	Parallel run loop
auto	4.667308396814935	0.0	discard	33_3_in_4	Parallel run loop
auto	3.0607699640967896	0.0	discard	21_3_in_5	Parallel run loop
auto	3.125966412039639	0.0	discard	22_3_in_5	Parallel run loop
auto	2.280693190144371	0.0	discard	12_3_in_5	Parallel run loop
auto	2.8574940526862185	0.0	keep	13_3_in_4	Parallel run loop
auto	4.861753263418145	0.0	keep	49_3_in_5	Parallel run loop
auto	5.932996747424285	0.0	discard	48_3_in_4	Parallel run loop
