commit	score	memory_gb	status	problem	description
auto	4.743893703613669	0.0	discard	47_3_in_5	Parallel run loop
auto	1.7415213554575293	0.0	discard	7_3_in_5	Parallel run loop
auto	3.4128861078981187	0.0	discard	26_3_in_5	Parallel run loop
auto	5.205715198843607	0.0	discard	40_3_in_4	Parallel run loop
auto	2.85800979240017	0.0	discard	13_3_in_4	Parallel run loop
auto	4.031642915555777	0.0	discard	25_3_in_4	Parallel run loop
auto	4.7894560122898095	0.0	discard	46_3_in_5	Parallel run loop
auto	4.83512348743006	0.0	discard	35_3_in_4	Parallel run loop
auto	5.281935413889523	0.0	discard	41_3_in_4	Parallel run loop
auto	1.8625278381907544	0.0	discard	8_3_in_5	Parallel run loop
auto	5.639011370907293	0.0	discard	45_3_in_4	Parallel run loop
auto	4.19126175551533	0.0	discard	38_3_in_5	Parallel run loop
auto	3.859886681529355	0.0	discard	23_3_in_4	Parallel run loop
auto	3.9447223664625923	0.0	discard	34_3_in_5	Parallel run loop
auto	3.2653207001879005	0.0	discard	24_3_in_5	Parallel run loop
auto	2.8027682661513866	0.0	discard	18_3_in_5	Parallel run loop
auto	3.752559168276142	0.0	discard	31_3_in_5	Parallel run loop
auto	5.087310109199051	0.0	keep	39_3_in_4	Parallel run loop
auto	4.918991752152422	0.0	discard	36_3_in_4	Parallel run loop
auto	4.201853485095585	0.0	discard	27_3_in_4	Parallel run loop
auto	4.493924228272134	0.0	discard	42_3_in_5	Parallel run loop
auto	4.120704841297614	0.0	discard	26_3_in_4	Parallel run loop
auto	3.388983482069515	0.0	discard	18_3_in_4	Parallel run loop
auto	4.596047595394476	0.0	discard	32_3_in_4	Parallel run loop
auto	3.4911849899890632	0.0	discard	19_3_in_4	Parallel run loop
auto	3.689105641415202	0.0	discard	30_3_in_5	Parallel run loop
auto	4.521480299677108	0.0	discard	43_3_in_5	Parallel run loop
auto	3.626281239317357	0.0	discard	29_3_in_5	Parallel run loop
auto	2.376686696691942	0.0	discard	13_3_in_5	Parallel run loop
auto	3.4228367222673124	0.0	discard	26_3_in_5	Parallel run loop
auto	2.465178612100705	0.0	discard	14_3_in_5	Parallel run loop
auto	3.5575865157565896	0.0	discard	28_3_in_5	Parallel run loop
auto	2.2828463356619753	0.0	discard	12_3_in_5	Parallel run loop
auto	1.6123349319774278	0.0	discard	6_3_in_5	Parallel run loop
auto	4.7480943727201375	0.0	discard	47_3_in_5	Parallel run loop
auto	4.071158098037037	0.0	discard	36_3_in_5	Parallel run loop
auto	5.225239631965783	0.0	discard	40_3_in_4	Parallel run loop
auto	4.219228847953709	0.0	discard	38_3_in_5	Parallel run loop
auto	4.430692479862689	0.0	discard	30_3_in_4	Parallel run loop
auto	4.511012361479802	0.0	discard	31_3_in_4	Parallel run loop
auto	4.022465532823228	0.0	discard	35_3_in_5	Parallel run loop
auto	2.8155364596357235	0.0	discard	18_3_in_5	Parallel run loop
auto	1.7415207886861965	0.0	discard	7_3_in_5	Parallel run loop
auto	1.4723585422181367	0.0	discard	5_3_in_5	Parallel run loop
auto	3.27607519606322	0.0	discard	24_3_in_5	Parallel run loop
auto	3.6778780092751195	0.0	discard	21_3_in_4	Parallel run loop
auto	4.734183976938621	0.0	discard	34_3_in_4	Parallel run loop
auto	4.971696999360521	0.0	discard	49_3_in_5	Parallel run loop
auto	3.5842564819388483	0.0	discard	20_3_in_4	Parallel run loop
auto	5.083545339704124	0.0	keep	39_3_in_4	Parallel run loop
auto	3.118509002944388	0.0	discard	22_3_in_5	Parallel run loop
auto	5.82983700250971	0.0	discard	47_3_in_4	Parallel run loop
auto	3.0595476058723476	0.0	discard	21_3_in_5	Parallel run loop
auto	4.335426874249968	0.0	discard	40_3_in_5	Parallel run loop
auto	4.437376086504897	0.0	discard	42_3_in_5	Parallel run loop
auto	3.691714675555753	0.0	discard	30_3_in_5	Parallel run loop
auto	2.3772535600574756	0.0	discard	13_3_in_5	Parallel run loop
auto	2.9840633829943117	0.0	discard	20_3_in_5	Parallel run loop
auto	5.561389735436036	0.0	discard	44_3_in_4	Parallel run loop
auto	4.565205935851734	0.0	discard	43_3_in_5	Parallel run loop
auto	5.05461090924511	0.0	discard	50_3_in_5	Parallel run loop
auto	3.4231984837613774	0.0	discard	26_3_in_5	Parallel run loop
auto	5.690435029094675	0.0	keep	46_3_in_4	Parallel run loop
auto	4.655111726180373	0.0	discard	33_3_in_4	Parallel run loop
auto	5.244840757282829	0.0	discard	40_3_in_4	Parallel run loop
auto	2.471036019478588	0.0	discard	14_3_in_5	Parallel run loop
auto	2.9035513162516793	0.0	discard	19_3_in_5	Parallel run loop
auto	4.435247274091654	0.0	discard	30_3_in_4	Parallel run loop
auto	4.076228129168676	0.0	discard	36_3_in_5	Parallel run loop
auto	4.906759601986733	0.0	discard	47_3_in_5	Parallel run loop
auto	1.8622693591596882	0.0	discard	8_3_in_5	Parallel run loop
auto	4.518654857818839	0.0	discard	31_3_in_4	Parallel run loop
auto	2.642663897110049	0.0	discard	16_3_in_5	Parallel run loop
auto	1.7415209020091427	0.0	discard	7_3_in_5	Parallel run loop
auto	3.281862975261556	0.0	discard	24_3_in_5	Parallel run loop
auto	5.0721030902387945	0.0	discard	38_3_in_4	Parallel run loop
auto	4.355805272659704	0.0	discard	29_3_in_4	Parallel run loop
auto	5.787941157328067	0.0	keep	48_3_in_4	Parallel run loop
auto	4.734302395643976	0.0	discard	34_3_in_4	Parallel run loop
auto	4.137731294272307	0.0	discard	37_3_in_5	Parallel run loop
auto	5.385694407660759	0.0	discard	42_3_in_4	Parallel run loop
auto	5.100251467359226	0.0	discard	39_3_in_4	Parallel run loop
auto	3.0388273599739866	0.0	keep	21_3_in_5	Parallel run loop
auto	4.475659542793828	0.0	discard	42_3_in_5	Parallel run loop
auto	3.9489720404264297	0.0	discard	24_3_in_4	Parallel run loop
auto	3.1255112614861718	0.0	discard	22_3_in_5	Parallel run loop
auto	4.894104483565227	0.0	keep	48_3_in_5	Parallel run loop
auto	4.345396349684011	0.0	discard	40_3_in_5	Parallel run loop
auto	4.03499304474626	0.0	discard	25_3_in_4	Parallel run loop
auto	2.737010711913475	0.0	discard	17_3_in_5	Parallel run loop
auto	1.9752561288221044	0.0	discard	9_3_in_5	Parallel run loop
auto	2.9838593032890177	0.0	discard	20_3_in_5	Parallel run loop
auto	2.856623626222795	0.0	keep	13_3_in_4	Parallel run loop
auto	5.761724730717903	0.0	discard	46_3_in_4	Parallel run loop
auto	5.128497686856184	0.0	discard	50_3_in_5	Parallel run loop
auto	4.671840926000884	0.0	discard	33_3_in_4	Parallel run loop
auto	4.3071523901739175	0.0	discard	39_3_in_5	Parallel run loop
auto	3.773087391471139	0.0	discard	22_3_in_4	Parallel run loop
auto	3.862207024373548	0.0	discard	23_3_in_4	Parallel run loop
auto	1.8622734644082803	0.0	discard	8_3_in_5	Parallel run loop
auto	4.052528535698155	0.0	keep	36_3_in_5	Parallel run loop
auto	4.682676257576483	0.0	discard	46_3_in_5	Parallel run loop
auto	4.432571909100386	0.0	discard	30_3_in_4	Parallel run loop
auto	2.6472416994375605	0.0	discard	16_3_in_5	Parallel run loop
auto	4.353670804934695	0.0	discard	29_3_in_4	Parallel run loop
auto	3.745343901275139	0.0	discard	31_3_in_5	Parallel run loop
auto	1.7415212469928043	0.0	discard	7_3_in_5	Parallel run loop
auto	4.193807570274168	0.0	keep	27_3_in_4	Parallel run loop
auto	3.4909897275867743	0.0	discard	27_3_in_5	Parallel run loop
auto	4.737309945126638	0.0	discard	34_3_in_4	Parallel run loop
auto	5.926234373903951	0.0	discard	48_3_in_4	Parallel run loop
auto	3.3828974516717856	0.0	discard	18_3_in_4	Parallel run loop
auto	2.557018700472065	0.0	discard	15_3_in_5	Parallel run loop
auto	5.066038834095818	0.0	keep	39_3_in_4	Parallel run loop
auto	3.9518895814636434	0.0	discard	24_3_in_4	Parallel run loop
auto	4.501108891407314	0.0	discard	42_3_in_5	Parallel run loop
auto	3.061069715300917	0.0	discard	21_3_in_5	Parallel run loop
auto	3.140203625733029	0.0	discard	22_3_in_5	Parallel run loop
auto	4.039204392944652	0.0	discard	25_3_in_4	Parallel run loop
auto	4.878403788675547	0.0	keep	48_3_in_5	Parallel run loop
auto	3.5498780646510286	0.0	discard	28_3_in_5	Parallel run loop
auto	1.612334946887304	0.0	discard	6_3_in_5	Parallel run loop
auto	2.855975678794047	0.0	keep	13_3_in_4	Parallel run loop
auto	5.47537358087101	0.0	discard	43_3_in_4	Parallel run loop
auto	4.284771226480588	0.0	discard	28_3_in_4	Parallel run loop
auto	1.4735926263639503	0.0	discard	5_3_in_5	Parallel run loop
auto	4.850539579060541	0.0	keep	49_3_in_5	Parallel run loop
auto	4.029522400341658	0.0	discard	35_3_in_5	Parallel run loop
auto	3.6862680395482084	0.0	discard	21_3_in_4	Parallel run loop
auto	4.094330653161774	0.0	discard	36_3_in_5	Parallel run loop
auto	3.867877042524789	0.0	discard	23_3_in_4	Parallel run loop
auto	4.811827524619835	0.0	discard	46_3_in_5	Parallel run loop
auto	4.444734909722076	0.0	discard	30_3_in_4	Parallel run loop
auto	4.3563096628278375	0.0	discard	29_3_in_4	Parallel run loop
auto	3.7469690566083487	0.0	discard	31_3_in_5	Parallel run loop
auto	3.5796001724364026	0.0	discard	20_3_in_4	Parallel run loop
auto	3.4895103213820304	0.0	discard	27_3_in_5	Parallel run loop
auto	4.19506477059012	0.0	discard	27_3_in_4	Parallel run loop
auto	5.79999140887007	0.0	discard	47_3_in_4	Parallel run loop
auto	2.8919911855989016	0.0	discard	19_3_in_5	Parallel run loop
auto	5.553503207265787	0.0	discard	44_3_in_4	Parallel run loop
auto	4.7355157979358795	0.0	discard	34_3_in_4	Parallel run loop
auto	5.9578513568749205	0.0	discard	48_3_in_4	Parallel run loop
auto	5.662086560854177	0.0	discard	45_3_in_4	Parallel run loop
auto	5.218276592534663	0.0	keep	41_3_in_4	Parallel run loop
auto	5.06273342893662	0.0	keep	39_3_in_4	Parallel run loop
auto	5.361431482114366	0.0	discard	42_3_in_4	Parallel run loop
auto	5.078565434721058	0.0	discard	38_3_in_4	Parallel run loop
auto	4.152091264647593	0.0	discard	37_3_in_5	Parallel run loop
auto	3.8921945247892684	0.0	discard	33_3_in_5	Parallel run loop
auto	4.961834196194671	0.0	discard	48_3_in_5	Parallel run loop
auto	2.0816221745237353	0.0	keep	10_3_in_5	Parallel run loop
auto	2.1840564144118213	0.0	discard	11_3_in_5	Parallel run loop
auto	1.9752519778518964	0.0	discard	9_3_in_5	Parallel run loop
auto	2.283428867707684	0.0	discard	12_3_in_5	Parallel run loop
auto	3.2089470758902694	0.0	discard	23_3_in_5	Parallel run loop
auto	3.559122237671007	0.0	discard	28_3_in_5	Parallel run loop
auto	3.677918308752109	0.0	keep	30_3_in_5	Parallel run loop
auto	5.003809510261405	0.0	discard	49_3_in_5	Parallel run loop
auto	2.72025640537614	0.0	keep	17_3_in_5	Parallel run loop
auto	3.3796497031228605	0.0	discard	18_3_in_4	Parallel run loop
auto	2.8580103436301982	0.0	discard	13_3_in_4	Parallel run loop
auto	4.200390840621953	0.0	discard	38_3_in_5	Parallel run loop
auto	4.360606703932272	0.0	discard	29_3_in_4	Parallel run loop
auto	2.553004805427056	0.0	discard	15_3_in_5	Parallel run loop
auto	2.897663276614445	0.0	discard	19_3_in_5	Parallel run loop
auto	3.774319700373718	0.0	discard	22_3_in_4	Parallel run loop
auto	4.316415995265867	0.0	discard	39_3_in_5	Parallel run loop
auto	4.197402808539317	0.0	discard	27_3_in_4	Parallel run loop
auto	3.7519006203415044	0.0	discard	31_3_in_5	Parallel run loop
auto	4.747529207653735	0.0	discard	34_3_in_4	Parallel run loop
auto	4.696789988275399	0.0	discard	45_3_in_5	Parallel run loop
auto	2.4678926638276018	0.0	discard	14_3_in_5	Parallel run loop
auto	5.275227363183112	0.0	discard	41_3_in_4	Parallel run loop
auto	1.6123349330933001	0.0	discard	6_3_in_5	Parallel run loop
auto	1.472357393631245	0.0	discard	5_3_in_5	Parallel run loop
auto	4.502338386152999	0.0	keep	31_3_in_4	Parallel run loop
auto	5.0630227371319645	0.0	discard	39_3_in_4	Parallel run loop
auto	3.822812301971383	0.0	discard	32_3_in_5	Parallel run loop
auto	2.0813781235179083	0.0	keep	10_3_in_5	Parallel run loop
auto	4.280036879207742	0.0	discard	28_3_in_4	Parallel run loop
auto	4.014216019599866	0.0	discard	35_3_in_5	Parallel run loop
auto	4.942167394585941	0.0	keep	37_3_in_4	Parallel run loop
auto	5.471893673513298	0.0	discard	43_3_in_4	Parallel run loop
auto	4.357610394065006	0.0	discard	40_3_in_5	Parallel run loop
auto	5.875021268173685	0.0	discard	47_3_in_4	Parallel run loop
auto	2.9809951885913537	0.0	discard	20_3_in_5	Parallel run loop
auto	2.7372988684937285	0.0	discard	17_3_in_5	Parallel run loop
auto	3.6804208240806036	0.0	discard	21_3_in_4	Parallel run loop
auto	3.6923389459261124	0.0	discard	30_3_in_5	Parallel run loop
auto	3.5904048121443304	0.0	discard	20_3_in_4	Parallel run loop
auto	2.5593061912626798	0.0	discard	15_3_in_5	Parallel run loop
auto	4.216949929778341	0.0	discard	38_3_in_5	Parallel run loop
auto	3.4892443107704483	0.0	discard	19_3_in_4	Parallel run loop
auto	2.8992388551249313	0.0	discard	19_3_in_5	Parallel run loop
auto	5.012137064629208	0.0	discard	50_3_in_5	Parallel run loop
auto	4.358403046603626	0.0	discard	29_3_in_4	Parallel run loop
auto	3.37184946157974	0.0	discard	18_3_in_4	Parallel run loop
auto	5.535154661536032	0.0	discard	44_3_in_4	Parallel run loop
auto	4.194226577146553	0.0	discard	27_3_in_4	Parallel run loop
auto	4.65513192881117	0.0	discard	33_3_in_4	Parallel run loop
auto	5.6969419999726165	0.0	discard	46_3_in_4	Parallel run loop
auto	2.641496319343698	0.0	discard	16_3_in_5	Parallel run loop
auto	2.183776658213363	0.0	discard	11_3_in_5	Parallel run loop
auto	4.653446353363121	0.0	discard	45_3_in_5	Parallel run loop
auto	5.662086560854177	0.0	discard	45_3_in_4	Parallel run loop
auto	5.257227390610044	0.0	discard	41_3_in_4	Parallel run loop
auto	1.4735920107901206	0.0	discard	5_3_in_5	Parallel run loop
auto	4.517237243952238	0.0	discard	31_3_in_4	Parallel run loop
auto	5.125054901462046	0.0	discard	39_3_in_4	Parallel run loop
auto	2.082958906028582	0.0	discard	10_3_in_5	Parallel run loop
auto	4.272630320491787	0.0	discard	28_3_in_4	Parallel run loop
auto	5.099738570380392	0.0	discard	38_3_in_4	Parallel run loop
auto	2.813499892835742	0.0	discard	18_3_in_5	Parallel run loop
auto	4.966938494091511	0.0	discard	37_3_in_4	Parallel run loop
auto	1.8622706466956076	0.0	discard	8_3_in_5	Parallel run loop
auto	4.11382338636805	0.0	discard	37_3_in_5	Parallel run loop
auto	4.608548516006385	0.0	discard	44_3_in_5	Parallel run loop
auto	2.728584091911675	0.0	discard	17_3_in_5	Parallel run loop
auto	4.866498476166238	0.0	discard	47_3_in_5	Parallel run loop
auto	4.548532822732305	0.0	discard	43_3_in_5	Parallel run loop
auto	3.427859004153313	0.0	discard	26_3_in_5	Parallel run loop
auto	3.882774804336972	0.0	discard	33_3_in_5	Parallel run loop
auto	5.411331920693078	0.0	discard	42_3_in_4	Parallel run loop
auto	4.831035797280756	0.0	discard	35_3_in_4	Parallel run loop
auto	2.376773848198566	0.0	discard	13_3_in_5	Parallel run loop
auto	3.948136829126031	0.0	discard	24_3_in_4	Parallel run loop
auto	2.8785192483012816	0.0	keep	19_3_in_5	Parallel run loop
auto	3.9534783706232934	0.0	discard	34_3_in_5	Parallel run loop
auto	3.387541710886119	0.0	discard	18_3_in_4	Parallel run loop
auto	5.051499597962342	0.0	discard	50_3_in_5	Parallel run loop
auto	4.678231595950284	0.0	discard	33_3_in_4	Parallel run loop
auto	5.560207206291971	0.0	keep	45_3_in_4	Parallel run loop
auto	4.621943789118523	0.0	discard	45_3_in_5	Parallel run loop
auto	4.5065227267550805	0.0	discard	31_3_in_4	Parallel run loop
auto	4.1993944654054545	0.0	discard	27_3_in_4	Parallel run loop
auto	5.282427458982876	0.0	discard	41_3_in_4	Parallel run loop
auto	1.4735920133661093	0.0	discard	5_3_in_5	Parallel run loop
auto	2.184121385733963	0.0	discard	11_3_in_5	Parallel run loop
auto	2.6405066139290643	0.0	discard	16_3_in_5	Parallel run loop
auto	5.770409987251236	0.0	discard	46_3_in_4	Parallel run loop
auto	3.182625179853619	0.0	discard	23_3_in_5	Parallel run loop
auto	4.276432873531629	0.0	discard	28_3_in_4	Parallel run loop
auto	4.597284458597534	0.0	discard	32_3_in_4	Parallel run loop
auto	1.7415209214069733	0.0	discard	7_3_in_5	Parallel run loop
auto	4.036072374052227	0.0	discard	25_3_in_4	Parallel run loop
auto	2.814583568517453	0.0	discard	18_3_in_5	Parallel run loop
auto	1.862164769984802	0.0	discard	8_3_in_5	Parallel run loop
auto	1.975257460369458	0.0	discard	9_3_in_5	Parallel run loop
auto	4.9989739085753895	0.0	discard	37_3_in_4	Parallel run loop
auto	2.7212173525198016	0.0	discard	17_3_in_5	Parallel run loop
auto	4.522641483729755	0.0	discard	43_3_in_5	Parallel run loop
auto	4.834166854058425	0.0	discard	47_3_in_5	Parallel run loop
auto	4.217627144546835	0.0	keep	39_3_in_5	Parallel run loop
auto	2.8983391786390356	0.0	discard	19_3_in_5	Parallel run loop
auto	3.3872913189498255	0.0	discard	18_3_in_4	Parallel run loop
auto	2.2830829323217343	0.0	discard	12_3_in_5	Parallel run loop
auto	2.3774800162154635	0.0	discard	13_3_in_5	Parallel run loop
auto	4.758639953044003	0.0	discard	46_3_in_5	Parallel run loop
auto	5.084195995724824	0.0	discard	50_3_in_5	Parallel run loop
auto	3.7546690524062516	0.0	discard	22_3_in_4	Parallel run loop
auto	3.4798991717040586	0.0	keep	27_3_in_5	Parallel run loop
auto	2.4668223624157726	0.0	discard	14_3_in_5	Parallel run loop
auto	5.690432564819588	0.0	discard	45_3_in_4	Parallel run loop
auto	3.8559895597596254	0.0	discard	23_3_in_4	Parallel run loop
auto	4.721307684388859	0.0	discard	45_3_in_5	Parallel run loop
auto	3.625467528580466	0.0	discard	29_3_in_5	Parallel run loop
auto	3.5467367998724475	0.0	discard	28_3_in_5	Parallel run loop
auto	4.511455891420218	0.0	discard	31_3_in_4	Parallel run loop
auto	1.6123349279522812	0.0	discard	6_3_in_5	Parallel run loop
auto	2.642157702134987	0.0	discard	16_3_in_5	Parallel run loop
auto	3.9849469399442836	0.0	keep	35_3_in_5	Parallel run loop
auto	3.8071723911739697	0.0	discard	32_3_in_5	Parallel run loop
auto	3.1972009170771214	0.0	discard	23_3_in_5	Parallel run loop
auto	4.258158420625047	0.0	keep	28_3_in_4	Parallel run loop
auto	1.741520900687775	0.0	discard	7_3_in_5	Parallel run loop
auto	1.863001412362638	0.0	discard	8_3_in_5	Parallel run loop
auto	4.039004278104007	0.0	discard	25_3_in_4	Parallel run loop
auto	3.657996814984857	0.0	keep	21_3_in_4	Parallel run loop
auto	5.471893673513298	0.0	discard	43_3_in_4	Parallel run loop
auto	5.854406961913515	0.0	discard	47_3_in_4	Parallel run loop
auto	3.556852239799306	0.0	discard	20_3_in_4	Parallel run loop
auto	2.7304088706351815	0.0	discard	17_3_in_5	Parallel run loop
auto	4.958835870968081	0.0	discard	49_3_in_5	Parallel run loop
auto	3.138505316421669	0.0	discard	22_3_in_5	Parallel run loop
auto	2.9860629032934365	0.0	discard	20_3_in_5	Parallel run loop
auto	3.0629846089758175	0.0	discard	21_3_in_5	Parallel run loop
auto	3.772874271804619	0.0	discard	22_3_in_4	Parallel run loop
auto	4.295673001920841	0.0	discard	39_3_in_5	Parallel run loop
auto	4.282739214544299	0.0	keep	40_3_in_5	Parallel run loop
auto	3.490335668802072	0.0	discard	19_3_in_4	Parallel run loop
auto	3.486855589618423	0.0	discard	27_3_in_5	Parallel run loop
auto	5.591723393651105	0.0	discard	44_3_in_4	Parallel run loop
auto	2.4682900918446333	0.0	discard	14_3_in_5	Parallel run loop
auto	4.742964878568384	0.0	discard	46_3_in_5	Parallel run loop
auto	4.65311045699863	0.0	discard	45_3_in_5	Parallel run loop
auto	3.852427382276454	0.0	discard	23_3_in_4	Parallel run loop
auto	5.201858855979298	0.0	discard	40_3_in_4	Parallel run loop
auto	1.6123349325900151	0.0	discard	6_3_in_5	Parallel run loop
auto	3.9860166827357784	0.0	discard	35_3_in_5	Parallel run loop
auto	4.887808955750561	0.0	discard	36_3_in_4	Parallel run loop
auto	3.554840868701835	0.0	discard	28_3_in_5	Parallel run loop
auto	4.5107902703337786	0.0	discard	31_3_in_4	Parallel run loop
auto	4.107598710611146	0.0	discard	26_3_in_4	Parallel run loop
auto	2.6383163563185974	0.0	discard	16_3_in_5	Parallel run loop
auto	5.060338589167849	0.0	discard	38_3_in_4	Parallel run loop
auto	5.922907465561673	0.0	discard	48_3_in_4	Parallel run loop
auto	5.411331920693078	0.0	discard	42_3_in_4	Parallel run loop
auto	3.682818849589327	0.0	discard	21_3_in_4	Parallel run loop
auto	3.5906955574876287	0.0	discard	20_3_in_4	Parallel run loop
auto	4.2760003396258375	0.0	discard	28_3_in_4	Parallel run loop
auto	5.899132366333242	0.0	discard	47_3_in_4	Parallel run loop
auto	4.994668908813568	0.0	discard	49_3_in_5	Parallel run loop
auto	4.159631692676099	0.0	discard	37_3_in_5	Parallel run loop
auto	3.425014434822748	0.0	discard	26_3_in_5	Parallel run loop
auto	4.626307932661024	0.0	discard	44_3_in_5	Parallel run loop
auto	3.771033212761776	0.0	discard	22_3_in_4	Parallel run loop
auto	3.489868015197944	0.0	discard	27_3_in_5	Parallel run loop
auto	3.9475564034626425	0.0	discard	34_3_in_5	Parallel run loop
auto	4.843100881264242	0.0	discard	35_3_in_4	Parallel run loop
auto	3.9415779040915115	0.0	discard	24_3_in_4	Parallel run loop
auto	3.8909169339041805	0.0	discard	33_3_in_5	Parallel run loop
auto	4.743138598684653	0.0	keep	48_3_in_5	Parallel run loop
auto	4.58136660798891	0.0	discard	32_3_in_4	Parallel run loop
auto	1.9752510127720562	0.0	discard	9_3_in_5	Parallel run loop
auto	4.669335146676603	0.0	discard	45_3_in_5	Parallel run loop
auto	4.262546235425356	0.0	keep	40_3_in_5	Parallel run loop
auto	2.8572490103181307	0.0	discard	13_3_in_4	Parallel run loop
auto	4.792559164606201	0.0	discard	46_3_in_5	Parallel run loop
auto	3.855058911872788	0.0	discard	23_3_in_4	Parallel run loop
auto	2.281669988995231	0.0	discard	12_3_in_5	Parallel run loop
auto	4.170101761469395	0.0	discard	38_3_in_5	Parallel run loop
auto	3.9881349665178627	0.0	discard	35_3_in_5	Parallel run loop
auto	3.54367406811395	0.0	discard	28_3_in_5	Parallel run loop
auto	2.639826130283964	0.0	discard	16_3_in_5	Parallel run loop
auto	3.732148955084701	0.0	keep	31_3_in_5	Parallel run loop
auto	3.617748445424819	0.0	discard	29_3_in_5	Parallel run loop
auto	5.030000133579372	0.0	discard	38_3_in_4	Parallel run loop
auto	5.414842593548908	0.0	discard	42_3_in_4	Parallel run loop
auto	5.939906761732473	0.0	discard	48_3_in_4	Parallel run loop
auto	2.558872103588254	0.0	discard	15_3_in_5	Parallel run loop
auto	4.277240295346592	0.0	discard	28_3_in_4	Parallel run loop
auto	3.685828591132501	0.0	discard	30_3_in_5	Parallel run loop
auto	4.078849818872393	0.0	discard	36_3_in_5	Parallel run loop
auto	4.360227039309649	0.0	discard	41_3_in_5	Parallel run loop
auto	4.440564693535418	0.0	discard	30_3_in_4	Parallel run loop
auto	3.773511131257478	0.0	discard	22_3_in_4	Parallel run loop
auto	3.4777850037486244	0.0	keep	27_3_in_5	Parallel run loop
