commit	score	memory_gb	status	problem	description
auto	5.437498628146641	0.0	discard	42_3_in_4	Parallel run loop
auto	5.634788640995765	0.0	discard	46_3_in_4	Parallel run loop
auto	4.187144543635598	0.0	discard	27_3_in_4	Parallel run loop
auto	4.274473786643523	0.0	discard	28_3_in_4	Parallel run loop
auto	4.661868580647742	0.0	discard	33_3_in_4	Parallel run loop
auto	3.882306941835682	0.0	discard	33_3_in_5	Parallel run loop
auto	3.6837844248703675	0.0	discard	30_3_in_5	Parallel run loop
auto	4.796150487257602	0.0	discard	47_3_in_5	Parallel run loop
auto	2.967634461437735	0.0	discard	20_3_in_5	Parallel run loop
auto	4.1096114662670145	0.0	discard	26_3_in_4	Parallel run loop
auto	3.0419013879376657	0.0	discard	21_3_in_5	Parallel run loop
auto	5.098313459946513	0.0	discard	50_3_in_5	Parallel run loop
auto	2.649873223100646	0.0	discard	16_3_in_5	Parallel run loop
auto	5.360837181901137	0.0	discard	41_3_in_4	Parallel run loop
auto	3.558945780631901	0.0	discard	28_3_in_5	Parallel run loop
auto	4.401509761160943	0.0	discard	42_3_in_5	Parallel run loop
auto	5.695950127256907	0.0	discard	45_3_in_4	Parallel run loop
auto	3.3580448204108477	0.0	discard	25_3_in_5	Parallel run loop
auto	4.367537389376519	0.0	discard	29_3_in_4	Parallel run loop
auto	3.426699312816884	0.0	discard	26_3_in_5	Parallel run loop
auto	4.092638616505865	0.0	keep	37_3_in_5	Parallel run loop
auto	2.0817327421756566	0.0	discard	10_3_in_5	Parallel run loop
auto	3.9636923664812063	0.0	discard	34_3_in_5	Parallel run loop
auto	1.741521072952752	0.0	discard	7_3_in_5	Parallel run loop
auto	3.9154423832183434	0.0	discard	24_3_in_4	Parallel run loop
auto	4.955568845144292	0.0	discard	48_3_in_5	Parallel run loop
auto	2.282113048349482	0.0	discard	12_3_in_5	Parallel run loop
auto	3.8587120453027755	0.0	discard	23_3_in_4	Parallel run loop
auto	3.7715789314703967	0.0	discard	22_3_in_4	Parallel run loop
auto	4.040252664343678	0.0	discard	25_3_in_4	Parallel run loop
auto	4.872874075559997	0.0	discard	36_3_in_4	Parallel run loop
auto	4.178449693797528	0.0	discard	38_3_in_5	Parallel run loop
auto	5.583597486513879	0.0	discard	46_3_in_4	Parallel run loop
auto	4.7871002244129865	0.0	discard	46_3_in_5	Parallel run loop
auto	4.187991380485445	0.0	discard	27_3_in_4	Parallel run loop
auto	4.7066313974373895	0.0	discard	45_3_in_5	Parallel run loop
auto	4.6522106432783366	0.0	discard	33_3_in_4	Parallel run loop
auto	3.7483967730873524	0.0	discard	31_3_in_5	Parallel run loop
auto	4.743893703613669	0.0	discard	47_3_in_5	Parallel run loop
auto	3.0374310908511677	0.0	discard	21_3_in_5	Parallel run loop
auto	2.4688520469779114	0.0	discard	14_3_in_5	Parallel run loop
auto	1.6123349333650627	0.0	discard	6_3_in_5	Parallel run loop
auto	1.4735919978255965	0.0	discard	5_3_in_5	Parallel run loop
auto	4.522492799901143	0.0	discard	31_3_in_4	Parallel run loop
auto	4.018775611765865	0.0	discard	35_3_in_5	Parallel run loop
auto	3.5623958083019693	0.0	discard	28_3_in_5	Parallel run loop
auto	4.441768158170846	0.0	discard	30_3_in_4	Parallel run loop
auto	4.50349332236505	0.0	discard	42_3_in_5	Parallel run loop
auto	5.891834870409866	0.0	discard	47_3_in_4	Parallel run loop
auto	3.660073230453256	0.0	discard	21_3_in_4	Parallel run loop
auto	4.152091264647593	0.0	discard	37_3_in_5	Parallel run loop
auto	4.341642841965756	0.0	discard	40_3_in_5	Parallel run loop
auto	4.887116485410961	0.0	discard	49_3_in_5	Parallel run loop
auto	5.004919950583277	0.0	discard	37_3_in_4	Parallel run loop
auto	5.594064506143768	0.0	discard	44_3_in_4	Parallel run loop
auto	3.4908815445434533	0.0	discard	19_3_in_4	Parallel run loop
auto	3.143201270481433	0.0	discard	22_3_in_5	Parallel run loop
auto	3.9531055638819548	0.0	discard	24_3_in_4	Parallel run loop
auto	2.876085124573234	0.0	discard	19_3_in_5	Parallel run loop
auto	4.777923182911854	0.0	discard	46_3_in_5	Parallel run loop
auto	5.243520531777947	0.0	discard	40_3_in_4	Parallel run loop
auto	2.6467453658002413	0.0	discard	16_3_in_5	Parallel run loop
auto	3.770184115094687	0.0	discard	22_3_in_4	Parallel run loop
auto	4.895732729562534	0.0	discard	36_3_in_4	Parallel run loop
auto	4.660962698863734	0.0	discard	33_3_in_4	Parallel run loop
auto	4.727937106524831	0.0	discard	45_3_in_5	Parallel run loop
auto	4.204428429097492	0.0	discard	27_3_in_4	Parallel run loop
auto	5.608386123531437	0.0	discard	46_3_in_4	Parallel run loop
auto	5.647952956007288	0.0	discard	45_3_in_4	Parallel run loop
auto	4.874620567782788	0.0	discard	47_3_in_5	Parallel run loop
auto	1.6123349279656054	0.0	discard	6_3_in_5	Parallel run loop
auto	3.342912436998309	0.0	discard	25_3_in_5	Parallel run loop
auto	1.4733172626676665	0.0	discard	5_3_in_5	Parallel run loop
auto	3.0532958221401323	0.0	discard	21_3_in_5	Parallel run loop
auto	5.251728161491698	0.0	discard	41_3_in_4	Parallel run loop
auto	5.057417540258158	0.0	discard	38_3_in_4	Parallel run loop
auto	1.8622715445424944	0.0	discard	8_3_in_5	Parallel run loop
auto	4.580331086643563	0.0	discard	43_3_in_5	Parallel run loop
auto	4.3636493013504305	0.0	discard	29_3_in_4	Parallel run loop
auto	3.6839448206347236	0.0	discard	21_3_in_4	Parallel run loop
auto	3.4261769858374103	0.0	discard	26_3_in_5	Parallel run loop
auto	5.929597324436657	0.0	discard	48_3_in_4	Parallel run loop
auto	5.004044871248653	0.0	discard	37_3_in_4	Parallel run loop
auto	4.368986883195149	0.0	discard	40_3_in_5	Parallel run loop
auto	5.027469543652212	0.0	discard	49_3_in_5	Parallel run loop
auto	4.8307800875561675	0.0	discard	35_3_in_4	Parallel run loop
auto	2.0816955176526317	0.0	discard	10_3_in_5	Parallel run loop
auto	3.952642111821091	0.0	discard	24_3_in_4	Parallel run loop
auto	3.494443403268083	0.0	discard	19_3_in_4	Parallel run loop
auto	2.8889269826872037	0.0	discard	19_3_in_5	Parallel run loop
auto	2.64170960434051	0.0	discard	16_3_in_5	Parallel run loop
auto	4.955568845144292	0.0	discard	48_3_in_5	Parallel run loop
auto	1.7413026747629379	0.0	discard	7_3_in_5	Parallel run loop
auto	3.9422000580513803	0.0	discard	34_3_in_5	Parallel run loop
auto	2.376445975821224	0.0	discard	13_3_in_5	Parallel run loop
auto	4.799133972017094	0.0	discard	46_3_in_5	Parallel run loop
auto	5.650874290964535	0.0	discard	46_3_in_4	Parallel run loop
auto	4.199713497566724	0.0	discard	27_3_in_4	Parallel run loop
auto	4.030420086047283	0.0	discard	25_3_in_4	Parallel run loop
auto	1.9752552834029304	0.0	discard	9_3_in_5	Parallel run loop
auto	5.149716793129176	0.0	discard	39_3_in_4	Parallel run loop
auto	1.6123349280533705	0.0	discard	6_3_in_5	Parallel run loop
auto	5.22770074829836	0.0	discard	41_3_in_4	Parallel run loop
auto	4.596782470705274	0.0	discard	32_3_in_4	Parallel run loop
auto	4.258309293665599	0.0	discard	39_3_in_5	Parallel run loop
auto	3.346983629817757	0.0	discard	25_3_in_5	Parallel run loop
auto	2.281478544445791	0.0	discard	12_3_in_5	Parallel run loop
auto	2.860332776026924	0.0	discard	13_3_in_4	Parallel run loop
auto	5.0646408211688945	0.0	discard	38_3_in_4	Parallel run loop
auto	4.3596493510761904	0.0	discard	29_3_in_4	Parallel run loop
auto	3.8659365976592337	0.0	discard	23_3_in_4	Parallel run loop
auto	4.1689808878674945	0.0	discard	38_3_in_5	Parallel run loop
auto	6.005134198197862	0.0	discard	48_3_in_4	Parallel run loop
auto	3.759349691352542	0.0	discard	31_3_in_5	Parallel run loop
auto	3.628632138191215	0.0	discard	29_3_in_5	Parallel run loop
auto	3.3921359871918937	0.0	discard	18_3_in_4	Parallel run loop
auto	2.468244038234594	0.0	discard	14_3_in_5	Parallel run loop
auto	3.67593886850907	0.0	discard	30_3_in_5	Parallel run loop
auto	2.0819520976449226	0.0	discard	10_3_in_5	Parallel run loop
auto	4.088930957799324	0.0	discard	36_3_in_5	Parallel run loop
auto	4.515987068986818	0.0	discard	31_3_in_4	Parallel run loop
auto	2.559566833873395	0.0	discard	15_3_in_5	Parallel run loop
auto	3.814672808347809	0.0	discard	32_3_in_5	Parallel run loop
auto	4.4209205461112315	0.0	discard	30_3_in_4	Parallel run loop
auto	3.2877584241337416	0.0	discard	24_3_in_5	Parallel run loop
auto	4.0105828325645625	0.0	discard	35_3_in_5	Parallel run loop
auto	1.741520783196901	0.0	discard	7_3_in_5	Parallel run loop
auto	5.902841173174928	0.0	discard	47_3_in_4	Parallel run loop
auto	5.104065212895554	0.0	discard	39_3_in_4	Parallel run loop
auto	3.9556883959265563	0.0	discard	34_3_in_5	Parallel run loop
auto	5.7271232355910735	0.0	discard	46_3_in_4	Parallel run loop
auto	1.6123349358409416	0.0	discard	6_3_in_5	Parallel run loop
auto	4.762994623578979	0.0	discard	34_3_in_4	Parallel run loop
auto	4.363046412087765	0.0	discard	41_3_in_5	Parallel run loop
auto	3.346624824853906	0.0	discard	25_3_in_5	Parallel run loop
auto	3.1252300850692256	0.0	discard	22_3_in_5	Parallel run loop
auto	5.525017554210438	0.0	discard	44_3_in_4	Parallel run loop
auto	2.28314077900594	0.0	discard	12_3_in_5	Parallel run loop
auto	5.3302093344000046	0.0	discard	41_3_in_4	Parallel run loop
auto	4.3656160948644045	0.0	discard	29_3_in_4	Parallel run loop
auto	5.079526141311208	0.0	discard	38_3_in_4	Parallel run loop
auto	5.2346441625634	0.0	discard	40_3_in_4	Parallel run loop
auto	5.725372003164504	0.0	discard	45_3_in_4	Parallel run loop
auto	4.227551787673065	0.0	discard	38_3_in_5	Parallel run loop
auto	2.8202454481095653	0.0	discard	18_3_in_5	Parallel run loop
auto	1.8630041486027153	0.0	discard	8_3_in_5	Parallel run loop
auto	4.473990249725501	0.0	discard	42_3_in_5	Parallel run loop
auto	4.557392542300272	0.0	discard	43_3_in_5	Parallel run loop
auto	2.0816096631709162	0.0	discard	10_3_in_5	Parallel run loop
auto	2.469414776905446	0.0	discard	14_3_in_5	Parallel run loop
auto	4.15406646575957	0.0	discard	37_3_in_5	Parallel run loop
auto	3.6950078047205324	0.0	discard	30_3_in_5	Parallel run loop
auto	5.423942402012171	0.0	discard	42_3_in_4	Parallel run loop
auto	4.091871112434221	0.0	discard	36_3_in_5	Parallel run loop
auto	4.42993636112703	0.0	discard	30_3_in_4	Parallel run loop
auto	4.520554798294311	0.0	discard	31_3_in_4	Parallel run loop
auto	3.416631443528257	0.0	discard	26_3_in_5	Parallel run loop
auto	3.883851034465735	0.0	discard	33_3_in_5	Parallel run loop
auto	4.021625562995008	0.0	discard	35_3_in_5	Parallel run loop
auto	5.171238123995403	0.0	discard	39_3_in_4	Parallel run loop
auto	4.9404894491967974	0.0	discard	48_3_in_5	Parallel run loop
auto	1.6121328425417065	0.0	keep	6_3_in_5	Parallel run loop
auto	3.1173713748519822	0.0	discard	22_3_in_5	Parallel run loop
auto	4.804256073161146	0.0	discard	35_3_in_4	Parallel run loop
auto	3.204338631443598	0.0	discard	23_3_in_5	Parallel run loop
auto	4.430757166738944	0.0	discard	41_3_in_5	Parallel run loop
auto	2.3763332320132524	0.0	discard	13_3_in_5	Parallel run loop
auto	5.540462200737183	0.0	discard	44_3_in_4	Parallel run loop
auto	3.348271070338079	0.0	discard	25_3_in_5	Parallel run loop
auto	4.577256398054884	0.0	discard	32_3_in_4	Parallel run loop
auto	5.251869509523386	0.0	discard	41_3_in_4	Parallel run loop
auto	1.9766058802513837	0.0	discard	9_3_in_5	Parallel run loop
auto	4.326383609113832	0.0	discard	29_3_in_4	Parallel run loop
auto	2.7367414203160227	0.0	discard	17_3_in_5	Parallel run loop
auto	4.014739159268251	0.0	discard	25_3_in_4	Parallel run loop
auto	2.8582164879034004	0.0	discard	13_3_in_4	Parallel run loop
auto	4.283468740120903	0.0	discard	39_3_in_5	Parallel run loop
auto	3.8661217820583245	0.0	discard	23_3_in_4	Parallel run loop
auto	4.541555660472628	0.0	discard	43_3_in_5	Parallel run loop
auto	4.489787202223684	0.0	discard	42_3_in_5	Parallel run loop
auto	2.467101735041057	0.0	discard	14_3_in_5	Parallel run loop
auto	4.145917038705444	0.0	discard	37_3_in_5	Parallel run loop
auto	2.0821996754533347	0.0	discard	10_3_in_5	Parallel run loop
auto	5.433524603530125	0.0	discard	42_3_in_4	Parallel run loop
auto	3.4946080655121414	0.0	discard	27_3_in_5	Parallel run loop
auto	4.501826969810296	0.0	discard	31_3_in_4	Parallel run loop
auto	3.7587935087762947	0.0	discard	31_3_in_5	Parallel run loop
auto	4.439927649336826	0.0	discard	30_3_in_4	Parallel run loop
auto	3.4267300513621155	0.0	discard	26_3_in_5	Parallel run loop
auto	3.8605134090047843	0.0	keep	33_3_in_5	Parallel run loop
auto	5.164060168532245	0.0	discard	39_3_in_4	Parallel run loop
auto	4.014057367879793	0.0	discard	35_3_in_5	Parallel run loop
auto	1.612334932135988	0.0	discard	6_3_in_5	Parallel run loop
auto	3.6191057650544183	0.0	discard	29_3_in_5	Parallel run loop
auto	3.1376683091890247	0.0	discard	22_3_in_5	Parallel run loop
auto	4.806915320751893	0.0	discard	35_3_in_4	Parallel run loop
auto	2.5547099306247665	0.0	discard	15_3_in_5	Parallel run loop
auto	3.5508567996833778	0.0	discard	28_3_in_5	Parallel run loop
auto	5.49537997391773	0.0	discard	44_3_in_4	Parallel run loop
auto	3.370904572221519	0.0	discard	18_3_in_4	Parallel run loop
auto	4.572650624243762	0.0	discard	32_3_in_4	Parallel run loop
auto	3.342035361932543	0.0	discard	25_3_in_5	Parallel run loop
auto	5.237345582507084	0.0	discard	41_3_in_4	Parallel run loop
auto	4.008981441883	0.0	discard	25_3_in_4	Parallel run loop
auto	4.573516495604805	0.0	discard	45_3_in_5	Parallel run loop
auto	4.361144691421463	0.0	discard	29_3_in_4	Parallel run loop
auto	1.4733172629792357	0.0	discard	5_3_in_5	Parallel run loop
auto	3.8227951731103524	0.0	discard	32_3_in_5	Parallel run loop
auto	4.291685249282874	0.0	discard	39_3_in_5	Parallel run loop
auto	2.858302420263705	0.0	discard	13_3_in_4	Parallel run loop
auto	4.429893343482823	0.0	discard	42_3_in_5	Parallel run loop
auto	4.4827191158122925	0.0	discard	43_3_in_5	Parallel run loop
auto	4.110283413059085	0.0	discard	37_3_in_5	Parallel run loop
auto	4.973010183209093	0.0	discard	37_3_in_4	Parallel run loop
auto	2.4682593394139998	0.0	discard	14_3_in_5	Parallel run loop
auto	5.49389035984852	0.0	discard	43_3_in_4	Parallel run loop
auto	3.6671750672209216	0.0	discard	21_3_in_4	Parallel run loop
auto	3.2694468466179347	0.0	discard	24_3_in_5	Parallel run loop
auto	4.519151827282252	0.0	discard	31_3_in_4	Parallel run loop
auto	3.862246369215491	0.0	discard	33_3_in_5	Parallel run loop
auto	4.7331967282618255	0.0	discard	34_3_in_4	Parallel run loop
auto	3.4281929715224515	0.0	discard	26_3_in_5	Parallel run loop
auto	5.036533549853543	0.0	discard	49_3_in_5	Parallel run loop
auto	5.171238123995403	0.0	discard	39_3_in_4	Parallel run loop
auto	4.022891848884219	0.0	discard	35_3_in_5	Parallel run loop
auto	5.874269763163611	0.0	discard	47_3_in_4	Parallel run loop
auto	5.091176834155003	0.0	discard	50_3_in_5	Parallel run loop
auto	3.5612836750394696	0.0	discard	28_3_in_5	Parallel run loop
auto	4.31428887567437	0.0	discard	40_3_in_5	Parallel run loop
auto	3.3780344915780955	0.0	discard	18_3_in_4	Parallel run loop
auto	3.3291436086481347	0.0	discard	25_3_in_5	Parallel run loop
auto	3.4666767533490956	0.0	discard	19_3_in_4	Parallel run loop
auto	5.5696101560901825	0.0	discard	44_3_in_4	Parallel run loop
auto	5.243145625496811	0.0	discard	41_3_in_4	Parallel run loop
auto	2.8784358953277223	0.0	discard	19_3_in_5	Parallel run loop
auto	4.723494157403891	0.0	discard	45_3_in_5	Parallel run loop
auto	4.363085969919045	0.0	discard	29_3_in_4	Parallel run loop
auto	4.039370600936511	0.0	discard	25_3_in_4	Parallel run loop
auto	5.24091990258663	0.0	discard	40_3_in_4	Parallel run loop
auto	2.8582430175435487	0.0	discard	13_3_in_4	Parallel run loop
auto	4.918991752152422	0.0	discard	36_3_in_4	Parallel run loop
auto	4.518980274638786	0.0	discard	43_3_in_5	Parallel run loop
auto	4.673937079106361	0.0	discard	33_3_in_4	Parallel run loop
auto	2.6449606092667284	0.0	discard	16_3_in_5	Parallel run loop
auto	2.468336598135436	0.0	discard	14_3_in_5	Parallel run loop
auto	5.690432564819588	0.0	discard	45_3_in_4	Parallel run loop
auto	5.0094289776488505	0.0	discard	37_3_in_4	Parallel run loop
auto	2.820608843857832	0.0	discard	18_3_in_5	Parallel run loop
auto	2.183665218890038	0.0	discard	11_3_in_5	Parallel run loop
auto	4.518803387850283	0.0	discard	31_3_in_4	Parallel run loop
auto	1.862273227685253	0.0	discard	8_3_in_5	Parallel run loop
auto	3.286920731293088	0.0	discard	24_3_in_5	Parallel run loop
auto	2.374611303063927	0.0	discard	13_3_in_5	Parallel run loop
auto	3.88193215293541	0.0	discard	33_3_in_5	Parallel run loop
auto	4.614774085796548	0.0	discard	44_3_in_5	Parallel run loop
auto	5.965306840487772	0.0	discard	48_3_in_4	Parallel run loop
auto	4.80124354579691	0.0	discard	48_3_in_5	Parallel run loop
auto	3.948570401655073	0.0	discard	24_3_in_4	Parallel run loop
auto	3.948806148330814	0.0	discard	34_3_in_5	Parallel run loop
auto	3.3770921278082566	0.0	discard	18_3_in_4	Parallel run loop
auto	3.202107310505675	0.0	discard	23_3_in_5	Parallel run loop
auto	5.587114090265403	0.0	discard	44_3_in_4	Parallel run loop
auto	4.2957865787028675	0.0	discard	40_3_in_5	Parallel run loop
auto	1.7415208340024457	0.0	discard	7_3_in_5	Parallel run loop
auto	3.3439650476284966	0.0	discard	25_3_in_5	Parallel run loop
auto	2.714734297372576	0.0	keep	17_3_in_5	Parallel run loop
auto	2.88315176150764	0.0	discard	19_3_in_5	Parallel run loop
auto	2.2830723986419206	0.0	discard	12_3_in_5	Parallel run loop
auto	1.9748054160361923	0.0	discard	9_3_in_5	Parallel run loop
auto	4.036946365699632	0.0	discard	25_3_in_4	Parallel run loop
auto	2.859532486676913	0.0	discard	13_3_in_4	Parallel run loop
auto	4.679035954634711	0.0	discard	33_3_in_4	Parallel run loop
auto	4.791836985262081	0.0	discard	46_3_in_5	Parallel run loop
auto	5.247521742555183	0.0	discard	40_3_in_4	Parallel run loop
auto	2.646604411445967	0.0	discard	16_3_in_5	Parallel run loop
auto	3.8664198641769327	0.0	discard	23_3_in_4	Parallel run loop
auto	3.77711346064634	0.0	discard	22_3_in_4	Parallel run loop
auto	4.565205935851734	0.0	discard	43_3_in_5	Parallel run loop
auto	5.679742162088725	0.0	discard	45_3_in_4	Parallel run loop
auto	3.493757891843577	0.0	discard	27_3_in_5	Parallel run loop
auto	4.190771041284906	0.0	discard	38_3_in_5	Parallel run loop
auto	3.2808685717934805	0.0	discard	24_3_in_5	Parallel run loop
auto	5.010560206510221	0.0	discard	37_3_in_4	Parallel run loop
auto	3.756562470649411	0.0	discard	31_3_in_5	Parallel run loop
auto	3.677409771915615	0.0	discard	30_3_in_5	Parallel run loop
auto	2.3763348820690973	0.0	discard	13_3_in_5	Parallel run loop
auto	2.551177311204796	0.0	discard	15_3_in_5	Parallel run loop
auto	3.6300293190493975	0.0	discard	29_3_in_5	Parallel run loop
auto	3.876014934311759	0.0	discard	33_3_in_5	Parallel run loop
auto	4.904742788909008	0.0	discard	48_3_in_5	Parallel run loop
auto	4.308914407426947	0.0	discard	40_3_in_5	Parallel run loop
auto	1.4731232309302922	0.0	discard	5_3_in_5	Parallel run loop
auto	3.3859995105001945	0.0	discard	18_3_in_4	Parallel run loop
auto	3.822031112715818	0.0	discard	32_3_in_5	Parallel run loop
auto	4.065606452218362	0.0	discard	36_3_in_5	Parallel run loop
auto	1.7415207946024385	0.0	discard	7_3_in_5	Parallel run loop
auto	3.3480782419910926	0.0	discard	25_3_in_5	Parallel run loop
auto	2.718939184611046	0.0	discard	17_3_in_5	Parallel run loop
auto	2.8853044796944265	0.0	discard	19_3_in_5	Parallel run loop
auto	5.484393225204206	0.0	discard	43_3_in_4	Parallel run loop
auto	2.858392158718291	0.0	discard	13_3_in_4	Parallel run loop
auto	1.9752491859939385	0.0	discard	9_3_in_5	Parallel run loop
auto	5.239639218819974	0.0	discard	40_3_in_4	Parallel run loop
auto	3.6830822150414035	0.0	discard	21_3_in_4	Parallel run loop
auto	5.026337041779723	0.0	discard	49_3_in_5	Parallel run loop
auto	2.646793148618296	0.0	discard	16_3_in_5	Parallel run loop
auto	4.758079353934699	0.0	discard	34_3_in_4	Parallel run loop
auto	3.4809498165058335	0.0	discard	19_3_in_4	Parallel run loop
auto	5.6823724933020054	0.0	discard	45_3_in_4	Parallel run loop
auto	5.770031720362105	0.0	discard	47_3_in_4	Parallel run loop
auto	4.922528763793943	0.0	discard	36_3_in_4	Parallel run loop
auto	5.028008488215278	0.0	discard	50_3_in_5	Parallel run loop
auto	4.440102834897448	0.0	discard	41_3_in_5	Parallel run loop
auto	2.1836376568658147	0.0	discard	11_3_in_5	Parallel run loop
auto	3.2656128476438946	0.0	discard	24_3_in_5	Parallel run loop
auto	2.3770006525407203	0.0	discard	13_3_in_5	Parallel run loop
auto	3.743935628326941	0.0	discard	31_3_in_5	Parallel run loop
auto	4.122104017668781	0.0	discard	26_3_in_4	Parallel run loop
auto	3.8789187758700416	0.0	discard	33_3_in_5	Parallel run loop
auto	2.8089544478046564	0.0	discard	18_3_in_5	Parallel run loop
auto	2.5600623042864443	0.0	discard	15_3_in_5	Parallel run loop
auto	4.937570516124916	0.0	discard	48_3_in_5	Parallel run loop
auto	3.8201181743829835	0.0	discard	32_3_in_5	Parallel run loop
auto	1.4735920464232979	0.0	discard	5_3_in_5	Parallel run loop
auto	4.35981730241187	0.0	discard	40_3_in_5	Parallel run loop
auto	4.085589919404327	0.0	discard	36_3_in_5	Parallel run loop
auto	3.3847819844661706	0.0	discard	18_3_in_4	Parallel run loop
auto	1.7415209734533361	0.0	discard	7_3_in_5	Parallel run loop
auto	3.34317297076961	0.0	discard	25_3_in_5	Parallel run loop
auto	2.723222390183156	0.0	discard	17_3_in_5	Parallel run loop
auto	1.8622693312606704	0.0	discard	8_3_in_5	Parallel run loop
auto	5.091838922448302	0.0	discard	38_3_in_4	Parallel run loop
auto	1.975241658837242	0.0	discard	9_3_in_5	Parallel run loop
auto	5.9690960152003845	0.0	discard	48_3_in_4	Parallel run loop
auto	5.2334266494413555	0.0	discard	40_3_in_4	Parallel run loop
auto	4.617984636473636	0.0	discard	44_3_in_5	Parallel run loop
auto	4.789411271511172	0.0	keep	49_3_in_5	Parallel run loop
auto	3.4694316643777032	0.0	discard	19_3_in_4	Parallel run loop
auto	4.751944513869636	0.0	discard	34_3_in_4	Parallel run loop
auto	5.857628957169063	0.0	discard	47_3_in_4	Parallel run loop
auto	5.418426312673791	0.0	discard	42_3_in_4	Parallel run loop
auto	5.077367152530817	0.0	discard	50_3_in_5	Parallel run loop
auto	4.880182954109323	0.0	discard	47_3_in_5	Parallel run loop
auto	3.757219148974066	0.0	discard	31_3_in_5	Parallel run loop
auto	3.283327870642163	0.0	discard	24_3_in_5	Parallel run loop
auto	3.93564437762773	0.0	discard	24_3_in_4	Parallel run loop
auto	2.1840541281051182	0.0	discard	11_3_in_5	Parallel run loop
