commit	score	memory_gb	status	problem	description
auto	3.8212838145946755	0.0	discard	22_4_in_DOMINO	Parallel run loop
auto	2.8300129121434714	0.0	discard	25_3_in_circle	Parallel run loop
auto	1.5230514075566917	0.0	discard	12_3_in_circle	Parallel run loop
auto	1.7011773066844613	0.0	discard	10_3_in_DOMINO	Parallel run loop
auto	3.013979923734041	0.0	discard	28_3_in_circle	Parallel run loop
auto	6.9673699289329925	0.0	discard	43_3_in_3	Parallel run loop
auto	2.7017972478376815	0.0	discard	23_3_in_circle	Parallel run loop
auto	2.931723676723068	0.0	discard	11_4_in_DOMINO	Parallel run loop
auto	4.912194872736637	0.0	discard	20_3_in_3	Parallel run loop
auto	3.0104540932523642	0.0	discard	13_4_in_DOMINO	Parallel run loop
auto	3.746847963455798	0.0	discard	11_3_in_3	Parallel run loop
auto	7.675106763760255	0.0	discard	50_3_in_3	Parallel run loop
auto	2.0482685290094627	0.0	keep	19_3_in_circle	Parallel run loop
auto	3.1081296475721976	0.0	discard	30_3_in_circle	Parallel run loop
auto	2.643847752583437	0.0	discard	16_4_in_CIRCLE	Parallel run loop
auto	2.1769121528097175	0.0	keep	18_3_in_DOMINO	Parallel run loop
auto	2.60668818809873	0.0	discard	22_3_in_circle	Parallel run loop
auto	3.1696204110914015	0.0	discard	31_3_in_circle	Parallel run loop
auto	3.0476688871211066	0.0	keep	29_3_in_circle	Parallel run loop
auto	2.9426482519806445	0.0	discard	27_3_in_circle	Parallel run loop
auto	1.6549223038095542	0.0	discard	15_3_in_circle	Parallel run loop
auto	1.7029189896133312	0.0	discard	16_3_in_circle	Parallel run loop
auto	1.9870429966086272	0.0	keep	15_3_in_DOMINO	Parallel run loop
auto	4.020316954443297	0.0	discard	13_3_in_3	Parallel run loop
auto	2.609199769618205	0.0	keep	22_3_in_DOMINO	Parallel run loop
auto	2.500673516113009	0.0	discard	20_3_in_DOMINO	Parallel run loop
auto	3.2232942054853804	0.0	discard	25_4_in_CIRCLE	Parallel run loop
auto	1.2748051192828511	0.0	discard	8_3_in_circle	Parallel run loop
auto	2.8776782496867814	0.0	discard	19_4_in_CIRCLE	Parallel run loop
auto	1.89256810033991	0.0	keep	20_3_in_circle	Parallel run loop
auto	2.9479967602447665	0.0	discard	20_4_in_CIRCLE	Parallel run loop
auto	4.019565593893119	0.0	discard	33_4_in_CIRCLE	Parallel run loop
auto	1.4830513649835477	0.0	discard	11_3_in_circle	Parallel run loop
auto	3.631402274099691	0.0	discard	29_4_in_CIRCLE	Parallel run loop
auto	1.8204190752494187	0.0	discard	18_3_in_circle	Parallel run loop
auto	2.697477612885324	0.0	discard	23_3_in_circle	Parallel run loop
auto	2.576348905974988	0.0	discard	21_3_in_circle	Parallel run loop
auto	2.8016697604273646	0.0	discard	18_4_in_CIRCLE	Parallel run loop
auto	3.8688750047412386	0.0	discard	23_4_in_DOMINO	Parallel run loop
auto	1.4007623159126743	0.0	discard	10_3_in_circle	Parallel run loop
auto	2.8832469100488693	0.0	discard	26_3_in_circle	Parallel run loop
auto	2.824640724191293	0.0	discard	25_3_in_circle	Parallel run loop
auto	4.52607678217151	0.0	discard	17_3_in_3	Parallel run loop
auto	3.1081296475721976	0.0	discard	30_3_in_circle	Parallel run loop
auto	3.0094621171564113	0.0	discard	28_3_in_circle	Parallel run loop
auto	1.8552899931430817	0.0	keep	19_3_in_circle	Parallel run loop
auto	2.5908349988663386	0.0	keep	22_3_in_circle	Parallel run loop
auto	6.9673699289329925	0.0	discard	43_3_in_3	Parallel run loop
auto	1.5230514075566917	0.0	discard	12_3_in_circle	Parallel run loop
auto	3.061314431260987	0.0	discard	29_3_in_circle	Parallel run loop
auto	2.175758505913405	0.0	keep	18_3_in_DOMINO	Parallel run loop
auto	1.7011773066844613	0.0	discard	10_3_in_DOMINO	Parallel run loop
auto	2.931723676723068	0.0	discard	11_4_in_DOMINO	Parallel run loop
auto	3.0104540932523642	0.0	discard	13_4_in_DOMINO	Parallel run loop
auto	1.9860191946575028	0.0	keep	15_3_in_DOMINO	Parallel run loop
auto	2.6494047857056615	0.0	discard	22_3_in_DOMINO	Parallel run loop
auto	3.746847963455798	0.0	discard	11_3_in_3	Parallel run loop
auto	2.469608107187733	0.0	keep	20_3_in_DOMINO	Parallel run loop
auto	3.164552820203738	0.0	discard	31_3_in_circle	Parallel run loop
auto	2.643847752583437	0.0	discard	16_4_in_CIRCLE	Parallel run loop
auto	2.932073235964317	0.0	keep	27_3_in_circle	Parallel run loop
auto	1.6549223038095542	0.0	discard	15_3_in_circle	Parallel run loop
auto	1.8833549268261347	0.0	keep	20_3_in_circle	Parallel run loop
auto	2.5819811985796304	0.0	discard	21_3_in_DOMINO	Parallel run loop
auto	2.70206745458314	0.0	discard	23_3_in_circle	Parallel run loop
auto	1.7029189896133312	0.0	discard	16_3_in_circle	Parallel run loop
auto	2.575833661957282	0.0	discard	21_3_in_circle	Parallel run loop
auto	3.7364237438117933	0.0	discard	31_4_in_CIRCLE	Parallel run loop
auto	1.2748051192828511	0.0	discard	8_3_in_circle	Parallel run loop
auto	4.04727924129811	0.0	discard	25_4_in_DOMINO	Parallel run loop
auto	4.020316954443297	0.0	discard	13_3_in_3	Parallel run loop
auto	2.8898863423392345	0.0	discard	26_3_in_circle	Parallel run loop
auto	3.128399308810775	0.0	discard	30_3_in_circle	Parallel run loop
auto	1.4830513649835477	0.0	discard	11_3_in_circle	Parallel run loop
auto	3.9241229167278884	0.0	discard	24_4_in_DOMINO	Parallel run loop
auto	3.1064519114939206	0.0	discard	21_4_in_CIRCLE	Parallel run loop
auto	2.6146194610897866	0.0	discard	22_3_in_circle	Parallel run loop
auto	1.8204190752494187	0.0	discard	18_3_in_circle	Parallel run loop
auto	1.8460916769234086	0.0	keep	19_3_in_circle	Parallel run loop
auto	3.0585603500889356	0.0	discard	29_3_in_circle	Parallel run loop
auto	2.4901149670854683	0.0	discard	19_3_in_DOMINO	Parallel run loop
auto	4.933706344963674	0.0	keep	21_3_in_3	Parallel run loop
auto	2.825205737086653	0.0	discard	25_3_in_circle	Parallel run loop
auto	2.1747755804071125	0.0	keep	18_3_in_DOMINO	Parallel run loop
auto	1.4007623159126743	0.0	discard	10_3_in_circle	Parallel run loop
auto	3.001347123854724	0.0	discard	28_3_in_circle	Parallel run loop
auto	2.5020190357383516	0.0	discard	20_3_in_DOMINO	Parallel run loop
auto	1.9851464537869072	0.0	keep	15_3_in_DOMINO	Parallel run loop
auto	3.115803431953349	0.0	discard	23_4_in_CIRCLE	Parallel run loop
auto	3.1769192934841137	0.0	discard	31_3_in_circle	Parallel run loop
auto	3.5236257287305413	0.0	discard	30_4_in_CIRCLE	Parallel run loop
auto	1.5230514075566917	0.0	discard	12_3_in_circle	Parallel run loop
auto	2.959940296747097	0.0	discard	27_3_in_circle	Parallel run loop
auto	1.7011773066844613	0.0	discard	10_3_in_DOMINO	Parallel run loop
auto	2.6896658697168867	0.0	keep	23_3_in_circle	Parallel run loop
auto	2.931723676723068	0.0	discard	11_4_in_DOMINO	Parallel run loop
auto	3.0104540932523642	0.0	discard	13_4_in_DOMINO	Parallel run loop
auto	1.8958192025625156	0.0	discard	20_3_in_circle	Parallel run loop
auto	3.746847963455798	0.0	discard	11_3_in_3	Parallel run loop
auto	2.8858431302049015	0.0	discard	26_3_in_circle	Parallel run loop
auto	3.2232942054853804	0.0	discard	25_4_in_CIRCLE	Parallel run loop
auto	4.020360663309433	0.0	discard	26_4_in_DOMINO	Parallel run loop
auto	2.643847752583437	0.0	discard	16_4_in_CIRCLE	Parallel run loop
auto	1.6549223038095542	0.0	discard	15_3_in_circle	Parallel run loop
auto	2.5683741928162918	0.0	discard	21_3_in_circle	Parallel run loop
auto	2.8776782496867814	0.0	discard	19_4_in_CIRCLE	Parallel run loop
auto	2.9479967602447665	0.0	discard	20_4_in_CIRCLE	Parallel run loop
auto	1.2748051192828511	0.0	discard	8_3_in_circle	Parallel run loop
auto	1.8582158012495773	0.0	discard	19_3_in_circle	Parallel run loop
auto	3.8688750047412386	0.0	discard	23_4_in_DOMINO	Parallel run loop
auto	3.631402274099691	0.0	discard	29_4_in_CIRCLE	Parallel run loop
auto	4.019565593893119	0.0	discard	33_4_in_CIRCLE	Parallel run loop
auto	2.8016697604273646	0.0	discard	18_4_in_CIRCLE	Parallel run loop
auto	4.965465729046708	0.0	discard	21_3_in_3	Parallel run loop
auto	2.817869376747562	0.0	discard	25_3_in_circle	Parallel run loop
auto	2.17393584382825	0.0	keep	18_3_in_DOMINO	Parallel run loop
auto	3.1143524387288757	0.0	discard	30_3_in_circle	Parallel run loop
auto	3.0079576870139517	0.0	discard	28_3_in_circle	Parallel run loop
auto	2.498018806303338	0.0	discard	20_3_in_DOMINO	Parallel run loop
auto	1.9844005340580158	0.0	keep	15_3_in_DOMINO	Parallel run loop
auto	2.6219510215594384	0.0	discard	22_3_in_circle	Parallel run loop
auto	3.1788261123912034	0.0	discard	31_3_in_circle	Parallel run loop
auto	3.063458208788125	0.0	discard	29_3_in_circle	Parallel run loop
auto	1.4830513649835477	0.0	discard	11_3_in_circle	Parallel run loop
auto	1.8204190752494187	0.0	discard	18_3_in_circle	Parallel run loop
auto	2.6799502145692116	0.0	keep	23_3_in_circle	Parallel run loop
auto	4.667223916623468	0.0	keep	19_3_in_3	Parallel run loop
auto	1.4007623159126743	0.0	discard	10_3_in_circle	Parallel run loop
auto	4.52607678217151	0.0	discard	17_3_in_3	Parallel run loop
auto	1.8958192025625156	0.0	discard	20_3_in_circle	Parallel run loop
auto	2.5745039265189864	0.0	discard	21_3_in_DOMINO	Parallel run loop
auto	1.5230514075566917	0.0	discard	12_3_in_circle	Parallel run loop
auto	2.9425271974846363	0.0	discard	27_3_in_circle	Parallel run loop
auto	3.7364237438117933	0.0	discard	31_4_in_CIRCLE	Parallel run loop
auto	1.7011773066844613	0.0	discard	10_3_in_DOMINO	Parallel run loop
auto	3.7914164805615247	0.0	discard	22_4_in_DOMINO	Parallel run loop
auto	2.931723676723068	0.0	discard	11_4_in_DOMINO	Parallel run loop
auto	1.7029189896133312	0.0	discard	16_3_in_circle	Parallel run loop
auto	3.0104540932523642	0.0	discard	13_4_in_DOMINO	Parallel run loop
auto	2.8982795967380435	0.0	discard	26_3_in_circle	Parallel run loop
auto	1.8582158012495773	0.0	discard	19_3_in_circle	Parallel run loop
auto	4.014200476639972	0.0	discard	25_4_in_DOMINO	Parallel run loop
auto	3.746847963455798	0.0	discard	11_3_in_3	Parallel run loop
auto	2.643847752583437	0.0	discard	16_4_in_CIRCLE	Parallel run loop
auto	1.6549223038095542	0.0	discard	15_3_in_circle	Parallel run loop
auto	4.020316954443297	0.0	discard	13_3_in_3	Parallel run loop
auto	2.5576091054520544	0.0	discard	21_3_in_circle	Parallel run loop
auto	2.205379219764513	0.0	discard	18_3_in_DOMINO	Parallel run loop
auto	1.2748051192828511	0.0	discard	8_3_in_circle	Parallel run loop
auto	3.9241229167278884	0.0	discard	24_4_in_DOMINO	Parallel run loop
auto	2.42442999977074	0.0	keep	20_3_in_DOMINO	Parallel run loop
auto	1.9837616114524637	0.0	keep	15_3_in_DOMINO	Parallel run loop
auto	2.4901149670854683	0.0	discard	19_3_in_DOMINO	Parallel run loop
auto	3.1064519114939206	0.0	discard	21_4_in_CIRCLE	Parallel run loop
auto	1.911646754271575	0.0	discard	14_3_in_DOMINO	Parallel run loop
auto	2.8240758242928625	0.0	discard	25_3_in_circle	Parallel run loop
auto	2.681619298129501	0.0	discard	23_3_in_circle	Parallel run loop
auto	3.5236257287305413	0.0	discard	30_4_in_CIRCLE	Parallel run loop
auto	2.9839888303219584	0.0	keep	28_3_in_circle	Parallel run loop
auto	4.669097318272951	0.0	discard	19_3_in_3	Parallel run loop
auto	3.0673699043676157	0.0	keep	30_3_in_circle	Parallel run loop
auto	2.5601262806201612	0.0	keep	21_3_in_DOMINO	Parallel run loop
auto	2.6167120982355048	0.0	discard	22_3_in_circle	Parallel run loop
auto	3.0637645852466493	0.0	discard	29_3_in_circle	Parallel run loop
auto	1.8958192025625156	0.0	discard	20_3_in_circle	Parallel run loop
auto	1.4830513649835477	0.0	discard	11_3_in_circle	Parallel run loop
auto	3.1794619729911817	0.0	discard	31_3_in_circle	Parallel run loop
auto	1.4007623159126743	0.0	discard	10_3_in_circle	Parallel run loop
auto	1.8204190752494187	0.0	discard	18_3_in_circle	Parallel run loop
auto	3.9641227017335576	0.0	discard	22_4_in_DOMINO	Parallel run loop
auto	3.115803431953349	0.0	discard	23_4_in_CIRCLE	Parallel run loop
auto	1.5230514075566917	0.0	discard	12_3_in_circle	Parallel run loop
auto	2.9425271974846363	0.0	discard	27_3_in_circle	Parallel run loop
auto	3.2232942054853804	0.0	discard	25_4_in_CIRCLE	Parallel run loop
auto	1.8582158012495773	0.0	discard	19_3_in_circle	Parallel run loop
auto	1.7011773066844613	0.0	discard	10_3_in_DOMINO	Parallel run loop
auto	2.5781530718033316	0.0	discard	21_3_in_circle	Parallel run loop
auto	2.931723676723068	0.0	discard	11_4_in_DOMINO	Parallel run loop
auto	4.020360663309433	0.0	discard	26_4_in_DOMINO	Parallel run loop
auto	3.0104540932523642	0.0	discard	13_4_in_DOMINO	Parallel run loop
auto	2.882382022470379	0.0	discard	26_3_in_circle	Parallel run loop
auto	2.4067469109391344	0.0	keep	20_3_in_DOMINO	Parallel run loop
auto	4.019565593893119	0.0	discard	33_4_in_CIRCLE	Parallel run loop
auto	1.9832133326420351	0.0	keep	15_3_in_DOMINO	Parallel run loop
auto	3.746847963455798	0.0	discard	11_3_in_3	Parallel run loop
auto	2.8052168215154145	0.0	discard	25_3_in_circle	Parallel run loop
auto	2.703970484986693	0.0	discard	23_3_in_circle	Parallel run loop
auto	2.643847752583437	0.0	discard	16_4_in_CIRCLE	Parallel run loop
auto	2.8776782496867814	0.0	discard	19_4_in_CIRCLE	Parallel run loop
auto	3.004835204405302	0.0	discard	28_3_in_circle	Parallel run loop
auto	2.9479967602447665	0.0	discard	20_4_in_CIRCLE	Parallel run loop
auto	3.104291049599433	0.0	discard	30_3_in_circle	Parallel run loop
auto	2.573374850402169	0.0	discard	21_3_in_DOMINO	Parallel run loop
auto	4.669097318272951	0.0	discard	19_3_in_3	Parallel run loop
auto	1.2748051192828511	0.0	discard	8_3_in_circle	Parallel run loop
auto	3.8688750047412386	0.0	discard	23_4_in_DOMINO	Parallel run loop
auto	2.8016697604273646	0.0	discard	18_4_in_CIRCLE	Parallel run loop
auto	1.6549223038095542	0.0	discard	15_3_in_circle	Parallel run loop
auto	4.929811098009403	0.0	discard	37_4_in_DOMINO	Parallel run loop
auto	3.8281160934956127	0.0	discard	34_4_in_CIRCLE	Parallel run loop
auto	3.631402274099691	0.0	discard	29_4_in_CIRCLE	Parallel run loop
auto	3.0539757196609427	0.0	discard	29_3_in_circle	Parallel run loop
auto	4.52607678217151	0.0	discard	17_3_in_3	Parallel run loop
auto	2.62536194505636	0.0	discard	22_3_in_circle	Parallel run loop
auto	2.945471343719646	0.0	discard	27_3_in_circle	Parallel run loop
auto	3.1544419316762666	0.0	keep	31_3_in_circle	Parallel run loop
auto	1.4830513649835477	0.0	discard	11_3_in_circle	Parallel run loop
auto	3.7364237438117933	0.0	discard	31_4_in_CIRCLE	Parallel run loop
auto	1.4007623159126743	0.0	discard	10_3_in_circle	Parallel run loop
auto	2.8858431302049015	0.0	discard	26_3_in_circle	Parallel run loop
auto	5.0279184253713805	0.0	discard	41_4_in_DOMINO	Parallel run loop
auto	1.8204190752494187	0.0	discard	18_3_in_circle	Parallel run loop
auto	2.3396794423041998	0.0	keep	20_3_in_DOMINO	Parallel run loop
auto	1.5230514075566917	0.0	discard	12_3_in_circle	Parallel run loop
auto	1.7029189896133312	0.0	discard	16_3_in_circle	Parallel run loop
auto	2.816460723817949	0.0	discard	25_3_in_circle	Parallel run loop
auto	1.982742108994763	0.0	keep	15_3_in_DOMINO	Parallel run loop
auto	2.5336790309011943	0.0	keep	21_3_in_circle	Parallel run loop
auto	1.7011773066844613	0.0	discard	10_3_in_DOMINO	Parallel run loop
auto	3.0030327539478465	0.0	discard	28_3_in_circle	Parallel run loop
auto	2.848831780259015	0.0	discard	11_4_in_DOMINO	Parallel run loop
auto	4.943502864466721	0.0	discard	40_4_in_DOMINO	Parallel run loop
auto	3.0104540932523642	0.0	discard	13_4_in_DOMINO	Parallel run loop
auto	3.122349158498006	0.0	discard	30_3_in_circle	Parallel run loop
auto	2.5754344770063256	0.0	discard	21_3_in_DOMINO	Parallel run loop
auto	3.746847963455798	0.0	discard	11_3_in_3	Parallel run loop
auto	4.669097318272951	0.0	discard	19_3_in_3	Parallel run loop
auto	4.020316954443297	0.0	discard	13_3_in_3	Parallel run loop
auto	4.014200476639972	0.0	discard	25_4_in_DOMINO	Parallel run loop
auto	3.0692846040320596	0.0	discard	29_3_in_circle	Parallel run loop
auto	3.9241229167278884	0.0	discard	24_4_in_DOMINO	Parallel run loop
auto	4.965465729046708	0.0	discard	21_3_in_3	Parallel run loop
auto	3.1064519114939206	0.0	discard	21_4_in_CIRCLE	Parallel run loop
auto	4.912194872736637	0.0	discard	20_3_in_3	Parallel run loop
auto	3.139732967826323	0.0	keep	31_3_in_circle	Parallel run loop
auto	2.4901149670854683	0.0	discard	19_3_in_DOMINO	Parallel run loop
auto	1.911646754271575	0.0	discard	14_3_in_DOMINO	Parallel run loop
auto	3.265553306575606	0.0	discard	26_4_in_CIRCLE	Parallel run loop
auto	2.8953826210193916	0.0	discard	26_3_in_circle	Parallel run loop
auto	4.475096077264324	0.0	discard	33_4_in_DOMINO	Parallel run loop
auto	3.115803431953349	0.0	discard	23_4_in_CIRCLE	Parallel run loop
auto	3.5236257287305413	0.0	discard	30_4_in_CIRCLE	Parallel run loop
auto	2.328728532343517	0.0	keep	20_3_in_DOMINO	Parallel run loop
auto	5.719122467319307	0.0	discard	26_3_in_3	Parallel run loop
auto	5.921363944330755	0.0	keep	31_3_in_3	Parallel run loop
auto	2.7940178072306385	0.0	discard	25_3_in_circle	Parallel run loop
auto	2.643847752583437	0.0	discard	16_4_in_CIRCLE	Parallel run loop
auto	2.5469856504655866	0.0	discard	21_3_in_circle	Parallel run loop
auto	3.2232942054853804	0.0	discard	25_4_in_CIRCLE	Parallel run loop
auto	1.9823365796770245	0.0	keep	15_3_in_DOMINO	Parallel run loop
auto	2.9024064399558376	0.0	discard	11_4_in_DOMINO	Parallel run loop
auto	4.020360663309433	0.0	discard	26_4_in_DOMINO	Parallel run loop
auto	2.5736322136235312	0.0	discard	21_3_in_DOMINO	Parallel run loop
auto	3.1089512134349593	0.0	discard	30_3_in_circle	Parallel run loop
auto	2.8776782496867814	0.0	discard	19_4_in_CIRCLE	Parallel run loop
auto	4.510334332905153	0.0	discard	34_4_in_DOMINO	Parallel run loop
auto	2.9479967602447665	0.0	discard	20_4_in_CIRCLE	Parallel run loop
auto	4.669097318272951	0.0	discard	19_3_in_3	Parallel run loop
auto	4.019565593893119	0.0	discard	33_4_in_CIRCLE	Parallel run loop
auto	1.7011773066844613	0.0	discard	10_3_in_DOMINO	Parallel run loop
auto	4.014200476639972	0.0	discard	25_4_in_DOMINO	Parallel run loop
auto	3.16677434906303	0.0	discard	31_3_in_circle	Parallel run loop
auto	3.8688750047412386	0.0	discard	23_4_in_DOMINO	Parallel run loop
auto	5.029602176115146	0.0	discard	42_4_in_DOMINO	Parallel run loop
auto	2.5824375133077595	0.0	keep	22_3_in_DOMINO	Parallel run loop
auto	3.631402274099691	0.0	discard	29_4_in_CIRCLE	Parallel run loop
auto	2.8016697604273646	0.0	discard	18_4_in_CIRCLE	Parallel run loop
auto	3.8281160934956127	0.0	discard	34_4_in_CIRCLE	Parallel run loop
auto	4.52607678217151	0.0	discard	17_3_in_3	Parallel run loop
auto	3.746847963455798	0.0	discard	11_3_in_3	Parallel run loop
auto	3.0104540932523642	0.0	discard	13_4_in_DOMINO	Parallel run loop
auto	5.026422664240083	0.0	discard	37_4_in_DOMINO	Parallel run loop
auto	3.7364237438117933	0.0	discard	31_4_in_CIRCLE	Parallel run loop
auto	5.089490454177981	0.0	discard	39_4_in_DOMINO	Parallel run loop
auto	2.8240758242928625	0.0	discard	25_3_in_circle	Parallel run loop
auto	2.5497890164203203	0.0	discard	21_3_in_circle	Parallel run loop
auto	2.320861433481963	0.0	keep	20_3_in_DOMINO	Parallel run loop
auto	3.7914164805615247	0.0	discard	22_4_in_DOMINO	Parallel run loop
auto	1.981987196856598	0.0	keep	15_3_in_DOMINO	Parallel run loop
auto	5.927325264360006	0.0	discard	31_3_in_3	Parallel run loop
auto	2.931723676723068	0.0	discard	11_4_in_DOMINO	Parallel run loop
auto	2.586015964671329	0.0	discard	21_3_in_DOMINO	Parallel run loop
auto	4.020316954443297	0.0	discard	13_3_in_3	Parallel run loop
auto	3.1086403183136158	0.0	discard	30_3_in_circle	Parallel run loop
auto	2.116892943954101	0.0	discard	16_3_in_DOMINO	Parallel run loop
auto	5.0279184253713805	0.0	discard	41_4_in_DOMINO	Parallel run loop
auto	4.943502864466721	0.0	discard	40_4_in_DOMINO	Parallel run loop
auto	3.9241229167278884	0.0	discard	24_4_in_DOMINO	Parallel run loop
auto	4.912194872736637	0.0	discard	20_3_in_3	Parallel run loop
auto	3.1064519114939206	0.0	discard	21_4_in_CIRCLE	Parallel run loop
auto	4.965465729046708	0.0	discard	21_3_in_3	Parallel run loop
auto	3.1613951373300844	0.0	discard	31_3_in_circle	Parallel run loop
auto	2.6124074576174157	0.0	discard	22_3_in_DOMINO	Parallel run loop
auto	2.4901149670854683	0.0	discard	19_3_in_DOMINO	Parallel run loop
auto	3.265553306575606	0.0	discard	26_4_in_CIRCLE	Parallel run loop
auto	4.475096077264324	0.0	discard	33_4_in_DOMINO	Parallel run loop
auto	1.911646754271575	0.0	discard	14_3_in_DOMINO	Parallel run loop
auto	3.5236257287305413	0.0	discard	30_4_in_CIRCLE	Parallel run loop
auto	3.115803431953349	0.0	discard	23_4_in_CIRCLE	Parallel run loop
auto	1.7011773066844613	0.0	discard	10_3_in_DOMINO	Parallel run loop
auto	2.643847752583437	0.0	discard	16_4_in_CIRCLE	Parallel run loop
auto	3.2232942054853804	0.0	discard	25_4_in_CIRCLE	Parallel run loop
auto	5.719122467319307	0.0	discard	26_3_in_3	Parallel run loop
auto	4.020360663309433	0.0	discard	26_4_in_DOMINO	Parallel run loop
auto	2.5633394526756437	0.0	discard	21_3_in_circle	Parallel run loop
auto	2.8776782496867814	0.0	discard	19_4_in_CIRCLE	Parallel run loop
auto	1.9816859007614458	0.0	keep	15_3_in_DOMINO	Parallel run loop
auto	2.314866815606775	0.0	keep	20_3_in_DOMINO	Parallel run loop
auto	2.9479967602447665	0.0	discard	20_4_in_CIRCLE	Parallel run loop
auto	4.510334332905153	0.0	discard	34_4_in_DOMINO	Parallel run loop
auto	4.019565593893119	0.0	discard	33_4_in_CIRCLE	Parallel run loop
auto	5.927325264360006	0.0	discard	31_3_in_3	Parallel run loop
auto	3.631402274099691	0.0	discard	29_4_in_CIRCLE	Parallel run loop
auto	3.747067648153613	0.0	discard	34_4_in_CIRCLE	Parallel run loop
auto	3.8688750047412386	0.0	discard	23_4_in_DOMINO	Parallel run loop
auto	4.810812353443134	0.0	discard	37_4_in_DOMINO	Parallel run loop
auto	5.029602176115146	0.0	discard	42_4_in_DOMINO	Parallel run loop
auto	2.8016697604273646	0.0	discard	18_4_in_CIRCLE	Parallel run loop
auto	3.0104540932523642	0.0	discard	13_4_in_DOMINO	Parallel run loop
auto	4.52607678217151	0.0	discard	17_3_in_3	Parallel run loop
auto	3.7364237438117933	0.0	discard	31_4_in_CIRCLE	Parallel run loop
auto	4.965465729046708	0.0	discard	21_3_in_3	Parallel run loop
auto	5.042168271527541	0.0	discard	39_4_in_DOMINO	Parallel run loop
auto	3.1648747594064135	0.0	discard	31_3_in_circle	Parallel run loop
