commit	score	memory_gb	status	problem	description
auto	11.005520545002303	0.0	discard	41_4_in_3	Parallel run loop
auto	4.922528763793943	0.0	keep	36_3_in_4	Parallel run loop
auto	3.494777088744195	0.0	discard	27_3_in_5	Parallel run loop
auto	3.8619322108575296	0.0	discard	23_3_in_4	Parallel run loop
auto	4.752336420341546	0.0	keep	34_3_in_4	Parallel run loop
auto	3.5631255856638395	0.0	discard	28_3_in_5	Parallel run loop
auto	3.749761073010563	0.0	keep	31_3_in_5	Parallel run loop
auto	3.0620970529338964	0.0	discard	21_3_in_5	Parallel run loop
auto	10.143929657656013	0.0	discard	36_4_in_3	Parallel run loop
auto	4.434470511563462	0.0	discard	30_3_in_4	Parallel run loop
auto	4.121874131279828	0.0	keep	26_3_in_4	Parallel run loop
auto	3.588226719959324	0.0	discard	20_3_in_4	Parallel run loop
auto	3.488553940974676	0.0	discard	19_3_in_4	Parallel run loop
auto	3.138493228763072	0.0	discard	22_3_in_5	Parallel run loop
auto	4.851070197588573	0.0	discard	19_3_in_3	Parallel run loop
auto	2.644500707751834	0.0	discard	16_3_in_5	Parallel run loop
auto	5.000067707885885	0.0	keep	22_3_in_3	Parallel run loop
auto	2.899382405290155	0.0	discard	19_3_in_5	Parallel run loop
auto	4.037177079703856	0.0	keep	25_3_in_4	Parallel run loop
auto	5.047679713048365	0.0	keep	38_3_in_4	Parallel run loop
auto	4.273067536499561	0.0	keep	28_3_in_4	Parallel run loop
auto	4.6585337754401674	0.0	keep	33_3_in_4	Parallel run loop
auto	3.2066828123661084	0.0	discard	23_3_in_5	Parallel run loop
auto	4.204249645321053	0.0	discard	27_3_in_4	Parallel run loop
auto	3.870080139998309	0.0	keep	33_3_in_5	Parallel run loop
auto	3.8101921298769303	0.0	discard	32_3_in_5	Parallel run loop
auto	4.500213775121804	0.0	discard	17_3_in_3	Parallel run loop
auto	3.9536453097614173	0.0	discard	24_3_in_4	Parallel run loop
auto	2.7375659104618713	0.0	discard	17_3_in_5	Parallel run loop
auto	3.6274352621521446	0.0	discard	29_3_in_5	Parallel run loop
auto	4.598583090345484	0.0	discard	32_3_in_4	Parallel run loop
auto	3.428133251425639	0.0	discard	26_3_in_5	Parallel run loop
auto	10.776309862715156	0.0	discard	40_4_in_3	Parallel run loop
auto	4.741163990775763	0.0	keep	47_3_in_5	Parallel run loop
auto	5.000630620844256	0.0	discard	37_3_in_4	Parallel run loop
auto	4.834594736876403	0.0	keep	35_3_in_4	Parallel run loop
auto	3.174557769380668	0.0	keep	16_3_in_4	Parallel run loop
auto	4.365119956412466	0.0	discard	29_3_in_4	Parallel run loop
auto	2.8222093921227107	0.0	discard	18_3_in_5	Parallel run loop
auto	3.6912366111536032	0.0	discard	30_3_in_5	Parallel run loop
auto	4.520348479104177	0.0	discard	31_3_in_4	Parallel run loop
auto	3.4918101609751977	0.0	discard	27_3_in_5	Parallel run loop
auto	5.100754308258733	0.0	keep	39_3_in_4	Parallel run loop
auto	3.864595446011329	0.0	discard	23_3_in_4	Parallel run loop
auto	3.559874648772938	0.0	discard	28_3_in_5	Parallel run loop
auto	4.759159245609078	0.0	discard	34_3_in_4	Parallel run loop
auto	4.433006981208872	0.0	discard	30_3_in_4	Parallel run loop
auto	11.01851023958955	0.0	discard	43_4_in_3	Parallel run loop
auto	3.956454504327308	0.0	keep	34_3_in_5	Parallel run loop
auto	3.0582616746703937	0.0	discard	21_3_in_5	Parallel run loop
auto	4.912633739106287	0.0	keep	36_3_in_4	Parallel run loop
auto	4.114248940780505	0.0	keep	26_3_in_4	Parallel run loop
auto	3.754738896730835	0.0	discard	31_3_in_5	Parallel run loop
auto	3.459691251320536	0.0	keep	19_3_in_4	Parallel run loop
auto	4.68018003596336	0.0	keep	46_3_in_5	Parallel run loop
auto	5.081476676876344	0.0	discard	38_3_in_4	Parallel run loop
auto	9.993868339689268	0.0	keep	35_4_in_3	Parallel run loop
auto	4.680405588390705	0.0	discard	33_3_in_4	Parallel run loop
auto	4.910363382997087	0.0	discard	20_3_in_3	Parallel run loop
auto	4.037718132575301	0.0	discard	25_3_in_4	Parallel run loop
auto	4.996424173479028	0.0	discard	21_3_in_3	Parallel run loop
auto	4.596535121809708	0.0	discard	32_3_in_4	Parallel run loop
auto	2.9092032907256167	0.0	discard	19_3_in_5	Parallel run loop
auto	2.651226105457336	0.0	discard	16_3_in_5	Parallel run loop
auto	3.892521826822933	0.0	discard	33_3_in_5	Parallel run loop
auto	4.203755638119018	0.0	discard	27_3_in_4	Parallel run loop
auto	2.7362673378981377	0.0	discard	17_3_in_5	Parallel run loop
auto	10.599771163337323	0.0	discard	39_4_in_3	Parallel run loop
auto	4.283492659312374	0.0	discard	28_3_in_4	Parallel run loop
auto	4.8086431463564985	0.0	keep	35_3_in_4	Parallel run loop
auto	4.015817229434117	0.0	keep	35_3_in_5	Parallel run loop
auto	9.945952382877353	0.0	discard	34_4_in_3	Parallel run loop
auto	4.9556894964809315	0.0	discard	37_3_in_4	Parallel run loop
auto	4.501187039771029	0.0	keep	18_3_in_3	Parallel run loop
auto	3.6900136585431866	0.0	discard	30_3_in_5	Parallel run loop
auto	4.888755149763693	0.0	discard	47_3_in_5	Parallel run loop
auto	3.618891276191829	0.0	discard	29_3_in_5	Parallel run loop
auto	3.8165085053580854	0.0	discard	32_3_in_5	Parallel run loop
auto	6.002373102450412	0.0	keep	31_3_in_3	Parallel run loop
auto	6.57626910209534	0.0	discard	15_4_in_3	Parallel run loop
auto	4.5152804301340534	0.0	discard	31_3_in_4	Parallel run loop
auto	10.940553511555468	0.0	discard	41_4_in_3	Parallel run loop
auto	4.985820981236973	0.0	keep	49_3_in_5	Parallel run loop
auto	5.593885567852298	0.0	keep	26_3_in_3	Parallel run loop
auto	3.5557707001598797	0.0	discard	28_3_in_5	Parallel run loop
auto	5.143037194483781	0.0	discard	39_3_in_4	Parallel run loop
auto	5.7822746045219455	0.0	keep	47_3_in_4	Parallel run loop
auto	3.0554812955125414	0.0	discard	21_3_in_5	Parallel run loop
auto	4.751172129860694	0.0	keep	34_3_in_4	Parallel run loop
auto	4.918991752152422	0.0	discard	36_3_in_4	Parallel run loop
auto	5.070686620602649	0.0	keep	50_3_in_5	Parallel run loop
auto	3.758977101186074	0.0	discard	31_3_in_5	Parallel run loop
auto	4.649519475293014	0.0	keep	33_3_in_4	Parallel run loop
auto	4.122288579039919	0.0	discard	26_3_in_4	Parallel run loop
auto	4.441139805924314	0.0	discard	30_3_in_4	Parallel run loop
auto	5.076672643865842	0.0	discard	38_3_in_4	Parallel run loop
auto	3.9475778796850087	0.0	keep	34_3_in_5	Parallel run loop
auto	5.255899565314644	0.0	keep	40_3_in_4	Parallel run loop
auto	4.7894560122898095	0.0	discard	46_3_in_5	Parallel run loop
auto	3.883971622498746	0.0	discard	33_3_in_5	Parallel run loop
auto	2.9049441872346113	0.0	discard	19_3_in_5	Parallel run loop
auto	3.49527399018512	0.0	discard	19_3_in_4	Parallel run loop
auto	4.5970322416396225	0.0	discard	32_3_in_4	Parallel run loop
auto	11.057079850967028	0.0	discard	42_4_in_3	Parallel run loop
auto	4.037625009281933	0.0	discard	25_3_in_4	Parallel run loop
auto	5.771006275969161	0.0	keep	46_3_in_4	Parallel run loop
auto	4.818005562436538	0.0	discard	35_3_in_4	Parallel run loop
auto	4.989160464713446	0.0	discard	37_3_in_4	Parallel run loop
auto	4.283605932510743	0.0	discard	28_3_in_4	Parallel run loop
auto	5.662086560854177	0.0	keep	45_3_in_4	Parallel run loop
auto	5.503381837061723	0.0	keep	27_3_in_3	Parallel run loop
auto	5.327142246105477	0.0	keep	41_3_in_4	Parallel run loop
auto	3.689300635613459	0.0	discard	30_3_in_5	Parallel run loop
auto	10.03779641185119	0.0	discard	36_4_in_3	Parallel run loop
auto	4.851070197588573	0.0	discard	19_3_in_3	Parallel run loop
auto	4.0095172278997975	0.0	keep	35_3_in_5	Parallel run loop
auto	5.965306840487772	0.0	keep	48_3_in_4	Parallel run loop
auto	4.833341558311521	0.0	discard	47_3_in_5	Parallel run loop
auto	4.500468044315581	0.0	discard	17_3_in_3	Parallel run loop
auto	3.815717913559669	0.0	discard	32_3_in_5	Parallel run loop
auto	10.776309862715156	0.0	discard	40_4_in_3	Parallel run loop
auto	4.660130479685161	0.0	keep	44_3_in_5	Parallel run loop
auto	4.5113016974024776	0.0	discard	31_3_in_4	Parallel run loop
auto	5.404523436614526	0.0	keep	42_3_in_4	Parallel run loop
auto	3.181902442562164	0.0	discard	16_3_in_4	Parallel run loop
auto	5.159510730794079	0.0	discard	39_3_in_4	Parallel run loop
auto	5.874269763163611	0.0	discard	47_3_in_4	Parallel run loop
auto	4.123177965431933	0.0	discard	26_3_in_4	Parallel run loop
auto	5.098313459946513	0.0	discard	50_3_in_5	Parallel run loop
auto	5.033097251641922	0.0	discard	49_3_in_5	Parallel run loop
auto	4.758246630762927	0.0	discard	34_3_in_4	Parallel run loop
auto	3.7573873485979656	0.0	discard	31_3_in_5	Parallel run loop
auto	4.927011729011038	0.0	discard	36_3_in_4	Parallel run loop
auto	4.938134349472098	0.0	keep	48_3_in_5	Parallel run loop
auto	5.020910742756499	0.0	keep	38_3_in_4	Parallel run loop
auto	10.102256807489026	0.0	discard	35_4_in_3	Parallel run loop
auto	4.702449902773762	0.0	discard	46_3_in_5	Parallel run loop
auto	5.243520531777947	0.0	keep	40_3_in_4	Parallel run loop
auto	3.5602715267535716	0.0	discard	28_3_in_5	Parallel run loop
auto	3.8836979305714485	0.0	discard	33_3_in_5	Parallel run loop
auto	4.6696142827646545	0.0	discard	33_3_in_4	Parallel run loop
auto	11.01851023958955	0.0	discard	43_4_in_3	Parallel run loop
auto	4.93394718759379	0.0	keep	21_3_in_3	Parallel run loop
auto	4.03643008255956	0.0	keep	25_3_in_4	Parallel run loop
auto	4.989697451147667	0.0	discard	37_3_in_4	Parallel run loop
auto	4.828941079038734	0.0	discard	35_3_in_4	Parallel run loop
auto	4.91094292387987	0.0	discard	20_3_in_3	Parallel run loop
auto	5.756086645071661	0.0	keep	46_3_in_4	Parallel run loop
auto	3.954937200354723	0.0	discard	34_3_in_5	Parallel run loop
auto	4.276125082485528	0.0	discard	28_3_in_4	Parallel run loop
auto	10.629098076349557	0.0	discard	39_4_in_3	Parallel run loop
auto	5.710268529417662	0.0	discard	45_3_in_4	Parallel run loop
auto	5.5470295389031685	0.0	keep	43_3_in_4	Parallel run loop
auto	5.30473040049928	0.0	keep	41_3_in_4	Parallel run loop
auto	6.0003972994324615	0.0	keep	31_3_in_3	Parallel run loop
auto	4.016641778510792	0.0	discard	35_3_in_5	Parallel run loop
auto	4.6116291880582985	0.0	keep	44_3_in_5	Parallel run loop
auto	5.909951852064155	0.0	keep	48_3_in_4	Parallel run loop
auto	3.804975325372318	0.0	keep	32_3_in_5	Parallel run loop
auto	4.834166854058425	0.0	discard	47_3_in_5	Parallel run loop
auto	4.053228531295271	0.0	keep	36_3_in_5	Parallel run loop
auto	11.044659619702836	0.0	discard	42_4_in_3	Parallel run loop
auto	5.446783302208864	0.0	keep	26_3_in_3	Parallel run loop
auto	4.756474332876029	0.0	discard	34_3_in_4	Parallel run loop
auto	5.414842593548908	0.0	discard	42_3_in_4	Parallel run loop
auto	5.895463759604653	0.0	discard	47_3_in_4	Parallel run loop
auto	5.141157659715252	0.0	discard	39_3_in_4	Parallel run loop
auto	5.591723393651105	0.0	keep	44_3_in_4	Parallel run loop
auto	11.051418833011057	0.0	discard	41_4_in_3	Parallel run loop
auto	4.929000756417977	0.0	keep	48_3_in_5	Parallel run loop
auto	5.026337041779723	0.0	discard	49_3_in_5	Parallel run loop
auto	5.074008573784659	0.0	discard	50_3_in_5	Parallel run loop
auto	4.742964878568384	0.0	discard	46_3_in_5	Parallel run loop
auto	3.7573873485979656	0.0	discard	31_3_in_5	Parallel run loop
auto	10.097240077527125	0.0	discard	36_4_in_3	Parallel run loop
auto	3.8716498857127517	0.0	discard	33_3_in_5	Parallel run loop
auto	4.851070197588573	0.0	discard	19_3_in_3	Parallel run loop
auto	5.075740362879084	0.0	discard	38_3_in_4	Parallel run loop
auto	4.478111646292735	0.0	keep	42_3_in_5	Parallel run loop
auto	4.121697458012153	0.0	discard	26_3_in_4	Parallel run loop
auto	4.5471086147615	0.0	keep	43_3_in_5	Parallel run loop
auto	5.235874043839695	0.0	keep	40_3_in_4	Parallel run loop
auto	4.907615771584827	0.0	keep	36_3_in_4	Parallel run loop
auto	4.500213775121804	0.0	discard	17_3_in_3	Parallel run loop
auto	4.036568334232731	0.0	discard	25_3_in_4	Parallel run loop
auto	5.725585130039607	0.0	keep	46_3_in_4	Parallel run loop
auto	4.842493763894582	0.0	discard	35_3_in_4	Parallel run loop
auto	4.139272693085462	0.0	keep	37_3_in_5	Parallel run loop
auto	5.686509075821817	0.0	discard	45_3_in_4	Parallel run loop
auto	3.9349807323211348	0.0	keep	34_3_in_5	Parallel run loop
auto	5.800973214871754	0.0	keep	29_3_in_3	Parallel run loop
auto	5.521016455349248	0.0	keep	43_3_in_4	Parallel run loop
auto	6.000045144398807	0.0	keep	32_3_in_3	Parallel run loop
auto	4.2996418438427035	0.0	keep	39_3_in_5	Parallel run loop
auto	4.271796340335114	0.0	keep	28_3_in_4	Parallel run loop
auto	4.6391100925870585	0.0	discard	44_3_in_5	Parallel run loop
auto	5.86732332502171	0.0	keep	48_3_in_4	Parallel run loop
auto	5.341452191045051	0.0	discard	41_3_in_4	Parallel run loop
auto	5.375729125944675	0.0	keep	42_3_in_4	Parallel run loop
auto	4.021478964672763	0.0	discard	35_3_in_5	Parallel run loop
auto	4.222375790947403	0.0	keep	38_3_in_5	Parallel run loop
auto	3.820084936704594	0.0	discard	32_3_in_5	Parallel run loop
auto	4.094960973179626	0.0	discard	36_3_in_5	Parallel run loop
auto	5.535154661536032	0.0	keep	44_3_in_4	Parallel run loop
auto	6.0003972994324615	0.0	discard	31_3_in_3	Parallel run loop
auto	4.93394718759379	0.0	discard	21_3_in_3	Parallel run loop
auto	4.831860226806961	0.0	discard	47_3_in_5	Parallel run loop
auto	5.851219388596868	0.0	discard	47_3_in_4	Parallel run loop
auto	4.946423095332698	0.0	discard	48_3_in_5	Parallel run loop
auto	5.916515309268356	0.0	keep	30_3_in_3	Parallel run loop
auto	4.890860599666036	0.0	keep	49_3_in_5	Parallel run loop
auto	4.741096075247791	0.0	discard	46_3_in_5	Parallel run loop
auto	5.593885567852298	0.0	discard	26_3_in_3	Parallel run loop
auto	5.15197701696613	0.0	discard	39_3_in_4	Parallel run loop
auto	5.051499597962342	0.0	keep	50_3_in_5	Parallel run loop
auto	4.338925229654497	0.0	keep	40_3_in_5	Parallel run loop
auto	4.3810279136638925	0.0	keep	41_3_in_5	Parallel run loop
auto	4.808414913454218	0.0	keep	19_3_in_3	Parallel run loop
auto	4.031076481739401	0.0	keep	25_3_in_4	Parallel run loop
auto	6.001644417168656	0.0	keep	33_3_in_3	Parallel run loop
auto	4.898092181690515	0.0	keep	36_3_in_4	Parallel run loop
auto	7.003877512508083	0.0	keep	44_3_in_3	Parallel run loop
auto	5.197685570039026	0.0	keep	40_3_in_4	Parallel run loop
auto	4.119965747439988	0.0	discard	26_3_in_4	Parallel run loop
auto	10.12146122489197	0.0	discard	36_4_in_3	Parallel run loop
auto	3.963591523330593	0.0	discard	34_3_in_5	Parallel run loop
auto	5.772068148337326	0.0	discard	46_3_in_4	Parallel run loop
auto	4.585695578292129	0.0	discard	43_3_in_5	Parallel run loop
auto	4.519941807971385	0.0	discard	42_3_in_5	Parallel run loop
auto	4.155591264670261	0.0	discard	37_3_in_5	Parallel run loop
auto	6.000259536170223	0.0	discard	32_3_in_3	Parallel run loop
auto	5.518796968382214	0.0	keep	43_3_in_4	Parallel run loop
auto	4.759237666624055	0.0	keep	45_3_in_5	Parallel run loop
auto	5.672015783127879	0.0	discard	45_3_in_4	Parallel run loop
auto	4.255803643074515	0.0	keep	39_3_in_5	Parallel run loop
auto	5.800973214871754	0.0	discard	29_3_in_3	Parallel run loop
auto	4.608548516006385	0.0	keep	44_3_in_5	Parallel run loop
auto	4.2065248685225916	0.0	keep	38_3_in_5	Parallel run loop
auto	4.055671170721144	0.0	discard	36_3_in_5	Parallel run loop
auto	5.9622688805178194	0.0	discard	48_3_in_4	Parallel run loop
auto	5.33718192836322	0.0	keep	42_3_in_4	Parallel run loop
auto	6.670108867679205	0.0	keep	38_3_in_3	Parallel run loop
auto	4.277908157795	0.0	discard	28_3_in_4	Parallel run loop
auto	4.0096686183707115	0.0	discard	35_3_in_5	Parallel run loop
auto	5.311346813901449	0.0	discard	41_3_in_4	Parallel run loop
auto	5.99192953919103	0.0	keep	31_3_in_3	Parallel run loop
auto	5.5696101560901825	0.0	discard	44_3_in_4	Parallel run loop
auto	6.652766487536131	0.0	keep	37_3_in_3	Parallel run loop
auto	4.943440181171258	0.0	discard	48_3_in_5	Parallel run loop
auto	5.794113313948808	0.0	discard	47_3_in_4	Parallel run loop
auto	5.013253540482748	0.0	discard	49_3_in_5	Parallel run loop
auto	6.9415985252871755	0.0	keep	42_3_in_3	Parallel run loop
auto	5.967739220261456	0.0	discard	30_3_in_3	Parallel run loop
auto	4.995604541746432	0.0	discard	21_3_in_3	Parallel run loop
auto	6.839421871225972	0.0	keep	39_3_in_3	Parallel run loop
auto	5.593885567852298	0.0	discard	26_3_in_3	Parallel run loop
auto	4.38026523750066	0.0	discard	40_3_in_5	Parallel run loop
auto	7.002154846474123	0.0	keep	41_3_in_3	Parallel run loop
auto	4.024752926798032	0.0	keep	25_3_in_4	Parallel run loop
auto	4.4414935273977605	0.0	discard	41_3_in_5	Parallel run loop
auto	4.851070197588573	0.0	discard	19_3_in_3	Parallel run loop
auto	5.126519174670583	0.0	keep	40_3_in_4	Parallel run loop
auto	5.148779870586544	0.0	discard	50_3_in_5	Parallel run loop
auto	4.918305164102589	0.0	discard	36_3_in_4	Parallel run loop
auto	7.424912596829384	0.0	keep	45_3_in_3	Parallel run loop
auto	5.442721123160443	0.0	keep	43_3_in_4	Parallel run loop
auto	7.003906059108661	0.0	keep	43_3_in_3	Parallel run loop
auto	7.003877512508083	0.0	discard	44_3_in_3	Parallel run loop
auto	4.56964455101872	0.0	discard	43_3_in_5	Parallel run loop
auto	4.153165592233845	0.0	discard	37_3_in_5	Parallel run loop
auto	7.740357666666721	0.0	keep	50_3_in_3	Parallel run loop
auto	4.488747876529763	0.0	discard	42_3_in_5	Parallel run loop
auto	6.000259536170223	0.0	discard	32_3_in_3	Parallel run loop
auto	4.659505373576158	0.0	keep	45_3_in_5	Parallel run loop
auto	5.650247326835063	0.0	keep	45_3_in_4	Parallel run loop
auto	4.282600862122904	0.0	discard	39_3_in_5	Parallel run loop
auto	5.754385120585343	0.0	discard	46_3_in_4	Parallel run loop
auto	5.881623376272442	0.0	discard	29_3_in_3	Parallel run loop
auto	4.626307932661024	0.0	discard	44_3_in_5	Parallel run loop
auto	5.578179629494518	0.0	discard	44_3_in_4	Parallel run loop
auto	5.984674057448995	0.0	discard	48_3_in_4	Parallel run loop
auto	4.22399718119533	0.0	discard	38_3_in_5	Parallel run loop
auto	4.103035427035319	0.0	discard	36_3_in_5	Parallel run loop
auto	4.285895758903256	0.0	discard	28_3_in_4	Parallel run loop
auto	5.346523212492716	0.0	discard	41_3_in_4	Parallel run loop
auto	5.378447259137774	0.0	discard	42_3_in_4	Parallel run loop
auto	5.95228234154563	0.0	keep	31_3_in_3	Parallel run loop
auto	4.988314173583206	0.0	discard	48_3_in_5	Parallel run loop
auto	6.752897812688078	0.0	discard	37_3_in_3	Parallel run loop
auto	4.001018100762643	0.0	keep	35_3_in_5	Parallel run loop
auto	6.670108867679205	0.0	discard	38_3_in_3	Parallel run loop
auto	7.389215428068609	0.0	keep	46_3_in_3	Parallel run loop
auto	4.45163931626776	0.0	discard	41_3_in_5	Parallel run loop
auto	6.812285038961553	0.0	keep	39_3_in_3	Parallel run loop
auto	6.9415985252871755	0.0	discard	42_3_in_3	Parallel run loop
auto	5.916515309268356	0.0	discard	30_3_in_3	Parallel run loop
auto	4.356534980497981	0.0	discard	40_3_in_5	Parallel run loop
auto	6.961575033158833	0.0	keep	41_3_in_3	Parallel run loop
auto	4.034814764364426	0.0	discard	25_3_in_4	Parallel run loop
auto	4.90173350960666	0.0	discard	36_3_in_4	Parallel run loop
auto	4.140325991712922	0.0	discard	37_3_in_5	Parallel run loop
auto	4.551425509209976	0.0	discard	43_3_in_5	Parallel run loop
auto	5.634454687140022	0.0	discard	26_3_in_3	Parallel run loop
auto	5.480729527139683	0.0	discard	43_3_in_4	Parallel run loop
auto	5.248882792288608	0.0	discard	40_3_in_4	Parallel run loop
auto	4.508673142459209	0.0	discard	42_3_in_5	Parallel run loop
auto	4.266531123212985	0.0	discard	39_3_in_5	Parallel run loop
auto	7.399183534902634	0.0	keep	45_3_in_3	Parallel run loop
auto	7.004219438633266	0.0	discard	43_3_in_3	Parallel run loop
auto	7.003877512508083	0.0	discard	44_3_in_3	Parallel run loop
auto	4.621558953698124	0.0	keep	45_3_in_5	Parallel run loop
auto	6.000259536170223	0.0	discard	32_3_in_3	Parallel run loop
auto	4.0839924009099215	0.0	discard	36_3_in_5	Parallel run loop
auto	4.644310240700544	0.0	discard	44_3_in_5	Parallel run loop
auto	5.616279363943449	0.0	discard	44_3_in_4	Parallel run loop
auto	5.784131122714162	0.0	keep	29_3_in_3	Parallel run loop
auto	7.740357666666721	0.0	discard	50_3_in_3	Parallel run loop
auto	5.704449507094224	0.0	discard	45_3_in_4	Parallel run loop
auto	4.232610837986472	0.0	discard	38_3_in_5	Parallel run loop
auto	5.749813712062366	0.0	discard	46_3_in_4	Parallel run loop
auto	5.435501309788684	0.0	discard	42_3_in_4	Parallel run loop
auto	6.670108867679205	0.0	discard	38_3_in_3	Parallel run loop
auto	4.445752378766835	0.0	discard	41_3_in_5	Parallel run loop
auto	6.9415985252871755	0.0	discard	42_3_in_3	Parallel run loop
auto	6.000671067281086	0.0	discard	31_3_in_3	Parallel run loop
auto	4.025933366306584	0.0	discard	25_3_in_4	Parallel run loop
auto	4.031177549293715	0.0	discard	35_3_in_5	Parallel run loop
auto	5.916515309268356	0.0	discard	30_3_in_3	Parallel run loop
auto	6.827949896182372	0.0	discard	39_3_in_3	Parallel run loop
auto	4.306725294837952	0.0	keep	40_3_in_5	Parallel run loop
auto	6.866435278289275	0.0	keep	41_3_in_3	Parallel run loop
auto	7.436644633348435	0.0	discard	46_3_in_3	Parallel run loop
auto	4.557392542300272	0.0	discard	43_3_in_5	Parallel run loop
auto	4.1324546215091384	0.0	keep	37_3_in_5	Parallel run loop
auto	6.650952241363264	0.0	keep	37_3_in_3	Parallel run loop
auto	5.510147045733704	0.0	discard	43_3_in_4	Parallel run loop
auto	4.918305164102589	0.0	discard	36_3_in_4	Parallel run loop
auto	7.003877512508083	0.0	discard	44_3_in_3	Parallel run loop
auto	4.421881937187199	0.0	keep	42_3_in_5	Parallel run loop
auto	7.374499210937253	0.0	keep	45_3_in_3	Parallel run loop
auto	4.275745822302719	0.0	discard	39_3_in_5	Parallel run loop
auto	7.0056348520542135	0.0	discard	43_3_in_3	Parallel run loop
auto	4.727338942991058	0.0	discard	45_3_in_5	Parallel run loop
auto	7.869601854051851	0.0	discard	50_3_in_3	Parallel run loop
auto	6.000259536170223	0.0	discard	32_3_in_3	Parallel run loop
auto	4.154707933020685	0.0	discard	4_4_in_3	Parallel run loop
auto	6.670108867679205	0.0	discard	38_3_in_3	Parallel run loop
auto	1.1435295943053447	0.0	keep	3_3_in_5	Parallel run loop
auto	5.784131122714162	0.0	discard	29_3_in_3	Parallel run loop
auto	5.707343503622244	0.0	discard	45_3_in_4	Parallel run loop
auto	1.4783993300089884	0.0	discard	3_3_in_4	Parallel run loop
auto	4.167243762522457	0.0	discard	37_3_in_5	Parallel run loop
auto	4.231709989925213	0.0	discard	38_3_in_5	Parallel run loop
