commit	score	memory_gb	status	problem	description
auto	3.4954874820989015	0.0	discard	19_3_in_4	Parallel run loop
auto	2.891893369235926	0.0	discard	19_3_in_5	Parallel run loop
auto	4.979000017298063	0.0	discard	50_3_in_5	Parallel run loop
auto	5.620151541422797	0.0	discard	44_3_in_4	Parallel run loop
auto	5.274274816044175	0.0	discard	40_3_in_4	Parallel run loop
auto	2.467552128588175	0.0	discard	14_3_in_5	Parallel run loop
auto	2.6503483984834104	0.0	discard	16_3_in_5	Parallel run loop
auto	3.952641811535049	0.0	discard	24_3_in_4	Parallel run loop
auto	3.7780504644202004	0.0	discard	22_3_in_4	Parallel run loop
auto	2.1837565038533184	0.0	discard	11_3_in_5	Parallel run loop
auto	3.821722232967094	0.0	discard	32_3_in_5	Parallel run loop
auto	5.275014140635853	0.0	discard	41_3_in_4	Parallel run loop
auto	3.6739427833147613	0.0	discard	21_3_in_4	Parallel run loop
auto	4.9430575462420006	0.0	discard	37_3_in_4	Parallel run loop
auto	3.879002787182956	0.0	discard	33_3_in_5	Parallel run loop
auto	2.8187855864786626	0.0	discard	18_3_in_5	Parallel run loop
auto	5.000729469232406	0.0	discard	49_3_in_5	Parallel run loop
auto	3.5853606877171607	0.0	discard	20_3_in_4	Parallel run loop
auto	2.5508985342279327	0.0	keep	15_3_in_5	Parallel run loop
auto	4.437767350905076	0.0	keep	43_3_in_5	Parallel run loop
auto	1.6123349357903138	0.0	discard	6_3_in_5	Parallel run loop
auto	4.890060395313869	0.0	discard	48_3_in_5	Parallel run loop
auto	3.483586323965287	0.0	discard	27_3_in_5	Parallel run loop
auto	4.613237116070952	0.0	keep	45_3_in_5	Parallel run loop
auto	3.198519024762052	0.0	discard	23_3_in_5	Parallel run loop
auto	1.741520875335353	0.0	discard	7_3_in_5	Parallel run loop
auto	5.165226492893488	0.0	discard	39_3_in_4	Parallel run loop
auto	2.983794317501145	0.0	discard	20_3_in_5	Parallel run loop
auto	3.3546360928478296	0.0	discard	25_3_in_5	Parallel run loop
auto	1.8622733209928188	0.0	discard	8_3_in_5	Parallel run loop
auto	2.733460737152129	0.0	discard	17_3_in_5	Parallel run loop
auto	2.283293902982647	0.0	discard	12_3_in_5	Parallel run loop
auto	5.1019414086673605	0.0	discard	50_3_in_5	Parallel run loop
auto	2.8589797906102543	0.0	discard	13_3_in_4	Parallel run loop
auto	3.8634510855288946	0.0	discard	23_3_in_4	Parallel run loop
auto	4.756607973416387	0.0	discard	46_3_in_5	Parallel run loop
auto	4.2025726785110455	0.0	discard	27_3_in_4	Parallel run loop
auto	4.589059708256128	0.0	discard	32_3_in_4	Parallel run loop
auto	4.216949929778341	0.0	discard	38_3_in_5	Parallel run loop
auto	2.18371446916864	0.0	discard	11_3_in_5	Parallel run loop
auto	3.386994172391607	0.0	discard	18_3_in_4	Parallel run loop
auto	4.51695806437515	0.0	discard	31_3_in_4	Parallel run loop
auto	4.014610435585818	0.0	discard	35_3_in_5	Parallel run loop
auto	4.27976233769068	0.0	discard	28_3_in_4	Parallel run loop
auto	2.807584810739649	0.0	discard	18_3_in_5	Parallel run loop
auto	4.971696999360521	0.0	discard	49_3_in_5	Parallel run loop
auto	4.977698650138801	0.0	discard	37_3_in_4	Parallel run loop
auto	3.673258266723099	0.0	discard	21_3_in_4	Parallel run loop
auto	5.471893673513298	0.0	discard	43_3_in_4	Parallel run loop
auto	2.557776342332113	0.0	discard	15_3_in_5	Parallel run loop
auto	5.343125196779171	0.0	discard	41_3_in_4	Parallel run loop
auto	4.662526361082581	0.0	discard	45_3_in_5	Parallel run loop
auto	3.4852989187763366	0.0	discard	19_3_in_4	Parallel run loop
auto	4.533641121995398	0.0	discard	43_3_in_5	Parallel run loop
auto	4.329037606582289	0.0	discard	40_3_in_5	Parallel run loop
auto	4.392471891927051	0.0	discard	41_3_in_5	Parallel run loop
auto	3.2098934885180874	0.0	discard	23_3_in_5	Parallel run loop
auto	2.8926736315101866	0.0	discard	19_3_in_5	Parallel run loop
auto	4.123711718333653	0.0	discard	26_3_in_4	Parallel run loop
auto	2.6473744208485663	0.0	discard	16_3_in_5	Parallel run loop
auto	5.243326409627004	0.0	discard	40_3_in_4	Parallel run loop
auto	5.712682894330071	0.0	discard	46_3_in_4	Parallel run loop
auto	3.887094069585749	0.0	discard	33_3_in_5	Parallel run loop
auto	3.3552141212797393	0.0	discard	25_3_in_5	Parallel run loop
auto	3.4248827947739144	0.0	discard	26_3_in_5	Parallel run loop
auto	4.977483030433841	0.0	keep	38_3_in_4	Parallel run loop
auto	4.8308194914143625	0.0	discard	35_3_in_4	Parallel run loop
auto	3.3903141267408166	0.0	discard	18_3_in_4	Parallel run loop
auto	4.633284650309261	0.0	discard	44_3_in_5	Parallel run loop
auto	4.775689047506527	0.0	discard	46_3_in_5	Parallel run loop
auto	2.0819147930626043	0.0	discard	10_3_in_5	Parallel run loop
auto	1.7415208749791966	0.0	discard	7_3_in_5	Parallel run loop
auto	2.8047776815041474	0.0	discard	18_3_in_5	Parallel run loop
auto	4.923439785301233	0.0	discard	48_3_in_5	Parallel run loop
auto	2.184179392419747	0.0	discard	11_3_in_5	Parallel run loop
auto	2.375773515144428	0.0	discard	13_3_in_5	Parallel run loop
auto	4.991167690052894	0.0	discard	37_3_in_4	Parallel run loop
auto	4.030283300385447	0.0	discard	25_3_in_4	Parallel run loop
auto	4.576649952780922	0.0	discard	32_3_in_4	Parallel run loop
auto	2.7266845546485214	0.0	discard	17_3_in_5	Parallel run loop
auto	5.1056512645303735	0.0	discard	39_3_in_4	Parallel run loop
auto	4.457445141789304	0.0	discard	43_3_in_5	Parallel run loop
auto	2.5581158956099617	0.0	discard	15_3_in_5	Parallel run loop
auto	2.2810437164135924	0.0	discard	12_3_in_5	Parallel run loop
auto	4.300665852740773	0.0	discard	40_3_in_5	Parallel run loop
auto	4.2200251138172264	0.0	discard	39_3_in_5	Parallel run loop
auto	1.9752407054817602	0.0	discard	9_3_in_5	Parallel run loop
auto	4.666920080914447	0.0	discard	45_3_in_5	Parallel run loop
auto	2.8563468853007974	0.0	discard	13_3_in_4	Parallel run loop
auto	2.891807296878469	0.0	discard	19_3_in_5	Parallel run loop
auto	4.200887746958941	0.0	discard	38_3_in_5	Parallel run loop
auto	3.8633715656712266	0.0	discard	23_3_in_4	Parallel run loop
auto	5.225239631965783	0.0	discard	40_3_in_4	Parallel run loop
auto	3.424911992589844	0.0	discard	26_3_in_5	Parallel run loop
auto	3.5968474148853176	0.0	keep	29_3_in_5	Parallel run loop
auto	3.558402244127039	0.0	discard	28_3_in_5	Parallel run loop
auto	5.08752742079617	0.0	discard	38_3_in_4	Parallel run loop
auto	4.192550474121457	0.0	discard	27_3_in_4	Parallel run loop
auto	1.472359754421041	0.0	discard	5_3_in_5	Parallel run loop
auto	2.0821302952799026	0.0	discard	10_3_in_5	Parallel run loop
auto	4.8356574757045445	0.0	discard	35_3_in_4	Parallel run loop
auto	1.7415207649601714	0.0	discard	7_3_in_5	Parallel run loop
auto	4.514552048833226	0.0	discard	31_3_in_4	Parallel run loop
auto	2.183893821339898	0.0	discard	11_3_in_5	Parallel run loop
auto	4.78476933174566	0.0	discard	46_3_in_5	Parallel run loop
auto	4.268587741580303	0.0	discard	28_3_in_4	Parallel run loop
auto	4.598548026375041	0.0	discard	32_3_in_4	Parallel run loop
auto	4.071962073008152	0.0	discard	36_3_in_5	Parallel run loop
auto	2.8222635662949314	0.0	discard	18_3_in_5	Parallel run loop
auto	2.731558116466453	0.0	discard	17_3_in_5	Parallel run loop
auto	3.81843422417986	0.0	discard	32_3_in_5	Parallel run loop
auto	4.018439941585873	0.0	discard	35_3_in_5	Parallel run loop
auto	5.460261284341275	0.0	discard	43_3_in_4	Parallel run loop
auto	4.439610403428946	0.0	discard	30_3_in_4	Parallel run loop
auto	4.571754177952527	0.0	discard	43_3_in_5	Parallel run loop
auto	2.8662106129659572	0.0	discard	13_3_in_4	Parallel run loop
auto	3.5759105743067243	0.0	discard	20_3_in_4	Parallel run loop
auto	2.2803080573738663	0.0	discard	12_3_in_5	Parallel run loop
auto	4.251863033089138	0.0	discard	39_3_in_5	Parallel run loop
auto	4.324979089931072	0.0	discard	40_3_in_5	Parallel run loop
auto	3.271166409171745	0.0	discard	24_3_in_5	Parallel run loop
auto	2.88678539671154	0.0	discard	19_3_in_5	Parallel run loop
auto	4.411744275808032	0.0	discard	41_3_in_5	Parallel run loop
auto	3.1351229611765863	0.0	discard	22_3_in_5	Parallel run loop
auto	3.060998858846869	0.0	discard	21_3_in_5	Parallel run loop
auto	3.6233366617445477	0.0	discard	29_3_in_5	Parallel run loop
auto	5.190176924647033	0.0	discard	40_3_in_4	Parallel run loop
auto	3.4844145716290655	0.0	discard	19_3_in_4	Parallel run loop
auto	4.196069021928795	0.0	discard	27_3_in_4	Parallel run loop
auto	2.0821191763262616	0.0	discard	10_3_in_5	Parallel run loop
auto	1.7419932159854945	0.0	discard	7_3_in_5	Parallel run loop
auto	5.074008573784659	0.0	discard	50_3_in_5	Parallel run loop
auto	2.6457006202621174	0.0	discard	16_3_in_5	Parallel run loop
auto	5.693119415654939	0.0	discard	46_3_in_4	Parallel run loop
auto	2.1841146507447835	0.0	discard	11_3_in_5	Parallel run loop
auto	5.2939218827705234	0.0	discard	41_3_in_4	Parallel run loop
auto	4.9059088899160805	0.0	discard	36_3_in_4	Parallel run loop
auto	4.6411339058892755	0.0	discard	33_3_in_4	Parallel run loop
auto	4.475659542793828	0.0	discard	42_3_in_5	Parallel run loop
auto	3.817681924871734	0.0	discard	32_3_in_5	Parallel run loop
auto	4.281093570670077	0.0	discard	28_3_in_4	Parallel run loop
auto	4.0809361345819575	0.0	discard	36_3_in_5	Parallel run loop
auto	4.3602838122487	0.0	discard	29_3_in_4	Parallel run loop
auto	4.1489274859009	0.0	discard	37_3_in_5	Parallel run loop
auto	4.629760027579935	0.0	discard	44_3_in_5	Parallel run loop
auto	3.572288379360089	0.0	discard	20_3_in_4	Parallel run loop
auto	5.4131224436245455	0.0	discard	42_3_in_4	Parallel run loop
auto	4.1192213713208155	0.0	discard	26_3_in_4	Parallel run loop
auto	4.279368530683067	0.0	discard	39_3_in_5	Parallel run loop
auto	4.358696763592145	0.0	discard	40_3_in_5	Parallel run loop
auto	2.2809279845580077	0.0	discard	12_3_in_5	Parallel run loop
auto	3.8725577569305547	0.0	discard	33_3_in_5	Parallel run loop
auto	2.8826966483354357	0.0	discard	19_3_in_5	Parallel run loop
auto	3.2810970527088337	0.0	discard	24_3_in_5	Parallel run loop
auto	3.0571754634205064	0.0	discard	21_3_in_5	Parallel run loop
auto	4.86384879349316	0.0	discard	47_3_in_5	Parallel run loop
auto	4.413955217043453	0.0	discard	41_3_in_5	Parallel run loop
auto	4.9404894491967974	0.0	discard	48_3_in_5	Parallel run loop
auto	3.9545517518977547	0.0	discard	24_3_in_4	Parallel run loop
auto	2.377508670606009	0.0	discard	13_3_in_5	Parallel run loop
auto	5.206555851259065	0.0	discard	40_3_in_4	Parallel run loop
auto	5.165226492893488	0.0	discard	39_3_in_4	Parallel run loop
auto	3.77799127439452	0.0	discard	22_3_in_4	Parallel run loop
auto	1.9747824662578153	0.0	discard	9_3_in_5	Parallel run loop
auto	3.2122189994552794	0.0	discard	23_3_in_5	Parallel run loop
auto	4.674562777471559	0.0	discard	33_3_in_4	Parallel run loop
auto	5.30473040049928	0.0	discard	41_3_in_4	Parallel run loop
auto	4.036468131443764	0.0	discard	25_3_in_4	Parallel run loop
auto	5.79179118342406	0.0	discard	46_3_in_4	Parallel run loop
auto	3.4856330327562572	0.0	discard	27_3_in_5	Parallel run loop
auto	4.1645405298553575	0.0	discard	38_3_in_5	Parallel run loop
auto	3.850514360725151	0.0	discard	23_3_in_4	Parallel run loop
auto	3.575151928896123	0.0	discard	20_3_in_4	Parallel run loop
auto	4.0674621640672	0.0	discard	36_3_in_5	Parallel run loop
auto	3.3874088657941024	0.0	discard	18_3_in_4	Parallel run loop
auto	3.6899088128478943	0.0	discard	30_3_in_5	Parallel run loop
auto	1.4751750784962074	0.0	discard	5_3_in_5	Parallel run loop
auto	1.6123349311755402	0.0	discard	6_3_in_5	Parallel run loop
auto	2.2806073138286824	0.0	discard	12_3_in_5	Parallel run loop
auto	4.435889143902954	0.0	discard	30_3_in_4	Parallel run loop
auto	3.559362302843549	0.0	discard	28_3_in_5	Parallel run loop
auto	4.505418045099399	0.0	discard	31_3_in_4	Parallel run loop
auto	4.007413326781681	0.0	discard	35_3_in_5	Parallel run loop
auto	2.8894685709163253	0.0	discard	19_3_in_5	Parallel run loop
auto	3.868769313015618	0.0	keep	33_3_in_5	Parallel run loop
auto	5.389963646300245	0.0	discard	43_3_in_4	Parallel run loop
auto	4.743602971811189	0.0	discard	34_3_in_4	Parallel run loop
auto	3.0625876369690115	0.0	discard	21_3_in_5	Parallel run loop
auto	3.493875333594783	0.0	discard	19_3_in_4	Parallel run loop
auto	4.982934915765285	0.0	discard	49_3_in_5	Parallel run loop
auto	3.646231398268579	0.0	keep	21_3_in_4	Parallel run loop
auto	5.78654289126928	0.0	discard	47_3_in_4	Parallel run loop
auto	3.1382685077260475	0.0	discard	22_3_in_5	Parallel run loop
auto	1.9772534141051405	0.0	discard	9_3_in_5	Parallel run loop
auto	5.05461090924511	0.0	discard	50_3_in_5	Parallel run loop
auto	5.207599733118786	0.0	discard	40_3_in_4	Parallel run loop
auto	3.492659412346524	0.0	discard	27_3_in_5	Parallel run loop
auto	5.451741682275354	0.0	keep	44_3_in_4	Parallel run loop
auto	3.212700678110059	0.0	discard	23_3_in_5	Parallel run loop
auto	3.846153469303986	0.0	discard	23_3_in_4	Parallel run loop
auto	5.334929179970105	0.0	discard	41_3_in_4	Parallel run loop
auto	4.195366965510294	0.0	discard	38_3_in_5	Parallel run loop
auto	2.643546376247839	0.0	discard	16_3_in_5	Parallel run loop
auto	4.508972897193636	0.0	discard	31_3_in_4	Parallel run loop
auto	4.071962073008152	0.0	discard	36_3_in_5	Parallel run loop
auto	3.5808091393914734	0.0	discard	20_3_in_4	Parallel run loop
auto	4.887083269878941	0.0	discard	36_3_in_4	Parallel run loop
auto	4.444243819400646	0.0	discard	42_3_in_5	Parallel run loop
auto	4.436279472714789	0.0	discard	30_3_in_4	Parallel run loop
auto	4.111554606387928	0.0	discard	26_3_in_4	Parallel run loop
auto	1.6123349404930138	0.0	discard	6_3_in_5	Parallel run loop
auto	3.866380038900737	0.0	keep	33_3_in_5	Parallel run loop
auto	5.476238526583793	0.0	discard	43_3_in_4	Parallel run loop
auto	1.8622712516004014	0.0	discard	8_3_in_5	Parallel run loop
auto	5.652418798180223	0.0	discard	45_3_in_4	Parallel run loop
auto	2.281294553869479	0.0	discard	12_3_in_5	Parallel run loop
auto	4.01622747508889	0.0	discard	35_3_in_5	Parallel run loop
auto	2.891455352538851	0.0	discard	19_3_in_5	Parallel run loop
auto	4.358721688932929	0.0	discard	29_3_in_4	Parallel run loop
auto	3.49006984953912	0.0	discard	19_3_in_4	Parallel run loop
auto	5.832794610956101	0.0	discard	47_3_in_4	Parallel run loop
auto	3.680975198549013	0.0	discard	21_3_in_4	Parallel run loop
auto	4.622926771052484	0.0	discard	44_3_in_5	Parallel run loop
auto	4.993353246517228	0.0	discard	49_3_in_5	Parallel run loop
auto	5.042365929223363	0.0	discard	50_3_in_5	Parallel run loop
auto	4.738640958789499	0.0	discard	47_3_in_5	Parallel run loop
auto	5.0669125228716725	0.0	discard	38_3_in_4	Parallel run loop
auto	5.406674477458217	0.0	keep	44_3_in_4	Parallel run loop
auto	3.860276001759022	0.0	discard	23_3_in_4	Parallel run loop
auto	4.207172460779992	0.0	discard	38_3_in_5	Parallel run loop
auto	5.235874043839695	0.0	discard	40_3_in_4	Parallel run loop
auto	5.4315682822728135	0.0	discard	42_3_in_4	Parallel run loop
auto	3.426755784703827	0.0	discard	26_3_in_5	Parallel run loop
auto	4.15406646575957	0.0	discard	37_3_in_5	Parallel run loop
auto	4.9494385803528385	0.0	discard	48_3_in_5	Parallel run loop
auto	3.9532690004425874	0.0	discard	24_3_in_4	Parallel run loop
auto	3.5623790669227473	0.0	discard	20_3_in_4	Parallel run loop
auto	4.091871112434221	0.0	discard	36_3_in_5	Parallel run loop
auto	4.82692463847135	0.0	discard	35_3_in_4	Parallel run loop
auto	4.508376054357783	0.0	discard	31_3_in_4	Parallel run loop
auto	5.117032467736828	0.0	discard	39_3_in_4	Parallel run loop
auto	3.943046153654136	0.0	discard	34_3_in_5	Parallel run loop
auto	4.425146962708705	0.0	discard	42_3_in_5	Parallel run loop
auto	5.48543914931965	0.0	discard	43_3_in_4	Parallel run loop
auto	2.3750249889570676	0.0	discard	13_3_in_5	Parallel run loop
auto	3.8666830287052556	0.0	discard	33_3_in_5	Parallel run loop
auto	2.8818512058157086	0.0	discard	19_3_in_5	Parallel run loop
auto	4.578661557786833	0.0	discard	32_3_in_4	Parallel run loop
auto	4.02621268341631	0.0	discard	25_3_in_4	Parallel run loop
auto	2.7255617291228273	0.0	discard	17_3_in_5	Parallel run loop
auto	4.744853285258161	0.0	discard	46_3_in_5	Parallel run loop
auto	4.602574310696887	0.0	discard	44_3_in_5	Parallel run loop
auto	2.8595333441401825	0.0	discard	13_3_in_4	Parallel run loop
auto	3.480422884689182	0.0	discard	19_3_in_4	Parallel run loop
auto	3.75277255192394	0.0	discard	31_3_in_5	Parallel run loop
auto	3.7699701810321264	0.0	discard	22_3_in_4	Parallel run loop
auto	5.5696101560901825	0.0	discard	44_3_in_4	Parallel run loop
auto	4.848533125673035	0.0	discard	47_3_in_5	Parallel run loop
auto	3.6123825259529405	0.0	discard	29_3_in_5	Parallel run loop
auto	4.1995155923476	0.0	discard	27_3_in_4	Parallel run loop
auto	3.863809557841359	0.0	discard	23_3_in_4	Parallel run loop
auto	4.209828242224128	0.0	discard	38_3_in_5	Parallel run loop
auto	3.3864404455649084	0.0	discard	18_3_in_4	Parallel run loop
auto	2.4685619553086386	0.0	discard	14_3_in_5	Parallel run loop
auto	3.6872788352785753	0.0	discard	30_3_in_5	Parallel run loop
auto	3.552810875843176	0.0	discard	28_3_in_5	Parallel run loop
auto	4.509712993197105	0.0	discard	31_3_in_4	Parallel run loop
auto	1.4735928503895597	0.0	discard	5_3_in_5	Parallel run loop
auto	3.5845186051817466	0.0	discard	20_3_in_4	Parallel run loop
auto	4.27923378766094	0.0	discard	28_3_in_4	Parallel run loop
auto	5.136619995315624	0.0	discard	39_3_in_4	Parallel run loop
auto	4.975310221416127	0.0	discard	37_3_in_4	Parallel run loop
auto	3.2823452685099297	0.0	discard	24_3_in_5	Parallel run loop
auto	3.816383470227719	0.0	discard	32_3_in_5	Parallel run loop
auto	2.3766000704740873	0.0	discard	13_3_in_5	Parallel run loop
auto	3.882774804336972	0.0	discard	33_3_in_5	Parallel run loop
auto	4.755190055921902	0.0	discard	34_3_in_4	Parallel run loop
auto	4.476879348922395	0.0	discard	42_3_in_5	Parallel run loop
auto	2.892424517872311	0.0	discard	19_3_in_5	Parallel run loop
auto	4.3858827057273295	0.0	discard	41_3_in_5	Parallel run loop
auto	2.732669765899694	0.0	discard	17_3_in_5	Parallel run loop
auto	4.601673132232768	0.0	discard	32_3_in_4	Parallel run loop
auto	4.6612049519013	0.0	keep	46_3_in_5	Parallel run loop
auto	4.5850689408375365	0.0	discard	44_3_in_5	Parallel run loop
auto	2.967437983415573	0.0	discard	20_3_in_5	Parallel run loop
auto	3.129977040736058	0.0	discard	22_3_in_5	Parallel run loop
auto	3.48449637624217	0.0	discard	19_3_in_4	Parallel run loop
auto	5.559387376791602	0.0	discard	44_3_in_4	Parallel run loop
auto	5.761724730717903	0.0	discard	46_3_in_4	Parallel run loop
auto	4.6576598419425315	0.0	discard	33_3_in_4	Parallel run loop
auto	4.116804367421597	0.0	discard	26_3_in_4	Parallel run loop
auto	4.912422627966543	0.0	discard	36_3_in_4	Parallel run loop
auto	3.6263155137238203	0.0	discard	29_3_in_5	Parallel run loop
auto	4.2017621048419205	0.0	discard	27_3_in_4	Parallel run loop
auto	5.677139475738862	0.0	discard	45_3_in_4	Parallel run loop
auto	2.6367373030476644	0.0	keep	16_3_in_5	Parallel run loop
auto	4.51448350491247	0.0	discard	31_3_in_4	Parallel run loop
auto	3.5617137672291226	0.0	discard	28_3_in_5	Parallel run loop
auto	5.143037194483781	0.0	discard	39_3_in_4	Parallel run loop
auto	3.393398966749288	0.0	discard	18_3_in_4	Parallel run loop
auto	1.8622754562656045	0.0	discard	8_3_in_5	Parallel run loop
auto	2.820111095857613	0.0	discard	18_3_in_5	Parallel run loop
auto	3.3531957920285955	0.0	discard	25_3_in_5	Parallel run loop
auto	5.078565434721058	0.0	discard	38_3_in_4	Parallel run loop
auto	2.376765837768411	0.0	discard	13_3_in_5	Parallel run loop
auto	4.3591354886282865	0.0	discard	29_3_in_4	Parallel run loop
auto	4.4628761120244445	0.0	discard	42_3_in_5	Parallel run loop
auto	4.489891240921304	0.0	discard	43_3_in_5	Parallel run loop
auto	3.803648973994539	0.0	discard	32_3_in_5	Parallel run loop
auto	4.4106555025540235	0.0	discard	41_3_in_5	Parallel run loop
auto	5.897539977815177	0.0	discard	48_3_in_4	Parallel run loop
auto	2.7245269938987366	0.0	discard	17_3_in_5	Parallel run loop
auto	4.128960978773291	0.0	discard	37_3_in_5	Parallel run loop
auto	5.3453865756691465	0.0	discard	42_3_in_4	Parallel run loop
auto	2.9807835976016333	0.0	discard	20_3_in_5	Parallel run loop
auto	4.628025014729158	0.0	discard	44_3_in_5	Parallel run loop
auto	4.748689795728094	0.0	discard	46_3_in_5	Parallel run loop
auto	5.546769429204488	0.0	discard	44_3_in_4	Parallel run loop
auto	5.779377622358351	0.0	discard	46_3_in_4	Parallel run loop
auto	3.424938335349193	0.0	discard	26_3_in_5	Parallel run loop
auto	3.137464478106061	0.0	discard	22_3_in_5	Parallel run loop
auto	4.679666686943143	0.0	discard	33_3_in_4	Parallel run loop
auto	4.120384885852515	0.0	discard	26_3_in_4	Parallel run loop
auto	4.950019912512329	0.0	discard	48_3_in_5	Parallel run loop
auto	4.791383328746227	0.0	keep	35_3_in_4	Parallel run loop
auto	4.201421673212198	0.0	discard	27_3_in_4	Parallel run loop
auto	2.0820831244428075	0.0	discard	10_3_in_5	Parallel run loop
auto	1.7415210330845958	0.0	discard	7_3_in_5	Parallel run loop
auto	3.344097232457723	0.0	discard	25_3_in_5	Parallel run loop
auto	4.036937436157193	0.0	discard	25_3_in_4	Parallel run loop
auto	2.6477913497549155	0.0	discard	16_3_in_5	Parallel run loop
auto	3.2067599807269036	0.0	discard	23_3_in_5	Parallel run loop
auto	3.953309921494822	0.0	discard	24_3_in_4	Parallel run loop
auto	2.858262513319784	0.0	discard	13_3_in_4	Parallel run loop
auto	1.8622732896880407	0.0	discard	8_3_in_5	Parallel run loop
auto	1.9748300222243127	0.0	discard	9_3_in_5	Parallel run loop
auto	3.770522763395937	0.0	discard	22_3_in_4	Parallel run loop
auto	3.4846818017747183	0.0	discard	27_3_in_5	Parallel run loop
auto	3.953122528865773	0.0	discard	34_3_in_5	Parallel run loop
auto	4.293614540336591	0.0	discard	39_3_in_5	Parallel run loop
auto	3.6845159189482724	0.0	discard	30_3_in_5	Parallel run loop
auto	3.7529989987189962	0.0	discard	31_3_in_5	Parallel run loop
auto	5.342232480164682	0.0	discard	42_3_in_4	Parallel run loop
auto	4.4614492623128905	0.0	discard	42_3_in_5	Parallel run loop
auto	2.7261661307949536	0.0	discard	17_3_in_5	Parallel run loop
auto	3.818753300532484	0.0	discard	32_3_in_5	Parallel run loop
auto	2.9784868238567364	0.0	discard	20_3_in_5	Parallel run loop
