commit	score	memory_gb	status	problem	description
auto	4.458334011739209	0.0	discard	14_TAN_in_3	Parallel run loop
auto	5.014904097593316	0.0	keep	18_TAN_in_3	Parallel run loop
auto	5.09256484200645	0.0	discard	25_3_in_tan	Parallel run loop
auto	2.464327940923231	0.0	discard	17_TAN_in_5	Parallel run loop
auto	1.5732939353497315	0.0	discard	19_TAN_in_8	Parallel run loop
auto	1.6428236255252964	0.0	discard	13_tan_in_cir	Parallel run loop
auto	1.9581643987272404	0.0	discard	19_tan_in_cir	Parallel run loop
auto	3.953214486372643	0.0	discard	11_TAN_in_3	Parallel run loop
auto	2.0793724207444617	0.0	discard	12_TAN_in_5	Parallel run loop
auto	1.6997701539863892	0.0	discard	12_TAN_in_6	Parallel run loop
auto	2.17181903299086	0.0	discard	20_TAN_in_6	Parallel run loop
auto	2.6342069352672097	0.0	keep	12_TAN_in_4	Parallel run loop
auto	2.280044846762315	0.0	discard	22_TAN_in_6	Parallel run loop
auto	2.410961767276158	0.0	discard	16_TAN_in_5	Parallel run loop
auto	5.442485306082487	0.0	discard	29_3_in_tan	Parallel run loop
auto	2.156823081993509	0.0	discard	13_TAN_in_5	Parallel run loop
auto	5.205056669949855	0.0	discard	19_TAN_in_3	Parallel run loop
auto	2.011416792345298	0.0	discard	17_TAN_in_6	Parallel run loop
auto	4.925191236308676	0.0	discard	17_TAN_in_3	Parallel run loop
auto	5.530029708238954	0.0	keep	30_3_in_tan	Parallel run loop
auto	4.729939375857578	0.0	discard	16_TAN_in_3	Parallel run loop
auto	2.7787972337337923	0.0	discard	22_TAN_in_5	Parallel run loop
auto	4.791877970190121	0.0	discard	22_3_in_tan	Parallel run loop
auto	4.596145846161481	0.0	keep	15_TAN_in_3	Parallel run loop
auto	1.4166353129838822	0.0	keep	16_TAN_in_8	Parallel run loop
auto	2.6203594133854033	0.0	discard	19_TAN_in_5	Parallel run loop
auto	2.414295188613044	0.0	discard	10_TAN_in_4	Parallel run loop
auto	1.6625369471849296	0.0	discard	9_TAN_in_DOMINO	Parallel run loop
auto	1.9429535794459345	0.0	discard	16_TAN_in_6	Parallel run loop
auto	5.579273614802213	0.0	discard	22_TAN_in_3	Parallel run loop
auto	4.849108326872425	0.0	keep	23_3_in_tan	Parallel run loop
auto	1.7469697583493138	0.0	discard	15_tan_in_cir	Parallel run loop
auto	2.048160026957283	0.0	keep	18_TAN_in_6	Parallel run loop
auto	1.9306415390194804	0.0	discard	18_tan_in_cir	Parallel run loop
auto	1.5924915979279013	0.0	discard	20_TAN_in_8	Parallel run loop
auto	2.5368990553514283	0.0	discard	18_TAN_in_5	Parallel run loop
auto	1.8309941025580165	0.0	discard	14_TAN_in_6	Parallel run loop
auto	2.2023815086640464	0.0	keep	21_TAN_in_6	Parallel run loop
auto	5.12744046544915	0.0	discard	26_3_in_tan	Parallel run loop
auto	1.7678033112569898	0.0	discard	13_TAN_in_6	Parallel run loop
auto	1.6590557691518022	0.0	keep	14_tan_in_cir	Parallel run loop
auto	4.203884294940956	0.0	keep	13_TAN_in_3	Parallel run loop
auto	2.6697872839424672	0.0	discard	20_TAN_in_5	Parallel run loop
auto	2.708856093603248	0.0	discard	21_TAN_in_5	Parallel run loop
auto	5.271509368145633	0.0	discard	27_3_in_tan	Parallel run loop
auto	5.043627019169879	0.0	discard	18_TAN_in_3	Parallel run loop
auto	2.1273520467429257	0.0	discard	19_TAN_in_6	Parallel run loop
auto	1.1781111424922206	0.0	keep	11_TAN_in_8	Parallel run loop
auto	1.8869784493445263	0.0	discard	15_TAN_in_6	Parallel run loop
auto	2.469872431236893	0.0	discard	17_TAN_in_5	Parallel run loop
auto	1.8147572439899666	0.0	discard	11_TAN_in_DOMINO	Parallel run loop
auto	5.172443270140055	0.0	discard	19_TAN_in_3	Parallel run loop
auto	1.137270275289659	0.0	discard	10_TAN_in_8	Parallel run loop
auto	4.118261553339798	0.0	discard	12_TAN_in_3	Parallel run loop
auto	1.4601428290798446	0.0	keep	17_TAN_in_8	Parallel run loop
auto	4.924508458238648	0.0	discard	17_TAN_in_3	Parallel run loop
auto	1.5506647830625093	0.0	keep	19_TAN_in_8	Parallel run loop
auto	2.6203594133854033	0.0	discard	19_TAN_in_5	Parallel run loop
auto	5.482847229544296	0.0	discard	21_TAN_in_3	Parallel run loop
auto	4.456953042166902	0.0	keep	14_TAN_in_3	Parallel run loop
auto	1.975438014399217	0.0	discard	13_TAN_in_DOMINO	Parallel run loop
auto	3.9293059446388674	0.0	discard	11_TAN_in_3	Parallel run loop
auto	5.442485306082487	0.0	discard	29_3_in_tan	Parallel run loop
auto	2.7941704269987713	0.0	discard	13_TAN_in_4	Parallel run loop
auto	2.271197774333372	0.0	discard	14_TAN_in_5	Parallel run loop
auto	5.268057457356338	0.0	keep	20_TAN_in_3	Parallel run loop
auto	2.172515086050362	0.0	discard	20_TAN_in_6	Parallel run loop
auto	5.488162304004834	0.0	keep	30_3_in_tan	Parallel run loop
auto	2.6888894750600048	0.0	discard	12_TAN_in_4	Parallel run loop
auto	4.758119941179373	0.0	discard	16_TAN_in_3	Parallel run loop
auto	2.275345452557366	0.0	discard	22_TAN_in_6	Parallel run loop
auto	4.596145846161481	0.0	discard	15_TAN_in_3	Parallel run loop
auto	2.7787972337337923	0.0	discard	22_TAN_in_5	Parallel run loop
auto	1.4113379343298378	0.0	keep	16_TAN_in_8	Parallel run loop
auto	1.9888834036676595	0.0	keep	17_TAN_in_6	Parallel run loop
auto	1.7469697583493138	0.0	discard	15_tan_in_cir	Parallel run loop
auto	2.2209923788581665	0.0	discard	21_TAN_in_6	Parallel run loop
auto	5.12744046544915	0.0	discard	26_3_in_tan	Parallel run loop
auto	5.548371661047709	0.0	keep	22_TAN_in_3	Parallel run loop
auto	1.5970633799429717	0.0	discard	20_TAN_in_8	Parallel run loop
auto	1.649054526430567	0.0	discard	9_TAN_in_DOMINO	Parallel run loop
auto	2.0669004761025747	0.0	discard	18_TAN_in_6	Parallel run loop
auto	2.5375758379822186	0.0	discard	18_TAN_in_5	Parallel run loop
auto	1.299137555345613	0.0	discard	13_TAN_in_8	Parallel run loop
auto	1.1399533318636597	0.0	discard	10_TAN_in_8	Parallel run loop
auto	5.033389142333856	0.0	discard	18_TAN_in_3	Parallel run loop
auto	1.249366653376161	0.0	keep	12_TAN_in_8	Parallel run loop
auto	2.1182040115477774	0.0	keep	19_TAN_in_6	Parallel run loop
auto	1.394980441844894	0.0	discard	15_TAN_in_8	Parallel run loop
auto	1.9594629344253647	0.0	discard	16_TAN_in_6	Parallel run loop
auto	2.0001616407760103	0.0	keep	14_TAN_in_DOMINO	Parallel run loop
auto	1.704515454312962	0.0	discard	14_tan_in_cir	Parallel run loop
auto	2.7382361094667367	0.0	discard	21_TAN_in_5	Parallel run loop
auto	1.8869784493445263	0.0	discard	15_TAN_in_6	Parallel run loop
auto	2.4204410687672877	0.0	discard	10_TAN_in_4	Parallel run loop
auto	4.29090945920537	0.0	discard	13_TAN_in_3	Parallel run loop
auto	1.8314591832860605	0.0	discard	14_TAN_in_6	Parallel run loop
auto	1.548022063259148	0.0	keep	19_TAN_in_8	Parallel run loop
auto	4.462618174279335	0.0	discard	14_TAN_in_3	Parallel run loop
auto	2.469872431236893	0.0	discard	17_TAN_in_5	Parallel run loop
auto	5.423048127583488	0.0	discard	21_TAN_in_3	Parallel run loop
auto	5.322553130781406	0.0	discard	20_TAN_in_3	Parallel run loop
auto	2.1647660274754026	0.0	discard	20_TAN_in_6	Parallel run loop
auto	4.899588578872381	0.0	discard	17_TAN_in_3	Parallel run loop
auto	1.975438014399217	0.0	discard	13_TAN_in_DOMINO	Parallel run loop
auto	3.3825725227330152	0.0	keep	10_tan_in_tan	Parallel run loop
auto	5.54349632176914	0.0	discard	30_3_in_tan	Parallel run loop
auto	1.4855958552122908	0.0	discard	17_TAN_in_8	Parallel run loop
auto	2.788009203488962	0.0	keep	13_TAN_in_4	Parallel run loop
auto	2.270834691886802	0.0	discard	22_TAN_in_6	Parallel run loop
auto	5.205056669949855	0.0	discard	19_TAN_in_3	Parallel run loop
auto	2.650130997903412	0.0	discard	12_TAN_in_4	Parallel run loop
auto	1.8137461532297416	0.0	keep	11_TAN_in_DOMINO	Parallel run loop
auto	2.7787972337337923	0.0	discard	22_TAN_in_5	Parallel run loop
auto	2.012611918943223	0.0	discard	17_TAN_in_6	Parallel run loop
auto	1.5975465378831686	0.0	discard	20_TAN_in_8	Parallel run loop
auto	2.0669004761025747	0.0	discard	18_TAN_in_6	Parallel run loop
auto	2.3409733523023433	0.0	discard	9_TAN_in_4	Parallel run loop
auto	3.3827149767139484	0.0	discard	19_TAN_in_4	Parallel run loop
auto	1.249366653376161	0.0	discard	12_TAN_in_8	Parallel run loop
auto	2.227370465652023	0.0	discard	21_TAN_in_6	Parallel run loop
auto	2.869504005669321	0.0	discard	14_TAN_in_4	Parallel run loop
auto	5.575236821765902	0.0	discard	22_TAN_in_3	Parallel run loop
auto	1.2991492803782665	0.0	discard	13_TAN_in_8	Parallel run loop
auto	1.4166353129838822	0.0	discard	16_TAN_in_8	Parallel run loop
auto	1.8961722889913053	0.0	keep	12_TAN_in_DOMINO	Parallel run loop
auto	4.624266254154281	0.0	discard	15_TAN_in_3	Parallel run loop
auto	5.033389142333856	0.0	discard	18_TAN_in_3	Parallel run loop
auto	3.996780034142966	0.0	discard	14_tan_in_tan	Parallel run loop
auto	1.704515454312962	0.0	discard	14_tan_in_cir	Parallel run loop
auto	3.8297830742505394	0.0	discard	13_tan_in_tan	Parallel run loop
auto	2.328606577893243	0.0	discard	18_TAN_in_DOMINO	Parallel run loop
auto	2.124164524801941	0.0	discard	19_TAN_in_6	Parallel run loop
auto	1.3947941201740044	0.0	discard	15_TAN_in_8	Parallel run loop
auto	2.0001616407760103	0.0	discard	14_TAN_in_DOMINO	Parallel run loop
auto	3.5269390254703743	0.0	keep	21_TAN_in_4	Parallel run loop
auto	2.2767743438012964	0.0	discard	17_TAN_in_DOMINO	Parallel run loop
auto	2.5979250474192463	0.0	discard	11_TAN_in_4	Parallel run loop
auto	5.383325754366961	0.0	keep	21_TAN_in_3	Parallel run loop
auto	5.341156803837438	0.0	discard	20_TAN_in_3	Parallel run loop
auto	2.9933444107925555	0.0	discard	15_TAN_in_4	Parallel run loop
auto	1.3472497713648832	0.0	keep	14_TAN_in_8	Parallel run loop
auto	1.5610214478396733	0.0	discard	19_TAN_in_8	Parallel run loop
auto	3.426053936045635	0.0	discard	11_tan_in_tan	Parallel run loop
auto	1.5111650071988247	0.0	discard	18_TAN_in_8	Parallel run loop
auto	1.9530737977030248	0.0	keep	13_TAN_in_DOMINO	Parallel run loop
auto	3.499812265669138	0.0	discard	20_TAN_in_4	Parallel run loop
auto	3.6401139140955783	0.0	discard	22_TAN_in_4	Parallel run loop
auto	2.31480741228784	0.0	keep	9_TAN_in_4	Parallel run loop
auto	2.8015886210718834	0.0	discard	13_TAN_in_4	Parallel run loop
auto	3.7049882304197026	0.0	discard	23_TAN_in_4	Parallel run loop
auto	2.6888894750600048	0.0	discard	12_TAN_in_4	Parallel run loop
auto	4.960498352873478	0.0	keep	21_tan_in_tan	Parallel run loop
auto	5.194733108609969	0.0	discard	19_TAN_in_3	Parallel run loop
auto	5.230325798749392	0.0	discard	23_tan_in_tan	Parallel run loop
auto	2.2526785708962813	0.0	keep	22_TAN_in_6	Parallel run loop
auto	3.388188646693066	0.0	discard	10_tan_in_tan	Parallel run loop
auto	3.7075022718468476	0.0	discard	12_tan_in_tan	Parallel run loop
auto	1.4780442999042835	0.0	discard	17_TAN_in_8	Parallel run loop
auto	1.8147572439899666	0.0	discard	11_TAN_in_DOMINO	Parallel run loop
auto	1.6897910934252705	0.0	discard	14_tan_in_cir	Parallel run loop
auto	1.249366653376161	0.0	discard	12_TAN_in_8	Parallel run loop
auto	2.0226905037341876	0.0	discard	14_TAN_in_DOMINO	Parallel run loop
auto	1.4382574620017936	0.0	discard	16_TAN_in_8	Parallel run loop
auto	1.3944256868048175	0.0	discard	15_TAN_in_8	Parallel run loop
auto	5.575236821765902	0.0	discard	22_TAN_in_3	Parallel run loop
auto	1.9114795111165137	0.0	discard	12_TAN_in_DOMINO	Parallel run loop
auto	4.5973714683870694	0.0	discard	15_TAN_in_3	Parallel run loop
auto	1.3088748195092579	0.0	discard	13_TAN_in_8	Parallel run loop
auto	3.378371973257291	0.0	discard	19_TAN_in_4	Parallel run loop
auto	3.2361318374978794	0.0	discard	17_TAN_in_4	Parallel run loop
auto	5.061364014876742	0.0	keep	22_tan_in_tan	Parallel run loop
auto	5.440983472878987	0.0	discard	21_TAN_in_3	Parallel run loop
auto	1.9700145622744452	0.0	discard	13_TAN_in_DOMINO	Parallel run loop
auto	3.5315396815563225	0.0	discard	21_TAN_in_4	Parallel run loop
auto	2.284205973116984	0.0	discard	17_TAN_in_DOMINO	Parallel run loop
auto	2.9022091280851936	0.0	discard	14_TAN_in_4	Parallel run loop
auto	2.3145366438435415	0.0	keep	18_TAN_in_DOMINO	Parallel run loop
auto	4.039420591262889	0.0	discard	14_tan_in_tan	Parallel run loop
auto	1.5633843609845828	0.0	discard	19_TAN_in_8	Parallel run loop
auto	3.8301434593748436	0.0	discard	13_tan_in_tan	Parallel run loop
auto	3.794111626387144	0.0	discard	24_TAN_in_4	Parallel run loop
auto	2.8045282773416518	0.0	discard	13_TAN_in_4	Parallel run loop
auto	2.318007271926879	0.0	discard	9_TAN_in_4	Parallel run loop
auto	3.444901421912655	0.0	keep	20_TAN_in_4	Parallel run loop
auto	1.3570176538838403	0.0	discard	14_TAN_in_8	Parallel run loop
auto	2.5770527532847085	0.0	keep	11_TAN_in_4	Parallel run loop
auto	1.49961103630296	0.0	discard	18_TAN_in_8	Parallel run loop
auto	3.703833397155411	0.0	discard	23_TAN_in_4	Parallel run loop
auto	5.339561170256563	0.0	discard	20_TAN_in_3	Parallel run loop
auto	3.6423431828691646	0.0	discard	22_TAN_in_4	Parallel run loop
auto	3.426053936045635	0.0	discard	11_tan_in_tan	Parallel run loop
auto	2.991719112071836	0.0	discard	15_TAN_in_4	Parallel run loop
auto	1.461967250412265	0.0	discard	17_TAN_in_8	Parallel run loop
auto	4.7544306650455015	0.0	discard	19_tan_in_tan	Parallel run loop
auto	4.399292678920288	0.0	discard	17_tan_in_tan	Parallel run loop
auto	4.84489667983717	0.0	keep	21_tan_in_tan	Parallel run loop
auto	5.214208036606882	0.0	keep	23_tan_in_tan	Parallel run loop
auto	3.6964589961578596	0.0	keep	12_tan_in_tan	Parallel run loop
auto	4.818744660060775	0.0	discard	20_tan_in_tan	Parallel run loop
auto	3.3825725227330152	0.0	discard	10_tan_in_tan	Parallel run loop
auto	3.202154379422382	0.0	discard	17_TAN_in_4	Parallel run loop
auto	4.607280376600179	0.0	discard	15_TAN_in_3	Parallel run loop
auto	5.367302508462981	0.0	discard	24_tan_in_tan	Parallel run loop
auto	1.704515454312962	0.0	discard	14_tan_in_cir	Parallel run loop
auto	5.061364014876742	0.0	discard	22_tan_in_tan	Parallel run loop
auto	2.0001616407760103	0.0	discard	14_TAN_in_DOMINO	Parallel run loop
auto	1.8147572439899666	0.0	discard	11_TAN_in_DOMINO	Parallel run loop
auto	5.577969087627246	0.0	discard	22_TAN_in_3	Parallel run loop
auto	4.186275133630474	0.0	discard	15_tan_in_tan	Parallel run loop
auto	3.346592009387839	0.0	keep	19_TAN_in_4	Parallel run loop
auto	1.249366653376161	0.0	discard	12_TAN_in_8	Parallel run loop
auto	1.2670519737762191	0.0	keep	13_TAN_in_8	Parallel run loop
auto	1.3947941201740044	0.0	discard	15_TAN_in_8	Parallel run loop
auto	1.89165931459218	0.0	keep	12_TAN_in_DOMINO	Parallel run loop
auto	2.328606577893243	0.0	discard	18_TAN_in_DOMINO	Parallel run loop
auto	0.9898812646259407	0.0	discard	7_TAN_in_8	Parallel run loop
auto	5.525480528595993	0.0	keep	26_tan_in_tan	Parallel run loop
auto	3.5120361434220078	0.0	keep	21_TAN_in_4	Parallel run loop
auto	2.896082986023826	0.0	discard	14_TAN_in_4	Parallel run loop
auto	3.829047190632061	0.0	discard	13_tan_in_tan	Parallel run loop
auto	2.2683867699156797	0.0	discard	17_TAN_in_DOMINO	Parallel run loop
auto	3.999803875767271	0.0	discard	14_tan_in_tan	Parallel run loop
auto	5.610107013670145	0.0	discard	27_tan_in_tan	Parallel run loop
auto	3.755374751198293	0.0	keep	24_TAN_in_4	Parallel run loop
auto	1.340124408330758	0.0	keep	14_TAN_in_8	Parallel run loop
auto	3.4414580562193167	0.0	keep	20_TAN_in_4	Parallel run loop
auto	2.31480741228784	0.0	discard	9_TAN_in_4	Parallel run loop
auto	3.6401139140955783	0.0	discard	22_TAN_in_4	Parallel run loop
auto	11.843471290376822	0.0	discard	20_6_in_TAN	Parallel run loop
auto	3.7049882304197026	0.0	discard	23_TAN_in_4	Parallel run loop
auto	2.5890379805710304	0.0	discard	11_TAN_in_4	Parallel run loop
auto	1.504445432052292	0.0	discard	18_TAN_in_8	Parallel run loop
auto	1.0949358415689194	0.0	discard	9_TAN_in_8	Parallel run loop
auto	3.194898348931776	0.0	discard	17_TAN_in_4	Parallel run loop
auto	7.418029515246066	0.0	discard	22_4_in_tan	Parallel run loop
auto	4.803607140698829	0.0	keep	20_tan_in_tan	Parallel run loop
auto	3.426053936045635	0.0	discard	11_tan_in_tan	Parallel run loop
auto	3.41439868078353	0.0	discard	10_tan_in_tan	Parallel run loop
auto	4.399292678920288	0.0	discard	17_tan_in_tan	Parallel run loop
auto	5.214208036606882	0.0	discard	23_tan_in_tan	Parallel run loop
auto	2.9926429256427474	0.0	discard	15_TAN_in_4	Parallel run loop
auto	5.278272430091416	0.0	keep	24_tan_in_tan	Parallel run loop
auto	3.6964589961578596	0.0	discard	12_tan_in_tan	Parallel run loop
auto	4.74538125354535	0.0	discard	19_tan_in_tan	Parallel run loop
auto	1.5105941147975273	0.0	discard	11_tan_in_cir	Parallel run loop
auto	5.03070692226687	0.0	discard	21_tan_in_tan	Parallel run loop
auto	1.242996652098017	0.0	keep	12_TAN_in_8	Parallel run loop
auto	4.1627085863223146	0.0	keep	15_tan_in_tan	Parallel run loop
auto	3.8261762018954926	0.0	discard	13_tan_in_tan	Parallel run loop
auto	8.417746278457562	0.0	discard	14_DOMINO_in_TAN	Parallel run loop
auto	1.299137555345613	0.0	discard	13_TAN_in_8	Parallel run loop
auto	3.9911128767254778	0.0	discard	14_tan_in_tan	Parallel run loop
auto	0.9898812646259407	0.0	discard	7_TAN_in_8	Parallel run loop
auto	1.89165931459218	0.0	discard	12_TAN_in_DOMINO	Parallel run loop
auto	5.086839644174709	0.0	discard	22_tan_in_tan	Parallel run loop
auto	8.966214411204323	0.0	discard	16_DOMINO_in_TAN	Parallel run loop
auto	2.869504005669321	0.0	discard	14_TAN_in_4	Parallel run loop
auto	3.4698634133921082	0.0	keep	21_TAN_in_4	Parallel run loop
auto	3.3248512069170397	0.0	keep	19_TAN_in_4	Parallel run loop
auto	1.8977361788735476	0.0	discard	10_TAN_in_5	Parallel run loop
auto	2.328606577893243	0.0	discard	18_TAN_in_DOMINO	Parallel run loop
auto	5.555438087005534	0.0	discard	26_tan_in_tan	Parallel run loop
auto	2.240195984105561	0.0	discard	17_TAN_in_DOMINO	Parallel run loop
auto	2.0001616407760103	0.0	discard	14_TAN_in_DOMINO	Parallel run loop
auto	2.5979250474192463	0.0	discard	11_TAN_in_4	Parallel run loop
auto	5.610107013670145	0.0	discard	27_tan_in_tan	Parallel run loop
auto	1.9876146945680135	0.0	discard	11_TAN_in_5	Parallel run loop
auto	3.194898348931776	0.0	discard	17_TAN_in_4	Parallel run loop
auto	3.629799723000234	0.0	discard	22_TAN_in_4	Parallel run loop
auto	4.818744660060775	0.0	discard	20_tan_in_tan	Parallel run loop
auto	3.7049882304197026	0.0	discard	23_TAN_in_4	Parallel run loop
auto	1.0904711599848518	0.0	discard	9_TAN_in_8	Parallel run loop
auto	11.843471290376822	0.0	discard	20_6_in_TAN	Parallel run loop
auto	1.3473195291947468	0.0	discard	6_TAN_in_DOMINO	Parallel run loop
auto	2.332977001680557	0.0	discard	9_TAN_in_4	Parallel run loop
auto	1.527939558401611	0.0	discard	18_TAN_in_8	Parallel run loop
auto	3.7946345469513307	0.0	discard	24_TAN_in_4	Parallel run loop
auto	1.3382975376010209	0.0	keep	14_TAN_in_8	Parallel run loop
auto	3.4515188781164845	0.0	discard	20_TAN_in_4	Parallel run loop
auto	2.0747820758343685	0.0	discard	12_TAN_in_5	Parallel run loop
auto	5.239609749535521	0.0	discard	23_tan_in_tan	Parallel run loop
auto	1.7617272846212837	0.0	keep	16_tan_in_cir	Parallel run loop
auto	3.009348557252171	0.0	discard	15_TAN_in_4	Parallel run loop
auto	5.035457001996874	0.0	discard	21_tan_in_tan	Parallel run loop
auto	1.6997701539863892	0.0	discard	12_TAN_in_6	Parallel run loop
auto	3.7075022718468476	0.0	discard	12_tan_in_tan	Parallel run loop
auto	5.317148710025486	0.0	discard	24_tan_in_tan	Parallel run loop
auto	8.417746278457562	0.0	discard	14_DOMINO_in_TAN	Parallel run loop
auto	1.9064168941279103	0.0	discard	12_TAN_in_DOMINO	Parallel run loop
auto	4.747138358050049	0.0	discard	19_tan_in_tan	Parallel run loop
auto	4.399292678920288	0.0	discard	17_tan_in_tan	Parallel run loop
auto	3.426053936045635	0.0	discard	11_tan_in_tan	Parallel run loop
auto	4.170353939963496	0.0	discard	15_tan_in_tan	Parallel run loop
auto	1.504962924277851	0.0	discard	11_tan_in_cir	Parallel run loop
auto	1.9488454577498493	0.0	keep	19_tan_in_cir	Parallel run loop
auto	0.9898812646259407	0.0	discard	7_TAN_in_8	Parallel run loop
auto	3.384225949890745	0.0	discard	19_TAN_in_4	Parallel run loop
auto	5.139798158914161	0.0	discard	26_3_in_tan	Parallel run loop
auto	5.062880344125998	0.0	discard	22_tan_in_tan	Parallel run loop
auto	5.50742494426421	0.0	keep	26_tan_in_tan	Parallel run loop
auto	3.5548448256097123	0.0	discard	21_TAN_in_4	Parallel run loop
auto	1.8977361788735476	0.0	discard	10_TAN_in_5	Parallel run loop
auto	8.961717264371641	0.0	discard	16_DOMINO_in_TAN	Parallel run loop
auto	2.156823081993509	0.0	discard	13_TAN_in_5	Parallel run loop
auto	5.610107013670145	0.0	discard	27_tan_in_tan	Parallel run loop
auto	1.7581535629954326	0.0	discard	15_tan_in_cir	Parallel run loop
auto	1.9876146945680135	0.0	discard	11_TAN_in_5	Parallel run loop
auto	2.603100791538245	0.0	keep	19_TAN_in_5	Parallel run loop
auto	5.460602464788415	0.0	discard	29_3_in_tan	Parallel run loop
auto	4.861804619861772	0.0	discard	23_3_in_tan	Parallel run loop
auto	1.1724880411711587	0.0	keep	11_TAN_in_8	Parallel run loop
auto	1.3473195291947468	0.0	discard	6_TAN_in_DOMINO	Parallel run loop
auto	3.781497644960352	0.0	discard	24_TAN_in_4	Parallel run loop
auto	1.6997701539863892	0.0	discard	12_TAN_in_6	Parallel run loop
auto	1.333398170731198	0.0	keep	14_TAN_in_8	Parallel run loop
auto	3.433534947097662	0.0	keep	20_TAN_in_4	Parallel run loop
auto	4.80621970582685	0.0	discard	20_tan_in_tan	Parallel run loop
auto	1.8219576553935253	0.0	discard	16_tan_in_cir	Parallel run loop
auto	1.0949358415689194	0.0	discard	9_TAN_in_8	Parallel run loop
auto	1.8309941025580165	0.0	discard	14_TAN_in_6	Parallel run loop
auto	2.0669004761025747	0.0	discard	18_TAN_in_6	Parallel run loop
auto	1.892574130407503	0.0	discard	15_TAN_in_6	Parallel run loop
auto	2.7787972337337923	0.0	discard	22_TAN_in_5	Parallel run loop
auto	2.0226071502744825	0.0	discard	17_TAN_in_6	Parallel run loop
auto	2.0913764668033608	0.0	discard	12_TAN_in_5	Parallel run loop
auto	2.172515086050362	0.0	discard	20_TAN_in_6	Parallel run loop
auto	11.820682276697985	0.0	keep	20_6_in_TAN	Parallel run loop
auto	2.464327940923231	0.0	discard	17_TAN_in_5	Parallel run loop
auto	1.8977361788735476	0.0	discard	10_TAN_in_5	Parallel run loop
auto	0.9898812646259407	0.0	discard	7_TAN_in_8	Parallel run loop
auto	1.9488454577498493	0.0	discard	19_tan_in_cir	Parallel run loop
auto	3.566374144512362	0.0	discard	21_TAN_in_4	Parallel run loop
