commit	score	memory_gb	status	problem	description
auto	9.711935082220293	0.0	discard	13_6_in_TAN	Parallel run loop
auto	12.65723687109974	0.0	discard	12_8_in_TAN	Parallel run loop
auto	1.2806341809933837	0.0	discard	4_TAN_in_5	Parallel run loop
auto	12.16139000744225	0.0	discard	17_CIRCLE_in_TAN	Parallel run loop
auto	7.8326848923957355	0.0	keep	13_5_in_TAN	Parallel run loop
auto	13.093800411987209	0.0	discard	20_CIRCLE_in_TAN	Parallel run loop
auto	12.799619338927066	0.0	discard	19_CIRCLE_in_TAN	Parallel run loop
auto	12.55271851177001	0.0	discard	18_CIRCLE_in_TAN	Parallel run loop
auto	8.537188004091725	0.0	discard	10_6_in_TAN	Parallel run loop
auto	2.6389756176142947	0.0	discard	6_3_in_tan	Parallel run loop
auto	3.0744322748224056	0.0	discard	8_3_in_tan	Parallel run loop
auto	0.9257201651728294	0.0	discard	6_TAN_in_8	Parallel run loop
auto	1.13989175549289	0.0	keep	5_TAN_in_6	Parallel run loop
auto	12.361712385842385	0.0	discard	11_8_in_TAN	Parallel run loop
auto	8.472419234749125	0.0	discard	15_5_in_TAN	Parallel run loop
auto	8.18292113792307	0.0	discard	14_5_in_TAN	Parallel run loop
auto	1.1058007189045806	0.0	discard	3_TAN_in_5	Parallel run loop
auto	10.340610768613228	0.0	discard	15_6_in_TAN	Parallel run loop
auto	15.352631895501817	0.0	discard	18_8_in_TAN	Parallel run loop
auto	15.703599971892366	0.0	discard	19_8_in_TAN	Parallel run loop
auto	7.356220861413814	0.0	discard	11_5_in_TAN	Parallel run loop
auto	9.067003345140972	0.0	discard	11_6_in_TAN	Parallel run loop
auto	10.057682434390053	0.0	discard	14_6_in_TAN	Parallel run loop
auto	1.2710691866826518	0.0	discard	7_tan_in_cir	Parallel run loop
auto	10.425000438970166	0.0	discard	12_CIRCLE_in_TAN	Parallel run loop
auto	9.420968794476451	0.0	discard	12_6_in_TAN	Parallel run loop
auto	6.983349989737053	0.0	discard	10_5_in_TAN	Parallel run loop
auto	10.723932220391713	0.0	discard	16_6_in_TAN	Parallel run loop
auto	8.677517351198007	0.0	discard	16_5_in_TAN	Parallel run loop
auto	13.57244125419423	0.0	discard	14_8_in_TAN	Parallel run loop
auto	13.223570199355342	0.0	discard	13_8_in_TAN	Parallel run loop
auto	6.2427324747115325	0.0	discard	7_DOMINO_in_TAN	Parallel run loop
auto	7.545162996877666	0.0	discard	12_5_in_TAN	Parallel run loop
auto	5.657833913032394	0.0	discard	12_4_in_tan	Parallel run loop
auto	11.896847695587084	0.0	discard	16_CIRCLE_in_TAN	Parallel run loop
auto	9.70387788182012	0.0	discard	13_6_in_TAN	Parallel run loop
auto	4.953480532948613	0.0	discard	9_4_in_tan	Parallel run loop
auto	5.2426949496987065	0.0	discard	5_DOMINO_in_TAN	Parallel run loop
auto	14.780689934071507	0.0	discard	17_8_in_TAN	Parallel run loop
auto	1.3015884503782176	0.0	discard	5_TAN_in_DOMINO	Parallel run loop
auto	7.830883474428317	0.0	keep	13_5_in_TAN	Parallel run loop
auto	2.537345539752651	0.0	discard	4_TAN_in_3	Parallel run loop
auto	9.096199840144036	0.0	keep	18_5_in_TAN	Parallel run loop
auto	4.414299592203655	0.0	discard	7_4_in_tan	Parallel run loop
auto	12.800243083873271	0.0	discard	19_CIRCLE_in_TAN	Parallel run loop
auto	0.9990475447325589	0.0	discard	3_TAN_in_DOMINO	Parallel run loop
auto	10.989060908265987	0.0	discard	17_6_in_TAN	Parallel run loop
auto	1.060533204507968	0.0	discard	4_TAN_in_6	Parallel run loop
auto	5.414278697687401	0.0	discard	11_4_in_tan	Parallel run loop
auto	3.0744322748224056	0.0	discard	8_3_in_tan	Parallel run loop
auto	2.6389756176142947	0.0	discard	6_3_in_tan	Parallel run loop
auto	5.2426949496987065	0.0	discard	5_DOMINO_in_TAN	Parallel run loop
auto	0.9257201651728294	0.0	discard	6_TAN_in_8	Parallel run loop
auto	7.355031405103133	0.0	discard	11_5_in_TAN	Parallel run loop
auto	13.093800411987209	0.0	discard	20_CIRCLE_in_TAN	Parallel run loop
auto	15.98701049064933	0.0	discard	20_8_in_TAN	Parallel run loop
auto	1.1398949299431922	0.0	discard	5_TAN_in_6	Parallel run loop
auto	8.537188004091725	0.0	discard	10_6_in_TAN	Parallel run loop
auto	10.342254767263785	0.0	discard	15_6_in_TAN	Parallel run loop
auto	8.180562910713755	0.0	discard	14_5_in_TAN	Parallel run loop
auto	12.65723687109974	0.0	discard	12_8_in_TAN	Parallel run loop
auto	12.548028648642404	0.0	discard	18_CIRCLE_in_TAN	Parallel run loop
auto	8.472419234749125	0.0	discard	15_5_in_TAN	Parallel run loop
auto	16.791945619851404	0.0	discard	22_8_in_TAN	Parallel run loop
auto	6.8329913630729875	0.0	discard	9_DOMINO_in_TAN	Parallel run loop
auto	12.171875547619045	0.0	discard	17_CIRCLE_in_TAN	Parallel run loop
auto	13.2218691330867	0.0	discard	13_8_in_TAN	Parallel run loop
auto	8.675894796842588	0.0	discard	16_5_in_TAN	Parallel run loop
auto	15.352631895501817	0.0	discard	18_8_in_TAN	Parallel run loop
auto	15.696439841133348	0.0	discard	19_8_in_TAN	Parallel run loop
auto	5.657397680868436	0.0	discard	12_4_in_tan	Parallel run loop
auto	13.5720514721825	0.0	keep	14_8_in_TAN	Parallel run loop
auto	4.953480532948613	0.0	discard	9_4_in_tan	Parallel run loop
auto	1.3015884503782176	0.0	discard	5_TAN_in_DOMINO	Parallel run loop
auto	7.543686323022313	0.0	discard	12_5_in_TAN	Parallel run loop
auto	2.7416156003769716	0.0	discard	5_TAN_in_3	Parallel run loop
auto	1.38636082854532	0.0	keep	5_TAN_in_5	Parallel run loop
auto	10.056842493708587	0.0	discard	14_6_in_TAN	Parallel run loop
auto	14.781675374165784	0.0	discard	17_8_in_TAN	Parallel run loop
auto	10.723932220391713	0.0	discard	16_6_in_TAN	Parallel run loop
auto	5.829251457657059	0.0	discard	13_4_in_tan	Parallel run loop
auto	3.1839953516248816	0.0	discard	9_3_in_tan	Parallel run loop
auto	12.800243083873271	0.0	discard	19_CIRCLE_in_TAN	Parallel run loop
auto	10.99844234170436	0.0	discard	17_6_in_TAN	Parallel run loop
auto	5.414278697687401	0.0	discard	11_4_in_tan	Parallel run loop
auto	13.093800411987209	0.0	discard	20_CIRCLE_in_TAN	Parallel run loop
auto	0.9257201651728294	0.0	discard	6_TAN_in_8	Parallel run loop
auto	6.414429819711533	0.0	discard	8_DOMINO_in_TAN	Parallel run loop
auto	9.096199840144036	0.0	discard	18_5_in_TAN	Parallel run loop
auto	2.6389756176142947	0.0	discard	6_3_in_tan	Parallel run loop
auto	6.828720696258137	0.0	keep	18_4_in_tan	Parallel run loop
auto	6.000453871206658	0.0	keep	14_4_in_tan	Parallel run loop
auto	0.9990475447325589	0.0	discard	3_TAN_in_DOMINO	Parallel run loop
auto	3.0744322748224056	0.0	discard	8_3_in_tan	Parallel run loop
auto	2.7901743930726672	0.0	discard	7_3_in_tan	Parallel run loop
auto	3.346384297742911	0.0	discard	10_3_in_tan	Parallel run loop
auto	15.98701049064933	0.0	discard	20_8_in_TAN	Parallel run loop
auto	7.830883474428317	0.0	discard	13_5_in_TAN	Parallel run loop
auto	6.8329913630729875	0.0	discard	9_DOMINO_in_TAN	Parallel run loop
auto	1.9617957927965048	0.0	discard	3_tan_in_tan	Parallel run loop
auto	1.9380628930945585	0.0	keep	6_TAN_in_4	Parallel run loop
auto	3.630911188977506	0.0	discard	12_3_in_tan	Parallel run loop
auto	15.352631895501817	0.0	discard	18_8_in_TAN	Parallel run loop
auto	16.795324632209066	0.0	discard	22_8_in_TAN	Parallel run loop
auto	15.717327236785252	0.0	discard	19_8_in_TAN	Parallel run loop
auto	3.1839953516248816	0.0	discard	9_3_in_tan	Parallel run loop
auto	3.4706595787487813	0.0	keep	11_3_in_tan	Parallel run loop
auto	5.656970416589561	0.0	discard	12_4_in_tan	Parallel run loop
auto	6.962713780428193	0.0	discard	19_4_in_tan	Parallel run loop
auto	6.414429819711533	0.0	discard	8_DOMINO_in_TAN	Parallel run loop
auto	4.953480532948613	0.0	discard	9_4_in_tan	Parallel run loop
auto	10.347473640441276	0.0	discard	15_6_in_TAN	Parallel run loop
auto	13.5720514721825	0.0	discard	14_8_in_TAN	Parallel run loop
auto	1.13989175549289	0.0	discard	5_TAN_in_6	Parallel run loop
auto	7.83115375303181	0.0	discard	12_DOMINO_in_TAN	Parallel run loop
auto	8.669295557284029	0.0	keep	16_5_in_TAN	Parallel run loop
auto	5.829251457657059	0.0	discard	13_4_in_tan	Parallel run loop
auto	7.416821744050934	0.0	discard	11_DOMINO_in_TAN	Parallel run loop
auto	2.7416037582228934	0.0	discard	5_TAN_in_3	Parallel run loop
auto	3.8895356289289125	0.0	discard	14_3_in_tan	Parallel run loop
auto	1.3015884503782176	0.0	discard	5_TAN_in_DOMINO	Parallel run loop
auto	3.176015968000912	0.0	discard	7_TAN_in_3	Parallel run loop
auto	2.6389756176142947	0.0	discard	6_3_in_tan	Parallel run loop
auto	3.714799988139069	0.0	keep	13_3_in_tan	Parallel run loop
auto	2.9380946861817696	0.0	discard	6_TAN_in_3	Parallel run loop
auto	7.001550333113583	0.0	discard	20_4_in_tan	Parallel run loop
auto	1.386429152648888	0.0	discard	5_TAN_in_5	Parallel run loop
auto	5.4142834498167325	0.0	discard	11_4_in_tan	Parallel run loop
auto	10.989060908265987	0.0	discard	17_6_in_TAN	Parallel run loop
auto	14.780689934071507	0.0	discard	17_8_in_TAN	Parallel run loop
auto	7.8326848923957355	0.0	discard	13_5_in_TAN	Parallel run loop
auto	6.82945465711647	0.0	discard	18_4_in_tan	Parallel run loop
auto	3.346384297742911	0.0	discard	10_3_in_tan	Parallel run loop
auto	6.000453871206658	0.0	discard	14_4_in_tan	Parallel run loop
auto	15.754652309402955	0.0	discard	19_8_in_TAN	Parallel run loop
auto	3.1839953516248816	0.0	discard	9_3_in_tan	Parallel run loop
auto	1.9380628930945585	0.0	discard	6_TAN_in_4	Parallel run loop
auto	0.9990475447325589	0.0	discard	3_TAN_in_DOMINO	Parallel run loop
auto	15.352631895501817	0.0	discard	18_8_in_TAN	Parallel run loop
auto	1.9617957927965048	0.0	discard	3_tan_in_tan	Parallel run loop
auto	2.7901743930726672	0.0	discard	7_3_in_tan	Parallel run loop
auto	16.806765620515144	0.0	discard	22_8_in_TAN	Parallel run loop
auto	9.093691284787404	0.0	keep	18_5_in_TAN	Parallel run loop
auto	3.630524336664464	0.0	keep	12_3_in_tan	Parallel run loop
auto	6.8329913630729875	0.0	discard	9_DOMINO_in_TAN	Parallel run loop
auto	3.9916785160884403	0.0	discard	15_3_in_tan	Parallel run loop
auto	15.98701049064933	0.0	discard	20_8_in_TAN	Parallel run loop
auto	6.414429819711533	0.0	discard	8_DOMINO_in_TAN	Parallel run loop
auto	5.829251457657059	0.0	discard	13_4_in_tan	Parallel run loop
auto	1.139798427055632	0.0	keep	5_TAN_in_6	Parallel run loop
auto	6.960801483157487	0.0	discard	19_4_in_tan	Parallel run loop
auto	2.7415424589234503	0.0	discard	5_TAN_in_3	Parallel run loop
auto	13.57244125419423	0.0	discard	14_8_in_TAN	Parallel run loop
auto	2.6952092734837074	0.0	discard	6_tan_in_tan	Parallel run loop
auto	5.656970416589561	0.0	discard	12_4_in_tan	Parallel run loop
auto	3.470875010729649	0.0	discard	11_3_in_tan	Parallel run loop
auto	7.416821744050934	0.0	discard	11_DOMINO_in_TAN	Parallel run loop
auto	3.1839953516248816	0.0	discard	9_3_in_tan	Parallel run loop
auto	7.829292204562744	0.0	discard	12_DOMINO_in_TAN	Parallel run loop
auto	2.4077404425018814	0.0	discard	5_tan_in_tan	Parallel run loop
auto	6.426129091758543	0.0	discard	17_4_in_tan	Parallel run loop
auto	0.9990475447325589	0.0	discard	3_TAN_in_DOMINO	Parallel run loop
auto	3.8895356289289125	0.0	discard	14_3_in_tan	Parallel run loop
auto	8.6707017776518	0.0	discard	16_5_in_TAN	Parallel run loop
auto	8.005170339036384	0.0	discard	13_DOMINO_in_TAN	Parallel run loop
auto	3.346384297742911	0.0	discard	10_3_in_tan	Parallel run loop
auto	4.2116998839058075	0.0	discard	17_3_in_tan	Parallel run loop
auto	1.9380628930945585	0.0	discard	6_TAN_in_4	Parallel run loop
auto	1.7071715795728635	0.0	discard	10_TAN_in_DOMINO	Parallel run loop
auto	7.001550333113583	0.0	discard	20_4_in_tan	Parallel run loop
auto	3.7142165849844364	0.0	keep	13_3_in_tan	Parallel run loop
auto	6.000951581169019	0.0	discard	14_4_in_tan	Parallel run loop
auto	1.3864840695475675	0.0	discard	5_TAN_in_5	Parallel run loop
auto	7.418737140759009	0.0	discard	23_4_in_tan	Parallel run loop
auto	14.783881928016516	0.0	discard	17_8_in_TAN	Parallel run loop
auto	2.9380946861817696	0.0	discard	6_TAN_in_3	Parallel run loop
auto	4.649426124422304	0.0	discard	21_3_in_tan	Parallel run loop
auto	3.176015968000912	0.0	discard	7_TAN_in_3	Parallel run loop
auto	1.9617957927965048	0.0	discard	3_tan_in_tan	Parallel run loop
auto	5.4142834498167325	0.0	discard	11_4_in_tan	Parallel run loop
auto	6.82945465711647	0.0	discard	18_4_in_tan	Parallel run loop
auto	16.784481308537313	0.0	discard	22_8_in_TAN	Parallel run loop
auto	6.414429819711533	0.0	discard	8_DOMINO_in_TAN	Parallel run loop
auto	4.942668817720112	0.0	discard	24_3_in_tan	Parallel run loop
auto	1.139798427055632	0.0	discard	5_TAN_in_6	Parallel run loop
auto	6.955684911869864	0.0	discard	19_4_in_tan	Parallel run loop
auto	3.9874362125382268	0.0	keep	15_3_in_tan	Parallel run loop
auto	2.6952092734837074	0.0	discard	6_tan_in_tan	Parallel run loop
auto	3.630524336664464	0.0	discard	12_3_in_tan	Parallel run loop
auto	9.093691284787404	0.0	discard	18_5_in_TAN	Parallel run loop
auto	15.98701049064933	0.0	discard	20_8_in_TAN	Parallel run loop
auto	5.829251457657059	0.0	discard	13_4_in_tan	Parallel run loop
auto	2.7901743930726672	0.0	discard	7_3_in_tan	Parallel run loop
auto	2.0001054630464767	0.0	discard	7_TAN_in_4	Parallel run loop
auto	6.8329913630729875	0.0	discard	9_DOMINO_in_TAN	Parallel run loop
auto	2.741501350357513	0.0	discard	5_TAN_in_3	Parallel run loop
auto	2.8282425559498208	0.0	discard	7_tan_in_tan	Parallel run loop
auto	2.4077404425018814	0.0	discard	5_tan_in_tan	Parallel run loop
auto	5.750980409876445	0.0	discard	4_6_in_TAN	Parallel run loop
auto	6.502700541228166	0.0	discard	5_6_in_TAN	Parallel run loop
auto	0.988845219611748	0.0	discard	3_TAN_in_6	Parallel run loop
auto	1.9381323505640131	0.0	discard	6_TAN_in_4	Parallel run loop
auto	3.887510625021792	0.0	keep	14_3_in_tan	Parallel run loop
auto	3.7142165849844364	0.0	discard	13_3_in_tan	Parallel run loop
auto	8.005170339036384	0.0	discard	13_DOMINO_in_TAN	Parallel run loop
auto	1.7071534633421885	0.0	keep	10_TAN_in_DOMINO	Parallel run loop
auto	0.9257201651728294	0.0	discard	6_TAN_in_8	Parallel run loop
auto	7.416821744050934	0.0	discard	11_DOMINO_in_TAN	Parallel run loop
auto	1.9617957927965048	0.0	discard	3_tan_in_tan	Parallel run loop
auto	3.346384297742911	0.0	discard	10_3_in_tan	Parallel run loop
auto	7.829292204562744	0.0	discard	12_DOMINO_in_TAN	Parallel run loop
auto	3.4706595787487813	0.0	discard	11_3_in_tan	Parallel run loop
auto	7.001550333113583	0.0	discard	20_4_in_tan	Parallel run loop
auto	6.419424293259695	0.0	discard	17_4_in_tan	Parallel run loop
auto	10.425000438970166	0.0	discard	12_CIRCLE_in_TAN	Parallel run loop
auto	2.9380946861817696	0.0	discard	6_TAN_in_3	Parallel run loop
auto	4.928251971687783	0.0	discard	24_3_in_tan	Parallel run loop
auto	2.6952092734837074	0.0	discard	6_tan_in_tan	Parallel run loop
auto	1.386429152648888	0.0	discard	5_TAN_in_5	Parallel run loop
auto	7.418737140759009	0.0	discard	23_4_in_tan	Parallel run loop
auto	3.176015968000912	0.0	discard	7_TAN_in_3	Parallel run loop
auto	6.000475455864383	0.0	discard	14_4_in_tan	Parallel run loop
auto	4.649426124422304	0.0	discard	21_3_in_tan	Parallel run loop
auto	6.828631161708708	0.0	keep	18_4_in_tan	Parallel run loop
auto	1.060533204507968	0.0	discard	4_TAN_in_6	Parallel run loop
auto	7.354278105218379	0.0	discard	11_5_in_TAN	Parallel run loop
auto	12.362131078860386	0.0	discard	11_8_in_TAN	Parallel run loop
auto	6.953395668051402	0.0	discard	19_4_in_tan	Parallel run loop
auto	2.4077404425018814	0.0	discard	5_tan_in_tan	Parallel run loop
auto	6.502700541228166	0.0	discard	5_6_in_TAN	Parallel run loop
auto	9.093691284787404	0.0	discard	18_5_in_TAN	Parallel run loop
auto	7.830883474428317	0.0	discard	13_5_in_TAN	Parallel run loop
auto	3.9874362125382268	0.0	discard	15_3_in_tan	Parallel run loop
auto	3.630524336664464	0.0	discard	12_3_in_tan	Parallel run loop
auto	2.8282425559498208	0.0	discard	7_tan_in_tan	Parallel run loop
auto	2.7901743930726672	0.0	discard	7_3_in_tan	Parallel run loop
auto	5.750980409876445	0.0	discard	4_6_in_TAN	Parallel run loop
auto	8.6707017776518	0.0	discard	16_5_in_TAN	Parallel run loop
auto	1.9381847875892406	0.0	discard	6_TAN_in_4	Parallel run loop
auto	2.6952092734837074	0.0	discard	6_tan_in_tan	Parallel run loop
auto	15.36611146511976	0.0	discard	18_8_in_TAN	Parallel run loop
auto	10.989060908265987	0.0	discard	17_6_in_TAN	Parallel run loop
auto	2.0001054630464767	0.0	discard	7_TAN_in_4	Parallel run loop
auto	3.7155574527349113	0.0	discard	13_3_in_tan	Parallel run loop
auto	0.988845219611748	0.0	discard	3_TAN_in_6	Parallel run loop
auto	0.9257201651728294	0.0	discard	6_TAN_in_8	Parallel run loop
auto	3.8893932103358577	0.0	discard	14_3_in_tan	Parallel run loop
auto	7.001550333113583	0.0	discard	20_4_in_tan	Parallel run loop
auto	2.950137091820942	0.0	discard	6_TAN_in_3	Parallel run loop
auto	4.982930917836225	0.0	discard	24_3_in_tan	Parallel run loop
auto	1.38636082854532	0.0	discard	5_TAN_in_5	Parallel run loop
auto	8.005170339036384	0.0	discard	13_DOMINO_in_TAN	Parallel run loop
auto	3.4706595787487813	0.0	discard	11_3_in_tan	Parallel run loop
auto	7.83115375303181	0.0	discard	12_DOMINO_in_TAN	Parallel run loop
auto	10.425000438970166	0.0	discard	12_CIRCLE_in_TAN	Parallel run loop
auto	6.419424293259695	0.0	discard	17_4_in_tan	Parallel run loop
auto	1.7071715795728635	0.0	discard	10_TAN_in_DOMINO	Parallel run loop
auto	7.416821744050934	0.0	discard	11_DOMINO_in_TAN	Parallel run loop
auto	1.139798427055632	0.0	discard	5_TAN_in_6	Parallel run loop
auto	7.354278105218379	0.0	discard	11_5_in_TAN	Parallel run loop
auto	2.4077404425018814	0.0	discard	5_tan_in_tan	Parallel run loop
auto	2.8282425559498208	0.0	discard	7_tan_in_tan	Parallel run loop
auto	3.176015968000912	0.0	discard	7_TAN_in_3	Parallel run loop
auto	6.000453871206658	0.0	discard	14_4_in_tan	Parallel run loop
auto	12.349576857726333	0.0	keep	11_8_in_TAN	Parallel run loop
auto	1.060533204507968	0.0	discard	4_TAN_in_6	Parallel run loop
auto	4.66135903430475	0.0	discard	21_3_in_tan	Parallel run loop
auto	3.630524336664464	0.0	discard	12_3_in_tan	Parallel run loop
auto	5.750980409876445	0.0	discard	4_6_in_TAN	Parallel run loop
auto	6.502700541228166	0.0	discard	5_6_in_TAN	Parallel run loop
auto	7.421244482039394	0.0	discard	23_4_in_tan	Parallel run loop
auto	6.828631161708708	0.0	discard	18_4_in_tan	Parallel run loop
auto	8.670181085414658	0.0	discard	16_5_in_TAN	Parallel run loop
auto	3.8895356289289125	0.0	discard	14_3_in_tan	Parallel run loop
auto	1.3864766352654738	0.0	discard	5_TAN_in_5	Parallel run loop
auto	0.9257201651728294	0.0	discard	6_TAN_in_8	Parallel run loop
auto	9.093691284787404	0.0	discard	18_5_in_TAN	Parallel run loop
auto	0.988845219611748	0.0	discard	3_TAN_in_6	Parallel run loop
auto	1.2091887861698134	0.0	discard	6_tan_in_cir	Parallel run loop
auto	0.8231141511692444	0.0	discard	4_TAN_in_8	Parallel run loop
auto	1.7071715795728635	0.0	discard	10_TAN_in_DOMINO	Parallel run loop
auto	1.139798427055632	0.0	discard	5_TAN_in_6	Parallel run loop
auto	8.051886310393924	0.0	discard	13_DOMINO_in_TAN	Parallel run loop
auto	3.990302953323464	0.0	discard	15_3_in_tan	Parallel run loop
auto	6.417434227241148	0.0	keep	17_4_in_tan	Parallel run loop
auto	1.9999939703045195	0.0	keep	7_TAN_in_4	Parallel run loop
auto	10.99844234170436	0.0	discard	17_6_in_TAN	Parallel run loop
auto	7.830883474428317	0.0	discard	13_5_in_TAN	Parallel run loop
auto	3.4706595787487813	0.0	discard	11_3_in_tan	Parallel run loop
auto	10.425000438970166	0.0	discard	12_CIRCLE_in_TAN	Parallel run loop
auto	6.000472374010108	0.0	discard	14_4_in_tan	Parallel run loop
auto	2.8282425559498208	0.0	discard	7_tan_in_tan	Parallel run loop
auto	11.303290353085066	0.0	discard	18_6_in_TAN	Parallel run loop
auto	12.349576857726333	0.0	discard	11_8_in_TAN	Parallel run loop
auto	7.354278105218379	0.0	discard	11_5_in_TAN	Parallel run loop
auto	4.649426124422304	0.0	discard	21_3_in_tan	Parallel run loop
auto	5.750980409876445	0.0	discard	4_6_in_TAN	Parallel run loop
auto	8.911796904804156	0.0	keep	17_5_in_TAN	Parallel run loop
auto	6.82945465711647	0.0	discard	18_4_in_tan	Parallel run loop
auto	1.060533204507968	0.0	discard	4_TAN_in_6	Parallel run loop
auto	7.415208676849679	0.0	keep	23_4_in_tan	Parallel run loop
auto	3.630911188977506	0.0	discard	12_3_in_tan	Parallel run loop
auto	6.502700541228166	0.0	discard	5_6_in_TAN	Parallel run loop
auto	0.988845219611748	0.0	discard	3_TAN_in_6	Parallel run loop
auto	0.9257201651728294	0.0	discard	6_TAN_in_8	Parallel run loop
auto	10.425000438970166	0.0	discard	12_CIRCLE_in_TAN	Parallel run loop
auto	5.750980409876445	0.0	discard	4_6_in_TAN	Parallel run loop
auto	8.668967097735935	0.0	keep	16_5_in_TAN	Parallel run loop
auto	10.99844234170436	0.0	discard	17_6_in_TAN	Parallel run loop
auto	6.419424293259695	0.0	discard	17_4_in_tan	Parallel run loop
auto	3.4706595787487813	0.0	discard	11_3_in_tan	Parallel run loop
auto	9.093691284787404	0.0	discard	18_5_in_TAN	Parallel run loop
auto	1.139798427055632	0.0	discard	5_TAN_in_6	Parallel run loop
auto	7.8334472095262315	0.0	discard	13_5_in_TAN	Parallel run loop
auto	1.3865637832098754	0.0	discard	5_TAN_in_5	Parallel run loop
auto	2.0001054630464767	0.0	discard	7_TAN_in_4	Parallel run loop
auto	11.51922073240496	0.0	discard	19_6_in_TAN	Parallel run loop
auto	1.3934990720453515	0.0	discard	9_tan_in_cir	Parallel run loop
auto	9.659307591070704	0.0	discard	20_5_in_TAN	Parallel run loop
auto	1.6397363084911005	0.0	discard	7_TAN_in_5	Parallel run loop
