commit	score	memory_gb	status	problem	description
auto	2.9900974090750925	0.0	discard	8_6_in_CIRCLE	Parallel run loop
auto	4.9328980595641845	0.0	keep	29_5_in_6	Parallel run loop
auto	5.083417758613617	0.0	discard	10_8_in_6	Parallel run loop
auto	3.237983563377362	0.0	discard	14_5_in_CIRCLE	Parallel run loop
auto	2.685060232664588	0.0	discard	15_5_in_8	Parallel run loop
auto	5.64521259112362	0.0	discard	15_8_in_CIRCLE	Parallel run loop
auto	5.373206866816074	0.0	discard	14_8_in_CIRCLE	Parallel run loop
auto	4.1854014009789955	0.0	discard	10_6_in_DOMINO	Parallel run loop
auto	5.118118581027425	0.0	discard	13_6_in_5	Parallel run loop
auto	3.7576743076763917	0.0	discard	12_5_in_DOMINO	Parallel run loop
auto	4.090319119219042	0.0	discard	15_6_in_CIRCLE	Parallel run loop
auto	3.625554767546156	0.0	discard	11_5_in_DOMINO	Parallel run loop
auto	5.310683556026722	0.0	discard	14_6_in_5	Parallel run loop
auto	2.7565782330234603	0.0	discard	10_6_in_8	Parallel run loop
auto	3.7950462907018387	0.0	discard	7_8_in_CIRCLE	Parallel run loop
auto	3.2878617804289507	0.0	discard	8_8_in_8	Parallel run loop
auto	2.334325046090789	0.0	discard	6_5_in_6	Parallel run loop
auto	6.735575862316236	0.0	discard	12_8_in_5	Parallel run loop
auto	3.463680674666948	0.0	discard	9_5_in_5	Parallel run loop
auto	2.9377634562638297	0.0	discard	12_6_in_8	Parallel run loop
auto	3.0848025018440732	0.0	discard	8_5_in_DOMINO	Parallel run loop
auto	4.574769884311197	0.0	discard	10_6_in_5	Parallel run loop
auto	2.9422489384062622	0.0	discard	8_DOMINO_in_6	Parallel run loop
auto	3.345343483244312	0.0	discard	15_5_in_CIRCLE	Parallel run loop
auto	3.698242161628505	0.0	discard	10_5_in_5	Parallel run loop
auto	4.619342824798609	0.0	discard	16_8_in_8	Parallel run loop
auto	2.8090852688546946	0.0	discard	5_DOMINO_in_5	Parallel run loop
auto	4.18778997474247	0.0	discard	13_8_in_8	Parallel run loop
auto	6.324910948264516	0.0	discard	12_8_in_DOMINO	Parallel run loop
auto	4.348618287689763	0.0	discard	5_8_in_5	Parallel run loop
auto	5.839596123437023	0.0	discard	17_6_in_5	Parallel run loop
auto	3.7204861167355805	0.0	discard	10_8_in_8	Parallel run loop
auto	3.4941454320093825	0.0	discard	7_6_in_DOMINO	Parallel run loop
auto	2.301873562409722	0.0	discard	7_5_in_CIRCLE	Parallel run loop
auto	5.028859189736653	0.0	discard	12_8_in_CIRCLE	Parallel run loop
auto	3.389995430732657	0.0	discard	16_6_in_8	Parallel run loop
auto	4.93259794043128	0.0	keep	29_5_in_6	Parallel run loop
auto	3.229490810765495	0.0	discard	5_6_in_5	Parallel run loop
auto	3.3262785051421733	0.0	discard	8_6_in_6	Parallel run loop
auto	5.76766116388135	0.0	discard	16_8_in_CIRCLE	Parallel run loop
auto	6.408094950662928	0.0	discard	20_8_in_CIRCLE	Parallel run loop
auto	3.0901213766355777	0.0	discard	7_5_in_5	Parallel run loop
auto	3.300980431842543	0.0	discard	15_6_in_8	Parallel run loop
auto	2.2118080678298013	0.0	discard	10_5_in_8	Parallel run loop
auto	4.825278353773088	0.0	discard	13_6_in_DOMINO	Parallel run loop
auto	3.214216984114548	0.0	discard	10_DOMINO_in_6	Parallel run loop
auto	3.177349149882355	0.0	discard	11_5_in_6	Parallel run loop
auto	4.937376466774466	0.0	discard	12_6_in_5	Parallel run loop
auto	4.016020462419165	0.0	discard	12_8_in_8	Parallel run loop
auto	4.7818533607437725	0.0	discard	6_8_in_5	Parallel run loop
auto	5.262303631584142	0.0	discard	13_8_in_CIRCLE	Parallel run loop
auto	1.8261429737118473	0.0	discard	7_5_in_8	Parallel run loop
auto	5.984846717852844	0.0	discard	17_8_in_CIRCLE	Parallel run loop
auto	7.794562305764205	0.0	discard	19_8_in_DOMINO	Parallel run loop
auto	6.524385953685497	0.0	discard	13_8_in_DOMINO	Parallel run loop
auto	2.0959010073397857	0.0	discard	9_5_in_8	Parallel run loop
auto	6.16650656709864	0.0	discard	15_8_in_6	Parallel run loop
auto	6.04077488592788	0.0	discard	11_8_in_DOMINO	Parallel run loop
auto	3.4285041744862585	0.0	discard	13_5_in_6	Parallel run loop
auto	4.9125338429934695	0.0	discard	22_6_in_CIRCLE	Parallel run loop
auto	2.005199633352468	0.0	keep	7_DOMINO_in_8	Parallel run loop
auto	3.087624644501296	0.0	discard	13_6_in_8	Parallel run loop
auto	4.129846426323647	0.0	discard	15_5_in_DOMINO	Parallel run loop
auto	6.988532146169312	0.0	discard	13_8_in_5	Parallel run loop
auto	2.331362522098815	0.0	keep	11_5_in_8	Parallel run loop
auto	3.0249325226413832	0.0	discard	12_5_in_CIRCLE	Parallel run loop
auto	3.9895552022139587	0.0	discard	12_5_in_5	Parallel run loop
auto	3.0793548370246726	0.0	discard	13_5_in_CIRCLE	Parallel run loop
auto	8.238698760322144	0.0	discard	21_8_in_DOMINO	Parallel run loop
auto	3.484020489154712	0.0	discard	16_5_in_CIRCLE	Parallel run loop
auto	1.961731631080694	0.0	discard	8_5_in_8	Parallel run loop
auto	3.8942198794588005	0.0	discard	13_5_in_DOMINO	Parallel run loop
auto	4.932321229061439	0.0	keep	29_5_in_6	Parallel run loop
auto	7.939579459363951	0.0	discard	17_8_in_5	Parallel run loop
auto	4.626004523607166	0.0	discard	12_6_in_DOMINO	Parallel run loop
auto	2.42115433681355	0.0	discard	8_6_in_8	Parallel run loop
auto	3.8126405255728777	0.0	discard	11_5_in_5	Parallel run loop
auto	3.698483979583938	0.0	discard	8_6_in_DOMINO	Parallel run loop
auto	3.8131538775656013	0.0	discard	7_6_in_5	Parallel run loop
auto	2.757555254323801	0.0	discard	16_5_in_8	Parallel run loop
auto	2.9900974090750925	0.0	discard	8_6_in_CIRCLE	Parallel run loop
auto	3.237983563377362	0.0	discard	14_5_in_CIRCLE	Parallel run loop
auto	4.880795652783389	0.0	discard	18_8_in_8	Parallel run loop
auto	5.64521259112362	0.0	discard	15_8_in_CIRCLE	Parallel run loop
auto	3.619137531048797	0.0	discard	12_6_in_CIRCLE	Parallel run loop
auto	2.685060232664588	0.0	discard	15_5_in_8	Parallel run loop
auto	3.909639951095922	0.0	keep	21_5_in_CIRCLE	Parallel run loop
auto	6.099037994484778	0.0	discard	18_8_in_CIRCLE	Parallel run loop
auto	3.616566011518087	0.0	keep	18_5_in_CIRCLE	Parallel run loop
auto	4.29961501261876	0.0	discard	14_8_in_8	Parallel run loop
auto	4.1854014009789955	0.0	discard	10_6_in_DOMINO	Parallel run loop
auto	5.118118581027425	0.0	discard	13_6_in_5	Parallel run loop
auto	3.998462426723429	0.0	keep	22_5_in_CIRCLE	Parallel run loop
auto	5.373206866816074	0.0	discard	14_8_in_CIRCLE	Parallel run loop
auto	4.090319119219042	0.0	discard	15_6_in_CIRCLE	Parallel run loop
auto	3.7576743076763917	0.0	discard	12_5_in_DOMINO	Parallel run loop
auto	5.310683556026722	0.0	discard	14_6_in_5	Parallel run loop
auto	3.34275373640043	0.0	discard	11_DOMINO_in_6	Parallel run loop
auto	3.7950462907018387	0.0	discard	7_8_in_CIRCLE	Parallel run loop
auto	8.14847732217796	0.0	discard	18_8_in_5	Parallel run loop
auto	3.2878617804289507	0.0	discard	8_8_in_8	Parallel run loop
auto	4.986626785389051	0.0	keep	23_6_in_CIRCLE	Parallel run loop
auto	4.480124023637546	0.0	discard	15_8_in_8	Parallel run loop
auto	3.509704759175081	0.0	discard	17_5_in_CIRCLE	Parallel run loop
auto	7.180558738898597	0.0	discard	14_8_in_5	Parallel run loop
auto	3.463680674666948	0.0	discard	9_5_in_5	Parallel run loop
auto	8.365946794416464	0.0	discard	19_8_in_5	Parallel run loop
auto	2.334325046090789	0.0	discard	6_5_in_6	Parallel run loop
auto	6.735575862316236	0.0	discard	12_8_in_5	Parallel run loop
auto	4.96404810255859	0.0	discard	29_5_in_6	Parallel run loop
auto	5.636369710672743	0.0	discard	16_6_in_5	Parallel run loop
auto	2.9377634562638297	0.0	discard	12_6_in_8	Parallel run loop
auto	3.1527750330791813	0.0	discard	14_6_in_8	Parallel run loop
auto	2.8579441508209107	0.0	discard	8_DOMINO_in_6	Parallel run loop
auto	4.574769884311197	0.0	discard	10_6_in_5	Parallel run loop
auto	4.619342824798609	0.0	discard	16_8_in_8	Parallel run loop
auto	3.345343483244312	0.0	discard	15_5_in_CIRCLE	Parallel run loop
auto	3.698242161628505	0.0	discard	10_5_in_5	Parallel run loop
auto	4.348618287689763	0.0	discard	5_8_in_5	Parallel run loop
auto	2.8090852688546946	0.0	discard	5_DOMINO_in_5	Parallel run loop
auto	3.055752327695466	0.0	discard	20_5_in_8	Parallel run loop
auto	3.4941454320093825	0.0	discard	7_6_in_DOMINO	Parallel run loop
auto	5.839596123437023	0.0	discard	17_6_in_5	Parallel run loop
auto	4.18778997474247	0.0	discard	13_8_in_8	Parallel run loop
auto	5.028859189736653	0.0	discard	12_8_in_CIRCLE	Parallel run loop
auto	2.57086553360258	0.0	discard	14_5_in_8	Parallel run loop
auto	2.953665845198902	0.0	discard	10_5_in_6	Parallel run loop
auto	3.389995430732657	0.0	discard	16_6_in_8	Parallel run loop
auto	4.287421360885064	0.0	discard	14_6_in_6	Parallel run loop
auto	3.0901213766355777	0.0	discard	7_5_in_5	Parallel run loop
auto	3.300980431842543	0.0	discard	15_6_in_8	Parallel run loop
auto	3.8008538929495774	0.0	discard	20_5_in_CIRCLE	Parallel run loop
auto	5.407277882325043	0.0	discard	12_8_in_6	Parallel run loop
auto	3.214216984114548	0.0	discard	10_DOMINO_in_6	Parallel run loop
auto	6.408094950662928	0.0	discard	20_8_in_CIRCLE	Parallel run loop
auto	5.76766116388135	0.0	discard	16_8_in_CIRCLE	Parallel run loop
auto	3.2336586610955442	0.0	discard	12_5_in_6	Parallel run loop
auto	6.134720683760772	0.0	discard	19_6_in_5	Parallel run loop
auto	4.937376466774466	0.0	discard	12_6_in_5	Parallel run loop
auto	5.96787115637767	0.0	discard	18_6_in_5	Parallel run loop
auto	5.984846717852844	0.0	discard	17_8_in_CIRCLE	Parallel run loop
auto	4.072350608987922	0.0	keep	23_5_in_CIRCLE	Parallel run loop
auto	8.571897635222657	0.0	discard	20_8_in_5	Parallel run loop
auto	7.794562305764205	0.0	discard	19_8_in_DOMINO	Parallel run loop
auto	4.367403997439509	0.0	discard	17_6_in_CIRCLE	Parallel run loop
auto	7.021084739848574	0.0	discard	20_8_in_6	Parallel run loop
auto	4.7818533607437725	0.0	discard	6_8_in_5	Parallel run loop
auto	4.016020462419165	0.0	discard	12_8_in_8	Parallel run loop
auto	3.8935082219066706	0.0	discard	14_6_in_CIRCLE	Parallel run loop
auto	1.8261429737118473	0.0	discard	7_5_in_8	Parallel run loop
auto	4.9125338429934695	0.0	discard	22_6_in_CIRCLE	Parallel run loop
auto	6.524385953685497	0.0	discard	13_8_in_DOMINO	Parallel run loop
auto	6.16650656709864	0.0	discard	15_8_in_6	Parallel run loop
auto	4.129846426323647	0.0	discard	15_5_in_DOMINO	Parallel run loop
auto	3.4285041744862585	0.0	discard	13_5_in_6	Parallel run loop
auto	6.988532146169312	0.0	discard	13_8_in_5	Parallel run loop
auto	3.087624644501296	0.0	discard	13_6_in_8	Parallel run loop
auto	8.238698760322144	0.0	discard	21_8_in_DOMINO	Parallel run loop
auto	3.0793548370246726	0.0	discard	13_5_in_CIRCLE	Parallel run loop
auto	4.77739666595167	0.0	discard	17_8_in_8	Parallel run loop
auto	3.9895552022139587	0.0	discard	12_5_in_5	Parallel run loop
auto	1.961731631080694	0.0	discard	8_5_in_8	Parallel run loop
auto	3.429337475000999	0.0	discard	9_8_in_8	Parallel run loop
auto	3.5015432852757242	0.0	discard	8_DOMINO_in_5	Parallel run loop
auto	3.9584777795716133	0.0	discard	12_6_in_6	Parallel run loop
auto	3.2561120298168578	0.0	discard	7_DOMINO_in_5	Parallel run loop
auto	3.5451997346116135	0.0	discard	16_5_in_CIRCLE	Parallel run loop
auto	3.8942198794588005	0.0	discard	13_5_in_DOMINO	Parallel run loop
auto	4.15748647722219	0.0	discard	16_6_in_CIRCLE	Parallel run loop
auto	2.42115433681355	0.0	discard	8_6_in_8	Parallel run loop
auto	7.939579459363951	0.0	discard	17_8_in_5	Parallel run loop
auto	2.757555254323801	0.0	discard	16_5_in_8	Parallel run loop
auto	3.698483979583938	0.0	discard	8_6_in_DOMINO	Parallel run loop
auto	5.431937953348882	0.0	discard	15_6_in_5	Parallel run loop
auto	3.8126405255728777	0.0	discard	11_5_in_5	Parallel run loop
auto	2.9900974090750925	0.0	discard	8_6_in_CIRCLE	Parallel run loop
auto	3.237983563377362	0.0	discard	14_5_in_CIRCLE	Parallel run loop
auto	4.865863965284076	0.0	discard	14_6_in_DOMINO	Parallel run loop
auto	4.880795652783389	0.0	discard	18_8_in_8	Parallel run loop
auto	4.627004892734379	0.0	keep	20_6_in_CIRCLE	Parallel run loop
auto	2.685060232664588	0.0	discard	15_5_in_8	Parallel run loop
auto	3.619137531048797	0.0	discard	12_6_in_CIRCLE	Parallel run loop
auto	6.099037994484778	0.0	discard	18_8_in_CIRCLE	Parallel run loop
auto	4.29961501261876	0.0	discard	14_8_in_8	Parallel run loop
auto	3.6165514924388846	0.0	keep	18_5_in_CIRCLE	Parallel run loop
auto	3.921198244633912	0.0	discard	21_5_in_CIRCLE	Parallel run loop
auto	3.9982903525716003	0.0	keep	22_5_in_CIRCLE	Parallel run loop
auto	4.1854014009789955	0.0	discard	10_6_in_DOMINO	Parallel run loop
auto	5.118118581027425	0.0	discard	13_6_in_5	Parallel run loop
auto	5.373206866816074	0.0	discard	14_8_in_CIRCLE	Parallel run loop
auto	7.645526350820605	0.0	discard	16_8_in_5	Parallel run loop
auto	4.5373443689855835	0.0	discard	21_DOMINO_in_6	Parallel run loop
auto	4.98239171642297	0.0	discard	19_5_in_5	Parallel run loop
auto	4.090319119219042	0.0	discard	15_6_in_CIRCLE	Parallel run loop
auto	5.310683556026722	0.0	discard	14_6_in_5	Parallel run loop
auto	3.34275373640043	0.0	discard	11_DOMINO_in_6	Parallel run loop
auto	4.480124023637546	0.0	discard	15_8_in_8	Parallel run loop
auto	3.7950462907018387	0.0	discard	7_8_in_CIRCLE	Parallel run loop
auto	3.2878617804289507	0.0	discard	8_8_in_8	Parallel run loop
auto	5.004581469793775	0.0	discard	23_6_in_CIRCLE	Parallel run loop
auto	8.14847732217796	0.0	discard	18_8_in_5	Parallel run loop
auto	3.509704759175081	0.0	discard	17_5_in_CIRCLE	Parallel run loop
auto	7.386904767147098	0.0	discard	15_8_in_5	Parallel run loop
auto	3.463680674666948	0.0	discard	9_5_in_5	Parallel run loop
auto	6.735575862316236	0.0	discard	12_8_in_5	Parallel run loop
auto	8.365946794416464	0.0	discard	19_8_in_5	Parallel run loop
auto	7.180558738898597	0.0	discard	14_8_in_5	Parallel run loop
auto	2.9377634562638297	0.0	discard	12_6_in_8	Parallel run loop
auto	2.8579441508209107	0.0	discard	8_DOMINO_in_6	Parallel run loop
auto	3.1527750330791813	0.0	discard	14_6_in_8	Parallel run loop
auto	5.636369710672743	0.0	discard	16_6_in_5	Parallel run loop
auto	4.619342824798609	0.0	discard	16_8_in_8	Parallel run loop
auto	4.348618287689763	0.0	discard	5_8_in_5	Parallel run loop
auto	3.4941454320093825	0.0	discard	7_6_in_DOMINO	Parallel run loop
auto	4.18778997474247	0.0	discard	13_8_in_8	Parallel run loop
auto	5.839596123437023	0.0	discard	17_6_in_5	Parallel run loop
auto	3.013251943344308	0.0	discard	7_8_in_8	Parallel run loop
auto	3.055752327695466	0.0	discard	20_5_in_8	Parallel run loop
auto	2.57086553360258	0.0	discard	14_5_in_8	Parallel run loop
auto	2.953665845198902	0.0	discard	10_5_in_6	Parallel run loop
auto	3.389995430732657	0.0	discard	16_6_in_8	Parallel run loop
auto	5.266575133750489	0.0	discard	26_6_in_CIRCLE	Parallel run loop
auto	5.222417810588005	0.0	discard	21_8_in_8	Parallel run loop
auto	5.085954598976742	0.0	keep	24_6_in_CIRCLE	Parallel run loop
auto	2.6315220312588257	0.0	keep	7_DOMINO_in_6	Parallel run loop
auto	4.287421360885064	0.0	discard	14_6_in_6	Parallel run loop
auto	5.191809705932578	0.0	keep	25_6_in_CIRCLE	Parallel run loop
auto	6.408094950662928	0.0	discard	20_8_in_CIRCLE	Parallel run loop
auto	5.76766116388135	0.0	discard	16_8_in_CIRCLE	Parallel run loop
auto	3.214216984114548	0.0	discard	10_DOMINO_in_6	Parallel run loop
auto	3.300980431842543	0.0	discard	15_6_in_8	Parallel run loop
auto	6.134720683760772	0.0	discard	19_6_in_5	Parallel run loop
auto	3.2336586610955442	0.0	discard	12_5_in_6	Parallel run loop
auto	5.407277882325043	0.0	discard	12_8_in_6	Parallel run loop
auto	3.8023746146681763	0.0	discard	20_5_in_CIRCLE	Parallel run loop
auto	4.937376466774466	0.0	discard	12_6_in_5	Parallel run loop
auto	5.96787115637767	0.0	discard	18_6_in_5	Parallel run loop
auto	5.803585986869996	0.0	discard	14_8_in_6	Parallel run loop
auto	8.571897635222657	0.0	discard	20_8_in_5	Parallel run loop
auto	4.092529834209793	0.0	discard	23_5_in_CIRCLE	Parallel run loop
auto	7.794562305764205	0.0	discard	19_8_in_DOMINO	Parallel run loop
auto	7.021084739848574	0.0	discard	20_8_in_6	Parallel run loop
auto	4.316151292780971	0.0	discard	17_6_in_CIRCLE	Parallel run loop
auto	3.8935082219066706	0.0	discard	14_6_in_CIRCLE	Parallel run loop
auto	4.016020462419165	0.0	discard	12_8_in_8	Parallel run loop
auto	1.8261429737118473	0.0	discard	7_5_in_8	Parallel run loop
auto	3.0005819980888866	0.0	discard	6_DOMINO_in_5	Parallel run loop
auto	3.9402133401017183	0.0	discard	14_5_in_DOMINO	Parallel run loop
auto	4.9125338429934695	0.0	discard	22_6_in_CIRCLE	Parallel run loop
auto	3.67413161069444	0.0	discard	9_DOMINO_in_5	Parallel run loop
auto	6.988532146169312	0.0	discard	13_8_in_5	Parallel run loop
auto	8.238698760322144	0.0	discard	21_8_in_DOMINO	Parallel run loop
auto	4.129846426323647	0.0	discard	15_5_in_DOMINO	Parallel run loop
auto	3.087624644501296	0.0	discard	13_6_in_8	Parallel run loop
auto	3.443042419757034	0.0	keep	12_DOMINO_in_6	Parallel run loop
auto	2.198224030578895	0.0	discard	9_DOMINO_in_8	Parallel run loop
auto	3.0793548370246726	0.0	discard	13_5_in_CIRCLE	Parallel run loop
auto	3.9895552022139587	0.0	discard	12_5_in_5	Parallel run loop
auto	4.77739666595167	0.0	discard	17_8_in_8	Parallel run loop
auto	3.672088484884481	0.0	keep	19_5_in_CIRCLE	Parallel run loop
auto	3.6577034435756794	0.0	discard	15_5_in_6	Parallel run loop
auto	7.939579459363951	0.0	discard	17_8_in_5	Parallel run loop
auto	3.5015432852757242	0.0	discard	8_DOMINO_in_5	Parallel run loop
auto	3.429337475000999	0.0	discard	9_8_in_8	Parallel run loop
auto	4.15748647722219	0.0	discard	16_6_in_CIRCLE	Parallel run loop
auto	6.379225450969315	0.0	discard	17_8_in_6	Parallel run loop
auto	3.2561120298168578	0.0	discard	7_DOMINO_in_5	Parallel run loop
auto	3.9584777795716133	0.0	discard	12_6_in_6	Parallel run loop
auto	3.8126405255728777	0.0	discard	11_5_in_5	Parallel run loop
auto	2.757555254323801	0.0	discard	16_5_in_8	Parallel run loop
auto	5.431937953348882	0.0	discard	15_6_in_5	Parallel run loop
auto	3.698483979583938	0.0	discard	8_6_in_DOMINO	Parallel run loop
auto	4.625750674048379	0.0	keep	20_6_in_CIRCLE	Parallel run loop
auto	4.865863965284076	0.0	discard	14_6_in_DOMINO	Parallel run loop
auto	2.443472754574046	0.0	keep	6_DOMINO_in_6	Parallel run loop
auto	4.880795652783389	0.0	discard	18_8_in_8	Parallel run loop
auto	3.619137531048797	0.0	discard	12_6_in_CIRCLE	Parallel run loop
auto	3.912663719069281	0.0	discard	21_5_in_CIRCLE	Parallel run loop
auto	6.099037994484778	0.0	discard	18_8_in_CIRCLE	Parallel run loop
auto	4.29961501261876	0.0	discard	14_8_in_8	Parallel run loop
auto	3.6165484031013064	0.0	keep	18_5_in_CIRCLE	Parallel run loop
auto	4.0121296694148905	0.0	discard	22_5_in_CIRCLE	Parallel run loop
auto	5.373206866816074	0.0	discard	14_8_in_CIRCLE	Parallel run loop
auto	4.679551114494732	0.0	discard	17_5_in_5	Parallel run loop
auto	5.118118581027425	0.0	discard	13_6_in_5	Parallel run loop
auto	4.520586378308617	0.0	discard	21_DOMINO_in_6	Parallel run loop
auto	6.578730071430992	0.0	discard	14_8_in_DOMINO	Parallel run loop
auto	7.645526350820605	0.0	discard	16_8_in_5	Parallel run loop
auto	4.98239171642297	0.0	discard	19_5_in_5	Parallel run loop
auto	5.310683556026722	0.0	discard	14_6_in_5	Parallel run loop
auto	3.3339172668580326	0.0	keep	11_DOMINO_in_6	Parallel run loop
auto	2.968904728936534	0.0	discard	19_5_in_8	Parallel run loop
auto	3.7491238161458025	0.0	discard	20_6_in_8	Parallel run loop
auto	8.14847732217796	0.0	discard	18_8_in_5	Parallel run loop
auto	5.004581469793775	0.0	discard	23_6_in_CIRCLE	Parallel run loop
auto	4.480124023637546	0.0	discard	15_8_in_8	Parallel run loop
auto	3.7950462907018387	0.0	discard	7_8_in_CIRCLE	Parallel run loop
auto	7.180558738898597	0.0	discard	14_8_in_5	Parallel run loop
auto	6.42361900877598	0.0	discard	21_6_in_5	Parallel run loop
auto	3.463680674666948	0.0	discard	9_5_in_5	Parallel run loop
auto	3.509704759175081	0.0	discard	17_5_in_CIRCLE	Parallel run loop
auto	2.9377634562638297	0.0	discard	12_6_in_8	Parallel run loop
auto	8.365946794416464	0.0	discard	19_8_in_5	Parallel run loop
auto	2.901054354602868	0.0	discard	18_5_in_8	Parallel run loop
auto	7.386904767147098	0.0	discard	15_8_in_5	Parallel run loop
auto	3.1527750330791813	0.0	discard	14_6_in_8	Parallel run loop
auto	4.0877788699043	0.0	discard	13_5_in_5	Parallel run loop
auto	5.636369710672743	0.0	discard	16_6_in_5	Parallel run loop
auto	3.498395495831623	0.0	discard	17_6_in_8	Parallel run loop
auto	4.619342824798609	0.0	discard	16_8_in_8	Parallel run loop
auto	2.8192851731777258	0.0	discard	17_5_in_8	Parallel run loop
auto	2.9058194154154107	0.0	discard	8_DOMINO_in_6	Parallel run loop
auto	2.3365233755366446	0.0	discard	10_DOMINO_in_8	Parallel run loop
auto	3.013251943344308	0.0	discard	7_8_in_8	Parallel run loop
auto	5.839596123437023	0.0	discard	17_6_in_5	Parallel run loop
auto	2.57086553360258	0.0	discard	14_5_in_8	Parallel run loop
auto	2.953665845198902	0.0	discard	10_5_in_6	Parallel run loop
auto	3.055752327695466	0.0	discard	20_5_in_8	Parallel run loop
auto	5.222417810588005	0.0	discard	21_8_in_8	Parallel run loop
auto	4.950411303539053	0.0	discard	22_5_in_DOMINO	Parallel run loop
auto	5.266575133750489	0.0	discard	26_6_in_CIRCLE	Parallel run loop
auto	5.105393906000926	0.0	discard	24_6_in_CIRCLE	Parallel run loop
auto	3.389995430732657	0.0	discard	16_6_in_8	Parallel run loop
auto	2.6317698704575285	0.0	discard	7_DOMINO_in_6	Parallel run loop
auto	4.287421360885064	0.0	discard	14_6_in_6	Parallel run loop
auto	6.566008958695746	0.0	discard	22_6_in_5	Parallel run loop
auto	5.211512366335625	0.0	discard	25_6_in_CIRCLE	Parallel run loop
auto	6.408094950662928	0.0	discard	20_8_in_CIRCLE	Parallel run loop
auto	5.58607531121421	0.0	discard	24_8_in_8	Parallel run loop
auto	3.8008538929495774	0.0	discard	20_5_in_CIRCLE	Parallel run loop
auto	3.2336586610955442	0.0	discard	12_5_in_6	Parallel run loop
auto	5.407277882325043	0.0	discard	12_8_in_6	Parallel run loop
auto	6.134720683760772	0.0	discard	19_6_in_5	Parallel run loop
auto	5.96787115637767	0.0	discard	18_6_in_5	Parallel run loop
auto	5.058315469467992	0.0	discard	20_5_in_5	Parallel run loop
auto	4.7995534643422655	0.0	discard	18_5_in_5	Parallel run loop
auto	3.1326434895629753	0.0	discard	21_5_in_8	Parallel run loop
auto	8.571897635222657	0.0	discard	20_8_in_5	Parallel run loop
