commit	score	memory_gb	status	problem	description
auto	1.3572799397019801	0.0	discard	8_3_in_6	Parallel run loop
auto	4.90677502707631	0.0	discard	10_5_in_4	Parallel run loop
auto	6.511348607795944	0.0	discard	6_8_in_4	Parallel run loop
auto	9.965839169619713	0.0	discard	12_6_in_3	Parallel run loop
auto	9.549077413600408	0.0	discard	11_6_in_3	Parallel run loop
auto	6.836942457137506	0.0	discard	3_8_in_3	Parallel run loop
auto	1.5546040447651086	0.0	discard	2_5_in_DOMINO	Parallel run loop
auto	6.309426277028839	0.0	discard	6_DOMINO_in_3	Parallel run loop
auto	0.8036669940717013	0.0	discard	5_3_in_8	Parallel run loop
auto	8.644990984048102	0.0	discard	9_6_in_3	Parallel run loop
auto	4.600466522759794	0.0	discard	9_5_in_4	Parallel run loop
auto	8.334285134687851	0.0	discard	8_6_in_3	Parallel run loop
auto	13.248748645382669	0.0	discard	11_8_in_3	Parallel run loop
auto	2.232256557748311	0.0	discard	9_4_in_6	Parallel run loop
auto	2.409476578918404	0.0	keep	11_4_in_6	Parallel run loop
auto	2.3890368551028365	0.0	discard	4_8_in_8	Parallel run loop
auto	2.5654377741581933	0.0	discard	8_4_in_5	Parallel run loop
auto	4.180372828743098	0.0	discard	7_5_in_4	Parallel run loop
auto	3.1025322179905857	0.0	discard	4_5_in_4	Parallel run loop
auto	3.278148122951711	0.0	discard	4_8_in_6	Parallel run loop
auto	7.0356339305232325	0.0	discard	7_8_in_4	Parallel run loop
auto	15.671190313492895	0.0	discard	16_8_in_3	Parallel run loop
auto	1.2773559305766378	0.0	discard	7_3_in_6	Parallel run loop
auto	1.8221266057306487	0.0	discard	6_4_in_6	Parallel run loop
auto	1.6817805984017322	0.0	keep	10_4_in_8	Parallel run loop
auto	5.521152154180106	0.0	discard	13_5_in_4	Parallel run loop
auto	5.828435470809099	0.0	discard	5_8_in_4	Parallel run loop
auto	8.57613463275667	0.0	discard	11_8_in_4	Parallel run loop
auto	5.115953738143804	0.0	discard	11_5_in_4	Parallel run loop
auto	3.5490409630937405	0.0	discard	5_5_in_4	Parallel run loop
auto	2.694081305519931	0.0	discard	9_4_in_5	Parallel run loop
auto	8.191207309046817	0.0	keep	12_5_in_3	Parallel run loop
auto	8.242726706535532	0.0	discard	10_8_in_4	Parallel run loop
auto	2.5886081332922775	0.0	discard	4_DOMINO_in_5	Parallel run loop
auto	7.939010552476867	0.0	discard	11_5_in_3	Parallel run loop
auto	1.8946917763403228	0.0	discard	2_6_in_DOMINO	Parallel run loop
auto	3.7678117974672194	0.0	discard	5_DOMINO_in_4	Parallel run loop
auto	1.4369065696866217	0.0	discard	7_4_in_8	Parallel run loop
auto	7.154716786844683	0.0	discard	8_DOMINO_in_3	Parallel run loop
auto	7.089787898053598	0.0	discard	9_5_in_3	Parallel run loop
auto	6.836942457137506	0.0	discard	3_8_in_3	Parallel run loop
auto	16.078167710405083	0.0	discard	17_8_in_3	Parallel run loop
auto	14.043894378809615	0.0	discard	13_8_in_3	Parallel run loop
auto	9.548866566331164	0.0	discard	11_6_in_3	Parallel run loop
auto	4.394719552807431	0.0	discard	8_5_in_4	Parallel run loop
auto	8.378731213157199	0.0	keep	13_5_in_3	Parallel run loop
auto	0.9877828664565054	0.0	keep	8_3_in_8	Parallel run loop
auto	1.5546040447651086	0.0	discard	2_5_in_DOMINO	Parallel run loop
auto	4.9066783874721205	0.0	discard	10_5_in_4	Parallel run loop
auto	9.323309384601313	0.0	discard	16_5_in_3	Parallel run loop
auto	8.333767009016682	0.0	discard	8_6_in_3	Parallel run loop
auto	8.64534498420694	0.0	discard	9_6_in_3	Parallel run loop
auto	0.8036669940717013	0.0	discard	5_3_in_8	Parallel run loop
auto	1.357174773389171	0.0	discard	8_3_in_6	Parallel run loop
auto	9.581576592877832	0.0	keep	17_5_in_3	Parallel run loop
auto	9.968276555392807	0.0	discard	12_6_in_3	Parallel run loop
auto	5.828435470809099	0.0	discard	5_8_in_4	Parallel run loop
auto	2.5654347018722725	0.0	discard	8_4_in_5	Parallel run loop
auto	3.2781514321939516	0.0	discard	4_8_in_6	Parallel run loop
auto	1.2773518064141203	0.0	keep	7_3_in_6	Parallel run loop
auto	2.4095699389209786	0.0	discard	11_4_in_6	Parallel run loop
auto	3.1025322179905857	0.0	discard	4_5_in_4	Parallel run loop
auto	1.9834743795450986	0.0	discard	14_4_in_8	Parallel run loop
auto	15.662595351861313	0.0	discard	16_8_in_3	Parallel run loop
auto	8.57659784505855	0.0	discard	11_8_in_4	Parallel run loop
auto	9.199860620713718	0.0	keep	13_8_in_4	Parallel run loop
auto	2.3890280931586987	0.0	discard	4_8_in_8	Parallel run loop
auto	5.9032119098286	0.0	keep	15_5_in_4	Parallel run loop
auto	10.291309731963905	0.0	keep	13_6_in_3	Parallel run loop
auto	6.614052791832837	0.0	discard	7_DOMINO_in_3	Parallel run loop
auto	4.600371256506449	0.0	keep	9_5_in_4	Parallel run loop
auto	9.548430084825512	0.0	discard	11_6_in_3	Parallel run loop
auto	14.04239935080187	0.0	keep	13_8_in_3	Parallel run loop
auto	2.793358383129364	0.0	discard	10_4_in_5	Parallel run loop
auto	7.154727598282767	0.0	discard	8_DOMINO_in_3	Parallel run loop
auto	11.364762495563992	0.0	keep	16_6_in_3	Parallel run loop
auto	1.8946917763403228	0.0	discard	2_6_in_DOMINO	Parallel run loop
auto	7.090068650140846	0.0	discard	9_5_in_3	Parallel run loop
auto	8.24278481486352	0.0	discard	10_8_in_4	Parallel run loop
auto	2.6940262622228293	0.0	discard	9_4_in_5	Parallel run loop
auto	8.1914959246825	0.0	discard	12_5_in_3	Parallel run loop
auto	1.4369076315702392	0.0	discard	7_4_in_8	Parallel run loop
auto	5.697054121886641	0.0	keep	14_5_in_4	Parallel run loop
auto	1.6817603190706747	0.0	keep	10_4_in_8	Parallel run loop
auto	5.116104204995974	0.0	discard	11_5_in_4	Parallel run loop
auto	16.075375912419812	0.0	keep	17_8_in_3	Parallel run loop
auto	5.5214698384237515	0.0	discard	13_5_in_4	Parallel run loop
auto	6.836942457137506	0.0	discard	3_8_in_3	Parallel run loop
auto	3.1025322179905857	0.0	discard	4_5_in_4	Parallel run loop
auto	1.3569408363551942	0.0	discard	8_3_in_6	Parallel run loop
auto	8.644990984048102	0.0	discard	9_6_in_3	Parallel run loop
auto	8.816456661132593	0.0	discard	12_8_in_4	Parallel run loop
auto	16.457386307046985	0.0	discard	18_8_in_3	Parallel run loop
auto	1.8976741370100267	0.0	discard	13_4_in_8	Parallel run loop
auto	4.906449805825038	0.0	keep	10_5_in_4	Parallel run loop
auto	0.9877828664565054	0.0	discard	8_3_in_8	Parallel run loop
auto	8.37894264557814	0.0	discard	13_5_in_3	Parallel run loop
auto	9.584068164120849	0.0	discard	17_5_in_3	Parallel run loop
auto	2.5654317567099265	0.0	discard	8_4_in_5	Parallel run loop
auto	9.311760583861163	0.0	discard	16_5_in_3	Parallel run loop
auto	1.2773688486821722	0.0	discard	7_3_in_6	Parallel run loop
auto	4.394719552807431	0.0	discard	8_5_in_4	Parallel run loop
auto	9.9656698022305	0.0	discard	12_6_in_3	Parallel run loop
auto	1.1993367066884737	0.0	keep	12_3_in_8	Parallel run loop
auto	1.9841798399371886	0.0	discard	14_4_in_8	Parallel run loop
auto	8.24270426061656	0.0	discard	10_8_in_4	Parallel run loop
auto	9.200031088085813	0.0	discard	13_8_in_4	Parallel run loop
auto	6.065686622952491	0.0	keep	16_5_in_4	Parallel run loop
auto	4.600471342541195	0.0	discard	9_5_in_4	Parallel run loop
auto	6.239804215577649	0.0	keep	17_5_in_4	Parallel run loop
auto	7.154809860165933	0.0	discard	8_DOMINO_in_3	Parallel run loop
auto	2.6939935131257275	0.0	keep	9_4_in_5	Parallel run loop
auto	5.905558053637779	0.0	discard	15_5_in_4	Parallel run loop
auto	10.293805144196833	0.0	discard	13_6_in_3	Parallel run loop
auto	10.449895341199724	0.0	discard	17_8_in_4	Parallel run loop
auto	15.662595351861313	0.0	discard	16_8_in_3	Parallel run loop
auto	6.614052791832837	0.0	discard	7_DOMINO_in_3	Parallel run loop
auto	2.389029563298287	0.0	discard	4_8_in_8	Parallel run loop
auto	5.635408328924276	0.0	discard	6_5_in_3	Parallel run loop
auto	1.1456906264640168	0.0	discard	11_3_in_8	Parallel run loop
auto	2.40948436918319	0.0	discard	11_4_in_6	Parallel run loop
auto	11.659043235523658	0.0	discard	17_6_in_3	Parallel run loop
auto	5.697678770535235	0.0	discard	14_5_in_4	Parallel run loop
auto	5.115940017863461	0.0	discard	11_5_in_4	Parallel run loop
auto	9.548430084825512	0.0	discard	11_6_in_3	Parallel run loop
auto	8.591029485537717	0.0	keep	14_5_in_3	Parallel run loop
auto	8.191207309046817	0.0	discard	12_5_in_3	Parallel run loop
auto	2.0318793644075943	0.0	keep	15_4_in_8	Parallel run loop
auto	8.644990984048102	0.0	discard	9_6_in_3	Parallel run loop
auto	1.8946917763403228	0.0	discard	2_6_in_DOMINO	Parallel run loop
auto	8.57613463275667	0.0	discard	11_8_in_4	Parallel run loop
auto	1.6817603190706747	0.0	discard	10_4_in_8	Parallel run loop
auto	11.366760246350553	0.0	discard	16_6_in_3	Parallel run loop
auto	5.521152154180106	0.0	discard	13_5_in_4	Parallel run loop
auto	5.232771882034677	0.0	discard	12_5_in_4	Parallel run loop
auto	0.9245400229687899	0.0	discard	7_3_in_8	Parallel run loop
auto	4.90677502707631	0.0	discard	10_5_in_4	Parallel run loop
auto	2.793439909071686	0.0	discard	10_4_in_5	Parallel run loop
auto	1.3569408363551942	0.0	discard	8_3_in_6	Parallel run loop
auto	16.457386307046985	0.0	discard	18_8_in_3	Parallel run loop
auto	0.9877828664565054	0.0	discard	8_3_in_8	Parallel run loop
auto	10.769501071004893	0.0	discard	22_5_in_3	Parallel run loop
auto	16.079376927145873	0.0	discard	17_8_in_3	Parallel run loop
auto	9.304804612391116	0.0	discard	16_5_in_3	Parallel run loop
auto	8.378731213157199	0.0	discard	13_5_in_3	Parallel run loop
auto	8.816456661132593	0.0	discard	12_8_in_4	Parallel run loop
auto	9.9656698022305	0.0	discard	12_6_in_3	Parallel run loop
auto	9.583130624808957	0.0	discard	17_5_in_3	Parallel run loop
auto	9.450041619231504	0.0	discard	14_8_in_4	Parallel run loop
auto	11.002992420145086	0.0	discard	23_5_in_3	Parallel run loop
auto	6.898980293351454	0.0	discard	6_6_in_3	Parallel run loop
auto	14.043894378809615	0.0	discard	13_8_in_3	Parallel run loop
auto	2.5725628709328703	0.0	discard	13_4_in_6	Parallel run loop
auto	2.185933334044359	0.0	discard	6_4_in_5	Parallel run loop
auto	9.789767129433292	0.0	discard	18_5_in_3	Parallel run loop
auto	1.4343288179215334	0.0	discard	9_3_in_6	Parallel run loop
auto	2.6939935131257275	0.0	discard	9_4_in_5	Parallel run loop
auto	5.635408328924276	0.0	discard	6_5_in_3	Parallel run loop
auto	1.1993899295054125	0.0	discard	12_3_in_8	Parallel run loop
auto	6.06669523698826	0.0	discard	16_5_in_4	Parallel run loop
auto	1.6238454871058032	0.0	discard	12_3_in_6	Parallel run loop
auto	6.565976529390174	0.0	discard	19_5_in_4	Parallel run loop
auto	6.614052791832837	0.0	discard	7_DOMINO_in_3	Parallel run loop
auto	5.90432699255411	0.0	discard	15_5_in_4	Parallel run loop
auto	10.290725125856296	0.0	keep	13_6_in_3	Parallel run loop
auto	1.7315919978066232	0.0	discard	11_4_in_8	Parallel run loop
auto	1.8969913822028721	0.0	keep	13_4_in_8	Parallel run loop
auto	1.983447447219101	0.0	discard	14_4_in_8	Parallel run loop
auto	2.4096021463836963	0.0	discard	11_4_in_6	Parallel run loop
auto	15.662595351861313	0.0	discard	16_8_in_3	Parallel run loop
auto	4.600495981549959	0.0	discard	9_5_in_4	Parallel run loop
auto	6.241153196492764	0.0	discard	17_5_in_4	Parallel run loop
auto	7.045278149126972	0.0	keep	22_5_in_4	Parallel run loop
auto	11.371595632874065	0.0	discard	16_6_in_3	Parallel run loop
auto	10.449895341199724	0.0	discard	17_8_in_4	Parallel run loop
auto	2.0327414872789515	0.0	discard	15_4_in_8	Parallel run loop
auto	11.191963094715094	0.0	discard	24_5_in_3	Parallel run loop
auto	1.2375424699839104	0.0	discard	13_3_in_8	Parallel run loop
auto	5.697916941560603	0.0	discard	14_5_in_4	Parallel run loop
auto	1.1456649393709497	0.0	keep	11_3_in_8	Parallel run loop
auto	9.199866705847468	0.0	discard	13_8_in_4	Parallel run loop
auto	10.970349764238584	0.0	discard	19_8_in_4	Parallel run loop
auto	1.6817805984017322	0.0	discard	10_4_in_8	Parallel run loop
auto	7.218582179364585	0.0	discard	23_5_in_4	Parallel run loop
auto	11.65685026745529	0.0	discard	17_6_in_3	Parallel run loop
auto	2.7933426344822223	0.0	discard	10_4_in_5	Parallel run loop
auto	0.9245400229687899	0.0	discard	7_3_in_8	Parallel run loop
auto	5.521152154180106	0.0	discard	13_5_in_4	Parallel run loop
auto	8.156697123581322	0.0	discard	11_DOMINO_in_3	Parallel run loop
auto	14.042758537775752	0.0	discard	13_8_in_3	Parallel run loop
auto	0.9877828664565054	0.0	discard	8_3_in_8	Parallel run loop
auto	16.07145450097547	0.0	keep	17_8_in_3	Parallel run loop
auto	16.429112380319218	0.0	keep	18_8_in_3	Parallel run loop
auto	9.935253543663116	0.0	keep	19_5_in_3	Parallel run loop
auto	8.593681552142662	0.0	discard	14_5_in_3	Parallel run loop
auto	2.890915757533456	0.0	keep	11_4_in_5	Parallel run loop
auto	5.2328707828465015	0.0	discard	12_5_in_4	Parallel run loop
auto	8.37894264557814	0.0	discard	13_5_in_3	Parallel run loop
auto	8.816456661132593	0.0	discard	12_8_in_4	Parallel run loop
auto	9.304804612391116	0.0	discard	16_5_in_3	Parallel run loop
auto	9.583130624808957	0.0	discard	17_5_in_3	Parallel run loop
auto	10.770151701780039	0.0	discard	22_5_in_3	Parallel run loop
auto	1.8969612395368383	0.0	keep	13_4_in_8	Parallel run loop
auto	6.614052791832837	0.0	discard	7_DOMINO_in_3	Parallel run loop
auto	13.414602658370956	0.0	keep	23_6_in_3	Parallel run loop
auto	1.1993692444250315	0.0	discard	12_3_in_8	Parallel run loop
auto	9.785646148055216	0.0	keep	18_5_in_3	Parallel run loop
auto	11.00377502996618	0.0	discard	23_5_in_3	Parallel run loop
auto	7.3390476696530005	0.0	discard	24_5_in_4	Parallel run loop
auto	10.288910091074099	0.0	keep	13_6_in_3	Parallel run loop
auto	6.898980293351454	0.0	discard	6_6_in_3	Parallel run loop
auto	1.9833282766528608	0.0	keep	14_4_in_8	Parallel run loop
auto	1.4343288179215334	0.0	discard	9_3_in_6	Parallel run loop
auto	2.5725085129527017	0.0	discard	13_4_in_6	Parallel run loop
auto	1.623716933602238	0.0	keep	12_3_in_6	Parallel run loop
auto	9.450270828143742	0.0	discard	14_8_in_4	Parallel run loop
auto	3.479411307571736	0.0	keep	16_4_in_5	Parallel run loop
auto	6.066262476904827	0.0	discard	16_5_in_4	Parallel run loop
auto	6.855994971480812	0.0	keep	21_5_in_4	Parallel run loop
auto	1.1456649393709497	0.0	discard	11_3_in_8	Parallel run loop
auto	10.449895341199724	0.0	discard	17_8_in_4	Parallel run loop
auto	9.19980751809371	0.0	keep	13_8_in_4	Parallel run loop
auto	6.566117569126898	0.0	discard	19_5_in_4	Parallel run loop
auto	14.239474570366355	0.0	keep	14_8_in_3	Parallel run loop
auto	5.635408328924276	0.0	discard	6_5_in_3	Parallel run loop
auto	1.2375424699839104	0.0	discard	13_3_in_8	Parallel run loop
auto	9.315779776455196	0.0	keep	6_8_in_3	Parallel run loop
auto	5.9032119098286	0.0	discard	15_5_in_4	Parallel run loop
auto	1.7315566334976624	0.0	discard	11_4_in_8	Parallel run loop
auto	1.2764112870663034	0.0	keep	14_3_in_8	Parallel run loop
auto	2.7560198222274126	0.0	keep	15_4_in_6	Parallel run loop
auto	6.243932143191826	0.0	discard	17_5_in_4	Parallel run loop
auto	7.207779313174355	0.0	keep	23_5_in_4	Parallel run loop
auto	5.464140210439507	0.0	discard	5_DOMINO_in_3	Parallel run loop
auto	2.0327414872789515	0.0	discard	15_4_in_8	Parallel run loop
auto	7.172393485589609	0.0	discard	10_5_in_3	Parallel run loop
auto	3.2350495411955666	0.0	keep	21_4_in_6	Parallel run loop
auto	1.6817603190706747	0.0	discard	10_4_in_8	Parallel run loop
auto	5.698935460853391	0.0	discard	14_5_in_4	Parallel run loop
auto	10.614485498014872	0.0	keep	18_8_in_4	Parallel run loop
auto	7.045725797328264	0.0	discard	22_5_in_4	Parallel run loop
auto	11.372099050189675	0.0	discard	16_6_in_3	Parallel run loop
auto	10.979680926536282	0.0	discard	19_8_in_4	Parallel run loop
auto	8.155432269863203	0.0	keep	11_DOMINO_in_3	Parallel run loop
auto	8.59131682040669	0.0	discard	14_5_in_3	Parallel run loop
auto	16.55183493839955	0.0	discard	19_8_in_3	Parallel run loop
auto	5.232690690208094	0.0	discard	12_5_in_4	Parallel run loop
auto	2.443377223844914	0.0	discard	12_4_in_6	Parallel run loop
auto	11.202701052199338	0.0	discard	24_5_in_3	Parallel run loop
auto	11.646201004217778	0.0	discard	17_6_in_3	Parallel run loop
auto	8.81692661953193	0.0	discard	12_8_in_4	Parallel run loop
auto	16.457656620123252	0.0	discard	18_8_in_3	Parallel run loop
auto	14.042691357364726	0.0	discard	13_8_in_3	Parallel run loop
auto	0.9245400229687899	0.0	discard	7_3_in_8	Parallel run loop
auto	8.378435377132936	0.0	keep	13_5_in_3	Parallel run loop
auto	10.769501071004893	0.0	discard	22_5_in_3	Parallel run loop
auto	13.632305857101928	0.0	discard	24_6_in_3	Parallel run loop
auto	6.898980293351454	0.0	discard	6_6_in_3	Parallel run loop
auto	2.820158249183454	0.0	keep	16_4_in_6	Parallel run loop
auto	2.793358383129364	0.0	discard	10_4_in_5	Parallel run loop
auto	0.9878086818367927	0.0	discard	8_3_in_8	Parallel run loop
auto	1.0751942192379291	0.0	keep	10_3_in_8	Parallel run loop
auto	2.890915757533456	0.0	discard	11_4_in_5	Parallel run loop
auto	9.935253543663116	0.0	discard	19_5_in_3	Parallel run loop
auto	9.581576592877832	0.0	discard	17_5_in_3	Parallel run loop
auto	3.121832026809895	0.0	discard	13_4_in_5	Parallel run loop
auto	16.079376927145873	0.0	discard	17_8_in_3	Parallel run loop
auto	6.664754455585294	0.0	keep	20_5_in_4	Parallel run loop
auto	11.00172553479279	0.0	keep	23_5_in_3	Parallel run loop
auto	9.451041839494088	0.0	discard	14_8_in_4	Parallel run loop
auto	7.338477230761274	0.0	keep	24_5_in_4	Parallel run loop
auto	12.190005605884524	0.0	keep	29_5_in_3	Parallel run loop
auto	1.8970361599905043	0.0	discard	13_4_in_8	Parallel run loop
auto	1.8612111964898277	0.0	discard	7_4_in_6	Parallel run loop
auto	2.572407461084219	0.0	discard	13_4_in_6	Parallel run loop
auto	9.656854597267445	0.0	keep	15_8_in_4	Parallel run loop
auto	7.3126018719068995	0.0	keep	9_DOMINO_in_3	Parallel run loop
auto	1.9833282766528608	0.0	discard	14_4_in_8	Parallel run loop
auto	10.28940876897214	0.0	discard	13_6_in_3	Parallel run loop
auto	1.1993423099351999	0.0	discard	12_3_in_8	Parallel run loop
auto	12.40347096897882	0.0	discard	30_5_in_3	Parallel run loop
auto	9.790800753311645	0.0	discard	18_5_in_3	Parallel run loop
auto	1.7316538987796435	0.0	discard	11_4_in_8	Parallel run loop
auto	3.479419267413941	0.0	discard	16_4_in_5	Parallel run loop
auto	1.6238715585064813	0.0	discard	12_3_in_6	Parallel run loop
auto	5.63541341028345	0.0	discard	6_5_in_3	Parallel run loop
auto	6.06669523698826	0.0	discard	16_5_in_4	Parallel run loop
auto	5.9032119098286	0.0	discard	15_5_in_4	Parallel run loop
auto	2.766989065083348	0.0	discard	15_4_in_6	Parallel run loop
auto	1.95592716935304	0.0	discard	5_4_in_5	Parallel run loop
auto	6.559110050612426	0.0	discard	19_5_in_4	Parallel run loop
auto	3.314757120833075	0.0	discard	22_4_in_6	Parallel run loop
auto	10.110839754113679	0.0	discard	20_5_in_3	Parallel run loop
auto	13.415666255457156	0.0	discard	23_6_in_3	Parallel run loop
auto	6.855994971480812	0.0	discard	21_5_in_4	Parallel run loop
auto	9.315789363255375	0.0	discard	6_8_in_3	Parallel run loop
auto	1.2375424699839104	0.0	discard	13_3_in_8	Parallel run loop
auto	14.24080134149529	0.0	discard	14_8_in_3	Parallel run loop
auto	1.2766608702562512	0.0	discard	14_3_in_8	Parallel run loop
auto	10.980723806978341	0.0	discard	19_8_in_4	Parallel run loop
auto	10.618230812343883	0.0	discard	18_8_in_4	Parallel run loop
auto	6.327982142264967	0.0	keep	18_5_in_4	Parallel run loop
auto	9.199762078842069	0.0	keep	13_8_in_4	Parallel run loop
auto	1.6666725690736295	0.0	discard	13_3_in_6	Parallel run loop
auto	6.242833112717157	0.0	discard	17_5_in_4	Parallel run loop
auto	5.464140210439507	0.0	discard	5_DOMINO_in_3	Parallel run loop
auto	2.0327414872789515	0.0	discard	15_4_in_8	Parallel run loop
auto	1.1457140987651178	0.0	discard	11_3_in_8	Parallel run loop
auto	7.046050674069792	0.0	discard	22_5_in_4	Parallel run loop
auto	3.2419942197836473	0.0	discard	21_4_in_6	Parallel run loop
auto	8.593681552142662	0.0	discard	14_5_in_3	Parallel run loop
auto	10.449895341199724	0.0	discard	17_8_in_4	Parallel run loop
auto	11.659043235523658	0.0	discard	17_6_in_3	Parallel run loop
auto	13.011165710784399	0.0	discard	22_6_in_3	Parallel run loop
auto	7.218355925758169	0.0	discard	23_5_in_4	Parallel run loop
auto	11.197299676890633	0.0	discard	24_5_in_3	Parallel run loop
auto	2.4433764206058397	0.0	keep	12_4_in_6	Parallel run loop
auto	7.172393485589609	0.0	discard	10_5_in_3	Parallel run loop
auto	10.770151701780039	0.0	discard	22_5_in_3	Parallel run loop
auto	3.12141277502547	0.0	keep	13_4_in_5	Parallel run loop
auto	11.337649935397504	0.0	keep	25_5_in_3	Parallel run loop
auto	8.155250286838498	0.0	keep	11_DOMINO_in_3	Parallel run loop
auto	5.232382168704193	0.0	keep	12_5_in_4	Parallel run loop
auto	2.8203937082772974	0.0	discard	16_4_in_6	Parallel run loop
auto	2.8908359199570595	0.0	keep	11_4_in_5	Parallel run loop
auto	2.621388410885791	0.0	keep	14_4_in_6	Parallel run loop
auto	1.0751942192379291	0.0	discard	10_3_in_8	Parallel run loop
auto	6.667283297662148	0.0	discard	20_5_in_4	Parallel run loop
auto	9.935253543663116	0.0	discard	19_5_in_3	Parallel run loop
auto	16.548007467301627	0.0	discard	19_8_in_3	Parallel run loop
auto	6.898980293351454	0.0	discard	6_6_in_3	Parallel run loop
auto	2.5723633048509797	0.0	discard	13_4_in_6	Parallel run loop
auto	9.45128157814493	0.0	discard	14_8_in_4	Parallel run loop
auto	13.639484473062398	0.0	discard	24_6_in_3	Parallel run loop
auto	10.995706341267324	0.0	keep	23_5_in_3	Parallel run loop
auto	9.656902445706843	0.0	discard	15_8_in_4	Parallel run loop
auto	11.489608389639638	0.0	discard	26_5_in_3	Parallel run loop
auto	8.694730499167349	0.0	keep	15_5_in_3	Parallel run loop
auto	3.479495219930474	0.0	discard	16_4_in_5	Parallel run loop
auto	13.406953464083857	0.0	keep	23_6_in_3	Parallel run loop
auto	1.1994095725911946	0.0	discard	12_3_in_8	Parallel run loop
auto	1.8969913822028721	0.0	discard	13_4_in_8	Parallel run loop
auto	12.42429689769431	0.0	discard	30_5_in_3	Parallel run loop
auto	3.5412316788645684	0.0	keep	17_4_in_5	Parallel run loop
auto	7.3390476696530005	0.0	discard	24_5_in_4	Parallel run loop
auto	9.785646148055216	0.0	discard	18_5_in_3	Parallel run loop
auto	7.317204392650463	0.0	discard	9_DOMINO_in_3	Parallel run loop
auto	1.8612129236313664	0.0	discard	7_4_in_6	Parallel run loop
auto	12.208038296240993	0.0	discard	29_5_in_3	Parallel run loop
