commit	score	memory_gb	status	problem	description
auto	2.0051996327520683	0.0	discard	7_DOMINO_in_8	Parallel run loop
auto	3.2342712519580337	0.0	discard	12_DOMINO_in_CIRCLE	Parallel run loop
auto	8.791744205000827	0.0	discard	14_DOMINO_in_3	Parallel run loop
auto	9.493652924802479	0.0	discard	16_DOMINO_in_3	Parallel run loop
auto	6.864504648488255	0.0	discard	19_DOMINO_in_4	Parallel run loop
auto	5.961436090702017	0.0	discard	14_DOMINO_in_4	Parallel run loop
auto	8.651091643465453	0.0	discard	13_DOMINO_in_3	Parallel run loop
auto	10.651500718525643	0.0	discard	20_DOMINO_in_3	Parallel run loop
auto	11.260853826103226	0.0	discard	23_DOMINO_in_3	Parallel run loop
auto	7.03616573595127	0.0	discard	20_DOMINO_in_4	Parallel run loop
auto	12.261313043390997	0.0	discard	27_DOMINO_in_3	Parallel run loop
auto	3.1860393694450497	0.0	discard	11_DOMINO_in_CIRCLE	Parallel run loop
auto	3.759141572791398	0.0	discard	17_DOMINO_in_CIRCLE	Parallel run loop
auto	11.881182844607538	0.0	discard	25_DOMINO_in_3	Parallel run loop
auto	4.882630265799585	0.0	discard	19_DOMINO_in_DOMINO	Parallel run loop
auto	4.282850583980959	0.0	discard	13_DOMINO_in_5	Parallel run loop
auto	11.10639567382138	0.0	discard	22_DOMINO_in_3	Parallel run loop
auto	12.650561160806369	0.0	discard	26_DOMINO_in_3	Parallel run loop
auto	5.202412276418183	0.0	discard	28_DOMINO_in_6	Parallel run loop
auto	2.0051996327520683	0.0	discard	7_DOMINO_in_8	Parallel run loop
auto	2.803879883664299	0.0	discard	9_DOMINO_in_CIRCLE	Parallel run loop
auto	8.791744205000827	0.0	discard	14_DOMINO_in_3	Parallel run loop
auto	9.493652924802479	0.0	discard	16_DOMINO_in_3	Parallel run loop
auto	5.961436090702017	0.0	discard	14_DOMINO_in_4	Parallel run loop
auto	6.864504648488255	0.0	discard	19_DOMINO_in_4	Parallel run loop
auto	11.505387066184918	0.0	discard	24_DOMINO_in_3	Parallel run loop
auto	10.651500718525643	0.0	discard	20_DOMINO_in_3	Parallel run loop
auto	10.95333223592899	0.0	discard	21_DOMINO_in_3	Parallel run loop
auto	3.8921243667471783	0.0	discard	16_DOMINO_in_6	Parallel run loop
auto	2.9559621946049712	0.0	discard	10_DOMINO_in_CIRCLE	Parallel run loop
auto	2.6915521371235593	0.0	discard	8_DOMINO_in_CIRCLE	Parallel run loop
auto	3.827281560659983	0.0	discard	11_DOMINO_in_DOMINO	Parallel run loop
auto	4.882630265799585	0.0	discard	19_DOMINO_in_DOMINO	Parallel run loop
auto	4.282850583980959	0.0	discard	13_DOMINO_in_5	Parallel run loop
auto	8.651091643465453	0.0	discard	13_DOMINO_in_3	Parallel run loop
auto	5.012765064798198	0.0	discard	20_DOMINO_in_DOMINO	Parallel run loop
auto	11.260853826103226	0.0	discard	23_DOMINO_in_3	Parallel run loop
auto	7.03616573595127	0.0	discard	20_DOMINO_in_4	Parallel run loop
auto	2.0051996327520683	0.0	discard	7_DOMINO_in_8	Parallel run loop
auto	12.261313043390997	0.0	discard	27_DOMINO_in_3	Parallel run loop
auto	8.791744205000827	0.0	discard	14_DOMINO_in_3	Parallel run loop
auto	9.493652924802479	0.0	discard	16_DOMINO_in_3	Parallel run loop
auto	5.961436090702017	0.0	discard	14_DOMINO_in_4	Parallel run loop
auto	6.864504648488255	0.0	discard	19_DOMINO_in_4	Parallel run loop
auto	11.505387066184918	0.0	discard	24_DOMINO_in_3	Parallel run loop
auto	11.10639567382138	0.0	discard	22_DOMINO_in_3	Parallel run loop
auto	11.881182844607538	0.0	discard	25_DOMINO_in_3	Parallel run loop
auto	12.524055549198305	0.0	discard	26_DOMINO_in_3	Parallel run loop
auto	5.1516751173744195	0.0	discard	28_DOMINO_in_6	Parallel run loop
auto	3.2342712519580337	0.0	discard	12_DOMINO_in_CIRCLE	Parallel run loop
auto	3.1860393694450497	0.0	discard	11_DOMINO_in_CIRCLE	Parallel run loop
auto	4.282850583980959	0.0	discard	13_DOMINO_in_5	Parallel run loop
auto	3.759141572791398	0.0	discard	17_DOMINO_in_CIRCLE	Parallel run loop
auto	2.803879883664299	0.0	discard	9_DOMINO_in_CIRCLE	Parallel run loop
auto	10.651500718525643	0.0	discard	20_DOMINO_in_3	Parallel run loop
auto	10.95333223592899	0.0	discard	21_DOMINO_in_3	Parallel run loop
auto	3.8921243667471783	0.0	discard	16_DOMINO_in_6	Parallel run loop
auto	2.0051996327520683	0.0	discard	7_DOMINO_in_8	Parallel run loop
auto	2.9559621946049712	0.0	discard	10_DOMINO_in_CIRCLE	Parallel run loop
auto	8.791744205000827	0.0	discard	14_DOMINO_in_3	Parallel run loop
auto	2.6915521371235593	0.0	discard	8_DOMINO_in_CIRCLE	Parallel run loop
auto	5.961436090702017	0.0	discard	14_DOMINO_in_4	Parallel run loop
auto	6.864504648488255	0.0	discard	19_DOMINO_in_4	Parallel run loop
auto	8.651091643465453	0.0	discard	13_DOMINO_in_3	Parallel run loop
auto	11.260853826103226	0.0	discard	23_DOMINO_in_3	Parallel run loop
auto	3.827281560659983	0.0	discard	11_DOMINO_in_DOMINO	Parallel run loop
auto	2.0051996327520683	0.0	discard	7_DOMINO_in_8	Parallel run loop
auto	7.03616573595127	0.0	discard	20_DOMINO_in_4	Parallel run loop
auto	12.261313043390997	0.0	discard	27_DOMINO_in_3	Parallel run loop
auto	5.012765064798198	0.0	discard	20_DOMINO_in_DOMINO	Parallel run loop
auto	4.882630265799585	0.0	discard	19_DOMINO_in_DOMINO	Parallel run loop
auto	11.10639567382138	0.0	discard	22_DOMINO_in_3	Parallel run loop
auto	11.881182844607538	0.0	discard	25_DOMINO_in_3	Parallel run loop
auto	10.651500718525643	0.0	discard	20_DOMINO_in_3	Parallel run loop
auto	11.505387066184918	0.0	discard	24_DOMINO_in_3	Parallel run loop
auto	12.402922356105613	0.0	discard	26_DOMINO_in_3	Parallel run loop
auto	10.95333223592899	0.0	discard	21_DOMINO_in_3	Parallel run loop
auto	8.791744205000827	0.0	discard	14_DOMINO_in_3	Parallel run loop
auto	3.2342712519580337	0.0	discard	12_DOMINO_in_CIRCLE	Parallel run loop
auto	5.961436090702017	0.0	discard	14_DOMINO_in_4	Parallel run loop
auto	6.864504648488255	0.0	discard	19_DOMINO_in_4	Parallel run loop
auto	3.1860393694450497	0.0	discard	11_DOMINO_in_CIRCLE	Parallel run loop
auto	11.260853826103226	0.0	discard	23_DOMINO_in_3	Parallel run loop
auto	3.759141572791398	0.0	discard	17_DOMINO_in_CIRCLE	Parallel run loop
auto	3.8921243667471783	0.0	discard	16_DOMINO_in_6	Parallel run loop
auto	2.803879883664299	0.0	discard	9_DOMINO_in_CIRCLE	Parallel run loop
auto	2.0051996327520683	0.0	discard	7_DOMINO_in_8	Parallel run loop
auto	2.9559621946049712	0.0	discard	10_DOMINO_in_CIRCLE	Parallel run loop
auto	4.282850583980959	0.0	discard	13_DOMINO_in_5	Parallel run loop
auto	2.6915521371235593	0.0	discard	8_DOMINO_in_CIRCLE	Parallel run loop
auto	8.651091643465453	0.0	discard	13_DOMINO_in_3	Parallel run loop
auto	1.9742999424741903	0.0	discard	2_DOMINO_in_DOMINO	Parallel run loop
auto	7.03616573595127	0.0	discard	20_DOMINO_in_4	Parallel run loop
auto	10.651500718525643	0.0	discard	20_DOMINO_in_3	Parallel run loop
auto	11.10639567382138	0.0	discard	22_DOMINO_in_3	Parallel run loop
auto	3.827281560659983	0.0	discard	11_DOMINO_in_DOMINO	Parallel run loop
auto	1.8705117246507013	0.0	discard	2_DOMINO_in_5	Parallel run loop
auto	6.801676448187571	0.0	discard	2_8_in_3	Parallel run loop
auto	0.8076667405152285	0.0	discard	5_3_in_8	Parallel run loop
auto	0.9297096409934831	0.0	discard	7_3_in_8	Parallel run loop
auto	1.4374452549514865	0.0	discard	7_4_in_8	Parallel run loop
auto	7.045342144997428	0.0	discard	7_8_in_4	Parallel run loop
auto	0.7365459277687013	0.0	discard	3_3_in_8	Parallel run loop
auto	17.971862856269954	0.0	keep	22_8_in_3	Parallel run loop
auto	13.627528805439963	0.0	keep	12_8_in_3	Parallel run loop
auto	5.945303376697194	0.0	keep	14_DOMINO_in_4	Parallel run loop
auto	8.651091643465453	0.0	discard	13_DOMINO_in_3	Parallel run loop
auto	1.5740009890436293	0.0	discard	8_4_in_8	Parallel run loop
auto	8.254999050446896	0.0	discard	10_8_in_4	Parallel run loop
auto	1.4407094647672383	0.0	discard	9_3_in_6	Parallel run loop
auto	6.849683441489762	0.0	keep	19_DOMINO_in_4	Parallel run loop
auto	4.916824784155605	0.0	discard	10_5_in_4	Parallel run loop
auto	1.6817555067443775	0.0	keep	10_4_in_8	Parallel run loop
auto	8.198696149187748	0.0	discard	12_5_in_3	Parallel run loop
auto	10.651500718525643	0.0	discard	20_DOMINO_in_3	Parallel run loop
auto	10.297430459713983	0.0	discard	13_6_in_3	Parallel run loop
auto	6.801676448187571	0.0	discard	2_8_in_3	Parallel run loop
auto	8.386341374974828	0.0	discard	13_5_in_3	Parallel run loop
auto	0.9297096409934831	0.0	discard	7_3_in_8	Parallel run loop
auto	11.006653177789293	0.0	discard	23_5_in_3	Parallel run loop
auto	9.79547333700182	0.0	discard	18_5_in_3	Parallel run loop
auto	7.063210656827799	0.0	discard	22_5_in_4	Parallel run loop
auto	5.24534638676903	0.0	discard	12_5_in_4	Parallel run loop
auto	5.945303376697194	0.0	discard	14_DOMINO_in_4	Parallel run loop
auto	3.161517944288801	0.0	keep	20_4_in_6	Parallel run loop
auto	7.4754110397542695	0.0	discard	25_5_in_4	Parallel run loop
auto	8.651091643465453	0.0	discard	13_DOMINO_in_3	Parallel run loop
auto	3.4890025520695467	0.0	discard	16_4_in_5	Parallel run loop
auto	11.349783348196492	0.0	discard	25_5_in_3	Parallel run loop
auto	13.635835179177114	0.0	discard	12_8_in_3	Parallel run loop
auto	6.344654303429573	0.0	discard	18_5_in_4	Parallel run loop
auto	2.4179851970817263	0.0	keep	22_4_in_8	Parallel run loop
auto	6.849683441489762	0.0	discard	19_DOMINO_in_4	Parallel run loop
auto	17.971862856269954	0.0	discard	22_8_in_3	Parallel run loop
auto	6.801676448187571	0.0	discard	2_8_in_3	Parallel run loop
auto	8.702551686269295	0.0	discard	15_5_in_3	Parallel run loop
auto	11.130681795666638	0.0	discard	20_8_in_4	Parallel run loop
auto	1.0149451143132089	0.0	discard	9_3_in_8	Parallel run loop
auto	1.4407094647672383	0.0	discard	9_3_in_6	Parallel run loop
auto	16.758782096915716	0.0	discard	20_8_in_3	Parallel run loop
auto	3.629867591362741	0.0	discard	18_4_in_5	Parallel run loop
auto	1.6817555067443775	0.0	discard	10_4_in_8	Parallel run loop
auto	5.945303376697194	0.0	discard	14_DOMINO_in_4	Parallel run loop
auto	3.5968438934549654	0.0	discard	17_4_in_5	Parallel run loop
auto	11.816197606627002	0.0	discard	10_8_in_3	Parallel run loop
auto	8.651091643465453	0.0	discard	13_DOMINO_in_3	Parallel run loop
auto	6.849683441489762	0.0	discard	19_DOMINO_in_4	Parallel run loop
auto	6.801676448187571	0.0	discard	2_8_in_3	Parallel run loop
auto	9.79547333700182	0.0	discard	18_5_in_3	Parallel run loop
auto	10.684190764330278	0.0	discard	21_5_in_3	Parallel run loop
auto	3.945432663835076	0.0	discard	32_4_in_6	Parallel run loop
auto	15.497153852014518	0.0	discard	32_6_in_3	Parallel run loop
auto	4.376394698337569	0.0	discard	25_4_in_5	Parallel run loop
auto	3.161517944288801	0.0	discard	20_4_in_6	Parallel run loop
auto	9.67677485957907	0.0	discard	16_8_in_4	Parallel run loop
auto	2.656187796396222	0.0	discard	28_4_in_8	Parallel run loop
auto	1.3540764210326226	0.0	discard	16_3_in_8	Parallel run loop
auto	11.349783348196492	0.0	discard	25_5_in_3	Parallel run loop
auto	13.630411820991872	0.0	discard	12_8_in_3	Parallel run loop
auto	3.9045595060225056	0.0	discard	31_4_in_6	Parallel run loop
auto	2.4179851970817263	0.0	discard	22_4_in_8	Parallel run loop
auto	5.945303376697194	0.0	discard	14_DOMINO_in_4	Parallel run loop
auto	17.979111284074293	0.0	discard	22_8_in_3	Parallel run loop
auto	1.6125945980227296	0.0	discard	24_3_in_8	Parallel run loop
auto	1.6817555067443775	0.0	discard	10_4_in_8	Parallel run loop
auto	1.4407094647672383	0.0	discard	9_3_in_6	Parallel run loop
auto	6.849683441489762	0.0	discard	19_DOMINO_in_4	Parallel run loop
auto	11.130681795666638	0.0	discard	20_8_in_4	Parallel run loop
auto	5.301797163457416	0.0	discard	39_4_in_5	Parallel run loop
auto	1.0149451143132089	0.0	discard	9_3_in_8	Parallel run loop
auto	4.941143877473089	0.0	discard	34_4_in_5	Parallel run loop
auto	2.9698298673179373	0.0	discard	36_4_in_8	Parallel run loop
auto	4.867215641034746	0.0	discard	38_4_in_DOMINO	Parallel run loop
auto	2.2736120830922086	0.0	keep	30_3_in_circle	Parallel run loop
auto	2.4236349131867896	0.0	keep	22_3_in_DOMINO	Parallel run loop
auto	6.866970338907654	0.0	discard	41_3_in_3	Parallel run loop
auto	4.791569234298686	0.0	discard	37_4_in_DOMINO	Parallel run loop
auto	1.9443033816243642	0.0	keep	22_3_in_circle	Parallel run loop
auto	3.7914164805615247	0.0	discard	22_4_in_DOMINO	Parallel run loop
auto	5.945303376697194	0.0	discard	14_DOMINO_in_4	Parallel run loop
auto	15.497153852014518	0.0	discard	32_6_in_3	Parallel run loop
auto	1.7578984300608393	0.0	keep	3_CIRCLE_in_8	Parallel run loop
auto	3.161517944288801	0.0	discard	20_4_in_6	Parallel run loop
auto	2.0046994478381874	0.0	discard	23_3_in_circle	Parallel run loop
auto	2.656187796396222	0.0	discard	28_4_in_8	Parallel run loop
auto	13.630411820991872	0.0	discard	12_8_in_3	Parallel run loop
auto	6.898420585043029	0.0	discard	19_DOMINO_in_4	Parallel run loop
auto	2.4179851970817263	0.0	discard	22_4_in_8	Parallel run loop
auto	17.971862856269954	0.0	discard	22_8_in_3	Parallel run loop
auto	1.3540764210326226	0.0	discard	16_3_in_8	Parallel run loop
auto	11.349783348196492	0.0	discard	25_5_in_3	Parallel run loop
auto	2.1122190059013577	0.0	keep	26_3_in_circle	Parallel run loop
auto	1.6125945980227296	0.0	discard	24_3_in_8	Parallel run loop
auto	1.6817555067443775	0.0	discard	10_4_in_8	Parallel run loop
auto	1.4407094647672383	0.0	discard	9_3_in_6	Parallel run loop
auto	2.110662555126422	0.0	keep	17_3_in_DOMINO	Parallel run loop
auto	11.130681795666638	0.0	discard	20_8_in_4	Parallel run loop
auto	1.7578984300608393	0.0	discard	3_CIRCLE_in_8	Parallel run loop
auto	5.945303376697194	0.0	discard	14_DOMINO_in_4	Parallel run loop
auto	1.0149451143132089	0.0	discard	9_3_in_8	Parallel run loop
auto	15.497153852014518	0.0	discard	32_6_in_3	Parallel run loop
auto	4.867215641034746	0.0	discard	38_4_in_DOMINO	Parallel run loop
auto	2.2736120830922086	0.0	discard	30_3_in_circle	Parallel run loop
auto	3.224501713660465	0.0	discard	20_4_in_6	Parallel run loop
auto	6.827115681145438	0.0	keep	41_3_in_3	Parallel run loop
auto	13.630411820991872	0.0	discard	12_8_in_3	Parallel run loop
auto	17.969805309425404	0.0	keep	22_8_in_3	Parallel run loop
auto	4.791569234298686	0.0	discard	37_4_in_DOMINO	Parallel run loop
auto	2.4179851970817263	0.0	discard	22_4_in_8	Parallel run loop
auto	3.7914164805615247	0.0	discard	22_4_in_DOMINO	Parallel run loop
auto	2.656187796396222	0.0	discard	28_4_in_8	Parallel run loop
auto	2.0046994478381874	0.0	discard	23_3_in_circle	Parallel run loop
auto	1.6817555067443775	0.0	discard	10_4_in_8	Parallel run loop
auto	1.3540764210326226	0.0	discard	16_3_in_8	Parallel run loop
auto	1.6125945980227296	0.0	discard	24_3_in_8	Parallel run loop
auto	1.497146383805927	0.0	keep	10_3_in_6	Parallel run loop
auto	1.7578984300608393	0.0	discard	3_CIRCLE_in_8	Parallel run loop
auto	5.945303376697194	0.0	discard	14_DOMINO_in_4	Parallel run loop
auto	1.0149451143132089	0.0	discard	9_3_in_8	Parallel run loop
auto	15.497153852014518	0.0	discard	32_6_in_3	Parallel run loop
auto	2.1122190059013577	0.0	discard	26_3_in_circle	Parallel run loop
auto	4.867215641034746	0.0	discard	38_4_in_DOMINO	Parallel run loop
auto	2.2736120830922086	0.0	discard	30_3_in_circle	Parallel run loop
auto	6.827115681145438	0.0	discard	41_3_in_3	Parallel run loop
auto	2.110662555126422	0.0	discard	17_3_in_DOMINO	Parallel run loop
auto	17.971862856269954	0.0	discard	22_8_in_3	Parallel run loop
auto	2.4179851970817263	0.0	discard	22_4_in_8	Parallel run loop
auto	4.791569234298686	0.0	discard	37_4_in_DOMINO	Parallel run loop
auto	2.656187796396222	0.0	discard	28_4_in_8	Parallel run loop
auto	3.7914164805615247	0.0	discard	22_4_in_DOMINO	Parallel run loop
auto	1.6817555067443775	0.0	discard	10_4_in_8	Parallel run loop
auto	1.3540764210326226	0.0	discard	16_3_in_8	Parallel run loop
auto	1.6125945980227296	0.0	discard	24_3_in_8	Parallel run loop
auto	1.497146383805927	0.0	discard	10_3_in_6	Parallel run loop
auto	2.0046994478381874	0.0	discard	23_3_in_circle	Parallel run loop
auto	1.7578984300608393	0.0	discard	3_CIRCLE_in_8	Parallel run loop
auto	5.945303376697194	0.0	discard	14_DOMINO_in_4	Parallel run loop
auto	3.3701178247932044	0.0	keep	23_4_in_6	Parallel run loop
auto	2.1122190059013577	0.0	discard	26_3_in_circle	Parallel run loop
auto	12.771121686878123	0.0	discard	32_5_in_3	Parallel run loop
auto	2.2736120830922086	0.0	discard	30_3_in_circle	Parallel run loop
auto	4.867215641034746	0.0	discard	38_4_in_DOMINO	Parallel run loop
auto	6.827115681145438	0.0	discard	41_3_in_3	Parallel run loop
auto	2.110662555126422	0.0	discard	17_3_in_DOMINO	Parallel run loop
auto	13.884493816920813	0.0	discard	38_5_in_3	Parallel run loop
auto	2.4179851970817263	0.0	discard	22_4_in_8	Parallel run loop
auto	2.656187796396222	0.0	discard	28_4_in_8	Parallel run loop
auto	1.6817555067443775	0.0	discard	10_4_in_8	Parallel run loop
auto	4.791569234298686	0.0	discard	37_4_in_DOMINO	Parallel run loop
auto	1.3540764210326226	0.0	discard	16_3_in_8	Parallel run loop
auto	1.6125945980227296	0.0	discard	24_3_in_8	Parallel run loop
auto	1.497146383805927	0.0	discard	10_3_in_6	Parallel run loop
auto	1.7578984300608393	0.0	discard	3_CIRCLE_in_8	Parallel run loop
auto	3.7914164805615247	0.0	discard	22_4_in_DOMINO	Parallel run loop
auto	2.0046994478381874	0.0	discard	23_3_in_circle	Parallel run loop
auto	5.945303376697194	0.0	discard	14_DOMINO_in_4	Parallel run loop
auto	3.3701178247932044	0.0	discard	23_4_in_6	Parallel run loop
auto	14.077674238257678	0.0	discard	25_6_in_3	Parallel run loop
auto	2.1122190059013577	0.0	discard	26_3_in_circle	Parallel run loop
auto	2.2736120830922086	0.0	discard	30_3_in_circle	Parallel run loop
auto	1.4029233710948728	0.0	discard	17_3_in_8	Parallel run loop
auto	6.827115681145438	0.0	discard	41_3_in_3	Parallel run loop
auto	2.110662555126422	0.0	discard	17_3_in_DOMINO	Parallel run loop
auto	1.4801224664338222	0.0	discard	19_3_in_8	Parallel run loop
auto	1.6817555067443775	0.0	discard	10_4_in_8	Parallel run loop
auto	2.4179851970817263	0.0	discard	22_4_in_8	Parallel run loop
auto	5.0055607612139665	0.0	discard	37_4_in_DOMINO	Parallel run loop
auto	1.3540764210326226	0.0	discard	16_3_in_8	Parallel run loop
auto	1.6125945980227296	0.0	discard	24_3_in_8	Parallel run loop
auto	1.497146383805927	0.0	discard	10_3_in_6	Parallel run loop
auto	2.8870004831185874	0.0	discard	17_4_in_6	Parallel run loop
auto	3.415990305406189	0.0	keep	24_4_in_6	Parallel run loop
auto	12.910495881561323	0.0	discard	33_5_in_3	Parallel run loop
auto	5.945303376697194	0.0	discard	14_DOMINO_in_4	Parallel run loop
auto	2.1122190059013577	0.0	discard	26_3_in_circle	Parallel run loop
auto	3.3701178247932044	0.0	discard	23_4_in_6	Parallel run loop
auto	1.5104429077839856	0.0	discard	20_3_in_8	Parallel run loop
auto	1.420375763366103	0.0	keep	18_3_in_8	Parallel run loop
auto	2.2736120830922086	0.0	discard	30_3_in_circle	Parallel run loop
auto	2.110662555126422	0.0	discard	17_3_in_DOMINO	Parallel run loop
auto	6.827115681145438	0.0	discard	41_3_in_3	Parallel run loop
auto	2.382191620351339	0.0	discard	21_4_in_8	Parallel run loop
auto	1.6817555067443775	0.0	discard	10_4_in_8	Parallel run loop
auto	2.4179851970817263	0.0	discard	22_4_in_8	Parallel run loop
auto	1.5708892985329193	0.0	discard	22_3_in_8	Parallel run loop
auto	1.3540764210326226	0.0	discard	16_3_in_8	Parallel run loop
auto	1.6125945980227296	0.0	discard	24_3_in_8	Parallel run loop
auto	1.497146383805927	0.0	discard	10_3_in_6	Parallel run loop
auto	3.504561196287405	0.0	discard	26_4_in_6	Parallel run loop
auto	3.4496332738520863	0.0	discard	24_4_in_6	Parallel run loop
auto	2.7228640292078126	0.0	discard	29_4_in_8	Parallel run loop
auto	2.8599677294777037	0.0	discard	32_4_in_8	Parallel run loop
auto	2.1122190059013577	0.0	discard	26_3_in_circle	Parallel run loop
auto	3.3701178247932044	0.0	discard	23_4_in_6	Parallel run loop
auto	2.2736120830922086	0.0	discard	30_3_in_circle	Parallel run loop
auto	1.4371225696424905	0.0	discard	18_3_in_8	Parallel run loop
auto	3.6518752588885164	0.0	discard	28_4_in_6	Parallel run loop
auto	2.110662555126422	0.0	discard	17_3_in_DOMINO	Parallel run loop
auto	6.866970338907654	0.0	discard	41_3_in_3	Parallel run loop
auto	1.587598796173356	0.0	keep	23_3_in_8	Parallel run loop
auto	1.6817555067443775	0.0	discard	10_4_in_8	Parallel run loop
auto	2.4179851970817263	0.0	discard	22_4_in_8	Parallel run loop
auto	1.5708892985329193	0.0	discard	22_3_in_8	Parallel run loop
auto	1.3540764210326226	0.0	discard	16_3_in_8	Parallel run loop
auto	1.497146383805927	0.0	discard	10_3_in_6	Parallel run loop
auto	1.6125945980227296	0.0	discard	24_3_in_8	Parallel run loop
auto	1.6870389317359202	0.0	keep	26_3_in_8	Parallel run loop
auto	3.6059584413230867	0.0	discard	27_4_in_6	Parallel run loop
auto	2.519017470378839	0.0	discard	25_4_in_8	Parallel run loop
auto	2.1122190059013577	0.0	discard	26_3_in_circle	Parallel run loop
auto	3.3701178247932044	0.0	discard	23_4_in_6	Parallel run loop
auto	2.2736120830922086	0.0	discard	30_3_in_circle	Parallel run loop
auto	1.7802430144454746	0.0	discard	29_3_in_8	Parallel run loop
auto	2.110662555126422	0.0	discard	17_3_in_DOMINO	Parallel run loop
auto	4.862108401795182	0.0	discard	33_4_in_5	Parallel run loop
auto	4.043834670396796	0.0	discard	35_4_in_6	Parallel run loop
auto	1.587598796173356	0.0	discard	23_3_in_8	Parallel run loop
auto	3.8939907640676124	0.0	keep	33_4_in_6	Parallel run loop
auto	2.4179851970817263	0.0	discard	22_4_in_8	Parallel run loop
auto	1.5708892985329193	0.0	discard	22_3_in_8	Parallel run loop
auto	1.8341316836445811	0.0	keep	32_3_in_8	Parallel run loop
auto	1.497146383805927	0.0	discard	10_3_in_6	Parallel run loop
auto	1.6125945980227296	0.0	discard	24_3_in_8	Parallel run loop
auto	1.6870389317359202	0.0	discard	26_3_in_8	Parallel run loop
auto	5.1332484788868875	0.0	discard	35_4_in_5	Parallel run loop
auto	2.9476053891229426	0.0	discard	35_4_in_8	Parallel run loop
auto	2.1122190059013577	0.0	discard	26_3_in_circle	Parallel run loop
auto	3.3701178247932044	0.0	discard	23_4_in_6	Parallel run loop
auto	2.2736120830922086	0.0	discard	30_3_in_circle	Parallel run loop
auto	1.7802430144454746	0.0	discard	29_3_in_8	Parallel run loop
auto	2.110662555126422	0.0	discard	17_3_in_DOMINO	Parallel run loop
