commit	score	memory_gb	status	problem	description
auto	15.507059097687918	0.0	keep	32_6_in_3	Parallel run loop
auto	12.992230942354865	0.0	keep	34_5_in_3	Parallel run loop
auto	1.7534043378776933	0.0	keep	12_4_in_8	Parallel run loop
auto	1.7728978039959224	0.0	keep	15_3_in_6	Parallel run loop
auto	3.802580487350702	0.0	keep	20_4_in_5	Parallel run loop
auto	1.4283235698739687	0.0	keep	18_3_in_8	Parallel run loop
auto	13.127993474088518	0.0	keep	35_5_in_3	Parallel run loop
auto	8.464522032559183	0.0	keep	12_DOMINO_in_3	Parallel run loop
auto	2.9218387837441084	0.0	keep	18_4_in_6	Parallel run loop
auto	13.203264763003764	0.0	keep	36_5_in_3	Parallel run loop
auto	14.28181817251176	0.0	keep	15_8_in_3	Parallel run loop
auto	2.718814968445421	0.0	keep	29_4_in_8	Parallel run loop
auto	1.605612861473498	0.0	keep	23_3_in_8	Parallel run loop
auto	1.8137514616169625	0.0	keep	16_3_in_6	Parallel run loop
auto	1.5776646032766954	0.0	keep	22_3_in_8	Parallel run loop
auto	9.887484739520144	0.0	keep	17_DOMINO_in_3	Parallel run loop
auto	2.8473683372998524	0.0	keep	32_4_in_8	Parallel run loop
auto	5.978348114063382	0.0	keep	14_DOMINO_in_4	Parallel run loop
auto	7.00002069337825	0.0	keep	20_DOMINO_in_4	Parallel run loop
auto	3.5043692815954772	0.0	keep	26_4_in_6	Parallel run loop
auto	3.6316480035405587	0.0	keep	28_4_in_6	Parallel run loop
auto	3.8704173057651876	0.0	keep	21_4_in_5	Parallel run loop
auto	2.7700936449241453	0.0	keep	30_4_in_8	Parallel run loop
auto	10.465438229182674	0.0	keep	19_DOMINO_in_3	Parallel run loop
auto	3.936673286917023	0.0	keep	22_4_in_5	Parallel run loop
auto	2.787023388543349	0.0	keep	31_4_in_8	Parallel run loop
auto	9.619115168407207	0.0	keep	16_DOMINO_in_3	Parallel run loop
auto	1.7546767310220577	0.0	keep	28_3_in_8	Parallel run loop
auto	3.6869814981866664	0.0	keep	29_4_in_6	Parallel run loop
auto	1.6960647652406249	0.0	keep	26_3_in_8	Parallel run loop
auto	1.741729337650681	0.0	keep	27_3_in_8	Parallel run loop
auto	1.9625626549669875	0.0	keep	19_3_in_6	Parallel run loop
auto	16.786989896453434	0.0	keep	21_8_in_3	Parallel run loop
auto	4.117832997059029	0.0	keep	24_4_in_5	Parallel run loop
auto	9.657000936176487	0.0	keep	16_8_in_4	Parallel run loop
auto	4.355276251862383	0.0	keep	27_4_in_5	Parallel run loop
auto	4.329755603406173	0.0	keep	40_4_in_6	Parallel run loop
auto	4.509402259792557	0.0	keep	29_4_in_5	Parallel run loop
auto	3.804363332294116	0.0	keep	31_4_in_6	Parallel run loop
auto	4.270339905002986	0.0	keep	39_4_in_6	Parallel run loop
auto	4.003618918192179	0.0	keep	23_4_in_5	Parallel run loop
auto	4.432846163334495	0.0	keep	28_4_in_5	Parallel run loop
auto	3.854860432420813	0.0	keep	32_4_in_6	Parallel run loop
auto	4.186573243006792	0.0	keep	38_4_in_6	Parallel run loop
auto	8.929827668669974	0.0	keep	14_DOMINO_in_3	Parallel run loop
auto	1.6655841595315923	0.0	keep	25_3_in_8	Parallel run loop
auto	1.6453700630094263	0.0	keep	24_3_in_8	Parallel run loop
auto	3.53670597865543	0.0	keep	27_4_in_6	Parallel run loop
auto	3.1495580309021682	0.0	keep	40_4_in_8	Parallel run loop
auto	4.723457441202047	0.0	keep	32_4_in_5	Parallel run loop
auto	2.8995220238396526	0.0	keep	34_4_in_8	Parallel run loop
auto	1.8889631199783583	0.0	keep	18_3_in_6	Parallel run loop
auto	4.181352769095384	0.0	keep	25_4_in_5	Parallel run loop
auto	2.4987747228068606	0.0	keep	25_4_in_8	Parallel run loop
auto	2.5894497582658365	0.0	keep	27_4_in_8	Parallel run loop
auto	2.8995914942837864	0.0	keep	33_4_in_8	Parallel run loop
auto	6.880135199247852	0.0	keep	19_DOMINO_in_4	Parallel run loop
auto	4.624846322901251	0.0	keep	31_4_in_5	Parallel run loop
auto	2.657079534688708	0.0	keep	28_4_in_8	Parallel run loop
auto	3.698890415334096	0.0	keep	30_4_in_6	Parallel run loop
auto	4.00064256476095	0.0	keep	35_4_in_6	Parallel run loop
auto	10.084511974997167	0.0	keep	18_DOMINO_in_3	Parallel run loop
auto	11.087420695432247	0.0	keep	22_DOMINO_in_3	Parallel run loop
auto	3.899478038029218	0.0	keep	33_4_in_6	Parallel run loop
auto	1.7810783298356412	0.0	keep	29_3_in_8	Parallel run loop
auto	1.8333584779613132	0.0	keep	17_3_in_6	Parallel run loop
auto	4.226915577359798	0.0	keep	26_4_in_5	Parallel run loop
auto	2.936674102221175	0.0	keep	19_4_in_6	Parallel run loop
auto	1.81166695401833	0.0	keep	30_3_in_8	Parallel run loop
auto	4.591515347828647	0.0	keep	30_4_in_5	Parallel run loop
auto	2.5702414801095044	0.0	keep	26_4_in_8	Parallel run loop
auto	4.768665977785714	0.0	keep	33_4_in_5	Parallel run loop
auto	3.942088596145953	0.0	keep	34_4_in_6	Parallel run loop
auto	3.0976559503799153	0.0	keep	39_4_in_8	Parallel run loop
auto	10.668246111399757	0.0	keep	20_DOMINO_in_3	Parallel run loop
auto	1.9903881974501638	0.0	keep	20_3_in_6	Parallel run loop
auto	4.830500491285715	0.0	keep	34_4_in_5	Parallel run loop
auto	11.240923821174528	0.0	keep	23_DOMINO_in_3	Parallel run loop
auto	2.2957349699972225	0.0	keep	27_3_in_6	Parallel run loop
auto	1.8358545436592422	0.0	keep	31_3_in_8	Parallel run loop
auto	10.939246238647364	0.0	keep	21_DOMINO_in_3	Parallel run loop
auto	11.861179066472017	0.0	keep	25_DOMINO_in_3	Parallel run loop
auto	1.8466809380129314	0.0	keep	32_3_in_8	Parallel run loop
auto	5.07987060034679	0.0	keep	38_4_in_5	Parallel run loop
auto	2.9130767285708896	0.0	keep	35_4_in_8	Parallel run loop
auto	4.041525245811542	0.0	keep	36_4_in_6	Parallel run loop
auto	12.048153486482255	0.0	keep	26_DOMINO_in_3	Parallel run loop
auto	2.367976613739326	0.0	keep	28_3_in_6	Parallel run loop
auto	12.249565153217116	0.0	keep	27_DOMINO_in_3	Parallel run loop
auto	11.650909611020241	0.0	keep	24_DOMINO_in_3	Parallel run loop
auto	4.934038277323603	0.0	keep	36_4_in_5	Parallel run loop
auto	1.8824060392004196	0.0	keep	33_3_in_8	Parallel run loop
auto	5.147300711517388	0.0	keep	39_4_in_5	Parallel run loop
auto	3.0206074905084366	0.0	keep	38_4_in_8	Parallel run loop
auto	2.9471914444154206	0.0	keep	36_4_in_8	Parallel run loop
auto	5.024654504399765	0.0	keep	37_4_in_5	Parallel run loop
auto	4.89631126493849	0.0	keep	35_4_in_5	Parallel run loop
auto	2.031370441244934	0.0	keep	37_3_in_8	Parallel run loop
auto	1.9409352448687207	0.0	keep	35_3_in_8	Parallel run loop
auto	1.9088227524371741	0.0	keep	34_3_in_8	Parallel run loop
auto	2.2761102762029797	0.0	keep	26_3_in_6	Parallel run loop
auto	1.9764393252821741	0.0	keep	36_3_in_8	Parallel run loop
auto	2.55230427254843	0.0	keep	33_3_in_6	Parallel run loop
auto	2.000025568006337	0.0	keep	21_3_in_6	Parallel run loop
auto	2.207695731302798	0.0	keep	25_3_in_6	Parallel run loop
auto	2.4322509485438673	0.0	keep	30_3_in_6	Parallel run loop
auto	5.194002084042339	0.0	keep	40_4_in_5	Parallel run loop
auto	2.500002454603796	0.0	keep	32_3_in_6	Parallel run loop
auto	2.6525043116384395	0.0	keep	36_3_in_6	Parallel run loop
auto	2.6770531762058574	0.0	keep	37_3_in_6	Parallel run loop
auto	2.3752294862346717	0.0	keep	29_3_in_6	Parallel run loop
auto	2.7289285132259624	0.0	keep	38_3_in_6	Parallel run loop
auto	2.400040812761501	0.0	keep	31_3_in_6	Parallel run loop
auto	2.807233303471547	0.0	keep	39_3_in_6	Parallel run loop
auto	1.2326653988951646e-13	0.0	keep	1_8_in_8	Parallel run loop
auto	2.654081232752008	0.0	keep	35_3_in_6	Parallel run loop
auto	0.8036669940717013	0.0	keep	5_3_in_8	Parallel run loop
auto	2.9318052910162207	0.0	keep	43_3_in_6	Parallel run loop
auto	0.7773356176027824	0.0	keep	4_3_in_8	Parallel run loop
auto	2.9884910039959403	0.0	keep	46_3_in_6	Parallel run loop
auto	3.1772309707993864	0.0	keep	49_3_in_6	Parallel run loop
auto	2.9798602708959616	0.0	keep	45_3_in_6	Parallel run loop
auto	3.094370376008156	0.0	keep	47_3_in_6	Parallel run loop
auto	2.597295154934724	0.0	keep	34_3_in_6	Parallel run loop
auto	2.9438371980176936	0.0	keep	44_3_in_6	Parallel run loop
auto	2.8694076110774587	0.0	keep	41_3_in_6	Parallel run loop
auto	2.8862168026966977	0.0	keep	42_3_in_6	Parallel run loop
auto	0.9245400229687899	0.0	keep	7_3_in_8	Parallel run loop
auto	2.860807976334626	0.0	keep	40_3_in_6	Parallel run loop
auto	3.1450751464802984	0.0	keep	48_3_in_6	Parallel run loop
auto	2.756125137176769	0.0	keep	15_4_in_6	Parallel run loop
auto	1.0087152127696104	0.0	keep	9_3_in_8	Parallel run loop
auto	3.314757120833075	0.0	keep	22_4_in_6	Parallel run loop
auto	1.4343288179215334	0.0	keep	9_3_in_6	Parallel run loop
auto	2.477139614975416	0.0	discard	23_4_in_8	Parallel run loop
auto	12.61163348240225	0.0	keep	31_5_in_3	Parallel run loop
auto	4.907901541045126	0.0	discard	9_DOMINO_in_4	Parallel run loop
auto	7.474835158097073	0.0	discard	25_5_in_4	Parallel run loop
auto	3.3711984125749535	0.0	keep	23_4_in_6	Parallel run loop
auto	3.1842433518589117	0.0	keep	20_4_in_6	Parallel run loop
auto	11.341154923547137	0.0	keep	25_5_in_3	Parallel run loop
auto	6.330387427375083	0.0	keep	18_5_in_4	Parallel run loop
auto	11.949685955614227	0.0	keep	18_6_in_3	Parallel run loop
auto	9.789767129433292	0.0	keep	18_5_in_3	Parallel run loop
auto	2.418135387191349	0.0	keep	22_4_in_8	Parallel run loop
auto	1.726091666469519	0.0	keep	14_3_in_6	Parallel run loop
auto	1.3962954396689018	0.0	discard	17_3_in_8	Parallel run loop
auto	1.4713628884347731	0.0	keep	19_3_in_8	Parallel run loop
auto	1.3552982199663324	0.0	keep	16_3_in_8	Parallel run loop
auto	3.4212355082343766	0.0	discard	24_4_in_6	Parallel run loop
auto	13.88026365502501	0.0	discard	38_5_in_3	Parallel run loop
auto	14.163529288047329	0.0	keep	40_5_in_3	Parallel run loop
auto	2.886925318404044	0.0	discard	17_4_in_6	Parallel run loop
auto	12.900578288069932	0.0	discard	33_5_in_3	Parallel run loop
auto	2.228789726459015	0.0	keep	19_4_in_8	Parallel run loop
auto	1.5012957147829153	0.0	discard	20_3_in_8	Parallel run loop
auto	8.310245954673741	0.0	keep	12_DOMINO_in_3	Parallel run loop
auto	13.82801452012332	0.0	discard	25_6_in_3	Parallel run loop
auto	11.110439200692014	0.0	keep	20_8_in_4	Parallel run loop
auto	14.054299053608903	0.0	keep	39_5_in_3	Parallel run loop
auto	12.774986102994186	0.0	discard	32_5_in_3	Parallel run loop
auto	15.482136095803213	0.0	keep	32_6_in_3	Parallel run loop
auto	1.439518984010248	0.0	discard	18_3_in_8	Parallel run loop
auto	8.637096952104814	0.0	discard	13_DOMINO_in_3	Parallel run loop
auto	2.851809238191822	0.0	discard	32_4_in_8	Parallel run loop
auto	3.6310466616901667	0.0	keep	28_4_in_6	Parallel run loop
auto	2.4730786377880323	0.0	keep	23_4_in_8	Parallel run loop
auto	1.530517468089551	0.0	keep	21_3_in_8	Parallel run loop
auto	2.7154679804620967	0.0	keep	29_4_in_8	Parallel run loop
auto	1.5998504260930768	0.0	keep	23_3_in_8	Parallel run loop
auto	1.5802763399663788	0.0	discard	22_3_in_8	Parallel run loop
auto	1.7733933120971939	0.0	discard	15_3_in_6	Parallel run loop
auto	12.608820666859891	0.0	keep	31_5_in_3	Parallel run loop
auto	7.000085673648282	0.0	discard	20_DOMINO_in_4	Parallel run loop
auto	9.901546615792537	0.0	discard	17_DOMINO_in_3	Parallel run loop
auto	3.5221736693005905	0.0	discard	26_4_in_6	Parallel run loop
auto	2.3433799280120184	0.0	discard	21_4_in_8	Parallel run loop
auto	10.200647880932765	0.0	keep	21_5_in_3	Parallel run loop
auto	3.3712839875550737	0.0	discard	23_4_in_6	Parallel run loop
auto	4.899916258677748	0.0	keep	9_DOMINO_in_4	Parallel run loop
auto	7.457099311805799	0.0	keep	25_5_in_4	Parallel run loop
auto	3.1749409878611337	0.0	keep	20_4_in_6	Parallel run loop
auto	1.8000735680784432	0.0	keep	16_3_in_6	Parallel run loop
auto	6.000009200264471	0.0	discard	14_DOMINO_in_4	Parallel run loop
auto	11.954772240070348	0.0	discard	18_6_in_3	Parallel run loop
auto	1.3944151947332142	0.0	keep	17_3_in_8	Parallel run loop
auto	1.376840554360093	0.0	discard	16_3_in_8	Parallel run loop
auto	2.7704559534373256	0.0	discard	30_4_in_8	Parallel run loop
auto	9.629273095692493	0.0	discard	16_DOMINO_in_3	Parallel run loop
auto	3.4178812170592687	0.0	discard	24_4_in_6	Parallel run loop
auto	1.4730633621924512	0.0	discard	19_3_in_8	Parallel run loop
auto	8.773298838193952	0.0	discard	13_DOMINO_in_3	Parallel run loop
auto	12.9024744243239	0.0	discard	33_5_in_3	Parallel run loop
auto	10.318783164761495	0.0	keep	19_DOMINO_in_3	Parallel run loop
auto	14.058909750646931	0.0	discard	39_5_in_3	Parallel run loop
auto	13.86920973938104	0.0	discard	38_5_in_3	Parallel run loop
auto	1.5429613618736142	0.0	discard	21_3_in_8	Parallel run loop
auto	2.867112794738145	0.0	discard	32_4_in_8	Parallel run loop
auto	4.331329663065942	0.0	discard	40_4_in_6	Parallel run loop
auto	1.719321539756422	0.0	keep	27_3_in_8	Parallel run loop
auto	3.677568604173762	0.0	keep	29_4_in_6	Parallel run loop
auto	4.105145783191192	0.0	keep	24_4_in_5	Parallel run loop
auto	1.439518984010248	0.0	discard	18_3_in_8	Parallel run loop
auto	12.77775354307169	0.0	discard	32_5_in_3	Parallel run loop
auto	2.8868181516858367	0.0	keep	17_4_in_6	Parallel run loop
auto	1.7106038383549487	0.0	discard	26_3_in_8	Parallel run loop
auto	1.7522848324980056	0.0	keep	28_3_in_8	Parallel run loop
auto	1.5120870131722424	0.0	discard	20_3_in_8	Parallel run loop
auto	1.9663570281325968	0.0	discard	19_3_in_6	Parallel run loop
auto	13.834303917569756	0.0	discard	25_6_in_3	Parallel run loop
auto	3.639754790379266	0.0	discard	28_4_in_6	Parallel run loop
auto	1.7500020214242256	0.0	keep	15_3_in_6	Parallel run loop
auto	2.711443698501453	0.0	keep	29_4_in_8	Parallel run loop
auto	3.3711556515134475	0.0	keep	23_4_in_6	Parallel run loop
auto	3.5043692815954772	0.0	discard	26_4_in_6	Parallel run loop
auto	4.896337609702395	0.0	keep	9_DOMINO_in_4	Parallel run loop
auto	10.175419775552646	0.0	keep	21_5_in_3	Parallel run loop
auto	2.335140167941394	0.0	keep	21_4_in_8	Parallel run loop
auto	1.5610577210797874	0.0	keep	22_3_in_8	Parallel run loop
auto	4.5041733168589975	0.0	keep	29_4_in_5	Parallel run loop
auto	7.000013110524711	0.0	keep	20_DOMINO_in_4	Parallel run loop
auto	9.784392058904936	0.0	keep	17_DOMINO_in_3	Parallel run loop
auto	1.596109782763897	0.0	keep	23_3_in_8	Parallel run loop
auto	1.4711065336694122	0.0	keep	19_3_in_8	Parallel run loop
auto	1.3962954396689018	0.0	discard	17_3_in_8	Parallel run loop
auto	3.165543618305243	0.0	keep	20_4_in_6	Parallel run loop
auto	3.4206687303787935	0.0	discard	24_4_in_6	Parallel run loop
auto	1.3552982199663324	0.0	discard	16_3_in_8	Parallel run loop
auto	4.270339905002986	0.0	discard	39_4_in_6	Parallel run loop
auto	1.5429613618736142	0.0	discard	21_3_in_8	Parallel run loop
auto	11.949685955614227	0.0	discard	18_6_in_3	Parallel run loop
auto	2.512917726299598	0.0	discard	25_4_in_8	Parallel run loop
auto	4.440978934601081	0.0	discard	28_4_in_5	Parallel run loop
auto	8.706795106042486	0.0	discard	13_DOMINO_in_3	Parallel run loop
auto	3.784468752707991	0.0	keep	31_4_in_6	Parallel run loop
auto	13.897063548876632	0.0	discard	38_5_in_3	Parallel run loop
auto	5.97969541415556	0.0	discard	14_DOMINO_in_4	Parallel run loop
auto	9.625076470906881	0.0	discard	16_DOMINO_in_3	Parallel run loop
auto	2.8995779267470345	0.0	keep	33_4_in_8	Parallel run loop
auto	14.054299053608903	0.0	discard	39_5_in_3	Parallel run loop
auto	3.843254059147447	0.0	keep	32_4_in_6	Parallel run loop
auto	12.9024744243239	0.0	discard	33_5_in_3	Parallel run loop
auto	1.439518984010248	0.0	discard	18_3_in_8	Parallel run loop
auto	8.928664320474262	0.0	keep	14_DOMINO_in_3	Parallel run loop
auto	1.6854306646965997	0.0	discard	25_3_in_8	Parallel run loop
auto	3.1716388637733273	0.0	discard	40_4_in_8	Parallel run loop
auto	13.807537279353001	0.0	discard	25_6_in_3	Parallel run loop
auto	1.5098578402273775	0.0	discard	20_3_in_8	Parallel run loop
auto	2.761296903153339	0.0	keep	30_4_in_8	Parallel run loop
auto	1.6474932133826834	0.0	discard	24_3_in_8	Parallel run loop
auto	2.8868450624043964	0.0	discard	17_4_in_6	Parallel run loop
auto	2.6545154069059094	0.0	keep	28_4_in_8	Parallel run loop
auto	12.77775354307169	0.0	discard	32_5_in_3	Parallel run loop
auto	3.5544325943944233	0.0	discard	27_4_in_6	Parallel run loop
auto	4.184389205054561	0.0	discard	25_4_in_5	Parallel run loop
auto	3.5043692815954772	0.0	discard	26_4_in_6	Parallel run loop
auto	7.00002069337825	0.0	discard	20_DOMINO_in_4	Parallel run loop
auto	3.3810451120187923	0.0	discard	23_4_in_6	Parallel run loop
auto	2.719506423775007	0.0	discard	29_4_in_8	Parallel run loop
auto	1.9542359188748015	0.0	keep	19_3_in_6	Parallel run loop
auto	4.8697933665466095	0.0	keep	9_DOMINO_in_4	Parallel run loop
auto	2.335140167941394	0.0	discard	21_4_in_8	Parallel run loop
auto	1.562676442511998	0.0	discard	22_3_in_8	Parallel run loop
auto	1.530517468089551	0.0	discard	21_3_in_8	Parallel run loop
auto	1.36838468046237	0.0	discard	16_3_in_8	Parallel run loop
auto	1.3962954396689018	0.0	discard	17_3_in_8	Parallel run loop
auto	2.8520283621778604	0.0	discard	32_4_in_8	Parallel run loop
auto	3.677169467894478	0.0	keep	29_4_in_6	Parallel run loop
auto	1.7588423192777844	0.0	discard	28_3_in_8	Parallel run loop
auto	1.7315851874788082	0.0	discard	27_3_in_8	Parallel run loop
auto	1.7106038383549487	0.0	discard	26_3_in_8	Parallel run loop
auto	1.4819201106967939	0.0	discard	19_3_in_8	Parallel run loop
auto	3.4206381989398404	0.0	discard	24_4_in_6	Parallel run loop
auto	11.949685955614227	0.0	discard	18_6_in_3	Parallel run loop
auto	1.439518984010248	0.0	discard	18_3_in_8	Parallel run loop
auto	4.591515347828647	0.0	discard	30_4_in_5	Parallel run loop
auto	8.775464893013828	0.0	discard	13_DOMINO_in_3	Parallel run loop
auto	3.6310466616901667	0.0	discard	28_4_in_6	Parallel run loop
auto	1.596109782763897	0.0	discard	23_3_in_8	Parallel run loop
auto	4.330197218587709	0.0	discard	40_4_in_6	Parallel run loop
auto	14.046687753100313	0.0	keep	39_5_in_3	Parallel run loop
auto	4.2605177369925595	0.0	keep	39_4_in_6	Parallel run loop
auto	2.5524848979436956	0.0	keep	26_4_in_8	Parallel run loop
auto	4.722915252995685	0.0	keep	32_4_in_5	Parallel run loop
auto	6.917185289957142	0.0	discard	19_DOMINO_in_4	Parallel run loop
auto	12.9024744243239	0.0	discard	33_5_in_3	Parallel run loop
auto	13.869713298816702	0.0	discard	38_5_in_3	Parallel run loop
auto	2.886925318404044	0.0	discard	17_4_in_6	Parallel run loop
auto	1.5011400082651052	0.0	discard	20_3_in_8	Parallel run loop
auto	4.422348851354329	0.0	keep	28_4_in_5	Parallel run loop
auto	9.932504026696751	0.0	keep	18_DOMINO_in_3	Parallel run loop
auto	6.000019946893238	0.0	discard	14_DOMINO_in_4	Parallel run loop
auto	13.81491594123617	0.0	discard	25_6_in_3	Parallel run loop
auto	12.775860034341676	0.0	discard	32_5_in_3	Parallel run loop
auto	10.633738628342188	0.0	keep	20_DOMINO_in_3	Parallel run loop
auto	1.7727463581284404	0.0	keep	29_3_in_8	Parallel run loop
auto	2.498751567925155	0.0	keep	25_4_in_8	Parallel run loop
auto	3.5598074205612367	0.0	discard	27_4_in_6	Parallel run loop
auto	2.761296903153339	0.0	discard	30_4_in_8	Parallel run loop
auto	2.8995068583162413	0.0	keep	33_4_in_8	Parallel run loop
auto	2.339706308164056	0.0	discard	21_4_in_8	Parallel run loop
auto	1.6640081377671292	0.0	keep	25_3_in_8	Parallel run loop
auto	1.6370396410597632	0.0	keep	24_3_in_8	Parallel run loop
auto	1.5837752061087893	0.0	discard	22_3_in_8	Parallel run loop
auto	4.167994950797684	0.0	keep	25_4_in_5	Parallel run loop
auto	9.619115168407207	0.0	discard	16_DOMINO_in_3	Parallel run loop
auto	1.372683681465086	0.0	discard	16_3_in_8	Parallel run loop
auto	4.016637004422287	0.0	discard	35_4_in_6	Parallel run loop
auto	8.92973999295741	0.0	discard	14_DOMINO_in_3	Parallel run loop
auto	3.523690648993375	0.0	discard	26_4_in_6	Parallel run loop
auto	3.899736977436757	0.0	discard	33_4_in_6	Parallel run loop
auto	4.766806084765439	0.0	keep	33_4_in_5	Parallel run loop
auto	3.1720129348464132	0.0	discard	40_4_in_8	Parallel run loop
auto	1.5398820168023855	0.0	discard	21_3_in_8	Parallel run loop
auto	2.7204414955160434	0.0	discard	29_4_in_8	Parallel run loop
auto	2.630295409018636	0.0	keep	28_4_in_8	Parallel run loop
auto	1.821223442912542	0.0	discard	30_3_in_8	Parallel run loop
auto	3.1358544743636227	0.0	discard	39_4_in_8	Parallel run loop
auto	11.949685955614227	0.0	discard	18_6_in_3	Parallel run loop
auto	4.723457441202047	0.0	discard	32_4_in_5	Parallel run loop
auto	4.836902548017542	0.0	discard	34_4_in_5	Parallel run loop
auto	1.7664009913969017	0.0	discard	28_3_in_8	Parallel run loop
auto	4.565337815553901	0.0	keep	30_4_in_5	Parallel run loop
auto	6.880135199247852	0.0	discard	19_DOMINO_in_4	Parallel run loop
auto	11.087420695432247	0.0	discard	22_DOMINO_in_3	Parallel run loop
auto	1.6960647652406249	0.0	discard	26_3_in_8	Parallel run loop
auto	2.5729670951409838	0.0	discard	26_4_in_8	Parallel run loop
auto	3.633112869911105	0.0	discard	28_4_in_6	Parallel run loop
auto	10.935408919797645	0.0	keep	21_DOMINO_in_3	Parallel run loop
auto	2.8508316106631586	0.0	discard	32_4_in_8	Parallel run loop
auto	14.041272433350503	0.0	keep	39_5_in_3	Parallel run loop
auto	4.267829916569931	0.0	discard	39_4_in_6	Parallel run loop
auto	3.6869814981866664	0.0	discard	29_4_in_6	Parallel run loop
auto	1.7397561725845585	0.0	discard	27_3_in_8	Parallel run loop
auto	4.328603237522852	0.0	keep	40_4_in_6	Parallel run loop
auto	1.605612861473498	0.0	discard	23_3_in_8	Parallel run loop
auto	7.000086231629819	0.0	discard	20_DOMINO_in_4	Parallel run loop
auto	3.942088596145953	0.0	discard	34_4_in_6	Parallel run loop
auto	11.287086234862041	0.0	discard	23_DOMINO_in_3	Parallel run loop
auto	1.6778600942355635	0.0	discard	25_3_in_8	Parallel run loop
auto	1.8435963493311955	0.0	keep	32_3_in_8	Parallel run loop
auto	11.874682297416605	0.0	discard	25_DOMINO_in_3	Parallel run loop
auto	2.498751567925155	0.0	discard	25_4_in_8	Parallel run loop
auto	2.8995818271329337	0.0	discard	33_4_in_8	Parallel run loop
auto	9.477589795765269	0.0	keep	16_DOMINO_in_3	Parallel run loop
auto	10.668246111399757	0.0	discard	20_DOMINO_in_3	Parallel run loop
auto	1.9827241679061538	0.0	keep	20_3_in_6	Parallel run loop
auto	1.8144062062665383	0.0	keep	31_3_in_8	Parallel run loop
auto	1.76885203281023	0.0	keep	29_3_in_8	Parallel run loop
auto	12.24440411714481	0.0	keep	27_DOMINO_in_3	Parallel run loop
auto	5.995238877583559	0.0	discard	14_DOMINO_in_4	Parallel run loop
