commit	score	memory_gb	status	problem	description
auto	10.625528379341857	0.0	discard	39_4_in_3	Parallel run loop
auto	11.01851023958955	0.0	discard	43_4_in_3	Parallel run loop
auto	10.981271781615474	0.0	discard	41_4_in_3	Parallel run loop
auto	8.465628025883607	0.0	discard	24_4_in_3	Parallel run loop
auto	4.8139467162719285	0.0	discard	6_6_in_4	Parallel run loop
auto	8.620168250920733	0.0	discard	25_4_in_3	Parallel run loop
auto	9.69401667960561	0.0	discard	32_4_in_3	Parallel run loop
auto	5.15538249832505	0.0	discard	7_4_in_3	Parallel run loop
auto	10.111596612230604	0.0	discard	36_4_in_3	Parallel run loop
auto	10.776309862715156	0.0	discard	40_4_in_3	Parallel run loop
auto	6.339849586688972	0.0	discard	11_6_in_4	Parallel run loop
auto	8.430168530083199	0.0	discard	21_6_in_4	Parallel run loop
auto	7.9061745767615585	0.0	discard	18_6_in_4	Parallel run loop
auto	10.087489862056094	0.0	discard	35_4_in_3	Parallel run loop
auto	11.057079850967028	0.0	discard	42_4_in_3	Parallel run loop
auto	8.323047882924953	0.0	discard	23_4_in_3	Parallel run loop
auto	3.2320649913102013	0.0	discard	3_4_in_3	Parallel run loop
auto	9.083749787439356	0.0	discard	25_6_in_4	Parallel run loop
auto	6.105491953617294	0.0	discard	10_6_in_4	Parallel run loop
auto	5.309910838673369	0.0	discard	9_4_in_3	Parallel run loop
auto	5.309456355946519	0.0	discard	8_4_in_3	Parallel run loop
auto	7.606741618201064	0.0	discard	17_6_in_4	Parallel run loop
auto	9.472120229746906	0.0	discard	31_4_in_3	Parallel run loop
auto	7.387955541169579	0.0	discard	18_4_in_3	Parallel run loop
auto	8.785229111502591	0.0	discard	27_4_in_3	Parallel run loop
auto	7.15750196563385	0.0	discard	16_4_in_3	Parallel run loop
auto	9.928503593750683	0.0	discard	34_4_in_3	Parallel run loop
auto	9.513940573292547	0.0	discard	27_6_in_4	Parallel run loop
auto	4.154707933020685	0.0	discard	4_4_in_3	Parallel run loop
auto	8.233889537063785	0.0	discard	22_4_in_3	Parallel run loop
auto	6.388840407653808	0.0	discard	12_6_in_4	Parallel run loop
auto	4.3094996669154355	0.0	discard	6_4_in_3	Parallel run loop
auto	10.995310036433763	0.0	keep	43_4_in_3	Parallel run loop
auto	11.077146989590327	0.0	discard	41_4_in_3	Parallel run loop
auto	10.599771163337323	0.0	discard	39_4_in_3	Parallel run loop
auto	4.814636736279653	0.0	discard	6_6_in_4	Parallel run loop
auto	9.748219324694178	0.0	discard	32_4_in_3	Parallel run loop
auto	8.563014759510843	0.0	discard	25_4_in_3	Parallel run loop
auto	8.620705105771622	0.0	discard	24_4_in_3	Parallel run loop
auto	8.418144246325605	0.0	discard	21_6_in_4	Parallel run loop
auto	10.077416856221319	0.0	discard	36_4_in_3	Parallel run loop
auto	4.309418543637569	0.0	discard	5_4_in_3	Parallel run loop
auto	8.356862175146127	0.0	discard	23_4_in_3	Parallel run loop
auto	7.8918224118578415	0.0	discard	18_6_in_4	Parallel run loop
auto	10.734548854156785	0.0	keep	40_4_in_3	Parallel run loop
auto	10.049879095022563	0.0	discard	35_4_in_3	Parallel run loop
auto	11.108688289472683	0.0	discard	42_4_in_3	Parallel run loop
auto	7.309824033492363	0.0	discard	17_4_in_3	Parallel run loop
auto	5.15538249832505	0.0	discard	7_4_in_3	Parallel run loop
auto	7.321655420249306	0.0	discard	16_6_in_4	Parallel run loop
auto	9.100998092955923	0.0	discard	25_6_in_4	Parallel run loop
auto	5.313726164808948	0.0	discard	9_4_in_3	Parallel run loop
auto	5.518386109617193	0.0	discard	9_6_in_4	Parallel run loop
auto	7.609265549754522	0.0	discard	17_6_in_4	Parallel run loop
auto	8.78113153438419	0.0	discard	27_4_in_3	Parallel run loop
auto	7.387955541169579	0.0	discard	18_4_in_3	Parallel run loop
auto	9.619043541412415	0.0	discard	31_4_in_3	Parallel run loop
auto	9.859456383527776	0.0	discard	34_4_in_3	Parallel run loop
auto	6.309719735191199	0.0	discard	12_4_in_3	Parallel run loop
auto	9.513940573292547	0.0	discard	27_6_in_4	Parallel run loop
auto	3.7250031912651163	0.0	discard	4_6_in_4	Parallel run loop
auto	4.438123057858091	0.0	discard	5_6_in_4	Parallel run loop
auto	3.491959014509597	0.0	discard	3_6_in_4	Parallel run loop
auto	10.940638114596652	0.0	discard	41_4_in_3	Parallel run loop
auto	6.759508156569627	0.0	discard	13_6_in_4	Parallel run loop
auto	11.01851023958955	0.0	discard	43_4_in_3	Parallel run loop
auto	6.156893685363397	0.0	discard	11_4_in_3	Parallel run loop
auto	9.807451120192226	0.0	discard	32_4_in_3	Parallel run loop
auto	10.599771163337323	0.0	discard	39_4_in_3	Parallel run loop
auto	8.620941418099708	0.0	discard	24_4_in_3	Parallel run loop
auto	8.43048885754377	0.0	discard	21_6_in_4	Parallel run loop
auto	8.619398901246518	0.0	discard	25_4_in_3	Parallel run loop
auto	10.776309862715156	0.0	discard	40_4_in_3	Parallel run loop
auto	10.143929657656013	0.0	discard	36_4_in_3	Parallel run loop
auto	7.763371982027166	0.0	discard	18_6_in_4	Parallel run loop
auto	8.472237346101952	0.0	discard	23_4_in_3	Parallel run loop
auto	4.154750717508222	0.0	discard	4_4_in_3	Parallel run loop
auto	10.102256807489026	0.0	discard	35_4_in_3	Parallel run loop
auto	9.118021638826727	0.0	discard	25_6_in_4	Parallel run loop
auto	6.337048755811844	0.0	discard	11_6_in_4	Parallel run loop
auto	11.057079850967028	0.0	discard	42_4_in_3	Parallel run loop
auto	4.309409782028365	0.0	discard	5_4_in_3	Parallel run loop
auto	6.388439030675833	0.0	discard	12_6_in_4	Parallel run loop
auto	3.232052318453766	0.0	discard	3_4_in_3	Parallel run loop
auto	7.929378074021842	0.0	discard	19_6_in_4	Parallel run loop
auto	8.1687093249147	0.0	discard	22_4_in_3	Parallel run loop
auto	8.793324245426204	0.0	discard	27_4_in_3	Parallel run loop
auto	9.859456383527776	0.0	discard	34_4_in_3	Parallel run loop
auto	7.465170253767653	0.0	discard	18_4_in_3	Parallel run loop
auto	4.3094996669154355	0.0	discard	6_4_in_3	Parallel run loop
auto	5.1555613069564314	0.0	discard	7_4_in_3	Parallel run loop
auto	9.503810945828404	0.0	discard	31_4_in_3	Parallel run loop
auto	4.44028768886956	0.0	discard	5_6_in_4	Parallel run loop
auto	9.500382336005865	0.0	discard	27_6_in_4	Parallel run loop
auto	3.491959014509597	0.0	discard	3_6_in_4	Parallel run loop
auto	6.764428342593895	0.0	discard	13_6_in_4	Parallel run loop
auto	11.058125893868384	0.0	discard	43_4_in_3	Parallel run loop
auto	9.622119891087138	0.0	keep	32_4_in_3	Parallel run loop
auto	10.95031226862635	0.0	discard	41_4_in_3	Parallel run loop
auto	8.627146868055858	0.0	discard	25_4_in_3	Parallel run loop
auto	7.31230043469089	0.0	discard	17_4_in_3	Parallel run loop
auto	8.522156032410958	0.0	discard	24_4_in_3	Parallel run loop
auto	8.43048885754377	0.0	discard	21_6_in_4	Parallel run loop
auto	10.599771163337323	0.0	discard	39_4_in_3	Parallel run loop
auto	7.766032072953816	0.0	discard	18_6_in_4	Parallel run loop
auto	5.309763263875329	0.0	discard	8_4_in_3	Parallel run loop
auto	6.105491953617294	0.0	discard	10_6_in_4	Parallel run loop
auto	10.776309862715156	0.0	discard	40_4_in_3	Parallel run loop
auto	6.339849586688972	0.0	discard	11_6_in_4	Parallel run loop
auto	10.093516369069183	0.0	discard	35_4_in_3	Parallel run loop
auto	10.088480821976555	0.0	discard	36_4_in_3	Parallel run loop
auto	9.100998092955923	0.0	discard	25_6_in_4	Parallel run loop
auto	4.309418543637569	0.0	discard	5_4_in_3	Parallel run loop
auto	10.93955256506185	0.0	discard	42_4_in_3	Parallel run loop
auto	7.321655420249306	0.0	discard	16_6_in_4	Parallel run loop
auto	7.470795874046588	0.0	keep	19_4_in_3	Parallel run loop
auto	6.393229738822146	0.0	discard	12_6_in_4	Parallel run loop
auto	5.518386109617193	0.0	discard	9_6_in_4	Parallel run loop
auto	7.4645934216366685	0.0	discard	18_4_in_3	Parallel run loop
auto	4.154750717508222	0.0	discard	4_4_in_3	Parallel run loop
auto	9.942756554192467	0.0	discard	34_4_in_3	Parallel run loop
auto	8.893973736111443	0.0	discard	27_4_in_3	Parallel run loop
auto	6.309719735191199	0.0	discard	12_4_in_3	Parallel run loop
auto	8.608683626354077	0.0	discard	22_6_in_4	Parallel run loop
auto	9.619043541412415	0.0	discard	31_4_in_3	Parallel run loop
auto	3.7250037826503797	0.0	discard	4_6_in_4	Parallel run loop
auto	9.743762411586093	0.0	discard	32_4_in_3	Parallel run loop
auto	3.4919620863456333	0.0	discard	3_6_in_4	Parallel run loop
auto	11.01851023958955	0.0	discard	43_4_in_3	Parallel run loop
auto	9.513940573292547	0.0	discard	27_6_in_4	Parallel run loop
auto	10.933591371805527	0.0	discard	41_4_in_3	Parallel run loop
auto	5.155808462483053	0.0	discard	7_4_in_3	Parallel run loop
auto	8.556205176387037	0.0	discard	25_4_in_3	Parallel run loop
auto	8.43048885754377	0.0	discard	21_6_in_4	Parallel run loop
auto	8.465628025883607	0.0	discard	24_4_in_3	Parallel run loop
auto	7.9061745767615585	0.0	discard	18_6_in_4	Parallel run loop
auto	10.629098076349557	0.0	discard	39_4_in_3	Parallel run loop
auto	9.14865194240609	0.0	discard	25_6_in_4	Parallel run loop
auto	7.15750196563385	0.0	discard	16_4_in_3	Parallel run loop
auto	6.154772890366584	0.0	discard	11_4_in_3	Parallel run loop
auto	10.088422645839744	0.0	discard	36_4_in_3	Parallel run loop
auto	10.776309862715156	0.0	discard	40_4_in_3	Parallel run loop
auto	4.815183322352559	0.0	discard	6_6_in_4	Parallel run loop
auto	3.232052318453766	0.0	discard	3_4_in_3	Parallel run loop
auto	7.320570895988601	0.0	keep	16_6_in_4	Parallel run loop
auto	11.057079850967028	0.0	discard	42_4_in_3	Parallel run loop
auto	9.96963730171343	0.0	discard	35_4_in_3	Parallel run loop
auto	7.471317325000314	0.0	discard	19_4_in_3	Parallel run loop
auto	7.606741618201064	0.0	discard	17_6_in_4	Parallel run loop
auto	5.464553491011745	0.0	discard	10_4_in_3	Parallel run loop
auto	8.156687169662156	0.0	discard	22_4_in_3	Parallel run loop
auto	10.010389597059318	0.0	discard	34_4_in_3	Parallel run loop
auto	7.464812585357712	0.0	discard	18_4_in_3	Parallel run loop
auto	6.310010096341531	0.0	discard	12_4_in_3	Parallel run loop
auto	4.3094996669154355	0.0	discard	6_4_in_3	Parallel run loop
auto	7.929378074021842	0.0	discard	19_6_in_4	Parallel run loop
auto	8.851527856275144	0.0	discard	27_4_in_3	Parallel run loop
auto	9.472120229746906	0.0	discard	31_4_in_3	Parallel run loop
auto	9.510755639083786	0.0	discard	27_6_in_4	Parallel run loop
auto	9.721971095944252	0.0	discard	32_4_in_3	Parallel run loop
auto	8.619398901246518	0.0	discard	25_4_in_3	Parallel run loop
auto	4.154750717508222	0.0	discard	4_4_in_3	Parallel run loop
auto	11.088947444804658	0.0	discard	43_4_in_3	Parallel run loop
auto	10.938332257894034	0.0	discard	41_4_in_3	Parallel run loop
auto	8.43048885754377	0.0	discard	21_6_in_4	Parallel run loop
auto	7.312938778337731	0.0	discard	17_4_in_3	Parallel run loop
auto	10.599771163337323	0.0	discard	39_4_in_3	Parallel run loop
auto	7.899473797362574	0.0	discard	18_6_in_4	Parallel run loop
auto	8.542548949487486	0.0	discard	24_4_in_3	Parallel run loop
auto	10.096814507517992	0.0	discard	36_4_in_3	Parallel run loop
auto	10.776309862715156	0.0	discard	40_4_in_3	Parallel run loop
auto	6.155773140917192	0.0	discard	11_4_in_3	Parallel run loop
auto	9.118021638826727	0.0	discard	25_6_in_4	Parallel run loop
auto	8.668469913995917	0.0	discard	23_6_in_4	Parallel run loop
auto	6.10514585744093	0.0	discard	10_6_in_4	Parallel run loop
auto	9.877528661157257	0.0	discard	35_4_in_3	Parallel run loop
auto	3.232066114699316	0.0	discard	3_4_in_3	Parallel run loop
auto	7.322848099940094	0.0	discard	16_6_in_4	Parallel run loop
auto	7.616186786313882	0.0	discard	17_6_in_4	Parallel run loop
auto	7.47650969637775	0.0	discard	19_4_in_3	Parallel run loop
auto	11.057079850967028	0.0	discard	42_4_in_3	Parallel run loop
auto	5.313726164808948	0.0	discard	9_4_in_3	Parallel run loop
auto	5.309456355946519	0.0	discard	8_4_in_3	Parallel run loop
auto	7.387785192386595	0.0	discard	18_4_in_3	Parallel run loop
auto	7.929378074021842	0.0	discard	19_6_in_4	Parallel run loop
auto	8.169777396534393	0.0	discard	22_4_in_3	Parallel run loop
auto	9.472120229746906	0.0	discard	31_4_in_3	Parallel run loop
auto	9.990378349400562	0.0	discard	34_4_in_3	Parallel run loop
auto	8.865129767555105	0.0	discard	27_4_in_3	Parallel run loop
auto	9.513940573292547	0.0	discard	27_6_in_4	Parallel run loop
auto	9.743762411586093	0.0	discard	32_4_in_3	Parallel run loop
auto	5.518421711656798	0.0	discard	9_6_in_4	Parallel run loop
auto	11.01851023958955	0.0	discard	43_4_in_3	Parallel run loop
auto	8.563014759510843	0.0	discard	25_4_in_3	Parallel run loop
auto	8.43048885754377	0.0	discard	21_6_in_4	Parallel run loop
auto	10.940553511555468	0.0	discard	41_4_in_3	Parallel run loop
auto	5.1555613069564314	0.0	discard	7_4_in_3	Parallel run loop
auto	10.619926529082107	0.0	discard	39_4_in_3	Parallel run loop
auto	7.730063257741899	0.0	discard	18_6_in_4	Parallel run loop
auto	6.156893685363397	0.0	discard	11_4_in_3	Parallel run loop
auto	8.583374246046413	0.0	discard	22_6_in_4	Parallel run loop
auto	4.154750717508222	0.0	discard	4_4_in_3	Parallel run loop
auto	8.522156032410958	0.0	discard	24_4_in_3	Parallel run loop
auto	10.086710196539814	0.0	discard	36_4_in_3	Parallel run loop
auto	10.776309862715156	0.0	discard	40_4_in_3	Parallel run loop
auto	9.118021638826727	0.0	discard	25_6_in_4	Parallel run loop
auto	6.1061179029979	0.0	discard	10_6_in_4	Parallel run loop
auto	9.877528661157257	0.0	discard	35_4_in_3	Parallel run loop
auto	4.437844418212015	0.0	discard	5_6_in_4	Parallel run loop
auto	3.7250037826503797	0.0	discard	4_6_in_4	Parallel run loop
auto	6.758488101159232	0.0	discard	13_6_in_4	Parallel run loop
auto	4.309409782028365	0.0	discard	5_4_in_3	Parallel run loop
auto	11.103279346092311	0.0	discard	42_4_in_3	Parallel run loop
auto	7.15750196563385	0.0	discard	16_4_in_3	Parallel run loop
auto	6.339849586688972	0.0	discard	11_6_in_4	Parallel run loop
auto	7.387785192386595	0.0	discard	18_4_in_3	Parallel run loop
auto	5.464403883665692	0.0	discard	10_4_in_3	Parallel run loop
auto	9.48566769368882	0.0	discard	31_4_in_3	Parallel run loop
auto	9.69401667960561	0.0	discard	32_4_in_3	Parallel run loop
auto	4.813853256562242	0.0	discard	6_6_in_4	Parallel run loop
auto	6.964348331759805	0.0	discard	15_6_in_4	Parallel run loop
auto	9.492725968698753	0.0	discard	27_6_in_4	Parallel run loop
auto	9.928503593750683	0.0	discard	34_4_in_3	Parallel run loop
auto	8.710054883820813	0.0	discard	27_4_in_3	Parallel run loop
auto	8.6040706617287	0.0	discard	22_6_in_4	Parallel run loop
auto	8.563014759510843	0.0	discard	25_4_in_3	Parallel run loop
auto	10.929690989571514	0.0	discard	41_4_in_3	Parallel run loop
auto	11.01851023958955	0.0	discard	43_4_in_3	Parallel run loop
auto	8.407910149090497	0.0	keep	21_6_in_4	Parallel run loop
auto	6.464503639360893	0.0	discard	14_4_in_3	Parallel run loop
auto	10.599771163337323	0.0	discard	39_4_in_3	Parallel run loop
auto	8.468423042134118	0.0	discard	24_4_in_3	Parallel run loop
auto	6.388840407653808	0.0	discard	12_6_in_4	Parallel run loop
auto	10.090481997169428	0.0	discard	36_4_in_3	Parallel run loop
auto	9.149636321582882	0.0	discard	25_6_in_4	Parallel run loop
auto	7.737109131649374	0.0	discard	18_6_in_4	Parallel run loop
auto	10.776309862715156	0.0	discard	40_4_in_3	Parallel run loop
auto	4.3094996669154355	0.0	discard	6_4_in_3	Parallel run loop
auto	4.309409782028365	0.0	discard	5_4_in_3	Parallel run loop
auto	6.75809411049523	0.0	discard	13_6_in_4	Parallel run loop
auto	7.618906682430825	0.0	keep	20_4_in_3	Parallel run loop
auto	4.440722088808257	0.0	discard	5_6_in_4	Parallel run loop
auto	10.938891194679247	0.0	keep	42_4_in_3	Parallel run loop
auto	7.309824033492363	0.0	discard	17_4_in_3	Parallel run loop
auto	10.049879095022563	0.0	discard	35_4_in_3	Parallel run loop
auto	4.154750717508222	0.0	discard	4_4_in_3	Parallel run loop
auto	8.668469913995917	0.0	discard	23_6_in_4	Parallel run loop
auto	7.387955541169579	0.0	discard	18_4_in_3	Parallel run loop
auto	5.313726164808948	0.0	discard	9_4_in_3	Parallel run loop
auto	9.472120229746906	0.0	discard	31_4_in_3	Parallel run loop
auto	4.8139467162719285	0.0	discard	6_6_in_4	Parallel run loop
auto	9.81378147137679	0.0	discard	32_4_in_3	Parallel run loop
auto	9.883661321007729	0.0	discard	34_4_in_3	Parallel run loop
auto	9.455403984086399	0.0	discard	27_6_in_4	Parallel run loop
auto	8.78608841182452	0.0	discard	27_4_in_3	Parallel run loop
auto	8.627146868055858	0.0	discard	25_4_in_3	Parallel run loop
auto	5.309719664446083	0.0	discard	8_4_in_3	Parallel run loop
auto	8.43048885754377	0.0	discard	21_6_in_4	Parallel run loop
auto	10.879207643540097	0.0	discard	41_4_in_3	Parallel run loop
auto	5.518194035394583	0.0	discard	9_6_in_4	Parallel run loop
auto	11.01851023958955	0.0	discard	43_4_in_3	Parallel run loop
auto	6.465828989260902	0.0	discard	14_4_in_3	Parallel run loop
auto	8.473473250294598	0.0	discard	24_4_in_3	Parallel run loop
auto	10.776309862715156	0.0	discard	40_4_in_3	Parallel run loop
auto	10.077416856221319	0.0	discard	36_4_in_3	Parallel run loop
auto	7.9061745767615585	0.0	discard	18_6_in_4	Parallel run loop
auto	10.599771163337323	0.0	discard	39_4_in_3	Parallel run loop
auto	9.118021638826727	0.0	discard	25_6_in_4	Parallel run loop
auto	10.947326139296766	0.0	discard	42_4_in_3	Parallel run loop
auto	6.309719735191199	0.0	discard	12_4_in_3	Parallel run loop
auto	5.1553690662282134	0.0	discard	7_4_in_3	Parallel run loop
auto	4.309409782028365	0.0	discard	5_4_in_3	Parallel run loop
auto	9.997726937860921	0.0	discard	35_4_in_3	Parallel run loop
auto	3.7250037826503797	0.0	discard	4_6_in_4	Parallel run loop
auto	6.758530280097716	0.0	discard	13_6_in_4	Parallel run loop
auto	7.62125626675218	0.0	discard	20_4_in_3	Parallel run loop
auto	9.541643379937524	0.0	discard	30_4_in_3	Parallel run loop
auto	3.491959014509597	0.0	discard	3_6_in_4	Parallel run loop
auto	7.465170253767653	0.0	discard	18_4_in_3	Parallel run loop
auto	3.2320649913102013	0.0	discard	3_4_in_3	Parallel run loop
auto	6.339849586688972	0.0	discard	11_6_in_4	Parallel run loop
auto	7.15750196563385	0.0	discard	16_4_in_3	Parallel run loop
auto	9.35004166159248	0.0	discard	27_6_in_4	Parallel run loop
auto	9.659578206958082	0.0	discard	32_4_in_3	Parallel run loop
auto	9.472120229746906	0.0	discard	31_4_in_3	Parallel run loop
auto	8.43048885754377	0.0	discard	21_6_in_4	Parallel run loop
auto	8.786601090591251	0.0	discard	27_4_in_3	Parallel run loop
auto	9.922051061990897	0.0	discard	34_4_in_3	Parallel run loop
auto	5.518421711656798	0.0	discard	9_6_in_4	Parallel run loop
auto	10.960459983336765	0.0	discard	41_4_in_3	Parallel run loop
auto	8.620168250920733	0.0	discard	25_4_in_3	Parallel run loop
auto	4.154707933020685	0.0	discard	4_4_in_3	Parallel run loop
auto	11.01851023958955	0.0	discard	43_4_in_3	Parallel run loop
auto	5.464325313619975	0.0	discard	10_4_in_3	Parallel run loop
auto	8.522156032410958	0.0	discard	24_4_in_3	Parallel run loop
auto	10.12146122489197	0.0	discard	36_4_in_3	Parallel run loop
auto	9.073586204037362	0.0	keep	25_6_in_4	Parallel run loop
auto	6.761533342910078	0.0	discard	13_6_in_4	Parallel run loop
auto	7.606741618201064	0.0	discard	17_6_in_4	Parallel run loop
auto	9.952991374773895	0.0	discard	35_4_in_3	Parallel run loop
auto	10.599771163337323	0.0	discard	39_4_in_3	Parallel run loop
auto	6.964000014504972	0.0	discard	15_6_in_4	Parallel run loop
auto	10.776309862715156	0.0	discard	40_4_in_3	Parallel run loop
auto	5.15538249832505	0.0	discard	7_4_in_3	Parallel run loop
auto	7.6208696685191635	0.0	discard	20_4_in_3	Parallel run loop
auto	10.947326139296766	0.0	discard	42_4_in_3	Parallel run loop
auto	7.9061745767615585	0.0	discard	18_6_in_4	Parallel run loop
auto	8.235227417004392	0.0	discard	22_4_in_3	Parallel run loop
auto	3.491966624935928	0.0	discard	3_6_in_4	Parallel run loop
auto	6.388840407653808	0.0	discard	12_6_in_4	Parallel run loop
auto	4.3094996669154355	0.0	discard	6_4_in_3	Parallel run loop
auto	7.929378074021842	0.0	discard	19_6_in_4	Parallel run loop
auto	7.309824033492363	0.0	discard	17_4_in_3	Parallel run loop
auto	9.460383991664408	0.0	discard	27_6_in_4	Parallel run loop
auto	7.387785192386595	0.0	discard	18_4_in_3	Parallel run loop
auto	8.418144246325605	0.0	discard	21_6_in_4	Parallel run loop
auto	8.893973736111443	0.0	discard	27_4_in_3	Parallel run loop
auto	9.472120229746906	0.0	discard	31_4_in_3	Parallel run loop
auto	9.659578206958082	0.0	discard	32_4_in_3	Parallel run loop
auto	10.857625834240915	0.0	discard	41_4_in_3	Parallel run loop
auto	4.154750717508222	0.0	discard	4_4_in_3	Parallel run loop
auto	9.942756554192467	0.0	discard	34_4_in_3	Parallel run loop
auto	8.627146868055858	0.0	discard	25_4_in_3	Parallel run loop
auto	8.668469913995917	0.0	discard	23_6_in_4	Parallel run loop
auto	8.568395832409651	0.0	discard	24_4_in_3	Parallel run loop
auto	6.106967720924623	0.0	discard	10_6_in_4	Parallel run loop
auto	10.938599347826347	0.0	keep	43_4_in_3	Parallel run loop
auto	9.118021638826727	0.0	discard	25_6_in_4	Parallel run loop
auto	10.090481997169428	0.0	discard	36_4_in_3	Parallel run loop
auto	5.155344374810373	0.0	discard	7_4_in_3	Parallel run loop
auto	6.758530280097716	0.0	discard	13_6_in_4	Parallel run loop
auto	11.020518488177382	0.0	discard	42_4_in_3	Parallel run loop
auto	5.309910838673369	0.0	discard	9_4_in_3	Parallel run loop
auto	9.877528661157257	0.0	discard	35_4_in_3	Parallel run loop
auto	6.964000014504972	0.0	discard	15_6_in_4	Parallel run loop
auto	10.619926529082107	0.0	discard	39_4_in_3	Parallel run loop
auto	10.776309862715156	0.0	discard	40_4_in_3	Parallel run loop
auto	7.7298149728516465	0.0	keep	18_6_in_4	Parallel run loop
auto	7.317715611254468	0.0	keep	16_6_in_4	Parallel run loop
auto	6.309719735191199	0.0	discard	12_4_in_3	Parallel run loop
auto	5.309456355946519	0.0	discard	8_4_in_3	Parallel run loop
auto	7.470689960011099	0.0	keep	19_4_in_3	Parallel run loop
auto	9.513940573292547	0.0	discard	27_6_in_4	Parallel run loop
auto	8.583374246046413	0.0	discard	22_6_in_4	Parallel run loop
auto	3.7250031912651163	0.0	discard	4_6_in_4	Parallel run loop
auto	8.43048885754377	0.0	discard	21_6_in_4	Parallel run loop
auto	9.235193419721474	0.0	discard	29_4_in_3	Parallel run loop
auto	7.387955541169579	0.0	discard	18_4_in_3	Parallel run loop
auto	9.472120229746906	0.0	discard	31_4_in_3	Parallel run loop
