commit	score	memory_gb	status	problem	description
auto	5.155344374810373	0.0	discard	7_4_in_3	Parallel run loop
auto	4.0398655873715015	0.0	discard	25_3_in_4	Parallel run loop
auto	6.9415985252871755	0.0	discard	42_3_in_3	Parallel run loop
auto	4.450144753771026	0.0	discard	41_3_in_5	Parallel run loop
auto	5.773367334754875	0.0	discard	46_3_in_4	Parallel run loop
auto	6.866435278289275	0.0	discard	41_3_in_3	Parallel run loop
auto	5.432573568682812	0.0	keep	43_3_in_4	Parallel run loop
auto	5.909524672483831	0.0	keep	30_3_in_3	Parallel run loop
auto	6.4818090142671645	0.0	keep	37_3_in_3	Parallel run loop
auto	7.3421123153878725	0.0	keep	46_3_in_3	Parallel run loop
auto	4.352340590859089	0.0	discard	40_3_in_5	Parallel run loop
auto	6.850157581093349	0.0	discard	39_3_in_3	Parallel run loop
auto	4.309409782028365	0.0	keep	5_4_in_3	Parallel run loop
auto	3.491959731325357	0.0	discard	3_6_in_4	Parallel run loop
auto	7.349793206731684	0.0	keep	45_3_in_3	Parallel run loop
auto	6.993287957642054	0.0	keep	43_3_in_3	Parallel run loop
auto	7.003877512508083	0.0	discard	44_3_in_3	Parallel run loop
auto	4.502916278981712	0.0	discard	42_3_in_5	Parallel run loop
auto	4.251302834683806	0.0	keep	39_3_in_5	Parallel run loop
auto	4.6314979312199895	0.0	discard	45_3_in_5	Parallel run loop
auto	6.155976403489312	0.0	discard	11_4_in_3	Parallel run loop
auto	5.309456355946519	0.0	keep	8_4_in_3	Parallel run loop
auto	4.440722088808257	0.0	discard	5_6_in_4	Parallel run loop
auto	6.659767022824357	0.0	keep	38_3_in_3	Parallel run loop
auto	3.232052318453766	0.0	keep	3_4_in_3	Parallel run loop
auto	7.869601854051851	0.0	discard	50_3_in_3	Parallel run loop
auto	4.81448320628354	0.0	keep	6_6_in_4	Parallel run loop
auto	5.764495888647738	0.0	keep	29_3_in_3	Parallel run loop
auto	6.9415985252871755	0.0	discard	42_3_in_3	Parallel run loop
auto	1.143532401649942	0.0	discard	3_3_in_5	Parallel run loop
auto	4.154750717508222	0.0	discard	4_4_in_3	Parallel run loop
auto	2.9771947200223887	0.0	keep	6_3_in_3	Parallel run loop
auto	6.105434418841609	0.0	discard	10_6_in_4	Parallel run loop
auto	1.8033637040984114	0.0	discard	5_3_in_4	Parallel run loop
auto	5.916515309268356	0.0	discard	30_3_in_3	Parallel run loop
auto	5.532468990143864	0.0	discard	43_3_in_4	Parallel run loop
auto	6.746108813914012	0.0	discard	37_3_in_3	Parallel run loop
auto	7.424187273053399	0.0	discard	46_3_in_3	Parallel run loop
auto	1.4783984091177982	0.0	discard	3_3_in_4	Parallel run loop
auto	6.866435278289275	0.0	discard	41_3_in_3	Parallel run loop
auto	6.849508062244828	0.0	discard	39_3_in_3	Parallel run loop
auto	4.459821975122056	0.0	discard	42_3_in_5	Parallel run loop
auto	5.155053785931084	0.0	discard	7_4_in_3	Parallel run loop
auto	7.143501075123361	0.0	keep	45_3_in_3	Parallel run loop
auto	6.309719735191199	0.0	keep	12_4_in_3	Parallel run loop
auto	7.004219438633266	0.0	discard	43_3_in_3	Parallel run loop
auto	4.302795502670536	0.0	discard	39_3_in_5	Parallel run loop
auto	4.725300635757203	0.0	discard	45_3_in_5	Parallel run loop
auto	3.491959014509597	0.0	discard	3_6_in_4	Parallel run loop
auto	4.309409782028365	0.0	discard	5_4_in_3	Parallel run loop
auto	6.670108867679205	0.0	discard	38_3_in_3	Parallel run loop
auto	6.339849586688972	0.0	discard	11_6_in_4	Parallel run loop
auto	7.869601854051851	0.0	discard	50_3_in_3	Parallel run loop
auto	7.15750196563385	0.0	discard	16_4_in_3	Parallel run loop
auto	5.800973214871754	0.0	discard	29_3_in_3	Parallel run loop
auto	5.309456355946519	0.0	discard	8_4_in_3	Parallel run loop
auto	6.156421400406855	0.0	discard	11_4_in_3	Parallel run loop
auto	4.814436351262699	0.0	keep	6_6_in_4	Parallel run loop
auto	5.916515309268356	0.0	discard	30_3_in_3	Parallel run loop
auto	3.2320607503195915	0.0	discard	3_4_in_3	Parallel run loop
auto	4.438943384678697	0.0	discard	5_6_in_4	Parallel run loop
auto	7.309824033492363	0.0	keep	17_4_in_3	Parallel run loop
auto	1.1435295943053447	0.0	discard	3_3_in_5	Parallel run loop
auto	6.892224974608594	0.0	discard	41_3_in_3	Parallel run loop
auto	6.764428342593895	0.0	discard	13_6_in_4	Parallel run loop
auto	7.436644633348435	0.0	discard	46_3_in_3	Parallel run loop
auto	4.154750717508222	0.0	discard	4_4_in_3	Parallel run loop
auto	2.977160322439396	0.0	keep	6_3_in_3	Parallel run loop
auto	7.463885837164645	0.0	discard	45_3_in_3	Parallel run loop
auto	4.476009527793577	0.0	discard	42_3_in_5	Parallel run loop
auto	6.104982492730227	0.0	keep	10_6_in_4	Parallel run loop
auto	1.8033170663164695	0.0	discard	5_3_in_4	Parallel run loop
auto	1.4783984091177982	0.0	discard	3_3_in_4	Parallel run loop
auto	6.309719735191199	0.0	discard	12_4_in_3	Parallel run loop
auto	4.3094996669154355	0.0	discard	6_4_in_3	Parallel run loop
auto	3.7250031912651163	0.0	keep	4_6_in_4	Parallel run loop
auto	5.309910838673369	0.0	keep	9_4_in_3	Parallel run loop
auto	5.155344374810373	0.0	discard	7_4_in_3	Parallel run loop
auto	5.750775043117149	0.0	keep	29_3_in_3	Parallel run loop
auto	6.339849586688972	0.0	discard	11_6_in_4	Parallel run loop
auto	4.309409782028365	0.0	discard	5_4_in_3	Parallel run loop
auto	7.15750196563385	0.0	discard	16_4_in_3	Parallel run loop
auto	3.491959014509597	0.0	discard	3_6_in_4	Parallel run loop
auto	6.388840407653808	0.0	discard	12_6_in_4	Parallel run loop
auto	8.159343201959462	0.0	discard	22_4_in_3	Parallel run loop
auto	3.232066114699316	0.0	discard	3_4_in_3	Parallel run loop
auto	6.864963969939269	0.0	keep	41_3_in_3	Parallel run loop
auto	5.518367766774567	0.0	keep	9_6_in_4	Parallel run loop
auto	6.155507768102454	0.0	discard	11_4_in_3	Parallel run loop
auto	5.309456355946519	0.0	discard	8_4_in_3	Parallel run loop
auto	4.8151242401285455	0.0	discard	6_6_in_4	Parallel run loop
auto	1.143532401649942	0.0	discard	3_3_in_5	Parallel run loop
auto	4.501108891407314	0.0	discard	42_3_in_5	Parallel run loop
auto	4.438938361146937	0.0	discard	5_6_in_4	Parallel run loop
auto	7.309824033492363	0.0	discard	17_4_in_3	Parallel run loop
auto	6.761533342910078	0.0	keep	13_6_in_4	Parallel run loop
auto	2.9772326063708436	0.0	discard	6_3_in_3	Parallel run loop
auto	4.154750717508222	0.0	discard	4_4_in_3	Parallel run loop
auto	1.8033170663164695	0.0	discard	5_3_in_4	Parallel run loop
auto	5.464261083124018	0.0	keep	10_4_in_3	Parallel run loop
auto	1.4783997932735071	0.0	discard	3_3_in_4	Parallel run loop
auto	5.802560013254032	0.0	discard	29_3_in_3	Parallel run loop
auto	6.309719735191199	0.0	discard	12_4_in_3	Parallel run loop
auto	4.3094996669154355	0.0	discard	6_4_in_3	Parallel run loop
auto	6.105491953617294	0.0	discard	10_6_in_4	Parallel run loop
auto	5.155403441090606	0.0	discard	7_4_in_3	Parallel run loop
auto	6.465828989260902	0.0	keep	14_4_in_3	Parallel run loop
auto	5.309910838673369	0.0	discard	9_4_in_3	Parallel run loop
auto	3.7250031912651163	0.0	discard	4_6_in_4	Parallel run loop
auto	4.309409782028365	0.0	discard	5_4_in_3	Parallel run loop
auto	6.962636027238767	0.0	discard	41_3_in_3	Parallel run loop
auto	3.491959731325357	0.0	discard	3_6_in_4	Parallel run loop
auto	3.232052318453766	0.0	discard	3_4_in_3	Parallel run loop
auto	7.15750196563385	0.0	discard	16_4_in_3	Parallel run loop
auto	6.339849586688972	0.0	discard	11_6_in_4	Parallel run loop
auto	7.6651078665839885	0.0	discard	17_6_in_4	Parallel run loop
auto	8.169777396534393	0.0	discard	22_4_in_3	Parallel run loop
auto	6.387462699883303	0.0	keep	12_6_in_4	Parallel run loop
auto	6.154772890366584	0.0	keep	11_4_in_3	Parallel run loop
auto	1.143532401649942	0.0	discard	3_3_in_5	Parallel run loop
auto	5.309456355946519	0.0	discard	8_4_in_3	Parallel run loop
auto	4.813853256562242	0.0	keep	6_6_in_4	Parallel run loop
auto	7.320812168678768	0.0	keep	16_6_in_4	Parallel run loop
auto	4.440722088808257	0.0	discard	5_6_in_4	Parallel run loop
auto	7.316129893063833	0.0	discard	17_4_in_3	Parallel run loop
auto	2.977253773162986	0.0	discard	6_3_in_3	Parallel run loop
auto	6.757236568870126	0.0	keep	13_6_in_4	Parallel run loop
auto	5.5183701774437885	0.0	discard	9_6_in_4	Parallel run loop
auto	8.583374246046413	0.0	discard	22_6_in_4	Parallel run loop
auto	6.1061179029979	0.0	discard	10_6_in_4	Parallel run loop
auto	6.309719735191199	0.0	discard	12_4_in_3	Parallel run loop
auto	7.929378074021842	0.0	discard	19_6_in_4	Parallel run loop
auto	4.3094996669154355	0.0	discard	6_4_in_3	Parallel run loop
auto	5.464131942977358	0.0	keep	10_4_in_3	Parallel run loop
auto	4.30942692978523	0.0	discard	5_4_in_3	Parallel run loop
auto	5.313726164808948	0.0	discard	9_4_in_3	Parallel run loop
auto	6.468945429935523	0.0	discard	14_4_in_3	Parallel run loop
auto	3.7250031912651163	0.0	discard	4_6_in_4	Parallel run loop
auto	7.471317325000314	0.0	discard	19_4_in_3	Parallel run loop
auto	3.2320607503195915	0.0	discard	3_4_in_3	Parallel run loop
auto	7.606741618201064	0.0	discard	17_6_in_4	Parallel run loop
auto	8.159343201959462	0.0	discard	22_4_in_3	Parallel run loop
auto	6.339849586688972	0.0	discard	11_6_in_4	Parallel run loop
auto	7.15750196563385	0.0	discard	16_4_in_3	Parallel run loop
auto	6.388840407653808	0.0	discard	12_6_in_4	Parallel run loop
auto	6.154772890366584	0.0	discard	11_4_in_3	Parallel run loop
auto	4.814977901128664	0.0	discard	6_6_in_4	Parallel run loop
auto	7.322558833359151	0.0	discard	16_6_in_4	Parallel run loop
auto	5.309540531425024	0.0	discard	8_4_in_3	Parallel run loop
auto	6.75909917167984	0.0	discard	13_6_in_4	Parallel run loop
auto	7.309824033492363	0.0	discard	17_4_in_3	Parallel run loop
auto	7.623564478432015	0.0	keep	20_4_in_3	Parallel run loop
auto	8.668469913995917	0.0	discard	23_6_in_4	Parallel run loop
auto	5.518154519484776	0.0	keep	9_6_in_4	Parallel run loop
auto	3.881099749755177	0.0	discard	12_3_in_3	Parallel run loop
auto	7.929846239536432	0.0	discard	19_6_in_4	Parallel run loop
auto	6.309719735191199	0.0	discard	12_4_in_3	Parallel run loop
auto	8.583374246046413	0.0	discard	22_6_in_4	Parallel run loop
auto	4.3094996669154355	0.0	discard	6_4_in_3	Parallel run loop
auto	5.464261083124018	0.0	discard	10_4_in_3	Parallel run loop
auto	3.7250031912651163	0.0	discard	4_6_in_4	Parallel run loop
auto	5.313726164808948	0.0	discard	9_4_in_3	Parallel run loop
auto	6.465828989260902	0.0	discard	14_4_in_3	Parallel run loop
auto	6.964000014504972	0.0	discard	15_6_in_4	Parallel run loop
auto	7.6280889942498495	0.0	discard	17_6_in_4	Parallel run loop
auto	7.47650969637775	0.0	discard	19_4_in_3	Parallel run loop
auto	8.312724148597217	0.0	discard	22_4_in_3	Parallel run loop
auto	6.388840407653808	0.0	discard	12_6_in_4	Parallel run loop
auto	6.156893685363397	0.0	discard	11_4_in_3	Parallel run loop
auto	7.321412559109307	0.0	discard	16_6_in_4	Parallel run loop
auto	8.81891309855994	0.0	discard	24_6_in_4	Parallel run loop
auto	6.764428342593895	0.0	discard	13_6_in_4	Parallel run loop
auto	7.620768472631966	0.0	keep	20_4_in_3	Parallel run loop
auto	7.309824033492363	0.0	discard	17_4_in_3	Parallel run loop
auto	8.666274702120212	0.0	discard	23_6_in_4	Parallel run loop
auto	5.518421711656798	0.0	discard	9_6_in_4	Parallel run loop
auto	7.929378074021842	0.0	discard	19_6_in_4	Parallel run loop
auto	3.7250031912651163	0.0	discard	4_6_in_4	Parallel run loop
auto	3.879900024835896	0.0	keep	12_3_in_3	Parallel run loop
auto	5.464261083124018	0.0	discard	10_4_in_3	Parallel run loop
auto	8.626434343123188	0.0	discard	22_6_in_4	Parallel run loop
auto	3.5000773592566494	0.0	discard	10_3_in_3	Parallel run loop
auto	6.465828989260902	0.0	discard	14_4_in_3	Parallel run loop
auto	9.327464627044307	0.0	discard	29_4_in_3	Parallel run loop
auto	6.965068880086202	0.0	discard	15_6_in_4	Parallel run loop
auto	9.472281673695477	0.0	discard	30_4_in_3	Parallel run loop
auto	7.606741618201064	0.0	discard	17_6_in_4	Parallel run loop
auto	8.778031375178879	0.0	discard	28_4_in_3	Parallel run loop
auto	7.696721432270371	0.0	discard	21_4_in_3	Parallel run loop
auto	7.47650969637775	0.0	discard	19_4_in_3	Parallel run loop
auto	7.321045141554854	0.0	discard	16_6_in_4	Parallel run loop
auto	5.000402359648589	0.0	discard	22_3_in_3	Parallel run loop
auto	10.62477196829007	0.0	discard	38_4_in_3	Parallel run loop
auto	4.640551753053798	0.0	discard	18_3_in_3	Parallel run loop
auto	8.796684966115714	0.0	keep	24_6_in_4	Parallel run loop
auto	7.621828621334028	0.0	discard	20_4_in_3	Parallel run loop
auto	6.002311620185098	0.0	discard	33_3_in_3	Parallel run loop
auto	8.660258484063416	0.0	keep	23_6_in_4	Parallel run loop
auto	5.6698204737217255	0.0	discard	27_3_in_3	Parallel run loop
auto	5.518421711656798	0.0	discard	9_6_in_4	Parallel run loop
auto	8.578042711805615	0.0	keep	22_6_in_4	Parallel run loop
auto	7.929378074021842	0.0	discard	19_6_in_4	Parallel run loop
auto	3.9424957590204364	0.0	discard	12_3_in_3	Parallel run loop
auto	3.5000773592566494	0.0	discard	10_3_in_3	Parallel run loop
auto	5.464234522413433	0.0	discard	10_4_in_3	Parallel run loop
auto	6.964000014504972	0.0	discard	15_6_in_4	Parallel run loop
auto	7.47650969637775	0.0	discard	19_4_in_3	Parallel run loop
auto	6.464503639360893	0.0	keep	14_4_in_3	Parallel run loop
auto	9.170480985456972	0.0	discard	29_4_in_3	Parallel run loop
auto	9.471674556783666	0.0	discard	30_4_in_3	Parallel run loop
auto	7.742742602208797	0.0	discard	21_4_in_3	Parallel run loop
auto	7.619752690266041	0.0	keep	20_4_in_3	Parallel run loop
auto	8.778031375178879	0.0	discard	28_4_in_3	Parallel run loop
auto	5.000691188682902	0.0	discard	22_3_in_3	Parallel run loop
auto	8.803741262374254	0.0	discard	24_6_in_4	Parallel run loop
auto	4.501187039771029	0.0	discard	18_3_in_3	Parallel run loop
auto	8.668469913995917	0.0	discard	23_6_in_4	Parallel run loop
auto	5.634164846779354	0.0	discard	27_3_in_3	Parallel run loop
auto	3.880727549790199	0.0	discard	12_3_in_3	Parallel run loop
auto	6.000570829625356	0.0	keep	33_3_in_3	Parallel run loop
auto	8.583374246046413	0.0	discard	22_6_in_4	Parallel run loop
auto	3.5000773592566494	0.0	discard	10_3_in_3	Parallel run loop
auto	6.465828989260902	0.0	discard	14_4_in_3	Parallel run loop
auto	6.964581745490916	0.0	discard	15_6_in_4	Parallel run loop
auto	1.7415210945225097	0.0	discard	7_3_in_5	Parallel run loop
auto	9.162858936716923	0.0	keep	29_4_in_3	Parallel run loop
auto	5.46434405747307	0.0	discard	10_4_in_3	Parallel run loop
auto	1.975530977484322	0.0	discard	9_3_in_5	Parallel run loop
auto	1.8622731817089389	0.0	keep	8_3_in_5	Parallel run loop
auto	7.6299695868013675	0.0	discard	20_4_in_3	Parallel run loop
auto	4.501187039771029	0.0	discard	18_3_in_3	Parallel run loop
auto	2.18388358945977	0.0	keep	11_3_in_5	Parallel run loop
auto	8.778031375178879	0.0	discard	28_4_in_3	Parallel run loop
auto	5.501566405682054	0.0	keep	27_3_in_3	Parallel run loop
auto	2.282652012438684	0.0	discard	12_3_in_5	Parallel run loop
auto	3.886252477818505	0.0	discard	12_3_in_3	Parallel run loop
auto	8.796580909835013	0.0	keep	24_6_in_4	Parallel run loop
auto	1.6123349350458647	0.0	discard	6_3_in_5	Parallel run loop
auto	6.002311620185098	0.0	discard	33_3_in_3	Parallel run loop
auto	5.000186944102854	0.0	discard	22_3_in_3	Parallel run loop
auto	2.087401526621445	0.0	discard	10_3_in_5	Parallel run loop
auto	2.37861120255269	0.0	discard	13_3_in_5	Parallel run loop
auto	3.500031650678817	0.0	discard	10_3_in_3	Parallel run loop
auto	2.4690916602539397	0.0	discard	14_3_in_5	Parallel run loop
auto	3.7445633999012258	0.0	keep	22_3_in_4	Parallel run loop
auto	1.4735929824869165	0.0	discard	5_3_in_5	Parallel run loop
auto	6.465828989260902	0.0	discard	14_4_in_3	Parallel run loop
auto	3.675332574129428	0.0	discard	21_3_in_4	Parallel run loop
auto	2.552271803893608	0.0	discard	15_3_in_5	Parallel run loop
auto	3.2751331592149673	0.0	discard	24_3_in_5	Parallel run loop
auto	1.862268621036947	0.0	keep	8_3_in_5	Parallel run loop
auto	9.170480985456972	0.0	discard	29_4_in_3	Parallel run loop
auto	3.379352703650692	0.0	discard	18_3_in_4	Parallel run loop
auto	4.501187039771029	0.0	discard	18_3_in_3	Parallel run loop
auto	5.710703566645898	0.0	discard	27_3_in_3	Parallel run loop
auto	1.7415207710935452	0.0	discard	7_3_in_5	Parallel run loop
auto	8.798388792345174	0.0	discard	24_6_in_4	Parallel run loop
auto	8.790599047861846	0.0	discard	28_4_in_3	Parallel run loop
auto	2.184759626135719	0.0	discard	11_3_in_5	Parallel run loop
auto	2.9788854830233156	0.0	discard	20_3_in_5	Parallel run loop
auto	1.9752806943674495	0.0	discard	9_3_in_5	Parallel run loop
auto	5.000244442568963	0.0	discard	22_3_in_3	Parallel run loop
auto	2.8586691957008186	0.0	discard	13_3_in_4	Parallel run loop
auto	3.3551805886103985	0.0	discard	25_3_in_5	Parallel run loop
auto	1.6123349488070233	0.0	discard	6_3_in_5	Parallel run loop
auto	6.002311620185098	0.0	discard	33_3_in_3	Parallel run loop
auto	3.753678772710529	0.0	discard	22_3_in_4	Parallel run loop
auto	4.358020945115107	0.0	discard	29_3_in_4	Parallel run loop
auto	2.813828711311901	0.0	keep	18_3_in_5	Parallel run loop
auto	2.4678467779001108	0.0	discard	14_3_in_5	Parallel run loop
auto	3.120899773095399	0.0	keep	22_3_in_5	Parallel run loop
auto	2.5583366661205496	0.0	discard	15_3_in_5	Parallel run loop
auto	2.28196471917776	0.0	discard	12_3_in_5	Parallel run loop
auto	2.082171566960134	0.0	discard	10_3_in_5	Parallel run loop
auto	3.2804241055972105	0.0	discard	24_3_in_5	Parallel run loop
auto	3.3803002577889254	0.0	discard	18_3_in_4	Parallel run loop
auto	2.375394819754651	0.0	discard	13_3_in_5	Parallel run loop
auto	1.862272623053338	0.0	discard	8_3_in_5	Parallel run loop
auto	3.934729569735836	0.0	keep	24_3_in_4	Parallel run loop
auto	3.6778156078372635	0.0	discard	21_3_in_4	Parallel run loop
auto	3.214757772886889	0.0	discard	23_3_in_5	Parallel run loop
auto	3.4269971339930114	0.0	discard	26_3_in_5	Parallel run loop
auto	1.4722087040066105	0.0	keep	5_3_in_5	Parallel run loop
auto	8.800510614999979	0.0	discard	24_6_in_4	Parallel run loop
auto	3.867045389846787	0.0	discard	23_3_in_4	Parallel run loop
auto	3.4954228611943665	0.0	discard	27_3_in_5	Parallel run loop
auto	1.7415208707935483	0.0	discard	7_3_in_5	Parallel run loop
auto	1.974637270572423	0.0	discard	9_3_in_5	Parallel run loop
auto	3.3302568040312535	0.0	keep	25_3_in_5	Parallel run loop
auto	3.6269114120505312	0.0	discard	29_3_in_5	Parallel run loop
auto	3.7357759323064093	0.0	keep	22_3_in_4	Parallel run loop
auto	4.199138185243568	0.0	discard	27_3_in_4	Parallel run loop
auto	1.612334938158126	0.0	discard	6_3_in_5	Parallel run loop
auto	2.822944883517418	0.0	discard	18_3_in_5	Parallel run loop
auto	2.3770275599225923	0.0	discard	13_3_in_5	Parallel run loop
auto	3.1129176646578376	0.0	keep	22_3_in_5	Parallel run loop
auto	2.28286551761468	0.0	discard	12_3_in_5	Parallel run loop
auto	2.184061031836693	0.0	discard	11_3_in_5	Parallel run loop
auto	2.553230836293047	0.0	discard	15_3_in_5	Parallel run loop
auto	2.9778685352461176	0.0	discard	20_3_in_5	Parallel run loop
auto	4.425978032832348	0.0	keep	30_3_in_4	Parallel run loop
auto	2.8587731802614873	0.0	discard	13_3_in_4	Parallel run loop
auto	3.3874310805785606	0.0	discard	18_3_in_4	Parallel run loop
auto	1.8622685504769485	0.0	keep	8_3_in_5	Parallel run loop
auto	3.0509236463180427	0.0	keep	21_3_in_5	Parallel run loop
auto	2.4629634876115145	0.0	keep	14_3_in_5	Parallel run loop
auto	3.2804638744357586	0.0	discard	24_3_in_5	Parallel run loop
auto	2.645858994603459	0.0	discard	16_3_in_5	Parallel run loop
auto	1.7415210945225097	0.0	discard	7_3_in_5	Parallel run loop
auto	2.0821135540172904	0.0	discard	10_3_in_5	Parallel run loop
auto	1.4735920046502846	0.0	discard	5_3_in_5	Parallel run loop
auto	2.9072423035787245	0.0	discard	19_3_in_5	Parallel run loop
auto	3.950995642334924	0.0	discard	24_3_in_4	Parallel run loop
auto	4.362310682463483	0.0	discard	29_3_in_4	Parallel run loop
auto	3.7668268426738862	0.0	discard	22_3_in_4	Parallel run loop
auto	2.2812069518774694	0.0	discard	12_3_in_5	Parallel run loop
auto	3.420646651675096	0.0	keep	26_3_in_5	Parallel run loop
auto	3.215289637701002	0.0	discard	23_3_in_5	Parallel run loop
auto	4.203956986434313	0.0	discard	27_3_in_4	Parallel run loop
auto	3.678680665024912	0.0	discard	21_3_in_4	Parallel run loop
auto	1.975255843346649	0.0	discard	9_3_in_5	Parallel run loop
auto	2.1847543877260476	0.0	discard	11_3_in_5	Parallel run loop
auto	3.3578918587254845	0.0	discard	25_3_in_5	Parallel run loop
auto	2.972207946813697	0.0	keep	20_3_in_5	Parallel run loop
auto	1.8618260165496168	0.0	keep	8_3_in_5	Parallel run loop
auto	1.6123349294840832	0.0	discard	6_3_in_5	Parallel run loop
auto	3.1337720583108477	0.0	discard	22_3_in_5	Parallel run loop
auto	3.0468101240121435	0.0	keep	21_3_in_5	Parallel run loop
auto	4.590957926504168	0.0	discard	32_3_in_4	Parallel run loop
auto	3.8609244720344744	0.0	discard	23_3_in_4	Parallel run loop
auto	2.7344806546266716	0.0	discard	17_3_in_5	Parallel run loop
auto	2.377893367829615	0.0	discard	13_3_in_5	Parallel run loop
auto	4.426711437951035	0.0	discard	30_3_in_4	Parallel run loop
auto	2.463558352122415	0.0	discard	14_3_in_5	Parallel run loop
auto	2.0821996754533347	0.0	discard	10_3_in_5	Parallel run loop
auto	3.9527721938737583	0.0	discard	24_3_in_4	Parallel run loop
auto	2.6467575039992424	0.0	discard	16_3_in_5	Parallel run loop
auto	2.558210252119453	0.0	discard	15_3_in_5	Parallel run loop
auto	2.858334525911555	0.0	discard	13_3_in_4	Parallel run loop
auto	3.3720761226811256	0.0	keep	18_3_in_4	Parallel run loop
auto	3.6906051563362396	0.0	discard	30_3_in_5	Parallel run loop
auto	2.282532919942195	0.0	discard	12_3_in_5	Parallel run loop
auto	2.9571889063784953	0.0	keep	20_3_in_5	Parallel run loop
auto	3.623636432944521	0.0	discard	29_3_in_5	Parallel run loop
auto	3.6774304144889913	0.0	discard	21_3_in_4	Parallel run loop
auto	4.5209735070459285	0.0	discard	31_3_in_4	Parallel run loop
auto	3.485498531070636	0.0	keep	27_3_in_5	Parallel run loop
auto	3.395691879355106	0.0	keep	26_3_in_5	Parallel run loop
auto	4.992667436556401	0.0	discard	37_3_in_4	Parallel run loop
auto	1.7415209636048061	0.0	discard	7_3_in_5	Parallel run loop
auto	1.473123356950687	0.0	discard	5_3_in_5	Parallel run loop
auto	4.576521911216649	0.0	keep	32_3_in_4	Parallel run loop
