commit	score	memory_gb	status	problem	description
auto	6.559110050612426	0.0	discard	19_5_in_4	Parallel run loop
auto	2.42874741437945	0.0	discard	22_4_in_8	Parallel run loop
auto	7.209005604559256	0.0	discard	23_5_in_4	Parallel run loop
auto	1.2374664980592032	0.0	discard	13_3_in_8	Parallel run loop
auto	2.756319777861962	0.0	discard	15_4_in_6	Parallel run loop
auto	10.112392733890127	0.0	discard	20_5_in_3	Parallel run loop
auto	6.861609167386894	0.0	discard	21_5_in_4	Parallel run loop
auto	1.2766608702562512	0.0	discard	14_3_in_8	Parallel run loop
auto	10.609432218967457	0.0	keep	18_8_in_4	Parallel run loop
auto	2.9701698860630352	0.0	discard	12_4_in_5	Parallel run loop
auto	14.243118620136773	0.0	discard	14_8_in_3	Parallel run loop
auto	1.6238309749887867	0.0	discard	12_3_in_6	Parallel run loop
auto	9.315789363255375	0.0	discard	6_8_in_3	Parallel run loop
auto	1.731657879726926	0.0	discard	11_4_in_8	Parallel run loop
auto	3.315593098074115	0.0	discard	22_4_in_6	Parallel run loop
auto	13.668045830620615	0.0	discard	37_5_in_3	Parallel run loop
auto	12.995666996902798	0.0	keep	22_6_in_3	Parallel run loop
auto	6.239839747787354	0.0	discard	17_5_in_4	Parallel run loop
auto	7.045725797328264	0.0	discard	22_5_in_4	Parallel run loop
auto	11.138541514933761	0.0	discard	20_8_in_4	Parallel run loop
auto	2.2866102207417343	0.0	keep	20_4_in_8	Parallel run loop
auto	2.1722119085914624	0.0	discard	18_4_in_8	Parallel run loop
auto	2.4433806142524532	0.0	discard	12_4_in_6	Parallel run loop
auto	10.97916849596094	0.0	discard	19_8_in_4	Parallel run loop
auto	1.6654792834380523	0.0	discard	13_3_in_6	Parallel run loop
auto	5.464140210439507	0.0	discard	5_DOMINO_in_3	Parallel run loop
auto	11.19989066768743	0.0	discard	24_5_in_3	Parallel run loop
auto	7.172393485589609	0.0	discard	10_5_in_3	Parallel run loop
auto	1.95592716935304	0.0	discard	5_4_in_5	Parallel run loop
auto	3.2379901994673155	0.0	discard	21_4_in_6	Parallel run loop
auto	1.302502187597249	0.0	keep	15_3_in_8	Parallel run loop
auto	1.7324892310549862	0.0	discard	14_3_in_6	Parallel run loop
auto	8.157336173288634	0.0	discard	11_DOMINO_in_3	Parallel run loop
auto	2.8221906765460663	0.0	discard	16_4_in_6	Parallel run loop
auto	2.6215296053335395	0.0	discard	14_4_in_6	Parallel run loop
auto	6.338683893838663	0.0	discard	18_5_in_4	Parallel run loop
auto	5.232390394171094	0.0	discard	12_5_in_4	Parallel run loop
auto	16.74763183880405	0.0	keep	20_8_in_3	Parallel run loop
auto	3.121832026809895	0.0	discard	13_4_in_5	Parallel run loop
auto	2.8908848465819488	0.0	discard	11_4_in_5	Parallel run loop
auto	13.651573506054458	0.0	discard	24_6_in_3	Parallel run loop
auto	16.552486355096143	0.0	discard	19_8_in_3	Parallel run loop
auto	3.6271310760268243	0.0	discard	18_4_in_5	Parallel run loop
auto	11.339293437634941	0.0	discard	25_5_in_3	Parallel run loop
auto	6.662834345127883	0.0	keep	20_5_in_4	Parallel run loop
auto	7.457439849552065	0.0	discard	25_5_in_4	Parallel run loop
auto	7.619824904224618	0.0	keep	10_DOMINO_in_3	Parallel run loop
auto	1.0761293066521178	0.0	discard	10_3_in_8	Parallel run loop
auto	9.94207082141723	0.0	discard	19_5_in_3	Parallel run loop
auto	14.820640020492533	0.0	discard	29_6_in_3	Parallel run loop
auto	11.61909366756465	0.0	discard	27_5_in_3	Parallel run loop
auto	7.3390476696530005	0.0	discard	24_5_in_4	Parallel run loop
auto	10.995706341267324	0.0	discard	23_5_in_3	Parallel run loop
auto	12.62226769641807	0.0	discard	31_5_in_3	Parallel run loop
auto	7.317204392650463	0.0	discard	9_DOMINO_in_3	Parallel run loop
auto	11.491632001756233	0.0	discard	26_5_in_3	Parallel run loop
auto	3.47940257562198	0.0	keep	16_4_in_5	Parallel run loop
auto	12.208038296240993	0.0	discard	29_5_in_3	Parallel run loop
auto	12.40347096897882	0.0	discard	30_5_in_3	Parallel run loop
auto	6.855994971480812	0.0	discard	21_5_in_4	Parallel run loop
auto	1.8612111964898277	0.0	discard	7_4_in_6	Parallel run loop
auto	5.7127159400272145	0.0	discard	13_DOMINO_in_4	Parallel run loop
auto	8.692885220519374	0.0	keep	15_5_in_3	Parallel run loop
auto	3.541587195265568	0.0	discard	17_4_in_5	Parallel run loop
auto	9.656879216836188	0.0	discard	15_8_in_4	Parallel run loop
auto	13.411041610081337	0.0	discard	23_6_in_3	Parallel run loop
auto	10.112392733890127	0.0	discard	20_5_in_3	Parallel run loop
auto	9.311473540593736	0.0	discard	15_DOMINO_in_3	Parallel run loop
auto	4.876988777958308	0.0	discard	9_DOMINO_in_4	Parallel run loop
auto	3.1623861535849067	0.0	keep	20_4_in_6	Parallel run loop
auto	14.24080134149529	0.0	discard	14_8_in_3	Parallel run loop
auto	2.427946194242151	0.0	discard	22_4_in_8	Parallel run loop
auto	9.315789363255375	0.0	discard	6_8_in_3	Parallel run loop
auto	1.2766608702562512	0.0	discard	14_3_in_8	Parallel run loop
auto	3.188379648853599	0.0	discard	14_4_in_5	Parallel run loop
auto	2.9699460152143953	0.0	discard	12_4_in_5	Parallel run loop
auto	2.4730786377880323	0.0	discard	23_4_in_8	Parallel run loop
auto	11.806482205714422	0.0	keep	10_8_in_3	Parallel run loop
auto	2.767585060517526	0.0	discard	15_4_in_6	Parallel run loop
auto	13.668045830620615	0.0	discard	37_5_in_3	Parallel run loop
auto	3.3215252332434697	0.0	discard	22_4_in_6	Parallel run loop
auto	1.6654792834380523	0.0	discard	13_3_in_6	Parallel run loop
auto	7.045725797328264	0.0	discard	22_5_in_4	Parallel run loop
auto	10.618230812343883	0.0	discard	18_8_in_4	Parallel run loop
auto	13.009112091779771	0.0	discard	22_6_in_3	Parallel run loop
auto	11.110439200692014	0.0	discard	20_8_in_4	Parallel run loop
auto	3.714125214951776	0.0	discard	19_4_in_5	Parallel run loop
auto	2.2909659829056572	0.0	discard	20_4_in_8	Parallel run loop
auto	2.172317582658325	0.0	discard	18_4_in_8	Parallel run loop
auto	7.172393485589609	0.0	discard	10_5_in_3	Parallel run loop
auto	5.464140210439507	0.0	discard	5_DOMINO_in_3	Parallel run loop
auto	12.995579534316954	0.0	discard	34_5_in_3	Parallel run loop
auto	3.2424955232652763	0.0	discard	21_4_in_6	Parallel run loop
auto	1.0087152127696104	0.0	discard	9_3_in_8	Parallel run loop
auto	7.218842094923034	0.0	discard	23_5_in_4	Parallel run loop
auto	2.443377223844914	0.0	discard	12_4_in_6	Parallel run loop
auto	1.302549355173943	0.0	discard	15_3_in_8	Parallel run loop
auto	14.184035580423297	0.0	discard	40_5_in_3	Parallel run loop
auto	2.8201237526042373	0.0	keep	16_4_in_6	Parallel run loop
auto	11.338013052810018	0.0	discard	25_5_in_3	Parallel run loop
auto	6.667283297662148	0.0	discard	20_5_in_4	Parallel run loop
auto	6.330387427375083	0.0	discard	18_5_in_4	Parallel run loop
auto	16.74508145517827	0.0	keep	20_8_in_3	Parallel run loop
auto	3.12141277502547	0.0	discard	13_4_in_5	Parallel run loop
auto	2.621343655272934	0.0	keep	14_4_in_6	Parallel run loop
auto	16.544767247188243	0.0	keep	19_8_in_3	Parallel run loop
auto	1.726091666469519	0.0	discard	14_3_in_6	Parallel run loop
auto	7.473964564971502	0.0	discard	25_5_in_4	Parallel run loop
auto	2.890963298341843	0.0	discard	11_4_in_5	Parallel run loop
auto	3.626066762816006	0.0	keep	18_4_in_5	Parallel run loop
auto	7.622582891208529	0.0	discard	10_DOMINO_in_3	Parallel run loop
auto	1.0760479230399078	0.0	discard	10_3_in_8	Parallel run loop
auto	2.230617366690337	0.0	discard	19_4_in_8	Parallel run loop
auto	3.8034570777848136	0.0	discard	20_4_in_5	Parallel run loop
auto	12.422548798690189	0.0	discard	30_5_in_3	Parallel run loop
auto	9.657026619489814	0.0	discard	15_8_in_4	Parallel run loop
auto	13.645110786679366	0.0	discard	24_6_in_3	Parallel run loop
auto	7.317204392650463	0.0	discard	9_DOMINO_in_3	Parallel run loop
auto	1.8612118938603162	0.0	discard	7_4_in_6	Parallel run loop
auto	5.723293361877296	0.0	discard	13_DOMINO_in_4	Parallel run loop
auto	12.201815406996435	0.0	discard	29_5_in_3	Parallel run loop
auto	3.5423671891828543	0.0	discard	17_4_in_5	Parallel run loop
auto	14.818984147007146	0.0	discard	29_6_in_3	Parallel run loop
auto	12.608975489247648	0.0	discard	31_5_in_3	Parallel run loop
auto	3.285257194926323	0.0	keep	15_4_in_5	Parallel run loop
auto	13.423728013287104	0.0	discard	23_6_in_3	Parallel run loop
auto	11.478290935644102	0.0	discard	26_5_in_3	Parallel run loop
auto	1.7534113659026749	0.0	discard	12_4_in_8	Parallel run loop
auto	11.61909366756465	0.0	discard	27_5_in_3	Parallel run loop
auto	2.9697946967661766	0.0	keep	12_4_in_5	Parallel run loop
auto	2.4766263885973223	0.0	discard	23_4_in_8	Parallel run loop
auto	3.1749409878611337	0.0	discard	20_4_in_6	Parallel run loop
auto	8.69347401863724	0.0	discard	15_5_in_3	Parallel run loop
auto	3.188657852733173	0.0	discard	14_4_in_5	Parallel run loop
auto	11.806478779489995	0.0	keep	10_8_in_3	Parallel run loop
auto	10.111904717586876	0.0	discard	20_5_in_3	Parallel run loop
auto	13.130890899825326	0.0	discard	35_5_in_3	Parallel run loop
auto	13.011264247868253	0.0	discard	22_6_in_3	Parallel run loop
auto	9.312947942925451	0.0	discard	15_DOMINO_in_3	Parallel run loop
auto	12.992230942354865	0.0	discard	34_5_in_3	Parallel run loop
auto	6.861372084895679	0.0	discard	21_5_in_4	Parallel run loop
auto	3.4794281720778395	0.0	discard	16_4_in_5	Parallel run loop
auto	13.668045830620615	0.0	discard	37_5_in_3	Parallel run loop
auto	0.8157515461356462	0.0	discard	6_3_in_8	Parallel run loop
auto	2.4225836387898845	0.0	discard	22_4_in_8	Parallel run loop
auto	8.320783436833434	0.0	discard	12_DOMINO_in_3	Parallel run loop
auto	2.2866254714406464	0.0	discard	20_4_in_8	Parallel run loop
auto	1.302549355173943	0.0	discard	15_3_in_8	Parallel run loop
auto	2.9222522002689515	0.0	discard	18_4_in_6	Parallel run loop
auto	1.6654792834380523	0.0	discard	13_3_in_6	Parallel run loop
auto	3.714125214951776	0.0	discard	19_4_in_5	Parallel run loop
auto	15.493598578141688	0.0	discard	32_6_in_3	Parallel run loop
auto	7.455743427512498	0.0	keep	25_5_in_4	Parallel run loop
auto	2.172317582658325	0.0	discard	18_4_in_8	Parallel run loop
auto	1.0087152127696104	0.0	discard	9_3_in_8	Parallel run loop
auto	11.699957059942268	0.0	keep	28_5_in_3	Parallel run loop
auto	16.54810838184825	0.0	discard	19_8_in_3	Parallel run loop
auto	11.128301217844964	0.0	discard	20_8_in_4	Parallel run loop
auto	1.7311124445701873	0.0	discard	14_3_in_6	Parallel run loop
auto	2.621351669450451	0.0	discard	14_4_in_6	Parallel run loop
auto	6.328075816989659	0.0	discard	18_5_in_4	Parallel run loop
auto	1.5000038342239952	0.0	discard	11_3_in_6	Parallel run loop
auto	11.61909366756465	0.0	discard	27_5_in_3	Parallel run loop
auto	2.2308138592378066	0.0	discard	19_4_in_8	Parallel run loop
auto	3.5414434908636063	0.0	discard	17_4_in_5	Parallel run loop
auto	2.8292547249195867	0.0	discard	16_4_in_6	Parallel run loop
auto	7.621746244220466	0.0	discard	10_DOMINO_in_3	Parallel run loop
auto	3.12150296309221	0.0	discard	13_4_in_5	Parallel run loop
auto	16.74875206870076	0.0	discard	20_8_in_3	Parallel run loop
auto	12.621300053638542	0.0	discard	31_5_in_3	Parallel run loop
auto	3.801396241161096	0.0	keep	20_4_in_5	Parallel run loop
auto	11.344405787121703	0.0	discard	25_5_in_3	Parallel run loop
auto	3.6263989516123645	0.0	discard	18_4_in_5	Parallel run loop
auto	3.8748057809124536	0.0	discard	21_4_in_5	Parallel run loop
auto	14.846652885329904	0.0	discard	29_6_in_3	Parallel run loop
auto	11.491632001756233	0.0	discard	26_5_in_3	Parallel run loop
auto	14.163529288047329	0.0	discard	40_5_in_3	Parallel run loop
auto	2.96994516769622	0.0	discard	12_4_in_5	Parallel run loop
auto	1.753401120124969	0.0	keep	12_4_in_8	Parallel run loop
auto	9.323716905782822	0.0	discard	15_DOMINO_in_3	Parallel run loop
auto	13.668045830620615	0.0	discard	37_5_in_3	Parallel run loop
auto	3.2851952972165024	0.0	keep	15_4_in_5	Parallel run loop
auto	14.281784649193382	0.0	keep	15_8_in_3	Parallel run loop
auto	5.712296073792366	0.0	discard	13_DOMINO_in_4	Parallel run loop
auto	0.815749133016216	0.0	discard	6_3_in_8	Parallel run loop
auto	2.418135387191349	0.0	discard	22_4_in_8	Parallel run loop
auto	11.806434173759616	0.0	keep	10_8_in_3	Parallel run loop
auto	8.69437590394399	0.0	discard	15_5_in_3	Parallel run loop
auto	3.188368322028737	0.0	keep	14_4_in_5	Parallel run loop
auto	2.9222948457033984	0.0	discard	18_4_in_6	Parallel run loop
auto	2.4769110951486475	0.0	discard	23_4_in_8	Parallel run loop
auto	13.12900793523333	0.0	discard	35_5_in_3	Parallel run loop
auto	12.992230942354865	0.0	discard	34_5_in_3	Parallel run loop
auto	2.621521434701497	0.0	discard	14_4_in_6	Parallel run loop
auto	1.0087152127696104	0.0	discard	9_3_in_8	Parallel run loop
auto	8.464522032559183	0.0	discard	12_DOMINO_in_3	Parallel run loop
auto	3.714125214951776	0.0	discard	19_4_in_5	Parallel run loop
auto	2.2864166988597523	0.0	keep	20_4_in_8	Parallel run loop
auto	1.302549355173943	0.0	discard	15_3_in_8	Parallel run loop
auto	2.178491426695346	0.0	discard	18_4_in_8	Parallel run loop
auto	10.175419775552646	0.0	discard	21_5_in_3	Parallel run loop
auto	7.620182773341832	0.0	discard	10_DOMINO_in_3	Parallel run loop
auto	2.230663262154167	0.0	discard	19_4_in_8	Parallel run loop
auto	15.542314175000326	0.0	discard	32_6_in_3	Parallel run loop
auto	1.5000028460733712	0.0	keep	11_3_in_6	Parallel run loop
auto	13.201845308610325	0.0	keep	36_5_in_3	Parallel run loop
auto	11.110439200692014	0.0	discard	20_8_in_4	Parallel run loop
auto	3.935963591481134	0.0	keep	22_4_in_5	Parallel run loop
auto	11.704478596287117	0.0	discard	28_5_in_3	Parallel run loop
auto	3.806156191009596	0.0	discard	20_4_in_5	Parallel run loop
auto	3.870838168983363	0.0	discard	21_4_in_5	Parallel run loop
auto	4.359459498338237	0.0	discard	27_4_in_5	Parallel run loop
auto	11.61823429747849	0.0	keep	27_5_in_3	Parallel run loop
auto	14.282206701504505	0.0	discard	15_8_in_3	Parallel run loop
auto	5.7126911521333295	0.0	discard	13_DOMINO_in_4	Parallel run loop
auto	3.320004372432699	0.0	discard	15_4_in_5	Parallel run loop
auto	16.74763183880405	0.0	discard	20_8_in_3	Parallel run loop
auto	3.6269808982622687	0.0	discard	18_4_in_5	Parallel run loop
auto	2.795914786522143	0.0	discard	31_4_in_8	Parallel run loop
auto	9.656890361450468	0.0	keep	16_8_in_4	Parallel run loop
auto	14.831058623454325	0.0	discard	29_6_in_3	Parallel run loop
auto	14.184035580423297	0.0	discard	40_5_in_3	Parallel run loop
auto	3.5423289030025464	0.0	discard	17_4_in_5	Parallel run loop
auto	9.318145959640546	0.0	discard	15_DOMINO_in_3	Parallel run loop
auto	16.78868483594043	0.0	discard	21_8_in_3	Parallel run loop
auto	1.7534113659026749	0.0	discard	12_4_in_8	Parallel run loop
auto	2.586537726316413	0.0	keep	27_4_in_8	Parallel run loop
auto	4.003618918192179	0.0	discard	23_4_in_5	Parallel run loop
auto	8.693047370558405	0.0	discard	15_5_in_3	Parallel run loop
auto	13.126815987471579	0.0	keep	35_5_in_3	Parallel run loop
auto	1.8011477561324227	0.0	discard	16_3_in_6	Parallel run loop
auto	3.188488819146114	0.0	discard	14_4_in_5	Parallel run loop
auto	3.714125214951776	0.0	discard	19_4_in_5	Parallel run loop
auto	8.314988098689216	0.0	discard	12_DOMINO_in_3	Parallel run loop
auto	1.0087152127696104	0.0	discard	9_3_in_8	Parallel run loop
auto	11.806453384851103	0.0	discard	10_8_in_3	Parallel run loop
auto	12.992230942354865	0.0	discard	34_5_in_3	Parallel run loop
auto	2.2912238511203236	0.0	discard	20_4_in_8	Parallel run loop
auto	2.9218387837441084	0.0	discard	18_4_in_6	Parallel run loop
auto	0.815749133016216	0.0	discard	6_3_in_8	Parallel run loop
auto	10.310305194130006	0.0	keep	19_DOMINO_in_3	Parallel run loop
auto	7.6237826111973375	0.0	discard	10_DOMINO_in_3	Parallel run loop
auto	1.7500220606968349	0.0	discard	15_3_in_6	Parallel run loop
auto	1.500017887046217	0.0	discard	11_3_in_6	Parallel run loop
auto	3.9379195665184534	0.0	discard	22_4_in_5	Parallel run loop
auto	15.482136095803213	0.0	discard	32_6_in_3	Parallel run loop
auto	4.202329703013884	0.0	discard	38_4_in_6	Parallel run loop
auto	3.802580487350702	0.0	discard	20_4_in_5	Parallel run loop
auto	4.366618338236126	0.0	discard	27_4_in_5	Parallel run loop
auto	14.282206701504505	0.0	discard	15_8_in_3	Parallel run loop
auto	11.704054505259304	0.0	discard	28_5_in_3	Parallel run loop
auto	2.91697082663271	0.0	discard	34_4_in_8	Parallel run loop
auto	3.8704173057651876	0.0	discard	21_4_in_5	Parallel run loop
auto	11.61909366756465	0.0	discard	27_5_in_3	Parallel run loop
auto	3.2851574948121107	0.0	keep	15_4_in_5	Parallel run loop
auto	13.203264763003764	0.0	discard	36_5_in_3	Parallel run loop
auto	10.200769370747105	0.0	discard	21_5_in_3	Parallel run loop
auto	4.104852131247691	0.0	keep	24_4_in_5	Parallel run loop
auto	9.896289976102057	0.0	discard	17_DOMINO_in_3	Parallel run loop
auto	1.942189374535767	0.0	discard	18_3_in_6	Parallel run loop
auto	3.7871772057690603	0.0	discard	31_4_in_6	Parallel run loop
auto	16.786517428761933	0.0	keep	21_8_in_3	Parallel run loop
auto	1.8011580613656972	0.0	discard	16_3_in_6	Parallel run loop
auto	1.8333584779613132	0.0	discard	17_3_in_6	Parallel run loop
auto	9.656953110067914	0.0	discard	16_8_in_4	Parallel run loop
auto	13.12900793523333	0.0	discard	35_5_in_3	Parallel run loop
auto	4.5041733168589975	0.0	discard	29_4_in_5	Parallel run loop
auto	2.8077627835207344	0.0	discard	31_4_in_8	Parallel run loop
auto	4.003912341825307	0.0	discard	23_4_in_5	Parallel run loop
auto	3.6267144413539265	0.0	discard	18_4_in_5	Parallel run loop
auto	3.8504539070806487	0.0	discard	32_4_in_6	Parallel run loop
auto	16.74763183880405	0.0	discard	20_8_in_3	Parallel run loop
auto	4.627810798960184	0.0	discard	31_4_in_5	Parallel run loop
auto	1.7534113659026749	0.0	discard	12_4_in_8	Parallel run loop
auto	2.586445559724832	0.0	keep	27_4_in_8	Parallel run loop
auto	4.2273333554472865	0.0	discard	26_4_in_5	Parallel run loop
auto	8.322468920458979	0.0	discard	12_DOMINO_in_3	Parallel run loop
auto	11.806472647119001	0.0	discard	10_8_in_3	Parallel run loop
auto	3.6967550388517845	0.0	keep	30_4_in_6	Parallel run loop
auto	2.924576610364034	0.0	discard	18_4_in_6	Parallel run loop
auto	15.496118847396849	0.0	discard	32_6_in_3	Parallel run loop
auto	1.960326828461204	0.0	discard	19_3_in_6	Parallel run loop
auto	1.5000038342239952	0.0	discard	11_3_in_6	Parallel run loop
auto	4.184418407482437	0.0	keep	38_4_in_6	Parallel run loop
auto	2.9368631837060795	0.0	discard	19_4_in_6	Parallel run loop
auto	10.331688789532356	0.0	discard	19_DOMINO_in_3	Parallel run loop
auto	0.815749366701618	0.0	discard	6_3_in_8	Parallel run loop
auto	3.9377171286154655	0.0	discard	22_4_in_5	Parallel run loop
auto	1.7728978039959224	0.0	discard	15_3_in_6	Parallel run loop
auto	9.932504026696751	0.0	discard	18_DOMINO_in_3	Parallel run loop
auto	10.198092879780287	0.0	discard	21_5_in_3	Parallel run loop
auto	2.9131459193544798	0.0	discard	34_4_in_8	Parallel run loop
auto	1.9336267855026765	0.0	discard	18_3_in_6	Parallel run loop
auto	1.833408427220232	0.0	discard	16_3_in_6	Parallel run loop
auto	1.8333584779613132	0.0	discard	17_3_in_6	Parallel run loop
auto	16.786989896453434	0.0	discard	21_8_in_3	Parallel run loop
auto	4.117832997059029	0.0	discard	24_4_in_5	Parallel run loop
auto	4.367086828784761	0.0	discard	27_4_in_5	Parallel run loop
auto	13.203264763003764	0.0	discard	36_5_in_3	Parallel run loop
auto	11.704478596287117	0.0	discard	28_5_in_3	Parallel run loop
auto	3.8742378142171052	0.0	discard	21_4_in_5	Parallel run loop
auto	2.3323071423345585	0.0	discard	27_3_in_6	Parallel run loop
auto	9.901920352028005	0.0	discard	17_DOMINO_in_3	Parallel run loop
auto	14.282073288470556	0.0	discard	15_8_in_3	Parallel run loop
auto	3.2854186873559885	0.0	discard	15_4_in_5	Parallel run loop
auto	3.7918102467920853	0.0	discard	31_4_in_6	Parallel run loop
auto	4.222768421020896	0.0	keep	26_4_in_5	Parallel run loop
auto	9.477589795765269	0.0	discard	16_DOMINO_in_3	Parallel run loop
auto	2.5866266191956044	0.0	discard	27_4_in_8	Parallel run loop
auto	3.70804476842138	0.0	discard	30_4_in_6	Parallel run loop
auto	4.003541473115572	0.0	keep	23_4_in_5	Parallel run loop
auto	4.4400105933032075	0.0	discard	28_4_in_5	Parallel run loop
auto	9.65702077711498	0.0	discard	16_8_in_4	Parallel run loop
auto	4.1683699045161395	0.0	discard	25_4_in_5	Parallel run loop
auto	4.507976755160084	0.0	discard	29_4_in_5	Parallel run loop
auto	4.624846322901251	0.0	discard	31_4_in_5	Parallel run loop
auto	3.8458405459991205	0.0	discard	32_4_in_6	Parallel run loop
auto	4.938599706640466	0.0	discard	36_4_in_5	Parallel run loop
auto	2.7890150666921567	0.0	discard	31_4_in_8	Parallel run loop
auto	3.0806050206193087	0.0	discard	38_4_in_8	Parallel run loop
auto	5.141255845444521	0.0	discard	39_4_in_5	Parallel run loop
auto	2.646502329860143	0.0	discard	28_4_in_8	Parallel run loop
auto	3.9377171286154655	0.0	discard	22_4_in_5	Parallel run loop
auto	2.9104299976311485	0.0	discard	34_4_in_8	Parallel run loop
auto	1.895774654486557	0.0	discard	18_3_in_6	Parallel run loop
auto	1.9719427593774863	0.0	discard	19_3_in_6	Parallel run loop
auto	1.8333584779613132	0.0	discard	17_3_in_6	Parallel run loop
auto	4.202277344356584	0.0	discard	38_4_in_6	Parallel run loop
auto	10.320650437096164	0.0	discard	19_DOMINO_in_3	Parallel run loop
auto	9.94064488085103	0.0	discard	18_DOMINO_in_3	Parallel run loop
auto	2.9368631837060795	0.0	discard	19_4_in_6	Parallel run loop
auto	4.8289001946664785	0.0	discard	34_4_in_5	Parallel run loop
auto	4.422545764048241	0.0	discard	28_4_in_5	Parallel run loop
auto	3.1172035536032285	0.0	discard	39_4_in_8	Parallel run loop
auto	2.5729670951409838	0.0	discard	26_4_in_8	Parallel run loop
auto	3.800418115229691	0.0	discard	31_4_in_6	Parallel run loop
auto	2.0000495982798405	0.0	discard	21_3_in_6	Parallel run loop
auto	4.11760609363318	0.0	discard	24_4_in_5	Parallel run loop
auto	3.7199780036124235	0.0	discard	30_4_in_6	Parallel run loop
auto	2.5985794671115974	0.0	discard	27_4_in_8	Parallel run loop
auto	1.9778755996821977	0.0	discard	20_3_in_6	Parallel run loop
auto	4.366618338236126	0.0	discard	27_4_in_5	Parallel run loop
auto	3.942088596145953	0.0	discard	34_4_in_6	Parallel run loop
auto	13.203264763003764	0.0	discard	36_5_in_3	Parallel run loop
auto	16.786989896453434	0.0	discard	21_8_in_3	Parallel run loop
