commit	score	memory_gb	status	problem	description
auto	11.413488992180232	0.0	discard	13_CIRCLE_in_3	Parallel run loop
auto	3.111128350051921	0.0	discard	30_3_in_circle	Parallel run loop
auto	3.115803431953349	0.0	discard	23_4_in_CIRCLE	Parallel run loop
auto	3.5236257287305413	0.0	discard	30_4_in_CIRCLE	Parallel run loop
auto	2.643847752583437	0.0	discard	16_4_in_CIRCLE	Parallel run loop
auto	3.2232942054853804	0.0	discard	25_4_in_CIRCLE	Parallel run loop
auto	2.8776782496867814	0.0	discard	19_4_in_CIRCLE	Parallel run loop
auto	4.538260254000323	0.0	discard	15_CIRCLE_in_CIRCLE	Parallel run loop
auto	2.9479967602447665	0.0	discard	20_4_in_CIRCLE	Parallel run loop
auto	1.4007623159126743	0.0	discard	10_3_in_circle	Parallel run loop
auto	1.5230514075566917	0.0	discard	12_3_in_circle	Parallel run loop
auto	4.019565593893119	0.0	discard	33_4_in_CIRCLE	Parallel run loop
auto	3.631402274099691	0.0	discard	29_4_in_CIRCLE	Parallel run loop
auto	3.1785137055483523	0.0	discard	31_3_in_circle	Parallel run loop
auto	2.8016697604273646	0.0	discard	18_4_in_CIRCLE	Parallel run loop
auto	1.6549223038095542	0.0	discard	15_3_in_circle	Parallel run loop
auto	2.9501763284455955	0.0	discard	27_3_in_circle	Parallel run loop
auto	4.044636069278394	0.0	discard	12_CIRCLE_in_CIRCLE	Parallel run loop
auto	2.8254882859152444	0.0	discard	25_3_in_circle	Parallel run loop
auto	4.809960188594904	0.0	discard	17_CIRCLE_in_CIRCLE	Parallel run loop
auto	4.345096413036063	0.0	discard	14_CIRCLE_in_CIRCLE	Parallel run loop
auto	1.7029189896133312	0.0	discard	16_3_in_circle	Parallel run loop
auto	3.00543626160326	0.0	discard	28_3_in_circle	Parallel run loop
auto	2.893356461113701	0.0	discard	26_3_in_circle	Parallel run loop
auto	4.63348722009616	0.0	discard	16_CIRCLE_in_CIRCLE	Parallel run loop
auto	1.9798257412707072	0.0	keep	15_3_in_DOMINO	Parallel run loop
auto	4.883494798545663	0.0	discard	18_CIRCLE_in_CIRCLE	Parallel run loop
auto	2.1123543372136946	0.0	keep	17_3_in_DOMINO	Parallel run loop
auto	3.0616205933203187	0.0	discard	29_3_in_circle	Parallel run loop
auto	2.611744817291966	0.0	discard	22_3_in_circle	Parallel run loop
auto	5.143321280120154	0.0	discard	20_CIRCLE_in_CIRCLE	Parallel run loop
auto	2.2036089104428545	0.0	discard	18_3_in_DOMINO	Parallel run loop
auto	3.1070863089874066	0.0	discard	30_3_in_circle	Parallel run loop
auto	2.5594005342947432	0.0	keep	23_3_in_circle	Parallel run loop
auto	11.471632991608798	0.0	discard	14_CIRCLE_in_3	Parallel run loop
auto	1.2748051192828511	0.0	discard	8_3_in_circle	Parallel run loop
auto	1.4830513649835477	0.0	discard	11_3_in_circle	Parallel run loop
auto	1.8582158012495773	0.0	discard	19_3_in_circle	Parallel run loop
auto	1.8204190752494187	0.0	discard	18_3_in_circle	Parallel run loop
auto	11.413488992180232	0.0	discard	13_CIRCLE_in_3	Parallel run loop
auto	1.8958192025625156	0.0	discard	20_3_in_circle	Parallel run loop
auto	3.1064519114939206	0.0	discard	21_4_in_CIRCLE	Parallel run loop
auto	3.7364237438117933	0.0	discard	31_4_in_CIRCLE	Parallel run loop
auto	3.265553306575606	0.0	discard	26_4_in_CIRCLE	Parallel run loop
auto	2.643847752583437	0.0	discard	16_4_in_CIRCLE	Parallel run loop
auto	2.832844482185521	0.0	discard	25_3_in_circle	Parallel run loop
auto	3.115803431953349	0.0	discard	23_4_in_CIRCLE	Parallel run loop
auto	3.5236257287305413	0.0	discard	30_4_in_CIRCLE	Parallel run loop
auto	1.5230514075566917	0.0	discard	12_3_in_circle	Parallel run loop
auto	4.538260254000323	0.0	discard	15_CIRCLE_in_CIRCLE	Parallel run loop
auto	2.8776782496867814	0.0	discard	19_4_in_CIRCLE	Parallel run loop
auto	3.1715283128702185	0.0	discard	31_3_in_circle	Parallel run loop
auto	2.9952346208406353	0.0	discard	28_3_in_circle	Parallel run loop
auto	1.4007623159126743	0.0	discard	10_3_in_circle	Parallel run loop
auto	3.2232942054853804	0.0	discard	25_4_in_CIRCLE	Parallel run loop
auto	1.97981616918965	0.0	keep	15_3_in_DOMINO	Parallel run loop
auto	4.044636069278394	0.0	discard	12_CIRCLE_in_CIRCLE	Parallel run loop
auto	2.933113981249712	0.0	discard	27_3_in_circle	Parallel run loop
auto	2.9479967602447665	0.0	discard	20_4_in_CIRCLE	Parallel run loop
auto	2.6093951869651835	0.0	discard	22_3_in_circle	Parallel run loop
auto	2.111702820220189	0.0	keep	17_3_in_DOMINO	Parallel run loop
auto	4.019565593893119	0.0	discard	33_4_in_CIRCLE	Parallel run loop
auto	4.809960188594904	0.0	discard	17_CIRCLE_in_CIRCLE	Parallel run loop
auto	4.345096413036063	0.0	discard	14_CIRCLE_in_CIRCLE	Parallel run loop
auto	2.889019463130233	0.0	discard	26_3_in_circle	Parallel run loop
auto	3.0987080727433094	0.0	discard	30_3_in_circle	Parallel run loop
auto	4.63348722009616	0.0	discard	16_CIRCLE_in_CIRCLE	Parallel run loop
auto	2.077898779161433	0.0	keep	23_3_in_circle	Parallel run loop
auto	4.883494798545663	0.0	discard	18_CIRCLE_in_CIRCLE	Parallel run loop
auto	3.0674434936009503	0.0	discard	29_3_in_circle	Parallel run loop
auto	1.6549223038095542	0.0	discard	15_3_in_circle	Parallel run loop
auto	5.143321280120154	0.0	discard	20_CIRCLE_in_CIRCLE	Parallel run loop
auto	1.7029189896133312	0.0	discard	16_3_in_circle	Parallel run loop
auto	2.8016697604273646	0.0	discard	18_4_in_CIRCLE	Parallel run loop
auto	3.631402274099691	0.0	discard	29_4_in_CIRCLE	Parallel run loop
auto	11.471632991608798	0.0	discard	14_CIRCLE_in_3	Parallel run loop
auto	1.2748051192828511	0.0	discard	8_3_in_circle	Parallel run loop
auto	1.4830513649835477	0.0	discard	11_3_in_circle	Parallel run loop
auto	11.413488992180232	0.0	discard	13_CIRCLE_in_3	Parallel run loop
auto	1.8204190752494187	0.0	discard	18_3_in_circle	Parallel run loop
auto	3.8281160934956127	0.0	discard	34_4_in_CIRCLE	Parallel run loop
auto	1.8582158012495773	0.0	discard	19_3_in_circle	Parallel run loop
auto	3.001231384690335	0.0	discard	28_3_in_circle	Parallel run loop
auto	1.8958192025625156	0.0	discard	20_3_in_circle	Parallel run loop
auto	2.627463180057836	0.0	discard	22_3_in_circle	Parallel run loop
auto	2.9534234703673077	0.0	discard	27_3_in_circle	Parallel run loop
auto	3.1064519114939206	0.0	discard	21_4_in_CIRCLE	Parallel run loop
auto	2.8345447839308484	0.0	discard	25_3_in_circle	Parallel run loop
auto	1.9798078673464947	0.0	keep	15_3_in_DOMINO	Parallel run loop
auto	3.265553306575606	0.0	discard	26_4_in_CIRCLE	Parallel run loop
auto	4.538260254000323	0.0	discard	15_CIRCLE_in_CIRCLE	Parallel run loop
auto	3.7364237438117933	0.0	discard	31_4_in_CIRCLE	Parallel run loop
auto	1.4007623159126743	0.0	discard	10_3_in_circle	Parallel run loop
auto	2.888152843958989	0.0	discard	26_3_in_circle	Parallel run loop
auto	1.5230514075566917	0.0	discard	12_3_in_circle	Parallel run loop
auto	2.1111434762143357	0.0	keep	17_3_in_DOMINO	Parallel run loop
auto	3.1133070112742955	0.0	discard	30_3_in_circle	Parallel run loop
auto	4.044636069278394	0.0	discard	12_CIRCLE_in_CIRCLE	Parallel run loop
auto	3.5236257287305413	0.0	discard	30_4_in_CIRCLE	Parallel run loop
auto	1.9912869536787472	0.0	keep	23_3_in_circle	Parallel run loop
auto	3.0548920956459287	0.0	discard	29_3_in_circle	Parallel run loop
auto	3.115803431953349	0.0	discard	23_4_in_CIRCLE	Parallel run loop
auto	4.809960188594904	0.0	discard	17_CIRCLE_in_CIRCLE	Parallel run loop
auto	2.643847752583437	0.0	discard	16_4_in_CIRCLE	Parallel run loop
auto	3.2232942054853804	0.0	discard	25_4_in_CIRCLE	Parallel run loop
auto	4.345096413036063	0.0	discard	14_CIRCLE_in_CIRCLE	Parallel run loop
auto	4.63348722009616	0.0	discard	16_CIRCLE_in_CIRCLE	Parallel run loop
auto	4.883494798545663	0.0	discard	18_CIRCLE_in_CIRCLE	Parallel run loop
auto	2.8776782496867814	0.0	discard	19_4_in_CIRCLE	Parallel run loop
auto	2.9479967602447665	0.0	discard	20_4_in_CIRCLE	Parallel run loop
auto	4.095949576448097	0.0	discard	35_4_in_CIRCLE	Parallel run loop
auto	5.143321280120154	0.0	discard	20_CIRCLE_in_CIRCLE	Parallel run loop
auto	1.6549223038095542	0.0	discard	15_3_in_circle	Parallel run loop
auto	4.019565593893119	0.0	discard	33_4_in_CIRCLE	Parallel run loop
auto	1.7029189896133312	0.0	discard	16_3_in_circle	Parallel run loop
auto	2.8016697604273646	0.0	discard	18_4_in_CIRCLE	Parallel run loop
auto	11.471632991608798	0.0	discard	14_CIRCLE_in_3	Parallel run loop
auto	1.2748051192828511	0.0	discard	8_3_in_circle	Parallel run loop
auto	1.4830513649835477	0.0	discard	11_3_in_circle	Parallel run loop
auto	3.631402274099691	0.0	discard	29_4_in_CIRCLE	Parallel run loop
auto	11.413488992180232	0.0	discard	13_CIRCLE_in_3	Parallel run loop
auto	3.005736835286789	0.0	discard	28_3_in_circle	Parallel run loop
auto	1.8204190752494187	0.0	discard	18_3_in_circle	Parallel run loop
auto	1.9798006670253354	0.0	keep	15_3_in_DOMINO	Parallel run loop
auto	2.62982907971198	0.0	discard	22_3_in_circle	Parallel run loop
auto	1.8582158012495773	0.0	discard	19_3_in_circle	Parallel run loop
auto	2.947522231565695	0.0	discard	27_3_in_circle	Parallel run loop
auto	2.14178013704162	0.0	discard	17_3_in_DOMINO	Parallel run loop
auto	1.8958192025625156	0.0	discard	20_3_in_circle	Parallel run loop
auto	3.1064519114939206	0.0	discard	21_4_in_CIRCLE	Parallel run loop
auto	3.0628455477809493	0.0	discard	29_3_in_circle	Parallel run loop
auto	4.538260254000323	0.0	discard	15_CIRCLE_in_CIRCLE	Parallel run loop
auto	2.0046994478381874	0.0	discard	23_3_in_circle	Parallel run loop
auto	1.4007623159126743	0.0	discard	10_3_in_circle	Parallel run loop
auto	1.5230514075566917	0.0	discard	12_3_in_circle	Parallel run loop
auto	3.789834932560656	0.0	discard	34_4_in_CIRCLE	Parallel run loop
auto	4.044636069278394	0.0	discard	12_CIRCLE_in_CIRCLE	Parallel run loop
auto	3.265553306575606	0.0	discard	26_4_in_CIRCLE	Parallel run loop
auto	3.7364237438117933	0.0	discard	31_4_in_CIRCLE	Parallel run loop
auto	4.809960188594904	0.0	discard	17_CIRCLE_in_CIRCLE	Parallel run loop
auto	3.9241229167278884	0.0	discard	24_4_in_DOMINO	Parallel run loop
auto	2.643847752583437	0.0	discard	16_4_in_CIRCLE	Parallel run loop
auto	3.5236257287305413	0.0	discard	30_4_in_CIRCLE	Parallel run loop
auto	4.345096413036063	0.0	discard	14_CIRCLE_in_CIRCLE	Parallel run loop
auto	4.943502864466721	0.0	discard	40_4_in_DOMINO	Parallel run loop
auto	4.63348722009616	0.0	discard	16_CIRCLE_in_CIRCLE	Parallel run loop
auto	3.115803431953349	0.0	discard	23_4_in_CIRCLE	Parallel run loop
auto	4.123485959320918	0.0	discard	35_4_in_CIRCLE	Parallel run loop
auto	4.475096077264324	0.0	discard	33_4_in_DOMINO	Parallel run loop
auto	4.883494798545663	0.0	discard	18_CIRCLE_in_CIRCLE	Parallel run loop
auto	3.2232942054853804	0.0	discard	25_4_in_CIRCLE	Parallel run loop
auto	2.9479967602447665	0.0	discard	20_4_in_CIRCLE	Parallel run loop
auto	1.9797944219572383	0.0	keep	15_3_in_DOMINO	Parallel run loop
auto	5.143321280120154	0.0	discard	20_CIRCLE_in_CIRCLE	Parallel run loop
auto	2.8776782496867814	0.0	discard	19_4_in_CIRCLE	Parallel run loop
auto	2.616188781982979	0.0	discard	22_3_in_circle	Parallel run loop
auto	11.471632991608798	0.0	discard	14_CIRCLE_in_3	Parallel run loop
auto	1.7029189896133312	0.0	discard	16_3_in_circle	Parallel run loop
auto	1.6549223038095542	0.0	discard	15_3_in_circle	Parallel run loop
auto	1.2748051192828511	0.0	discard	8_3_in_circle	Parallel run loop
auto	1.4830513649835477	0.0	discard	11_3_in_circle	Parallel run loop
auto	11.413488992180232	0.0	discard	13_CIRCLE_in_3	Parallel run loop
auto	3.009346065058362	0.0	discard	28_3_in_circle	Parallel run loop
auto	4.019565593893119	0.0	discard	33_4_in_CIRCLE	Parallel run loop
auto	2.0046994478381874	0.0	discard	23_3_in_circle	Parallel run loop
auto	1.8204190752494187	0.0	discard	18_3_in_circle	Parallel run loop
auto	1.8582158012495773	0.0	discard	19_3_in_circle	Parallel run loop
auto	3.631402274099691	0.0	discard	29_4_in_CIRCLE	Parallel run loop
auto	2.936636006924171	0.0	discard	27_3_in_circle	Parallel run loop
auto	2.8016697604273646	0.0	discard	18_4_in_CIRCLE	Parallel run loop
auto	1.8958192025625156	0.0	discard	20_3_in_circle	Parallel run loop
auto	3.058866236712607	0.0	discard	29_3_in_circle	Parallel run loop
auto	4.538260254000323	0.0	discard	15_CIRCLE_in_CIRCLE	Parallel run loop
auto	4.044636069278394	0.0	discard	12_CIRCLE_in_CIRCLE	Parallel run loop
auto	3.1064519114939206	0.0	discard	21_4_in_CIRCLE	Parallel run loop
auto	4.020360663309433	0.0	discard	26_4_in_DOMINO	Parallel run loop
auto	1.4007623159126743	0.0	discard	10_3_in_circle	Parallel run loop
auto	4.809960188594904	0.0	discard	17_CIRCLE_in_CIRCLE	Parallel run loop
auto	1.5230514075566917	0.0	discard	12_3_in_circle	Parallel run loop
auto	4.345096413036063	0.0	discard	14_CIRCLE_in_CIRCLE	Parallel run loop
auto	2.008733336427987	0.0	discard	15_3_in_DOMINO	Parallel run loop
auto	3.747067648153613	0.0	discard	34_4_in_CIRCLE	Parallel run loop
auto	3.265553306575606	0.0	discard	26_4_in_CIRCLE	Parallel run loop
auto	4.883494798545663	0.0	discard	18_CIRCLE_in_CIRCLE	Parallel run loop
auto	4.63348722009616	0.0	discard	16_CIRCLE_in_CIRCLE	Parallel run loop
auto	2.643847752583437	0.0	discard	16_4_in_CIRCLE	Parallel run loop
auto	4.0943114423581095	0.0	discard	35_4_in_CIRCLE	Parallel run loop
auto	3.7364237438117933	0.0	discard	31_4_in_CIRCLE	Parallel run loop
auto	4.510334332905153	0.0	discard	34_4_in_DOMINO	Parallel run loop
auto	3.5236257287305413	0.0	discard	30_4_in_CIRCLE	Parallel run loop
auto	3.115803431953349	0.0	discard	23_4_in_CIRCLE	Parallel run loop
auto	3.2232942054853804	0.0	discard	25_4_in_CIRCLE	Parallel run loop
auto	2.9479967602447665	0.0	discard	20_4_in_CIRCLE	Parallel run loop
auto	5.143321280120154	0.0	discard	20_CIRCLE_in_CIRCLE	Parallel run loop
auto	2.600537866433976	0.0	discard	22_3_in_circle	Parallel run loop
auto	5.029602176115146	0.0	discard	42_4_in_DOMINO	Parallel run loop
auto	11.471632991608798	0.0	discard	14_CIRCLE_in_3	Parallel run loop
auto	2.0046994478381874	0.0	discard	23_3_in_circle	Parallel run loop
auto	4.86697455948945	0.0	discard	37_4_in_DOMINO	Parallel run loop
auto	1.7029189896133312	0.0	discard	16_3_in_circle	Parallel run loop
auto	2.943398381614131	0.0	discard	27_3_in_circle	Parallel run loop
auto	1.2748051192828511	0.0	discard	8_3_in_circle	Parallel run loop
auto	1.4830513649835477	0.0	discard	11_3_in_circle	Parallel run loop
auto	3.0402630199916447	0.0	keep	29_3_in_circle	Parallel run loop
auto	11.413488992180232	0.0	discard	13_CIRCLE_in_3	Parallel run loop
auto	1.6549223038095542	0.0	discard	15_3_in_circle	Parallel run loop
auto	1.8204190752494187	0.0	discard	18_3_in_circle	Parallel run loop
auto	1.8582158012495773	0.0	discard	19_3_in_circle	Parallel run loop
auto	2.8776782496867814	0.0	discard	19_4_in_CIRCLE	Parallel run loop
auto	4.538260254000323	0.0	discard	15_CIRCLE_in_CIRCLE	Parallel run loop
auto	2.8016697604273646	0.0	discard	18_4_in_CIRCLE	Parallel run loop
auto	4.044636069278394	0.0	discard	12_CIRCLE_in_CIRCLE	Parallel run loop
auto	4.019565593893119	0.0	discard	33_4_in_CIRCLE	Parallel run loop
auto	1.8958192025625156	0.0	discard	20_3_in_circle	Parallel run loop
auto	3.8688750047412386	0.0	discard	23_4_in_DOMINO	Parallel run loop
auto	1.4007623159126743	0.0	discard	10_3_in_circle	Parallel run loop
auto	4.809960188594904	0.0	discard	17_CIRCLE_in_CIRCLE	Parallel run loop
auto	3.1064519114939206	0.0	discard	21_4_in_CIRCLE	Parallel run loop
auto	2.931723676723068	0.0	discard	11_4_in_DOMINO	Parallel run loop
auto	3.631402274099691	0.0	discard	29_4_in_CIRCLE	Parallel run loop
auto	1.5230514075566917	0.0	discard	12_3_in_circle	Parallel run loop
auto	3.0223172208985285	0.0	discard	13_4_in_DOMINO	Parallel run loop
auto	4.345096413036063	0.0	discard	14_CIRCLE_in_CIRCLE	Parallel run loop
auto	2.6154040038314315	0.0	discard	22_3_in_circle	Parallel run loop
auto	4.63348722009616	0.0	discard	16_CIRCLE_in_CIRCLE	Parallel run loop
auto	4.883494798545663	0.0	discard	18_CIRCLE_in_CIRCLE	Parallel run loop
auto	3.265553306575606	0.0	discard	26_4_in_CIRCLE	Parallel run loop
auto	2.643847752583437	0.0	discard	16_4_in_CIRCLE	Parallel run loop
auto	3.789834932560656	0.0	discard	34_4_in_CIRCLE	Parallel run loop
auto	2.0046994478381874	0.0	discard	23_3_in_circle	Parallel run loop
auto	3.5236257287305413	0.0	discard	30_4_in_CIRCLE	Parallel run loop
auto	3.057891434880465	0.0	discard	29_3_in_circle	Parallel run loop
auto	3.7364237438117933	0.0	discard	31_4_in_CIRCLE	Parallel run loop
auto	4.955505153601827	0.0	discard	37_4_in_DOMINO	Parallel run loop
auto	3.115803431953349	0.0	discard	23_4_in_CIRCLE	Parallel run loop
auto	5.143321280120154	0.0	discard	20_CIRCLE_in_CIRCLE	Parallel run loop
auto	3.2232942054853804	0.0	discard	25_4_in_CIRCLE	Parallel run loop
auto	2.9479967602447665	0.0	discard	20_4_in_CIRCLE	Parallel run loop
auto	11.471632991608798	0.0	discard	14_CIRCLE_in_3	Parallel run loop
auto	4.099227811142753	0.0	discard	35_4_in_CIRCLE	Parallel run loop
auto	1.2748051192828511	0.0	discard	8_3_in_circle	Parallel run loop
auto	1.7029189896133312	0.0	discard	16_3_in_circle	Parallel run loop
auto	1.4830513649835477	0.0	discard	11_3_in_circle	Parallel run loop
auto	3.887615286150665	0.0	discard	22_4_in_DOMINO	Parallel run loop
auto	11.413488992180232	0.0	discard	13_CIRCLE_in_3	Parallel run loop
auto	1.6549223038095542	0.0	discard	15_3_in_circle	Parallel run loop
auto	4.044636069278394	0.0	discard	12_CIRCLE_in_CIRCLE	Parallel run loop
auto	4.538260254000323	0.0	discard	15_CIRCLE_in_CIRCLE	Parallel run loop
auto	1.8204190752494187	0.0	discard	18_3_in_circle	Parallel run loop
auto	4.943502864466721	0.0	discard	40_4_in_DOMINO	Parallel run loop
auto	1.8582158012495773	0.0	discard	19_3_in_circle	Parallel run loop
auto	5.034186680493225	0.0	discard	38_4_in_DOMINO	Parallel run loop
auto	2.8776782496867814	0.0	discard	19_4_in_CIRCLE	Parallel run loop
auto	2.8016697604273646	0.0	discard	18_4_in_CIRCLE	Parallel run loop
auto	2.6272004337398296	0.0	discard	22_3_in_circle	Parallel run loop
auto	1.4007623159126743	0.0	discard	10_3_in_circle	Parallel run loop
auto	4.809960188594904	0.0	discard	17_CIRCLE_in_CIRCLE	Parallel run loop
auto	1.8958192025625156	0.0	discard	20_3_in_circle	Parallel run loop
auto	4.019565593893119	0.0	discard	33_4_in_CIRCLE	Parallel run loop
auto	3.1064519114939206	0.0	discard	21_4_in_CIRCLE	Parallel run loop
auto	4.037277676108749	0.0	discard	25_4_in_DOMINO	Parallel run loop
auto	3.631402274099691	0.0	discard	29_4_in_CIRCLE	Parallel run loop
auto	4.345096413036063	0.0	discard	14_CIRCLE_in_CIRCLE	Parallel run loop
auto	1.5230514075566917	0.0	discard	12_3_in_circle	Parallel run loop
auto	4.63348722009616	0.0	discard	16_CIRCLE_in_CIRCLE	Parallel run loop
auto	4.883494798545663	0.0	discard	18_CIRCLE_in_CIRCLE	Parallel run loop
auto	3.265553306575606	0.0	discard	26_4_in_CIRCLE	Parallel run loop
auto	2.643847752583437	0.0	discard	16_4_in_CIRCLE	Parallel run loop
auto	4.955505153601827	0.0	discard	37_4_in_DOMINO	Parallel run loop
auto	7.015974820954202	0.0	discard	44_3_in_3	Parallel run loop
auto	3.9241229167278884	0.0	discard	24_4_in_DOMINO	Parallel run loop
auto	3.646430789996679	0.0	discard	34_4_in_CIRCLE	Parallel run loop
auto	5.143321280120154	0.0	discard	20_CIRCLE_in_CIRCLE	Parallel run loop
auto	3.5236257287305413	0.0	discard	30_4_in_CIRCLE	Parallel run loop
auto	3.115803431953349	0.0	discard	23_4_in_CIRCLE	Parallel run loop
auto	4.475096077264324	0.0	discard	33_4_in_DOMINO	Parallel run loop
auto	3.7364237438117933	0.0	discard	31_4_in_CIRCLE	Parallel run loop
auto	11.471632991608798	0.0	discard	14_CIRCLE_in_3	Parallel run loop
auto	4.123898349155834	0.0	discard	35_4_in_CIRCLE	Parallel run loop
auto	2.9479967602447665	0.0	discard	20_4_in_CIRCLE	Parallel run loop
auto	2.62982907971198	0.0	discard	22_3_in_circle	Parallel run loop
auto	1.7029189896133312	0.0	discard	16_3_in_circle	Parallel run loop
auto	3.2232942054853804	0.0	discard	25_4_in_CIRCLE	Parallel run loop
auto	1.2748051192828511	0.0	discard	8_3_in_circle	Parallel run loop
auto	4.044636069278394	0.0	discard	12_CIRCLE_in_CIRCLE	Parallel run loop
auto	11.413488992180232	0.0	discard	13_CIRCLE_in_3	Parallel run loop
auto	1.4830513649835477	0.0	discard	11_3_in_circle	Parallel run loop
auto	7.030922742455542	0.0	discard	45_3_in_3	Parallel run loop
auto	1.6549223038095542	0.0	discard	15_3_in_circle	Parallel run loop
auto	4.538260254000323	0.0	discard	15_CIRCLE_in_CIRCLE	Parallel run loop
auto	1.8204190752494187	0.0	discard	18_3_in_circle	Parallel run loop
auto	1.8582158012495773	0.0	discard	19_3_in_circle	Parallel run loop
auto	6.84302398719644	0.0	discard	38_3_in_3	Parallel run loop
auto	2.8776782496867814	0.0	discard	19_4_in_CIRCLE	Parallel run loop
auto	1.4007623159126743	0.0	discard	10_3_in_circle	Parallel run loop
auto	2.8016697604273646	0.0	discard	18_4_in_CIRCLE	Parallel run loop
auto	4.020360663309433	0.0	discard	26_4_in_DOMINO	Parallel run loop
auto	4.809960188594904	0.0	discard	17_CIRCLE_in_CIRCLE	Parallel run loop
auto	6.9673699289329925	0.0	discard	43_3_in_3	Parallel run loop
auto	1.8958192025625156	0.0	discard	20_3_in_circle	Parallel run loop
auto	3.1064519114939206	0.0	discard	21_4_in_CIRCLE	Parallel run loop
auto	4.345096413036063	0.0	discard	14_CIRCLE_in_CIRCLE	Parallel run loop
auto	4.019565593893119	0.0	discard	33_4_in_CIRCLE	Parallel run loop
auto	1.5230514075566917	0.0	discard	12_3_in_circle	Parallel run loop
auto	4.63348722009616	0.0	discard	16_CIRCLE_in_CIRCLE	Parallel run loop
auto	4.510334332905153	0.0	discard	34_4_in_DOMINO	Parallel run loop
auto	4.883494798545663	0.0	discard	18_CIRCLE_in_CIRCLE	Parallel run loop
auto	3.747067648153613	0.0	discard	34_4_in_CIRCLE	Parallel run loop
auto	5.143321280120154	0.0	discard	20_CIRCLE_in_CIRCLE	Parallel run loop
auto	2.643847752583437	0.0	discard	16_4_in_CIRCLE	Parallel run loop
auto	3.265553306575606	0.0	discard	26_4_in_CIRCLE	Parallel run loop
auto	2.931723676723068	0.0	discard	11_4_in_DOMINO	Parallel run loop
auto	11.471632991608798	0.0	discard	14_CIRCLE_in_3	Parallel run loop
auto	3.631402274099691	0.0	discard	29_4_in_CIRCLE	Parallel run loop
auto	3.8688750047412386	0.0	discard	23_4_in_DOMINO	Parallel run loop
auto	3.5236257287305413	0.0	discard	30_4_in_CIRCLE	Parallel run loop
auto	3.115803431953349	0.0	discard	23_4_in_CIRCLE	Parallel run loop
