commit	score	memory_gb	status	problem	description
auto	10.090848203208573	0.0	discard	36_4_in_3	Parallel run loop
auto	7.15750196563385	0.0	discard	16_4_in_3	Parallel run loop
auto	9.455403984086399	0.0	discard	27_6_in_4	Parallel run loop
auto	4.30942692978523	0.0	discard	5_4_in_3	Parallel run loop
auto	7.4645934216366685	0.0	discard	18_4_in_3	Parallel run loop
auto	5.155053785931084	0.0	discard	7_4_in_3	Parallel run loop
auto	8.627146868055858	0.0	discard	25_4_in_3	Parallel run loop
auto	8.465628025883607	0.0	discard	24_4_in_3	Parallel run loop
auto	9.635390066119172	0.0	discard	31_4_in_3	Parallel run loop
auto	9.70420703924515	0.0	discard	32_4_in_3	Parallel run loop
auto	6.339849586688972	0.0	discard	11_6_in_4	Parallel run loop
auto	10.208937371323803	0.0	discard	37_4_in_3	Parallel run loop
auto	9.859456383527776	0.0	discard	34_4_in_3	Parallel run loop
auto	4.81448320628354	0.0	discard	6_6_in_4	Parallel run loop
auto	3.232052318453766	0.0	discard	3_4_in_3	Parallel run loop
auto	8.783265765615603	0.0	discard	27_4_in_3	Parallel run loop
auto	6.465828989260902	0.0	discard	14_4_in_3	Parallel run loop
auto	5.464261083124018	0.0	discard	10_4_in_3	Parallel run loop
auto	6.1054923679433895	0.0	discard	10_6_in_4	Parallel run loop
auto	11.01851023958955	0.0	discard	43_4_in_3	Parallel run loop
auto	9.156500143360176	0.0	discard	29_4_in_3	Parallel run loop
auto	10.549071817935308	0.0	discard	38_4_in_3	Parallel run loop
auto	4.4389418771467595	0.0	discard	5_6_in_4	Parallel run loop
auto	7.667364054835058	0.0	discard	17_6_in_4	Parallel run loop
auto	10.776309862715156	0.0	discard	40_4_in_3	Parallel run loop
auto	6.388951826894444	0.0	discard	12_6_in_4	Parallel run loop
auto	10.930094204549755	0.0	discard	42_4_in_3	Parallel run loop
auto	10.02474426084719	0.0	discard	35_4_in_3	Parallel run loop
auto	9.255840516534487	0.0	discard	26_6_in_4	Parallel run loop
auto	4.154707933020685	0.0	discard	4_4_in_3	Parallel run loop
auto	10.876370870591666	0.0	discard	41_4_in_3	Parallel run loop
auto	10.599771163337323	0.0	discard	39_4_in_3	Parallel run loop
auto	10.077416856221319	0.0	discard	36_4_in_3	Parallel run loop
auto	9.455403984086399	0.0	discard	27_6_in_4	Parallel run loop
auto	7.4645934216366685	0.0	discard	18_4_in_3	Parallel run loop
auto	7.742742602208797	0.0	discard	21_4_in_3	Parallel run loop
auto	8.79744222560545	0.0	discard	24_6_in_4	Parallel run loop
auto	5.155053785931084	0.0	discard	7_4_in_3	Parallel run loop
auto	8.621102567739802	0.0	discard	25_4_in_3	Parallel run loop
auto	8.541657663661779	0.0	discard	24_4_in_3	Parallel run loop
auto	9.749653181334807	0.0	discard	32_4_in_3	Parallel run loop
auto	9.54070433367155	0.0	discard	31_4_in_3	Parallel run loop
auto	7.93094512902203	0.0	discard	19_6_in_4	Parallel run loop
auto	7.309824033492363	0.0	discard	17_4_in_3	Parallel run loop
auto	9.859456383527776	0.0	discard	34_4_in_3	Parallel run loop
auto	4.3094996669154355	0.0	discard	6_4_in_3	Parallel run loop
auto	8.662236449092912	0.0	discard	23_6_in_4	Parallel run loop
auto	8.893973736111443	0.0	discard	27_4_in_3	Parallel run loop
auto	5.309763263875329	0.0	discard	8_4_in_3	Parallel run loop
auto	5.309910838673369	0.0	discard	9_4_in_3	Parallel run loop
auto	4.438123057858091	0.0	discard	5_6_in_4	Parallel run loop
auto	6.104982492730227	0.0	discard	10_6_in_4	Parallel run loop
auto	10.47736351943713	0.0	discard	38_4_in_3	Parallel run loop
auto	9.170480985456972	0.0	discard	29_4_in_3	Parallel run loop
auto	7.47650969637775	0.0	discard	19_4_in_3	Parallel run loop
auto	10.776309862715156	0.0	discard	40_4_in_3	Parallel run loop
auto	6.388840407653808	0.0	discard	12_6_in_4	Parallel run loop
auto	11.05066329001321	0.0	discard	43_4_in_3	Parallel run loop
auto	11.044659619702836	0.0	discard	42_4_in_3	Parallel run loop
auto	9.936087376153132	0.0	discard	35_4_in_3	Parallel run loop
auto	7.321655420249306	0.0	discard	16_6_in_4	Parallel run loop
auto	10.934110033460978	0.0	discard	41_4_in_3	Parallel run loop
auto	10.599771163337323	0.0	discard	39_4_in_3	Parallel run loop
auto	4.154707933020685	0.0	discard	4_4_in_3	Parallel run loop
auto	10.090481997169428	0.0	discard	36_4_in_3	Parallel run loop
auto	7.387955541169579	0.0	discard	18_4_in_3	Parallel run loop
auto	6.310542818074557	0.0	discard	12_4_in_3	Parallel run loop
auto	5.155053785931084	0.0	discard	7_4_in_3	Parallel run loop
auto	9.44462203203615	0.0	discard	27_6_in_4	Parallel run loop
auto	8.465628025883607	0.0	discard	24_4_in_3	Parallel run loop
auto	8.622307413281824	0.0	discard	25_4_in_3	Parallel run loop
auto	8.802712457436023	0.0	discard	24_6_in_4	Parallel run loop
auto	9.743762411586093	0.0	discard	32_4_in_3	Parallel run loop
auto	9.54070433367155	0.0	discard	31_4_in_3	Parallel run loop
auto	8.578042711805615	0.0	discard	22_6_in_4	Parallel run loop
auto	7.309824033492363	0.0	discard	17_4_in_3	Parallel run loop
auto	3.491959731325357	0.0	discard	3_6_in_4	Parallel run loop
auto	9.931246793297	0.0	discard	34_4_in_3	Parallel run loop
auto	8.668469913995917	0.0	discard	23_6_in_4	Parallel run loop
auto	6.758530280097716	0.0	discard	13_6_in_4	Parallel run loop
auto	4.440722088808257	0.0	discard	5_6_in_4	Parallel run loop
auto	8.905031750058896	0.0	discard	27_4_in_3	Parallel run loop
auto	10.776309862715156	0.0	discard	40_4_in_3	Parallel run loop
auto	8.778031375178879	0.0	discard	28_4_in_3	Parallel run loop
auto	4.30942692978523	0.0	discard	5_4_in_3	Parallel run loop
auto	10.549071817935308	0.0	discard	38_4_in_3	Parallel run loop
auto	6.104982492730227	0.0	discard	10_6_in_4	Parallel run loop
auto	10.930094204549755	0.0	discard	42_4_in_3	Parallel run loop
auto	7.15750196563385	0.0	discard	16_4_in_3	Parallel run loop
auto	11.01851023958955	0.0	discard	43_4_in_3	Parallel run loop
auto	6.339849586688972	0.0	discard	11_6_in_4	Parallel run loop
auto	9.471674556783666	0.0	discard	30_4_in_3	Parallel run loop
auto	10.102256807489026	0.0	discard	35_4_in_3	Parallel run loop
auto	4.814211891248772	0.0	discard	6_6_in_4	Parallel run loop
auto	10.929690989571514	0.0	discard	41_4_in_3	Parallel run loop
auto	10.599771163337323	0.0	discard	39_4_in_3	Parallel run loop
auto	10.087378355933945	0.0	discard	36_4_in_3	Parallel run loop
auto	3.2320649913102013	0.0	discard	3_4_in_3	Parallel run loop
auto	7.387955541169579	0.0	discard	18_4_in_3	Parallel run loop
auto	5.464231117966536	0.0	discard	10_4_in_3	Parallel run loop
auto	9.398771335140053	0.0	discard	27_6_in_4	Parallel run loop
auto	6.4656366476095695	0.0	discard	14_4_in_3	Parallel run loop
auto	9.801666012162258	0.0	discard	32_4_in_3	Parallel run loop
auto	8.621102567739802	0.0	discard	25_4_in_3	Parallel run loop
auto	8.591953675831972	0.0	discard	24_4_in_3	Parallel run loop
auto	9.597130699747467	0.0	discard	31_4_in_3	Parallel run loop
auto	7.606741618201064	0.0	discard	17_6_in_4	Parallel run loop
auto	7.309824033492363	0.0	discard	17_4_in_3	Parallel run loop
auto	9.942756554192467	0.0	discard	34_4_in_3	Parallel run loop
auto	9.255840516534487	0.0	discard	26_6_in_4	Parallel run loop
auto	8.154847614937545	0.0	discard	22_4_in_3	Parallel run loop
auto	8.662236449092912	0.0	discard	23_6_in_4	Parallel run loop
auto	11.044659619702836	0.0	discard	42_4_in_3	Parallel run loop
auto	10.776309862715156	0.0	discard	40_4_in_3	Parallel run loop
auto	7.6389652057557225	0.0	discard	20_4_in_3	Parallel run loop
auto	8.881154331031414	0.0	discard	27_4_in_3	Parallel run loop
auto	7.6282607946591146	0.0	discard	21_4_in_3	Parallel run loop
auto	4.3094996669154355	0.0	discard	6_4_in_3	Parallel run loop
auto	7.929378074021842	0.0	discard	19_6_in_4	Parallel run loop
auto	5.313726164808948	0.0	discard	9_4_in_3	Parallel run loop
auto	5.309456355946519	0.0	discard	8_4_in_3	Parallel run loop
auto	10.599771163337323	0.0	discard	39_4_in_3	Parallel run loop
auto	7.3211725522845335	0.0	discard	16_6_in_4	Parallel run loop
auto	9.877528661157257	0.0	discard	35_4_in_3	Parallel run loop
auto	11.01851023958955	0.0	discard	43_4_in_3	Parallel run loop
auto	7.471317325000314	0.0	discard	19_4_in_3	Parallel run loop
auto	10.857625834240915	0.0	discard	41_4_in_3	Parallel run loop
auto	4.8139467162719285	0.0	discard	6_6_in_4	Parallel run loop
auto	10.090848203208573	0.0	discard	36_4_in_3	Parallel run loop
auto	7.387955541169579	0.0	discard	18_4_in_3	Parallel run loop
auto	5.464261083124018	0.0	discard	10_4_in_3	Parallel run loop
auto	5.5188027154469745	0.0	discard	9_6_in_4	Parallel run loop
auto	6.4642062051880504	0.0	keep	14_4_in_3	Parallel run loop
auto	9.455403984086399	0.0	discard	27_6_in_4	Parallel run loop
auto	8.513301110599267	0.0	discard	24_4_in_3	Parallel run loop
auto	9.659578206958082	0.0	discard	32_4_in_3	Parallel run loop
auto	8.627146868055858	0.0	discard	25_4_in_3	Parallel run loop
auto	7.626602931549492	0.0	discard	17_6_in_4	Parallel run loop
auto	6.309719735191199	0.0	discard	12_4_in_3	Parallel run loop
auto	9.472120229746906	0.0	discard	31_4_in_3	Parallel run loop
auto	8.583374246046413	0.0	discard	22_6_in_4	Parallel run loop
auto	8.236289814969588	0.0	discard	22_4_in_3	Parallel run loop
auto	9.859456383527776	0.0	discard	34_4_in_3	Parallel run loop
auto	8.774947412252958	0.0	discard	26_4_in_3	Parallel run loop
auto	10.629169964278313	0.0	keep	40_4_in_3	Parallel run loop
auto	7.668656188512311	0.0	discard	21_4_in_3	Parallel run loop
auto	8.787911269234767	0.0	discard	27_4_in_3	Parallel run loop
auto	10.963768808251237	0.0	discard	42_4_in_3	Parallel run loop
auto	10.273658222250052	0.0	discard	37_4_in_3	Parallel run loop
auto	3.491959014509597	0.0	discard	3_6_in_4	Parallel run loop
auto	7.93094512902203	0.0	discard	19_6_in_4	Parallel run loop
auto	9.96093481479161	0.0	discard	35_4_in_3	Parallel run loop
auto	10.599771163337323	0.0	discard	39_4_in_3	Parallel run loop
auto	3.7250037826503797	0.0	discard	4_6_in_4	Parallel run loop
auto	6.764428342593895	0.0	discard	13_6_in_4	Parallel run loop
auto	10.938599347826347	0.0	discard	43_4_in_3	Parallel run loop
auto	10.95031226862635	0.0	discard	41_4_in_3	Parallel run loop
auto	4.813853256562242	0.0	discard	6_6_in_4	Parallel run loop
auto	7.47650969637775	0.0	discard	19_4_in_3	Parallel run loop
auto	8.778031375178879	0.0	discard	28_4_in_3	Parallel run loop
auto	10.087378355933945	0.0	discard	36_4_in_3	Parallel run loop
auto	6.156893685363397	0.0	discard	11_4_in_3	Parallel run loop
auto	9.47062467278763	0.0	discard	30_4_in_3	Parallel run loop
auto	7.4645934216366685	0.0	discard	18_4_in_3	Parallel run loop
auto	9.500382336005865	0.0	discard	27_6_in_4	Parallel run loop
auto	8.591953675831972	0.0	discard	24_4_in_3	Parallel run loop
auto	6.465828989260902	0.0	discard	14_4_in_3	Parallel run loop
auto	8.563014759510843	0.0	discard	25_4_in_3	Parallel run loop
auto	9.635390066119172	0.0	discard	31_4_in_3	Parallel run loop
auto	9.743762411586093	0.0	discard	32_4_in_3	Parallel run loop
auto	6.964093304910182	0.0	discard	15_6_in_4	Parallel run loop
auto	7.15750196563385	0.0	discard	16_4_in_3	Parallel run loop
auto	4.309418543637569	0.0	discard	5_4_in_3	Parallel run loop
auto	3.2320607503195915	0.0	discard	3_4_in_3	Parallel run loop
auto	8.872878150568093	0.0	discard	27_4_in_3	Parallel run loop
auto	7.629777982122117	0.0	discard	21_4_in_3	Parallel run loop
auto	6.336898312206758	0.0	discard	11_6_in_4	Parallel run loop
auto	10.776309862715156	0.0	discard	40_4_in_3	Parallel run loop
auto	9.928503593750683	0.0	discard	34_4_in_3	Parallel run loop
auto	9.255840516534487	0.0	discard	26_6_in_4	Parallel run loop
auto	3.491959014509597	0.0	discard	3_6_in_4	Parallel run loop
auto	7.929378074021842	0.0	discard	19_6_in_4	Parallel run loop
auto	11.044659619702836	0.0	discard	42_4_in_3	Parallel run loop
auto	6.388840407653808	0.0	discard	12_6_in_4	Parallel run loop
auto	10.01756455102368	0.0	discard	35_4_in_3	Parallel run loop
auto	11.01851023958955	0.0	discard	43_4_in_3	Parallel run loop
auto	7.620768472631966	0.0	discard	20_4_in_3	Parallel run loop
auto	10.629098076349557	0.0	discard	39_4_in_3	Parallel run loop
auto	4.154707933020685	0.0	discard	4_4_in_3	Parallel run loop
auto	8.802321555071812	0.0	discard	24_6_in_4	Parallel run loop
auto	4.814211891248772	0.0	discard	6_6_in_4	Parallel run loop
auto	10.868935062578375	0.0	discard	41_4_in_3	Parallel run loop
auto	10.091697833051867	0.0	discard	36_4_in_3	Parallel run loop
auto	4.3094996669154355	0.0	discard	6_4_in_3	Parallel run loop
auto	7.4645934216366685	0.0	discard	18_4_in_3	Parallel run loop
auto	9.527477794934235	0.0	discard	30_4_in_3	Parallel run loop
auto	8.623666296814353	0.0	discard	25_4_in_3	Parallel run loop
auto	9.513940573292547	0.0	discard	27_6_in_4	Parallel run loop
auto	8.471518827955164	0.0	discard	24_4_in_3	Parallel run loop
auto	5.313726164808948	0.0	discard	9_4_in_3	Parallel run loop
auto	9.81626260602841	0.0	discard	32_4_in_3	Parallel run loop
auto	9.631514356730015	0.0	discard	31_4_in_3	Parallel run loop
auto	5.518169259009756	0.0	discard	9_6_in_4	Parallel run loop
auto	5.311470093777435	0.0	discard	8_4_in_3	Parallel run loop
auto	8.856773859040588	0.0	discard	27_4_in_3	Parallel run loop
auto	7.321655420249306	0.0	discard	16_6_in_4	Parallel run loop
auto	7.623675363404806	0.0	keep	21_4_in_3	Parallel run loop
auto	10.776309862715156	0.0	discard	40_4_in_3	Parallel run loop
auto	6.339849586688972	0.0	discard	11_6_in_4	Parallel run loop
auto	6.309719735191199	0.0	discard	12_4_in_3	Parallel run loop
auto	3.491959014509597	0.0	discard	3_6_in_4	Parallel run loop
auto	9.859456383527776	0.0	discard	34_4_in_3	Parallel run loop
auto	10.938891194679247	0.0	discard	42_4_in_3	Parallel run loop
auto	6.388840407653808	0.0	discard	12_6_in_4	Parallel run loop
auto	7.929378074021842	0.0	discard	19_6_in_4	Parallel run loop
auto	10.059349683152524	0.0	discard	35_4_in_3	Parallel run loop
auto	8.774947412252958	0.0	discard	26_4_in_3	Parallel run loop
auto	4.814977901128664	0.0	discard	6_6_in_4	Parallel run loop
auto	10.629098076349557	0.0	discard	39_4_in_3	Parallel run loop
auto	8.807448787223308	0.0	discard	24_6_in_4	Parallel run loop
auto	8.626434343123188	0.0	discard	22_6_in_4	Parallel run loop
auto	11.01851023958955	0.0	discard	43_4_in_3	Parallel run loop
auto	7.622844726014357	0.0	discard	20_4_in_3	Parallel run loop
auto	10.876370870591666	0.0	discard	41_4_in_3	Parallel run loop
auto	10.091697833051867	0.0	discard	36_4_in_3	Parallel run loop
auto	10.260221039654585	0.0	discard	37_4_in_3	Parallel run loop
auto	8.556205176387037	0.0	discard	25_4_in_3	Parallel run loop
auto	3.7250031912651163	0.0	discard	4_6_in_4	Parallel run loop
auto	7.4645934216366685	0.0	discard	18_4_in_3	Parallel run loop
auto	9.472120229746906	0.0	discard	31_4_in_3	Parallel run loop
auto	9.513940573292547	0.0	discard	27_6_in_4	Parallel run loop
auto	9.776917347988455	0.0	discard	32_4_in_3	Parallel run loop
auto	5.518421711656798	0.0	discard	9_6_in_4	Parallel run loop
auto	9.24249056264491	0.0	discard	29_4_in_3	Parallel run loop
auto	6.763805704177151	0.0	discard	13_6_in_4	Parallel run loop
auto	8.785229111502591	0.0	discard	27_4_in_3	Parallel run loop
auto	8.591953675831972	0.0	discard	24_4_in_3	Parallel run loop
auto	8.887524588788821	0.0	discard	28_4_in_3	Parallel run loop
auto	7.742742602208797	0.0	discard	21_4_in_3	Parallel run loop
auto	9.915899865338089	0.0	discard	34_4_in_3	Parallel run loop
auto	7.15750196563385	0.0	discard	16_4_in_3	Parallel run loop
auto	6.154757970205473	0.0	keep	11_4_in_3	Parallel run loop
auto	7.929969838268283	0.0	discard	19_6_in_4	Parallel run loop
auto	10.043200894965349	0.0	discard	35_4_in_3	Parallel run loop
auto	10.995310036433763	0.0	discard	43_4_in_3	Parallel run loop
auto	6.388840407653808	0.0	discard	12_6_in_4	Parallel run loop
auto	4.309418543637569	0.0	discard	5_4_in_3	Parallel run loop
auto	10.704871652443588	0.0	discard	40_4_in_3	Parallel run loop
auto	5.464237488458371	0.0	discard	10_4_in_3	Parallel run loop
auto	3.232052318453766	0.0	discard	3_4_in_3	Parallel run loop
auto	6.96445270547868	0.0	discard	15_6_in_4	Parallel run loop
auto	6.3985247233180775	0.0	discard	13_4_in_3	Parallel run loop
auto	7.609265549754522	0.0	discard	17_6_in_4	Parallel run loop
auto	10.931904666713491	0.0	discard	41_4_in_3	Parallel run loop
auto	10.92685747137244	0.0	discard	42_4_in_3	Parallel run loop
auto	10.599771163337323	0.0	discard	39_4_in_3	Parallel run loop
auto	10.064106535642859	0.0	discard	36_4_in_3	Parallel run loop
auto	8.619398901246518	0.0	discard	25_4_in_3	Parallel run loop
auto	10.260221039654585	0.0	discard	37_4_in_3	Parallel run loop
auto	8.310638441783382	0.0	discard	22_4_in_3	Parallel run loop
auto	7.4645934216366685	0.0	discard	18_4_in_3	Parallel run loop
auto	9.807451120192226	0.0	discard	32_4_in_3	Parallel run loop
auto	9.513940573292547	0.0	discard	27_6_in_4	Parallel run loop
auto	9.255840516534487	0.0	discard	26_6_in_4	Parallel run loop
auto	9.619043541412415	0.0	discard	31_4_in_3	Parallel run loop
auto	4.154707933020685	0.0	discard	4_4_in_3	Parallel run loop
auto	4.3094996669154355	0.0	discard	6_4_in_3	Parallel run loop
auto	8.784800424936387	0.0	discard	27_4_in_3	Parallel run loop
auto	5.309910838673369	0.0	discard	9_4_in_3	Parallel run loop
auto	8.568395832409651	0.0	discard	24_4_in_3	Parallel run loop
auto	7.309824033492363	0.0	discard	17_4_in_3	Parallel run loop
auto	6.156893685363397	0.0	discard	11_4_in_3	Parallel run loop
auto	9.859456383527776	0.0	discard	34_4_in_3	Parallel run loop
auto	8.687194129676884	0.0	discard	23_6_in_4	Parallel run loop
auto	5.309456355946519	0.0	discard	8_4_in_3	Parallel run loop
auto	3.232052318453766	0.0	discard	3_4_in_3	Parallel run loop
auto	10.776309862715156	0.0	discard	40_4_in_3	Parallel run loop
auto	11.103647942559064	0.0	discard	43_4_in_3	Parallel run loop
auto	5.464337921567581	0.0	discard	10_4_in_3	Parallel run loop
auto	6.389261532841575	0.0	discard	12_6_in_4	Parallel run loop
auto	10.088803322429495	0.0	discard	35_4_in_3	Parallel run loop
auto	7.471317325000314	0.0	discard	19_4_in_3	Parallel run loop
auto	7.321655420249306	0.0	discard	16_6_in_4	Parallel run loop
auto	11.057079850967028	0.0	discard	42_4_in_3	Parallel run loop
auto	10.923760603712402	0.0	discard	41_4_in_3	Parallel run loop
auto	7.643914050230149	0.0	discard	17_6_in_4	Parallel run loop
auto	10.599771163337323	0.0	discard	39_4_in_3	Parallel run loop
auto	6.309719735191199	0.0	discard	12_4_in_3	Parallel run loop
auto	10.090848203208573	0.0	discard	36_4_in_3	Parallel run loop
auto	8.619398901246518	0.0	discard	25_4_in_3	Parallel run loop
auto	8.625701385822886	0.0	keep	26_4_in_3	Parallel run loop
auto	5.155344374810373	0.0	discard	7_4_in_3	Parallel run loop
auto	9.500382336005865	0.0	discard	27_6_in_4	Parallel run loop
auto	7.387955541169579	0.0	discard	18_4_in_3	Parallel run loop
auto	4.154750717508222	0.0	discard	4_4_in_3	Parallel run loop
auto	9.77605831201459	0.0	discard	32_4_in_3	Parallel run loop
auto	3.7250031912651163	0.0	discard	4_6_in_4	Parallel run loop
auto	8.571858677686734	0.0	keep	22_6_in_4	Parallel run loop
auto	8.553044291559809	0.0	discard	24_4_in_3	Parallel run loop
auto	8.793324245426204	0.0	discard	27_4_in_3	Parallel run loop
auto	9.499299123679213	0.0	discard	31_4_in_3	Parallel run loop
auto	7.309824033492363	0.0	discard	17_4_in_3	Parallel run loop
auto	9.940946873872878	0.0	discard	34_4_in_3	Parallel run loop
auto	4.309409782028365	0.0	discard	5_4_in_3	Parallel run loop
auto	8.778031375178879	0.0	discard	28_4_in_3	Parallel run loop
auto	6.759508156569627	0.0	discard	13_6_in_4	Parallel run loop
auto	9.246638397085151	0.0	discard	29_4_in_3	Parallel run loop
auto	4.438938361146937	0.0	discard	5_6_in_4	Parallel run loop
auto	10.100856434129922	0.0	discard	35_4_in_3	Parallel run loop
auto	7.471317325000314	0.0	discard	19_4_in_3	Parallel run loop
auto	11.01851023958955	0.0	discard	43_4_in_3	Parallel run loop
auto	9.426331391908217	0.0	discard	30_4_in_3	Parallel run loop
auto	10.936299587656697	0.0	discard	42_4_in_3	Parallel run loop
auto	11.0146746562449	0.0	discard	41_4_in_3	Parallel run loop
auto	7.6651078665839885	0.0	discard	17_6_in_4	Parallel run loop
auto	7.15750196563385	0.0	discard	16_4_in_3	Parallel run loop
auto	10.776309862715156	0.0	discard	40_4_in_3	Parallel run loop
auto	10.08995002629652	0.0	discard	36_4_in_3	Parallel run loop
auto	6.339849586688972	0.0	discard	11_6_in_4	Parallel run loop
auto	10.630909312077861	0.0	discard	39_4_in_3	Parallel run loop
auto	6.964000014504972	0.0	discard	15_6_in_4	Parallel run loop
auto	8.627146868055858	0.0	discard	25_4_in_3	Parallel run loop
auto	8.774947412252958	0.0	discard	26_4_in_3	Parallel run loop
auto	6.465828989260902	0.0	discard	14_4_in_3	Parallel run loop
auto	7.387955541169579	0.0	discard	18_4_in_3	Parallel run loop
auto	9.743762411586093	0.0	discard	32_4_in_3	Parallel run loop
auto	6.3894945280876145	0.0	discard	13_4_in_3	Parallel run loop
auto	9.474361225301514	0.0	discard	27_6_in_4	Parallel run loop
auto	8.553044291559809	0.0	discard	24_4_in_3	Parallel run loop
auto	9.472120229746906	0.0	discard	31_4_in_3	Parallel run loop
auto	8.583374246046413	0.0	discard	22_6_in_4	Parallel run loop
auto	8.77391027500456	0.0	discard	27_4_in_3	Parallel run loop
auto	8.169777396534393	0.0	discard	22_4_in_3	Parallel run loop
auto	9.255840516534487	0.0	discard	26_6_in_4	Parallel run loop
auto	4.309409782028365	0.0	discard	5_4_in_3	Parallel run loop
auto	9.934621969128687	0.0	discard	34_4_in_3	Parallel run loop
auto	7.62493979132775	0.0	discard	20_4_in_3	Parallel run loop
auto	6.759508156569627	0.0	discard	13_6_in_4	Parallel run loop
auto	4.3094996669154355	0.0	discard	6_4_in_3	Parallel run loop
auto	8.802476707641297	0.0	discard	24_6_in_4	Parallel run loop
auto	9.470231222643518	0.0	discard	30_4_in_3	Parallel run loop
auto	11.057079850967028	0.0	discard	42_4_in_3	Parallel run loop
auto	10.953665867786633	0.0	discard	41_4_in_3	Parallel run loop
auto	10.776309862715156	0.0	discard	40_4_in_3	Parallel run loop
auto	7.471317325000314	0.0	discard	19_4_in_3	Parallel run loop
auto	11.058125893868384	0.0	discard	43_4_in_3	Parallel run loop
auto	10.010413360236821	0.0	discard	35_4_in_3	Parallel run loop
auto	10.482155065084912	0.0	discard	38_4_in_3	Parallel run loop
