commit	score	memory_gb	status	problem	description
auto	4.431601397114377	0.0	discard	30_3_in_4	Parallel run loop
auto	5.682306768643288	0.0	discard	46_3_in_4	Parallel run loop
auto	5.299673291475193	0.0	discard	41_3_in_4	Parallel run loop
auto	5.8148543246182784	0.0	discard	48_3_in_4	Parallel run loop
auto	4.585760271107522	0.0	discard	32_3_in_4	Parallel run loop
auto	3.821618733046842	0.0	discard	32_3_in_5	Parallel run loop
auto	3.678225926605342	0.0	discard	21_3_in_4	Parallel run loop
auto	1.472940599971071	0.0	discard	5_3_in_5	Parallel run loop
auto	2.8036502562978303	0.0	discard	18_3_in_5	Parallel run loop
auto	4.5052519089814655	0.0	discard	31_3_in_4	Parallel run loop
auto	3.9503980673496435	0.0	discard	34_3_in_5	Parallel run loop
auto	3.3332531249228583	0.0	discard	25_3_in_5	Parallel run loop
auto	4.9113622831955865	0.0	discard	49_3_in_5	Parallel run loop
auto	4.816689595164396	0.0	discard	48_3_in_5	Parallel run loop
auto	4.153401499683559	0.0	discard	37_3_in_5	Parallel run loop
auto	4.646215964428969	0.0	discard	44_3_in_5	Parallel run loop
auto	3.886547906995229	0.0	discard	33_3_in_5	Parallel run loop
auto	4.534926745190415	0.0	discard	43_3_in_5	Parallel run loop
auto	1.8618262561353123	0.0	discard	8_3_in_5	Parallel run loop
auto	4.834166854058425	0.0	discard	47_3_in_5	Parallel run loop
auto	3.9509015086217225	0.0	discard	24_3_in_4	Parallel run loop
auto	1.741520805105189	0.0	discard	7_3_in_5	Parallel run loop
auto	3.374150497876484	0.0	discard	18_3_in_4	Parallel run loop
auto	5.157303844649163	0.0	discard	39_3_in_4	Parallel run loop
auto	4.03456833982831	0.0	discard	25_3_in_4	Parallel run loop
auto	2.3761332732625355	0.0	discard	13_3_in_5	Parallel run loop
auto	1.9761813360420224	0.0	discard	9_3_in_5	Parallel run loop
auto	2.6458840600006073	0.0	discard	16_3_in_5	Parallel run loop
auto	4.280891031948797	0.0	discard	39_3_in_5	Parallel run loop
auto	5.549976559997544	0.0	discard	44_3_in_4	Parallel run loop
auto	2.8574362968729536	0.0	discard	13_3_in_4	Parallel run loop
auto	3.764779582576863	0.0	discard	22_3_in_4	Parallel run loop
auto	4.585624124585849	0.0	discard	32_3_in_4	Parallel run loop
auto	5.2597039333582245	0.0	discard	41_3_in_4	Parallel run loop
auto	5.728951149458322	0.0	discard	46_3_in_4	Parallel run loop
auto	4.436582299565148	0.0	discard	30_3_in_4	Parallel run loop
auto	5.922907465561673	0.0	discard	48_3_in_4	Parallel run loop
auto	3.678264728777231	0.0	discard	21_3_in_4	Parallel run loop
auto	3.8422548712084836	0.0	discard	23_3_in_4	Parallel run loop
auto	3.4804176148635593	0.0	discard	27_3_in_5	Parallel run loop
auto	2.812203816048876	0.0	discard	18_3_in_5	Parallel run loop
auto	3.7459454268146164	0.0	discard	31_3_in_5	Parallel run loop
auto	3.348235612289268	0.0	discard	25_3_in_5	Parallel run loop
auto	4.9010927885846405	0.0	discard	49_3_in_5	Parallel run loop
auto	3.6179926248486507	0.0	discard	29_3_in_5	Parallel run loop
auto	4.700664784752636	0.0	discard	45_3_in_5	Parallel run loop
auto	3.8890920112006744	0.0	discard	33_3_in_5	Parallel run loop
auto	4.894899033642789	0.0	discard	48_3_in_5	Parallel run loop
auto	4.874620567782788	0.0	discard	47_3_in_5	Parallel run loop
auto	4.013055772872405	0.0	discard	35_3_in_5	Parallel run loop
auto	3.9396588014444127	0.0	discard	24_3_in_4	Parallel run loop
auto	4.201451182396569	0.0	discard	27_3_in_4	Parallel run loop
auto	1.8616876272565483	0.0	discard	8_3_in_5	Parallel run loop
auto	2.858406290865934	0.0	discard	13_3_in_4	Parallel run loop
auto	3.3916005710089565	0.0	discard	18_3_in_4	Parallel run loop
auto	4.989697451147667	0.0	discard	37_3_in_4	Parallel run loop
auto	5.473624686357986	0.0	discard	43_3_in_4	Parallel run loop
auto	4.081433007120316	0.0	discard	36_3_in_5	Parallel run loop
auto	1.7415209270617367	0.0	discard	7_3_in_5	Parallel run loop
auto	2.375738022845646	0.0	discard	13_3_in_5	Parallel run loop
auto	5.832794610956101	0.0	discard	47_3_in_4	Parallel run loop
auto	5.693730068056111	0.0	discard	46_3_in_4	Parallel run loop
auto	4.424479631988935	0.0	discard	41_3_in_5	Parallel run loop
auto	4.585907039228384	0.0	discard	32_3_in_4	Parallel run loop
auto	3.137588746498847	0.0	discard	22_3_in_5	Parallel run loop
auto	5.3140888053704	0.0	discard	41_3_in_4	Parallel run loop
auto	4.442518400500379	0.0	discard	30_3_in_4	Parallel run loop
auto	4.328248697339882	0.0	discard	40_3_in_5	Parallel run loop
auto	2.9748280317256484	0.0	discard	20_3_in_5	Parallel run loop
auto	3.8615972837543486	0.0	discard	23_3_in_4	Parallel run loop
auto	3.6778295167407116	0.0	discard	21_3_in_4	Parallel run loop
auto	3.489383283142823	0.0	discard	27_3_in_5	Parallel run loop
auto	2.809109124234959	0.0	discard	18_3_in_5	Parallel run loop
auto	3.74932302673242	0.0	discard	31_3_in_5	Parallel run loop
auto	4.960932180721833	0.0	discard	49_3_in_5	Parallel run loop
auto	3.343386024045272	0.0	discard	25_3_in_5	Parallel run loop
auto	3.624015823544955	0.0	discard	29_3_in_5	Parallel run loop
auto	4.685639810987329	0.0	discard	45_3_in_5	Parallel run loop
auto	4.917997248684821	0.0	discard	48_3_in_5	Parallel run loop
auto	3.056807156787094	0.0	discard	21_3_in_5	Parallel run loop
auto	4.002497350671502	0.0	discard	35_3_in_5	Parallel run loop
auto	3.4748621186078514	0.0	discard	19_3_in_4	Parallel run loop
auto	3.9484186761811197	0.0	discard	24_3_in_4	Parallel run loop
auto	1.862270584454065	0.0	discard	8_3_in_5	Parallel run loop
auto	4.996513475417375	0.0	discard	50_3_in_5	Parallel run loop
auto	1.7415210075792393	0.0	discard	7_3_in_5	Parallel run loop
auto	4.992667436556401	0.0	discard	37_3_in_4	Parallel run loop
auto	5.471893673513298	0.0	discard	43_3_in_4	Parallel run loop
auto	4.911800779055884	0.0	discard	36_3_in_4	Parallel run loop
auto	2.8894454315476965	0.0	discard	19_3_in_5	Parallel run loop
auto	2.856410462779632	0.0	discard	13_3_in_4	Parallel run loop
auto	5.22984702666132	0.0	discard	40_3_in_4	Parallel run loop
auto	4.675524555480416	0.0	discard	33_3_in_4	Parallel run loop
auto	5.7451630457885035	0.0	discard	46_3_in_4	Parallel run loop
auto	2.183879537835532	0.0	discard	11_3_in_5	Parallel run loop
auto	4.498190630990099	0.0	discard	42_3_in_5	Parallel run loop
auto	4.119028683340692	0.0	discard	26_3_in_4	Parallel run loop
auto	4.549971733868087	0.0	discard	43_3_in_5	Parallel run loop
auto	5.085497108967094	0.0	discard	38_3_in_4	Parallel run loop
auto	3.8506493554949146	0.0	discard	23_3_in_4	Parallel run loop
auto	3.3559823233612645	0.0	discard	25_3_in_5	Parallel run loop
auto	3.7557767300664877	0.0	discard	31_3_in_5	Parallel run loop
auto	3.4901811184295815	0.0	discard	27_3_in_5	Parallel run loop
auto	4.357882239141805	0.0	discard	29_3_in_4	Parallel run loop
auto	2.9718216981887555	0.0	discard	20_3_in_5	Parallel run loop
auto	4.964314328345671	0.0	discard	49_3_in_5	Parallel run loop
auto	2.817214357371377	0.0	discard	18_3_in_5	Parallel run loop
auto	3.6753149517714734	0.0	discard	21_3_in_4	Parallel run loop
auto	4.578524378306164	0.0	discard	44_3_in_5	Parallel run loop
auto	4.0179094473840165	0.0	discard	35_3_in_5	Parallel run loop
auto	4.150806847283978	0.0	discard	37_3_in_5	Parallel run loop
auto	3.4871840692541594	0.0	discard	19_3_in_4	Parallel run loop
auto	3.425582644734859	0.0	discard	26_3_in_5	Parallel run loop
auto	3.215101016604777	0.0	discard	23_3_in_5	Parallel run loop
auto	3.952003653774082	0.0	discard	24_3_in_4	Parallel run loop
auto	4.033880095342315	0.0	discard	25_3_in_4	Parallel run loop
auto	1.861689063078724	0.0	discard	8_3_in_5	Parallel run loop
auto	2.902372632503388	0.0	discard	19_3_in_5	Parallel run loop
auto	5.15197701696613	0.0	discard	39_3_in_4	Parallel run loop
auto	2.7344363095296833	0.0	discard	17_3_in_5	Parallel run loop
auto	5.191756653725868	0.0	discard	40_3_in_4	Parallel run loop
auto	5.505955378054052	0.0	discard	43_3_in_4	Parallel run loop
auto	4.655346198754355	0.0	discard	33_3_in_4	Parallel run loop
auto	1.9747928128944459	0.0	discard	9_3_in_5	Parallel run loop
auto	2.860138097670802	0.0	discard	13_3_in_4	Parallel run loop
auto	2.183991076242773	0.0	discard	11_3_in_5	Parallel run loop
auto	4.2800489006868725	0.0	discard	39_3_in_5	Parallel run loop
auto	4.20134589648837	0.0	discard	27_3_in_4	Parallel run loop
auto	5.704665152422516	0.0	discard	46_3_in_4	Parallel run loop
auto	3.8593390849175844	0.0	discard	23_3_in_4	Parallel run loop
auto	5.019772627349093	0.0	discard	38_3_in_4	Parallel run loop
auto	4.754597204888607	0.0	discard	46_3_in_5	Parallel run loop
auto	3.766673648451794	0.0	discard	22_3_in_4	Parallel run loop
auto	3.554581092310484	0.0	discard	28_3_in_5	Parallel run loop
auto	4.279516088625683	0.0	discard	28_3_in_4	Parallel run loop
auto	4.182717331306672	0.0	discard	38_3_in_5	Parallel run loop
auto	2.4661299383365702	0.0	discard	14_3_in_5	Parallel run loop
auto	4.357436376926885	0.0	discard	29_3_in_4	Parallel run loop
auto	4.051403091548968	0.0	keep	36_3_in_5	Parallel run loop
auto	4.610438180295428	0.0	discard	44_3_in_5	Parallel run loop
auto	3.8023946525496393	0.0	discard	32_3_in_5	Parallel run loop
auto	5.826910738529898	0.0	discard	47_3_in_4	Parallel run loop
auto	3.2818901038827244	0.0	discard	24_3_in_5	Parallel run loop
auto	4.416554978049517	0.0	discard	41_3_in_5	Parallel run loop
auto	4.3227548907728925	0.0	discard	40_3_in_5	Parallel run loop
auto	1.8622721665512032	0.0	discard	8_3_in_5	Parallel run loop
auto	3.137032868098389	0.0	discard	22_3_in_5	Parallel run loop
auto	3.0628690397958835	0.0	discard	21_3_in_5	Parallel run loop
auto	5.064150820404027	0.0	discard	50_3_in_5	Parallel run loop
auto	2.903356334545761	0.0	discard	19_3_in_5	Parallel run loop
auto	1.9752469955824403	0.0	discard	9_3_in_5	Parallel run loop
auto	4.67220608145454	0.0	discard	33_3_in_4	Parallel run loop
auto	4.865900483423787	0.0	discard	36_3_in_4	Parallel run loop
auto	2.6387538809420072	0.0	discard	16_3_in_5	Parallel run loop
auto	5.57171919188146	0.0	discard	44_3_in_4	Parallel run loop
auto	5.22190388887061	0.0	discard	40_3_in_4	Parallel run loop
auto	4.149547723454701	0.0	discard	37_3_in_5	Parallel run loop
auto	4.215468173515719	0.0	discard	38_3_in_5	Parallel run loop
auto	4.571754177952527	0.0	discard	43_3_in_5	Parallel run loop
auto	4.279643784770154	0.0	discard	28_3_in_4	Parallel run loop
auto	5.081476676876344	0.0	discard	38_3_in_4	Parallel run loop
auto	3.865776381295095	0.0	discard	23_3_in_4	Parallel run loop
auto	4.118387935174307	0.0	discard	26_3_in_4	Parallel run loop
auto	4.4957339018605955	0.0	discard	42_3_in_5	Parallel run loop
auto	3.7733146117192966	0.0	discard	22_3_in_4	Parallel run loop
auto	5.669494159712282	0.0	discard	45_3_in_4	Parallel run loop
auto	4.7894560122898095	0.0	discard	46_3_in_5	Parallel run loop
auto	3.7989602116134646	0.0	discard	32_3_in_5	Parallel run loop
auto	4.057314564565037	0.0	discard	36_3_in_5	Parallel run loop
auto	4.774505218671138	0.0	discard	47_3_in_5	Parallel run loop
auto	5.42024606848092	0.0	discard	42_3_in_4	Parallel run loop
auto	3.8748798588770175	0.0	discard	33_3_in_5	Parallel run loop
auto	4.56263961884708	0.0	discard	44_3_in_5	Parallel run loop
auto	3.4255466296650883	0.0	discard	26_3_in_5	Parallel run loop
auto	3.2836903426943373	0.0	discard	24_3_in_5	Parallel run loop
auto	4.322028164832128	0.0	discard	40_3_in_5	Parallel run loop
auto	4.3910382976171745	0.0	discard	41_3_in_5	Parallel run loop
auto	2.9004478560858455	0.0	discard	19_3_in_5	Parallel run loop
auto	3.1095685217839386	0.0	keep	22_3_in_5	Parallel run loop
auto	4.811329487167819	0.0	discard	35_3_in_4	Parallel run loop
auto	3.9449955161265993	0.0	discard	34_3_in_5	Parallel run loop
auto	3.21137774483549	0.0	discard	23_3_in_5	Parallel run loop
auto	4.8961953896097095	0.0	discard	36_3_in_4	Parallel run loop
auto	2.3747893232898063	0.0	discard	13_3_in_5	Parallel run loop
auto	2.646903732552547	0.0	discard	16_3_in_5	Parallel run loop
auto	5.227520108442469	0.0	discard	40_3_in_4	Parallel run loop
auto	5.145927994132565	0.0	discard	39_3_in_4	Parallel run loop
auto	4.037484758073915	0.0	discard	25_3_in_4	Parallel run loop
auto	4.120996670385742	0.0	discard	37_3_in_5	Parallel run loop
auto	2.7332362972304676	0.0	discard	17_3_in_5	Parallel run loop
auto	2.556240908940907	0.0	discard	15_3_in_5	Parallel run loop
auto	4.1991174496793	0.0	discard	27_3_in_4	Parallel run loop
auto	4.274384507199736	0.0	discard	39_3_in_5	Parallel run loop
auto	4.1122120039621315	0.0	discard	26_3_in_4	Parallel run loop
auto	3.688914389065927	0.0	discard	30_3_in_5	Parallel run loop
auto	3.625531319310634	0.0	discard	29_3_in_5	Parallel run loop
auto	4.6502114301125435	0.0	discard	45_3_in_5	Parallel run loop
auto	4.051707758055518	0.0	discard	36_3_in_5	Parallel run loop
auto	3.5586333356390942	0.0	discard	28_3_in_5	Parallel run loop
auto	2.4682957817229414	0.0	discard	14_3_in_5	Parallel run loop
auto	3.8716498857127517	0.0	discard	33_3_in_5	Parallel run loop
auto	4.8412354199467735	0.0	discard	47_3_in_5	Parallel run loop
auto	3.8074437925372813	0.0	discard	32_3_in_5	Parallel run loop
auto	4.534513416534669	0.0	discard	44_3_in_5	Parallel run loop
auto	1.6127718256411632	0.0	discard	6_3_in_5	Parallel run loop
auto	4.81693291261548	0.0	discard	35_3_in_4	Parallel run loop
auto	4.995960901742871	0.0	discard	37_3_in_4	Parallel run loop
auto	4.423262093203331	0.0	discard	41_3_in_5	Parallel run loop
auto	4.357610394065006	0.0	discard	40_3_in_5	Parallel run loop
auto	4.708263090601348	0.0	keep	34_3_in_4	Parallel run loop
auto	3.139236495011584	0.0	discard	22_3_in_5	Parallel run loop
auto	5.2346441625634	0.0	discard	40_3_in_4	Parallel run loop
auto	2.8997676252224984	0.0	discard	19_3_in_5	Parallel run loop
auto	5.841859196287362	0.0	discard	47_3_in_4	Parallel run loop
auto	4.926245872172347	0.0	discard	36_3_in_4	Parallel run loop
auto	2.377100619698222	0.0	discard	13_3_in_5	Parallel run loop
auto	3.065224121519522	0.0	discard	21_3_in_5	Parallel run loop
auto	2.9857740741981713	0.0	discard	20_3_in_5	Parallel run loop
auto	3.4954626729440252	0.0	discard	19_3_in_4	Parallel run loop
auto	5.6823724933020054	0.0	discard	45_3_in_4	Parallel run loop
auto	5.576003679685058	0.0	discard	44_3_in_4	Parallel run loop
auto	5.091176834155003	0.0	discard	50_3_in_5	Parallel run loop
auto	4.571754177952527	0.0	discard	43_3_in_5	Parallel run loop
auto	2.183272185232998	0.0	discard	11_3_in_5	Parallel run loop
auto	3.559068443976086	0.0	discard	28_3_in_5	Parallel run loop
auto	4.52161941161136	0.0	discard	42_3_in_5	Parallel run loop
auto	2.5593034171663978	0.0	discard	15_3_in_5	Parallel run loop
auto	5.321536985230072	0.0	discard	41_3_in_4	Parallel run loop
auto	4.357889060366392	0.0	discard	29_3_in_4	Parallel run loop
auto	4.287941432631569	0.0	discard	39_3_in_5	Parallel run loop
auto	5.384226978558246	0.0	discard	42_3_in_4	Parallel run loop
auto	4.05693346694609	0.0	discard	36_3_in_5	Parallel run loop
auto	3.4164410665994436	0.0	discard	26_3_in_5	Parallel run loop
auto	3.8791878550535595	0.0	discard	33_3_in_5	Parallel run loop
auto	3.8139740294442115	0.0	discard	32_3_in_5	Parallel run loop
auto	4.5773134107863775	0.0	discard	44_3_in_5	Parallel run loop
auto	4.778728216255848	0.0	discard	48_3_in_5	Parallel run loop
auto	4.836741378202467	0.0	discard	35_3_in_4	Parallel run loop
auto	2.0818102985186773	0.0	discard	10_3_in_5	Parallel run loop
auto	4.760089981325877	0.0	discard	34_3_in_4	Parallel run loop
auto	4.444643966420363	0.0	discard	41_3_in_5	Parallel run loop
auto	3.952421238418229	0.0	discard	34_3_in_5	Parallel run loop
auto	5.888708989376692	0.0	discard	47_3_in_4	Parallel run loop
auto	3.1381202894255997	0.0	discard	22_3_in_5	Parallel run loop
auto	3.211376874412798	0.0	discard	23_3_in_5	Parallel run loop
auto	5.180182203510173	0.0	discard	39_3_in_4	Parallel run loop
auto	1.741521275772425	0.0	discard	7_3_in_5	Parallel run loop
auto	4.038774468947269	0.0	discard	25_3_in_4	Parallel run loop
auto	3.4957335539409438	0.0	discard	27_3_in_5	Parallel run loop
auto	4.750383535622116	0.0	discard	46_3_in_5	Parallel run loop
auto	1.9752341290169695	0.0	discard	9_3_in_5	Parallel run loop
auto	2.73873020026711	0.0	discard	17_3_in_5	Parallel run loop
auto	2.281826533696073	0.0	discard	12_3_in_5	Parallel run loop
auto	3.7675985038164455	0.0	discard	22_3_in_4	Parallel run loop
auto	4.211890671734769	0.0	discard	38_3_in_5	Parallel run loop
auto	4.19706920403625	0.0	discard	27_3_in_4	Parallel run loop
auto	3.384688004727031	0.0	discard	18_3_in_4	Parallel run loop
auto	2.1835890262320756	0.0	discard	11_3_in_5	Parallel run loop
auto	4.088930957799324	0.0	discard	36_3_in_5	Parallel run loop
auto	3.877229950593242	0.0	discard	33_3_in_5	Parallel run loop
auto	3.80869888520801	0.0	discard	32_3_in_5	Parallel run loop
auto	3.6915190040454995	0.0	discard	30_3_in_5	Parallel run loop
auto	3.7454415778370693	0.0	discard	31_3_in_5	Parallel run loop
auto	5.211895091100356	0.0	discard	41_3_in_4	Parallel run loop
auto	3.626262793302696	0.0	discard	29_3_in_5	Parallel run loop
auto	5.367733422128874	0.0	discard	42_3_in_4	Parallel run loop
auto	4.798340156869671	0.0	discard	48_3_in_5	Parallel run loop
auto	4.585926025370803	0.0	discard	45_3_in_5	Parallel run loop
auto	4.624608583310271	0.0	discard	44_3_in_5	Parallel run loop
auto	2.0817757187786605	0.0	discard	10_3_in_5	Parallel run loop
auto	2.4677175966007523	0.0	discard	14_3_in_5	Parallel run loop
auto	1.472517861591441	0.0	discard	5_3_in_5	Parallel run loop
auto	1.6123349394121147	0.0	discard	6_3_in_5	Parallel run loop
auto	4.43947928716964	0.0	discard	30_3_in_4	Parallel run loop
auto	4.512186640835901	0.0	discard	31_3_in_4	Parallel run loop
auto	4.2627763968866486	0.0	discard	28_3_in_4	Parallel run loop
auto	4.02400565822647	0.0	discard	35_3_in_5	Parallel run loop
auto	1.9746163232882044	0.0	discard	9_3_in_5	Parallel run loop
auto	3.492616545179251	0.0	discard	19_3_in_4	Parallel run loop
auto	4.992667436556401	0.0	discard	37_3_in_4	Parallel run loop
auto	5.499829008196363	0.0	discard	43_3_in_4	Parallel run loop
auto	4.5945660734942075	0.0	keep	46_3_in_5	Parallel run loop
auto	2.985349039456538	0.0	discard	20_3_in_5	Parallel run loop
auto	3.777311052774909	0.0	discard	22_3_in_4	Parallel run loop
auto	3.6186492125985654	0.0	discard	29_3_in_5	Parallel run loop
auto	3.063732469730793	0.0	discard	21_3_in_5	Parallel run loop
auto	5.11306980634976	0.0	discard	50_3_in_5	Parallel run loop
auto	4.203424186315758	0.0	discard	27_3_in_4	Parallel run loop
auto	3.7573873485979656	0.0	discard	31_3_in_5	Parallel run loop
auto	3.286514335165139	0.0	discard	24_3_in_5	Parallel run loop
auto	5.331766549226381	0.0	discard	41_3_in_4	Parallel run loop
auto	3.3925778915812477	0.0	discard	18_3_in_4	Parallel run loop
auto	5.430340844987876	0.0	discard	42_3_in_4	Parallel run loop
auto	2.1838226701469683	0.0	discard	11_3_in_5	Parallel run loop
auto	4.674248399981433	0.0	discard	33_3_in_4	Parallel run loop
auto	5.559387376791602	0.0	discard	44_3_in_4	Parallel run loop
auto	3.885766444387352	0.0	discard	33_3_in_5	Parallel run loop
auto	2.637895177452445	0.0	discard	16_3_in_5	Parallel run loop
auto	4.619673990233451	0.0	discard	45_3_in_5	Parallel run loop
auto	4.923446815096689	0.0	discard	48_3_in_5	Parallel run loop
auto	5.58816702200982	0.0	discard	45_3_in_4	Parallel run loop
auto	2.810650843317501	0.0	discard	18_3_in_5	Parallel run loop
auto	4.1119273558084695	0.0	discard	26_3_in_4	Parallel run loop
auto	4.499642253961491	0.0	discard	42_3_in_5	Parallel run loop
auto	5.074817362174933	0.0	discard	38_3_in_4	Parallel run loop
auto	3.35613784098603	0.0	discard	25_3_in_5	Parallel run loop
auto	4.570091587037521	0.0	discard	43_3_in_5	Parallel run loop
auto	4.260863769892116	0.0	discard	28_3_in_4	Parallel run loop
auto	5.537220782817872	0.0	discard	43_3_in_4	Parallel run loop
auto	1.9820616137883758	0.0	discard	9_3_in_5	Parallel run loop
auto	4.362319409532207	0.0	discard	29_3_in_4	Parallel run loop
auto	4.7871002244129865	0.0	discard	46_3_in_5	Parallel run loop
auto	4.133508481902109	0.0	discard	37_3_in_5	Parallel run loop
auto	3.428610567024476	0.0	discard	26_3_in_5	Parallel run loop
auto	2.3784555474371394	0.0	discard	13_3_in_5	Parallel run loop
auto	3.964072551303954	0.0	discard	34_3_in_5	Parallel run loop
auto	3.036655622875211	0.0	keep	21_3_in_5	Parallel run loop
auto	4.8163791476242315	0.0	discard	47_3_in_5	Parallel run loop
auto	5.154075676664995	0.0	discard	39_3_in_4	Parallel run loop
auto	3.21046557560715	0.0	discard	23_3_in_5	Parallel run loop
auto	1.7415212993382525	0.0	discard	7_3_in_5	Parallel run loop
auto	4.599946613045342	0.0	discard	32_3_in_4	Parallel run loop
auto	4.038070571473699	0.0	discard	25_3_in_4	Parallel run loop
auto	2.1838071181883687	0.0	discard	11_3_in_5	Parallel run loop
auto	3.9529804634461274	0.0	discard	24_3_in_4	Parallel run loop
auto	2.2811947311606984	0.0	discard	12_3_in_5	Parallel run loop
auto	2.7299729709658926	0.0	discard	17_3_in_5	Parallel run loop
auto	2.6422033699875995	0.0	discard	16_3_in_5	Parallel run loop
auto	2.856786657851975	0.0	discard	13_3_in_4	Parallel run loop
auto	4.675164889831833	0.0	discard	45_3_in_5	Parallel run loop
auto	4.283468740120903	0.0	discard	39_3_in_5	Parallel run loop
auto	3.4831861333191325	0.0	discard	27_3_in_5	Parallel run loop
auto	4.173333067771166	0.0	discard	38_3_in_5	Parallel run loop
auto	3.689105641415202	0.0	discard	30_3_in_5	Parallel run loop
auto	4.113596717522623	0.0	discard	26_3_in_4	Parallel run loop
auto	5.076672643865842	0.0	discard	38_3_in_4	Parallel run loop
auto	4.46194921009023	0.0	discard	42_3_in_5	Parallel run loop
auto	2.55915537666346	0.0	discard	15_3_in_5	Parallel run loop
auto	3.5547185508766432	0.0	discard	28_3_in_5	Parallel run loop
auto	4.282009311058472	0.0	discard	28_3_in_4	Parallel run loop
auto	2.4681880500436493	0.0	discard	14_3_in_5	Parallel run loop
auto	1.4735927714590706	0.0	discard	5_3_in_5	Parallel run loop
auto	1.6123349347551181	0.0	discard	6_3_in_5	Parallel run loop
auto	3.0528757307128376	0.0	discard	21_3_in_5	Parallel run loop
auto	4.508026176379613	0.0	discard	31_3_in_4	Parallel run loop
auto	4.019659017535461	0.0	discard	35_3_in_5	Parallel run loop
auto	4.964684335760804	0.0	discard	37_3_in_4	Parallel run loop
