commit	score	memory_gb	status	problem	description
auto	5.445689579242635	0.0	discard	23_8_in_8	Parallel run loop
auto	4.738880780683014	0.0	discard	11_6_in_5	Parallel run loop
auto	3.2939446631250693	0.0	discard	24_5_in_8	Parallel run loop
auto	6.185025339270861	0.0	discard	30_8_in_8	Parallel run loop
auto	7.073021978092495	0.0	discard	26_6_in_5	Parallel run loop
auto	3.828751125834083	0.0	discard	10_DOMINO_in_5	Parallel run loop
auto	7.021084739848574	0.0	discard	20_8_in_6	Parallel run loop
auto	4.26706542800429	0.0	discard	21_5_in_6	Parallel run loop
auto	3.7491238161458025	0.0	discard	20_6_in_8	Parallel run loop
auto	3.201035699156441	0.0	discard	22_5_in_8	Parallel run loop
auto	3.616547745836317	0.0	discard	18_5_in_CIRCLE	Parallel run loop
auto	3.509704759175081	0.0	discard	17_5_in_CIRCLE	Parallel run loop
auto	4.072528361684914	0.0	discard	23_5_in_CIRCLE	Parallel run loop
auto	5.679885998161292	0.0	discard	25_8_in_8	Parallel run loop
auto	3.7226483304039983	0.0	discard	16_5_in_6	Parallel run loop
auto	4.316151292780971	0.0	discard	17_6_in_CIRCLE	Parallel run loop
auto	5.525354288666385	0.0	discard	24_5_in_5	Parallel run loop
auto	3.0793548370246726	0.0	discard	13_5_in_CIRCLE	Parallel run loop
auto	3.9982536857362456	0.0	discard	22_5_in_CIRCLE	Parallel run loop
auto	4.77739666595167	0.0	discard	17_8_in_8	Parallel run loop
auto	5.211512366335625	0.0	discard	25_6_in_CIRCLE	Parallel run loop
auto	6.082666816508816	0.0	discard	22_6_in_DOMINO	Parallel run loop
auto	3.8008538929495774	0.0	discard	20_5_in_CIRCLE	Parallel run loop
auto	3.6577034435756794	0.0	discard	15_5_in_6	Parallel run loop
auto	2.6315066934704827	0.0	discard	7_DOMINO_in_6	Parallel run loop
auto	3.532369992899478	0.0	discard	15_DOMINO_in_CIRCLE	Parallel run loop
auto	4.455953178698011	0.0	discard	21_DOMINO_in_6	Parallel run loop
auto	4.23160540718142	0.0	discard	14_5_in_5	Parallel run loop
auto	4.574769884311197	0.0	discard	10_6_in_5	Parallel run loop
auto	2.57086553360258	0.0	discard	14_5_in_8	Parallel run loop
auto	2.757555254323801	0.0	discard	16_5_in_8	Parallel run loop
auto	3.498395495831623	0.0	discard	17_6_in_8	Parallel run loop
auto	2.8192851731777258	0.0	discard	17_5_in_8	Parallel run loop
auto	3.509704759175081	0.0	discard	17_5_in_CIRCLE	Parallel run loop
auto	4.950411303539053	0.0	discard	22_5_in_DOMINO	Parallel run loop
auto	4.480124023637546	0.0	discard	15_8_in_8	Parallel run loop
auto	5.381237089465599	0.0	discard	22_8_in_8	Parallel run loop
auto	3.1326434895629753	0.0	discard	21_5_in_8	Parallel run loop
auto	4.072528361684914	0.0	discard	23_5_in_CIRCLE	Parallel run loop
auto	5.843198846518677	0.0	discard	27_8_in_8	Parallel run loop
auto	6.42361900877598	0.0	discard	21_6_in_5	Parallel run loop
auto	5.105393906000926	0.0	discard	24_6_in_CIRCLE	Parallel run loop
auto	3.832919053395452	0.0	discard	21_6_in_8	Parallel run loop
auto	6.566008958695746	0.0	discard	22_6_in_5	Parallel run loop
auto	5.319190116042833	0.0	discard	22_6_in_6	Parallel run loop
auto	7.021084739848574	0.0	discard	20_8_in_6	Parallel run loop
auto	3.3195455222733887	0.0	discard	13_DOMINO_in_CIRCLE	Parallel run loop
auto	3.201035699156441	0.0	discard	22_5_in_8	Parallel run loop
auto	5.1860614802694025	0.0	discard	21_5_in_5	Parallel run loop
auto	3.3680008605885274	0.0	keep	25_5_in_8	Parallel run loop
auto	6.810603175471824	0.0	discard	24_6_in_5	Parallel run loop
auto	5.747359388851401	0.0	discard	26_6_in_6	Parallel run loop
auto	3.616547745836317	0.0	discard	18_5_in_CIRCLE	Parallel run loop
auto	4.929814055285817	0.0	discard	29_5_in_6	Parallel run loop
auto	2.901054354602868	0.0	discard	18_5_in_8	Parallel run loop
auto	4.697192598913602	0.0	discard	21_6_in_CIRCLE	Parallel run loop
auto	3.4223270717610794	0.0	discard	14_DOMINO_in_CIRCLE	Parallel run loop
auto	5.291310888280076	0.0	discard	27_6_in_CIRCLE	Parallel run loop
auto	6.084448783541743	0.0	discard	29_8_in_8	Parallel run loop
auto	3.9982536857362456	0.0	discard	22_5_in_CIRCLE	Parallel run loop
auto	3.2939446631250693	0.0	discard	24_5_in_8	Parallel run loop
auto	7.073021978092495	0.0	discard	26_6_in_5	Parallel run loop
auto	5.211512366335625	0.0	discard	25_6_in_CIRCLE	Parallel run loop
auto	4.316151292780971	0.0	discard	17_6_in_CIRCLE	Parallel run loop
auto	3.828751125834083	0.0	discard	10_DOMINO_in_5	Parallel run loop
auto	3.5015432852757242	0.0	discard	8_DOMINO_in_5	Parallel run loop
auto	3.935981746673115	0.0	discard	12_DOMINO_in_DOMINO	Parallel run loop
auto	4.51418687182837	0.0	discard	14_DOMINO_in_5	Parallel run loop
auto	3.5883031545498194	0.0	discard	13_DOMINO_in_6	Parallel run loop
auto	4.26706542800429	0.0	discard	21_5_in_6	Parallel run loop
auto	5.81136683395832	0.0	discard	22_DOMINO_in_5	Parallel run loop
auto	4.738880780683014	0.0	discard	11_6_in_5	Parallel run loop
auto	3.7226483304039983	0.0	discard	16_5_in_6	Parallel run loop
auto	5.525354288666385	0.0	discard	24_5_in_5	Parallel run loop
auto	3.2668521998149376	0.0	discard	23_5_in_8	Parallel run loop
auto	2.57086553360258	0.0	discard	14_5_in_8	Parallel run loop
auto	4.974408251907489	0.0	discard	30_5_in_6	Parallel run loop
auto	2.8192851731777258	0.0	discard	17_5_in_8	Parallel run loop
auto	4.455507583380141	0.0	discard	21_DOMINO_in_6	Parallel run loop
auto	3.7491238161458025	0.0	discard	20_6_in_8	Parallel run loop
auto	3.5163051105935637	0.0	discard	27_5_in_8	Parallel run loop
auto	4.929814055285817	0.0	discard	29_5_in_6	Parallel run loop
auto	5.445689579242635	0.0	discard	23_8_in_8	Parallel run loop
auto	5.381237089465599	0.0	discard	22_8_in_8	Parallel run loop
auto	5.679885998161292	0.0	discard	25_8_in_8	Parallel run loop
auto	3.582215248748605	0.0	discard	28_5_in_8	Parallel run loop
auto	6.082666816508816	0.0	discard	22_6_in_DOMINO	Parallel run loop
auto	3.8008538929495774	0.0	discard	20_5_in_CIRCLE	Parallel run loop
auto	6.42361900877598	0.0	discard	21_6_in_5	Parallel run loop
auto	4.1296632942495055	0.0	discard	24_5_in_CIRCLE	Parallel run loop
auto	3.616547745836317	0.0	discard	18_5_in_CIRCLE	Parallel run loop
auto	6.928203614427568	0.0	discard	25_6_in_5	Parallel run loop
auto	3.532369992899478	0.0	discard	15_DOMINO_in_CIRCLE	Parallel run loop
auto	4.480124023637546	0.0	discard	15_8_in_8	Parallel run loop
auto	6.185025339270861	0.0	discard	30_8_in_8	Parallel run loop
auto	3.3680008605885274	0.0	discard	25_5_in_8	Parallel run loop
auto	3.9982536857362456	0.0	discard	22_5_in_CIRCLE	Parallel run loop
auto	4.950411303539053	0.0	discard	22_5_in_DOMINO	Parallel run loop
auto	2.901054354602868	0.0	discard	18_5_in_8	Parallel run loop
auto	5.105393906000926	0.0	discard	24_6_in_CIRCLE	Parallel run loop
auto	5.747359388851401	0.0	discard	26_6_in_6	Parallel run loop
auto	5.705107689893281	0.0	discard	26_5_in_5	Parallel run loop
auto	4.42567836789445	0.0	discard	23_5_in_6	Parallel run loop
auto	5.319190116042833	0.0	discard	22_6_in_6	Parallel run loop
auto	6.566008958695746	0.0	discard	22_6_in_5	Parallel run loop
auto	2.6315066934704827	0.0	discard	7_DOMINO_in_6	Parallel run loop
auto	3.6908186161581833	0.0	discard	14_DOMINO_in_6	Parallel run loop
auto	3.935981746673115	0.0	discard	12_DOMINO_in_DOMINO	Parallel run loop
auto	3.3195455222733887	0.0	discard	13_DOMINO_in_CIRCLE	Parallel run loop
auto	3.4223270717610794	0.0	discard	14_DOMINO_in_CIRCLE	Parallel run loop
auto	4.23160540718142	0.0	discard	14_5_in_5	Parallel run loop
auto	3.1326434895629753	0.0	discard	21_5_in_8	Parallel run loop
auto	4.557313734756144	0.0	keep	22_DOMINO_in_6	Parallel run loop
auto	6.810603175471824	0.0	discard	24_6_in_5	Parallel run loop
auto	4.455507583380141	0.0	discard	21_DOMINO_in_6	Parallel run loop
auto	5.445689579242635	0.0	discard	23_8_in_8	Parallel run loop
auto	3.201035699156441	0.0	discard	22_5_in_8	Parallel run loop
auto	5.1860614802694025	0.0	discard	21_5_in_5	Parallel run loop
auto	3.832919053395452	0.0	discard	21_6_in_8	Parallel run loop
auto	4.697192598913602	0.0	discard	21_6_in_CIRCLE	Parallel run loop
auto	7.073021978092495	0.0	discard	26_6_in_5	Parallel run loop
auto	6.084448783541743	0.0	discard	29_8_in_8	Parallel run loop
auto	3.2939446631250693	0.0	discard	24_5_in_8	Parallel run loop
auto	5.843198846518677	0.0	discard	27_8_in_8	Parallel run loop
auto	5.211512366335625	0.0	discard	25_6_in_CIRCLE	Parallel run loop
auto	4.26706542800429	0.0	discard	21_5_in_6	Parallel run loop
auto	5.291310888280076	0.0	discard	27_6_in_CIRCLE	Parallel run loop
auto	3.8941082611544644	0.0	keep	16_DOMINO_in_6	Parallel run loop
auto	3.624672718769662	0.0	keep	29_5_in_8	Parallel run loop
auto	5.679885998161292	0.0	discard	25_8_in_8	Parallel run loop
auto	6.928203614427568	0.0	discard	25_6_in_5	Parallel run loop
auto	3.616547745836317	0.0	discard	18_5_in_CIRCLE	Parallel run loop
auto	4.12471042296586	0.0	discard	24_5_in_CIRCLE	Parallel run loop
auto	4.51418687182837	0.0	discard	14_DOMINO_in_5	Parallel run loop
auto	3.7226483304039983	0.0	discard	16_5_in_6	Parallel run loop
auto	6.185025339270861	0.0	discard	30_8_in_8	Parallel run loop
auto	4.072121108848746	0.0	discard	23_5_in_CIRCLE	Parallel run loop
auto	3.2668521998149376	0.0	discard	23_5_in_8	Parallel run loop
auto	3.582215248748605	0.0	discard	28_5_in_8	Parallel run loop
auto	3.5163051105935637	0.0	discard	27_5_in_8	Parallel run loop
auto	4.738880780683014	0.0	discard	11_6_in_5	Parallel run loop
auto	3.9982536857362456	0.0	discard	22_5_in_CIRCLE	Parallel run loop
auto	3.7491238161458025	0.0	discard	20_6_in_8	Parallel run loop
auto	3.828751125834083	0.0	discard	10_DOMINO_in_5	Parallel run loop
auto	2.6315066934704827	0.0	discard	7_DOMINO_in_6	Parallel run loop
auto	3.532369992899478	0.0	discard	15_DOMINO_in_CIRCLE	Parallel run loop
auto	4.950411303539053	0.0	discard	22_5_in_DOMINO	Parallel run loop
auto	4.142528358899169	0.0	discard	12_DOMINO_in_5	Parallel run loop
auto	2.901054354602868	0.0	discard	18_5_in_8	Parallel run loop
auto	2.8192851731777258	0.0	discard	17_5_in_8	Parallel run loop
auto	3.6508051620464856	0.0	keep	14_DOMINO_in_6	Parallel run loop
auto	5.381237089465599	0.0	discard	22_8_in_8	Parallel run loop
auto	5.525354288666385	0.0	discard	24_5_in_5	Parallel run loop
auto	3.7667670323305202	0.0	discard	31_5_in_8	Parallel run loop
auto	3.3835587963854876	0.0	discard	25_5_in_8	Parallel run loop
auto	4.974408251907489	0.0	discard	30_5_in_6	Parallel run loop
auto	5.1860614802694025	0.0	discard	21_5_in_5	Parallel run loop
auto	6.082666816508816	0.0	discard	22_6_in_DOMINO	Parallel run loop
auto	4.42567836789445	0.0	discard	23_5_in_6	Parallel run loop
auto	6.810603175471824	0.0	discard	24_6_in_5	Parallel run loop
auto	3.1326434895629753	0.0	discard	21_5_in_8	Parallel run loop
auto	5.747359388851401	0.0	discard	26_6_in_6	Parallel run loop
auto	5.319190116042833	0.0	discard	22_6_in_6	Parallel run loop
auto	3.624672718769662	0.0	discard	29_5_in_8	Parallel run loop
auto	6.300619479013313	0.0	discard	32_6_in_6	Parallel run loop
auto	6.624822374397423	0.0	discard	29_DOMINO_in_5	Parallel run loop
auto	6.566008958695746	0.0	discard	22_6_in_5	Parallel run loop
auto	4.23160540718142	0.0	discard	14_5_in_5	Parallel run loop
auto	7.178978529661767	0.0	discard	27_6_in_5	Parallel run loop
auto	3.941121425788697	0.0	discard	16_DOMINO_in_6	Parallel run loop
auto	5.705107689893281	0.0	discard	26_5_in_5	Parallel run loop
auto	5.843198846518677	0.0	discard	27_8_in_8	Parallel run loop
auto	6.42361900877598	0.0	discard	21_6_in_5	Parallel run loop
auto	3.832919053395452	0.0	discard	21_6_in_8	Parallel run loop
auto	3.3195455222733887	0.0	discard	13_DOMINO_in_CIRCLE	Parallel run loop
auto	4.697192598913602	0.0	discard	21_6_in_CIRCLE	Parallel run loop
auto	3.4223270717610794	0.0	discard	14_DOMINO_in_CIRCLE	Parallel run loop
auto	6.185025339270861	0.0	discard	30_8_in_8	Parallel run loop
auto	4.072528361684914	0.0	discard	23_5_in_CIRCLE	Parallel run loop
auto	6.084448783541743	0.0	discard	29_8_in_8	Parallel run loop
auto	4.441477536678243	0.0	discard	16_5_in_5	Parallel run loop
auto	7.073021978092495	0.0	discard	26_6_in_5	Parallel run loop
auto	5.679885998161292	0.0	discard	25_8_in_8	Parallel run loop
auto	5.291310888280076	0.0	discard	27_6_in_CIRCLE	Parallel run loop
auto	3.2939446631250693	0.0	discard	24_5_in_8	Parallel run loop
auto	3.828751125834083	0.0	discard	10_DOMINO_in_5	Parallel run loop
auto	4.51418687182837	0.0	discard	14_DOMINO_in_5	Parallel run loop
auto	4.738880780683014	0.0	discard	11_6_in_5	Parallel run loop
auto	3.935981746673115	0.0	discard	12_DOMINO_in_DOMINO	Parallel run loop
auto	3.532369992899478	0.0	discard	15_DOMINO_in_CIRCLE	Parallel run loop
auto	3.9982536857362456	0.0	discard	22_5_in_CIRCLE	Parallel run loop
auto	4.1296632942495055	0.0	discard	24_5_in_CIRCLE	Parallel run loop
auto	3.5163051105935637	0.0	discard	27_5_in_8	Parallel run loop
auto	5.525354288666385	0.0	discard	24_5_in_5	Parallel run loop
auto	3.3835587963854876	0.0	discard	25_5_in_8	Parallel run loop
auto	3.582215248748605	0.0	discard	28_5_in_8	Parallel run loop
auto	6.300619479013313	0.0	discard	32_6_in_6	Parallel run loop
auto	5.705107689893281	0.0	discard	26_5_in_5	Parallel run loop
auto	5.445689579242635	0.0	discard	23_8_in_8	Parallel run loop
auto	5.843198846518677	0.0	discard	27_8_in_8	Parallel run loop
auto	5.425165163298882	0.0	discard	23_6_in_6	Parallel run loop
auto	4.142528358899169	0.0	discard	12_DOMINO_in_5	Parallel run loop
auto	3.624672718769662	0.0	discard	29_5_in_8	Parallel run loop
auto	4.23160540718142	0.0	discard	14_5_in_5	Parallel run loop
auto	5.319190116042833	0.0	discard	22_6_in_6	Parallel run loop
auto	4.42567836789445	0.0	discard	23_5_in_6	Parallel run loop
auto	6.082666816508816	0.0	discard	22_6_in_DOMINO	Parallel run loop
auto	4.974408251907489	0.0	discard	30_5_in_6	Parallel run loop
auto	6.624822374397423	0.0	discard	29_DOMINO_in_5	Parallel run loop
auto	5.747359388851401	0.0	discard	26_6_in_6	Parallel run loop
auto	5.310294973685477	0.0	discard	20_DOMINO_in_5	Parallel run loop
auto	3.616547745836317	0.0	discard	18_5_in_CIRCLE	Parallel run loop
auto	5.746679693947278	0.0	discard	27_6_in_6	Parallel run loop
auto	3.7667670323305202	0.0	discard	31_5_in_8	Parallel run loop
auto	7.178978529661767	0.0	discard	27_6_in_5	Parallel run loop
auto	6.928203614427568	0.0	discard	25_6_in_5	Parallel run loop
auto	5.86850539428139	0.0	discard	28_8_in_8	Parallel run loop
auto	4.736978747103675	0.0	discard	16_DOMINO_in_5	Parallel run loop
auto	6.084448783541743	0.0	discard	29_8_in_8	Parallel run loop
auto	7.073021978092495	0.0	discard	26_6_in_5	Parallel run loop
auto	5.1860614802694025	0.0	discard	21_5_in_5	Parallel run loop
auto	6.810603175471824	0.0	discard	24_6_in_5	Parallel run loop
auto	4.441477536678243	0.0	discard	16_5_in_5	Parallel run loop
auto	4.072121108848746	0.0	discard	23_5_in_CIRCLE	Parallel run loop
auto	3.828751125834083	0.0	discard	10_DOMINO_in_5	Parallel run loop
auto	4.142528358899169	0.0	discard	12_DOMINO_in_5	Parallel run loop
auto	4.51418687182837	0.0	discard	14_DOMINO_in_5	Parallel run loop
auto	3.4223270717610794	0.0	discard	14_DOMINO_in_CIRCLE	Parallel run loop
auto	3.532369992899478	0.0	discard	15_DOMINO_in_CIRCLE	Parallel run loop
auto	5.210507290831572	0.0	discard	18_DOMINO_in_5	Parallel run loop
auto	3.2939446631250693	0.0	discard	24_5_in_8	Parallel run loop
auto	3.832845383043779	0.0	discard	18_DOMINO_in_CIRCLE	Parallel run loop
auto	5.425165163298882	0.0	discard	23_6_in_6	Parallel run loop
auto	5.310294973685477	0.0	discard	20_DOMINO_in_5	Parallel run loop
auto	3.624672718769662	0.0	discard	29_5_in_8	Parallel run loop
auto	5.747359388851401	0.0	discard	26_6_in_6	Parallel run loop
auto	5.291310888280076	0.0	discard	27_6_in_CIRCLE	Parallel run loop
auto	3.9982536857362456	0.0	discard	22_5_in_CIRCLE	Parallel run loop
auto	4.626301058318689	0.0	discard	19_6_in_6	Parallel run loop
auto	4.697192598913602	0.0	discard	21_6_in_CIRCLE	Parallel run loop
auto	6.300619479013313	0.0	discard	32_6_in_6	Parallel run loop
auto	3.8788167176520854	0.0	keep	19_DOMINO_in_CIRCLE	Parallel run loop
auto	5.525354288666385	0.0	discard	24_5_in_5	Parallel run loop
auto	5.916404951696938	0.0	discard	23_DOMINO_in_5	Parallel run loop
auto	6.624822374397423	0.0	discard	29_DOMINO_in_5	Parallel run loop
auto	6.082666816508816	0.0	discard	22_6_in_DOMINO	Parallel run loop
auto	5.843198846518677	0.0	discard	27_8_in_8	Parallel run loop
auto	6.185025339270861	0.0	discard	30_8_in_8	Parallel run loop
auto	3.4490256687014904	0.0	discard	26_5_in_8	Parallel run loop
auto	4.974408251907489	0.0	discard	30_5_in_6	Parallel run loop
auto	5.746679693947278	0.0	discard	27_6_in_6	Parallel run loop
auto	3.6720870606044564	0.0	discard	19_5_in_CIRCLE	Parallel run loop
auto	3.616547745836317	0.0	discard	18_5_in_CIRCLE	Parallel run loop
auto	4.124297951923563	0.0	discard	24_5_in_CIRCLE	Parallel run loop
auto	4.42567836789445	0.0	discard	23_5_in_6	Parallel run loop
auto	5.705107689893281	0.0	discard	26_5_in_5	Parallel run loop
auto	6.084448783541743	0.0	discard	29_8_in_8	Parallel run loop
auto	6.810603175471824	0.0	discard	24_6_in_5	Parallel run loop
auto	4.736978747103675	0.0	discard	16_DOMINO_in_5	Parallel run loop
auto	3.5764417535910717	0.0	discard	25_DOMINO_in_8	Parallel run loop
auto	3.659026073253804	0.0	discard	16_DOMINO_in_CIRCLE	Parallel run loop
auto	6.928203614427568	0.0	discard	25_6_in_5	Parallel run loop
auto	7.178978529661767	0.0	discard	27_6_in_5	Parallel run loop
auto	5.86850539428139	0.0	discard	28_8_in_8	Parallel run loop
auto	2.0051996327521553	0.0	keep	7_DOMINO_in_8	Parallel run loop
auto	4.51418687182837	0.0	discard	14_DOMINO_in_5	Parallel run loop
auto	4.107409157480664	0.0	discard	23_5_in_CIRCLE	Parallel run loop
auto	4.142528358899169	0.0	discard	12_DOMINO_in_5	Parallel run loop
auto	3.9373484195098065	0.0	discard	19_DOMINO_in_CIRCLE	Parallel run loop
auto	4.42567836789445	0.0	discard	23_5_in_6	Parallel run loop
auto	3.9982536857362456	0.0	discard	22_5_in_CIRCLE	Parallel run loop
auto	5.916404951696938	0.0	discard	23_DOMINO_in_5	Parallel run loop
auto	5.310294973685477	0.0	discard	20_DOMINO_in_5	Parallel run loop
auto	4.12471042296586	0.0	discard	24_5_in_CIRCLE	Parallel run loop
auto	4.736978747103675	0.0	discard	16_DOMINO_in_5	Parallel run loop
auto	3.641260813961986	0.0	discard	29_5_in_8	Parallel run loop
auto	6.928203614427568	0.0	discard	25_6_in_5	Parallel run loop
auto	6.2814449776191115	0.0	keep	29_DOMINO_in_5	Parallel run loop
auto	2.198224030578895	0.0	discard	9_DOMINO_in_8	Parallel run loop
auto	3.5764417535910717	0.0	discard	25_DOMINO_in_8	Parallel run loop
auto	3.832845383043779	0.0	discard	18_DOMINO_in_CIRCLE	Parallel run loop
auto	4.974408251907489	0.0	discard	30_5_in_6	Parallel run loop
auto	7.178978529661767	0.0	discard	27_6_in_5	Parallel run loop
auto	6.129498684047866	0.0	discard	28_8_in_8	Parallel run loop
auto	5.291310888280076	0.0	discard	27_6_in_CIRCLE	Parallel run loop
auto	4.626301058318689	0.0	discard	19_6_in_6	Parallel run loop
auto	3.659026073253804	0.0	discard	16_DOMINO_in_CIRCLE	Parallel run loop
auto	5.425165163298882	0.0	discard	23_6_in_6	Parallel run loop
auto	5.705107689893281	0.0	discard	26_5_in_5	Parallel run loop
auto	2.324171944271372	0.0	discard	10_DOMINO_in_8	Parallel run loop
auto	6.300619479013313	0.0	discard	32_6_in_6	Parallel run loop
auto	3.6720870606044564	0.0	discard	19_5_in_CIRCLE	Parallel run loop
auto	4.441477536678243	0.0	discard	16_5_in_5	Parallel run loop
auto	3.616547745836317	0.0	discard	18_5_in_CIRCLE	Parallel run loop
auto	3.9095319593326012	0.0	discard	21_5_in_CIRCLE	Parallel run loop
auto	5.746679693947278	0.0	discard	27_6_in_6	Parallel run loop
auto	4.142528358899169	0.0	discard	12_DOMINO_in_5	Parallel run loop
auto	5.280847385875782	0.0	keep	20_DOMINO_in_5	Parallel run loop
auto	4.542752912493154	0.0	keep	22_DOMINO_in_6	Parallel run loop
auto	2.847707045129096	0.0	discard	15_DOMINO_in_8	Parallel run loop
auto	5.857240902179969	0.0	discard	23_DOMINO_in_5	Parallel run loop
auto	2.93656857296528	0.0	discard	9_DOMINO_in_6	Parallel run loop
auto	4.439495793991655	0.0	keep	21_DOMINO_in_6	Parallel run loop
auto	3.9373484195098065	0.0	discard	19_DOMINO_in_CIRCLE	Parallel run loop
auto	3.365213031051526	0.0	discard	21_DOMINO_in_8	Parallel run loop
auto	2.443470535936834	0.0	discard	6_DOMINO_in_6	Parallel run loop
auto	2.0051996327521553	0.0	discard	7_DOMINO_in_8	Parallel run loop
auto	2.198224030578895	0.0	discard	9_DOMINO_in_8	Parallel run loop
auto	2.6315066934704827	0.0	discard	7_DOMINO_in_6	Parallel run loop
auto	4.626301058318689	0.0	discard	19_6_in_6	Parallel run loop
auto	2.480039806457236	0.0	discard	11_DOMINO_in_8	Parallel run loop
auto	4.919315485918929	0.0	discard	16_DOMINO_in_5	Parallel run loop
auto	3.7741752302989555	0.0	discard	15_DOMINO_in_6	Parallel run loop
auto	6.624822374397423	0.0	discard	29_DOMINO_in_5	Parallel run loop
auto	4.1296632942495055	0.0	discard	24_5_in_CIRCLE	Parallel run loop
auto	3.659026073253804	0.0	discard	16_DOMINO_in_CIRCLE	Parallel run loop
auto	2.324171944271372	0.0	discard	10_DOMINO_in_8	Parallel run loop
auto	7.178978529661767	0.0	discard	27_6_in_5	Parallel run loop
auto	3.893718850328349	0.0	keep	16_DOMINO_in_6	Parallel run loop
auto	2.6915521371235593	0.0	discard	8_DOMINO_in_CIRCLE	Parallel run loop
auto	6.300619479013313	0.0	discard	32_6_in_6	Parallel run loop
auto	3.9095319593326012	0.0	discard	21_5_in_CIRCLE	Parallel run loop
auto	5.746679693947278	0.0	discard	27_6_in_6	Parallel run loop
auto	4.558228051991228	0.0	discard	16_6_in_6	Parallel run loop
auto	7.812784092602333	0.0	discard	32_6_in_5	Parallel run loop
auto	5.29283928885952	0.0	discard	20_DOMINO_in_5	Parallel run loop
auto	4.904537362780794	0.0	discard	21_5_in_DOMINO	Parallel run loop
auto	4.569815862524372	0.0	discard	18_5_in_DOMINO	Parallel run loop
auto	3.6508051620464856	0.0	discard	14_DOMINO_in_6	Parallel run loop
auto	5.425165163298882	0.0	discard	23_6_in_6	Parallel run loop
auto	4.441477536678243	0.0	discard	16_5_in_5	Parallel run loop
auto	4.882630265799585	0.0	discard	19_DOMINO_in_DOMINO	Parallel run loop
auto	3.9373484195098065	0.0	discard	19_DOMINO_in_CIRCLE	Parallel run loop
auto	3.6720870606044564	0.0	discard	19_5_in_CIRCLE	Parallel run loop
