commit	score	memory_gb	status	problem	description
auto	3.1860393694450497	0.0	discard	11_DOMINO_in_CIRCLE	Parallel run loop
auto	8.382506079934158	0.0	discard	22_8_in_DOMINO	Parallel run loop
auto	4.309862100185108	0.0	discard	16_5_in_DOMINO	Parallel run loop
auto	5.8434126687983206	0.0	discard	20_6_in_DOMINO	Parallel run loop
auto	5.949837118888085	0.0	discard	28_6_in_6	Parallel run loop
auto	4.843428274429765	0.0	discard	33_4_in_5	Parallel run loop
auto	12.910495881561323	0.0	discard	33_5_in_3	Parallel run loop
auto	3.9493073634468594	0.0	discard	11_6_in_6	Parallel run loop
auto	7.812784092602333	0.0	discard	32_6_in_5	Parallel run loop
auto	12.261313043390997	0.0	discard	27_DOMINO_in_3	Parallel run loop
auto	5.302443940088193	0.0	discard	22_5_in_5	Parallel run loop
auto	6.3086008314667135	0.0	discard	10_8_in_5	Parallel run loop
auto	7.676416747555321	0.0	discard	31_6_in_5	Parallel run loop
auto	5.693379391606711	0.0	discard	19_6_in_DOMINO	Parallel run loop
auto	4.569815862524372	0.0	discard	18_5_in_DOMINO	Parallel run loop
auto	5.9728961010757065	0.0	discard	14_DOMINO_in_4	Parallel run loop
auto	5.384931350321754	0.0	discard	23_5_in_5	Parallel run loop
auto	2.4007400073217737	0.0	discard	12_5_in_8	Parallel run loop
auto	6.281350871924349	0.0	discard	20_6_in_5	Parallel run loop
auto	7.160232969366078	0.0	discard	16_8_in_DOMINO	Parallel run loop
auto	6.835647451099712	0.0	discard	19_DOMINO_in_4	Parallel run loop
auto	3.8369336484278946	0.0	discard	13_6_in_CIRCLE	Parallel run loop
auto	11.78013726824729	0.0	discard	25_DOMINO_in_3	Parallel run loop
auto	14.05678443804131	0.0	discard	39_5_in_3	Parallel run loop
auto	2.803879883664299	0.0	discard	9_DOMINO_in_CIRCLE	Parallel run loop
auto	2.9559621946049712	0.0	discard	10_DOMINO_in_CIRCLE	Parallel run loop
auto	8.651091643465453	0.0	discard	13_DOMINO_in_3	Parallel run loop
auto	3.759141572791398	0.0	discard	17_DOMINO_in_CIRCLE	Parallel run loop
auto	6.497991980936347	0.0	discard	11_8_in_5	Parallel run loop
auto	4.75127218611163	0.0	discard	10_8_in_CIRCLE	Parallel run loop
auto	12.059293801707227	0.0	discard	24_DOMINO_in_3	Parallel run loop
auto	12.261313043390997	0.0	discard	27_DOMINO_in_3	Parallel run loop
auto	5.790189669490146	0.0	discard	13_8_in_6	Parallel run loop
auto	4.475245630635559	0.0	discard	15_6_in_6	Parallel run loop
auto	5.102893955208136	0.0	discard	20_8_in_8	Parallel run loop
auto	4.697834635053744	0.0	discard	19_5_in_DOMINO	Parallel run loop
auto	12.910495881561323	0.0	discard	33_5_in_3	Parallel run loop
auto	4.882630265799585	0.0	discard	19_DOMINO_in_DOMINO	Parallel run loop
auto	4.904537362780794	0.0	discard	21_5_in_DOMINO	Parallel run loop
auto	8.102774853359481	0.0	discard	20_8_in_DOMINO	Parallel run loop
auto	6.2478639807772485	0.0	discard	16_8_in_6	Parallel run loop
auto	4.558228051991228	0.0	discard	16_6_in_6	Parallel run loop
auto	4.885880125978864	0.0	discard	33_4_in_5	Parallel run loop
auto	11.10639567382138	0.0	discard	22_DOMINO_in_3	Parallel run loop
auto	13.884493816920813	0.0	discard	38_5_in_3	Parallel run loop
auto	5.994170884047151	0.0	discard	9_8_in_5	Parallel run loop
auto	4.8203042879733635	0.0	discard	20_5_in_DOMINO	Parallel run loop
auto	2.6915521371235593	0.0	discard	8_DOMINO_in_CIRCLE	Parallel run loop
auto	11.960108969580684	0.0	discard	18_6_in_3	Parallel run loop
auto	5.777467632032182	0.0	discard	26_8_in_8	Parallel run loop
auto	5.663881359656193	0.0	discard	25_6_in_6	Parallel run loop
auto	13.820493131853882	0.0	discard	25_6_in_3	Parallel run loop
auto	6.3086008314667135	0.0	discard	10_8_in_5	Parallel run loop
auto	3.827281560659983	0.0	discard	11_DOMINO_in_DOMINO	Parallel run loop
auto	12.771121686878123	0.0	discard	32_5_in_3	Parallel run loop
auto	4.569815862524372	0.0	discard	18_5_in_DOMINO	Parallel run loop
auto	12.261313043390997	0.0	discard	27_DOMINO_in_3	Parallel run loop
auto	2.4195050032821817	0.0	discard	22_3_in_DOMINO	Parallel run loop
auto	14.05678443804131	0.0	discard	39_5_in_3	Parallel run loop
auto	7.812784092602333	0.0	discard	32_6_in_5	Parallel run loop
auto	5.8434126687983206	0.0	discard	20_6_in_DOMINO	Parallel run loop
auto	6.0953254095291225	0.0	discard	19_8_in_CIRCLE	Parallel run loop
auto	4.309862100185108	0.0	discard	16_5_in_DOMINO	Parallel run loop
auto	2.6447738834161796	0.0	discard	9_6_in_8	Parallel run loop
auto	5.949837118888085	0.0	discard	28_6_in_6	Parallel run loop
auto	4.409839693042728	0.0	discard	17_5_in_DOMINO	Parallel run loop
auto	3.2342712519580337	0.0	discard	12_DOMINO_in_CIRCLE	Parallel run loop
auto	3.1860393694450497	0.0	discard	11_DOMINO_in_CIRCLE	Parallel run loop
auto	3.9493073634468594	0.0	discard	11_6_in_6	Parallel run loop
auto	10.95333223592899	0.0	discard	21_DOMINO_in_3	Parallel run loop
auto	2.5069731037578142	0.0	discard	13_5_in_8	Parallel run loop
auto	13.820493131853882	0.0	discard	25_6_in_3	Parallel run loop
auto	1.401399818648565	0.0	keep	6_TAN_in_DOMINO	Auto run attempts=50
auto	1.3368758283548057	0.0	keep	6_TAN_in_DOMINO	Auto run attempts=500
auto	0.9585657974618701	0.0	keep	6_TAN_in_8	Auto run attempts=500
auto	4.95506179472005	0.0	keep	6_L_in_4	Auto run attempts=50
auto	3.0013166125544877	0.0	keep	2_L_in_4	Auto run attempts=20
auto	7.009349846310128	0.0	keep	6_L_in_TAN	Auto run attempts=50
auto	1.1484906287640406	0.0	keep	6_TAN_in_L	Auto run attempts=100
auto	3.8859119431539417	0.0	keep	6_8_in_L	Auto run attempts=100
auto	2.3660505917044126	0.0	keep	4_3_in_tan	Parallel run loop
auto	3.5355440385160137	0.0	keep	4_4_in_tan	Parallel run loop
auto	4.000013294015053	0.0	keep	5_4_in_tan	Parallel run loop
auto	4.633426754255851	0.0	keep	4_5_in_TAN	Parallel run loop
auto	5.750996554085433	0.0	keep	4_6_in_TAN	Parallel run loop
auto	0.9428131770575349	0.0	keep	2_TAN_in_DOMINO	Parallel run loop
auto	6.502770442991866	0.0	keep	5_6_in_TAN	Parallel run loop
auto	8.692190453140515	0.0	keep	8_CIRCLE_in_TAN	Parallel run loop
auto	5.165304032569934	0.0	keep	5_5_in_TAN	Parallel run loop
auto	2.539171130737929	0.0	keep	5_3_in_tan	Parallel run loop
auto	0.926783634788641	0.0	keep	3_tan_in_cir	Parallel run loop
auto	0.7886759730374461	0.0	keep	2_TAN_in_6	Parallel run loop
auto	4.828605706475182	0.0	keep	4_DOMINO_in_TAN	Parallel run loop
auto	0.9368619773715136	0.0	keep	2_TAN_in_5	Parallel run loop
auto	0.7239009551121717	0.0	keep	3_TAN_in_8	Parallel run loop
auto	4.82921070439029	0.0	keep	8_4_in_tan	Parallel run loop
auto	8.742684287632692	0.0	keep	5_8_in_TAN	Parallel run loop
auto	6.7429962728646755	0.0	keep	6_6_in_TAN	Parallel run loop
auto	5.4824064146790965	0.0	keep	6_5_in_TAN	Parallel run loop
auto	6.037303673815075	0.0	keep	7_5_in_TAN	Parallel run loop
auto	0.9888762137653412	0.0	keep	3_TAN_in_6	Parallel run loop
auto	7.399285812321998	0.0	keep	7_6_in_TAN	Parallel run loop
auto	1.1256829428589297	0.0	keep	5_tan_in_cir	Parallel run loop
auto	10.656958373798044	0.0	keep	8_8_in_TAN	Parallel run loop
auto	8.283236519597178	0.0	keep	9_6_in_TAN	Parallel run loop
auto	1.2091887861698134	0.0	keep	6_tan_in_cir	Parallel run loop
auto	10.060099554417164	0.0	keep	11_CIRCLE_in_TAN	Parallel run loop
auto	9.949886007733342	0.0	keep	7_8_in_TAN	Parallel run loop
auto	0.8809341152377284	0.0	keep	5_TAN_in_8	Parallel run loop
auto	7.835146019226511	0.0	keep	8_6_in_TAN	Parallel run loop
auto	6.6959808625151345	0.0	keep	9_5_in_TAN	Parallel run loop
auto	12.546625092194388	0.0	keep	18_CIRCLE_in_TAN	Parallel run loop
auto	10.428129537263247	0.0	keep	12_CIRCLE_in_TAN	Parallel run loop
auto	1.0605657573909508	0.0	keep	4_TAN_in_6	Parallel run loop
auto	8.536475570780645	0.0	keep	10_6_in_TAN	Parallel run loop
auto	2.537345539752651	0.0	keep	4_TAN_in_3	Parallel run loop
auto	6.983349989737053	0.0	keep	10_5_in_TAN	Parallel run loop
auto	11.14241489605376	0.0	keep	14_CIRCLE_in_TAN	Parallel run loop
auto	6.2427324747115325	0.0	keep	7_DOMINO_in_TAN	Parallel run loop
auto	6.30717362885674	0.0	keep	8_5_in_TAN	Parallel run loop
auto	12.364253212669002	0.0	keep	11_8_in_TAN	Parallel run loop
auto	7.3575219611049025	0.0	keep	11_5_in_TAN	Parallel run loop
auto	1.2806341809933837	0.0	keep	4_TAN_in_5	Parallel run loop
auto	4.414299592203655	0.0	keep	7_4_in_tan	Parallel run loop
auto	1.2710691866826518	0.0	keep	7_tan_in_cir	Parallel run loop
auto	9.420968794476451	0.0	keep	12_6_in_TAN	Parallel run loop
auto	9.70387788182012	0.0	keep	13_6_in_TAN	Parallel run loop
auto	9.067003345140972	0.0	keep	11_6_in_TAN	Parallel run loop
auto	10.79951154399235	0.0	keep	13_CIRCLE_in_TAN	Parallel run loop
auto	11.895634001108402	0.0	keep	16_CIRCLE_in_TAN	Parallel run loop
auto	0.8231141511692444	0.0	keep	4_TAN_in_8	Parallel run loop
auto	1.1058007189045806	0.0	keep	3_TAN_in_5	Parallel run loop
auto	12.799619338927066	0.0	keep	19_CIRCLE_in_TAN	Parallel run loop
auto	10.723932220391713	0.0	keep	16_6_in_TAN	Parallel run loop
auto	10.047481814874239	0.0	keep	14_6_in_TAN	Parallel run loop
auto	8.472419234749125	0.0	keep	15_5_in_TAN	Parallel run loop
auto	8.175185534704477	0.0	keep	14_5_in_TAN	Parallel run loop
auto	5.2426949496987065	0.0	keep	5_DOMINO_in_TAN	Parallel run loop
auto	7.543686323022313	0.0	keep	12_5_in_TAN	Parallel run loop
auto	13.22099484931051	0.0	keep	13_8_in_TAN	Parallel run loop
auto	12.657086126253771	0.0	keep	12_8_in_TAN	Parallel run loop
auto	12.158105901660921	0.0	keep	17_CIRCLE_in_TAN	Parallel run loop
auto	3.0744322748224056	0.0	keep	8_3_in_tan	Parallel run loop
auto	2.6389756176142947	0.0	keep	6_3_in_tan	Parallel run loop
auto	4.953480532948613	0.0	keep	9_4_in_tan	Parallel run loop
auto	7.8334472095262315	0.0	keep	13_5_in_TAN	Parallel run loop
auto	8.920269498222936	0.0	keep	17_5_in_TAN	Parallel run loop
auto	10.34430868882364	0.0	keep	15_6_in_TAN	Parallel run loop
auto	9.64854002812037	0.0	keep	20_5_in_TAN	Parallel run loop
auto	13.57244125419423	0.0	keep	14_8_in_TAN	Parallel run loop
auto	1.3015884503782176	0.0	keep	5_TAN_in_DOMINO	Parallel run loop
auto	9.419461214920503	0.0	keep	19_5_in_TAN	Parallel run loop
auto	8.671368230469906	0.0	keep	16_5_in_TAN	Parallel run loop
auto	1.1399124299546186	0.0	keep	5_TAN_in_6	Parallel run loop
auto	11.004857006820892	0.0	keep	17_6_in_TAN	Parallel run loop
auto	11.51922073240496	0.0	keep	19_6_in_TAN	Parallel run loop
auto	13.093800411987209	0.0	keep	20_CIRCLE_in_TAN	Parallel run loop
auto	1.3312238937273968	0.0	keep	8_tan_in_cir	Parallel run loop
auto	9.100838208106136	0.0	keep	18_5_in_TAN	Parallel run loop
auto	15.691560053223977	0.0	keep	19_8_in_TAN	Parallel run loop
auto	0.9984674438594388	0.0	keep	7_TAN_in_8	Parallel run loop
auto	11.303290353085066	0.0	keep	18_6_in_TAN	Parallel run loop
auto	11.84901763109908	0.0	keep	20_6_in_TAN	Parallel run loop
auto	15.362449238281346	0.0	keep	18_8_in_TAN	Parallel run loop
auto	0.9990475447325589	0.0	keep	3_TAN_in_DOMINO	Parallel run loop
auto	5.656970416589561	0.0	keep	12_4_in_tan	Parallel run loop
auto	14.780689934071507	0.0	keep	17_8_in_TAN	Parallel run loop
auto	1.6360218706327077	0.0	keep	7_TAN_in_5	Parallel run loop
auto	16.784481308537313	0.0	keep	22_8_in_TAN	Parallel run loop
auto	15.98701049064933	0.0	keep	20_8_in_TAN	Parallel run loop
auto	1.3864840695475675	0.0	keep	5_TAN_in_5	Parallel run loop
auto	5.829251457657059	0.0	keep	13_4_in_tan	Parallel run loop
auto	1.5105495647610865	0.0	keep	6_TAN_in_5	Parallel run loop
auto	5.414278697687401	0.0	keep	11_4_in_tan	Parallel run loop
auto	2.741501350357513	0.0	keep	5_TAN_in_3	Parallel run loop
auto	1.3772652545298265	0.0	keep	9_tan_in_cir	Parallel run loop
auto	3.1839953516248816	0.0	keep	9_3_in_tan	Parallel run loop
auto	6.8329913630729875	0.0	keep	9_DOMINO_in_TAN	Parallel run loop
auto	2.7901743930726672	0.0	keep	7_3_in_tan	Parallel run loop
auto	6.414429819711533	0.0	keep	8_DOMINO_in_TAN	Parallel run loop
auto	1.9617957927965048	0.0	keep	3_tan_in_tan	Parallel run loop
auto	6.000951581169019	0.0	keep	14_4_in_tan	Parallel run loop
auto	1.732958658283716	0.0	keep	8_TAN_in_5	Parallel run loop
auto	7.829292204562744	0.0	keep	12_DOMINO_in_TAN	Parallel run loop
auto	3.630911188977506	0.0	keep	12_3_in_tan	Parallel run loop
auto	3.346384297742911	0.0	keep	10_3_in_tan	Parallel run loop
auto	6.376015494322555	0.0	keep	16_4_in_tan	Parallel run loop
auto	1.447046343723036	0.0	keep	10_tan_in_cir	Parallel run loop
auto	6.82945465711647	0.0	keep	18_4_in_tan	Parallel run loop
auto	6.953395668051402	0.0	keep	19_4_in_tan	Parallel run loop
auto	3.8895356289289125	0.0	keep	14_3_in_tan	Parallel run loop
auto	1.8139454457591047	0.0	keep	9_TAN_in_5	Parallel run loop
auto	1.3203673212301983	0.0	keep	7_TAN_in_6	Parallel run loop
auto	3.470875010729649	0.0	keep	11_3_in_tan	Parallel run loop
auto	3.176015968000912	0.0	keep	7_TAN_in_3	Parallel run loop
auto	1.2404105002372954	0.0	keep	6_TAN_in_6	Parallel run loop
auto	1.5125998112673182	0.0	keep	11_tan_in_cir	Parallel run loop
auto	2.9380946861817696	0.0	keep	6_TAN_in_3	Parallel run loop
auto	7.781580904588374	0.0	keep	24_4_in_tan	Parallel run loop
auto	1.9381847875892406	0.0	keep	6_TAN_in_4	Parallel run loop
auto	7.416821744050934	0.0	keep	11_DOMINO_in_TAN	Parallel run loop
auto	1.0952537467135883	0.0	keep	9_TAN_in_8	Parallel run loop
auto	8.420895700426637	0.0	keep	14_DOMINO_in_TAN	Parallel run loop
auto	8.981470718405928	0.0	keep	16_DOMINO_in_TAN	Parallel run loop
auto	1.4575217049470242	0.0	keep	9_TAN_in_6	Parallel run loop
auto	3.7149903410076828	0.0	keep	13_3_in_tan	Parallel run loop
auto	1.3859249957020598	0.0	keep	8_TAN_in_6	Parallel run loop
auto	3.378158541868193	0.0	keep	8_TAN_in_3	Parallel run loop
auto	7.4161184357365615	0.0	keep	22_4_in_tan	Parallel run loop
auto	3.9875332605988265	0.0	keep	15_3_in_tan	Parallel run loop
auto	2.6952092734837074	0.0	keep	6_tan_in_tan	Parallel run loop
auto	1.9173561451966628	0.0	keep	10_TAN_in_5	Parallel run loop
auto	8.051886310393924	0.0	keep	13_DOMINO_in_TAN	Parallel run loop
auto	6.419424293259695	0.0	keep	17_4_in_tan	Parallel run loop
auto	9.863712339156736	0.0	keep	20_DOMINO_in_TAN	Parallel run loop
auto	7.001550333113583	0.0	keep	20_4_in_tan	Parallel run loop
auto	4.209923157769256	0.0	keep	17_3_in_tan	Parallel run loop
auto	1.5565619679051172	0.0	keep	10_TAN_in_6	Parallel run loop
auto	4.649426124422304	0.0	keep	21_3_in_tan	Parallel run loop
auto	1.8623990360559108	0.0	keep	17_tan_in_cir	Parallel run loop
auto	7.415500454503056	0.0	keep	23_4_in_tan	Parallel run loop
auto	9.419573239705542	0.0	keep	18_DOMINO_in_TAN	Parallel run loop
auto	1.8024204131731285	0.0	keep	16_tan_in_cir	Parallel run loop
auto	1.6212188122854785	0.0	keep	11_TAN_in_6	Parallel run loop
auto	9.078929589982948	0.0	keep	17_DOMINO_in_TAN	Parallel run loop
auto	4.4742123979253705	0.0	keep	19_3_in_tan	Parallel run loop
auto	3.7734263999297917	0.0	keep	10_TAN_in_3	Parallel run loop
auto	1.9899637903876886	0.0	keep	11_TAN_in_5	Parallel run loop
auto	5.09256484200645	0.0	keep	25_3_in_tan	Parallel run loop
auto	1.5733552071681831	0.0	keep	12_tan_in_cir	Parallel run loop
auto	9.684853391971192	0.0	keep	19_DOMINO_in_TAN	Parallel run loop
auto	3.5806431076845198	0.0	keep	9_TAN_in_3	Parallel run loop
auto	4.584179503475751	0.0	keep	20_3_in_tan	Parallel run loop
auto	2.005678699631353	0.0	keep	20_tan_in_cir	Parallel run loop
auto	4.783514142875713	0.0	keep	22_3_in_tan	Parallel run loop
auto	1.2019205370895165	0.0	keep	11_TAN_in_8	Parallel run loop
auto	1.6236825684414373	0.0	keep	13_tan_in_cir	Parallel run loop
auto	1.9785069750733129	0.0	keep	19_tan_in_cir	Parallel run loop
auto	4.28753814632513	0.0	keep	18_3_in_tan	Parallel run loop
auto	1.7030773128553576	0.0	keep	12_TAN_in_6	Parallel run loop
auto	2.0852769159931155	0.0	keep	12_TAN_in_5	Parallel run loop
auto	2.1593744675828312	0.0	keep	13_TAN_in_5	Parallel run loop
auto	1.911316670450674	0.0	keep	18_tan_in_cir	Parallel run loop
auto	2.3138762734890186	0.0	keep	15_TAN_in_5	Parallel run loop
auto	8.000746278869807	0.0	keep	26_4_in_tan	Parallel run loop
auto	5.34471429791033	0.0	keep	28_3_in_tan	Parallel run loop
auto	4.881531863271899	0.0	keep	23_3_in_tan	Parallel run loop
auto	4.048185007773551	0.0	keep	16_3_in_tan	Parallel run loop
auto	2.4077404425018814	0.0	keep	5_tan_in_tan	Parallel run loop
auto	2.3947885480111375	0.0	keep	16_TAN_in_5	Parallel run loop
auto	5.131612000648393	0.0	keep	26_3_in_tan	Parallel run loop
auto	5.460602464788415	0.0	keep	29_3_in_tan	Parallel run loop
auto	1.7712833658724463	0.0	keep	15_tan_in_cir	Parallel run loop
auto	2.623612914217607	0.0	keep	19_TAN_in_5	Parallel run loop
auto	4.96019714463145	0.0	keep	24_3_in_tan	Parallel run loop
auto	1.9031907799123202	0.0	keep	15_TAN_in_6	Parallel run loop
auto	1.7609803649006393	0.0	keep	13_TAN_in_6	Parallel run loop
auto	1.9512731179755254	0.0	keep	16_TAN_in_6	Parallel run loop
auto	1.7071715795728635	0.0	keep	10_TAN_in_DOMINO	Parallel run loop
auto	1.834070125339316	0.0	keep	14_TAN_in_6	Parallel run loop
auto	1.1399533318636597	0.0	keep	10_TAN_in_8	Parallel run loop
auto	5.26602638472001	0.0	keep	27_3_in_tan	Parallel run loop
auto	2.6568597263685176	0.0	keep	20_TAN_in_5	Parallel run loop
auto	2.8282425559498208	0.0	keep	7_tan_in_tan	Parallel run loop
auto	2.2643086327268693	0.0	keep	14_TAN_in_5	Parallel run loop
auto	2.7382361094667367	0.0	keep	21_TAN_in_5	Parallel run loop
auto	4.089712656613054	0.0	keep	12_TAN_in_3	Parallel run loop
auto	2.0001054630464767	0.0	keep	7_TAN_in_4	Parallel run loop
auto	4.729939375857578	0.0	keep	16_TAN_in_3	Parallel run loop
auto	3.914521673766167	0.0	keep	11_TAN_in_3	Parallel run loop
auto	2.4719440872562815	0.0	keep	17_TAN_in_5	Parallel run loop
auto	2.1883289555481493	0.0	keep	20_TAN_in_6	Parallel run loop
auto	5.537367083951278	0.0	keep	30_3_in_tan	Parallel run loop
auto	4.26964097663499	0.0	keep	13_TAN_in_3	Parallel run loop
auto	2.814201187931104	0.0	keep	22_TAN_in_5	Parallel run loop
auto	2.5336736376583135	0.0	keep	18_TAN_in_5	Parallel run loop
auto	4.899588578872381	0.0	keep	17_TAN_in_3	Parallel run loop
auto	4.458334011739209	0.0	keep	14_TAN_in_3	Parallel run loop
auto	2.414295188613044	0.0	keep	10_TAN_in_4	Parallel run loop
auto	1.649054526430567	0.0	keep	9_TAN_in_DOMINO	Parallel run loop
auto	2.01628040959419	0.0	keep	17_TAN_in_6	Parallel run loop
auto	2.075160000325577	0.0	keep	18_TAN_in_6	Parallel run loop
auto	2.6888894750600048	0.0	keep	12_TAN_in_4	Parallel run loop
auto	5.155075876917145	0.0	keep	19_TAN_in_3	Parallel run loop
auto	2.276773938603047	0.0	keep	22_TAN_in_6	Parallel run loop
auto	5.422062025009601	0.0	keep	21_TAN_in_3	Parallel run loop
auto	5.015415187418127	0.0	keep	18_TAN_in_3	Parallel run loop
auto	1.5828993374475773	0.0	keep	20_TAN_in_8	Parallel run loop
auto	2.222275502353573	0.0	keep	21_TAN_in_6	Parallel run loop
auto	1.9692481318070767	0.0	keep	13_TAN_in_DOMINO	Parallel run loop
auto	1.5633843609845828	0.0	keep	19_TAN_in_8	Parallel run loop
auto	2.121938052340183	0.0	keep	19_TAN_in_6	Parallel run loop
auto	5.577969087627246	0.0	keep	22_TAN_in_3	Parallel run loop
auto	4.609399440798246	0.0	keep	15_TAN_in_3	Parallel run loop
auto	1.691196336795918	0.0	keep	14_tan_in_cir	Parallel run loop
auto	2.7891829814296156	0.0	keep	13_TAN_in_4	Parallel run loop
auto	1.461422753281799	0.0	keep	17_TAN_in_8	Parallel run loop
auto	1.4210166553937755	0.0	keep	16_TAN_in_8	Parallel run loop
auto	1.8147572439899666	0.0	keep	11_TAN_in_DOMINO	Parallel run loop
auto	3.3707950723257185	0.0	keep	19_TAN_in_4	Parallel run loop
auto	1.9254380971373508	0.0	keep	12_TAN_in_DOMINO	Parallel run loop
auto	2.9405515632896093	0.0	keep	15_TAN_in_4	Parallel run loop
auto	3.558809649961579	0.0	keep	21_TAN_in_4	Parallel run loop
auto	1.3544042368703513	0.0	keep	14_TAN_in_8	Parallel run loop
auto	5.321098668727586	0.0	keep	20_TAN_in_3	Parallel run loop
auto	1.2540731834550305	0.0	keep	12_TAN_in_8	Parallel run loop
auto	1.3871002366117615	0.0	keep	15_TAN_in_8	Parallel run loop
auto	2.8296413931094513	0.0	keep	14_TAN_in_4	Parallel run loop
auto	2.318007271926879	0.0	keep	9_TAN_in_4	Parallel run loop
auto	3.478620654296181	0.0	keep	20_TAN_in_4	Parallel run loop
auto	1.2824019460183362	0.0	keep	13_TAN_in_8	Parallel run loop
auto	2.021469875538346	0.0	keep	14_TAN_in_DOMINO	Parallel run loop
auto	3.40431025931176	0.0	keep	10_tan_in_tan	Parallel run loop
auto	1.4964558127228125	0.0	keep	18_TAN_in_8	Parallel run loop
auto	4.391655173899453	0.0	keep	17_tan_in_tan	Parallel run loop
auto	2.240195984105561	0.0	keep	17_TAN_in_DOMINO	Parallel run loop
auto	3.8180134545537974	0.0	keep	13_tan_in_tan	Parallel run loop
auto	2.328606577893243	0.0	keep	18_TAN_in_DOMINO	Parallel run loop
auto	3.7828135895485695	0.0	keep	24_TAN_in_4	Parallel run loop
auto	3.5838442610672088	0.0	keep	22_TAN_in_4	Parallel run loop
auto	3.9911128767254778	0.0	keep	14_tan_in_tan	Parallel run loop
auto	3.6972149989392085	0.0	keep	12_tan_in_tan	Parallel run loop
auto	2.5890379805710304	0.0	keep	11_TAN_in_4	Parallel run loop
auto	3.426053936045635	0.0	keep	11_tan_in_tan	Parallel run loop
auto	3.179706814677285	0.0	keep	17_TAN_in_4	Parallel run loop
auto	4.985924547689463	0.0	keep	21_tan_in_tan	Parallel run loop
auto	5.217906973863198	0.0	keep	23_tan_in_tan	Parallel run loop
auto	3.6695371810239257	0.0	keep	23_TAN_in_4	Parallel run loop
auto	4.80621970582685	0.0	keep	20_tan_in_tan	Parallel run loop
auto	5.062880344125998	0.0	keep	22_tan_in_tan	Parallel run loop
auto	4.71413973548647	0.0	keep	19_tan_in_tan	Parallel run loop
auto	0.9257201651728294	0.0	keep	6_TAN_in_8	Parallel run loop
auto	4.170353939963496	0.0	keep	15_tan_in_tan	Parallel run loop
auto	1.2092158227075118	0.0	discard	6_tan_in_cir	Parallel run loop
auto	0.8231177380802561	0.0	discard	4_TAN_in_8	Parallel run loop
auto	11.001245261825352	0.0	keep	17_6_in_TAN	Parallel run loop
auto	5.610107013670145	0.0	keep	27_tan_in_tan	Parallel run loop
auto	1.2710691866826518	0.0	discard	7_tan_in_cir	Parallel run loop
auto	5.531523429056904	0.0	keep	26_tan_in_tan	Parallel run loop
auto	12.362131078860386	0.0	keep	11_8_in_TAN	Parallel run loop
auto	5.32333653998721	0.0	keep	24_tan_in_tan	Parallel run loop
auto	11.313869723623139	0.0	discard	18_6_in_TAN	Parallel run loop
auto	1.6389186210024822	0.0	discard	7_TAN_in_5	Parallel run loop
