commit	score	memory_gb	status	problem	description
auto	4.852872034049425	0.0	discard	48_3_in_5	Parallel run loop
auto	2.375509675338642	0.0	discard	13_3_in_5	Parallel run loop
auto	1.7413027520048998	0.0	discard	7_3_in_5	Parallel run loop
auto	4.025070889146615	0.0	discard	25_3_in_4	Parallel run loop
auto	5.826172331048088	0.0	discard	47_3_in_4	Parallel run loop
auto	5.584845355670499	0.0	discard	44_3_in_4	Parallel run loop
auto	4.256049793076677	0.0	discard	39_3_in_5	Parallel run loop
auto	4.859642096728174	0.0	discard	50_3_in_5	Parallel run loop
auto	2.8576921888347817	0.0	discard	13_3_in_4	Parallel run loop
auto	3.867668028318115	0.0	discard	23_3_in_4	Parallel run loop
auto	4.205883684352359	0.0	discard	38_3_in_5	Parallel run loop
auto	3.488631038328258	0.0	discard	27_3_in_5	Parallel run loop
auto	5.2346441625634	0.0	discard	40_3_in_4	Parallel run loop
auto	3.7491722058255488	0.0	discard	22_3_in_4	Parallel run loop
auto	5.780524290737251	0.0	discard	46_3_in_4	Parallel run loop
auto	2.5611905079765243	0.0	discard	15_3_in_5	Parallel run loop
auto	3.690749889637259	0.0	discard	30_3_in_5	Parallel run loop
auto	4.01622747508889	0.0	discard	35_3_in_5	Parallel run loop
auto	2.4673751163738236	0.0	discard	14_3_in_5	Parallel run loop
auto	4.59732770499945	0.0	discard	45_3_in_5	Parallel run loop
auto	4.340727845398934	0.0	discard	40_3_in_5	Parallel run loop
auto	4.116769115856504	0.0	discard	26_3_in_4	Parallel run loop
auto	4.991687598488985	0.0	discard	49_3_in_5	Parallel run loop
auto	4.638711161262693	0.0	discard	44_3_in_5	Parallel run loop
auto	4.281164597069878	0.0	discard	28_3_in_4	Parallel run loop
auto	3.2856854371904998	0.0	discard	24_3_in_5	Parallel run loop
auto	4.994197301047704	0.0	discard	37_3_in_4	Parallel run loop
auto	3.8893887681622292	0.0	discard	33_3_in_5	Parallel run loop
auto	3.473748633724836	0.0	discard	19_3_in_4	Parallel run loop
auto	1.7419930363164973	0.0	discard	7_3_in_5	Parallel run loop
auto	4.747529207653735	0.0	discard	34_3_in_4	Parallel run loop
auto	4.838854163352729	0.0	discard	47_3_in_5	Parallel run loop
auto	2.978278963131453	0.0	discard	20_3_in_5	Parallel run loop
auto	4.887679370187197	0.0	discard	48_3_in_5	Parallel run loop
auto	4.65985964611341	0.0	discard	33_3_in_4	Parallel run loop
auto	4.910575378057167	0.0	discard	36_3_in_4	Parallel run loop
auto	2.8972567826059064	0.0	discard	19_3_in_5	Parallel run loop
auto	4.427588591432923	0.0	discard	42_3_in_5	Parallel run loop
auto	5.630434792843395	0.0	discard	45_3_in_4	Parallel run loop
auto	1.8629985113308525	0.0	discard	8_3_in_5	Parallel run loop
auto	3.492876056264351	0.0	discard	27_3_in_5	Parallel run loop
auto	2.858038623662593	0.0	discard	13_3_in_4	Parallel run loop
auto	5.021176429991055	0.0	discard	38_3_in_4	Parallel run loop
auto	4.319557952529596	0.0	keep	29_3_in_4	Parallel run loop
auto	5.242213627161816	0.0	discard	40_3_in_4	Parallel run loop
auto	3.743884313621529	0.0	discard	22_3_in_4	Parallel run loop
auto	5.745198138284918	0.0	discard	46_3_in_4	Parallel run loop
auto	3.690776739137758	0.0	discard	30_3_in_5	Parallel run loop
auto	5.950556431427995	0.0	discard	48_3_in_4	Parallel run loop
auto	4.016641778510792	0.0	discard	35_3_in_5	Parallel run loop
auto	4.719144191273682	0.0	discard	45_3_in_5	Parallel run loop
auto	2.4657932638833873	0.0	discard	14_3_in_5	Parallel run loop
auto	5.426242371417246	0.0	discard	42_3_in_4	Parallel run loop
auto	4.110987948805815	0.0	discard	26_3_in_4	Parallel run loop
auto	4.662203167972031	0.0	discard	44_3_in_5	Parallel run loop
auto	3.41201538504234	0.0	discard	26_3_in_5	Parallel run loop
auto	4.9847754772189905	0.0	discard	37_3_in_4	Parallel run loop
auto	5.006923261780616	0.0	discard	49_3_in_5	Parallel run loop
auto	4.275065696765906	0.0	discard	28_3_in_4	Parallel run loop
auto	3.4894059461630307	0.0	discard	19_3_in_4	Parallel run loop
auto	4.7439128607154295	0.0	discard	34_3_in_4	Parallel run loop
auto	2.3774970017877792	0.0	discard	13_3_in_5	Parallel run loop
auto	4.906013023927473	0.0	discard	48_3_in_5	Parallel run loop
auto	4.596782470705274	0.0	discard	32_3_in_4	Parallel run loop
auto	2.0821400404499335	0.0	discard	10_3_in_5	Parallel run loop
auto	4.01372723196768	0.0	discard	25_3_in_4	Parallel run loop
auto	4.41009374774525	0.0	discard	42_3_in_5	Parallel run loop
auto	2.719645491234262	0.0	discard	17_3_in_5	Parallel run loop
auto	4.8019980951147865	0.0	discard	47_3_in_5	Parallel run loop
auto	4.240844018967575	0.0	discard	39_3_in_5	Parallel run loop
auto	2.8961595146128247	0.0	discard	19_3_in_5	Parallel run loop
auto	5.614313771227863	0.0	discard	45_3_in_4	Parallel run loop
auto	2.281856885636369	0.0	discard	12_3_in_5	Parallel run loop
auto	3.388909410731896	0.0	discard	18_3_in_4	Parallel run loop
auto	4.761131129999431	0.0	discard	46_3_in_5	Parallel run loop
auto	3.7768213904903023	0.0	discard	22_3_in_4	Parallel run loop
auto	1.612334939486133	0.0	discard	6_3_in_5	Parallel run loop
auto	5.724745756334785	0.0	discard	46_3_in_4	Parallel run loop
auto	5.091838922448302	0.0	discard	38_3_in_4	Parallel run loop
auto	4.3595575545157255	0.0	discard	29_3_in_4	Parallel run loop
auto	2.5611859085138065	0.0	discard	15_3_in_5	Parallel run loop
auto	4.523484389216004	0.0	discard	31_3_in_4	Parallel run loop
auto	3.562552531125392	0.0	discard	28_3_in_5	Parallel run loop
auto	4.988973209871861	0.0	discard	37_3_in_4	Parallel run loop
auto	3.283428393847495	0.0	discard	24_3_in_5	Parallel run loop
auto	3.8202826885277203	0.0	discard	32_3_in_5	Parallel run loop
auto	4.436180469119232	0.0	discard	30_3_in_4	Parallel run loop
auto	4.1192353620494755	0.0	discard	26_3_in_4	Parallel run loop
auto	4.741805858281119	0.0	discard	34_3_in_4	Parallel run loop
auto	3.5490839146464155	0.0	keep	20_3_in_4	Parallel run loop
auto	3.1325125488255194	0.0	discard	22_3_in_5	Parallel run loop
auto	5.013859084443008	0.0	discard	49_3_in_5	Parallel run loop
auto	4.281580340080784	0.0	discard	28_3_in_4	Parallel run loop
auto	4.371146354937699	0.0	discard	41_3_in_5	Parallel run loop
auto	4.452706245379259	0.0	discard	42_3_in_5	Parallel run loop
auto	4.242208788864731	0.0	discard	39_3_in_5	Parallel run loop
auto	2.0821657739868566	0.0	discard	10_3_in_5	Parallel run loop
auto	4.915319526260801	0.0	discard	48_3_in_5	Parallel run loop
auto	4.027878391965611	0.0	discard	25_3_in_4	Parallel run loop
auto	2.722196984809452	0.0	discard	17_3_in_5	Parallel run loop
auto	4.3227548907728925	0.0	discard	40_3_in_5	Parallel run loop
auto	5.650247326835063	0.0	discard	45_3_in_4	Parallel run loop
auto	2.9751757947003186	0.0	discard	20_3_in_5	Parallel run loop
auto	4.852271430195675	0.0	discard	47_3_in_5	Parallel run loop
auto	5.770409987251236	0.0	discard	46_3_in_4	Parallel run loop
auto	2.2807652180571316	0.0	discard	12_3_in_5	Parallel run loop
auto	4.676125384035168	0.0	discard	33_3_in_4	Parallel run loop
auto	2.6429847361505066	0.0	discard	16_3_in_5	Parallel run loop
auto	5.5386748003731565	0.0	discard	44_3_in_4	Parallel run loop
auto	4.8824992748436	0.0	discard	36_3_in_4	Parallel run loop
auto	4.099064979390608	0.0	discard	37_3_in_5	Parallel run loop
auto	2.8143729152535837	0.0	discard	18_3_in_5	Parallel run loop
auto	5.302704559787133	0.0	discard	41_3_in_4	Parallel run loop
auto	1.8622714468037658	0.0	discard	8_3_in_5	Parallel run loop
auto	4.10517391924706	0.0	discard	26_3_in_4	Parallel run loop
auto	5.922907465561673	0.0	discard	48_3_in_4	Parallel run loop
auto	3.284073553961208	0.0	discard	24_3_in_5	Parallel run loop
auto	4.442679144264696	0.0	discard	30_3_in_4	Parallel run loop
auto	4.747184142888358	0.0	discard	34_3_in_4	Parallel run loop
auto	5.391716024923637	0.0	discard	42_3_in_4	Parallel run loop
auto	3.8844669468741198	0.0	discard	33_3_in_5	Parallel run loop
auto	4.2736995661558375	0.0	discard	28_3_in_4	Parallel run loop
auto	4.799719821404201	0.0	discard	35_3_in_4	Parallel run loop
auto	2.7229129563478893	0.0	discard	17_3_in_5	Parallel run loop
auto	3.578549420690257	0.0	discard	20_3_in_4	Parallel run loop
auto	3.942925958715004	0.0	discard	24_3_in_4	Parallel run loop
auto	3.4235421806863293	0.0	discard	26_3_in_5	Parallel run loop
auto	2.082085213299199	0.0	discard	10_3_in_5	Parallel run loop
auto	4.342708171152459	0.0	discard	40_3_in_5	Parallel run loop
auto	2.967842614358263	0.0	discard	20_3_in_5	Parallel run loop
auto	4.908526661733259	0.0	discard	48_3_in_5	Parallel run loop
auto	2.3743246634136597	0.0	discard	13_3_in_5	Parallel run loop
auto	4.03700471024765	0.0	discard	25_3_in_4	Parallel run loop
auto	4.289794480616933	0.0	discard	39_3_in_5	Parallel run loop
auto	4.8000180868288895	0.0	discard	47_3_in_5	Parallel run loop
auto	3.9300012975441376	0.0	discard	34_3_in_5	Parallel run loop
auto	4.919685183977322	0.0	discard	36_3_in_4	Parallel run loop
auto	2.281478544445791	0.0	discard	12_3_in_5	Parallel run loop
auto	1.741521069006973	0.0	discard	7_3_in_5	Parallel run loop
auto	5.545936142065632	0.0	discard	44_3_in_4	Parallel run loop
auto	4.588546925279157	0.0	discard	32_3_in_4	Parallel run loop
auto	1.8629257615533563	0.0	discard	8_3_in_5	Parallel run loop
auto	4.154738088032755	0.0	discard	37_3_in_5	Parallel run loop
auto	5.3140888053704	0.0	discard	41_3_in_4	Parallel run loop
auto	2.8589797906102543	0.0	discard	13_3_in_4	Parallel run loop
auto	4.7627685150915315	0.0	discard	46_3_in_5	Parallel run loop
auto	4.187242865442628	0.0	discard	38_3_in_5	Parallel run loop
auto	5.407892715406405	0.0	discard	42_3_in_4	Parallel run loop
auto	4.118246882174169	0.0	discard	26_3_in_4	Parallel run loop
auto	3.866528505297588	0.0	discard	23_3_in_4	Parallel run loop
auto	3.7540396194796632	0.0	discard	31_3_in_5	Parallel run loop
auto	4.715937762500319	0.0	discard	34_3_in_4	Parallel run loop
auto	3.376592408390671	0.0	discard	18_3_in_4	Parallel run loop
auto	4.2728722368309455	0.0	discard	28_3_in_4	Parallel run loop
auto	3.5525513716876485	0.0	discard	28_3_in_5	Parallel run loop
auto	3.9489024658258813	0.0	discard	24_3_in_4	Parallel run loop
auto	3.5746371818163793	0.0	discard	20_3_in_4	Parallel run loop
auto	3.68681159857067	0.0	discard	30_3_in_5	Parallel run loop
auto	2.556541198233966	0.0	discard	15_3_in_5	Parallel run loop
auto	2.4653777884012427	0.0	discard	14_3_in_5	Parallel run loop
auto	2.970080334262713	0.0	discard	20_3_in_5	Parallel run loop
auto	2.376767575238597	0.0	discard	13_3_in_5	Parallel run loop
auto	4.647371275545946	0.0	discard	45_3_in_5	Parallel run loop
auto	3.9380630941682733	0.0	discard	34_3_in_5	Parallel run loop
auto	4.355470407153589	0.0	discard	40_3_in_5	Parallel run loop
auto	2.082131633404919	0.0	discard	10_3_in_5	Parallel run loop
auto	1.473297719401486	0.0	discard	5_3_in_5	Parallel run loop
auto	1.6123349307050574	0.0	discard	6_3_in_5	Parallel run loop
auto	2.2812681848281997	0.0	discard	12_3_in_5	Parallel run loop
auto	4.51695806437515	0.0	discard	31_3_in_4	Parallel run loop
auto	4.0206638559084364	0.0	discard	35_3_in_5	Parallel run loop
auto	4.588379290208047	0.0	discard	32_3_in_4	Parallel run loop
auto	4.076678305473534	0.0	discard	36_3_in_5	Parallel run loop
auto	3.820084936704594	0.0	discard	32_3_in_5	Parallel run loop
auto	5.505955378054052	0.0	discard	43_3_in_4	Parallel run loop
auto	5.55544433809813	0.0	discard	44_3_in_4	Parallel run loop
auto	4.209828242224128	0.0	discard	38_3_in_5	Parallel run loop
auto	3.1374167706052183	0.0	discard	22_3_in_5	Parallel run loop
auto	4.714607200608449	0.0	discard	34_3_in_4	Parallel run loop
auto	3.4770244388344587	0.0	discard	19_3_in_4	Parallel run loop
auto	3.682546922185809	0.0	discard	21_3_in_4	Parallel run loop
auto	3.3877196313127014	0.0	discard	18_3_in_4	Parallel run loop
auto	3.562091318936975	0.0	discard	28_3_in_5	Parallel run loop
auto	2.903597755097616	0.0	discard	19_3_in_5	Parallel run loop
auto	5.244840757282829	0.0	discard	40_3_in_4	Parallel run loop
auto	4.428207637707449	0.0	discard	41_3_in_5	Parallel run loop
auto	4.631916645437032	0.0	discard	45_3_in_5	Parallel run loop
auto	4.673937079106361	0.0	discard	33_3_in_4	Parallel run loop
auto	2.081722924430403	0.0	discard	10_3_in_5	Parallel run loop
auto	2.5577375636210484	0.0	discard	15_3_in_5	Parallel run loop
auto	3.6740463807262183	0.0	discard	30_3_in_5	Parallel run loop
auto	2.467406117874032	0.0	discard	14_3_in_5	Parallel run loop
auto	3.344624823058221	0.0	discard	25_3_in_5	Parallel run loop
auto	4.283624407484106	0.0	discard	28_3_in_4	Parallel run loop
auto	2.6459522549512675	0.0	discard	16_3_in_5	Parallel run loop
auto	5.8591056881492944	0.0	discard	48_3_in_4	Parallel run loop
auto	5.053783606242882	0.0	discard	38_3_in_4	Parallel run loop
auto	2.1834531088484006	0.0	discard	11_3_in_5	Parallel run loop
auto	2.8112953498575752	0.0	discard	18_3_in_5	Parallel run loop
auto	4.344281596935547	0.0	discard	29_3_in_4	Parallel run loop
auto	3.9961949684928193	0.0	discard	35_3_in_5	Parallel run loop
auto	2.281503095431672	0.0	discard	12_3_in_5	Parallel run loop
auto	4.617984636473636	0.0	discard	44_3_in_5	Parallel run loop
auto	3.877820416184594	0.0	discard	33_3_in_5	Parallel run loop
auto	4.817550434171623	0.0	discard	35_3_in_4	Parallel run loop
auto	3.210427049086028	0.0	discard	23_3_in_5	Parallel run loop
auto	3.4235919926493437	0.0	discard	26_3_in_5	Parallel run loop
auto	1.7415208664378672	0.0	discard	7_3_in_5	Parallel run loop
auto	5.143277010851126	0.0	discard	39_3_in_4	Parallel run loop
auto	1.9746174582889962	0.0	discard	9_3_in_5	Parallel run loop
auto	4.7514447134779	0.0	discard	34_3_in_4	Parallel run loop
auto	4.777923182911854	0.0	discard	46_3_in_5	Parallel run loop
auto	2.8568016004009062	0.0	discard	13_3_in_4	Parallel run loop
auto	3.480245869467052	0.0	discard	27_3_in_5	Parallel run loop
auto	3.8528143293305144	0.0	discard	23_3_in_4	Parallel run loop
auto	3.7524935465744136	0.0	discard	31_3_in_5	Parallel run loop
auto	3.746100285587469	0.0	discard	22_3_in_4	Parallel run loop
auto	3.6218127474164694	0.0	discard	29_3_in_5	Parallel run loop
auto	3.3536477992274	0.0	discard	25_3_in_5	Parallel run loop
auto	2.5554615571573422	0.0	discard	15_3_in_5	Parallel run loop
auto	2.46722761235319	0.0	discard	14_3_in_5	Parallel run loop
auto	3.684551445384515	0.0	discard	30_3_in_5	Parallel run loop
auto	4.7026328336486	0.0	discard	45_3_in_5	Parallel run loop
auto	2.0817302869504632	0.0	discard	10_3_in_5	Parallel run loop
auto	1.6121838485531408	0.0	discard	6_3_in_5	Parallel run loop
auto	1.4721913407487142	0.0	discard	5_3_in_5	Parallel run loop
auto	4.195954821706654	0.0	discard	27_3_in_4	Parallel run loop
auto	2.1833341689501267	0.0	discard	11_3_in_5	Parallel run loop
auto	4.351938057141181	0.0	discard	29_3_in_4	Parallel run loop
auto	4.0616877413828645	0.0	discard	36_3_in_5	Parallel run loop
auto	5.926234373903951	0.0	discard	48_3_in_4	Parallel run loop
auto	4.5039198820490025	0.0	discard	31_3_in_4	Parallel run loop
auto	2.280743654273099	0.0	discard	12_3_in_5	Parallel run loop
auto	4.633284650309261	0.0	discard	44_3_in_5	Parallel run loop
auto	4.0179094473840165	0.0	discard	35_3_in_5	Parallel run loop
auto	3.814964813985842	0.0	discard	32_3_in_5	Parallel run loop
auto	4.438615903185471	0.0	discard	30_3_in_4	Parallel run loop
auto	1.741520834902992	0.0	discard	7_3_in_5	Parallel run loop
auto	5.393607788284486	0.0	discard	43_3_in_4	Parallel run loop
auto	3.6845825042983456	0.0	discard	21_3_in_4	Parallel run loop
auto	1.9752494845930977	0.0	discard	9_3_in_5	Parallel run loop
auto	5.15028140394785	0.0	discard	39_3_in_4	Parallel run loop
auto	3.7759387850982544	0.0	discard	22_3_in_4	Parallel run loop
auto	2.8592478854835415	0.0	discard	13_3_in_4	Parallel run loop
auto	3.2832783388201916	0.0	discard	24_3_in_5	Parallel run loop
auto	3.864552558796444	0.0	discard	23_3_in_4	Parallel run loop
auto	5.864177853641543	0.0	discard	47_3_in_4	Parallel run loop
auto	4.404349327525299	0.0	discard	41_3_in_5	Parallel run loop
auto	3.753120829415447	0.0	discard	31_3_in_5	Parallel run loop
auto	2.554765870801601	0.0	discard	15_3_in_5	Parallel run loop
auto	3.479737206523483	0.0	discard	27_3_in_5	Parallel run loop
auto	2.084230524954229	0.0	discard	10_3_in_5	Parallel run loop
auto	3.060056730908997	0.0	discard	21_3_in_5	Parallel run loop
auto	3.1352854634080947	0.0	discard	22_3_in_5	Parallel run loop
auto	3.6900136585431866	0.0	discard	30_3_in_5	Parallel run loop
auto	2.4676711502184463	0.0	discard	14_3_in_5	Parallel run loop
auto	1.6123349352075333	0.0	discard	6_3_in_5	Parallel run loop
auto	2.18402467390922	0.0	discard	11_3_in_5	Parallel run loop
auto	4.354877917818964	0.0	discard	29_3_in_4	Parallel run loop
auto	5.833180730341111	0.0	discard	48_3_in_4	Parallel run loop
auto	1.4723574283823386	0.0	discard	5_3_in_5	Parallel run loop
auto	3.483890023964048	0.0	discard	19_3_in_4	Parallel run loop
auto	4.50411784121742	0.0	discard	31_3_in_4	Parallel run loop
auto	5.009180673075184	0.0	discard	50_3_in_5	Parallel run loop
auto	2.2815771989645137	0.0	discard	12_3_in_5	Parallel run loop
auto	2.904912811676042	0.0	discard	19_3_in_5	Parallel run loop
auto	5.510147045733704	0.0	discard	43_3_in_4	Parallel run loop
auto	5.231028209256738	0.0	discard	40_3_in_4	Parallel run loop
auto	4.665879712161468	0.0	discard	33_3_in_4	Parallel run loop
auto	2.645238489285822	0.0	discard	16_3_in_5	Parallel run loop
auto	4.911800779055884	0.0	discard	36_3_in_4	Parallel run loop
auto	5.343125196779171	0.0	discard	41_3_in_4	Parallel run loop
auto	1.8616880020035673	0.0	discard	8_3_in_5	Parallel run loop
auto	5.66452984542008	0.0	discard	45_3_in_4	Parallel run loop
auto	2.8041945366598897	0.0	discard	18_3_in_5	Parallel run loop
auto	4.489787202223684	0.0	discard	42_3_in_5	Parallel run loop
auto	3.2727701998468697	0.0	discard	24_3_in_5	Parallel run loop
auto	4.11097736747613	0.0	discard	37_3_in_5	Parallel run loop
auto	5.076672643865842	0.0	discard	38_3_in_4	Parallel run loop
auto	2.557307070953347	0.0	discard	15_3_in_5	Parallel run loop
auto	3.8834769091486363	0.0	discard	33_3_in_5	Parallel run loop
auto	5.418426312673791	0.0	discard	42_3_in_4	Parallel run loop
auto	3.4137006100818055	0.0	discard	26_3_in_5	Parallel run loop
auto	1.47329771716793	0.0	discard	5_3_in_5	Parallel run loop
auto	1.6123349308506036	0.0	discard	6_3_in_5	Parallel run loop
auto	4.824222680782865	0.0	discard	35_3_in_4	Parallel run loop
auto	2.3756554980249662	0.0	discard	13_3_in_5	Parallel run loop
auto	3.948679175056822	0.0	discard	24_3_in_4	Parallel run loop
auto	3.690776739137758	0.0	discard	30_3_in_5	Parallel run loop
auto	3.933347540788514	0.0	discard	34_3_in_5	Parallel run loop
auto	4.578936270716615	0.0	discard	32_3_in_4	Parallel run loop
auto	5.8377930323044644	0.0	discard	48_3_in_4	Parallel run loop
auto	4.0256528571951025	0.0	discard	25_3_in_4	Parallel run loop
auto	3.201148831490672	0.0	discard	23_3_in_5	Parallel run loop
auto	4.509841399424309	0.0	discard	31_3_in_4	Parallel run loop
auto	2.7188864173406553	0.0	discard	17_3_in_5	Parallel run loop
auto	2.905637516448375	0.0	discard	19_3_in_5	Parallel run loop
auto	4.275169600037679	0.0	discard	39_3_in_5	Parallel run loop
auto	4.799133972017094	0.0	discard	46_3_in_5	Parallel run loop
auto	4.674248399981433	0.0	discard	33_3_in_4	Parallel run loop
auto	4.918305164102589	0.0	discard	36_3_in_4	Parallel run loop
auto	3.6279922050946336	0.0	discard	29_3_in_5	Parallel run loop
auto	1.8622726771496108	0.0	discard	8_3_in_5	Parallel run loop
auto	4.19754337139984	0.0	discard	38_3_in_5	Parallel run loop
auto	5.484972884636443	0.0	keep	45_3_in_4	Parallel run loop
auto	4.199292249885746	0.0	discard	27_3_in_4	Parallel run loop
auto	5.081476676876344	0.0	discard	38_3_in_4	Parallel run loop
auto	3.3861964557133275	0.0	discard	18_3_in_4	Parallel run loop
auto	3.5588198943186877	0.0	discard	28_3_in_5	Parallel run loop
auto	4.504087871818774	0.0	discard	42_3_in_5	Parallel run loop
auto	3.283878297675579	0.0	discard	24_3_in_5	Parallel run loop
auto	3.4176610299114967	0.0	discard	26_3_in_5	Parallel run loop
auto	1.6127718246940652	0.0	discard	6_3_in_5	Parallel run loop
auto	4.078055777862013	0.0	discard	36_3_in_5	Parallel run loop
auto	4.796869828989566	0.0	discard	35_3_in_4	Parallel run loop
auto	5.423942402012171	0.0	discard	42_3_in_4	Parallel run loop
auto	1.473123276548621	0.0	discard	5_3_in_5	Parallel run loop
auto	3.8139700665184875	0.0	discard	32_3_in_5	Parallel run loop
auto	4.435152389371065	0.0	discard	30_3_in_4	Parallel run loop
auto	4.588048863177004	0.0	discard	32_3_in_4	Parallel run loop
auto	4.967655375018358	0.0	discard	37_3_in_4	Parallel run loop
auto	5.815088049223805	0.0	discard	48_3_in_4	Parallel run loop
auto	3.6746084269421937	0.0	discard	21_3_in_4	Parallel run loop
auto	3.9389067753874816	0.0	discard	34_3_in_5	Parallel run loop
auto	3.2101496702470844	0.0	discard	23_3_in_5	Parallel run loop
auto	4.940735949778982	0.0	discard	49_3_in_5	Parallel run loop
auto	4.506128838622367	0.0	discard	31_3_in_4	Parallel run loop
auto	2.7251743020710006	0.0	discard	17_3_in_5	Parallel run loop
auto	4.773478413835224	0.0	discard	46_3_in_5	Parallel run loop
auto	4.4294758905232285	0.0	discard	41_3_in_5	Parallel run loop
auto	4.35441655961971	0.0	discard	40_3_in_5	Parallel run loop
auto	5.794113313948808	0.0	discard	47_3_in_4	Parallel run loop
auto	3.1404950504201876	0.0	discard	22_3_in_5	Parallel run loop
auto	4.215468173515719	0.0	discard	38_3_in_5	Parallel run loop
auto	2.9848068664171636	0.0	discard	20_3_in_5	Parallel run loop
auto	5.66452984542008	0.0	discard	45_3_in_4	Parallel run loop
auto	1.861828498641528	0.0	discard	8_3_in_5	Parallel run loop
auto	3.0649488031245946	0.0	discard	21_3_in_5	Parallel run loop
auto	3.371379023164665	0.0	discard	18_3_in_4	Parallel run loop
auto	3.5629578739264396	0.0	discard	28_3_in_5	Parallel run loop
auto	3.487337283936383	0.0	discard	19_3_in_4	Parallel run loop
auto	5.508739621895675	0.0	discard	44_3_in_4	Parallel run loop
auto	5.0526422123354955	0.0	discard	50_3_in_5	Parallel run loop
auto	5.414842593548908	0.0	discard	42_3_in_4	Parallel run loop
auto	4.834071171541336	0.0	discard	35_3_in_4	Parallel run loop
auto	5.263283051516556	0.0	discard	40_3_in_4	Parallel run loop
auto	2.6438298335372394	0.0	discard	16_3_in_5	Parallel run loop
