commit	score	memory_gb	status	problem	description
auto	3.859989914178085	0.0	discard	23_3_in_4	Parallel run loop
auto	2.2809171867592135	0.0	discard	12_3_in_5	Parallel run loop
auto	3.6811655372379595	0.0	discard	30_3_in_5	Parallel run loop
auto	3.7425696669071873	0.0	discard	31_3_in_5	Parallel run loop
auto	3.6234856064276286	0.0	discard	29_3_in_5	Parallel run loop
auto	4.177809837456734	0.0	discard	38_3_in_5	Parallel run loop
auto	4.202689194389921	0.0	discard	27_3_in_4	Parallel run loop
auto	4.440409463776088	0.0	discard	30_3_in_4	Parallel run loop
auto	3.388698347619757	0.0	discard	18_3_in_4	Parallel run loop
auto	2.5593365246366573	0.0	discard	15_3_in_5	Parallel run loop
auto	3.560680103373791	0.0	discard	28_3_in_5	Parallel run loop
auto	5.674564119611208	0.0	discard	45_3_in_4	Parallel run loop
auto	4.093088661067221	0.0	discard	36_3_in_5	Parallel run loop
auto	4.286756943249005	0.0	discard	28_3_in_4	Parallel run loop
auto	4.5220566324298375	0.0	discard	31_3_in_4	Parallel run loop
auto	4.033238239691809	0.0	discard	25_3_in_4	Parallel run loop
auto	3.113399046068886	0.0	discard	22_3_in_5	Parallel run loop
auto	3.8264205379241463	0.0	discard	32_3_in_5	Parallel run loop
auto	3.658544912142078	0.0	discard	21_3_in_4	Parallel run loop
auto	4.762994623578979	0.0	discard	34_3_in_4	Parallel run loop
auto	3.050695312501774	0.0	discard	21_3_in_5	Parallel run loop
auto	4.425709645578415	0.0	discard	41_3_in_5	Parallel run loop
auto	3.4754849171033264	0.0	discard	19_3_in_4	Parallel run loop
auto	2.884390323736563	0.0	discard	19_3_in_5	Parallel run loop
auto	2.73608042183696	0.0	discard	17_3_in_5	Parallel run loop
auto	5.190022751715162	0.0	discard	40_3_in_4	Parallel run loop
auto	4.118203440138151	0.0	discard	26_3_in_4	Parallel run loop
auto	5.087667181107133	0.0	discard	50_3_in_5	Parallel run loop
auto	5.515484200126924	0.0	discard	44_3_in_4	Parallel run loop
auto	4.808490496956055	0.0	discard	35_3_in_4	Parallel run loop
auto	5.785517877120283	0.0	discard	46_3_in_4	Parallel run loop
auto	2.8192938244737284	0.0	discard	18_3_in_5	Parallel run loop
auto	4.483159865696016	0.0	discard	42_3_in_5	Parallel run loop
auto	3.356161557253298	0.0	discard	25_3_in_5	Parallel run loop
auto	3.7463710672172996	0.0	discard	31_3_in_5	Parallel run loop
auto	3.680041559842427	0.0	discard	30_3_in_5	Parallel run loop
auto	4.4775173887288675	0.0	discard	43_3_in_5	Parallel run loop
auto	4.165093463444451	0.0	discard	38_3_in_5	Parallel run loop
auto	4.435422010710749	0.0	discard	30_3_in_4	Parallel run loop
auto	4.201404803788363	0.0	discard	27_3_in_4	Parallel run loop
auto	5.900593354068861	0.0	discard	48_3_in_4	Parallel run loop
auto	5.43919166921472	0.0	discard	42_3_in_4	Parallel run loop
auto	4.360961880608149	0.0	discard	29_3_in_4	Parallel run loop
auto	3.8832465351687873	0.0	discard	33_3_in_5	Parallel run loop
auto	3.426401613047769	0.0	discard	26_3_in_5	Parallel run loop
auto	4.877386760747978	0.0	discard	47_3_in_5	Parallel run loop
auto	3.6857580273282204	0.0	discard	21_3_in_4	Parallel run loop
auto	2.0817136347178073	0.0	discard	10_3_in_5	Parallel run loop
auto	4.005457607521188	0.0	discard	25_3_in_4	Parallel run loop
auto	2.37690915069459	0.0	discard	13_3_in_5	Parallel run loop
auto	2.8820960907738122	0.0	discard	19_3_in_5	Parallel run loop
auto	5.1489070024842984	0.0	discard	39_3_in_4	Parallel run loop
auto	3.13785434085881	0.0	discard	22_3_in_5	Parallel run loop
auto	4.288863290939708	0.0	discard	39_3_in_5	Parallel run loop
auto	2.2806293094785692	0.0	discard	12_3_in_5	Parallel run loop
auto	4.597796327739546	0.0	discard	32_3_in_4	Parallel run loop
auto	3.0613095078165395	0.0	discard	21_3_in_5	Parallel run loop
auto	1.9752525107629868	0.0	discard	9_3_in_5	Parallel run loop
auto	5.770409987251236	0.0	discard	46_3_in_4	Parallel run loop
auto	2.856026923525032	0.0	discard	13_3_in_4	Parallel run loop
auto	5.218258301957283	0.0	discard	40_3_in_4	Parallel run loop
auto	3.773927372665473	0.0	discard	22_3_in_4	Parallel run loop
auto	3.855946025721914	0.0	discard	23_3_in_4	Parallel run loop
auto	2.8152308273941524	0.0	discard	18_3_in_5	Parallel run loop
auto	3.494173476242961	0.0	discard	27_3_in_5	Parallel run loop
auto	3.68170020721978	0.0	discard	30_3_in_5	Parallel run loop
auto	3.3809834762316138	0.0	discard	18_3_in_4	Parallel run loop
auto	4.52682617094661	0.0	discard	43_3_in_5	Parallel run loop
auto	2.5567596604596408	0.0	discard	15_3_in_5	Parallel run loop
auto	4.170603023283181	0.0	discard	38_3_in_5	Parallel run loop
auto	4.719144191273682	0.0	discard	45_3_in_5	Parallel run loop
auto	1.6127718293591276	0.0	discard	6_3_in_5	Parallel run loop
auto	1.4735922210559393	0.0	discard	5_3_in_5	Parallel run loop
auto	3.562242090192701	0.0	discard	28_3_in_5	Parallel run loop
auto	5.943418243793153	0.0	discard	48_3_in_4	Parallel run loop
auto	4.522279654880295	0.0	discard	31_3_in_4	Parallel run loop
auto	4.874620567782788	0.0	discard	47_3_in_5	Parallel run loop
auto	2.0821191763262616	0.0	discard	10_3_in_5	Parallel run loop
auto	3.4231154796918055	0.0	discard	26_3_in_5	Parallel run loop
auto	4.283536603512572	0.0	discard	28_3_in_4	Parallel run loop
auto	2.376273288581493	0.0	discard	13_3_in_5	Parallel run loop
auto	4.036824241290077	0.0	discard	25_3_in_4	Parallel run loop
auto	5.155140930171531	0.0	discard	39_3_in_4	Parallel run loop
auto	4.218833386173672	0.0	discard	39_3_in_5	Parallel run loop
auto	4.0454494540135375	0.0	discard	36_3_in_5	Parallel run loop
auto	5.794978717846507	0.0	discard	46_3_in_4	Parallel run loop
auto	2.8799543401224583	0.0	discard	19_3_in_5	Parallel run loop
auto	1.9746539618013366	0.0	discard	9_3_in_5	Parallel run loop
auto	3.8244305310037667	0.0	discard	32_3_in_5	Parallel run loop
auto	2.2824460530988535	0.0	discard	12_3_in_5	Parallel run loop
auto	5.005803815812155	0.0	discard	37_3_in_4	Parallel run loop
auto	2.8591528540976223	0.0	discard	13_3_in_4	Parallel run loop
auto	5.234023577097955	0.0	discard	40_3_in_4	Parallel run loop
auto	5.733809856613445	0.0	discard	47_3_in_4	Parallel run loop
auto	3.2813236514373822	0.0	discard	24_3_in_5	Parallel run loop
auto	3.4916116226948732	0.0	discard	27_3_in_5	Parallel run loop
auto	2.8138283275014815	0.0	discard	18_3_in_5	Parallel run loop
auto	2.5546702459905575	0.0	discard	15_3_in_5	Parallel run loop
auto	4.738213083436626	0.0	discard	34_3_in_4	Parallel run loop
auto	2.9628179511816364	0.0	discard	20_3_in_5	Parallel run loop
auto	4.369417973554069	0.0	discard	41_3_in_5	Parallel run loop
auto	4.16126700214779	0.0	discard	38_3_in_5	Parallel run loop
auto	3.49550607607412	0.0	discard	19_3_in_4	Parallel run loop
auto	5.109319071919103	0.0	discard	50_3_in_5	Parallel run loop
auto	1.4717129001451648	0.0	keep	5_3_in_5	Parallel run loop
auto	5.587114090265403	0.0	discard	44_3_in_4	Parallel run loop
auto	4.927011729011038	0.0	discard	36_3_in_4	Parallel run loop
auto	2.6487614439991845	0.0	discard	16_3_in_5	Parallel run loop
auto	3.4278246248235735	0.0	discard	26_3_in_5	Parallel run loop
auto	4.121637036983122	0.0	discard	26_3_in_4	Parallel run loop
auto	2.0842267745627567	0.0	discard	10_3_in_5	Parallel run loop
auto	5.329338047953247	0.0	discard	41_3_in_4	Parallel run loop
auto	2.184947621618556	0.0	discard	11_3_in_5	Parallel run loop
auto	4.0179012477135805	0.0	discard	25_3_in_4	Parallel run loop
auto	5.164060168532245	0.0	discard	39_3_in_4	Parallel run loop
auto	4.287772957933017	0.0	discard	39_3_in_5	Parallel run loop
auto	4.090677512155585	0.0	discard	36_3_in_5	Parallel run loop
auto	1.9759470706144677	0.0	discard	9_3_in_5	Parallel run loop
auto	2.9053262455369238	0.0	discard	19_3_in_5	Parallel run loop
auto	4.419551931621841	0.0	discard	42_3_in_5	Parallel run loop
auto	3.357471327244867	0.0	discard	25_3_in_5	Parallel run loop
auto	3.487268621403462	0.0	discard	27_3_in_5	Parallel run loop
auto	1.861823767540449	0.0	discard	8_3_in_5	Parallel run loop
auto	3.280700878051728	0.0	discard	24_3_in_5	Parallel run loop
auto	3.80970066395345	0.0	discard	32_3_in_5	Parallel run loop
auto	4.365518120619438	0.0	discard	29_3_in_4	Parallel run loop
auto	5.686825250886641	0.0	discard	47_3_in_4	Parallel run loop
auto	2.808654251079366	0.0	discard	18_3_in_5	Parallel run loop
auto	2.5519078238899136	0.0	discard	15_3_in_5	Parallel run loop
auto	5.264881744860238	0.0	discard	40_3_in_4	Parallel run loop
auto	2.9673213962533382	0.0	discard	20_3_in_5	Parallel run loop
auto	4.587411707091533	0.0	discard	44_3_in_5	Parallel run loop
auto	4.376455768295102	0.0	discard	41_3_in_5	Parallel run loop
auto	4.180721991905948	0.0	discard	38_3_in_5	Parallel run loop
auto	5.402864548101916	0.0	discard	42_3_in_4	Parallel run loop
auto	3.865595398751122	0.0	keep	33_3_in_5	Parallel run loop
auto	5.591723393651105	0.0	discard	44_3_in_4	Parallel run loop
auto	1.47269465694929	0.0	discard	5_3_in_5	Parallel run loop
auto	3.953806598759891	0.0	discard	24_3_in_4	Parallel run loop
auto	4.918009466585688	0.0	discard	48_3_in_5	Parallel run loop
auto	3.9520757209567576	0.0	discard	34_3_in_5	Parallel run loop
auto	4.573707287360491	0.0	discard	32_3_in_4	Parallel run loop
auto	2.7287744728621948	0.0	discard	17_3_in_5	Parallel run loop
auto	4.811827524619835	0.0	discard	46_3_in_5	Parallel run loop
auto	3.775567179419303	0.0	discard	22_3_in_4	Parallel run loop
auto	3.864677622862386	0.0	discard	23_3_in_4	Parallel run loop
auto	4.200529166048739	0.0	discard	27_3_in_4	Parallel run loop
auto	3.7418802191398877	0.0	discard	31_3_in_5	Parallel run loop
auto	3.62441788100205	0.0	discard	29_3_in_5	Parallel run loop
auto	3.3842539808464	0.0	discard	18_3_in_4	Parallel run loop
auto	5.854406961913515	0.0	discard	47_3_in_4	Parallel run loop
auto	4.49481506307134	0.0	discard	42_3_in_5	Parallel run loop
auto	1.861825941697874	0.0	discard	8_3_in_5	Parallel run loop
auto	3.5617983911405657	0.0	discard	28_3_in_5	Parallel run loop
auto	3.4805236554652996	0.0	discard	27_3_in_5	Parallel run loop
auto	4.6404205401111875	0.0	discard	45_3_in_5	Parallel run loop
auto	1.6123349280298875	0.0	discard	6_3_in_5	Parallel run loop
auto	2.8039481375109685	0.0	discard	18_3_in_5	Parallel run loop
auto	2.553810840052969	0.0	discard	15_3_in_5	Parallel run loop
auto	4.974292257029335	0.0	discard	37_3_in_4	Parallel run loop
auto	4.518768207080099	0.0	discard	31_3_in_4	Parallel run loop
auto	4.5329813813165405	0.0	discard	44_3_in_5	Parallel run loop
auto	4.278908925100916	0.0	discard	28_3_in_4	Parallel run loop
auto	2.9734422337527393	0.0	discard	20_3_in_5	Parallel run loop
auto	4.324682411788783	0.0	discard	41_3_in_5	Parallel run loop
auto	3.6575290101903977	0.0	discard	21_3_in_4	Parallel run loop
auto	4.755613952749212	0.0	discard	34_3_in_4	Parallel run loop
auto	3.886547906995229	0.0	discard	33_3_in_5	Parallel run loop
auto	5.551582039501394	0.0	discard	44_3_in_4	Parallel run loop
auto	4.3620227855576355	0.0	discard	40_3_in_5	Parallel run loop
auto	3.0603393471748	0.0	discard	21_3_in_5	Parallel run loop
auto	3.4918344564701527	0.0	discard	19_3_in_4	Parallel run loop
auto	3.136155328671971	0.0	discard	22_3_in_5	Parallel run loop
auto	4.593747444168572	0.0	discard	32_3_in_4	Parallel run loop
auto	2.7332144670576968	0.0	discard	17_3_in_5	Parallel run loop
auto	3.7532194391925446	0.0	discard	31_3_in_5	Parallel run loop
auto	3.7486275963959423	0.0	discard	22_3_in_4	Parallel run loop
auto	5.057756273265343	0.0	discard	50_3_in_5	Parallel run loop
auto	4.863494558936461	0.0	discard	36_3_in_4	Parallel run loop
auto	3.8646182180251456	0.0	discard	23_3_in_4	Parallel run loop
auto	3.6131794177935577	0.0	discard	29_3_in_5	Parallel run loop
auto	3.3864083561689378	0.0	discard	18_3_in_4	Parallel run loop
auto	4.654380840469517	0.0	discard	33_3_in_4	Parallel run loop
auto	1.861828972978574	0.0	discard	8_3_in_5	Parallel run loop
auto	2.634098174048226	0.0	keep	16_3_in_5	Parallel run loop
auto	4.719144191273682	0.0	discard	45_3_in_5	Parallel run loop
auto	3.493318648586367	0.0	discard	27_3_in_5	Parallel run loop
auto	1.6123349369250526	0.0	discard	6_3_in_5	Parallel run loop
auto	4.271724970168201	0.0	discard	28_3_in_4	Parallel run loop
auto	5.316307948694974	0.0	discard	41_3_in_4	Parallel run loop
auto	2.1837644688884	0.0	discard	11_3_in_5	Parallel run loop
auto	2.820655015497316	0.0	discard	18_3_in_5	Parallel run loop
auto	2.5571254644706527	0.0	discard	15_3_in_5	Parallel run loop
auto	4.1031681125153066	0.0	discard	26_3_in_4	Parallel run loop
auto	4.558499360231863	0.0	discard	44_3_in_5	Parallel run loop
auto	3.6515860978764842	0.0	discard	21_3_in_4	Parallel run loop
auto	2.966826265708764	0.0	discard	20_3_in_5	Parallel run loop
auto	4.338399044790816	0.0	discard	41_3_in_5	Parallel run loop
auto	5.0985756167519725	0.0	discard	38_3_in_4	Parallel run loop
auto	3.3592503846702577	0.0	discard	25_3_in_5	Parallel run loop
auto	5.616279363943449	0.0	discard	44_3_in_4	Parallel run loop
auto	4.573434105529997	0.0	discard	43_3_in_5	Parallel run loop
auto	4.36486087557988	0.0	discard	29_3_in_4	Parallel run loop
auto	5.9807153129879	0.0	discard	48_3_in_4	Parallel run loop
auto	4.162585469417552	0.0	discard	37_3_in_5	Parallel run loop
auto	5.437498628146641	0.0	discard	42_3_in_4	Parallel run loop
auto	2.7326165740973596	0.0	discard	17_3_in_5	Parallel run loop
auto	3.764674929939151	0.0	discard	31_3_in_5	Parallel run loop
auto	4.7073426341293025	0.0	keep	48_3_in_5	Parallel run loop
auto	4.885650086569071	0.0	discard	47_3_in_5	Parallel run loop
auto	3.616928515921785	0.0	discard	29_3_in_5	Parallel run loop
auto	3.9310422523658213	0.0	discard	24_3_in_4	Parallel run loop
auto	3.3785615992535853	0.0	discard	18_3_in_4	Parallel run loop
auto	4.90600046296649	0.0	discard	36_3_in_4	Parallel run loop
auto	1.8622719238928478	0.0	discard	8_3_in_5	Parallel run loop
auto	3.492614333617319	0.0	discard	27_3_in_5	Parallel run loop
auto	2.3756712679500747	0.0	discard	13_3_in_5	Parallel run loop
auto	4.68231744747177	0.0	discard	33_3_in_4	Parallel run loop
auto	2.6499263635553736	0.0	discard	16_3_in_5	Parallel run loop
auto	2.1836343129803497	0.0	discard	11_3_in_5	Parallel run loop
auto	3.925187847513056	0.0	discard	34_3_in_5	Parallel run loop
auto	4.272937685640725	0.0	discard	28_3_in_4	Parallel run loop
auto	3.188030802395929	0.0	discard	23_3_in_5	Parallel run loop
auto	1.741303227130731	0.0	discard	7_3_in_5	Parallel run loop
auto	2.282280341288021	0.0	discard	12_3_in_5	Parallel run loop
auto	4.10767796136786	0.0	discard	26_3_in_4	Parallel run loop
auto	4.560283708147031	0.0	discard	44_3_in_5	Parallel run loop
auto	3.670119118349446	0.0	discard	21_3_in_4	Parallel run loop
auto	4.375720014356748	0.0	discard	41_3_in_5	Parallel run loop
auto	2.9594040164269133	0.0	discard	20_3_in_5	Parallel run loop
auto	4.748783669585152	0.0	discard	46_3_in_5	Parallel run loop
auto	2.8601171046189573	0.0	discard	13_3_in_4	Parallel run loop
auto	4.2066433663020915	0.0	discard	27_3_in_4	Parallel run loop
auto	2.469522564608896	0.0	discard	14_3_in_5	Parallel run loop
auto	3.561726913652314	0.0	discard	28_3_in_5	Parallel run loop
auto	4.021945284824138	0.0	discard	35_3_in_5	Parallel run loop
auto	4.5231937792359584	0.0	discard	31_3_in_4	Parallel run loop
auto	4.060180568074642	0.0	discard	36_3_in_5	Parallel run loop
auto	3.8056844752647203	0.0	discard	32_3_in_5	Parallel run loop
auto	2.735509380638831	0.0	discard	17_3_in_5	Parallel run loop
auto	4.902352962798866	0.0	discard	48_3_in_5	Parallel run loop
auto	4.437787821680842	0.0	discard	30_3_in_4	Parallel run loop
auto	3.9344241907719293	0.0	discard	24_3_in_4	Parallel run loop
auto	3.390991873781748	0.0	discard	18_3_in_4	Parallel run loop
auto	3.630153259825549	0.0	discard	29_3_in_5	Parallel run loop
auto	4.978928733240983	0.0	discard	37_3_in_4	Parallel run loop
auto	2.3759882649088477	0.0	discard	13_3_in_5	Parallel run loop
auto	3.280683450027345	0.0	discard	24_3_in_5	Parallel run loop
auto	5.458747514057588	0.0	discard	43_3_in_4	Parallel run loop
auto	4.709702141530612	0.0	discard	34_3_in_4	Parallel run loop
auto	3.938270942072467	0.0	discard	34_3_in_5	Parallel run loop
auto	3.1971573441007783	0.0	discard	23_3_in_5	Parallel run loop
auto	5.033097251641922	0.0	discard	49_3_in_5	Parallel run loop
auto	2.1840692581422543	0.0	discard	11_3_in_5	Parallel run loop
auto	1.7415209789035757	0.0	discard	7_3_in_5	Parallel run loop
auto	4.2757539062895455	0.0	discard	28_3_in_4	Parallel run loop
auto	4.557103417104571	0.0	discard	44_3_in_5	Parallel run loop
auto	4.114130114499267	0.0	discard	26_3_in_4	Parallel run loop
auto	3.1234732622743007	0.0	discard	22_3_in_5	Parallel run loop
auto	4.340727845398934	0.0	discard	40_3_in_5	Parallel run loop
auto	3.038266522363673	0.0	discard	21_3_in_5	Parallel run loop
auto	2.9641076983748214	0.0	discard	20_3_in_5	Parallel run loop
auto	5.080762807461953	0.0	discard	50_3_in_5	Parallel run loop
auto	3.464210007214826	0.0	discard	19_3_in_4	Parallel run loop
auto	4.764865590095546	0.0	discard	46_3_in_5	Parallel run loop
auto	5.710268529417662	0.0	discard	45_3_in_4	Parallel run loop
auto	3.3586056170514293	0.0	discard	25_3_in_5	Parallel run loop
auto	5.360837181901137	0.0	discard	41_3_in_4	Parallel run loop
auto	4.557058241448855	0.0	discard	42_3_in_5	Parallel run loop
auto	4.079956994876601	0.0	discard	36_3_in_5	Parallel run loop
auto	2.7360152773316506	0.0	discard	17_3_in_5	Parallel run loop
auto	3.8234923184225993	0.0	discard	32_3_in_5	Parallel run loop
auto	5.023313614919641	0.0	discard	38_3_in_4	Parallel run loop
auto	4.36579007190773	0.0	discard	29_3_in_4	Parallel run loop
auto	4.43867943792102	0.0	discard	30_3_in_4	Parallel run loop
auto	4.58388874156798	0.0	discard	43_3_in_5	Parallel run loop
auto	5.861871605978339	0.0	discard	48_3_in_4	Parallel run loop
auto	5.014169378273553	0.0	discard	37_3_in_4	Parallel run loop
auto	3.288869644434085	0.0	discard	24_3_in_5	Parallel run loop
auto	2.377340995189756	0.0	discard	13_3_in_5	Parallel run loop
auto	5.467875282300267	0.0	discard	43_3_in_4	Parallel run loop
auto	3.1978341498918272	0.0	discard	23_3_in_5	Parallel run loop
auto	4.152091264647593	0.0	discard	37_3_in_5	Parallel run loop
auto	4.760089981325877	0.0	discard	34_3_in_4	Parallel run loop
auto	4.2724064268952615	0.0	discard	28_3_in_4	Parallel run loop
auto	5.29638124892489	0.0	discard	42_3_in_4	Parallel run loop
auto	2.18402887614876	0.0	discard	11_3_in_5	Parallel run loop
auto	3.8682126562680414	0.0	discard	33_3_in_5	Parallel run loop
auto	4.786802335177402	0.0	discard	47_3_in_5	Parallel run loop
auto	4.622926771052484	0.0	discard	44_3_in_5	Parallel run loop
auto	4.112972023852724	0.0	discard	26_3_in_4	Parallel run loop
auto	3.1183292893820473	0.0	discard	22_3_in_5	Parallel run loop
auto	3.0422271975620383	0.0	discard	21_3_in_5	Parallel run loop
auto	2.968016188678792	0.0	discard	20_3_in_5	Parallel run loop
auto	3.428644913293959	0.0	discard	26_3_in_5	Parallel run loop
auto	5.077367152530817	0.0	discard	50_3_in_5	Parallel run loop
auto	3.4969417222755648	0.0	discard	19_3_in_4	Parallel run loop
auto	2.082604027347345	0.0	discard	10_3_in_5	Parallel run loop
auto	4.799695279326109	0.0	discard	35_3_in_4	Parallel run loop
auto	5.1724773505235815	0.0	discard	39_3_in_4	Parallel run loop
auto	4.563907803839641	0.0	discard	32_3_in_4	Parallel run loop
auto	4.082101223063133	0.0	discard	36_3_in_5	Parallel run loop
auto	5.109477813550126	0.0	discard	38_3_in_4	Parallel run loop
auto	3.8294236941646744	0.0	discard	32_3_in_5	Parallel run loop
auto	1.9752713218118536	0.0	discard	9_3_in_5	Parallel run loop
auto	4.287941432631569	0.0	discard	39_3_in_5	Parallel run loop
auto	2.281898761319993	0.0	discard	12_3_in_5	Parallel run loop
auto	2.8587730493574277	0.0	discard	13_3_in_4	Parallel run loop
auto	4.59888628944443	0.0	discard	43_3_in_5	Parallel run loop
auto	3.2887639751074267	0.0	discard	24_3_in_5	Parallel run loop
auto	6.000951478575948	0.0	discard	48_3_in_4	Parallel run loop
auto	3.755219784270887	0.0	discard	22_3_in_4	Parallel run loop
auto	3.2156554953287975	0.0	discard	23_3_in_5	Parallel run loop
auto	3.8602770359592555	0.0	discard	23_3_in_4	Parallel run loop
auto	5.4200082076029314	0.0	discard	43_3_in_4	Parallel run loop
auto	4.251144311720912	0.0	keep	28_3_in_4	Parallel run loop
auto	4.757797006016469	0.0	discard	34_3_in_4	Parallel run loop
auto	4.188208397748359	0.0	discard	27_3_in_4	Parallel run loop
auto	5.391322313924155	0.0	discard	42_3_in_4	Parallel run loop
auto	3.871279279260062	0.0	discard	33_3_in_5	Parallel run loop
auto	2.185363052085862	0.0	discard	11_3_in_5	Parallel run loop
auto	4.674215492351177	0.0	keep	47_3_in_5	Parallel run loop
auto	3.6744523652624346	0.0	discard	30_3_in_5	Parallel run loop
auto	4.096592021224079	0.0	discard	26_3_in_4	Parallel run loop
auto	2.958184852335429	0.0	discard	20_3_in_5	Parallel run loop
auto	3.0415259676756707	0.0	discard	21_3_in_5	Parallel run loop
auto	4.848771146923646	0.0	discard	35_3_in_4	Parallel run loop
auto	5.087667181107133	0.0	discard	50_3_in_5	Parallel run loop
auto	3.5525837515059204	0.0	discard	28_3_in_5	Parallel run loop
auto	4.717003416511636	0.0	discard	45_3_in_5	Parallel run loop
auto	2.4719492090355386	0.0	discard	14_3_in_5	Parallel run loop
auto	1.6123349430672458	0.0	discard	6_3_in_5	Parallel run loop
auto	4.602575070486316	0.0	discard	32_3_in_4	Parallel run loop
auto	5.19265668672453	0.0	discard	39_3_in_4	Parallel run loop
auto	1.4735927140889922	0.0	discard	5_3_in_5	Parallel run loop
auto	1.9760419683375041	0.0	discard	9_3_in_5	Parallel run loop
auto	4.523903124917237	0.0	discard	31_3_in_4	Parallel run loop
auto	4.314028885611799	0.0	discard	39_3_in_5	Parallel run loop
auto	2.861461981578492	0.0	discard	13_3_in_4	Parallel run loop
auto	4.030620355381424	0.0	discard	35_3_in_5	Parallel run loop
auto	5.065435442906843	0.0	discard	49_3_in_5	Parallel run loop
auto	4.3666181256228285	0.0	discard	40_3_in_5	Parallel run loop
auto	5.881181782761836	0.0	discard	47_3_in_4	Parallel run loop
auto	3.746429033323957	0.0	discard	22_3_in_4	Parallel run loop
auto	5.272655906623705	0.0	discard	40_3_in_4	Parallel run loop
auto	5.542073525238048	0.0	discard	43_3_in_4	Parallel run loop
auto	4.88659946651919	0.0	discard	36_3_in_4	Parallel run loop
